kernels/outputdata/convolution/variable_clock_size-4096/no_observers/convolution_NVIDIA_RTX_A4000_noisetest_backend-CUDA_CUDA-11.2_cache.json
{
"device_name": "NVIDIA RTX A4000",
"kernel_name": "convolution_kernel",
"problem_size": [
4096,
4096
],
"tune_params_keys": [
"block_size_x",
"block_size_y",
"tile_size_x",
"tile_size_y",
"read_only",
"use_padding",
"REPEAT"
],
"tune_params": {
"block_size_x": [
64
],
"block_size_y": [
2
],
"tile_size_x": [
1
],
"tile_size_y": [
4
],
"read_only": [
1
],
"use_padding": [
0
],
"REPEAT": [
0,
1,
2,
3,
4,
5,
6,
7,
8,
9,
10,
11,
12,
13,
14,
15,
16,
17,
18,
19,
20,
21,
22,
23,
24,
25,
26,
27,
28,
29,
30,
31,
32,
33,
34,
35,
36,
37,
38,
39,
40,
41,
42,
43,
44,
45,
46,
47,
48,
49,
50,
51,
52,
53,
54,
55,
56,
57,
58,
59,
60,
61,
62,
63,
64,
65,
66,
67,
68,
69,
70,
71,
72,
73,
74,
75,
76,
77,
78,
79,
80,
81,
82,
83,
84,
85,
86,
87,
88,
89,
90,
91,
92,
93,
94,
95,
96,
97,
98,
99,
100,
101,
102,
103,
104,
105,
106,
107,
108,
109,
110,
111,
112,
113,
114,
115,
116,
117,
118,
119,
120,
121,
122,
123,
124,
125,
126,
127,
128,
129,
130,
131,
132,
133,
134,
135,
136,
137,
138,
139,
140,
141,
142,
143,
144,
145,
146,
147,
148,
149,
150,
151,
152,
153,
154,
155,
156,
157,
158,
159,
160,
161,
162,
163,
164,
165,
166,
167,
168,
169,
170,
171,
172,
173,
174,
175,
176,
177,
178,
179,
180,
181,
182,
183,
184,
185,
186,
187,
188,
189,
190,
191,
192,
193,
194,
195,
196,
197,
198,
199,
200,
201,
202,
203,
204,
205,
206,
207,
208,
209,
210,
211,
212,
213,
214,
215,
216,
217,
218,
219,
220,
221,
222,
223,
224,
225,
226,
227,
228,
229,
230,
231,
232,
233,
234,
235,
236,
237,
238,
239,
240,
241,
242,
243,
244,
245,
246,
247,
248,
249,
250,
251,
252,
253,
254,
255,
256,
257,
258,
259,
260,
261,
262,
263,
264,
265,
266,
267,
268,
269,
270,
271,
272,
273,
274,
275,
276,
277,
278,
279,
280,
281,
282,
283,
284,
285,
286,
287,
288,
289,
290,
291,
292,
293,
294,
295,
296,
297,
298,
299,
300,
301,
302,
303,
304,
305,
306,
307,
308,
309,
310,
311,
312,
313,
314,
315,
316,
317,
318,
319,
320,
321,
322,
323,
324,
325,
326,
327,
328,
329,
330,
331,
332,
333,
334,
335,
336,
337,
338,
339,
340,
341,
342,
343,
344,
345,
346,
347,
348,
349,
350,
351,
352,
353,
354,
355,
356,
357,
358,
359,
360,
361,
362,
363,
364,
365,
366,
367,
368,
369,
370,
371,
372,
373,
374,
375,
376,
377,
378,
379,
380,
381,
382,
383,
384,
385,
386,
387,
388,
389,
390,
391,
392,
393,
394,
395,
396,
397,
398,
399,
400,
401,
402,
403,
404,
405,
406,
407,
408,
409,
410,
411,
412,
413,
414,
415,
416,
417,
418,
419,
420,
421,
422,
423,
424,
425,
426,
427,
428,
429,
430,
431,
432,
433,
434,
435,
436,
437,
438,
439,
440,
441,
442,
443,
444,
445,
446,
447,
448,
449,
450,
451,
452,
453,
454,
455,
456,
457,
458,
459,
460,
461,
462,
463,
464,
465,
466,
467,
468,
469,
470,
471,
472,
473,
474,
475,
476,
477,
478,
479,
480,
481,
482,
483,
484,
485,
486,
487,
488,
489,
490,
491,
492,
493,
494,
495,
496,
497,
498,
499,
500,
501,
502,
503,
504,
505,
506,
507,
508,
509,
510,
511,
512,
513,
514,
515,
516,
517,
518,
519,
520,
521,
522,
523,
524,
525,
526,
527,
528,
529,
530,
531,
532,
533,
534,
535,
536,
537,
538,
539,
540,
541,
542,
543,
544,
545,
546,
547,
548,
549,
550,
551,
552,
553,
554,
555,
556,
557,
558,
559,
560,
561,
562,
563,
564,
565,
566,
567,
568,
569,
570,
571,
572,
573,
574,
575,
576,
577,
578,
579,
580,
581,
582,
583,
584,
585,
586,
587,
588,
589,
590,
591,
592,
593,
594,
595,
596,
597,
598,
599,
600,
601,
602,
603,
604,
605,
606,
607,
608,
609,
610,
611,
612,
613,
614,
615,
616,
617,
618,
619,
620,
621,
622,
623,
624,
625,
626,
627,
628,
629,
630,
631,
632,
633,
634,
635,
636,
637,
638,
639,
640,
641,
642,
643,
644,
645,
646,
647,
648,
649,
650,
651,
652,
653,
654,
655,
656,
657,
658,
659,
660,
661,
662,
663,
664,
665,
666,
667,
668,
669,
670,
671,
672,
673,
674,
675,
676,
677,
678,
679,
680,
681,
682,
683,
684,
685,
686,
687,
688,
689,
690,
691,
692,
693,
694,
695,
696,
697,
698,
699,
700,
701,
702,
703,
704,
705,
706,
707,
708,
709,
710,
711,
712,
713,
714,
715,
716,
717,
718,
719,
720,
721,
722,
723,
724,
725,
726,
727,
728,
729,
730,
731,
732,
733,
734,
735,
736,
737,
738,
739,
740,
741,
742,
743,
744,
745,
746,
747,
748,
749,
750,
751,
752,
753,
754,
755,
756,
757,
758,
759,
760,
761,
762,
763,
764,
765,
766,
767,
768,
769,
770,
771,
772,
773,
774,
775,
776,
777,
778,
779,
780,
781,
782,
783,
784,
785,
786,
787,
788,
789,
790,
791,
792,
793,
794,
795,
796,
797,
798,
799,
800,
801,
802,
803,
804,
805,
806,
807,
808,
809,
810,
811,
812,
813,
814,
815,
816,
817,
818,
819,
820,
821,
822,
823,
824,
825,
826,
827,
828,
829,
830,
831,
832,
833,
834,
835,
836,
837,
838,
839,
840,
841,
842,
843,
844,
845,
846,
847,
848,
849,
850,
851,
852,
853,
854,
855,
856,
857,
858,
859,
860,
861,
862,
863,
864,
865,
866,
867,
868,
869,
870,
871,
872,
873,
874,
875,
876,
877,
878,
879,
880,
881,
882,
883,
884,
885,
886,
887,
888,
889,
890,
891,
892,
893,
894,
895,
896,
897,
898,
899,
900,
901,
902,
903,
904,
905,
906,
907,
908,
909,
910,
911,
912,
913,
914,
915,
916,
917,
918,
919,
920,
921,
922,
923,
924,
925,
926,
927,
928,
929,
930,
931,
932,
933,
934,
935,
936,
937,
938,
939,
940,
941,
942,
943,
944,
945,
946,
947,
948,
949,
950,
951,
952,
953,
954,
955,
956,
957,
958,
959,
960,
961,
962,
963,
964,
965,
966,
967,
968,
969,
970,
971,
972,
973,
974,
975,
976,
977,
978,
979,
980,
981,
982,
983,
984,
985,
986,
987,
988,
989,
990,
991,
992,
993,
994,
995,
996,
997,
998,
999
]
},
"objective": "time",
"cache": {
"64,2,1,4,1,0,0": {"block_size_x": 64, "block_size_y": 2, "tile_size_x": 1, "tile_size_y": 4, "read_only": 1, "use_padding": 0, "REPEAT": 0, "time": 1.701535971959432, "times": [1.7305599451065063, 1.6895999908447266, 1.6875519752502441, 1.686527967453003, 1.686527967453003, 1.686527967453003, 1.6855039596557617, 1.6855039596557617, 1.6875519752502441, 1.6855039596557617, 1.6864320039749146, 1.686527967453003, 1.686527967453003, 1.686527967453003, 1.6844799518585205, 1.6864639520645142, 1.6885759830474854, 1.7172479629516602, 1.7172479629516602, 1.7182719707489014, 1.7182719707489014, 1.7172479629516602, 1.7172479629516602, 1.7172479629516602, 1.7182400226593018, 1.7181440591812134, 1.7172479629516602, 1.7172479629516602, 1.7182719707489014, 1.7172479629516602], "compile_time": 1912.868482992053, "verification_time": 0, "benchmark_time": 52.585490979254246, "GFLOP/s": 5699.104225714954, "strategy_time": 0, "framework_time": 21.667778957635164, "timestamp": "2024-01-16 14:09:48.902456+00:00"},
"64,2,1,4,1,0,1": {"block_size_x": 64, "block_size_y": 2, "tile_size_x": 1, "tile_size_y": 4, "read_only": 1, "use_padding": 0, "REPEAT": 1, "time": 1.6950911641120912, "times": [1.7315839529037476, 1.6906239986419678, 1.6864639520645142, 1.6855039596557617, 1.686527967453003, 1.686527967453003, 1.6855039596557617, 1.6834559440612793, 1.6875519752502441, 1.6855039596557617, 1.686527967453003, 1.6855039596557617, 1.6855039596557617, 1.6844799518585205, 1.6844799518585205, 1.6855039596557617, 1.6834559440612793, 1.6855039596557617, 1.6855039596557617, 1.6844799518585205, 1.6844799518585205, 1.6855039596557617, 1.7069439888000488, 1.714176058769226, 1.7182719707489014, 1.7172479629516602, 1.716223955154419, 1.716223955154419, 1.7172479629516602, 1.716223955154419], "compile_time": 1915.8048802055418, "verification_time": 0, "benchmark_time": 52.29180119931698, "GFLOP/s": 5720.772459503394, "strategy_time": 0, "framework_time": 1.6455408185720444, "timestamp": "2024-01-16 14:09:50.872236+00:00"},
"64,2,1,4,1,0,2": {"block_size_x": 64, "block_size_y": 2, "tile_size_x": 1, "tile_size_y": 4, "read_only": 1, "use_padding": 0, "REPEAT": 2, "time": 1.7138272285461427, "times": [1.7428480386734009, 1.7008639574050903, 1.6977920532226562, 1.6977920532226562, 1.697759985923767, 1.6977920532226562, 1.6977920532226562, 1.6977920532226562, 1.696768045425415, 1.696768045425415, 1.6967359781265259, 1.6977920532226562, 1.696768045425415, 1.6967359781265259, 1.696768045425415, 1.7131520509719849, 1.7285120487213135, 1.7284159660339355, 1.7274880409240723, 1.7274880409240723, 1.7285120487213135, 1.7284799814224243, 1.7274880409240723, 1.7274880409240723, 1.7274880409240723, 1.7285120487213135, 1.7285120487213135, 1.7284159660339355, 1.7275840044021606, 1.7285120487213135], "compile_time": 1917.2954419627786, "verification_time": 0, "benchmark_time": 52.73365695029497, "GFLOP/s": 5658.231288708291, "strategy_time": 0, "framework_time": 1.4924253337085247, "timestamp": "2024-01-16 14:09:52.843791+00:00"},
"64,2,1,4,1,0,3": {"block_size_x": 64, "block_size_y": 2, "tile_size_x": 1, "tile_size_y": 4, "read_only": 1, "use_padding": 0, "REPEAT": 3, "time": 1.700172773996989, "times": [1.7315839529037476, 1.6906239986419678, 1.6874560117721558, 1.686527967453003, 1.686527967453003, 1.686527967453003, 1.6855679750442505, 1.6855039596557617, 1.6874560117721558, 1.6855039596557617, 1.6844799518585205, 1.686527967453003, 1.6855039596557617, 1.6855039596557617, 1.6855039596557617, 1.6844799518585205, 1.6844799518585205, 1.6885759830474854, 1.714176058769226, 1.7172479629516602, 1.7172479629516602, 1.7203199863433838, 1.7172479629516602, 1.7172479629516602, 1.7172160148620605, 1.7171519994735718, 1.7182719707489014, 1.716223955154419, 1.7182719707489014, 1.716223955154419], "compile_time": 1760.3660197928548, "verification_time": 0, "benchmark_time": 52.56914021447301, "GFLOP/s": 5703.67376558, "strategy_time": 0, "framework_time": 1.8063019961118698, "timestamp": "2024-01-16 14:09:54.658566+00:00"},
"64,2,1,4,1,0,4": {"block_size_x": 64, "block_size_y": 2, "tile_size_x": 1, "tile_size_y": 4, "read_only": 1, "use_padding": 0, "REPEAT": 4, "time": 1.7068757653236388, "times": [1.7448960542678833, 1.7018879652023315, 1.6977920532226562, 1.696768045425415, 1.6957440376281738, 1.6958400011062622, 1.6957440376281738, 1.6957440376281738, 1.6978559494018555, 1.696768045425415, 1.6957440376281738, 1.696768045425415, 1.696768045425415, 1.6957440376281738, 1.6957440376281738, 1.6957440376281738, 1.696768045425415, 1.6957440376281738, 1.6957440376281738, 1.6977920532226562, 1.6957440376281738, 1.7018879652023315, 1.7274880409240723, 1.7284799814224243, 1.7285120487213135, 1.7285120487213135, 1.7295360565185547, 1.7285120487213135, 1.7285120487213135, 1.7274880409240723], "compile_time": 1918.460062239319, "verification_time": 0, "benchmark_time": 52.34008003026247, "GFLOP/s": 5681.275137304044, "strategy_time": 0, "framework_time": 1.7791814170777798, "timestamp": "2024-01-16 14:09:56.631185+00:00"},
"64,2,1,4,1,0,5": {"block_size_x": 64, "block_size_y": 2, "tile_size_x": 1, "tile_size_y": 4, "read_only": 1, "use_padding": 0, "REPEAT": 5, "time": 1.691165828704834, "times": [1.7305599451065063, 1.6895999908447266, 1.686527967453003, 1.686527967453003, 1.6855039596557617, 1.6844799518585205, 1.6855039596557617, 1.686527967453003, 1.6855039596557617, 1.6855039596557617, 1.6844799518585205, 1.686527967453003, 1.6844799518585205, 1.6855039596557617, 1.6844799518585205, 1.6844799518585205, 1.6844799518585205, 1.685472011566162, 1.686527967453003, 1.6844799518585205, 1.6854079961776733, 1.6844799518585205, 1.6844799518585205, 1.6844799518585205, 1.6844799518585205, 1.6855039596557617, 1.7172479629516602, 1.7172479629516602, 1.716223955154419, 1.7182719707489014], "compile_time": 1918.4945770539343, "verification_time": 0, "benchmark_time": 52.10044188424945, "GFLOP/s": 5734.050844337689, "strategy_time": 0, "framework_time": 1.526347827166319, "timestamp": "2024-01-16 14:09:58.603340+00:00"},
"64,2,1,4,1,0,6": {"block_size_x": 64, "block_size_y": 2, "tile_size_x": 1, "tile_size_y": 4, "read_only": 1, "use_padding": 0, "REPEAT": 6, "time": 1.703003704547882, "times": [1.7326079607009888, 1.6906239986419678, 1.6895999908447266, 1.686527967453003, 1.6855039596557617, 1.6855039596557617, 1.6875519752502441, 1.6844799518585205, 1.686527967453003, 1.6885759830474854, 1.6854079961776733, 1.6855039596557617, 1.686527967453003, 1.6875519752502441, 1.6855039596557617, 1.6998399496078491, 1.7151999473571777, 1.7172479629516602, 1.7172479629516602, 1.7172479629516602, 1.716223955154419, 1.7203199863433838, 1.716223955154419, 1.716223955154419, 1.716223955154419, 1.721343994140625, 1.7172479629516602, 1.7171519994735718, 1.7172479629516602, 1.7171200513839722], "compile_time": 1763.939781114459, "verification_time": 0, "benchmark_time": 52.65611317008734, "GFLOP/s": 5694.192456600937, "strategy_time": 0, "framework_time": 1.438782550394535, "timestamp": "2024-01-16 14:10:00.421409+00:00"},
"64,2,1,4,1,0,7": {"block_size_x": 64, "block_size_y": 2, "tile_size_x": 1, "tile_size_y": 4, "read_only": 1, "use_padding": 0, "REPEAT": 7, "time": 1.6942068974177042, "times": [1.73363196849823, 1.6906239986419678, 1.686527967453003, 1.6855039596557617, 1.6844799518585205, 1.6855039596557617, 1.6855039596557617, 1.6864320039749146, 1.6844799518585205, 1.6855039596557617, 1.6855679750442505, 1.686527967453003, 1.6855039596557617, 1.6855039596557617, 1.686527967453003, 1.6844799518585205, 1.6855039596557617, 1.6855039596557617, 1.6855039596557617, 1.6844799518585205, 1.6855039596557617, 1.6844799518585205, 1.686527967453003, 1.703935980796814, 1.7172479629516602, 1.7172479629516602, 1.7172479629516602, 1.7172479629516602, 1.716223955154419, 1.7172479629516602], "compile_time": 1911.369665991515, "verification_time": 0, "benchmark_time": 52.20060981810093, "GFLOP/s": 5723.758333637076, "strategy_time": 0, "framework_time": 1.49201275780797, "timestamp": "2024-01-16 14:10:02.386504+00:00"},
"64,2,1,4,1,0,8": {"block_size_x": 64, "block_size_y": 2, "tile_size_x": 1, "tile_size_y": 4, "read_only": 1, "use_padding": 0, "REPEAT": 8, "time": 1.7022634307543436, "times": [1.73363196849823, 1.6906239986419678, 1.686527967453003, 1.6855039596557617, 1.6855039596557617, 1.686527967453003, 1.6844799518585205, 1.6844799518585205, 1.6875519752502441, 1.6844799518585205, 1.6855039596557617, 1.686527967453003, 1.6875519752502441, 1.6844799518585205, 1.686527967453003, 1.6895999908447266, 1.7192959785461426, 1.716223955154419, 1.7172479629516602, 1.716223955154419, 1.7182719707489014, 1.716223955154419, 1.716223955154419, 1.716223955154419, 1.7172479629516602, 1.716223955154419, 1.716223955154419, 1.716223955154419, 1.7172479629516602, 1.7192959785461426], "compile_time": 1758.8172098621726, "verification_time": 0, "benchmark_time": 52.64811823144555, "GFLOP/s": 5696.6687251824205, "strategy_time": 0, "framework_time": 1.3297488912940025, "timestamp": "2024-01-16 14:10:04.199330+00:00"},
"64,2,1,4,1,0,9": {"block_size_x": 64, "block_size_y": 2, "tile_size_x": 1, "tile_size_y": 4, "read_only": 1, "use_padding": 0, "REPEAT": 9, "time": 1.6960853020350137, "times": [1.73363196849823, 1.6906239986419678, 1.6855039596557617, 1.6855039596557617, 1.6855039596557617, 1.6864320039749146, 1.6855039596557617, 1.686527967453003, 1.6855039596557617, 1.6845760345458984, 1.6855039596557617, 1.686527967453003, 1.6855039596557617, 1.6844799518585205, 1.6855039596557617, 1.6864960193634033, 1.6844799518585205, 1.6855039596557617, 1.6855039596557617, 1.6844799518585205, 1.6844799518585205, 1.7029119729995728, 1.716256022453308, 1.716223955154419, 1.716223955154419, 1.716223955154419, 1.7172479629516602, 1.7172479629516602, 1.716223955154419, 1.716223955154419], "compile_time": 1915.594195947051, "verification_time": 0, "benchmark_time": 52.32510296627879, "GFLOP/s": 5717.41930453909, "strategy_time": 0, "framework_time": 1.4930348843336105, "timestamp": "2024-01-16 14:10:06.168773+00:00"},
"64,2,1,4,1,0,10": {"block_size_x": 64, "block_size_y": 2, "tile_size_x": 1, "tile_size_y": 4, "read_only": 1, "use_padding": 0, "REPEAT": 10, "time": 1.7018783728281657, "times": [1.7356799840927124, 1.6895999908447266, 1.686527967453003, 1.6855039596557617, 1.6855039596557617, 1.6844799518585205, 1.6844799518585205, 1.6855039596557617, 1.6855039596557617, 1.6855039596557617, 1.686400055885315, 1.6855039596557617, 1.6854079961776733, 1.685439944267273, 1.6855039596557617, 1.6885759830474854, 1.716223955154419, 1.7172479629516602, 1.7182719707489014, 1.7172479629516602, 1.7172479629516602, 1.7172479629516602, 1.7172479629516602, 1.7172479629516602, 1.7172479629516602, 1.716223955154419, 1.7172479629516602, 1.716223955154419, 1.7131520509719849, 1.7131520509719849], "compile_time": 1915.2586478739977, "verification_time": 0, "benchmark_time": 52.640622947365046, "GFLOP/s": 5697.9576230734, "strategy_time": 0, "framework_time": 1.1803400702774525, "timestamp": "2024-01-16 14:10:08.137884+00:00"},
"64,2,1,4,1,0,11": {"block_size_x": 64, "block_size_y": 2, "tile_size_x": 1, "tile_size_y": 4, "read_only": 1, "use_padding": 0, "REPEAT": 11, "time": 1.6934847672780355, "times": [1.7326079607009888, 1.690559983253479, 1.686527967453003, 1.6844799518585205, 1.6856000423431396, 1.6855039596557617, 1.6855039596557617, 1.6855039596557617, 1.686527967453003, 1.686400055885315, 1.6855039596557617, 1.6855039596557617, 1.6855039596557617, 1.686527967453003, 1.6844799518585205, 1.6855039596557617, 1.6844799518585205, 1.6844799518585205, 1.6855039596557617, 1.6855039596557617, 1.6844799518585205, 1.6844799518585205, 1.686527967453003, 1.686527967453003, 1.716223955154419, 1.716223955154419, 1.7172479629516602, 1.718176007270813, 1.716223955154419, 1.716223955154419], "compile_time": 1914.5893738605082, "verification_time": 0, "benchmark_time": 52.20031924545765, "GFLOP/s": 5726.199039620835, "strategy_time": 0, "framework_time": 1.2891534715890884, "timestamp": "2024-01-16 14:10:10.105992+00:00"},
"64,2,1,4,1,0,12": {"block_size_x": 64, "block_size_y": 2, "tile_size_x": 1, "tile_size_y": 4, "read_only": 1, "use_padding": 0, "REPEAT": 12, "time": 1.6934591690699259, "times": [1.7315839529037476, 1.6885440349578857, 1.6855039596557617, 1.686527967453003, 1.6844799518585205, 1.6855039596557617, 1.6844799518585205, 1.6855039596557617, 1.6855039596557617, 1.6844799518585205, 1.6844799518585205, 1.686527967453003, 1.6853760480880737, 1.6844799518585205, 1.6844799518585205, 1.6834880113601685, 1.6844799518585205, 1.6875519752502441, 1.6834559440612793, 1.6834559440612793, 1.6844799518585205, 1.6844799518585205, 1.6844799518585205, 1.7050559520721436, 1.714176058769226, 1.7163200378417969, 1.716223955154419, 1.716223955154419, 1.716223955154419, 1.716223955154419], "compile_time": 1763.944079168141, "verification_time": 0, "benchmark_time": 52.181473933160305, "GFLOP/s": 5726.285596437421, "strategy_time": 0, "framework_time": 1.5642582438886166, "timestamp": "2024-01-16 14:10:11.923714+00:00"},
"64,2,1,4,1,0,13": {"block_size_x": 64, "block_size_y": 2, "tile_size_x": 1, "tile_size_y": 4, "read_only": 1, "use_padding": 0, "REPEAT": 13, "time": 1.6992149074872336, "times": [1.7326079607009888, 1.6906239986419678, 1.6855039596557617, 1.685472011566162, 1.6855039596557617, 1.6885759830474854, 1.684448003768921, 1.6855039596557617, 1.6855039596557617, 1.6855039596557617, 1.6844799518585205, 1.686527967453003, 1.6885759830474854, 1.6855039596557617, 1.6855039596557617, 1.6855039596557617, 1.6875519752502441, 1.6844799518585205, 1.6895999908447266, 1.716096043586731, 1.716223955154419, 1.716223955154419, 1.7182719707489014, 1.716223955154419, 1.7192959785461426, 1.7161600589752197, 1.7172479629516602, 1.7172479629516602, 1.7192959785461426, 1.7171839475631714], "compile_time": 1713.3526732213795, "verification_time": 0, "benchmark_time": 52.49846773222089, "GFLOP/s": 5706.88899048095, "strategy_time": 0, "framework_time": 1.3984772376716137, "timestamp": "2024-01-16 14:10:13.690995+00:00"},
"64,2,1,4,1,0,14": {"block_size_x": 64, "block_size_y": 2, "tile_size_x": 1, "tile_size_y": 4, "read_only": 1, "use_padding": 0, "REPEAT": 14, "time": 1.6960106333096823, "times": [1.7335360050201416, 1.6886399984359741, 1.6855039596557617, 1.6855039596557617, 1.686400055885315, 1.6855039596557617, 1.6855039596557617, 1.6844799518585205, 1.686527967453003, 1.6844799518585205, 1.6844799518585205, 1.6864960193634033, 1.686527967453003, 1.6844799518585205, 1.6844799518585205, 1.6855039596557617, 1.6855039596557617, 1.6844799518585205, 1.686527967453003, 1.6855039596557617, 1.6855039596557617, 1.7018879652023315, 1.7151999473571777, 1.7172479629516602, 1.7172479629516602, 1.716223955154419, 1.7172479629516602, 1.716223955154419, 1.7172479629516602, 1.716223955154419], "compile_time": 1921.429813373834, "verification_time": 0, "benchmark_time": 52.30310186743736, "GFLOP/s": 5717.671020184777, "strategy_time": 0, "framework_time": 1.2392797507345676, "timestamp": "2024-01-16 14:10:15.665996+00:00"},
"64,2,1,4,1,0,15": {"block_size_x": 64, "block_size_y": 2, "tile_size_x": 1, "tile_size_y": 4, "read_only": 1, "use_padding": 0, "REPEAT": 15, "time": 1.6984767675399781, "times": [1.7346559762954712, 1.6906239986419678, 1.686527967453003, 1.6855039596557617, 1.6844799518585205, 1.6856640577316284, 1.6875519752502441, 1.6844799518585205, 1.6855039596557617, 1.6844799518585205, 1.6844799518585205, 1.6855039596557617, 1.6855039596557617, 1.6844799518585205, 1.6855039596557617, 1.6855039596557617, 1.6844799518585205, 1.6844799518585205, 1.6855039596557617, 1.7121280431747437, 1.716223955154419, 1.716223955154419, 1.7172479629516602, 1.7171519994735718, 1.716223955154419, 1.716223955154419, 1.7172479629516602, 1.716223955154419, 1.7172479629516602, 1.7172479629516602], "compile_time": 1929.1652059182525, "verification_time": 0, "benchmark_time": 52.51451814547181, "GFLOP/s": 5709.3691437682555, "strategy_time": 0, "framework_time": 1.5695281326770782, "timestamp": "2024-01-16 14:10:17.649277+00:00"},
"64,2,1,4,1,0,16": {"block_size_x": 64, "block_size_y": 2, "tile_size_x": 1, "tile_size_y": 4, "read_only": 1, "use_padding": 0, "REPEAT": 16, "time": 1.6934314330418905, "times": [1.73363196849823, 1.6886399984359741, 1.6855679750442505, 1.686527967453003, 1.6844799518585205, 1.6855039596557617, 1.6864960193634033, 1.6855039596557617, 1.686560034751892, 1.6844799518585205, 1.6855039596557617, 1.686527967453003, 1.684607982635498, 1.6855039596557617, 1.6844799518585205, 1.6855039596557617, 1.6844799518585205, 1.6855039596557617, 1.6844799518585205, 1.6844799518585205, 1.6844799518585205, 1.6855039596557617, 1.6855039596557617, 1.6885759830474854, 1.716223955154419, 1.716223955154419, 1.7172479629516602, 1.716223955154419, 1.7172479629516602, 1.7172479629516602], "compile_time": 1917.304018046707, "verification_time": 0, "benchmark_time": 52.20305360853672, "GFLOP/s": 5726.379384951525, "strategy_time": 0, "framework_time": 1.408086158335209, "timestamp": "2024-01-16 14:10:19.620222+00:00"},
"64,2,1,4,1,0,17": {"block_size_x": 64, "block_size_y": 2, "tile_size_x": 1, "tile_size_y": 4, "read_only": 1, "use_padding": 0, "REPEAT": 17, "time": 1.691438897450765, "times": [1.7315839529037476, 1.6906239986419678, 1.6855039596557617, 1.6855039596557617, 1.6845439672470093, 1.6855039596557617, 1.6844799518585205, 1.6844799518585205, 1.686527967453003, 1.6844799518585205, 1.6844799518585205, 1.6855039596557617, 1.6855039596557617, 1.6834559440612793, 1.6844799518585205, 1.6855039596557617, 1.6855039596557617, 1.6853760480880737, 1.6844799518585205, 1.6845439672470093, 1.686527967453003, 1.6844799518585205, 1.6855039596557617, 1.6844799518585205, 1.6855039596557617, 1.6998399496078491, 1.7151999473571777, 1.716223955154419, 1.7171200513839722, 1.716223955154419], "compile_time": 1923.0043212883174, "verification_time": 0, "benchmark_time": 52.10018204525113, "GFLOP/s": 5733.125129506649, "strategy_time": 0, "framework_time": 1.4711939729750156, "timestamp": "2024-01-16 14:10:21.596828+00:00"},
"64,2,1,4,1,0,18": {"block_size_x": 64, "block_size_y": 2, "tile_size_x": 1, "tile_size_y": 4, "read_only": 1, "use_padding": 0, "REPEAT": 18, "time": 1.7004863659540812, "times": [1.73363196849823, 1.690559983253479, 1.6855039596557617, 1.6855039596557617, 1.6844799518585205, 1.6855039596557617, 1.6855039596557617, 1.6855039596557617, 1.6864320039749146, 1.6844799518585205, 1.6844799518585205, 1.686527967453003, 1.6845439672470093, 1.6844799518585205, 1.6844799518585205, 1.6855039596557617, 1.6844160556793213, 1.716223955154419, 1.716223955154419, 1.7172479629516602, 1.7172479629516602, 1.716223955154419, 1.7172479629516602, 1.716223955154419, 1.7182719707489014, 1.7172479629516602, 1.7172479629516602, 1.716223955154419, 1.7151999473571777, 1.712224006652832], "compile_time": 1920.3037042170763, "verification_time": 0, "benchmark_time": 52.615936845541, "GFLOP/s": 5702.621933436812, "strategy_time": 0, "framework_time": 1.2709801085293293, "timestamp": "2024-01-16 14:10:23.571049+00:00"},
"64,2,1,4,1,0,19": {"block_size_x": 64, "block_size_y": 2, "tile_size_x": 1, "tile_size_y": 4, "read_only": 1, "use_padding": 0, "REPEAT": 19, "time": 1.6994868993759156, "times": [1.735584020614624, 1.6906239986419678, 1.686527967453003, 1.686527967453003, 1.6844799518585205, 1.686527967453003, 1.6844799518585205, 1.6855039596557617, 1.6874239444732666, 1.6845120191574097, 1.6855039596557617, 1.685439944267273, 1.6855039596557617, 1.6844799518585205, 1.6844799518585205, 1.685472011566162, 1.6844799518585205, 1.6855039596557617, 1.7059199810028076, 1.716223955154419, 1.7172479629516602, 1.716223955154419, 1.7172479629516602, 1.7172479629516602, 1.7172479629516602, 1.716223955154419, 1.7172479629516602, 1.716223955154419, 1.7172479629516602, 1.7172479629516602], "compile_time": 1923.3123566955328, "verification_time": 0, "benchmark_time": 52.501393016427755, "GFLOP/s": 5705.975639801054, "strategy_time": 0, "framework_time": 1.2682750821113586, "timestamp": "2024-01-16 14:10:25.548163+00:00"},
"64,2,1,4,1,0,20": {"block_size_x": 64, "block_size_y": 2, "tile_size_x": 1, "tile_size_y": 4, "read_only": 1, "use_padding": 0, "REPEAT": 20, "time": 1.6931476950645448, "times": [1.7315839529037476, 1.6895999908447266, 1.6855039596557617, 1.6855039596557617, 1.6855039596557617, 1.6834559440612793, 1.6844799518585205, 1.6864320039749146, 1.6855039596557617, 1.6844799518585205, 1.6855039596557617, 1.6855039596557617, 1.6844799518585205, 1.6855039596557617, 1.6855039596557617, 1.6855039596557617, 1.6844799518585205, 1.6855039596557617, 1.6855039596557617, 1.6844799518585205, 1.6846400499343872, 1.6855039596557617, 1.6844799518585205, 1.6874239444732666, 1.716223955154419, 1.7172479629516602, 1.716223955154419, 1.716223955154419, 1.716223955154419, 1.716223955154419], "compile_time": 1915.6208368949592, "verification_time": 0, "benchmark_time": 52.18093283474445, "GFLOP/s": 5727.339012578185, "strategy_time": 0, "framework_time": 1.5481174923479557, "timestamp": "2024-01-16 14:10:27.517549+00:00"},
"64,2,1,4,1,0,21": {"block_size_x": 64, "block_size_y": 2, "tile_size_x": 1, "tile_size_y": 4, "read_only": 1, "use_padding": 0, "REPEAT": 21, "time": 1.6970378597577414, "times": [1.7448960542678833, 1.7018879652023315, 1.698815941810608, 1.6977920532226562, 1.696768045425415, 1.696768045425415, 1.6958719491958618, 1.6977920532226562, 1.696768045425415, 1.696768045425415, 1.6957440376281738, 1.696768045425415, 1.6895999908447266, 1.6855039596557617, 1.6844799518585205, 1.6844799518585205, 1.6844799518585205, 1.6854079961776733, 1.6855039596557617, 1.6844799518585205, 1.691648006439209, 1.6844799518585205, 1.6855039596557617, 1.6844799518585205, 1.6855039596557617, 1.7111040353775024, 1.7172800302505493, 1.716223955154419, 1.7171839475631714, 1.7171519994735718], "compile_time": 1926.1317858472466, "verification_time": 0, "benchmark_time": 52.21414379775524, "GFLOP/s": 5714.210082139427, "strategy_time": 0, "framework_time": 1.566495280712843, "timestamp": "2024-01-16 14:10:29.497493+00:00"},
"64,2,1,4,1,0,22": {"block_size_x": 64, "block_size_y": 2, "tile_size_x": 1, "tile_size_y": 4, "read_only": 1, "use_padding": 0, "REPEAT": 22, "time": 1.695203181107839, "times": [1.7305279970169067, 1.690559983253479, 1.6855039596557617, 1.686527967453003, 1.6855039596557617, 1.685439944267273, 1.686527967453003, 1.6855039596557617, 1.6844799518585205, 1.6844799518585205, 1.6844799518585205, 1.6855039596557617, 1.684607982635498, 1.6855039596557617, 1.6834559440612793, 1.6845760345458984, 1.6845760345458984, 1.6855039596557617, 1.6855039596557617, 1.6844799518585205, 1.6855039596557617, 1.6844799518585205, 1.6855039596557617, 1.6906239986419678, 1.7192959785461426, 1.7274880409240723, 1.7274880409240723, 1.7274880409240723, 1.7274880409240723, 1.7274880409240723], "compile_time": 1925.3085958771408, "verification_time": 0, "benchmark_time": 52.20566922798753, "GFLOP/s": 5720.394437711428, "strategy_time": 0, "framework_time": 1.4006420969963074, "timestamp": "2024-01-16 14:10:31.476438+00:00"},
"64,2,1,4,1,0,23": {"block_size_x": 64, "block_size_y": 2, "tile_size_x": 1, "tile_size_y": 4, "read_only": 1, "use_padding": 0, "REPEAT": 23, "time": 1.7013077100118001, "times": [1.7346880435943604, 1.6906239986419678, 1.6855039596557617, 1.686527967453003, 1.6845760345458984, 1.6844799518585205, 1.686527967453003, 1.6855039596557617, 1.686527967453003, 1.6844799518585205, 1.6855039596557617, 1.6855039596557617, 1.6844799518585205, 1.686400055885315, 1.6855039596557617, 1.6853760480880737, 1.7151999473571777, 1.716223955154419, 1.716223955154419, 1.7151999473571777, 1.716223955154419, 1.7172479629516602, 1.7172479629516602, 1.716223955154419, 1.7172479629516602, 1.716223955154419, 1.716223955154419, 1.714176058769226, 1.7112319469451904, 1.7121280431747437], "compile_time": 1919.3928688764572, "verification_time": 0, "benchmark_time": 52.66254395246506, "GFLOP/s": 5699.868866128128, "strategy_time": 0, "framework_time": 1.248869113624096, "timestamp": "2024-01-16 14:10:33.449772+00:00"},
"64,2,1,4,1,0,24": {"block_size_x": 64, "block_size_y": 2, "tile_size_x": 1, "tile_size_y": 4, "read_only": 1, "use_padding": 0, "REPEAT": 24, "time": 1.696998365720113, "times": [1.7326079607009888, 1.6906239986419678, 1.686527967453003, 1.686527967453003, 1.6844799518585205, 1.6855039596557617, 1.6855039596557617, 1.6844799518585205, 1.6855039596557617, 1.6844799518585205, 1.6855039596557617, 1.6855039596557617, 1.6855039596557617, 1.6844799518585205, 1.6844799518585205, 1.6844799518585205, 1.685472011566162, 1.6844799518585205, 1.6844799518585205, 1.6844799518585205, 1.7090239524841309, 1.7151360511779785, 1.716223955154419, 1.716223955154419, 1.7172479629516602, 1.716223955154419, 1.716223955154419, 1.716096043586731, 1.716223955154419, 1.716223955154419], "compile_time": 1917.463495861739, "verification_time": 0, "benchmark_time": 52.38552624359727, "GFLOP/s": 5714.343068259248, "strategy_time": 0, "framework_time": 1.6735629178583622, "timestamp": "2024-01-16 14:10:35.421325+00:00"},
"64,2,1,4,1,0,25": {"block_size_x": 64, "block_size_y": 2, "tile_size_x": 1, "tile_size_y": 4, "read_only": 1, "use_padding": 0, "REPEAT": 25, "time": 1.697339701652527, "times": [1.73363196849823, 1.6895999908447266, 1.6864320039749146, 1.6855039596557617, 1.6855039596557617, 1.6844799518585205, 1.6855039596557617, 1.6844799518585205, 1.686527967453003, 1.6844799518585205, 1.6844799518585205, 1.685439944267273, 1.6885759830474854, 1.6844799518585205, 1.6855039596557617, 1.6844799518585205, 1.6844799518585205, 1.6855039596557617, 1.6844799518585205, 1.6885759830474854, 1.7131520509719849, 1.714176058769226, 1.7172479629516602, 1.7151999473571777, 1.7172479629516602, 1.7171519994735718, 1.716223955154419, 1.716223955154419, 1.716223955154419, 1.7151999473571777], "compile_time": 1766.2284267134964, "verification_time": 0, "benchmark_time": 52.401525899767876, "GFLOP/s": 5713.193910776254, "strategy_time": 0, "framework_time": 1.2337383814156055, "timestamp": "2024-01-16 14:10:37.241220+00:00"},
"64,2,1,4,1,0,26": {"block_size_x": 64, "block_size_y": 2, "tile_size_x": 1, "tile_size_y": 4, "read_only": 1, "use_padding": 0, "REPEAT": 26, "time": 1.6964959700902302, "times": [1.73363196849823, 1.6895999908447266, 1.686527967453003, 1.686527967453003, 1.6844799518585205, 1.6855039596557617, 1.686527967453003, 1.6855039596557617, 1.686527967453003, 1.6845439672470093, 1.6855039596557617, 1.686527967453003, 1.6844799518585205, 1.686527967453003, 1.6844799518585205, 1.686527967453003, 1.6855039596557617, 1.6855039596557617, 1.6844799518585205, 1.6844160556793213, 1.6855039596557617, 1.714176058769226, 1.7172479629516602, 1.716256022453308, 1.716223955154419, 1.716223955154419, 1.7172479629516602, 1.716223955154419, 1.716223955154419, 1.716223955154419], "compile_time": 1923.7743420526385, "verification_time": 0, "benchmark_time": 52.381298039108515, "GFLOP/s": 5716.035298029173, "strategy_time": 0, "framework_time": 1.30805978551507, "timestamp": "2024-01-16 14:10:39.218714+00:00"},
"64,2,1,4,1,0,27": {"block_size_x": 64, "block_size_y": 2, "tile_size_x": 1, "tile_size_y": 4, "read_only": 1, "use_padding": 0, "REPEAT": 27, "time": 1.6937013069788616, "times": [1.7316800355911255, 1.6895999908447266, 1.6855039596557617, 1.6875519752502441, 1.6855039596557617, 1.685472011566162, 1.6845439672470093, 1.686527967453003, 1.685472011566162, 1.6855039596557617, 1.6885440349578857, 1.6864960193634033, 1.6855039596557617, 1.6855039596557617, 1.6855039596557617, 1.6855039596557617, 1.6844799518585205, 1.6844799518585205, 1.6855039596557617, 1.6844799518585205, 1.6855039596557617, 1.6855039596557617, 1.6855039596557617, 1.6906239986419678, 1.7163519859313965, 1.716223955154419, 1.7182719707489014, 1.7172479629516602, 1.716223955154419, 1.716223955154419], "compile_time": 1921.3083749637008, "verification_time": 0, "benchmark_time": 52.17971093952656, "GFLOP/s": 5725.466945111726, "strategy_time": 0, "framework_time": 1.2623532675206661, "timestamp": "2024-01-16 14:10:41.193495+00:00"},
"64,2,1,4,1,0,28": {"block_size_x": 64, "block_size_y": 2, "tile_size_x": 1, "tile_size_y": 4, "read_only": 1, "use_padding": 0, "REPEAT": 28, "time": 1.7023381471633912, "times": [1.7418240308761597, 1.7018879652023315, 1.6969280242919922, 1.696768045425415, 1.696768045425415, 1.695904016494751, 1.696768045425415, 1.698815941810608, 1.6977280378341675, 1.6957440376281738, 1.696768045425415, 1.696768045425415, 1.6976959705352783, 1.6967040300369263, 1.6947200298309326, 1.696768045425415, 1.6957440376281738, 1.696671962738037, 1.6957440376281738, 1.696768045425415, 1.6957440376281738, 1.6958400011062622, 1.6957440376281738, 1.6957440376281738, 1.717344045639038, 1.7192959785461426, 1.716223955154419, 1.716223955154419, 1.7172479629516602, 1.7172479629516602], "compile_time": 1924.2994962260127, "verification_time": 0, "benchmark_time": 52.23923176527023, "GFLOP/s": 5696.4186957559, "strategy_time": 0, "framework_time": 1.599123701453209, "timestamp": "2024-01-16 14:10:43.171662+00:00"},
"64,2,1,4,1,0,29": {"block_size_x": 64, "block_size_y": 2, "tile_size_x": 1, "tile_size_y": 4, "read_only": 1, "use_padding": 0, "REPEAT": 29, "time": 1.6999626358350117, "times": [1.73363196849823, 1.6906239986419678, 1.6855039596557617, 1.686400055885315, 1.6855039596557617, 1.6855039596557617, 1.6844799518585205, 1.686527967453003, 1.6855039596557617, 1.6844799518585205, 1.6855039596557617, 1.686527967453003, 1.6844799518585205, 1.6844799518585205, 1.6853760480880737, 1.6844799518585205, 1.6844799518585205, 1.6957440376281738, 1.7151999473571777, 1.7172479629516602, 1.716223955154419, 1.716223955154419, 1.7172479629516602, 1.7171839475631714, 1.7172479629516602, 1.716223955154419, 1.716223955154419, 1.7171519994735718, 1.7172479629516602, 1.716223955154419], "compile_time": 1917.1142922714353, "verification_time": 0, "benchmark_time": 52.56033269688487, "GFLOP/s": 5704.378816088964, "strategy_time": 0, "framework_time": 1.6795452684164047, "timestamp": "2024-01-16 14:10:45.143046+00:00"},
"64,2,1,4,1,0,30": {"block_size_x": 64, "block_size_y": 2, "tile_size_x": 1, "tile_size_y": 4, "read_only": 1, "use_padding": 0, "REPEAT": 30, "time": 1.696410632133484, "times": [1.735584020614624, 1.6885759830474854, 1.686527967453003, 1.686527967453003, 1.685439944267273, 1.6855039596557617, 1.6855039596557617, 1.6855039596557617, 1.6844799518585205, 1.6844799518585205, 1.6844799518585205, 1.6855039596557617, 1.6854079961776733, 1.686400055885315, 1.6855039596557617, 1.6844799518585205, 1.6844799518585205, 1.6834559440612793, 1.6844799518585205, 1.684448003768921, 1.6875519752502441, 1.7151999473571777, 1.716223955154419, 1.716223955154419, 1.7172479629516602, 1.7171839475631714, 1.716223955154419, 1.716223955154419, 1.7172479629516602, 1.716223955154419], "compile_time": 1919.7831898927689, "verification_time": 0, "benchmark_time": 52.31071589514613, "GFLOP/s": 5716.322843251883, "strategy_time": 0, "framework_time": 1.264267135411501, "timestamp": "2024-01-16 14:10:47.116436+00:00"},
"64,2,1,4,1,0,31": {"block_size_x": 64, "block_size_y": 2, "tile_size_x": 1, "tile_size_y": 4, "read_only": 1, "use_padding": 0, "REPEAT": 31, "time": 1.698909835020701, "times": [1.73363196849823, 1.691648006439209, 1.6855039596557617, 1.685472011566162, 1.6895999908447266, 1.6854079961776733, 1.6855039596557617, 1.6855039596557617, 1.6855039596557617, 1.6844799518585205, 1.6855039596557617, 1.6895999908447266, 1.6844799518585205, 1.6844799518585205, 1.6855039596557617, 1.686527967453003, 1.6844799518585205, 1.6844799518585205, 1.6855039596557617, 1.70905601978302, 1.716223955154419, 1.7172479629516602, 1.7182719707489014, 1.7171839475631714, 1.7172479629516602, 1.7172479629516602, 1.7171839475631714, 1.7203199863433838, 1.7172479629516602, 1.7172479629516602], "compile_time": 1768.8423497602344, "verification_time": 0, "benchmark_time": 52.423857152462006, "GFLOP/s": 5707.913773941888, "strategy_time": 0, "framework_time": 1.3202428817749023, "timestamp": "2024-01-16 14:10:48.939051+00:00"},
"64,2,1,4,1,0,32": {"block_size_x": 64, "block_size_y": 2, "tile_size_x": 1, "tile_size_y": 4, "read_only": 1, "use_padding": 0, "REPEAT": 32, "time": 1.6947413007418315, "times": [1.7326079607009888, 1.6895999908447266, 1.686527967453003, 1.6855039596557617, 1.6864639520645142, 1.686400055885315, 1.6844799518585205, 1.6844799518585205, 1.6875519752502441, 1.6855039596557617, 1.6855039596557617, 1.686527967453003, 1.6863679885864258, 1.6855039596557617, 1.6844799518585205, 1.686527967453003, 1.6844799518585205, 1.6855039596557617, 1.6844799518585205, 1.6844799518585205, 1.6844799518585205, 1.6855039596557617, 1.6926720142364502, 1.7151999473571777, 1.7182400226593018, 1.716223955154419, 1.7172479629516602, 1.716223955154419, 1.7172479629516602, 1.716223955154419], "compile_time": 1919.138593133539, "verification_time": 0, "benchmark_time": 52.24854964762926, "GFLOP/s": 5721.953459064976, "strategy_time": 0, "framework_time": 1.5872311778366566, "timestamp": "2024-01-16 14:10:50.912058+00:00"},
"64,2,1,4,1,0,33": {"block_size_x": 64, "block_size_y": 2, "tile_size_x": 1, "tile_size_y": 4, "read_only": 1, "use_padding": 0, "REPEAT": 33, "time": 1.6940351684888204, "times": [1.7305599451065063, 1.6915839910507202, 1.6864320039749146, 1.6855039596557617, 1.6855039596557617, 1.6855039596557617, 1.6844799518585205, 1.6855039596557617, 1.6875519752502441, 1.6844799518585205, 1.6855039596557617, 1.686527967453003, 1.6855039596557617, 1.6855039596557617, 1.6844799518585205, 1.6855039596557617, 1.6855039596557617, 1.6855039596557617, 1.6844799518585205, 1.6855039596557617, 1.6855039596557617, 1.6846400499343872, 1.6855039596557617, 1.701856017112732, 1.7192959785461426, 1.716223955154419, 1.7182400226593018, 1.716223955154419, 1.7172479629516602, 1.7151999473571777], "compile_time": 1927.049064077437, "verification_time": 0, "benchmark_time": 52.2168199531734, "GFLOP/s": 5724.338566507155, "strategy_time": 0, "framework_time": 1.5844972804188728, "timestamp": "2024-01-16 14:10:52.892938+00:00"},
"64,2,1,4,1,0,34": {"block_size_x": 64, "block_size_y": 2, "tile_size_x": 1, "tile_size_y": 4, "read_only": 1, "use_padding": 0, "REPEAT": 34, "time": 1.6972106417020163, "times": [1.73363196849823, 1.6906239986419678, 1.6906239986419678, 1.6855039596557617, 1.6855039596557617, 1.6875519752502441, 1.6895999908447266, 1.6855039596557617, 1.686527967453003, 1.6906239986419678, 1.6844799518585205, 1.686527967453003, 1.6855039596557617, 1.6855039596557617, 1.6855039596557617, 1.6855039596557617, 1.6855039596557617, 1.6855039596557617, 1.6855039596557617, 1.6855039596557617, 1.6895999908447266, 1.7080320119857788, 1.7151999473571777, 1.7182719707489014, 1.7182719707489014, 1.7171200513839722, 1.7172479629516602, 1.7172479629516602, 1.7172479629516602, 1.717344045639038], "compile_time": 1766.462093219161, "verification_time": 0, "benchmark_time": 52.33628395944834, "GFLOP/s": 5713.628355685603, "strategy_time": 0, "framework_time": 1.5072617679834366, "timestamp": "2024-01-16 14:10:54.713274+00:00"},
"64,2,1,4,1,0,35": {"block_size_x": 64, "block_size_y": 2, "tile_size_x": 1, "tile_size_y": 4, "read_only": 1, "use_padding": 0, "REPEAT": 35, "time": 1.6927359620730082, "times": [1.7326079607009888, 1.6906239986419678, 1.686527967453003, 1.6855039596557617, 1.686527967453003, 1.6855039596557617, 1.6855039596557617, 1.6855039596557617, 1.6855039596557617, 1.6844799518585205, 1.6855039596557617, 1.6855039596557617, 1.6844799518585205, 1.6855039596557617, 1.6855039596557617, 1.6855039596557617, 1.6844799518585205, 1.6844799518585205, 1.6855039596557617, 1.6844799518585205, 1.6855039596557617, 1.6855039596557617, 1.6855039596557617, 1.6855039596557617, 1.6957440376281738, 1.716223955154419, 1.7171839475631714, 1.7171839475631714, 1.7172479629516602, 1.7172479629516602], "compile_time": 1922.4208192899823, "verification_time": 0, "benchmark_time": 52.14772094041109, "GFLOP/s": 5728.732103100292, "strategy_time": 0, "framework_time": 1.5632756985723972, "timestamp": "2024-01-16 14:10:56.689436+00:00"},
"64,2,1,4,1,0,36": {"block_size_x": 64, "block_size_y": 2, "tile_size_x": 1, "tile_size_y": 4, "read_only": 1, "use_padding": 0, "REPEAT": 36, "time": 1.6986378312110901, "times": [1.7326079607009888, 1.6906239986419678, 1.6855039596557617, 1.6855039596557617, 1.6855039596557617, 1.6844799518585205, 1.6855039596557617, 1.6855039596557617, 1.686527967453003, 1.6844799518585205, 1.6844799518585205, 1.686527967453003, 1.6855039596557617, 1.685472011566162, 1.6895999908447266, 1.7008639574050903, 1.6998399496078491, 1.7008639574050903, 1.700767993927002, 1.6998399496078491, 1.698815941810608, 1.6998399496078491, 1.6998399496078491, 1.6998399496078491, 1.6998399496078491, 1.698815941810608, 1.7254400253295898, 1.7315839529037476, 1.7326079607009888, 1.7325119972229004], "compile_time": 1920.412017032504, "verification_time": 0, "benchmark_time": 52.10387799888849, "GFLOP/s": 5708.827785312008, "strategy_time": 0, "framework_time": 1.566693652421236, "timestamp": "2024-01-16 14:10:58.663550+00:00"},
"64,2,1,4,1,0,37": {"block_size_x": 64, "block_size_y": 2, "tile_size_x": 1, "tile_size_y": 4, "read_only": 1, "use_padding": 0, "REPEAT": 37, "time": 1.7021119713783264, "times": [1.7346559762954712, 1.6906239986419678, 1.6855039596557617, 1.6855039596557617, 1.6845439672470093, 1.6855039596557617, 1.6854079961776733, 1.6855039596557617, 1.686527967453003, 1.6844799518585205, 1.6844799518585205, 1.6844799518585205, 1.6854079961776733, 1.6854079961776733, 1.6844799518585205, 1.6977920532226562, 1.7171519994735718, 1.716223955154419, 1.716223955154419, 1.716223955154419, 1.7172479629516602, 1.716223955154419, 1.7172479629516602, 1.7161600589752197, 1.7172479629516602, 1.716223955154419, 1.7172479629516602, 1.716223955154419, 1.7171839475631714, 1.716223955154419], "compile_time": 1923.7973247654736, "verification_time": 0, "benchmark_time": 52.70329071208835, "GFLOP/s": 5697.175633015161, "strategy_time": 0, "framework_time": 1.523914746940136, "timestamp": "2024-01-16 14:11:00.641606+00:00"},
"64,2,1,4,1,0,38": {"block_size_x": 64, "block_size_y": 2, "tile_size_x": 1, "tile_size_y": 4, "read_only": 1, "use_padding": 0, "REPEAT": 38, "time": 1.702732769648234, "times": [1.7366080284118652, 1.6906239986419678, 1.686527967453003, 1.6855039596557617, 1.6864639520645142, 1.6855039596557617, 1.6855039596557617, 1.6844799518585205, 1.6855360269546509, 1.6844799518585205, 1.6844799518585205, 1.6844799518585205, 1.6855039596557617, 1.6855039596557617, 1.6834559440612793, 1.7121280431747437, 1.7172479629516602, 1.7172479629516602, 1.7161600589752197, 1.7172479629516602, 1.716223955154419, 1.716223955154419, 1.716223955154419, 1.716223955154419, 1.7172479629516602, 1.7172479629516602, 1.7172479629516602, 1.716223955154419, 1.7182079553604126, 1.716223955154419], "compile_time": 1925.7968291640282, "verification_time": 0, "benchmark_time": 52.717025857418776, "GFLOP/s": 5695.09850333317, "strategy_time": 0, "framework_time": 1.5104180201888084, "timestamp": "2024-01-16 14:11:02.621661+00:00"},
"64,2,1,4,1,0,39": {"block_size_x": 64, "block_size_y": 2, "tile_size_x": 1, "tile_size_y": 4, "read_only": 1, "use_padding": 0, "REPEAT": 39, "time": 1.698909827073415, "times": [1.7346559762954712, 1.6904959678649902, 1.686527967453003, 1.6844799518585205, 1.6844799518585205, 1.6844799518585205, 1.6844799518585205, 1.6855039596557617, 1.6874560117721558, 1.6844799518585205, 1.6844799518585205, 1.6855039596557617, 1.6844799518585205, 1.6844799518585205, 1.698815941810608, 1.7008639574050903, 1.6998399496078491, 1.6998080015182495, 1.698815941810608, 1.6998399496078491, 1.698815941810608, 1.6998399496078491, 1.6998399496078491, 1.6998399496078491, 1.7008639574050903, 1.6998399496078491, 1.7285120487213135, 1.7315839529037476, 1.7315839529037476, 1.7326079607009888], "compile_time": 1926.5710390172899, "verification_time": 0, "benchmark_time": 52.067800890654325, "GFLOP/s": 5707.913800642789, "strategy_time": 0, "framework_time": 1.3851942494511604, "timestamp": "2024-01-16 14:11:04.601714+00:00"},
"64,2,1,4,1,0,40": {"block_size_x": 64, "block_size_y": 2, "tile_size_x": 1, "tile_size_y": 4, "read_only": 1, "use_padding": 0, "REPEAT": 40, "time": 1.6919444998105366, "times": [1.7305599451065063, 1.6906239986419678, 1.686400055885315, 1.6856319904327393, 1.6844799518585205, 1.6855039596557617, 1.6855039596557617, 1.6844799518585205, 1.6874239444732666, 1.6855039596557617, 1.6855039596557617, 1.6854079961776733, 1.6855039596557617, 1.6855039596557617, 1.6844799518585205, 1.6844799518585205, 1.6844799518585205, 1.6844799518585205, 1.6844799518585205, 1.6855039596557617, 1.6844799518585205, 1.6844799518585205, 1.6844799518585205, 1.6844799518585205, 1.6854079961776733, 1.714176058769226, 1.7172479629516602, 1.716223955154419, 1.716223955154419, 1.7151999473571777], "compile_time": 1927.5557426735759, "verification_time": 0, "benchmark_time": 52.147489972412586, "GFLOP/s": 5731.411904519264, "strategy_time": 0, "framework_time": 1.5443125739693642, "timestamp": "2024-01-16 14:11:06.582993+00:00"},
"64,2,1,4,1,0,41": {"block_size_x": 64, "block_size_y": 2, "tile_size_x": 1, "tile_size_y": 4, "read_only": 1, "use_padding": 0, "REPEAT": 41, "time": 1.6936564962069194, "times": [1.7367039918899536, 1.6906239986419678, 1.686527967453003, 1.6855039596557617, 1.6855039596557617, 1.6844799518585205, 1.6855039596557617, 1.6885759830474854, 1.6855039596557617, 1.685439944267273, 1.6855039596557617, 1.6855039596557617, 1.6844799518585205, 1.6844799518585205, 1.686527967453003, 1.6844799518585205, 1.6855039596557617, 1.685472011566162, 1.685439944267273, 1.6834559440612793, 1.6855039596557617, 1.6844799518585205, 1.6855039596557617, 1.6895999908447266, 1.716223955154419, 1.7172479629516602, 1.7172479629516602, 1.716223955154419, 1.716223955154419, 1.716223955154419], "compile_time": 1767.5812686793506, "verification_time": 0, "benchmark_time": 52.22560605034232, "GFLOP/s": 5725.61842954444, "strategy_time": 0, "framework_time": 1.496773213148117, "timestamp": "2024-01-16 14:11:08.404328+00:00"},
"64,2,1,4,1,0,42": {"block_size_x": 64, "block_size_y": 2, "tile_size_x": 1, "tile_size_y": 4, "read_only": 1, "use_padding": 0, "REPEAT": 42, "time": 1.698913033803304, "times": [1.7326079607009888, 1.691648006439209, 1.6885759830474854, 1.6855039596557617, 1.6844799518585205, 1.684607982635498, 1.6844799518585205, 1.6844799518585205, 1.686527967453003, 1.6854079961776733, 1.6855039596557617, 1.6864320039749146, 1.6885759830474854, 1.6844799518585205, 1.6834559440612793, 1.6844799518585205, 1.6885759830474854, 1.686527967453003, 1.6844799518585205, 1.7172479629516602, 1.716223955154419, 1.7172479629516602, 1.716223955154419, 1.7171519994735718, 1.716223955154419, 1.716223955154419, 1.716223955154419, 1.7172479629516602, 1.7192959785461426, 1.7172479629516602], "compile_time": 1714.0071266330779, "verification_time": 0, "benchmark_time": 52.502714563161135, "GFLOP/s": 5707.903026849532, "strategy_time": 0, "framework_time": 1.5153191052377224, "timestamp": "2024-01-16 14:11:10.172384+00:00"},
"64,2,1,4,1,0,43": {"block_size_x": 64, "block_size_y": 2, "tile_size_x": 1, "tile_size_y": 4, "read_only": 1, "use_padding": 0, "REPEAT": 43, "time": 1.6994282325108847, "times": [1.7335679531097412, 1.6906239986419678, 1.686527967453003, 1.6856000423431396, 1.6844799518585205, 1.685439944267273, 1.6855039596557617, 1.6844799518585205, 1.686527967453003, 1.6855039596557617, 1.6855039596557617, 1.6864960193634033, 1.6855039596557617, 1.6855039596557617, 1.6855039596557617, 1.6855039596557617, 1.6844799518585205, 1.6855039596557617, 1.70905601978302, 1.7151999473571777, 1.7172479629516602, 1.716223955154419, 1.716223955154419, 1.716223955154419, 1.716223955154419, 1.716223955154419, 1.7172479629516602, 1.7172479629516602, 1.7172479629516602, 1.716223955154419], "compile_time": 1926.662099082023, "verification_time": 0, "benchmark_time": 52.4874571710825, "GFLOP/s": 5706.172618818071, "strategy_time": 0, "framework_time": 1.5411656349897385, "timestamp": "2024-01-16 14:11:12.153105+00:00"},
"64,2,1,4,1,0,44": {"block_size_x": 64, "block_size_y": 2, "tile_size_x": 1, "tile_size_y": 4, "read_only": 1, "use_padding": 0, "REPEAT": 44, "time": 1.6993823726971944, "times": [1.73363196849823, 1.6906239986419678, 1.6855039596557617, 1.6855039596557617, 1.6855039596557617, 1.6855039596557617, 1.6855039596557617, 1.6844799518585205, 1.686400055885315, 1.6854079961776733, 1.6844799518585205, 1.686527967453003, 1.6854079961776733, 1.6855039596557617, 1.6844799518585205, 1.6844799518585205, 1.6855039596557617, 1.6855039596557617, 1.7059520483016968, 1.716223955154419, 1.7172479629516602, 1.7172479629516602, 1.7172479629516602, 1.7172160148620605, 1.716223955154419, 1.716223955154419, 1.716223955154419, 1.7172160148620605, 1.7172479629516602, 1.7172479629516602], "compile_time": 1925.1917470246553, "verification_time": 0, "benchmark_time": 52.4987168610096, "GFLOP/s": 5706.326606535837, "strategy_time": 0, "framework_time": 1.6670511104166508, "timestamp": "2024-01-16 14:11:14.132493+00:00"},
"64,2,1,4,1,0,45": {"block_size_x": 64, "block_size_y": 2, "tile_size_x": 1, "tile_size_y": 4, "read_only": 1, "use_padding": 0, "REPEAT": 45, "time": 1.6954004923502604, "times": [1.73363196849823, 1.6895999908447266, 1.686527967453003, 1.686527967453003, 1.6844799518585205, 1.6855039596557617, 1.6844799518585205, 1.6844799518585205, 1.686527967453003, 1.6855039596557617, 1.6844799518585205, 1.6855039596557617, 1.6844799518585205, 1.6855039596557617, 1.6844799518585205, 1.6844799518585205, 1.6844799518585205, 1.6834559440612793, 1.6834559440612793, 1.6844799518585205, 1.6844160556793213, 1.698815941810608, 1.7151999473571777, 1.716223955154419, 1.716223955154419, 1.7151999473571777, 1.716223955154419, 1.716223955154419, 1.716223955154419, 1.7151999473571777], "compile_time": 1919.8814439587295, "verification_time": 0, "benchmark_time": 52.29581659659743, "GFLOP/s": 5719.728696407979, "strategy_time": 0, "framework_time": 1.3483352959156036, "timestamp": "2024-01-16 14:11:16.106049+00:00"},
"64,2,1,4,1,0,46": {"block_size_x": 64, "block_size_y": 2, "tile_size_x": 1, "tile_size_y": 4, "read_only": 1, "use_padding": 0, "REPEAT": 46, "time": 1.6969450434048972, "times": [1.7326079607009888, 1.6906239986419678, 1.686527967453003, 1.6885759830474854, 1.6844799518585205, 1.686527967453003, 1.6844799518585205, 1.684607982635498, 1.686527967453003, 1.6855039596557617, 1.6855039596557617, 1.686527967453003, 1.6855039596557617, 1.6855039596557617, 1.6844799518585205, 1.6855039596557617, 1.6855039596557617, 1.6875519752502441, 1.6844799518585205, 1.6855039596557617, 1.6855039596557617, 1.70905601978302, 1.7151999473571777, 1.7163840532302856, 1.7172479629516602, 1.729472041130066, 1.717344045639038, 1.7172479629516602, 1.7171200513839722, 1.7172479629516602], "compile_time": 1766.203629784286, "verification_time": 0, "benchmark_time": 52.34223511070013, "GFLOP/s": 5714.522627404974, "strategy_time": 0, "framework_time": 1.4789290726184845, "timestamp": "2024-01-16 14:11:17.926104+00:00"},
"64,2,1,4,1,0,47": {"block_size_x": 64, "block_size_y": 2, "tile_size_x": 1, "tile_size_y": 4, "read_only": 1, "use_padding": 0, "REPEAT": 47, "time": 1.6931690414746603, "times": [1.7346559762954712, 1.6906239986419678, 1.686527967453003, 1.686527967453003, 1.6855039596557617, 1.6855039596557617, 1.6855039596557617, 1.6855039596557617, 1.6844799518585205, 1.6853760480880737, 1.6844799518585205, 1.686400055885315, 1.6853760480880737, 1.6855039596557617, 1.6875840425491333, 1.6854079961776733, 1.6844799518585205, 1.6855039596557617, 1.6855039596557617, 1.6844799518585205, 1.6844799518585205, 1.6875519752502441, 1.6855039596557617, 1.6844799518585205, 1.703935980796814, 1.7151999473571777, 1.7172479629516602, 1.716223955154419, 1.716223955154419, 1.7192959785461426], "compile_time": 1702.8913861140609, "verification_time": 0, "benchmark_time": 52.127000875771046, "GFLOP/s": 5727.2668058909385, "strategy_time": 0, "framework_time": 1.2284801341593266, "timestamp": "2024-01-16 14:11:19.682380+00:00"},
"64,2,1,4,1,0,48": {"block_size_x": 64, "block_size_y": 2, "tile_size_x": 1, "tile_size_y": 4, "read_only": 1, "use_padding": 0, "REPEAT": 48, "time": 1.698643167813619, "times": [1.7315839529037476, 1.6895999908447266, 1.686527967453003, 1.6855039596557617, 1.6855039596557617, 1.6855039596557617, 1.684607982635498, 1.6855039596557617, 1.686527967453003, 1.6855039596557617, 1.6834559440612793, 1.6855039596557617, 1.6844799518585205, 1.685472011566162, 1.6895999908447266, 1.6998399496078491, 1.6998399496078491, 1.6998399496078491, 1.698815941810608, 1.700767993927002, 1.698815941810608, 1.7008639574050903, 1.6998399496078491, 1.6998080015182495, 1.6998399496078491, 1.6998399496078491, 1.7285120487213135, 1.7326079607009888, 1.7336000204086304, 1.7315839529037476], "compile_time": 1920.1406291685998, "verification_time": 0, "benchmark_time": 52.10879724472761, "GFLOP/s": 5708.809849970807, "strategy_time": 0, "framework_time": 1.4427104033529758, "timestamp": "2024-01-16 14:11:21.656102+00:00"},
"64,2,1,4,1,0,49": {"block_size_x": 64, "block_size_y": 2, "tile_size_x": 1, "tile_size_y": 4, "read_only": 1, "use_padding": 0, "REPEAT": 49, "time": 1.701199968655904, "times": [1.73363196849823, 1.6895999908447266, 1.6855039596557617, 1.686527967453003, 1.6864320039749146, 1.686527967453003, 1.6855039596557617, 1.685472011566162, 1.686527967453003, 1.6844799518585205, 1.6855039596557617, 1.686527967453003, 1.6844799518585205, 1.6844799518585205, 1.6844799518585205, 1.6855039596557617, 1.6947200298309326, 1.716223955154419, 1.7172479629516602, 1.7172479629516602, 1.7172479629516602, 1.716223955154419, 1.7172479629516602, 1.716223955154419, 1.7172479629516602, 1.7172479629516602, 1.7172479629516602, 1.7171839475631714, 1.7172479629516602, 1.716256022453308], "compile_time": 1922.1607008948922, "verification_time": 0, "benchmark_time": 52.5741190649569, "GFLOP/s": 5700.229853437898, "strategy_time": 0, "framework_time": 1.4053522609174252, "timestamp": "2024-01-16 14:11:23.632273+00:00"},
"64,2,1,4,1,0,50": {"block_size_x": 64, "block_size_y": 2, "tile_size_x": 1, "tile_size_y": 4, "read_only": 1, "use_padding": 0, "REPEAT": 50, "time": 1.7015477021535237, "times": [1.7356799840927124, 1.691648006439209, 1.6855039596557617, 1.686527967453003, 1.6855039596557617, 1.686527967453003, 1.6844799518585205, 1.6855039596557617, 1.6855039596557617, 1.6844799518585205, 1.6855039596557617, 1.6936960220336914, 1.6844799518585205, 1.6855039596557617, 1.6855039596557617, 1.6844799518585205, 1.69977605342865, 1.7163200378417969, 1.716223955154419, 1.716223955154419, 1.716223955154419, 1.7172479629516602, 1.7172479629516602, 1.716223955154419, 1.7172479629516602, 1.716223955154419, 1.716223955154419, 1.7172479629516602, 1.7172479629516602, 1.716223955154419], "compile_time": 1925.3997458145022, "verification_time": 0, "benchmark_time": 52.61164903640747, "GFLOP/s": 5699.064937014065, "strategy_time": 0, "framework_time": 1.3459501788020134, "timestamp": "2024-01-16 14:11:25.611660+00:00"},
"64,2,1,4,1,0,51": {"block_size_x": 64, "block_size_y": 2, "tile_size_x": 1, "tile_size_y": 4, "read_only": 1, "use_padding": 0, "REPEAT": 51, "time": 1.698745568593343, "times": [1.7326079607009888, 1.6895999908447266, 1.686527967453003, 1.686527967453003, 1.6844799518585205, 1.6855039596557617, 1.6855039596557617, 1.6855039596557617, 1.6855679750442505, 1.6855039596557617, 1.6855039596557617, 1.6855360269546509, 1.6844799518585205, 1.6855039596557617, 1.6845120191574097, 1.6854079961776733, 1.6844799518585205, 1.6855039596557617, 1.6875519752502441, 1.7172479629516602, 1.716223955154419, 1.716223955154419, 1.7172479629516602, 1.716223955154419, 1.718176007270813, 1.7172479629516602, 1.7172479629516602, 1.716223955154419, 1.7172479629516602, 1.7172479629516602], "compile_time": 1921.618946827948, "verification_time": 0, "benchmark_time": 52.466386929154396, "GFLOP/s": 5708.465721579397, "strategy_time": 0, "framework_time": 1.3839011080563068, "timestamp": "2024-01-16 14:11:27.587160+00:00"},
"64,2,1,4,1,0,52": {"block_size_x": 64, "block_size_y": 2, "tile_size_x": 1, "tile_size_y": 4, "read_only": 1, "use_padding": 0, "REPEAT": 52, "time": 1.6989023725191752, "times": [1.7324800491333008, 1.6895999908447266, 1.686527967453003, 1.686527967453003, 1.6855039596557617, 1.686400055885315, 1.6855039596557617, 1.686527967453003, 1.6855039596557617, 1.6855039596557617, 1.6855039596557617, 1.6855039596557617, 1.686527967453003, 1.6855039596557617, 1.685439944267273, 1.686527967453003, 1.6855039596557617, 1.6875519752502441, 1.6844799518585205, 1.7131520509719849, 1.7172479629516602, 1.7192959785461426, 1.7171519994735718, 1.7172479629516602, 1.716223955154419, 1.716223955154419, 1.7171839475631714, 1.7172479629516602, 1.7172479629516602, 1.716223955154419], "compile_time": 1764.9389118887484, "verification_time": 0, "benchmark_time": 52.46052565053105, "GFLOP/s": 5707.938846197914, "strategy_time": 0, "framework_time": 1.3432754203677177, "timestamp": "2024-01-16 14:11:29.405939+00:00"},
"64,2,1,4,1,0,53": {"block_size_x": 64, "block_size_y": 2, "tile_size_x": 1, "tile_size_y": 4, "read_only": 1, "use_padding": 0, "REPEAT": 53, "time": 1.7013749043146769, "times": [1.7376320362091064, 1.691648006439209, 1.686527967453003, 1.686527967453003, 1.6855039596557617, 1.6855039596557617, 1.6855039596557617, 1.686527967453003, 1.6855039596557617, 1.6855039596557617, 1.686527967453003, 1.6895999908447266, 1.6844799518585205, 1.6855039596557617, 1.6855039596557617, 1.6895999908447266, 1.6855039596557617, 1.708191990852356, 1.7172479629516602, 1.7172479629516602, 1.7172479629516602, 1.716223955154419, 1.7172479629516602, 1.7203199863433838, 1.7172160148620605, 1.7172479629516602, 1.7172479629516602, 1.7172479629516602, 1.7192319631576538, 1.716223955154419], "compile_time": 1708.765652962029, "verification_time": 0, "benchmark_time": 52.570100873708725, "GFLOP/s": 5699.643754829039, "strategy_time": 0, "framework_time": 1.4118649996817112, "timestamp": "2024-01-16 14:11:31.168717+00:00"},
"64,2,1,4,1,0,54": {"block_size_x": 64, "block_size_y": 2, "tile_size_x": 1, "tile_size_y": 4, "read_only": 1, "use_padding": 0, "REPEAT": 54, "time": 1.7013983686765035, "times": [1.7326079607009888, 1.6906239986419678, 1.6855039596557617, 1.686527967453003, 1.6855039596557617, 1.6855039596557617, 1.6855039596557617, 1.6855039596557617, 1.686527967453003, 1.6844799518585205, 1.6844799518585205, 1.6855039596557617, 1.6855039596557617, 1.6844799518585205, 1.6855039596557617, 1.6855039596557617, 1.7131199836730957, 1.7172479629516602, 1.716223955154419, 1.716223955154419, 1.7172479629516602, 1.7151999473571777, 1.7172479629516602, 1.7172479629516602, 1.7171200513839722, 1.716223955154419, 1.7181440591812134, 1.7172479629516602, 1.7131199836730957, 1.7110719680786133], "compile_time": 1927.232398185879, "verification_time": 0, "benchmark_time": 52.593475207686424, "GFLOP/s": 5699.565149779328, "strategy_time": 0, "framework_time": 1.4740093611180782, "timestamp": "2024-01-16 14:11:33.150048+00:00"},
"64,2,1,4,1,0,55": {"block_size_x": 64, "block_size_y": 2, "tile_size_x": 1, "tile_size_y": 4, "read_only": 1, "use_padding": 0, "REPEAT": 55, "time": 1.6993183692296345, "times": [1.7326079607009888, 1.6905920505523682, 1.686527967453003, 1.686527967453003, 1.6855039596557617, 1.6855039596557617, 1.686527967453003, 1.6874879598617554, 1.686527967453003, 1.6844799518585205, 1.6855039596557617, 1.686527967453003, 1.6844799518585205, 1.6855039596557617, 1.6855039596557617, 1.6864320039749146, 1.6844799518585205, 1.6855039596557617, 1.6895999908447266, 1.716223955154419, 1.7172479629516602, 1.7233920097351074, 1.7172479629516602, 1.7172479629516602, 1.7172479629516602, 1.716223955154419, 1.718176007270813, 1.7172479629516602, 1.7172479629516602, 1.716223955154419], "compile_time": 1920.7963468506932, "verification_time": 0, "benchmark_time": 52.49097291380167, "GFLOP/s": 5706.541530764552, "strategy_time": 0, "framework_time": 1.5165391378104687, "timestamp": "2024-01-16 14:11:35.124883+00:00"},
"64,2,1,4,1,0,56": {"block_size_x": 64, "block_size_y": 2, "tile_size_x": 1, "tile_size_y": 4, "read_only": 1, "use_padding": 0, "REPEAT": 56, "time": 1.7002111673355103, "times": [1.7315839529037476, 1.6895999908447266, 1.6855039596557617, 1.6895999908447266, 1.685472011566162, 1.6855039596557617, 1.683519959449768, 1.6844799518585205, 1.6855039596557617, 1.6844799518585205, 1.6855039596557617, 1.6864639520645142, 1.6855039596557617, 1.6844799518585205, 1.6885759830474854, 1.6844799518585205, 1.6854079961776733, 1.6987520456314087, 1.7151999473571777, 1.7162879705429077, 1.7172479629516602, 1.7172479629516602, 1.7172479629516602, 1.7172479629516602, 1.7172479629516602, 1.716223955154419, 1.7192959785461426, 1.716223955154419, 1.716223955154419, 1.716223955154419], "compile_time": 1767.4526581540704, "verification_time": 0, "benchmark_time": 52.53088800236583, "GFLOP/s": 5703.544968003614, "strategy_time": 0, "framework_time": 1.3276860117912292, "timestamp": "2024-01-16 14:11:36.946226+00:00"},
"64,2,1,4,1,0,57": {"block_size_x": 64, "block_size_y": 2, "tile_size_x": 1, "tile_size_y": 4, "read_only": 1, "use_padding": 0, "REPEAT": 57, "time": 1.7003114382425943, "times": [1.73363196849823, 1.6916160583496094, 1.686527967453003, 1.6855039596557617, 1.6855039596557617, 1.6855039596557617, 1.685472011566162, 1.6855039596557617, 1.6875519752502441, 1.6855039596557617, 1.6844799518585205, 1.6855039596557617, 1.6855039596557617, 1.6855039596557617, 1.686400055885315, 1.6844799518585205, 1.6855039596557617, 1.686527967453003, 1.7172479629516602, 1.7172479629516602, 1.7182719707489014, 1.716223955154419, 1.7254400253295898, 1.7172479629516602, 1.7182719707489014, 1.716223955154419, 1.7172479629516602, 1.716223955154419, 1.7172479629516602, 1.716223955154419], "compile_time": 1925.0870812684298, "verification_time": 0, "benchmark_time": 52.55811894312501, "GFLOP/s": 5703.208618076964, "strategy_time": 0, "framework_time": 1.37270987033844, "timestamp": "2024-01-16 14:11:38.925275+00:00"},
