kernels/outputdata/variable_clock_size-4096/original_tuning/convolution_NVIDIA_RTX_A4000_cache.json
{
"device_name": "NVIDIA RTX A4000",
"kernel_name": "convolution_kernel",
"problem_size": [
4096,
4096
],
"tune_params_keys": [
"block_size_x",
"block_size_y",
"tile_size_x",
"tile_size_y",
"read_only",
"use_padding"
],
"tune_params": {
"block_size_x": [
16,
32,
48,
64,
80,
96,
112,
128,
144,
160,
176,
192,
208,
224,
240,
256
],
"block_size_y": [
1,
2,
4,
8,
16
],
"tile_size_x": [
1,
2,
3,
4
],
"tile_size_y": [
1,
2,
3,
4
],
"read_only": [
0,
1
],
"use_padding": [
0,
1
]
},
"objective": "time",
"cache": {
"16,1,1,1,0,0": {"block_size_x": 16, "block_size_y": 1, "tile_size_x": 1, "tile_size_y": 1, "read_only": 0, "use_padding": 0, "time": 10.163734499613444, "times": [10.232799530029297, 10.22976016998291, 10.22976016998291, 10.223584175109863, 10.22976016998291, 10.23078441619873, 10.189920425415039, 10.165247917175293, 10.143744468688965, 10.145792007446289, 10.145792007446289, 10.13862419128418, 10.145792007446289, 10.142720222473145, 10.147839546203613, 10.14566421508789, 10.141695976257324, 10.14470386505127, 10.142656326293945, 10.144767761230469, 10.14367961883545, 10.148863792419434, 10.148863792419434, 10.143744468688965, 10.143744468688965, 10.143744468688965, 10.145792007446289, 10.14572811126709, 10.142720222473145, 10.143744468688965], "compile_time": 0.18154969438910484, "verification_time": 0, "benchmark_time": 306.04699486866593, "GFLOP/s": 954.1011572438078, "strategy_time": 0, "framework_time": 112.09353152662516, "timestamp": "2024-01-16 12:08:45.810768+00:00"},
"16,1,1,1,0,1": {"block_size_x": 16, "block_size_y": 1, "tile_size_x": 1, "tile_size_y": 1, "read_only": 0, "use_padding": 1, "time": 10.247851753234864, "times": [9.752575874328613, 9.740287780761719, 9.768959999084473, 10.359807968139648, 10.382335662841797, 10.482815742492676, 10.44591999053955, 10.356736183166504, 10.357760429382324, 10.356736183166504, 10.34444808959961, 10.266624450683594, 10.268671989440918, 10.267680168151855, 10.259455680847168, 10.264575958251953, 10.266624450683594, 10.268671989440918, 10.259391784667969, 10.266624450683594, 10.261504173278809, 10.265600204467773, 10.267647743225098, 10.272768020629883, 10.268671989440918, 10.267647743225098, 10.277728080749512, 10.272768020629883, 10.271743774414062, 10.272768020629883], "compile_time": 1373.1542630121112, "verification_time": 0, "benchmark_time": 309.13843493908644, "GFLOP/s": 946.2696262110687, "strategy_time": 0, "framework_time": 1.5715621411800385, "timestamp": "2024-01-16 12:08:47.494668+00:00"},
"16,1,1,1,1,0": {"block_size_x": 16, "block_size_y": 1, "tile_size_x": 1, "tile_size_y": 1, "read_only": 1, "use_padding": 0, "time": 10.274644152323406, "times": [9.863167762756348, 9.850879669189453, 9.848735809326172, 10.061823844909668, 10.439680099487305, 10.439680099487305, 10.441727638244629, 10.383359909057617, 10.306559562683105, 10.308608055114746, 10.31167984008789, 10.316800117492676, 10.314751625061035, 10.312704086303711, 10.315775871276855, 10.312704086303711, 10.313728332519531, 10.316864013671875, 10.316800117492676, 10.312704086303711, 10.314751625061035, 10.314751625061035, 10.312735557556152, 10.313759803771973, 10.314751625061035, 10.314751625061035, 10.315711975097656, 10.315775871276855, 10.315775871276855, 10.317824363708496], "compile_time": 1221.2588828988373, "verification_time": 0, "benchmark_time": 309.8989683203399, "GFLOP/s": 943.8021117069213, "strategy_time": 0, "framework_time": 1.4025778509676456, "timestamp": "2024-01-16 12:08:49.027262+00:00"},
"16,1,1,1,1,1": {"block_size_x": 16, "block_size_y": 1, "tile_size_x": 1, "tile_size_y": 1, "read_only": 1, "use_padding": 1, "time": 10.508222929636638, "times": [10.070015907287598, 10.055680274963379, 10.368000030517578, 10.656767845153809, 10.613759994506836, 10.585087776184082, 10.584063529968262, 10.587136268615723, 10.55129623413086, 10.52569580078125, 10.53286361694336, 10.531840324401855, 10.530816078186035, 10.53388786315918, 10.532959938049316, 10.529791831970215, 10.53388786315918, 10.53388786315918, 10.530783653259277, 10.530816078186035, 10.533856391906738, 10.531840324401855, 10.53286361694336, 10.53286361694336, 10.5348482131958, 10.532992362976074, 10.53286361694336, 10.529824256896973, 10.533856391906738, 10.531840324401855], "compile_time": 1079.3384239077568, "verification_time": 0, "benchmark_time": 316.7719100601971, "GFLOP/s": 922.8230989133878, "strategy_time": 0, "framework_time": 1.0883468203246593, "timestamp": "2024-01-16 12:08:50.424490+00:00"},
"16,1,1,2,0,0": {"block_size_x": 16, "block_size_y": 1, "tile_size_x": 1, "tile_size_y": 2, "read_only": 0, "use_padding": 0, "time": 5.6143466631571455, "times": [5.235712051391602, 5.223423957824707, 5.224448204040527, 5.25219202041626, 5.304319858551025, 5.3051838874816895, 5.303296089172363, 5.62278413772583, 5.796864032745361, 5.795839786529541, 5.815296173095703, 5.818272113800049, 5.793791770935059, 5.793791770935059, 5.719168186187744, 5.695487976074219, 5.692416191101074, 5.694431781768799, 5.695487976074219, 5.692319869995117, 5.693439960479736, 5.693439960479736, 5.696512222290039, 5.699584007263184, 5.695487976074219, 5.696479797363281, 5.696512222290039, 5.695487976074219, 5.695487976074219, 5.693439960479736], "compile_time": 1207.3951098136604, "verification_time": 0, "benchmark_time": 169.7831992059946, "GFLOP/s": 1727.2233849818786, "strategy_time": 0, "framework_time": 1.41427805647254, "timestamp": "2024-01-16 12:08:51.803111+00:00"},
"16,1,1,2,0,1": {"block_size_x": 16, "block_size_y": 1, "tile_size_x": 1, "tile_size_y": 2, "read_only": 0, "use_padding": 1, "time": 5.684833097457886, "times": [5.263360023498535, 5.251071929931641, 5.252096176147461, 5.254303932189941, 5.2551679611206055, 5.784575939178467, 5.916704177856445, 5.916543960571289, 5.883903980255127, 5.832704067230225, 5.830656051635742, 5.831679821014404, 5.788671970367432, 5.77126407623291, 5.774335861206055, 5.764959812164307, 5.725183963775635, 5.724160194396973, 5.724160194396973, 5.726208209991455, 5.727231979370117, 5.726208209991455, 5.727200031280518, 5.7292799949646, 5.731296062469482, 5.727231979370117, 5.726208209991455, 5.724160194396973, 5.727231979370117, 5.727231979370117], "compile_time": 920.1964233070612, "verification_time": 0, "benchmark_time": 172.05492313951254, "GFLOP/s": 1705.8074848910442, "strategy_time": 0, "framework_time": 1.1244169436395168, "timestamp": "2024-01-16 12:08:52.896518+00:00"},
"16,1,1,2,1,0": {"block_size_x": 16, "block_size_y": 1, "tile_size_x": 1, "tile_size_y": 2, "read_only": 1, "use_padding": 0, "time": 5.640999428431193, "times": [5.250944137573242, 5.236735820770264, 5.238783836364746, 5.236735820770264, 5.235712051391602, 5.233695983886719, 5.481472015380859, 5.891071796417236, 5.893119812011719, 5.895167827606201, 5.812096118927002, 5.807104110717773, 5.809152126312256, 5.792863845825195, 5.751808166503906, 5.750783920288086, 5.749728202819824, 5.705728054046631, 5.701632022857666, 5.705728054046631, 5.704639911651611, 5.702655792236328, 5.701632022857666, 5.705728054046631, 5.706751823425293, 5.7066240310668945, 5.705728054046631, 5.7047038078308105, 5.706751823425293, 5.7047038078308105], "compile_time": 919.1253278404474, "verification_time": 0, "benchmark_time": 170.42454984039068, "GFLOP/s": 1719.062547520392, "strategy_time": 0, "framework_time": 1.138521358370781, "timestamp": "2024-01-16 12:08:53.987234+00:00"},
"16,1,1,2,1,1": {"block_size_x": 16, "block_size_y": 1, "tile_size_x": 1, "tile_size_y": 2, "read_only": 1, "use_padding": 1, "time": 5.66826982498169, "times": [5.271552085876465, 5.256192207336426, 5.257215976715088, 5.258272171020508, 5.537792205810547, 5.5695037841796875, 5.570559978485107, 5.648384094238281, 5.829535961151123, 5.835775852203369, 5.832704067230225, 5.816319942474365, 5.8089919090271, 5.806079864501953, 5.784575939178467, 5.737472057342529, 5.730303764343262, 5.730303764343262, 5.730175971984863, 5.734399795532227, 5.727231979370117, 5.731328010559082, 5.732255935668945, 5.727231979370117, 5.731328010559082, 5.732351779937744, 5.732351779937744, 5.7333760261535645, 5.727295875549316, 5.727231979370117], "compile_time": 920.7611209712923, "verification_time": 0, "benchmark_time": 171.56307213008404, "GFLOP/s": 1710.7920313287707, "strategy_time": 0, "framework_time": 1.3038222678005695, "timestamp": "2024-01-16 12:08:55.080890+00:00"},
"16,1,1,3,0,0": {"block_size_x": 16, "block_size_y": 1, "tile_size_x": 1, "tile_size_y": 3, "read_only": 0, "use_padding": 0, "time": 4.312255970637003, "times": [3.9340479373931885, 3.926016092300415, 3.9331839084625244, 3.9229440689086914, 3.9239680767059326, 3.924992084503174, 3.92192006111145, 3.9239680767059326, 4.031487941741943, 4.550816059112549, 4.55782413482666, 4.552703857421875, 4.552608013153076, 4.5352959632873535, 4.5352959632873535, 4.531167984008789, 4.525055885314941, 4.505472183227539, 4.427775859832764, 4.427775859832764, 4.420608043670654, 4.425727844238281, 4.420608043670654, 4.4245758056640625, 4.422656059265137, 4.420608043670654, 4.419583797454834, 4.421631813049316, 4.421631813049316, 4.425727844238281], "compile_time": 1033.9113408699632, "verification_time": 0, "benchmark_time": 130.79628627747297, "GFLOP/s": 2248.760489644016, "strategy_time": 0, "framework_time": 1.2046964839100838, "timestamp": "2024-01-16 12:08:56.246828+00:00"},
"16,1,1,3,0,1": {"block_size_x": 16, "block_size_y": 1, "tile_size_x": 1, "tile_size_y": 3, "read_only": 0, "use_padding": 1, "time": 4.3571167627970375, "times": [3.9976959228515625, 3.9772160053253174, 3.981247901916504, 3.9782400131225586, 3.9772160053253174, 4.206592082977295, 4.274144172668457, 4.267007827758789, 4.275199890136719, 4.272128105163574, 4.495359897613525, 4.501503944396973, 4.49945592880249, 4.5004801750183105, 4.503551959991455, 4.502528190612793, 4.493311882019043, 4.501503944396973, 4.489215850830078, 4.456448078155518, 4.45747184753418, 4.456448078155518, 4.45747184753418, 4.455423831939697, 4.45747184753418, 4.45030403137207, 4.452352046966553, 4.455423831939697, 4.463615894317627, 4.45747184753418], "compile_time": 1021.1129640229046, "verification_time": 0, "benchmark_time": 131.90698716789484, "GFLOP/s": 2225.607293979171, "strategy_time": 0, "framework_time": 1.0623889975249767, "timestamp": "2024-01-16 12:08:57.400935+00:00"},
"16,1,1,3,1,0": {"block_size_x": 16, "block_size_y": 1, "tile_size_x": 1, "tile_size_y": 3, "read_only": 1, "use_padding": 0, "time": 4.273823960622152, "times": [3.879807949066162, 3.8645761013031006, 3.8707199096679688, 3.872767925262451, 3.8707199096679688, 3.8595199584960938, 3.8696959018707275, 4.011007785797119, 4.494336128234863, 4.5004801750183105, 4.49945592880249, 4.493311882019043, 4.476928234100342, 4.476928234100342, 4.474815845489502, 4.472799777984619, 4.448256015777588, 4.384768009185791, 4.362271785736084, 4.369408130645752, 4.366335868835449, 4.363135814666748, 4.363264083862305, 4.371391773223877, 4.371456146240234, 4.370431900024414, 4.366335868835449, 4.364287853240967, 4.3581438064575195, 4.3673601150512695], "compile_time": 1018.007286824286, "verification_time": 0, "benchmark_time": 129.44246223196387, "GFLOP/s": 2268.982283160851, "strategy_time": 0, "framework_time": 1.0988968424499035, "timestamp": "2024-01-16 12:08:58.549508+00:00"},
"16,1,1,3,1,1": {"block_size_x": 16, "block_size_y": 1, "tile_size_x": 1, "tile_size_y": 3, "read_only": 1, "use_padding": 1, "time": 4.286168511708578, "times": [3.940351963043213, 3.920896053314209, 3.9289278984069824, 3.931135892868042, 3.97107195854187, 3.989504098892212, 3.9823360443115234, 3.9780800342559814, 3.980288028717041, 4.100096225738525, 4.488192081451416, 4.484096050262451, 4.484096050262451, 4.482048034667969, 4.482048034667969, 4.481023788452148, 4.485983848571777, 4.482048034667969, 4.459519863128662, 4.435967922210693, 4.436992168426514, 4.440063953399658, 4.435967922210693, 4.4021759033203125, 4.4000959396362305, 4.40012788772583, 4.393856048583984, 4.398079872131348, 4.401279926300049, 4.3887038230896], "compile_time": 1021.2487480603158, "verification_time": 0, "benchmark_time": 129.78724716231227, "GFLOP/s": 2262.4474099676577, "strategy_time": 0, "framework_time": 1.0458878241479397, "timestamp": "2024-01-16 12:08:59.701615+00:00"},
"16,1,1,4,0,0": {"block_size_x": 16, "block_size_y": 1, "tile_size_x": 1, "tile_size_y": 4, "read_only": 0, "use_padding": 0, "time": 3.362493896484375, "times": [3.0566399097442627, 3.043328046798706, 3.0452160835266113, 3.045248031616211, 3.0443520545959473, 3.0442559719085693, 3.0443520545959473, 3.292191982269287, 3.427328109741211, 3.4283199310302734, 3.427328109741211, 3.427328109741211, 3.4252800941467285, 3.5051519870758057, 3.521536111831665, 3.5246078968048096, 3.525631904602051, 3.525631904602051, 3.5143680572509766, 3.487744092941284, 3.4856960773468018, 3.482624053955078, 3.483583927154541, 3.4846720695495605, 3.463167905807495, 3.428352117538452, 3.422208070755005, 3.422208070755005, 3.423232078552246, 3.423232078552246], "compile_time": 1103.9285347796977, "verification_time": 0, "benchmark_time": 102.79388632625341, "GFLOP/s": 2883.9400595310676, "strategy_time": 0, "framework_time": 1.0340455919504166, "timestamp": "2024-01-16 12:09:00.909396+00:00"},
"16,1,1,4,0,1": {"block_size_x": 16, "block_size_y": 1, "tile_size_x": 1, "tile_size_y": 4, "read_only": 0, "use_padding": 1, "time": 3.394233552614848, "times": [3.066879987716675, 3.0545918941497803, 3.0565121173858643, 3.0545918941497803, 3.0536000728607178, 3.057663917541504, 3.0556159019470215, 3.0556159019470215, 3.0554559230804443, 3.132352113723755, 3.5870718955993652, 3.586047887802124, 3.586047887802124, 3.5891199111938477, 3.586047887802124, 3.628959894180298, 3.655679941177368, 3.6555519104003906, 3.6526401042938232, 3.65664005279541, 3.631103992462158, 3.511296033859253, 3.4959359169006348, 3.4949119091033936, 3.4938879013061523, 3.4949119091033936, 3.4836480617523193, 3.4652159214019775, 3.4662399291992188, 3.463167905807495], "compile_time": 1107.730865944177, "verification_time": 0, "benchmark_time": 103.2050158828497, "GFLOP/s": 2856.9721846422303, "strategy_time": 0, "framework_time": 1.3092909939587116, "timestamp": "2024-01-16 12:09:02.121665+00:00"},
"16,1,1,4,1,0": {"block_size_x": 16, "block_size_y": 1, "tile_size_x": 1, "tile_size_y": 4, "read_only": 1, "use_padding": 0, "time": 3.3646922588348387, "times": [3.0955519676208496, 3.0853118896484375, 3.082240104675293, 3.081183910369873, 3.083199977874756, 3.082240104675293, 3.180543899536133, 3.265536069869995, 3.2675840854644775, 3.2634880542755127, 3.2634880542755127, 3.2624640464782715, 3.412992000579834, 3.5543038845062256, 3.556351900100708, 3.5532801151275635, 3.5583999156951904, 3.556351900100708, 3.5082240104675293, 3.4929919242858887, 3.490816116333008, 3.496959924697876, 3.4887681007385254, 3.4846720695495605, 3.4611198902130127, 3.463167905807495, 3.462143898010254, 3.4590721130371094, 3.463167905807495, 3.4651520252227783], "compile_time": 1105.9052371419966, "verification_time": 0, "benchmark_time": 102.17283293604851, "GFLOP/s": 2882.0558024400307, "strategy_time": 0, "framework_time": 1.004870980978012, "timestamp": "2024-01-16 12:09:03.330772+00:00"},
"16,1,1,4,1,1": {"block_size_x": 16, "block_size_y": 1, "tile_size_x": 1, "tile_size_y": 4, "read_only": 1, "use_padding": 1, "time": 3.423817578951518, "times": [3.088383913040161, 3.0914559364318848, 3.0945279598236084, 3.0904319286346436, 3.0853118896484375, 3.092479944229126, 3.093503952026367, 3.0844480991363525, 3.088383913040161, 3.1928319931030273, 3.6024320125579834, 3.5973119735717773, 3.595263957977295, 3.595263957977295, 3.5973119735717773, 3.6956160068511963, 3.6812798976898193, 3.6833279132843018, 3.694591999053955, 3.6771841049194336, 3.640320062637329, 3.5532801151275635, 3.557375907897949, 3.5696640014648438, 3.556351900100708, 3.560447931289673, 3.4795520305633545, 3.4549760818481445, 3.452928066253662, 3.468287944793701], "compile_time": 1105.9658001177013, "verification_time": 0, "benchmark_time": 103.96624123677611, "GFLOP/s": 2832.2860737719566, "strategy_time": 0, "framework_time": 0.9911865927278996, "timestamp": "2024-01-16 12:09:04.541720+00:00"},
"16,1,2,1,0,0": {"block_size_x": 16, "block_size_y": 1, "tile_size_x": 2, "tile_size_y": 1, "read_only": 0, "use_padding": 0, "time": 8.184836212793986, "times": [7.666528224945068, 7.654399871826172, 7.6523518562316895, 7.6523518562316895, 8.254303932189941, 8.39577579498291, 8.437760353088379, 8.498175621032715, 8.492032051086426, 8.39680004119873, 8.39782428741455, 8.281087875366211, 8.20736026763916, 8.208383560180664, 8.208383560180664, 8.209280014038086, 8.209312438964844, 8.208383560180664, 8.208224296569824, 8.208383560180664, 8.210432052612305, 8.210432052612305, 8.209407806396484, 8.209280014038086, 8.209407806396484, 8.209407806396484, 8.209407806396484, 8.209407806396484, 8.210432052612305, 8.210368156433105], "compile_time": 1552.6661607436836, "verification_time": 0, "benchmark_time": 247.0085909590125, "GFLOP/s": 1184.7800732825833, "strategy_time": 0, "framework_time": 0.9817793034017086, "timestamp": "2024-01-16 12:09:06.342401+00:00"},
"16,1,2,1,0,1": {"block_size_x": 16, "block_size_y": 1, "tile_size_x": 2, "tile_size_y": 1, "read_only": 0, "use_padding": 1, "time": 8.163352441787719, "times": [7.664639949798584, 7.654399871826172, 7.6523518562316895, 7.878655910491943, 8.395711898803711, 8.39782428741455, 8.301535606384277, 8.28825569152832, 8.263680458068848, 8.208383560180664, 8.209407806396484, 8.209407806396484, 8.20736026763916, 8.209407806396484, 8.210432052612305, 8.208383560180664, 8.209407806396484, 8.209407806396484, 8.209407806396484, 8.210432052612305, 8.20736026763916, 8.210432052612305, 8.21241569519043, 8.210432052612305, 8.209407806396484, 8.210432052612305, 8.209407806396484, 8.210432052612305, 8.210432052612305, 8.21132755279541], "compile_time": 1575.1457097940147, "verification_time": 0, "benchmark_time": 246.42647104337811, "GFLOP/s": 1187.8980991143353, "strategy_time": 0, "framework_time": 1.1043380945920944, "timestamp": "2024-01-16 12:09:08.165102+00:00"},
"16,1,2,1,1,0": {"block_size_x": 16, "block_size_y": 1, "tile_size_x": 2, "tile_size_y": 1, "read_only": 1, "use_padding": 0, "time": 8.142160987854004, "times": [7.666687965393066, 7.655424118041992, 7.653567790985107, 7.6545281410217285, 8.09062385559082, 8.279040336608887, 8.28006362915039, 8.279935836791992, 8.28006362915039, 8.2227201461792, 8.209407806396484, 8.209407806396484, 8.209407806396484, 8.210432052612305, 8.210432052612305, 8.210399627685547, 8.208383560180664, 8.210335731506348, 8.210432052612305, 8.211392402648926, 8.210271835327148, 8.210432052612305, 8.211456298828125, 8.210432052612305, 8.209247589111328, 8.210495948791504, 8.209407806396484, 8.210432052612305, 8.209535598754883, 8.210432052612305], "compile_time": 1586.6975616663694, "verification_time": 0, "benchmark_time": 245.79294491559267, "GFLOP/s": 1190.9898198360063, "strategy_time": 0, "framework_time": 1.0543754324316978, "timestamp": "2024-01-16 12:09:09.998671+00:00"},
"16,1,2,1,1,1": {"block_size_x": 16, "block_size_y": 1, "tile_size_x": 2, "tile_size_y": 1, "read_only": 1, "use_padding": 1, "time": 8.151128466924032, "times": [7.665664196014404, 7.654240131378174, 7.65337610244751, 7.654335975646973, 7.971776008605957, 8.39782428741455, 8.39680004119873, 8.28825569152832, 8.28825569152832, 8.267775535583496, 8.254528045654297, 8.255488395690918, 8.216575622558594, 8.209407806396484, 8.208383560180664, 8.210432052612305, 8.209407806396484, 8.210432052612305, 8.209407806396484, 8.210271835327148, 8.210432052612305, 8.209407806396484, 8.208383560180664, 8.209407806396484, 8.211456298828125, 8.210432052612305, 8.209407806396484, 8.211456298828125, 8.211423873901367, 8.209407806396484], "compile_time": 1590.850108768791, "verification_time": 0, "benchmark_time": 245.98911264911294, "GFLOP/s": 1189.679550181279, "strategy_time": 0, "framework_time": 1.0264026932418346, "timestamp": "2024-01-16 12:09:11.836562+00:00"},
"16,1,2,2,0,0": {"block_size_x": 16, "block_size_y": 1, "tile_size_x": 2, "tile_size_y": 2, "read_only": 0, "use_padding": 0, "time": 5.1080138206481935, "times": [5.233664035797119, 5.228544235229492, 5.221375942230225, 5.21727991104126, 5.144576072692871, 5.148575782775879, 5.147647857666016, 5.139455795288086, 5.141503810882568, 5.143551826477051, 5.149695873260498, 5.1466240882873535, 5.143551826477051, 5.140480041503906, 5.1465277671813965, 5.143551826477051, 5.1466240882873535, 5.140480041503906, 5.140480041503906, 5.141503810882568, 5.145599842071533, 5.1466240882873535, 5.145599842071533, 5.143551826477051, 5.147552013397217, 5.144576072692871, 5.084159851074219, 4.688896179199219, 4.696063995361328, 4.69209623336792], "compile_time": 1829.3979363515973, "verification_time": 0, "benchmark_time": 154.3614282272756, "GFLOP/s": 1898.4347318718585, "strategy_time": 0, "framework_time": 1.0496354661881924, "timestamp": "2024-01-16 12:09:13.821395+00:00"},
"16,1,2,2,0,1": {"block_size_x": 16, "block_size_y": 1, "tile_size_x": 2, "tile_size_y": 2, "read_only": 0, "use_padding": 1, "time": 5.1833813190460205, "times": [5.232639789581299, 5.230591773986816, 5.2254719734191895, 5.2203521728515625, 5.213024139404297, 5.223455905914307, 5.215231895446777, 5.224448204040527, 5.228544235229492, 5.22649621963501, 5.223423957824707, 5.223423957824707, 5.223423957824707, 5.21727991104126, 5.230591773986816, 5.158912181854248, 5.142528057098389, 5.142528057098389, 5.145567893981934, 5.140575885772705, 5.1374077796936035, 5.1374077796936035, 5.1466240882873535, 5.144576072692871, 5.139455795288086, 5.143551826477051, 5.140480041503906, 5.140480041503906, 5.136384010314941, 5.146560192108154], "compile_time": 1784.6997478045523, "verification_time": 0, "benchmark_time": 156.5890102647245, "GFLOP/s": 1870.831075531355, "strategy_time": 0, "framework_time": 1.226226333528757, "timestamp": "2024-01-16 12:09:15.763934+00:00"},
"16,1,2,2,1,0": {"block_size_x": 16, "block_size_y": 1, "tile_size_x": 2, "tile_size_y": 2, "read_only": 1, "use_padding": 0, "time": 4.88986029624939, "times": [4.280159950256348, 4.268032073974609, 4.267007827758789, 4.270080089569092, 4.329472064971924, 4.379648208618164, 4.379648208618164, 4.377600193023682, 4.405248165130615, 4.837376117706299, 4.800511837005615, 4.800511837005615, 4.796288013458252, 5.096447944641113, 5.212160110473633, 5.211264133453369, 5.213183879852295, 5.2111358642578125, 5.213183879852295, 5.21011209487915, 5.212160110473633, 5.213183879852295, 5.213183879852295, 5.212160110473633, 5.2151360511779785, 5.214208126068115, 5.213183879852295, 5.212160110473633, 5.2130560874938965, 5.21830415725708], "compile_time": 1779.865485150367, "verification_time": 0, "benchmark_time": 148.306870367378, "GFLOP/s": 1983.1304496445327, "strategy_time": 0, "framework_time": 1.1238735169172287, "timestamp": "2024-01-16 12:09:17.693255+00:00"},
"16,1,2,2,1,1": {"block_size_x": 16, "block_size_y": 1, "tile_size_x": 2, "tile_size_y": 2, "read_only": 1, "use_padding": 1, "time": 4.672796805699666, "times": [4.501471996307373, 4.493216037750244, 4.494336128234863, 4.493311882019043, 4.4912638664245605, 4.527103900909424, 4.720640182495117, 4.7226881980896, 4.721663951873779, 4.72057580947876, 4.71449613571167, 4.711359977722168, 4.716544151306152, 4.71449613571167, 4.716544151306152, 4.71449613571167, 4.715519905090332, 4.71347188949585, 4.715583801269531, 4.71347188949585, 4.716544151306152, 4.714335918426514, 4.71449613571167, 4.715519905090332, 4.713312149047852, 4.71449613571167, 4.716447830200195, 4.715424060821533, 4.71347188949585, 4.717599868774414], "compile_time": 1782.798278145492, "verification_time": 0, "benchmark_time": 141.1080276593566, "GFLOP/s": 2075.25198531461, "strategy_time": 0, "framework_time": 1.2130714021623135, "timestamp": "2024-01-16 12:09:19.618397+00:00"},
"16,1,2,3,0,0": {"block_size_x": 16, "block_size_y": 1, "tile_size_x": 2, "tile_size_y": 3, "read_only": 0, "use_padding": 0, "time": 3.7977664470672607, "times": [3.8143041133880615, 3.8000640869140625, 3.7939200401306152, 3.7990400791168213, 3.8010880947113037, 3.796992063522339, 3.79801607131958, 3.8010880947113037, 3.79801607131958, 3.7990400791168213, 3.7979838848114014, 3.7990400791168213, 3.8000640869140625, 3.800031900405884, 3.796992063522339, 3.8060801029205322, 3.79801607131958, 3.7950398921966553, 3.7939200401306152, 3.7939200401306152, 3.796992063522339, 3.7959680557250977, 3.7908480167388916, 3.791872024536133, 3.7939200401306152, 3.7939200401306152, 3.796992063522339, 3.7949440479278564, 3.79584002494812, 3.7990400791168213], "compile_time": 2002.3138020187616, "verification_time": 0, "benchmark_time": 115.40174670517445, "GFLOP/s": 2553.4036869193123, "strategy_time": 0, "framework_time": 1.2573744170367718, "timestamp": "2024-01-16 12:09:21.737395+00:00"},
"16,1,2,3,0,1": {"block_size_x": 16, "block_size_y": 1, "tile_size_x": 2, "tile_size_y": 3, "read_only": 0, "use_padding": 1, "time": 3.7999243338902793, "times": [3.813375949859619, 3.79801607131958, 3.7990400791168213, 3.800031900405884, 3.7959680557250977, 3.7959680557250977, 3.7949440479278564, 3.802112102508545, 3.79801607131958, 3.8000640869140625, 3.802112102508545, 3.8000640869140625, 3.8000640869140625, 3.79801607131958, 3.8000640869140625, 3.8000640869140625, 3.8010239601135254, 3.8041601181030273, 3.803136110305786, 3.7990400791168213, 3.796992063522339, 3.796992063522339, 3.8010880947113037, 3.796992063522339, 3.7990400791168213, 3.79801607131958, 3.802112102508545, 3.7990400791168213, 3.8000640869140625, 3.802112102508545], "compile_time": 1996.497097890824, "verification_time": 0, "benchmark_time": 115.36450777202845, "GFLOP/s": 2551.9536695806223, "strategy_time": 0, "framework_time": 1.3282066211104393, "timestamp": "2024-01-16 12:09:23.850608+00:00"},
"16,1,2,3,1,0": {"block_size_x": 16, "block_size_y": 1, "tile_size_x": 2, "tile_size_y": 3, "read_only": 1, "use_padding": 0, "time": 3.7523775657018024, "times": [3.7641279697418213, 3.7519359588623047, 3.7499520778656006, 3.752959966659546, 3.7499840259552, 3.7498879432678223, 3.752959966659546, 3.7498879432678223, 3.752959966659546, 3.748863935470581, 3.7550721168518066, 3.7519359588623047, 3.7550079822540283, 3.7519359588623047, 3.753983974456787, 3.752959966659546, 3.74783992767334, 3.752959966659546, 3.753983974456787, 3.756959915161133, 3.7498879432678223, 3.7498879432678223, 3.753983974456787, 3.7498879432678223, 3.7498879432678223, 3.753983974456787, 3.752863883972168, 3.7498879432678223, 3.752959966659546, 3.7519359588623047], "compile_time": 2000.4736259579659, "verification_time": 0, "benchmark_time": 113.79209207370877, "GFLOP/s": 2584.28974115944, "strategy_time": 0, "framework_time": 1.2456229887902737, "timestamp": "2024-01-16 12:09:25.966142+00:00"},
"16,1,2,3,1,1": {"block_size_x": 16, "block_size_y": 1, "tile_size_x": 2, "tile_size_y": 3, "read_only": 1, "use_padding": 1, "time": 3.7526879707972207, "times": [3.767296075820923, 3.753983974456787, 3.7509119510650635, 3.7519359588623047, 3.74783992767334, 3.7519359588623047, 3.753983974456787, 3.7509119510650635, 3.7550079822540283, 3.7498879432678223, 3.7570559978485107, 3.7550079822540283, 3.7509119510650635, 3.752959966659546, 3.752959966659546, 3.7550079822540283, 3.7498879432678223, 3.753983974456787, 3.74783992767334, 3.7509119510650635, 3.752959966659546, 3.752000093460083, 3.753983974456787, 3.7550079822540283, 3.7529280185699463, 3.7519359588623047, 3.752959966659546, 3.753983974456787, 3.748863935470581, 3.7457919120788574], "compile_time": 2008.061314933002, "verification_time": 0, "benchmark_time": 113.80574805662036, "GFLOP/s": 2584.0759805936973, "strategy_time": 0, "framework_time": 1.1121826246380806, "timestamp": "2024-01-16 12:09:28.089146+00:00"},
"16,1,2,4,0,0": {"block_size_x": 16, "block_size_y": 1, "tile_size_x": 2, "tile_size_y": 4, "read_only": 0, "use_padding": 0, "time": 3.8367082834243775, "times": [3.7101120948791504, 3.6966400146484375, 3.6956160068511963, 3.6966400146484375, 3.6966400146484375, 3.6966400146484375, 3.6976640224456787, 3.719167947769165, 3.8881280422210693, 3.8900160789489746, 3.8891520500183105, 3.8891520500183105, 3.8901760578155518, 3.889024019241333, 3.8901760578155518, 3.8901119232177734, 3.8891520500183105, 3.8891520500183105, 3.8840320110321045, 3.881983995437622, 3.883903980255127, 3.8830080032348633, 3.8828799724578857, 3.8840320110321045, 3.8830080032348633, 3.8830080032348633, 3.881983995437622, 3.8830080032348633, 3.8840320110321045, 3.8830080032348633], "compile_time": 1320.2980472706258, "verification_time": 0, "benchmark_time": 116.7493499815464, "GFLOP/s": 2527.4871404465835, "strategy_time": 0, "framework_time": 1.391666941344738, "timestamp": "2024-01-16 12:09:29.527609+00:00"},
"16,1,2,4,0,1": {"block_size_x": 16, "block_size_y": 1, "tile_size_x": 2, "tile_size_y": 4, "read_only": 0, "use_padding": 1, "time": 3.7920224189758303, "times": [3.46726393699646, 3.4560000896453857, 3.4549760818481445, 3.4558401107788086, 3.4560000896453857, 3.4569599628448486, 3.4549760818481445, 3.4560000896453857, 3.702591896057129, 3.9690239429473877, 3.9526400566101074, 3.9526400566101074, 3.9526400566101074, 3.9526400566101074, 3.9536640644073486, 3.951616048812866, 3.9526400566101074, 3.9526400566101074, 3.9372799396514893, 3.9178879261016846, 3.916735887527466, 3.916800022125244, 3.9167680740356445, 3.906559944152832, 3.881983995437622, 3.8828799724578857, 3.8830080032348633, 3.8829760551452637, 3.8830080032348633, 3.8840320110321045], "compile_time": 1321.0560670122504, "verification_time": 0, "benchmark_time": 115.20742205902934, "GFLOP/s": 2557.2714969915924, "strategy_time": 0, "framework_time": 1.0859337635338306, "timestamp": "2024-01-16 12:09:30.964982+00:00"},
"16,1,2,4,1,0": {"block_size_x": 16, "block_size_y": 1, "tile_size_x": 2, "tile_size_y": 4, "read_only": 1, "use_padding": 0, "time": 3.833701324462891, "times": [3.4763519763946533, 3.463167905807495, 3.463167905807495, 3.463104009628296, 3.462143898010254, 3.463167905807495, 3.462143898010254, 3.7723519802093506, 4.022272109985352, 4.023295879364014, 4.023295879364014, 4.023295879364014, 4.00486421585083, 3.9874560832977295, 3.9883840084075928, 3.9854400157928467, 3.987391948699951, 3.964927911758423, 3.951551914215088, 3.951616048812866, 3.950592041015625, 3.9526400566101074, 3.9331839084625244, 3.8942720890045166, 3.8911681175231934, 3.8891520500183105, 3.8891520500183105, 3.8901760578155518, 3.8911359310150146, 3.8901760578155518], "compile_time": 1326.9262500107288, "verification_time": 0, "benchmark_time": 116.34728778153658, "GFLOP/s": 2529.469571904797, "strategy_time": 0, "framework_time": 1.0651652701199055, "timestamp": "2024-01-16 12:09:32.409343+00:00"},
"16,1,2,4,1,1": {"block_size_x": 16, "block_size_y": 1, "tile_size_x": 2, "tile_size_y": 4, "read_only": 1, "use_padding": 1, "time": 3.8340362707773843, "times": [3.4744319915771484, 3.4641919136047363, 3.463167905807495, 3.462143898010254, 3.463167905807495, 3.461280107498169, 3.4641919136047363, 3.8656320571899414, 4.022272109985352, 4.023295879364014, 4.022272109985352, 4.023295879364014, 4.043871879577637, 3.9976959228515625, 3.9966719150543213, 3.9976959228515625, 3.9966719150543213, 3.9485440254211426, 3.926016092300415, 3.9229440689086914, 3.9239680767059326, 3.926016092300415, 3.895296096801758, 3.8901760578155518, 3.8901760578155518, 3.891200065612793, 3.892224073410034, 3.891200065612793, 3.891200065612793, 3.8901760578155518], "compile_time": 1322.9288342408836, "verification_time": 0, "benchmark_time": 116.41965294256806, "GFLOP/s": 2529.2485942063877, "strategy_time": 0, "framework_time": 1.1085760779678822, "timestamp": "2024-01-16 12:09:33.849825+00:00"},
"16,1,3,1,0,0": {"block_size_x": 16, "block_size_y": 1, "tile_size_x": 3, "tile_size_y": 1, "read_only": 0, "use_padding": 0, "time": 9.2351061185201, "times": [9.249792098999023, 9.23840045928955, 9.236479759216309, 9.237504005432129, 9.237407684326172, 9.236479759216309, 9.236576080322266, 9.235456466674805, 9.236479759216309, 9.236479759216309, 9.236479759216309, 9.236479759216309, 9.237504005432129, 9.237504005432129, 9.237504005432129, 9.236479759216309, 9.236479759216309, 9.232383728027344, 9.23033618927002, 9.233280181884766, 9.233407974243164, 9.23033618927002, 9.23136043548584, 9.232383728027344, 9.233407974243164, 9.233407974243164, 9.23136043548584, 9.232383728027344, 9.23136043548584, 9.228287696838379], "compile_time": 2470.335451886058, "verification_time": 0, "benchmark_time": 278.0456757172942, "GFLOP/s": 1050.0400020908428, "strategy_time": 0, "framework_time": 1.2267972342669964, "timestamp": "2024-01-16 12:09:36.599458+00:00"},
"16,1,3,1,0,1": {"block_size_x": 16, "block_size_y": 1, "tile_size_x": 3, "tile_size_y": 1, "read_only": 0, "use_padding": 1, "time": 8.745189317067464, "times": [9.247743606567383, 9.235456466674805, 9.234432220458984, 9.235456466674805, 9.234432220458984, 9.233407974243164, 9.234432220458984, 9.234432220458984, 9.234432220458984, 9.234432220458984, 8.518655776977539, 8.50227165222168, 8.50227165222168, 8.5032958984375, 8.50227165222168, 8.504256248474121, 8.50227165222168, 8.5032958984375, 8.50227165222168, 8.500224113464355, 8.49510383605957, 8.497056007385254, 8.49510383605957, 8.49612808227539, 8.49510383605957, 8.496000289916992, 8.49510383605957, 8.49510383605957, 8.49612808227539, 8.49510383605957], "compile_time": 2504.8493170179427, "verification_time": 0, "benchmark_time": 263.3386026136577, "GFLOP/s": 1108.864599314562, "strategy_time": 0, "framework_time": 1.3219662941992283, "timestamp": "2024-01-16 12:09:39.368994+00:00"},
"16,1,3,1,1,0": {"block_size_x": 16, "block_size_y": 1, "tile_size_x": 3, "tile_size_y": 1, "read_only": 1, "use_padding": 0, "time": 8.801327959696453, "times": [9.460736274719238, 9.448448181152344, 9.4453763961792, 9.449440002441406, 9.446399688720703, 9.44752025604248, 9.446399688720703, 9.450464248657227, 9.451519966125488, 9.445247650146484, 9.450464248657227, 9.44934368133545, 9.442303657531738, 9.152511596679688, 8.253439903259277, 8.257535934448242, 8.252415657043457, 8.252415657043457, 8.25443172454834, 8.252415657043457, 8.255488395690918, 8.252256393432617, 8.249343872070312, 8.25436782836914, 8.256447792053223, 8.251392364501953, 8.253439903259277, 8.252415657043457, 8.251392364501953, 8.254464149475098], "compile_time": 2496.6971101239324, "verification_time": 0, "benchmark_time": 264.99329321086407, "GFLOP/s": 1101.791785558511, "strategy_time": 0, "framework_time": 1.4438224025070667, "timestamp": "2024-01-16 12:09:42.132153+00:00"},
"16,1,3,1,1,1": {"block_size_x": 16, "block_size_y": 1, "tile_size_x": 3, "tile_size_y": 1, "read_only": 1, "use_padding": 1, "time": 8.767418638865154, "times": [9.297920227050781, 9.285632133483887, 9.284607887268066, 9.284607887268066, 9.285632133483887, 9.285632133483887, 9.284607887268066, 9.285632133483887, 9.284607887268066, 9.284607887268066, 9.285632133483887, 9.285632133483887, 9.28553581237793, 9.285632133483887, 9.285759925842285, 9.279487609863281, 8.98969554901123, 8.113151550292969, 8.11520004272461, 8.112128257751465, 8.112128257751465, 8.111104011535645, 8.112223625183105, 8.113151550292969, 8.113151550292969, 8.112128257751465, 8.112095832824707, 8.111104011535645, 8.112128257751465, 8.112000465393066], "compile_time": 2506.8645607680082, "verification_time": 0, "benchmark_time": 264.2345209605992, "GFLOP/s": 1106.053132333966, "strategy_time": 0, "framework_time": 1.4417003840208054, "timestamp": "2024-01-16 12:09:44.904723+00:00"},
"16,1,3,2,0,0": {"block_size_x": 16, "block_size_y": 1, "tile_size_x": 3, "tile_size_y": 2, "read_only": 0, "use_padding": 0, "time": 4.9336597442626955, "times": [4.985856056213379, 4.969376087188721, 4.973567962646484, 4.973567962646484, 4.973631858825684, 4.9725117683410645, 4.972544193267822, 4.9694719314575195, 4.97049617767334, 4.970367908477783, 4.9734721183776855, 4.97049617767334, 4.971519947052002, 4.97049617767334, 4.974592208862305, 4.972544193267822, 4.9694719314575195, 4.971519947052002, 4.972544193267822, 4.972544193267822, 4.973567962646484, 4.973567962646484, 4.971519947052002, 4.971519947052002, 4.967455863952637, 4.967423915863037, 4.965439796447754, 4.626431941986084, 4.572159767150879, 4.570112228393555], "compile_time": 2753.848156426102, "verification_time": 0, "benchmark_time": 149.04045313596725, "GFLOP/s": 1965.5248538930587, "strategy_time": 0, "framework_time": 1.239800825715065, "timestamp": "2024-01-16 12:09:47.808876+00:00"},
"16,1,3,2,0,1": {"block_size_x": 16, "block_size_y": 1, "tile_size_x": 3, "tile_size_y": 2, "read_only": 0, "use_padding": 1, "time": 4.946828921635945, "times": [4.958208084106445, 4.946944236755371, 4.945919990539551, 4.946944236755371, 4.945919990539551, 4.946944236755371, 4.946944236755371, 4.946944236755371, 4.946944236755371, 4.946944236755371, 4.947968006134033, 4.946944236755371, 4.945919990539551, 4.946944236755371, 4.946944236755371, 4.946944236755371, 4.945919990539551, 4.947904109954834, 4.945919990539551, 4.945919990539551, 4.947968006134033, 4.946944236755371, 4.9488959312438965, 4.947968006134033, 4.946944236755371, 4.947872161865234, 4.947904109954834, 4.940800189971924, 4.941760063171387, 4.941823959350586], "compile_time": 2731.5528132021427, "verification_time": 0, "benchmark_time": 150.1196138560772, "GFLOP/s": 1960.292341137415, "strategy_time": 0, "framework_time": 1.2487377971410751, "timestamp": "2024-01-16 12:09:50.691820+00:00"},
"16,1,3,2,1,0": {"block_size_x": 16, "block_size_y": 1, "tile_size_x": 3, "tile_size_y": 2, "read_only": 1, "use_padding": 0, "time": 4.903863493601481, "times": [4.915200233459473, 4.903840065002441, 4.902912139892578, 4.901887893676758, 4.90393590927124, 4.90393590927124, 4.902912139892578, 4.901887893676758, 4.902912139892578, 4.903872013092041, 4.901984214782715, 4.9049601554870605, 4.902912139892578, 4.90393590927124, 4.902912139892578, 4.902912139892578, 4.903903961181641, 4.90393590927124, 4.90393590927124, 4.9049601554870605, 4.9049601554870605, 4.90393590927124, 4.9048638343811035, 4.90393590927124, 4.903007984161377, 4.903903961181641, 4.9049601554870605, 4.90393590927124, 4.90393590927124, 4.898816108703613], "compile_time": 2738.5208811610937, "verification_time": 0, "benchmark_time": 148.57584284618497, "GFLOP/s": 1977.467533640132, "strategy_time": 0, "framework_time": 1.3124486431479454, "timestamp": "2024-01-16 12:09:53.580253+00:00"},
"16,1,3,2,1,1": {"block_size_x": 16, "block_size_y": 1, "tile_size_x": 3, "tile_size_y": 2, "read_only": 1, "use_padding": 1, "time": 4.902293300628662, "times": [4.91315221786499, 4.9027838706970215, 4.901887893676758, 4.900864124298096, 4.901887893676758, 4.901887893676758, 4.901887893676758, 4.901887893676758, 4.901887893676758, 4.901887893676758, 4.900864124298096, 4.901887893676758, 4.900864124298096, 4.901887893676758, 4.901887893676758, 4.901887893676758, 4.901887893676758, 4.901887893676758, 4.902912139892578, 4.901887893676758, 4.901887893676758, 4.901887893676758, 4.902912139892578, 4.901887893676758, 4.902912139892578, 4.901887893676758, 4.902912139892578, 4.900864124298096, 4.901887893676758, 4.901887893676758], "compile_time": 2746.181317139417, "verification_time": 0, "benchmark_time": 148.55179795995355, "GFLOP/s": 1978.1009118235424, "strategy_time": 0, "framework_time": 0.9740651585161686, "timestamp": "2024-01-16 12:09:56.475984+00:00"},
"16,1,3,3,0,0": {"block_size_x": 16, "block_size_y": 1, "tile_size_x": 3, "tile_size_y": 3, "read_only": 0, "use_padding": 0, "time": 4.290234645207723, "times": [4.303872108459473, 4.290559768676758, 4.289535999298096, 4.289440155029297, 4.290559768676758, 4.290527820587158, 4.289535999298096, 4.289535999298096, 4.290559768676758, 4.288512229919434, 4.290559768676758, 4.289535999298096, 4.290463924407959, 4.288512229919434, 4.290559768676758, 4.290431976318359, 4.288512229919434, 4.289567947387695, 4.289535999298096, 4.288512229919434, 4.289408206939697, 4.289599895477295, 4.290559768676758, 4.29040002822876, 4.289535999298096, 4.288512229919434, 4.289535999298096, 4.290559768676758, 4.289535999298096, 4.290559768676758], "compile_time": 1464.019519276917, "verification_time": 0, "benchmark_time": 129.64389892295003, "GFLOP/s": 2260.303141888055, "strategy_time": 0, "framework_time": 1.2602396309375763, "timestamp": "2024-01-16 12:09:58.070932+00:00"},
"16,1,3,3,0,1": {"block_size_x": 16, "block_size_y": 1, "tile_size_x": 3, "tile_size_y": 3, "read_only": 0, "use_padding": 1, "time": 4.25591033299764, "times": [4.137983798980713, 4.126719951629639, 4.124671936035156, 4.124671936035156, 4.125696182250977, 4.125696182250977, 4.125696182250977, 4.257791996002197, 4.297728061676025, 4.296703815460205, 4.297728061676025, 4.296639919281006, 4.295680046081543, 4.297728061676025, 4.296703815460205, 4.296703815460205, 4.296832084655762, 4.296703815460205, 4.295551776885986, 4.296703815460205, 4.296703815460205, 4.296703815460205, 4.297728061676025, 4.296703815460205, 4.296703815460205, 4.296703815460205, 4.295680046081543, 4.296639919281006, 4.296703815460205, 4.296703815460205], "compile_time": 1468.0727296508849, "verification_time": 0, "benchmark_time": 128.94184421747923, "GFLOP/s": 2278.5326967097494, "strategy_time": 0, "framework_time": 1.2317169457674026, "timestamp": "2024-01-16 12:09:59.669204+00:00"},
"16,1,3,3,1,0": {"block_size_x": 16, "block_size_y": 1, "tile_size_x": 3, "tile_size_y": 3, "read_only": 1, "use_padding": 0, "time": 4.237022972106933, "times": [4.091839790344238, 4.080639839172363, 4.080639839172363, 4.080639839172363, 4.080575942993164, 4.079616069793701, 4.080639839172363, 4.2248640060424805, 4.286464214324951, 4.286464214324951, 4.286464214324951, 4.287487983703613, 4.285439968109131, 4.287456035614014, 4.286464214324951, 4.286464214324951, 4.286464214324951, 4.2936320304870605, 4.286464214324951, 4.285439968109131, 4.286464214324951, 4.287487983703613, 4.285439968109131, 4.287327766418457, 4.287487983703613, 4.286464214324951, 4.286464214324951, 4.285439968109131, 4.286464214324951, 4.287487983703613], "compile_time": 1469.1865262575448, "verification_time": 0, "benchmark_time": 128.1351433135569, "GFLOP/s": 2288.689703086005, "strategy_time": 0, "framework_time": 1.491541974246502, "timestamp": "2024-01-16 12:10:01.268041+00:00"},
"16,1,3,3,1,1": {"block_size_x": 16, "block_size_y": 1, "tile_size_x": 3, "tile_size_y": 3, "read_only": 1, "use_padding": 1, "time": 4.261979722976685, "times": [4.140031814575195, 4.126719951629639, 4.1266560554504395, 4.127583980560303, 4.125696182250977, 4.127744197845459, 4.226047992706299, 4.2987518310546875, 4.299744129180908, 4.297728061676025, 4.296703815460205, 4.297728061676025, 4.2985920906066895, 4.298687934875488, 4.2987518310546875, 4.2987518310546875, 4.297728061676025, 4.2987518310546875, 4.297728061676025, 4.297791957855225, 4.2987518310546875, 4.297728061676025, 4.298719882965088, 4.299776077270508, 4.297728061676025, 4.297728061676025, 4.297728061676025, 4.296832084655762, 4.297728061676025, 4.2987518310546875], "compile_time": 1473.4618333168328, "verification_time": 0, "benchmark_time": 129.01515141129494, "GFLOP/s": 2275.287889269259, "strategy_time": 0, "framework_time": 1.1249450035393238, "timestamp": "2024-01-16 12:10:02.871667+00:00"},
"16,1,3,4,0,0": {"block_size_x": 16, "block_size_y": 1, "tile_size_x": 3, "tile_size_y": 4, "read_only": 0, "use_padding": 0, "time": 4.14104212919871, "times": [4.237311840057373, 4.215807914733887, 4.2188801765441895, 4.217855930328369, 4.2178239822387695, 4.217855930328369, 4.217855930328369, 4.217855930328369, 4.2188801765441895, 4.217855930328369, 4.2188801765441895, 4.217855930328369, 4.219903945922852, 4.2188801765441895, 4.218815803527832, 4.2188801765441895, 4.216832160949707, 4.216832160949707, 4.217855930328369, 4.215712070465088, 4.214784145355225, 4.211711883544922, 4.213759899139404, 3.93833589553833, 3.8799359798431396, 3.8798398971557617, 3.8778879642486572, 3.879807949066162, 3.878880023956299, 3.8778879642486572], "compile_time": 2018.39286275208, "verification_time": 0, "benchmark_time": 125.5752993747592, "GFLOP/s": 2341.736825043219, "strategy_time": 0, "framework_time": 1.063331961631775, "timestamp": "2024-01-16 12:10:05.016722+00:00"},
"16,1,3,4,0,1": {"block_size_x": 16, "block_size_y": 1, "tile_size_x": 3, "tile_size_y": 4, "read_only": 0, "use_padding": 1, "time": 4.220652866363525, "times": [4.240384101867676, 4.222976207733154, 4.220928192138672, 4.2188801765441895, 4.220928192138672, 4.221951961517334, 4.221951961517334, 4.221951961517334, 4.219903945922852, 4.221951961517334, 4.220928192138672, 4.220928192138672, 4.2188801765441895, 4.2188801765441895, 4.219903945922852, 4.220928192138672, 4.2188801765441895, 4.219903945922852, 4.221951961517334, 4.21884822845459, 4.220928192138672, 4.220928192138672, 4.219871997833252, 4.2188801765441895, 4.219903945922852, 4.217855930328369, 4.219903945922852, 4.217855930328369, 4.215807914733887, 4.215807914733887], "compile_time": 2034.3596548773348, "verification_time": 0, "benchmark_time": 128.05741699412465, "GFLOP/s": 2297.566550730111, "strategy_time": 0, "framework_time": 1.0411608964204788, "timestamp": "2024-01-16 12:10:07.180204+00:00"},
"16,1,3,4,1,0": {"block_size_x": 16, "block_size_y": 1, "tile_size_x": 3, "tile_size_y": 4, "read_only": 1, "use_padding": 0, "time": 4.214469305674235, "times": [4.227071762084961, 4.216832160949707, 4.216832160949707, 4.21670389175415, 4.215807914733887, 4.216832160949707, 4.217855930328369, 4.215807914733887, 4.216832160949707, 4.215807914733887, 4.2178239822387695, 4.215807914733887, 4.215807914733887, 4.214784145355225, 4.214784145355225, 4.213759899139404, 4.211711883544922, 4.211711883544922, 4.21068811416626, 4.211711883544922, 4.2117438316345215, 4.2096638679504395, 4.21068811416626, 4.21068811416626, 4.213759899139404, 4.211711883544922, 4.212639808654785, 4.211711883544922, 4.212736129760742, 4.213759899139404], "compile_time": 2022.9643750935793, "verification_time": 0, "benchmark_time": 128.03130922839046, "GFLOP/s": 2300.9375901596773, "strategy_time": 0, "framework_time": 1.2777824886143208, "timestamp": "2024-01-16 12:10:09.332501+00:00"},
"16,1,3,4,1,1": {"block_size_x": 16, "block_size_y": 1, "tile_size_x": 3, "tile_size_y": 4, "read_only": 1, "use_padding": 1, "time": 4.215841054916382, "times": [4.226047992706299, 4.217855930328369, 4.217855930328369, 4.216832160949707, 4.215807914733887, 4.216832160949707, 4.217855930328369, 4.215807914733887, 4.216832160949707, 4.215807914733887, 4.217855930328369, 4.215936183929443, 4.21676778793335, 4.217855930328369, 4.215807914733887, 4.215807914733887, 4.215807914733887, 4.215807914733887, 4.214784145355225, 4.217855930328369, 4.216832160949707, 4.215807914733887, 4.21776008605957, 4.213759899139404, 4.21068811416626, 4.21068811416626, 4.211711883544922, 4.211711883544922, 4.211711883544922, 4.212736129760742], "compile_time": 2036.363708321005, "verification_time": 0, "benchmark_time": 128.0315793119371, "GFLOP/s": 2300.1889116980333, "strategy_time": 0, "framework_time": 1.2256549671292305, "timestamp": "2024-01-16 12:10:11.498146+00:00"},
"16,1,4,1,0,0": {"block_size_x": 16, "block_size_y": 1, "tile_size_x": 4, "tile_size_y": 1, "read_only": 0, "use_padding": 0, "time": 9.385943380991618, "times": [9.490431785583496, 9.479167938232422, 9.479167938232422, 9.479167938232422, 9.47817611694336, 9.478143692016602, 9.480192184448242, 9.47920036315918, 9.480192184448242, 9.478143692016602, 9.479071617126465, 9.479167938232422, 9.479104042053223, 9.479167938232422, 9.479167938232422, 9.476096153259277, 9.476096153259277, 9.47606372833252, 9.475071907043457, 9.476991653442383, 9.475071907043457, 9.475071907043457, 9.475071907043457, 9.475071907043457, 9.475071907043457, 9.47599983215332, 9.475199699401855, 9.247743606567383, 8.21350383758545, 8.212512016296387], "compile_time": 2223.0283012613654, "verification_time": 0, "benchmark_time": 283.10876665636897, "GFLOP/s": 1033.1652828461336, "strategy_time": 0, "framework_time": 1.0920348577201366, "timestamp": "2024-01-16 12:10:14.005399+00:00"},
"16,1,4,1,0,1": {"block_size_x": 16, "block_size_y": 1, "tile_size_x": 4, "tile_size_y": 1, "read_only": 0, "use_padding": 1, "time": 8.664407348632812, "times": [9.492480278015137, 9.480192184448242, 9.478143692016602, 9.478143692016602, 9.479167938232422, 9.479167938232422, 9.479167938232422, 9.479167938232422, 9.479167938232422, 9.478143692016602, 9.475071907043457, 8.920191764831543, 8.21350383758545, 8.20019245147705, 8.144895553588867, 8.144895553588867, 8.145983695983887, 8.144864082336426, 8.144895553588867, 8.144800186157227, 8.145919799804688, 8.146944046020508, 8.143872261047363, 8.143872261047363, 8.145919799804688, 8.143872261047363, 8.144895553588867, 8.144895553588867, 8.144895553588867, 8.144895553588867], "compile_time": 2269.7416627779603, "verification_time": 0, "benchmark_time": 261.00325025618076, "GFLOP/s": 1119.2030173339163, "strategy_time": 0, "framework_time": 1.2320070527493954, "timestamp": "2024-01-16 12:10:16.537401+00:00"},
"16,1,4,1,1,0": {"block_size_x": 16, "block_size_y": 1, "tile_size_x": 4, "tile_size_y": 1, "read_only": 1, "use_padding": 0, "time": 9.050282637278238, "times": [9.491456031799316, 9.478240013122559, 9.479167938232422, 9.478143692016602, 9.478048324584961, 9.477120399475098, 9.478143692016602, 9.47817611694336, 9.478143692016602, 9.478143692016602, 9.478143692016602, 9.477120399475098, 9.477120399475098, 9.478143692016602, 9.477120399475098, 9.479167938232422, 9.479167938232422, 9.478143692016602, 9.476096153259277, 9.475071907043457, 8.374272346496582, 8.21350383758545, 8.21350383758545, 8.211456298828125, 8.201215744018555, 8.144864082336426, 8.145919799804688, 8.144895553588867, 8.144895553588867, 8.143872261047363], "compile_time": 2255.0845337100327, "verification_time": 0, "benchmark_time": 272.95283786952496, "GFLOP/s": 1071.4837576516088, "strategy_time": 0, "framework_time": 1.3138316571712494, "timestamp": "2024-01-16 12:10:19.066777+00:00"},
"16,1,4,1,1,1": {"block_size_x": 16, "block_size_y": 1, "tile_size_x": 4, "tile_size_y": 1, "read_only": 1, "use_padding": 1, "time": 9.331397215525309, "times": [9.491392135620117, 9.478143692016602, 9.478143692016602, 9.479071617126465, 9.479167938232422, 9.479167938232422, 9.479167938232422, 9.480192184448242, 9.478143692016602, 9.478143692016602, 9.478143692016602, 9.478143692016602, 9.479167938232422, 9.478143692016602, 9.475071907043457, 9.475040435791016, 9.475071907043457, 9.475071907043457, 9.475071907043457, 9.475071907043457, 9.476096153259277, 9.475071907043457, 9.475071907043457, 9.475071907043457, 9.475071907043457, 9.477120399475098, 8.883199691772461, 8.21350383758545, 8.214495658874512, 8.212479591369629], "compile_time": 2263.9282159507275, "verification_time": 0, "benchmark_time": 281.5497578121722, "GFLOP/s": 1039.2045932699154, "strategy_time": 0, "framework_time": 1.2837634421885014, "timestamp": "2024-01-16 12:10:21.613564+00:00"},
"16,1,4,2,0,0": {"block_size_x": 16, "block_size_y": 1, "tile_size_x": 4, "tile_size_y": 2, "read_only": 0, "use_padding": 0, "time": 5.044904470443726, "times": [5.058495998382568, 5.045248031616211, 5.045248031616211, 5.045248031616211, 5.045248031616211, 5.044223785400391, 5.045248031616211, 5.046271800994873, 5.044223785400391, 5.046239852905273, 5.045248031616211, 5.044352054595947, 5.045248031616211, 5.045184135437012, 5.045248031616211, 5.045248031616211, 5.045248031616211, 5.045248031616211, 5.045216083526611, 5.04531192779541, 5.045248031616211, 5.046207904815674, 5.044223785400391, 5.042175769805908, 5.041152000427246, 5.042175769805908, 5.042175769805908, 5.042175769805908, 5.042175769805908, 5.042175769805908], "compile_time": 2535.234870854765, "verification_time": 0, "benchmark_time": 153.27026369050145, "GFLOP/s": 1922.1832454534224, "strategy_time": 0, "framework_time": 1.2487294152379036, "timestamp": "2024-01-16 12:10:24.303343+00:00"},
"16,1,4,2,0,1": {"block_size_x": 16, "block_size_y": 1, "tile_size_x": 4, "tile_size_y": 2, "read_only": 0, "use_padding": 1, "time": 5.045821825663249, "times": [5.058559894561768, 5.046271800994873, 5.045248031616211, 5.045248031616211, 5.046207904815674, 5.045248031616211, 5.047296047210693, 5.044288158416748, 5.045248031616211, 5.044223785400391, 5.045248031616211, 5.045248031616211, 5.044223785400391, 5.045248031616211, 5.045248031616211, 5.045248031616211, 5.045248031616211, 5.044223785400391, 5.045119762420654, 5.046271800994873, 5.045248031616211, 5.045248031616211, 5.046271800994873, 5.045248031616211, 5.045248031616211, 5.046207904815674, 5.046271800994873, 5.045248031616211, 5.045248031616211, 5.045248031616211], "compile_time": 2495.594506151974, "verification_time": 0, "benchmark_time": 153.2119051553309, "GFLOP/s": 1921.8337830875241, "strategy_time": 0, "framework_time": 1.1163000017404556, "timestamp": "2024-01-16 12:10:26.953289+00:00"},
"16,1,4,2,1,0": {"block_size_x": 16, "block_size_y": 1, "tile_size_x": 4, "tile_size_y": 2, "read_only": 1, "use_padding": 0, "time": 4.966567389170328, "times": [5.054463863372803, 5.0432000160217285, 5.042175769805908, 5.042175769805908, 5.041152000427246, 5.0432000160217285, 5.041152000427246, 5.0432000160217285, 5.0432000160217285, 5.042175769805908, 5.042175769805908, 5.042175769805908, 5.042175769805908, 5.042175769805908, 5.042175769805908, 5.042175769805908, 5.0432000160217285, 5.042143821716309, 5.0432000160217285, 5.042304039001465, 5.0432000160217285, 5.041152000427246, 5.039103984832764, 5.038080215454102, 5.037951946258545, 4.863999843597412, 4.517888069152832, 4.517824172973633, 4.518911838531494, 4.518911838531494], "compile_time": 2496.687853243202, "verification_time": 0, "benchmark_time": 150.60539403930306, "GFLOP/s": 1952.5016149272335, "strategy_time": 0, "framework_time": 1.2722224928438663, "timestamp": "2024-01-16 12:10:29.601878+00:00"},
"16,1,4,2,1,1": {"block_size_x": 16, "block_size_y": 1, "tile_size_x": 4, "tile_size_y": 2, "read_only": 1, "use_padding": 1, "time": 5.042237742741903, "times": [5.053440093994141, 5.042175769805908, 5.041152000427246, 5.042175769805908, 5.042175769805908, 5.042175769805908, 5.042175769805908, 5.042175769805908, 5.042175769805908, 5.042175769805908, 5.042175769805908, 5.042111873626709, 5.042143821716309, 5.041152000427246, 5.041183948516846, 5.042175769805908, 5.042175769805908, 5.042175769805908, 5.042175769805908, 5.04310417175293, 5.042175769805908, 5.042175769805908, 5.040128231048584, 5.0411200523376465, 5.041152000427246, 5.040128231048584, 5.042175769805908, 5.042175769805908, 5.041152000427246, 5.042175769805908], "compile_time": 2502.6953532360494, "verification_time": 0, "benchmark_time": 152.9954602010548, "GFLOP/s": 1923.1998455365917, "strategy_time": 0, "framework_time": 1.1787568219006062, "timestamp": "2024-01-16 12:10:32.258771+00:00"},
"16,1,4,3,0,0": {"block_size_x": 16, "block_size_y": 1, "tile_size_x": 4, "tile_size_y": 3, "read_only": 0, "use_padding": 0, "time": 4.592775440216064, "times": [4.753407955169678, 4.745183944702148, 4.743167877197266, 4.7421441078186035, 4.744192123413086, 4.743167877197266, 4.744160175323486, 4.740096092224121, 4.743199825286865, 4.741119861602783, 4.746240139007568, 4.741119861602783, 4.744192123413086, 4.7421441078186035, 4.741119861602783, 4.7421441078186035, 4.744192123413086, 4.70527982711792, 4.711423873901367, 4.708352088928223, 4.648960113525391, 4.265984058380127, 4.264959812164307, 4.2639360427856445, 4.262911796569824, 4.260863780975342, 4.2639360427856445, 4.264959812164307, 4.261888027191162, 4.258815765380859], "compile_time": 2020.7452387548983, "verification_time": 0, "benchmark_time": 139.30738624185324, "GFLOP/s": 2111.409750863804, "strategy_time": 0, "framework_time": 1.24455988407135, "timestamp": "2024-01-16 12:10:34.420092+00:00"},
"16,1,4,3,0,1": {"block_size_x": 16, "block_size_y": 1, "tile_size_x": 4, "tile_size_y": 3, "read_only": 0, "use_padding": 1, "time": 4.707602167129517, "times": [4.729856014251709, 4.713568210601807, 4.7124481201171875, 4.7124481201171875, 4.716544151306152, 4.71347188949585, 4.7124481201171875, 4.715519905090332, 4.7124481201171875, 4.716544151306152, 4.7124481201171875, 4.716544151306152, 4.713503837585449, 4.714399814605713, 4.715519905090332, 4.71347188949585, 4.717535972595215, 4.71340799331665, 4.7126078605651855, 4.71449613571167, 4.715519905090332, 4.71347188949585, 4.716544151306152, 4.71449613571167, 4.7175679206848145, 4.712384223937988, 4.710400104522705, 4.710400104522705, 4.711423873901367, 4.506624221801758], "compile_time": 2018.7453930266201, "verification_time": 0, "benchmark_time": 142.04484317451715, "GFLOP/s": 2059.9087398910206, "strategy_time": 0, "framework_time": 1.186912413686514, "timestamp": "2024-01-16 12:10:36.582093+00:00"},
"16,1,4,3,1,0": {"block_size_x": 16, "block_size_y": 1, "tile_size_x": 4, "tile_size_y": 3, "read_only": 1, "use_padding": 0, "time": 4.715992530186971, "times": [4.727807998657227, 4.716544151306152, 4.715519905090332, 4.721663951873779, 4.7175679206848145, 4.7123517990112305, 4.71347188949585, 4.71347188949585, 4.71347188949585, 4.716544151306152, 4.71449613571167, 4.715519905090332, 4.71347188949585, 4.71449613571167, 4.71347188949585, 4.71347188949585, 4.71347188949585, 4.7124481201171875, 4.716544151306152, 4.721663951873779, 4.716544151306152, 4.715519905090332, 4.7124481201171875, 4.717472076416016, 4.716608047485352, 4.717535972595215, 4.7175679206848145, 4.7175679206848145, 4.71449613571167, 4.716544151306152], "compile_time": 2019.6628216654062, "verification_time": 0, "benchmark_time": 142.41355331614614, "GFLOP/s": 2056.2438947746896, "strategy_time": 0, "framework_time": 1.0626399889588356, "timestamp": "2024-01-16 12:10:38.745257+00:00"},
"16,1,4,3,1,1": {"block_size_x": 16, "block_size_y": 1, "tile_size_x": 4, "tile_size_y": 3, "read_only": 1, "use_padding": 1, "time": 4.715144554773967, "times": [4.7329277992248535, 4.718592166900635, 4.715519905090332, 4.716544151306152, 4.71449613571167, 4.718592166900635, 4.7175679206848145, 4.716544151306152, 4.7175679206848145, 4.71449613571167, 4.7124481201171875, 4.71347188949585, 4.715519905090332, 4.71449613571167, 4.715519905090332, 4.715519905090332, 4.718592166900635, 4.7124481201171875, 4.71449613571167, 4.718592166900635, 4.710400104522705, 4.708352088928223, 4.71347188949585, 4.7124481201171875, 4.711423873901367, 4.715519905090332, 4.707327842712402, 4.71347188949585, 4.71347188949585, 4.71449613571167], "compile_time": 2019.0004813484848, "verification_time": 0, "benchmark_time": 142.3032572492957, "GFLOP/s": 2056.613691340978, "strategy_time": 0, "framework_time": 1.296396367251873, "timestamp": "2024-01-16 12:10:40.907881+00:00"},
"16,1,4,4,0,0": {"block_size_x": 16, "block_size_y": 1, "tile_size_x": 4, "tile_size_y": 4, "read_only": 0, "use_padding": 0, "time": 4.464980300267538, "times": [4.482048034667969, 4.4707841873168945, 4.46457576751709, 4.464735984802246, 4.465663909912109, 4.465663909912109, 4.468736171722412, 4.464640140533447, 4.463615894317627, 4.468736171722412, 4.469759941101074, 4.464640140533447, 4.465663909912109, 4.463583946228027, 4.463615894317627, 4.467679977416992, 4.46668815612793, 4.460544109344482, 4.460544109344482, 4.46668815612793, 4.468736171722412, 4.460544109344482, 4.45849609375, 4.4615678787231445, 4.45849609375, 4.462592124938965, 4.4615678787231445, 4.46668815612793, 4.462592124938965, 4.459519863128662], "compile_time": 2854.75417599082, "verification_time": 0, "benchmark_time": 135.24293387308717, "GFLOP/s": 2171.8417990374896, "strategy_time": 0, "framework_time": 1.2445501051843166, "timestamp": "2024-01-16 12:10:43.899145+00:00"},
"16,1,4,4,0,1": {"block_size_x": 16, "block_size_y": 1, "tile_size_x": 4, "tile_size_y": 4, "read_only": 0, "use_padding": 1, "time": 4.465148830413819, "times": [4.476928234100342, 4.467807769775391, 4.468736171722412, 4.462592124938965, 4.46668815612793, 4.459519863128662, 4.469727993011475, 4.468736171722412, 4.464640140533447, 4.46668815612793, 4.465663909912109, 4.465663909912109, 4.462592124938965, 4.4707841873168945, 4.46668815612793, 4.463615894317627, 4.460544109344482, 4.465663909912109, 4.464640140533447, 4.465663909912109, 4.460544109344482, 4.467711925506592, 4.459551811218262, 4.467711925506592, 4.462528228759766, 4.465536117553711, 4.4615678787231445, 4.460544109344482, 4.4615678787231445, 4.463615894317627], "compile_time": 2849.376946222037, "verification_time": 0, "benchmark_time": 135.25018794462085, "GFLOP/s": 2171.7598262231463, "strategy_time": 0, "framework_time": 1.1330018751323223, "timestamp": "2024-01-16 12:10:46.884930+00:00"},
"16,1,4,4,1,0": {"block_size_x": 16, "block_size_y": 1, "tile_size_x": 4, "tile_size_y": 4, "read_only": 1, "use_padding": 0, "time": 4.469261948267619, "times": [4.476928234100342, 4.467711925506592, 4.467840194702148, 4.4707841873168945, 4.469759941101074, 4.471807956695557, 4.472832202911377, 4.467711925506592, 4.469759941101074, 4.472832202911377, 4.46668815612793, 4.460544109344482, 4.467711925506592, 4.469632148742676, 4.469759941101074, 4.468736171722412, 4.473728179931641, 4.4707841873168945, 4.4655680656433105, 4.46668815612793, 4.471807956695557, 4.468671798706055, 4.468736171722412, 4.468736171722412, 4.472832202911377, 4.473728179931641, 4.4707841873168945, 4.4615678787231445, 4.467584133148193, 4.46560001373291], "compile_time": 2851.7948840744793, "verification_time": 0, "benchmark_time": 135.51124604418874, "GFLOP/s": 2169.761128402611, "strategy_time": 0, "framework_time": 1.243318896740675, "timestamp": "2024-01-16 12:10:49.873503+00:00"},
"16,1,4,4,1,1": {"block_size_x": 16, "block_size_y": 1, "tile_size_x": 4, "tile_size_y": 4, "read_only": 1, "use_padding": 1, "time": 4.466754134496053, "times": [4.477952003479004, 4.46668815612793, 4.46668815612793, 4.463615894317627, 4.464511871337891, 4.471839904785156, 4.465663909912109, 4.469759941101074, 4.469759941101074, 4.465663909912109, 4.465663909912109, 4.465663909912109, 4.465663909912109, 4.462592124938965, 4.467711925506592, 4.463615894317627, 4.464640140533447, 4.467711925506592, 4.4707841873168945, 4.467711925506592, 4.464640140533447, 4.463615894317627, 4.467711925506592, 4.46668815612793, 4.467679977416992, 4.468736171722412, 4.471871852874756, 4.464640140533447, 4.464640140533447, 4.45849609375], "compile_time": 2852.822467684746, "verification_time": 0, "benchmark_time": 135.31149178743362, "GFLOP/s": 2170.9793187652267, "strategy_time": 0, "framework_time": 1.3226387090981007, "timestamp": "2024-01-16 12:10:52.862983+00:00"},
"16,2,1,1,0,0": {"block_size_x": 16, "block_size_y": 2, "tile_size_x": 1, "tile_size_y": 1, "read_only": 0, "use_padding": 0, "time": 4.627785650889079, "times": [4.30079984664917, 4.288512229919434, 4.287487983703613, 4.287487983703613, 4.286464214324951, 4.287487983703613, 4.287487983703613, 4.5107197761535645, 4.661248207092285, 4.661248207092285, 4.662144184112549, 4.708352088928223, 4.831232070922852, 4.832255840301514, 4.831232070922852, 4.824960231781006, 4.7861762046813965, 4.787199974060059, 4.789247989654541, 4.7861762046813965, 4.7421441078186035, 4.7369279861450195, 4.737023830413818, 4.737023830413818, 4.7226881980896, 4.691967964172363, 4.690944194793701, 4.691967964172363, 4.691967964172363, 4.692992210388184], "compile_time": 796.7962282709777, "verification_time": 0, "benchmark_time": 140.09372796863317, "GFLOP/s": 2095.436474275119, "strategy_time": 0, "framework_time": 1.3074488379061222, "timestamp": "2024-01-16 12:10:53.801205+00:00"},
