kernels/outputdata/expdist/expdist_NVIDIA_RTX_A4000_size-32768x32768_cache.json
{
"device_name": "NVIDIA RTX A4000",
"kernel_name": "ExpDist",
"problem_size": "callable",
"tune_params_keys": [
"nvml_gr_clock",
"block_size_x",
"block_size_y",
"tile_size_x",
"tile_size_y",
"use_shared_mem",
"loop_unroll_factor_x",
"loop_unroll_factor_y",
"use_column",
"use_separate_acc",
"n_y_blocks"
],
"tune_params": {
"nvml_gr_clock": [
1560
],
"block_size_x": [
1024,
512,
256,
128,
64,
32
],
"block_size_y": [
1,
2,
4,
8,
16,
32
],
"tile_size_x": [
1,
2,
3,
4,
5,
6,
7,
8
],
"tile_size_y": [
1,
2,
3,
4,
5,
6,
7,
8
],
"use_shared_mem": [
0,
1,
2
],
"loop_unroll_factor_x": [
1,
2,
3,
4,
5,
6,
7,
8
],
"loop_unroll_factor_y": [
1,
2,
3,
4,
5,
6,
7,
8
],
"use_column": [
0,
1
],
"use_separate_acc": [
0
],
"n_y_blocks": [
1,
2,
4,
8,
16,
32,
64,
128,
256,
512,
1024
]
},
"objective": "GFLOP/s",
"cache": {
"1560,1024,1,1,1,0,1,1,0,0,1": {"nvml_gr_clock": 1560, "block_size_x": 1024, "block_size_y": 1, "tile_size_x": 1, "tile_size_y": 1, "use_shared_mem": 0, "loop_unroll_factor_x": 1, "loop_unroll_factor_y": 1, "use_column": 0, "use_separate_acc": 0, "n_y_blocks": 1, "core_freqs": [1560.0, 1560.0, 1560.0, 1560.0, 1560.0, 1560.0, 1560.0, 1560.0, 1560.0, 1560.0, 1560.0, 1560.0, 1560.0, 1560.0, 1560.0, 1560.0, 1560.0, 1560.0, 1560.0, 1560.0, 1560.0, 1560.0, 1560.0, 1560.0, 1560.0, 1560.0, 1560.0, 1560.0, 1560.0, 1560.0, 1560.0, 1560.0], "core_freq": 1560.0, "mem_freqs": [6501.0, 6501.0, 6501.0, 6501.0, 6501.0, 6501.0, 6501.0, 6501.0, 6501.0, 6501.0, 6501.0, 6501.0, 6501.0, 6501.0, 6501.0, 6501.0, 6501.0, 6501.0, 6501.0, 6501.0, 6501.0, 6501.0, 6501.0, 6501.0, 6501.0, 6501.0, 6501.0, 6501.0, 6501.0, 6501.0, 6501.0, 6501.0], "mem_freq": 6501.0, "temperatures": [49.84907010014306, 50.0, 50.14967811158798, 50.59097421203438, 50.86904975749955, 51.0, 51.0, 51.0, 51.0, 51.0, 51.0, 51.0, 51.0, 51.0, 51.0, 51.0, 51.0, 51.0, 51.0, 51.0, 51.0, 51.001794043774666, 51.13943001443001, 51.27078470102352, 51.60463445302676, 51.80371639906188, 52.0, 52.0, 52.0, 52.0, 52.0, 52.0], "temperature": 51.133722868518184, "num_regs": 36, "time": 442.84869384765625, "times": [442.89227294921875, 442.8636169433594, 442.8318786621094, 442.84210205078125, 442.8451843261719, 442.8554382324219, 442.8533630371094, 442.84210205078125, 442.8451843261719, 442.84210205078125, 442.8584899902344, 442.8533630371094, 442.85235595703125, 442.8450927734375, 442.8533630371094, 442.84722900390625, 442.8431396484375, 442.8441467285156, 442.8410949707031, 442.8318786621094, 442.84326171875, 442.84210205078125, 442.84930419921875, 442.84722900390625, 442.85223388671875, 442.85748291015625, 442.8523254394531, 442.84197998046875, 442.85333251953125, 442.8431396484375, 442.84722900390625, 442.8451843261719], "pwr_core_freqs": [1560.0], "pwr_core_freq": 1560.0, "pwr_mem_freqs": [6501.0], "pwr_mem_freq": 6501.0, "pwr_temperatures": [52.0], "pwr_temperature": 52.0, "nvml_energy": 25.699838250061035, "compile_time": 2829.4765977188945, "verification_time": 0, "benchmark_time": 15547.366433776915, "registers": 36, "GFLOP/s": 87.28411673106841, "strategy_time": 0, "framework_time": 10525.20733885467, "timestamp": "2024-01-19 09:45:26.479820+00:00"},
"1560,1024,1,1,1,0,1,1,1,0,1": {"nvml_gr_clock": 1560, "block_size_x": 1024, "block_size_y": 1, "tile_size_x": 1, "tile_size_y": 1, "use_shared_mem": 0, "loop_unroll_factor_x": 1, "loop_unroll_factor_y": 1, "use_column": 1, "use_separate_acc": 0, "n_y_blocks": 1, "core_freqs": [1560.0, 1560.0, 1560.0, 1560.0, 1560.0, 1560.0, 1560.0, 1560.0, 1560.0, 1560.0, 1560.0, 1560.0, 1560.0, 1560.0, 1560.0, 1560.0, 1560.0, 1560.0, 1560.0, 1560.0, 1560.0, 1560.0, 1560.0, 1560.0, 1560.0, 1560.0, 1560.0, 1560.0, 1560.0, 1560.0, 1560.0, 1560.0], "core_freq": 1560.0, "mem_freqs": [6501.0, 6501.0, 6501.0, 6501.0, 6501.0, 6501.0, 6501.0, 6501.0, 6501.0, 6501.0, 6501.0, 6501.0, 6501.0, 6501.0, 6501.0, 6501.0, 6501.0, 6501.0, 6501.0, 6501.0, 6501.0, 6501.0, 6501.0, 6501.0, 6501.0, 6501.0, 6501.0, 6501.0, 6501.0, 6501.0, 6501.0, 6501.0], "mem_freq": 6501.0, "temperatures": [50.92175141242938, 51.0, 51.0, 51.0, 51.0, 51.0, 51.0, 51.0, 51.0, 51.0, 51.0, 51.0, 51.0, 51.0, 51.0, 51.0, 51.0, 51.0, 51.0, 51.0, 51.0, 51.0, 51.0, 51.0, 51.0, 51.0, 51.0, 51.0, 51.0, 51.02384311512415, 51.113540790580316, 51.057632836660105], "temperature": 51.00364900483731, "num_regs": 42, "time": 571.3180046081543, "times": [571.3541259765625, 571.31201171875, 571.2916259765625, 571.315185546875, 571.3233642578125, 571.3325805664062, 571.304931640625, 571.30908203125, 571.3131713867188, 571.3223876953125, 571.3264770507812, 571.3253784179688, 571.3233642578125, 571.3213500976562, 571.31005859375, 571.3162231445312, 571.3203125, 571.33056640625, 571.3172607421875, 571.3172607421875, 571.3284912109375, 571.3008422851562, 571.315185546875, 571.3162231445312, 571.3203125, 571.3029174804688, 571.3233642578125, 571.3223876953125, 571.31103515625, 571.3162231445312, 571.3203125, 571.3121337890625], "pwr_core_freqs": [1560.0], "pwr_core_freq": 1560.0, "pwr_mem_freqs": [6501.0], "pwr_mem_freq": 6501.0, "pwr_temperatures": [51.15835236902218], "pwr_temperature": 51.15835236902218, "nvml_energy": 29.708536239624024, "compile_time": 2891.0874193534255, "verification_time": 0, "benchmark_time": 19482.918072491884, "registers": 42, "GFLOP/s": 67.65699098615158, "strategy_time": 0, "framework_time": 1.9779782742261887, "timestamp": "2024-01-19 09:45:48.855843+00:00"},
"1560,1024,1,1,1,0,1,1,1,0,2": {"nvml_gr_clock": 1560, "block_size_x": 1024, "block_size_y": 1, "tile_size_x": 1, "tile_size_y": 1, "use_shared_mem": 0, "loop_unroll_factor_x": 1, "loop_unroll_factor_y": 1, "use_column": 1, "use_separate_acc": 0, "n_y_blocks": 2, "core_freqs": [1560.0, 1560.0, 1560.0, 1560.0, 1560.0, 1560.0, 1560.0, 1560.0, 1560.0, 1560.0, 1560.0, 1560.0, 1560.0, 1560.0, 1560.0, 1560.0, 1560.0, 1560.0, 1560.0, 1560.0, 1560.0, 1560.0, 1560.0, 1560.0, 1560.0, 1560.0, 1560.0, 1560.0, 1560.0, 1560.0, 1560.0, 1560.0], "core_freq": 1560.0, "mem_freqs": [6501.0, 6501.0, 6501.0, 6501.0, 6501.0, 6501.0, 6501.0, 6501.0, 6501.0, 6501.0, 6501.0, 6501.0, 6501.0, 6501.0, 6501.0, 6501.0, 6501.0, 6501.0, 6501.0, 6501.0, 6501.0, 6501.0, 6501.0, 6501.0, 6501.0, 6501.0, 6501.0, 6501.0, 6501.0, 6501.0, 6501.0, 6501.0], "mem_freq": 6501.0, "temperatures": [50.89651727091065, 51.0, 51.0, 51.0, 51.0, 51.0, 51.0, 51.0, 51.0, 51.0, 51.054677488252885, 51.049262494629815, 51.1078445432382, 51.09605588706156, 51.057489760093624, 51.05782752188262, 51.10188087774295, 51.10898908673176, 51.10454610641044, 51.10419042189282, 51.212203876525486, 51.213348545350826, 51.24966779861214, 51.26855639976622, 51.32062812276945, 51.26938541068351, 51.32474820143885, 51.317571428571426, 51.37762438884096, 51.377247231410905, 51.4206315187884, 51.47724568709102], "temperature": 51.142754377146765, "num_regs": 42, "time": 564.6139163970947, "times": [564.6622924804688, 564.6264038085938, 564.6295166015625, 564.6222534179688, 564.6121215820312, 564.6018676757812, 564.611083984375, 564.6182250976562, 564.6141357421875, 564.6141357421875, 564.621337890625, 564.6243896484375, 564.6151733398438, 564.5977783203125, 564.6029052734375, 564.60595703125, 564.590576171875, 564.6171875, 564.6151733398438, 564.6069946289062, 564.6121215820312, 564.60595703125, 564.6141357421875, 564.5926513671875, 564.6192626953125, 564.6182250976562, 564.6109619140625, 564.6121215820312, 564.622314453125, 564.6069946289062, 564.6264038085938, 564.5946655273438], "pwr_core_freqs": [1560.0], "pwr_core_freq": 1560.0, "pwr_mem_freqs": [6501.0], "pwr_mem_freq": 6501.0, "pwr_temperatures": [51.49958574979288], "pwr_temperature": 51.49958574979288, "nvml_energy": 28.929687848354337, "compile_time": 2880.884286016226, "verification_time": 0, "benchmark_time": 19254.04721777886, "registers": 42, "GFLOP/s": 68.46033362878497, "strategy_time": 0, "framework_time": 1.8369229510426521, "timestamp": "2024-01-19 09:46:10.992647+00:00"},
"1560,1024,1,1,1,0,1,1,1,0,4": {"nvml_gr_clock": 1560, "block_size_x": 1024, "block_size_y": 1, "tile_size_x": 1, "tile_size_y": 1, "use_shared_mem": 0, "loop_unroll_factor_x": 1, "loop_unroll_factor_y": 1, "use_column": 1, "use_separate_acc": 0, "n_y_blocks": 4, "core_freqs": [1560.0, 1560.0, 1560.0, 1560.0, 1560.0, 1560.0, 1560.0, 1560.0, 1560.0, 1560.0, 1560.0, 1560.0, 1560.0, 1560.0, 1560.0, 1560.0, 1560.0, 1560.0, 1560.0, 1560.0, 1560.0, 1560.0, 1560.0, 1560.0, 1560.0, 1560.0, 1560.0, 1560.0, 1560.0, 1560.0, 1560.0, 1560.0], "core_freq": 1560.0, "mem_freqs": [6501.0, 6501.0, 6501.0, 6501.0, 6501.0, 6501.0, 6501.0, 6501.0, 6501.0, 6501.0, 6501.0, 6501.0, 6501.0, 6501.0, 6501.0, 6501.0, 6501.0, 6501.0, 6501.0, 6501.0, 6501.0, 6501.0, 6501.0, 6501.0, 6501.0, 6501.0, 6501.0, 6501.0, 6501.0, 6501.0, 6501.0, 6501.0], "mem_freq": 6501.0, "temperatures": [50.93619767656279, 51.0, 51.06951871657754, 51.139007619401596, 51.074326816672816, 51.3548506086315, 51.42159572507831, 51.749953934033535, 51.73811279026908, 51.91623616236162, 51.933603836222794, 52.0, 52.0, 52.0, 52.0, 52.0, 52.0, 52.0, 52.0, 52.0, 52.0, 52.0, 52.0, 52.0, 52.0, 52.0, 52.0, 52.0, 52.0, 52.0, 52.0, 52.0], "temperature": 51.79166887143161, "num_regs": 42, "time": 424.3256645202637, "times": [424.3763122558594, 424.3220520019531, 424.33331298828125, 424.32513427734375, 424.33843994140625, 424.3087463378906, 424.3189697265625, 424.3292236328125, 424.3240966796875, 424.3210144042969, 424.32513427734375, 424.3169250488281, 424.3240966796875, 424.3210144042969, 424.3138427734375, 424.3169250488281, 424.3199768066406, 424.3404846191406, 424.332275390625, 424.3394470214844, 424.32000732421875, 424.32000732421875, 424.3179626464844, 424.32513427734375, 424.332275390625, 424.32000732421875, 424.32818603515625, 424.3261413574219, 424.31591796875, 424.3240966796875, 424.3169250488281, 424.3271789550781], "pwr_core_freqs": [1560.0], "pwr_core_freq": 1560.0, "pwr_mem_freqs": [6501.0], "pwr_mem_freq": 6501.0, "pwr_temperatures": [52.0], "pwr_temperature": 52.0, "nvml_energy": 23.58953666767502, "compile_time": 2887.644755654037, "verification_time": 0, "benchmark_time": 14899.1474295035, "registers": 42, "GFLOP/s": 91.09431816173849, "strategy_time": 0, "framework_time": 2.0201383158564568, "timestamp": "2024-01-19 09:46:28.781494+00:00"},
"1560,1024,1,1,1,0,1,1,1,0,8": {"nvml_gr_clock": 1560, "block_size_x": 1024, "block_size_y": 1, "tile_size_x": 1, "tile_size_y": 1, "use_shared_mem": 0, "loop_unroll_factor_x": 1, "loop_unroll_factor_y": 1, "use_column": 1, "use_separate_acc": 0, "n_y_blocks": 8, "core_freqs": [1560.0, 1560.0, 1560.0, 1560.0, 1560.0, 1560.0, 1560.0, 1560.0, 1560.0, 1560.0, 1560.0, 1560.0, 1560.0, 1560.0, 1560.0, 1560.0, 1560.0, 1560.0, 1560.0, 1560.0, 1560.0, 1560.0, 1560.0, 1560.0, 1560.0, 1560.0, 1560.0, 1560.0, 1560.0, 1560.0, 1560.0, 1560.0], "core_freq": 1560.0, "mem_freqs": [6501.0, 6501.0, 6501.0, 6501.0, 6501.0, 6501.0, 6501.0, 6501.0, 6501.0, 6501.0, 6501.0, 6501.0, 6501.0, 6501.0, 6501.0, 6501.0, 6501.0, 6501.0, 6501.0, 6501.0, 6501.0, 6501.0, 6501.0, 6501.0, 6501.0, 6501.0, 6501.0, 6501.0, 6501.0, 6501.0, 6501.0, 6501.0], "mem_freq": 6501.0, "temperatures": [51.63758640014945, 52.0, 52.0, 52.0, 52.0, 52.0, 52.0, 52.0, 52.0, 52.0, 52.0, 52.0, 52.0, 52.0, 52.0, 52.0, 52.0, 52.068508493559825, 52.07022471910113, 52.07386255473063, 52.07151051625239, 52.21188193269411, 52.34498878085265, 52.221805919820156, 52.562744732425884, 52.638178764694906, 52.56889469753548, 52.8502713831181, 52.843294732909975, 52.78362245849655, 52.78419282511211, 52.94114241605558], "temperature": 52.208522228984656, "num_regs": 42, "time": 422.8376808166504, "times": [422.87615966796875, 422.8536376953125, 422.8290710449219, 422.8321228027344, 422.835205078125, 422.8362121582031, 422.8504638671875, 422.8331604003906, 422.81573486328125, 422.8269958496094, 422.83416748046875, 422.8536376953125, 422.8229064941406, 422.8412780761719, 422.84130859375, 422.8433837890625, 422.8464660644531, 422.83612060546875, 422.8321228027344, 422.83416748046875, 422.83612060546875, 422.8362121582031, 422.8454284667969, 422.83416748046875, 422.82598876953125, 422.8290710449219, 422.836181640625, 422.8269958496094, 422.84954833984375, 422.8372497558594, 422.84954833984375, 422.824951171875], "pwr_core_freqs": [1560.0], "pwr_core_freq": 1560.0, "pwr_mem_freqs": [6501.0], "pwr_mem_freq": 6501.0, "pwr_temperatures": [52.9535175879397], "pwr_temperature": 52.9535175879397, "nvml_energy": 23.47214249981308, "compile_time": 2791.884394362569, "verification_time": 0, "benchmark_time": 14847.729843109846, "registers": 42, "GFLOP/s": 91.41488292468638, "strategy_time": 0, "framework_time": 1.89996138215065, "timestamp": "2024-01-19 09:46:46.423042+00:00"},
"1560,1024,1,1,1,0,1,1,1,0,16": {"nvml_gr_clock": 1560, "block_size_x": 1024, "block_size_y": 1, "tile_size_x": 1, "tile_size_y": 1, "use_shared_mem": 0, "loop_unroll_factor_x": 1, "loop_unroll_factor_y": 1, "use_column": 1, "use_separate_acc": 0, "n_y_blocks": 16, "core_freqs": [1560.0, 1560.0, 1560.0, 1560.0, 1560.0, 1560.0, 1560.0, 1560.0, 1560.0, 1560.0, 1560.0, 1560.0, 1560.0, 1560.0, 1560.0, 1560.0, 1560.0, 1560.0, 1560.0, 1560.0, 1560.0, 1560.0, 1560.0, 1560.0, 1560.0, 1560.0, 1560.0, 1560.0, 1560.0, 1560.0, 1560.0, 1560.0], "core_freq": 1560.0, "mem_freqs": [6501.0, 6501.0, 6501.0, 6501.0, 6501.0, 6501.0, 6501.0, 6501.0, 6501.0, 6501.0, 6501.0, 6501.0, 6501.0, 6501.0, 6501.0, 6501.0, 6501.0, 6501.0, 6501.0, 6501.0, 6501.0, 6501.0, 6501.0, 6501.0, 6501.0, 6501.0, 6501.0, 6501.0, 6501.0, 6501.0, 6501.0, 6501.0], "mem_freq": 6501.0, "temperatures": [51.91371907585361, 52.0, 52.13804370022463, 52.29127234490011, 52.54083333333333, 52.7136989114808, 52.82177814029364, 52.92354865085854, 53.0, 53.0, 53.0, 53.0, 53.0, 53.0, 53.0, 53.0, 53.0, 53.0, 53.0, 53.0, 53.0, 53.0, 53.0, 53.0, 53.0, 53.0, 53.0, 53.0, 53.0, 53.0, 53.0, 53.0], "temperature": 52.85446544240452, "num_regs": 42, "time": 388.3025121688843, "times": [388.3376770019531, 388.29876708984375, 388.3141174316406, 388.305908203125, 388.3008117675781, 388.2946472167969, 388.2997741699219, 388.3079528808594, 388.3160400390625, 388.30181884765625, 388.305908203125, 388.2977294921875, 388.3068542480469, 388.2956848144531, 388.29876708984375, 388.29364013671875, 388.31103515625, 388.30181884765625, 388.3008117675781, 388.2905578613281, 388.2946472167969, 388.2966003417969, 388.29364013671875, 388.3130798339844, 388.30181884765625, 388.3017883300781, 388.2905578613281, 388.30682373046875, 388.306884765625, 388.3049011230469, 388.2997741699219, 388.28955078125], "pwr_core_freqs": [1560.0], "pwr_core_freq": 1560.0, "pwr_mem_freqs": [6501.0], "pwr_mem_freq": 6501.0, "pwr_temperatures": [53.0], "pwr_temperature": 53.0, "nvml_energy": 22.126642050919532, "compile_time": 2308.828837238252, "verification_time": 0, "benchmark_time": 13633.840247057378, "registers": 42, "GFLOP/s": 99.54521507496294, "strategy_time": 0, "framework_time": 1.7711594700813293, "timestamp": "2024-01-19 09:47:02.367517+00:00"},
"1560,1024,1,1,1,0,1,1,1,0,32": {"nvml_gr_clock": 1560, "block_size_x": 1024, "block_size_y": 1, "tile_size_x": 1, "tile_size_y": 1, "use_shared_mem": 0, "loop_unroll_factor_x": 1, "loop_unroll_factor_y": 1, "use_column": 1, "use_separate_acc": 0, "n_y_blocks": 32, "core_freqs": [1560.0, 1560.0, 1560.0, 1560.0, 1560.0, 1560.0, 1560.0, 1560.0, 1560.0, 1560.0, 1560.0, 1560.0, 1560.0, 1560.0, 1560.0, 1560.0, 1560.0, 1560.0, 1560.0, 1560.0, 1560.0, 1560.0, 1560.0, 1560.0, 1560.0, 1560.0, 1560.0, 1560.0, 1560.0, 1560.0, 1560.0, 1560.0], "core_freq": 1560.0, "mem_freqs": [6501.0, 6501.0, 6501.0, 6501.0, 6501.0, 6501.0, 6501.0, 6501.0, 6501.0, 6501.0, 6501.0, 6501.0, 6501.0, 6501.0, 6501.0, 6501.0, 6501.0, 6501.0, 6501.0, 6501.0, 6501.0, 6501.0, 6501.0, 6501.0, 6501.0, 6501.0, 6501.0, 6501.0, 6501.0, 6501.0, 6501.0, 6501.0], "mem_freq": 6501.0, "temperatures": [52.40974882928906, 53.0, 53.0, 53.0, 53.0, 53.0, 53.0, 53.0, 53.0, 53.0, 53.0, 53.0, 53.0, 53.0, 53.0, 53.0, 53.0, 53.0, 53.0, 53.0, 53.0, 53.0, 53.0, 53.0, 53.00186104218362, 53.15358931552588, 53.08215417106653, 53.161018732898334, 53.23000619962802, 53.22592669289708, 53.3158874637981, 53.39213250517599], "temperature": 53.03038515476446, "num_regs": 42, "time": 387.76124477386475, "times": [387.7980041503906, 387.7570495605469, 387.75909423828125, 387.75604248046875, 387.7621765136719, 387.76422119140625, 387.7611389160156, 387.7570495605469, 387.75604248046875, 387.76422119140625, 387.7580871582031, 387.7550048828125, 387.7621765136719, 387.7611389160156, 387.7703552246094, 387.7529602050781, 387.7632141113281, 387.75604248046875, 387.7611389160156, 387.7519226074219, 387.7611389160156, 387.7673034667969, 387.7580871582031, 387.75909423828125, 387.7601318359375, 387.75909423828125, 387.76422119140625, 387.75909423828125, 387.7611389160156, 387.7611389160156, 387.75909423828125, 387.7632141113281], "pwr_core_freqs": [1560.0], "pwr_core_freq": 1560.0, "pwr_mem_freqs": [6501.0], "pwr_mem_freq": 6501.0, "pwr_temperatures": [53.74678672572798], "pwr_temperature": 53.74678672572798, "nvml_energy": 22.121003491859437, "compile_time": 2882.870549336076, "verification_time": 0, "benchmark_time": 13615.44793844223, "registers": 42, "GFLOP/s": 99.68416805176625, "strategy_time": 0, "framework_time": 1.609274186193943, "timestamp": "2024-01-19 09:47:18.867478+00:00"},
"1560,1024,1,1,1,0,1,1,1,0,64": {"nvml_gr_clock": 1560, "block_size_x": 1024, "block_size_y": 1, "tile_size_x": 1, "tile_size_y": 1, "use_shared_mem": 0, "loop_unroll_factor_x": 1, "loop_unroll_factor_y": 1, "use_column": 1, "use_separate_acc": 0, "n_y_blocks": 64, "core_freqs": [1560.0, 1560.0, 1560.0, 1560.0, 1560.0, 1560.0, 1560.0, 1560.0, 1560.0, 1560.0, 1560.0, 1560.0, 1560.0, 1560.0, 1560.0, 1560.0, 1560.0, 1560.0, 1560.0, 1560.0, 1560.0, 1560.0, 1560.0, 1560.0, 1560.0, 1560.0, 1560.0, 1560.0, 1560.0, 1560.0, 1560.0, 1560.0], "core_freq": 1560.0, "mem_freqs": [6501.0, 6501.0, 6501.0, 6501.0, 6501.0, 6501.0, 6501.0, 6501.0, 6501.0, 6501.0, 6501.0, 6501.0, 6501.0, 6501.0, 6501.0, 6501.0, 6501.0, 6501.0, 6501.0, 6501.0, 6501.0, 6501.0, 6501.0, 6501.0, 6501.0, 6501.0, 6501.0, 6501.0, 6501.0, 6501.0, 6501.0, 6501.0], "mem_freq": 6501.0, "temperatures": [52.81814319099214, 53.0, 53.0, 53.0, 53.0, 53.0, 53.0, 53.0, 53.0, 53.0, 53.0, 53.0, 53.08222126560482, 53.161476109215016, 53.16549819417888, 53.290267743306416, 53.4060773480663, 53.415189873417724, 53.612786745964314, 53.84058586287412, 54.0, 54.0, 54.0, 54.0, 54.0, 54.0, 54.0, 54.0, 54.0, 54.0, 54.0, 54.0], "temperature": 53.46225769792562, "num_regs": 42, "time": 379.4802551269531, "times": [379.52203369140625, 379.48504638671875, 379.47698974609375, 379.4708557128906, 379.4832458496094, 379.4831237792969, 379.4831237792969, 379.4728088378906, 379.4892883300781, 379.4851989746094, 379.47802734375, 379.4810791015625, 379.4708557128906, 379.4790344238281, 379.4759826660156, 379.47802734375, 379.47802734375, 379.4810791015625, 379.4851989746094, 379.4749450683594, 379.46881103515625, 379.4810791015625, 379.47698974609375, 379.4749450683594, 379.47802734375, 379.4862060546875, 379.47698974609375, 379.4790344238281, 379.4800720214844, 379.4759826660156, 379.47802734375, 379.47802734375], "pwr_core_freqs": [1560.0], "pwr_core_freq": 1560.0, "pwr_mem_freqs": [6501.0], "pwr_mem_freq": 6501.0, "pwr_temperatures": [54.0], "pwr_temperature": 54.0, "nvml_energy": 21.8045559793396, "compile_time": 2770.301252603531, "verification_time": 0, "benchmark_time": 13327.498575672507, "registers": 42, "GFLOP/s": 101.85946848557016, "strategy_time": 0, "framework_time": 2.0890962332487106, "timestamp": "2024-01-19 09:47:34.967402+00:00"},
"1560,1024,1,1,1,0,1,1,1,0,128": {"nvml_gr_clock": 1560, "block_size_x": 1024, "block_size_y": 1, "tile_size_x": 1, "tile_size_y": 1, "use_shared_mem": 0, "loop_unroll_factor_x": 1, "loop_unroll_factor_y": 1, "use_column": 1, "use_separate_acc": 0, "n_y_blocks": 128, "core_freqs": [1560.0, 1560.0, 1560.0, 1560.0, 1560.0, 1560.0, 1560.0, 1560.0, 1560.0, 1560.0, 1560.0, 1560.0, 1560.0, 1560.0, 1560.0, 1560.0, 1560.0, 1560.0, 1560.0, 1560.0, 1560.0, 1560.0, 1560.0, 1560.0, 1560.0, 1560.0, 1560.0, 1560.0, 1560.0, 1560.0, 1560.0, 1560.0], "core_freq": 1560.0, "mem_freqs": [6501.0, 6501.0, 6501.0, 6501.0, 6501.0, 6501.0, 6501.0, 6501.0, 6501.0, 6501.0, 6501.0, 6501.0, 6501.0, 6501.0, 6501.0, 6501.0, 6501.0, 6501.0, 6501.0, 6501.0, 6501.0, 6501.0, 6501.0, 6501.0, 6501.0, 6501.0, 6501.0, 6501.0, 6501.0, 6501.0, 6501.0, 6501.0], "mem_freq": 6501.0, "temperatures": [52.97312169312169, 53.0, 53.0, 53.03030303030303, 53.20012801365479, 53.44735729386892, 53.52985074626866, 53.76118125401241, 53.92410119840213, 53.998049837486455, 54.0, 54.0, 54.0, 54.0, 54.0, 54.0, 54.0, 54.0, 54.0, 54.0, 54.0, 54.0, 54.0, 54.0, 54.0, 54.0, 54.0, 54.0, 54.0, 54.0, 54.0, 54.0], "temperature": 53.80825290834744, "num_regs": 42, "time": 379.3545513153076, "times": [379.3971252441406, 379.35308837890625, 379.3541259765625, 379.35308837890625, 379.35821533203125, 379.3541259765625, 379.3541259765625, 379.3510437011719, 379.3459167480469, 379.3500061035156, 379.357177734375, 379.357177734375, 379.3489990234375, 379.35205078125, 379.3541259765625, 379.3509216308594, 379.3500061035156, 379.3510437011719, 379.3551330566406, 379.3509216308594, 379.3510437011719, 379.357177734375, 379.3551330566406, 379.35205078125, 379.3551330566406, 379.3561706542969, 379.357177734375, 379.3510437011719, 379.3530578613281, 379.35205078125, 379.3500061035156, 379.357177734375], "pwr_core_freqs": [1560.0], "pwr_core_freq": 1560.0, "pwr_mem_freqs": [6501.0], "pwr_mem_freq": 6501.0, "pwr_temperatures": [54.0], "pwr_temperature": 54.0, "nvml_energy": 21.799988645885467, "compile_time": 2781.0879796743393, "verification_time": 0, "benchmark_time": 13321.884023025632, "registers": 42, "GFLOP/s": 101.89322087735358, "strategy_time": 0, "framework_time": 1.7725713551044464, "timestamp": "2024-01-19 09:47:51.072177+00:00"},
"1560,1024,1,1,1,0,1,1,1,0,256": {"nvml_gr_clock": 1560, "block_size_x": 1024, "block_size_y": 1, "tile_size_x": 1, "tile_size_y": 1, "use_shared_mem": 0, "loop_unroll_factor_x": 1, "loop_unroll_factor_y": 1, "use_column": 1, "use_separate_acc": 0, "n_y_blocks": 256, "core_freqs": [1560.0, 1560.0, 1560.0, 1560.0, 1560.0, 1560.0, 1560.0, 1560.0, 1560.0, 1560.0, 1560.0, 1560.0, 1560.0, 1560.0, 1560.0, 1560.0, 1560.0, 1560.0, 1560.0, 1560.0, 1560.0, 1560.0, 1560.0, 1560.0, 1560.0, 1560.0, 1560.0, 1560.0, 1560.0, 1560.0, 1560.0, 1560.0], "core_freq": 1560.0, "mem_freqs": [6501.0, 6501.0, 6501.0, 6501.0, 6501.0, 6501.0, 6501.0, 6501.0, 6501.0, 6501.0, 6501.0, 6501.0, 6501.0, 6501.0, 6501.0, 6501.0, 6501.0, 6501.0, 6501.0, 6501.0, 6501.0, 6501.0, 6501.0, 6501.0, 6501.0, 6501.0, 6501.0, 6501.0, 6501.0, 6501.0, 6501.0, 6501.0], "mem_freq": 6501.0, "temperatures": [53.0, 53.304185661002904, 53.8420725388601, 54.0, 54.0, 54.0, 54.0, 54.0, 54.0, 54.0, 54.0, 54.0, 54.0, 54.0, 54.0, 54.0, 54.0, 54.0, 54.0, 54.0, 54.0, 54.0, 54.0, 54.0, 54.0, 54.0, 54.0, 54.0, 54.0, 54.0, 54.0, 54.0], "temperature": 53.94207056874572, "num_regs": 42, "time": 377.6158285140991, "times": [377.65325927734375, 377.6174011230469, 377.6153564453125, 377.6134338378906, 377.6143493652344, 377.61639404296875, 377.6174011230469, 377.6142578125, 377.6133117675781, 377.61126708984375, 377.6214904785156, 377.6153564453125, 377.6133117675781, 377.61639404296875, 377.61639404296875, 377.6143493652344, 377.61126708984375, 377.6121520996094, 377.6132507324219, 377.6122741699219, 377.6142272949219, 377.6143493652344, 377.6143493652344, 377.61639404296875, 377.61932373046875, 377.61126708984375, 377.6132507324219, 377.6143493652344, 377.6133117675781, 377.6143493652344, 377.6184387207031, 377.6102294921875], "pwr_core_freqs": [1560.0], "pwr_core_freq": 1560.0, "pwr_mem_freqs": [6501.0], "pwr_mem_freq": 6501.0, "pwr_temperatures": [54.0], "pwr_temperature": 54.0, "nvml_energy": 21.735755897185804, "compile_time": 2873.314249329269, "verification_time": 0, "benchmark_time": 13261.258208192885, "registers": 42, "GFLOP/s": 102.36238570851323, "strategy_time": 0, "framework_time": 1.8444666638970375, "timestamp": "2024-01-19 09:48:07.208630+00:00"},
"1560,1024,1,1,1,0,1,1,1,0,512": {"nvml_gr_clock": 1560, "block_size_x": 1024, "block_size_y": 1, "tile_size_x": 1, "tile_size_y": 1, "use_shared_mem": 0, "loop_unroll_factor_x": 1, "loop_unroll_factor_y": 1, "use_column": 1, "use_separate_acc": 0, "n_y_blocks": 512, "core_freqs": [1560.0, 1560.0, 1560.0, 1560.0, 1560.0, 1560.0, 1560.0, 1560.0, 1560.0, 1560.0, 1560.0, 1560.0, 1560.0, 1560.0, 1560.0, 1560.0, 1560.0, 1560.0, 1560.0, 1560.0, 1560.0, 1560.0, 1560.0, 1560.0, 1560.0, 1560.0, 1560.0, 1560.0, 1560.0, 1560.0, 1560.0, 1560.0], "core_freq": 1560.0, "mem_freqs": [6501.0, 6501.0, 6501.0, 6501.0, 6501.0, 6501.0, 6501.0, 6501.0, 6501.0, 6501.0, 6501.0, 6501.0, 6501.0, 6501.0, 6501.0, 6501.0, 6501.0, 6501.0, 6501.0, 6501.0, 6501.0, 6501.0, 6501.0, 6501.0, 6501.0, 6501.0, 6501.0, 6501.0, 6501.0, 6501.0, 6501.0, 6501.0], "mem_freq": 6501.0, "temperatures": [53.402289281997916, 54.0, 54.0, 54.0, 54.0, 54.0, 54.0, 54.0, 54.0, 54.0, 54.0, 54.0, 54.0, 54.0, 54.0, 54.0, 54.0, 54.0, 54.0, 54.0, 54.0, 54.0, 54.0, 54.0, 54.0, 54.0, 54.0, 54.0, 54.0, 54.0, 54.0, 54.077717976318624], "temperature": 53.983750226822394, "num_regs": 42, "time": 378.1028776168823, "times": [378.14068603515625, 378.1006774902344, 378.0997009277344, 378.10174560546875, 378.102783203125, 378.102783203125, 378.0966491699219, 378.0997009277344, 378.1007385253906, 378.0966491699219, 378.0997009277344, 378.102783203125, 378.1007385253906, 378.1058654785156, 378.102783203125, 378.1007385253906, 378.1140441894531, 378.1058654785156, 378.102783203125, 378.10174560546875, 378.0966491699219, 378.102783203125, 378.1007385253906, 378.10382080078125, 378.0956115722656, 378.1048278808594, 378.10174560546875, 378.10174560546875, 378.1058654785156, 378.09356689453125, 378.1007385253906, 378.1048278808594], "pwr_core_freqs": [1560.0], "pwr_core_freq": 1560.0, "pwr_mem_freqs": [6501.0], "pwr_mem_freq": 6501.0, "pwr_temperatures": [54.128934310893875], "pwr_temperature": 54.128934310893875, "nvml_energy": 21.773432310445784, "compile_time": 2724.1763966158032, "verification_time": 0, "benchmark_time": 13276.07405744493, "registers": 42, "GFLOP/s": 102.2305287164895, "strategy_time": 0, "framework_time": 1.704653725028038, "timestamp": "2024-01-19 09:48:23.210618+00:00"},
"1560,1024,1,1,1,0,1,1,1,0,1024": {"nvml_gr_clock": 1560, "block_size_x": 1024, "block_size_y": 1, "tile_size_x": 1, "tile_size_y": 1, "use_shared_mem": 0, "loop_unroll_factor_x": 1, "loop_unroll_factor_y": 1, "use_column": 1, "use_separate_acc": 0, "n_y_blocks": 1024, "core_freqs": [1560.0, 1560.0, 1560.0, 1560.0, 1560.0, 1560.0, 1560.0, 1560.0, 1560.0, 1560.0, 1560.0, 1560.0, 1560.0, 1560.0, 1560.0, 1560.0, 1560.0, 1560.0, 1560.0, 1560.0, 1560.0, 1560.0, 1560.0, 1560.0, 1560.0, 1560.0, 1560.0, 1560.0, 1560.0, 1560.0, 1560.0, 1560.0], "core_freq": 1560.0, "mem_freqs": [6501.0, 6501.0, 6501.0, 6501.0, 6501.0, 6501.0, 6501.0, 6501.0, 6501.0, 6501.0, 6501.0, 6501.0, 6501.0, 6501.0, 6501.0, 6501.0, 6501.0, 6501.0, 6501.0, 6501.0, 6501.0, 6501.0, 6501.0, 6501.0, 6501.0, 6501.0, 6501.0, 6501.0, 6501.0, 6501.0, 6501.0, 6501.0], "mem_freq": 6501.0, "temperatures": [53.5170762182424, 54.0, 54.0, 54.0, 54.0, 54.0, 54.0, 54.0, 54.0, 54.0, 54.0, 54.0, 54.0, 54.0, 54.0, 54.0, 54.0, 54.0, 54.0, 54.0, 54.0, 54.0, 54.03524968527067, 54.127539267015706, 54.20304992688531, 54.057196731615335, 54.21460037759597, 54.3642467477969, 54.27966645285439, 54.443602511366095, 54.45244651556874, 54.60509152114454], "temperature": 54.07186768610488, "num_regs": 42, "time": 379.1588077545166, "times": [379.19744873046875, 379.1677551269531, 379.1626281738281, 379.156494140625, 379.16058349609375, 379.1595458984375, 379.1563720703125, 379.156494140625, 379.1575012207031, 379.1534118652344, 379.1534118652344, 379.15435791015625, 379.15533447265625, 379.1626281738281, 379.15435791015625, 379.1534118652344, 379.1708068847656, 379.1585388183594, 379.1513671875, 379.1595458984375, 379.1585998535156, 379.1615905761719, 379.1534118652344, 379.1534118652344, 379.1595458984375, 379.15545654296875, 379.1544189453125, 379.1544189453125, 379.156494140625, 379.1575012207031, 379.1615905761719, 379.1534118652344], "pwr_core_freqs": [1560.0], "pwr_core_freq": 1560.0, "pwr_mem_freqs": [6501.0], "pwr_mem_freq": 6501.0, "pwr_temperatures": [54.81514214169981], "pwr_temperature": 54.81514214169981, "nvml_energy": 21.851301249700548, "compile_time": 2905.26598226279, "verification_time": 0, "benchmark_time": 13312.37789709121, "registers": 42, "GFLOP/s": 101.94582401215379, "strategy_time": 0, "framework_time": 2.188943326473236, "timestamp": "2024-01-19 09:48:39.430482+00:00"},
"1560,1024,1,1,1,1,1,1,0,0,1": {"nvml_gr_clock": 1560, "block_size_x": 1024, "block_size_y": 1, "tile_size_x": 1, "tile_size_y": 1, "use_shared_mem": 1, "loop_unroll_factor_x": 1, "loop_unroll_factor_y": 1, "use_column": 0, "use_separate_acc": 0, "n_y_blocks": 1, "core_freqs": [1560.0, 1560.0, 1560.0, 1560.0, 1560.0, 1560.0, 1560.0, 1560.0, 1560.0, 1560.0, 1560.0, 1560.0, 1560.0, 1560.0, 1560.0, 1560.0, 1560.0, 1560.0, 1560.0, 1560.0, 1560.0, 1560.0, 1560.0, 1560.0, 1560.0, 1560.0, 1560.0, 1560.0, 1560.0, 1560.0, 1560.0, 1560.0], "core_freq": 1560.0, "mem_freqs": [6501.0, 6501.0, 6501.0, 6501.0, 6501.0, 6501.0, 6501.0, 6501.0, 6501.0, 6501.0, 6501.0, 6501.0, 6501.0, 6501.0, 6501.0, 6501.0, 6501.0, 6501.0, 6501.0, 6501.0, 6501.0, 6501.0, 6501.0, 6501.0, 6501.0, 6501.0, 6501.0, 6501.0, 6501.0, 6501.0, 6501.0, 6501.0], "mem_freq": 6501.0, "temperatures": [53.80124888492418, 54.0, 54.0, 54.0, 54.0, 54.189601386481804, 54.197246907126676, 54.36964440589766, 54.607832898172326, 54.80777274311607, 54.93581671913256, 55.0, 55.0, 55.0, 55.0, 55.0, 55.0, 55.0, 55.0, 55.0, 55.0, 55.0, 55.0, 55.0, 55.0, 55.0, 55.0, 55.0, 55.0, 55.0, 55.0, 55.0], "temperature": 54.7471613732766, "num_regs": 36, "time": 459.1962833404541, "times": [459.2220153808594, 459.1984558105469, 459.1994934082031, 459.1954040527344, 459.1984558105469, 459.1943664550781, 459.1933288574219, 459.1994934082031, 459.1933288574219, 459.1984558105469, 459.1933288574219, 459.1994934082031, 459.19232177734375, 459.1933288574219, 459.1984558105469, 459.1984558105469, 459.1943664550781, 459.19744873046875, 459.20556640625, 459.1902770996094, 459.1902770996094, 459.1984558105469, 459.1912841796875, 459.1943664550781, 459.1912841796875, 459.19232177734375, 459.1954040527344, 459.1964111328125, 459.2046203613281, 459.1892395019531, 459.1902770996094, 459.1912841796875], "pwr_core_freqs": [1560.0], "pwr_core_freq": 1560.0, "pwr_mem_freqs": [6501.0], "pwr_mem_freq": 6501.0, "pwr_temperatures": [55.0], "pwr_temperature": 55.0, "nvml_energy": 27.66014732329559, "compile_time": 2854.6605883166194, "verification_time": 0, "benchmark_time": 16121.56359758228, "registers": 36, "GFLOP/s": 84.17676381614282, "strategy_time": 0, "framework_time": 2.151802182197571, "timestamp": "2024-01-19 09:48:58.408889+00:00"},
"1560,1024,1,1,1,1,1,1,1,0,1": {"nvml_gr_clock": 1560, "block_size_x": 1024, "block_size_y": 1, "tile_size_x": 1, "tile_size_y": 1, "use_shared_mem": 1, "loop_unroll_factor_x": 1, "loop_unroll_factor_y": 1, "use_column": 1, "use_separate_acc": 0, "n_y_blocks": 1, "core_freqs": [1560.0, 1560.0, 1560.0, 1560.0, 1560.0, 1560.0, 1560.0, 1560.0, 1560.0, 1560.0, 1560.0, 1560.0, 1560.0, 1560.0, 1560.0, 1560.0, 1560.0, 1560.0, 1560.0, 1560.0, 1560.0, 1560.0, 1560.0, 1560.0, 1560.0, 1560.0, 1560.0, 1560.0, 1560.0, 1560.0, 1560.0, 1560.0], "core_freq": 1560.0, "mem_freqs": [6501.0, 6501.0, 6501.0, 6501.0, 6501.0, 6501.0, 6501.0, 6501.0, 6501.0, 6501.0, 6501.0, 6501.0, 6501.0, 6501.0, 6501.0, 6501.0, 6501.0, 6501.0, 6501.0, 6501.0, 6501.0, 6501.0, 6501.0, 6501.0, 6501.0, 6501.0, 6501.0, 6501.0, 6501.0, 6501.0, 6501.0, 6501.0], "mem_freq": 6501.0, "temperatures": [54.0, 54.0, 54.0, 54.0, 54.0, 54.0, 54.0, 54.0, 54.0, 54.0, 54.0, 54.0, 54.0, 54.0, 54.0, 54.0, 54.0, 54.0, 54.0, 54.0, 54.0, 54.0, 54.0, 54.0, 54.0, 54.0, 54.0, 54.0, 54.0, 54.0, 54.0, 54.0], "temperature": 54.0, "num_regs": 38, "time": 586.0664253234863, "times": [586.1201782226562, 586.0648803710938, 586.0679931640625, 586.0597534179688, 586.0720825195312, 586.0669555664062, 586.06591796875, 586.0669555664062, 586.060791015625, 586.0669555664062, 586.0740966796875, 586.0689697265625, 586.0720825195312, 586.0597534179688, 586.06591796875, 586.056640625, 586.0700073242188, 586.071044921875, 586.0577392578125, 586.0587768554688, 586.0587768554688, 586.060791015625, 586.060791015625, 586.0597534179688, 586.0689697265625, 586.0618286132812, 586.06591796875, 586.0740966796875, 586.060791015625, 586.060791015625, 586.0638427734375, 586.061767578125], "pwr_core_freqs": [1560.0], "pwr_core_freq": 1560.0, "pwr_mem_freqs": [6501.0], "pwr_mem_freq": 6501.0, "pwr_temperatures": [54.0], "pwr_temperature": 54.0, "nvml_energy": 30.597941999713896, "compile_time": 2830.0310177728534, "verification_time": 0, "benchmark_time": 19986.882989294827, "registers": 38, "GFLOP/s": 65.95439598278413, "strategy_time": 0, "framework_time": 1.6911793500185013, "timestamp": "2024-01-19 09:49:21.227526+00:00"},
"1560,1024,1,1,1,1,1,1,1,0,2": {"nvml_gr_clock": 1560, "block_size_x": 1024, "block_size_y": 1, "tile_size_x": 1, "tile_size_y": 1, "use_shared_mem": 1, "loop_unroll_factor_x": 1, "loop_unroll_factor_y": 1, "use_column": 1, "use_separate_acc": 0, "n_y_blocks": 2, "core_freqs": [1560.0, 1560.0, 1560.0, 1560.0, 1560.0, 1560.0, 1560.0, 1560.0, 1560.0, 1560.0, 1560.0, 1560.0, 1560.0, 1560.0, 1560.0, 1560.0, 1560.0, 1560.0, 1560.0, 1560.0, 1560.0, 1560.0, 1560.0, 1560.0, 1560.0, 1560.0, 1560.0, 1560.0, 1560.0, 1560.0, 1560.0, 1560.0], "core_freq": 1560.0, "mem_freqs": [6501.0, 6501.0, 6501.0, 6501.0, 6501.0, 6501.0, 6501.0, 6501.0, 6501.0, 6501.0, 6501.0, 6501.0, 6501.0, 6501.0, 6501.0, 6501.0, 6501.0, 6501.0, 6501.0, 6501.0, 6501.0, 6501.0, 6501.0, 6501.0, 6501.0, 6501.0, 6501.0, 6501.0, 6501.0, 6501.0, 6501.0, 6501.0], "mem_freq": 6501.0, "temperatures": [53.3684800897364, 53.5182123844214, 53.61969463510295, 53.667918231122236, 53.729881035689296, 53.72790925640667, 53.72348484848485, 53.72091026191499, 53.725740189828585, 53.720734613767, 53.631201686577654, 53.67237507018529, 53.617614269788184, 53.626649817467005, 53.626739772247994, 53.779699461298556, 53.770909602928754, 53.77607694391764, 53.72517227401703, 53.725847858397515, 53.725084516565246, 53.6752263819435, 53.62130017569942, 53.620116263350006, 53.57194344330468, 53.720493488690884, 53.671849648458625, 53.66972972972973, 53.62508456230551, 53.72577152138603, 53.72377858979564, 53.723438767234384], "temperature": 53.67340841849261, "num_regs": 38, "time": 579.304859161377, "times": [579.346435546875, 579.3054809570312, 579.3085327148438, 579.3085327148438, 579.2952270507812, 579.2952270507812, 579.3177490234375, 579.294189453125, 579.3065185546875, 579.2962646484375, 579.2973022460938, 579.3125610351562, 579.3074951171875, 579.3085327148438, 579.3034057617188, 579.29931640625, 579.3074951171875, 579.3085327148438, 579.3065185546875, 579.2962646484375, 579.3054809570312, 579.29931640625, 579.294189453125, 579.3013916015625, 579.3034057617188, 579.3116455078125, 579.3054809570312, 579.304443359375, 579.304443359375, 579.3034057617188, 579.29931640625, 579.3013916015625], "pwr_core_freqs": [1560.0], "pwr_core_freq": 1560.0, "pwr_mem_freqs": [6501.0], "pwr_mem_freq": 6501.0, "pwr_temperatures": [53.700021659085984], "pwr_temperature": 53.700021659085984, "nvml_energy": 29.78959377265549, "compile_time": 2858.356344513595, "verification_time": 0, "benchmark_time": 19756.163806654513, "registers": 38, "GFLOP/s": 66.72420656708535, "strategy_time": 0, "framework_time": 1.8508397042751312, "timestamp": "2024-01-19 09:49:43.843931+00:00"},
"1560,1024,1,1,1,1,1,1,1,0,4": {"nvml_gr_clock": 1560, "block_size_x": 1024, "block_size_y": 1, "tile_size_x": 1, "tile_size_y": 1, "use_shared_mem": 1, "loop_unroll_factor_x": 1, "loop_unroll_factor_y": 1, "use_column": 1, "use_separate_acc": 0, "n_y_blocks": 4, "core_freqs": [1560.0, 1560.0, 1560.0, 1560.0, 1560.0, 1560.0, 1560.0, 1560.0, 1560.0, 1560.0, 1560.0, 1560.0, 1560.0, 1560.0, 1560.0, 1560.0, 1560.0, 1560.0, 1560.0, 1560.0, 1560.0, 1560.0, 1560.0, 1560.0, 1560.0, 1560.0, 1560.0, 1560.0, 1560.0, 1560.0, 1560.0, 1560.0], "core_freq": 1560.0, "mem_freqs": [6501.0, 6501.0, 6501.0, 6501.0, 6501.0, 6501.0, 6501.0, 6501.0, 6501.0, 6501.0, 6501.0, 6501.0, 6501.0, 6501.0, 6501.0, 6501.0, 6501.0, 6501.0, 6501.0, 6501.0, 6501.0, 6501.0, 6501.0, 6501.0, 6501.0, 6501.0, 6501.0, 6501.0, 6501.0, 6501.0, 6501.0, 6501.0], "mem_freq": 6501.0, "temperatures": [52.894404332129966, 53.0, 53.0, 53.0, 53.0702981229297, 53.13395348837209, 53.14433363553944, 53.34262443438914, 53.390402309218835, 53.57449882607911, 53.48613879325965, 53.84923354373309, 53.79841183901823, 53.72370088719899, 54.0, 54.0, 53.939125518281195, 54.0, 54.0, 54.0, 54.0, 54.0, 54.0, 54.0, 54.0, 54.0, 54.0, 54.0, 54.0, 54.0, 54.0, 54.0], "temperature": 53.69834767906717, "num_regs": 38, "time": 435.7912130355835, "times": [435.8388366699219, 435.7939147949219, 435.78570556640625, 435.7918701171875, 435.7908630371094, 435.7918701171875, 435.7908630371094, 435.79595947265625, 435.79290771484375, 435.79595947265625, 435.7999572753906, 435.7867431640625, 435.7898254394531, 435.78369140625, 435.7816467285156, 435.7887878417969, 435.7908630371094, 435.7887878417969, 435.7876892089844, 435.7918701171875, 435.7980041503906, 435.7857360839844, 435.7806091308594, 435.7958679199219, 435.7980041503906, 435.7795715332031, 435.7918701171875, 435.7867431640625, 435.7867431640625, 435.7806091308594, 435.7846984863281, 435.791748046875], "pwr_core_freqs": [1560.0], "pwr_core_freq": 1560.0, "pwr_mem_freqs": [6501.0], "pwr_mem_freq": 6501.0, "pwr_temperatures": [54.0], "pwr_temperature": 54.0, "nvml_energy": 24.281414807916644, "compile_time": 2870.2952908352017, "verification_time": 0, "benchmark_time": 15300.754437223077, "registers": 38, "GFLOP/s": 88.69765137931735, "strategy_time": 0, "framework_time": 2.3262789472937584, "timestamp": "2024-01-19 09:50:02.017341+00:00"},
"1560,1024,1,1,1,1,1,1,1,0,8": {"nvml_gr_clock": 1560, "block_size_x": 1024, "block_size_y": 1, "tile_size_x": 1, "tile_size_y": 1, "use_shared_mem": 1, "loop_unroll_factor_x": 1, "loop_unroll_factor_y": 1, "use_column": 1, "use_separate_acc": 0, "n_y_blocks": 8, "core_freqs": [1560.0, 1560.0, 1560.0, 1560.0, 1560.0, 1560.0, 1560.0, 1560.0, 1560.0, 1560.0, 1560.0, 1560.0, 1560.0, 1560.0, 1560.0, 1560.0, 1560.0, 1560.0, 1560.0, 1560.0, 1560.0, 1560.0, 1560.0, 1560.0, 1560.0, 1560.0, 1560.0, 1560.0, 1560.0, 1560.0, 1560.0, 1560.0], "core_freq": 1560.0, "mem_freqs": [6501.0, 6501.0, 6501.0, 6501.0, 6501.0, 6501.0, 6501.0, 6501.0, 6501.0, 6501.0, 6501.0, 6501.0, 6501.0, 6501.0, 6501.0, 6501.0, 6501.0, 6501.0, 6501.0, 6501.0, 6501.0, 6501.0, 6501.0, 6501.0, 6501.0, 6501.0, 6501.0, 6501.0, 6501.0, 6501.0, 6501.0, 6501.0], "mem_freq": 6501.0, "temperatures": [52.95983935742972, 53.071939805468894, 53.34915997078159, 53.62151829601311, 53.69388127853881, 53.86125273124545, 53.78944494995451, 53.90021929824562, 53.9705186533212, 53.93361298559183, 53.92700319009195, 54.0, 54.0, 54.0, 54.0, 54.0, 54.0, 54.0, 54.0, 54.0, 54.0, 54.0, 54.0, 54.0, 54.0, 54.0, 54.0, 54.0, 54.0, 54.0, 54.0, 54.0], "temperature": 53.877449703646334, "num_regs": 38, "time": 434.31375885009766, "times": [434.3603210449219, 434.32037353515625, 434.31219482421875, 434.2896728515625, 434.3132019042969, 434.3009338378906, 434.3039855957031, 434.3132019042969, 434.32958984375, 434.29376220703125, 434.3101501464844, 434.3459777832031, 434.3162841796875, 434.3234558105469, 434.30810546875, 434.3316345214844, 434.3193664550781, 434.29888916015625, 434.302978515625, 434.3152770996094, 434.3111572265625, 434.2968444824219, 434.2958068847656, 434.29888916015625, 434.3132019042969, 434.3152770996094, 434.32037353515625, 434.3091125488281, 434.2998962402344, 434.3377990722656, 434.3162841796875, 434.3162841796875], "pwr_core_freqs": [1560.0], "pwr_core_freq": 1560.0, "pwr_mem_freqs": [6501.0], "pwr_mem_freq": 6501.0, "pwr_temperatures": [54.0], "pwr_temperature": 54.0, "nvml_energy": 24.129169500434877, "compile_time": 2605.859398841858, "verification_time": 0, "benchmark_time": 15252.60641798377, "registers": 38, "GFLOP/s": 88.99938420173609, "strategy_time": 0, "framework_time": 1.735311932861805, "timestamp": "2024-01-19 09:50:19.877577+00:00"},
"1560,1024,1,1,1,1,1,1,1,0,16": {"nvml_gr_clock": 1560, "block_size_x": 1024, "block_size_y": 1, "tile_size_x": 1, "tile_size_y": 1, "use_shared_mem": 1, "loop_unroll_factor_x": 1, "loop_unroll_factor_y": 1, "use_column": 1, "use_separate_acc": 0, "n_y_blocks": 16, "core_freqs": [1560.0, 1560.0, 1560.0, 1560.0, 1560.0, 1560.0, 1560.0, 1560.0, 1560.0, 1560.0, 1560.0, 1560.0, 1560.0, 1560.0, 1560.0, 1560.0, 1560.0, 1560.0, 1560.0, 1560.0, 1560.0, 1560.0, 1560.0, 1560.0, 1560.0, 1560.0, 1560.0, 1560.0, 1560.0, 1560.0, 1560.0, 1560.0], "core_freq": 1560.0, "mem_freqs": [6501.0, 6501.0, 6501.0, 6501.0, 6501.0, 6501.0, 6501.0, 6501.0, 6501.0, 6501.0, 6501.0, 6501.0, 6501.0, 6501.0, 6501.0, 6501.0, 6501.0, 6501.0, 6501.0, 6501.0, 6501.0, 6501.0, 6501.0, 6501.0, 6501.0, 6501.0, 6501.0, 6501.0, 6501.0, 6501.0, 6501.0, 6501.0], "mem_freq": 6501.0, "temperatures": [53.0, 53.46484218937275, 53.92598519703941, 54.0, 54.0, 54.0, 54.0, 54.0, 54.0, 54.0, 54.0, 54.0, 54.0, 54.0, 54.0, 54.0, 54.0, 54.0, 54.0, 54.0, 54.0, 54.0, 54.0, 54.0, 54.0, 54.0, 54.0, 54.0, 54.0, 54.0, 54.0, 54.0], "temperature": 53.94971335582538, "num_regs": 38, "time": 398.8244791030884, "times": [398.8797302246094, 398.8346862792969, 398.8377685546875, 398.8080749511719, 398.8162536621094, 398.8029479980469, 398.8102111816406, 398.83367919921875, 398.8295593261719, 398.8357238769531, 398.7988586425781, 398.817138671875, 398.81829833984375, 398.8295593261719, 398.8407287597656, 398.8387756347656, 398.82855224609375, 398.8265075683594, 398.8326416015625, 398.8275146484375, 398.80511474609375, 398.803955078125, 398.8295593261719, 398.8377685546875, 398.8377685546875, 398.82659912109375, 398.7978210449219, 398.84185791015625, 398.8275146484375, 398.7947082519531, 398.7988586425781, 398.8345947265625], "pwr_core_freqs": [1560.0], "pwr_core_freq": 1560.0, "pwr_mem_freqs": [6501.0], "pwr_mem_freq": 6501.0, "pwr_temperatures": [54.0], "pwr_temperature": 54.0, "nvml_energy": 22.745757692207334, "compile_time": 2870.428408496082, "verification_time": 0, "benchmark_time": 14032.275308854878, "registers": 38, "GFLOP/s": 96.91896840165818, "strategy_time": 0, "framework_time": 1.6151191666722298, "timestamp": "2024-01-19 09:50:36.781930+00:00"},
"1560,1024,1,1,1,1,1,1,1,0,32": {"nvml_gr_clock": 1560, "block_size_x": 1024, "block_size_y": 1, "tile_size_x": 1, "tile_size_y": 1, "use_shared_mem": 1, "loop_unroll_factor_x": 1, "loop_unroll_factor_y": 1, "use_column": 1, "use_separate_acc": 0, "n_y_blocks": 32, "core_freqs": [1560.0, 1560.0, 1560.0, 1560.0, 1560.0, 1560.0, 1560.0, 1560.0, 1560.0, 1560.0, 1560.0, 1560.0, 1560.0, 1560.0, 1560.0, 1560.0, 1560.0, 1560.0, 1560.0, 1560.0, 1560.0, 1560.0, 1560.0, 1560.0, 1560.0, 1560.0, 1560.0, 1560.0, 1560.0, 1560.0, 1560.0, 1560.0], "core_freq": 1560.0, "mem_freqs": [6501.0, 6501.0, 6501.0, 6501.0, 6501.0, 6501.0, 6501.0, 6501.0, 6501.0, 6501.0, 6501.0, 6501.0, 6501.0, 6501.0, 6501.0, 6501.0, 6501.0, 6501.0, 6501.0, 6501.0, 6501.0, 6501.0, 6501.0, 6501.0, 6501.0, 6501.0, 6501.0, 6501.0, 6501.0, 6501.0, 6501.0, 6501.0], "mem_freq": 6501.0, "temperatures": [53.422532320952186, 54.0, 54.0, 54.0, 54.0, 54.0, 54.0, 54.0, 54.0, 54.0, 54.0, 54.0, 54.0, 54.0, 54.0, 54.0, 54.0, 54.0, 54.0, 54.0, 54.0, 54.0, 54.0, 54.0, 54.0, 54.0, 54.0, 54.0, 54.0, 54.0, 54.0, 54.0], "temperature": 53.98195413502975, "num_regs": 38, "time": 398.2401866912842, "times": [398.28070068359375, 398.23455810546875, 398.2417907714844, 398.2336120605469, 398.2417907714844, 398.2510070800781, 398.2591857910156, 398.2325744628906, 398.234619140625, 398.2510070800781, 398.234619140625, 398.2479248046875, 398.2428283691406, 398.2336120605469, 398.2141418457031, 398.244873046875, 398.23858642578125, 398.2377014160156, 398.2550964355469, 398.2274475097656, 398.21722412109375, 398.2428283691406, 398.22235107421875, 398.2377014160156, 398.23974609375, 398.23565673828125, 398.2561340332031, 398.2377014160156, 398.23565673828125, 398.2490539550781, 398.23553466796875, 398.23870849609375], "pwr_core_freqs": [1560.0], "pwr_core_freq": 1560.0, "pwr_mem_freqs": [6501.0], "pwr_mem_freq": 6501.0, "pwr_temperatures": [54.02494347088751], "pwr_temperature": 54.02494347088751, "nvml_energy": 22.715819368964194, "compile_time": 2847.0200980082154, "verification_time": 0, "benchmark_time": 14011.470627970994, "registers": 38, "GFLOP/s": 97.06116655164266, "strategy_time": 0, "framework_time": 1.6537094488739967, "timestamp": "2024-01-19 09:50:53.642110+00:00"},
"1560,1024,1,1,1,1,1,1,1,0,64": {"nvml_gr_clock": 1560, "block_size_x": 1024, "block_size_y": 1, "tile_size_x": 1, "tile_size_y": 1, "use_shared_mem": 1, "loop_unroll_factor_x": 1, "loop_unroll_factor_y": 1, "use_column": 1, "use_separate_acc": 0, "n_y_blocks": 64, "core_freqs": [1560.0, 1560.0, 1560.0, 1560.0, 1560.0, 1560.0, 1560.0, 1560.0, 1560.0, 1560.0, 1560.0, 1560.0, 1560.0, 1560.0, 1560.0, 1560.0, 1560.0, 1560.0, 1560.0, 1560.0, 1560.0, 1560.0, 1560.0, 1560.0, 1560.0, 1560.0, 1560.0, 1560.0, 1560.0, 1560.0, 1560.0, 1560.0], "core_freq": 1560.0, "mem_freqs": [6501.0, 6501.0, 6501.0, 6501.0, 6501.0, 6501.0, 6501.0, 6501.0, 6501.0, 6501.0, 6501.0, 6501.0, 6501.0, 6501.0, 6501.0, 6501.0, 6501.0, 6501.0, 6501.0, 6501.0, 6501.0, 6501.0, 6501.0, 6501.0, 6501.0, 6501.0, 6501.0, 6501.0, 6501.0, 6501.0, 6501.0, 6501.0], "mem_freq": 6501.0, "temperatures": [53.54143302180685, 54.0, 54.0, 54.0, 54.0, 54.0, 54.0, 54.0, 54.0, 54.0, 54.0, 54.0, 54.0, 54.0, 54.0, 54.0, 54.0, 54.0, 54.0, 54.0, 54.0, 54.0, 54.0, 54.0, 54.0, 54.0, 54.075946733250106, 54.00561680882047, 54.161048689138575, 54.21678467305289, 54.15190664721817, 54.463704630788484], "temperature": 54.01926378762737, "num_regs": 38, "time": 389.7349376678467, "times": [389.7794494628906, 389.7344055175781, 389.7292785644531, 389.71905517578125, 389.7364501953125, 389.73236083984375, 389.7313232421875, 389.7333679199219, 389.7261962890625, 389.7282409667969, 389.7436218261719, 389.7425842285156, 389.7313232421875, 389.72723388671875, 389.7344055175781, 389.75079345703125, 389.7292785644531, 389.7364501953125, 389.7261962890625, 389.72613525390625, 389.736328125, 389.7364501953125, 389.72723388671875, 389.7303161621094, 389.7477111816406, 389.73541259765625, 389.7425842285156, 389.7344055175781, 389.7364501953125, 389.7313232421875, 389.7303161621094, 389.7313232421875], "pwr_core_freqs": [1560.0], "pwr_core_freq": 1560.0, "pwr_mem_freqs": [6501.0], "pwr_mem_freq": 6501.0, "pwr_temperatures": [54.47943779281624], "pwr_temperature": 54.47943779281624, "nvml_energy": 22.332981133180617, "compile_time": 2869.908225722611, "verification_time": 0, "benchmark_time": 13685.226815752685, "registers": 38, "GFLOP/s": 99.17934819829459, "strategy_time": 0, "framework_time": 2.3163901641964912, "timestamp": "2024-01-19 09:51:10.199594+00:00"},
"1560,1024,1,1,1,1,1,1,1,0,128": {"nvml_gr_clock": 1560, "block_size_x": 1024, "block_size_y": 1, "tile_size_x": 1, "tile_size_y": 1, "use_shared_mem": 1, "loop_unroll_factor_x": 1, "loop_unroll_factor_y": 1, "use_column": 1, "use_separate_acc": 0, "n_y_blocks": 128, "core_freqs": [1560.0, 1560.0, 1560.0, 1560.0, 1560.0, 1560.0, 1560.0, 1560.0, 1560.0, 1560.0, 1560.0, 1560.0, 1560.0, 1560.0, 1560.0, 1560.0, 1560.0, 1560.0, 1560.0, 1560.0, 1560.0, 1560.0, 1560.0, 1560.0, 1560.0, 1560.0, 1560.0, 1560.0, 1560.0, 1560.0, 1560.0, 1560.0], "core_freq": 1560.0, "mem_freqs": [6501.0, 6501.0, 6501.0, 6501.0, 6501.0, 6501.0, 6501.0, 6501.0, 6501.0, 6501.0, 6501.0, 6501.0, 6501.0, 6501.0, 6501.0, 6501.0, 6501.0, 6501.0, 6501.0, 6501.0, 6501.0, 6501.0, 6501.0, 6501.0, 6501.0, 6501.0, 6501.0, 6501.0, 6501.0, 6501.0, 6501.0, 6501.0], "mem_freq": 6501.0, "temperatures": [53.82253344481605, 54.0, 54.0, 54.0, 54.0, 54.0, 54.0, 54.0, 54.0, 54.0, 54.0, 54.0, 54.0, 54.0, 54.0, 54.0, 54.0, 54.001652209830645, 54.0, 54.00563947633434, 54.154108900944344, 54.30388408130408, 54.15946108988538, 54.304575690385, 54.30631536604988, 54.38844140153041, 54.537904685300624, 54.492855705373316, 54.842412060301506, 54.84089496581728, 54.998349494532704, 55.0], "temperature": 54.19246964288767, "num_regs": 38, "time": 389.55304622650146, "times": [389.5961608886719, 389.5511169433594, 389.5490417480469, 389.5572509765625, 389.5469970703125, 389.5552062988281, 389.5571594238281, 389.54803466796875, 389.5490417480469, 389.5511169433594, 389.5521240234375, 389.5469665527344, 389.5469970703125, 389.5500793457031, 389.5490417480469, 389.55316162109375, 389.5582580566406, 389.5500793457031, 389.54803466796875, 389.5521240234375, 389.5541687011719, 389.5490417480469, 389.5602111816406, 389.5500793457031, 389.5521240234375, 389.5572509765625, 389.5500793457031, 389.5459899902344, 389.5511169433594, 389.5603332519531, 389.5490417480469, 389.550048828125], "pwr_core_freqs": [1560.0], "pwr_core_freq": 1560.0, "pwr_mem_freqs": [6501.0], "pwr_mem_freq": 6501.0, "pwr_temperatures": [55.0], "pwr_temperature": 55.0, "nvml_energy": 22.30502832083702, "compile_time": 2712.5235265120864, "verification_time": 0, "benchmark_time": 13677.88162920624, "registers": 38, "GFLOP/s": 99.2256573589345, "strategy_time": 0, "framework_time": 1.4919359236955643, "timestamp": "2024-01-19 09:51:26.591522+00:00"},
"1560,1024,1,1,1,1,1,1,1,0,256": {"nvml_gr_clock": 1560, "block_size_x": 1024, "block_size_y": 1, "tile_size_x": 1, "tile_size_y": 1, "use_shared_mem": 1, "loop_unroll_factor_x": 1, "loop_unroll_factor_y": 1, "use_column": 1, "use_separate_acc": 0, "n_y_blocks": 256, "core_freqs": [1560.0, 1560.0, 1560.0, 1560.0, 1560.0, 1560.0, 1560.0, 1560.0, 1560.0, 1560.0, 1560.0, 1560.0, 1560.0, 1560.0, 1560.0, 1560.0, 1560.0, 1560.0, 1560.0, 1560.0, 1560.0, 1560.0, 1560.0, 1560.0, 1560.0, 1560.0, 1560.0, 1560.0, 1560.0, 1560.0, 1560.0, 1560.0], "core_freq": 1560.0, "mem_freqs": [6501.0, 6501.0, 6501.0, 6501.0, 6501.0, 6501.0, 6501.0, 6501.0, 6501.0, 6501.0, 6501.0, 6501.0, 6501.0, 6501.0, 6501.0, 6501.0, 6501.0, 6501.0, 6501.0, 6501.0, 6501.0, 6501.0, 6501.0, 6501.0, 6501.0, 6501.0, 6501.0, 6501.0, 6501.0, 6501.0, 6501.0, 6501.0], "mem_freq": 6501.0, "temperatures": [53.845882352941175, 54.0, 54.0, 54.0, 54.0, 54.0, 54.0, 54.0, 54.0, 54.0, 54.0, 54.0, 54.07539682539682, 54.14857703631011, 54.15905572755418, 54.15871212121212, 54.23242630385487, 54.38457175269427, 54.31465354032564, 54.395344436033305, 54.692162059825826, 54.99621856683683, 54.84876017414348, 54.99641577060932, 55.0, 55.0, 55.0, 55.0, 55.0, 55.0, 55.0, 55.0], "temperature": 54.414005520866816, "num_regs": 38, "time": 387.5554485321045, "times": [387.5921936035156, 387.557373046875, 387.5604553222656, 387.55328369140625, 387.55224609375, 387.55328369140625, 387.55224609375, 387.5521545410156, 387.5512390136719, 387.5512390136719, 387.55841064453125, 387.5512390136719, 387.55328369140625, 387.5542907714844, 387.55224609375, 387.5553283691406, 387.55841064453125, 387.557373046875, 387.5512390136719, 387.5553283691406, 387.55224609375, 387.5511779785156, 387.55841064453125, 387.55224609375, 387.5563659667969, 387.5502014160156, 387.5512390136719, 387.55328369140625, 387.5572814941406, 387.55328369140625, 387.56146240234375, 387.5542907714844], "pwr_core_freqs": [1560.0], "pwr_core_freq": 1560.0, "pwr_mem_freqs": [6501.0], "pwr_mem_freq": 6501.0, "pwr_temperatures": [55.0], "pwr_temperature": 55.0, "nvml_energy": 22.270873849897388, "compile_time": 2680.000171996653, "verification_time": 0, "benchmark_time": 13599.419256672263, "registers": 38, "GFLOP/s": 99.73710145065344, "strategy_time": 0, "framework_time": 1.688293181359768, "timestamp": "2024-01-19 09:51:42.872660+00:00"},
"1560,1024,1,1,1,1,1,1,1,0,512": {"nvml_gr_clock": 1560, "block_size_x": 1024, "block_size_y": 1, "tile_size_x": 1, "tile_size_y": 1, "use_shared_mem": 1, "loop_unroll_factor_x": 1, "loop_unroll_factor_y": 1, "use_column": 1, "use_separate_acc": 0, "n_y_blocks": 512, "core_freqs": [1560.0, 1560.0, 1560.0, 1560.0, 1560.0, 1560.0, 1560.0, 1560.0, 1560.0, 1560.0, 1560.0, 1560.0, 1560.0, 1560.0, 1560.0, 1560.0, 1560.0, 1560.0, 1560.0, 1560.0, 1560.0, 1560.0, 1560.0, 1560.0, 1560.0, 1560.0, 1560.0, 1560.0, 1560.0, 1560.0, 1560.0, 1560.0], "core_freq": 1560.0, "mem_freqs": [6501.0, 6501.0, 6501.0, 6501.0, 6501.0, 6501.0, 6501.0, 6501.0, 6501.0, 6501.0, 6501.0, 6501.0, 6501.0, 6501.0, 6501.0, 6501.0, 6501.0, 6501.0, 6501.0, 6501.0, 6501.0, 6501.0, 6501.0, 6501.0, 6501.0, 6501.0, 6501.0, 6501.0, 6501.0, 6501.0, 6501.0, 6501.0], "mem_freq": 6501.0, "temperatures": [53.828297264189466, 54.0, 54.0, 54.0, 54.0, 54.0, 54.0, 54.0, 54.07690734301493, 54.157680569684636, 54.19141914191419, 54.2245628818201, 54.3119304059652, 54.42535326643457, 54.613431613431615, 54.61385936222404, 54.79488229273286, 54.894758311238014, 54.95207864018022, 55.0, 55.0, 55.0, 55.0, 55.0, 55.0, 55.0, 55.0, 55.0, 55.0, 55.0, 55.0, 55.0], "temperature": 54.56516128415093, "num_regs": 38, "time": 387.98008728027344, "times": [388.0263671875, 387.9731140136719, 387.97515869140625, 387.9679870605469, 387.9833679199219, 387.989501953125, 387.9659423828125, 387.9833679199219, 387.97210693359375, 387.97515869140625, 387.9772033691406, 387.97711181640625, 387.9782409667969, 387.9792785644531, 387.9741516113281, 387.9833679199219, 387.9884948730469, 387.9864196777344, 387.98541259765625, 387.97515869140625, 387.98028564453125, 387.98236083984375, 387.9679870605469, 387.984375, 387.9781494140625, 387.98028564453125, 387.9792785644531, 387.9710693359375, 387.9771423339844, 387.9864196777344, 387.98541259765625, 387.9731140136719], "pwr_core_freqs": [1560.0], "pwr_core_freq": 1560.0, "pwr_mem_freqs": [6501.0], "pwr_mem_freq": 6501.0, "pwr_temperatures": [55.0], "pwr_temperature": 55.0, "nvml_energy": 22.32127038140869, "compile_time": 2772.9109544306993, "verification_time": 0, "benchmark_time": 13623.563637025654, "registers": 38, "GFLOP/s": 99.62794059602584, "strategy_time": 0, "framework_time": 1.5156902372837067, "timestamp": "2024-01-19 09:51:59.270681+00:00"},
"1560,1024,1,1,1,1,1,1,1,0,1024": {"nvml_gr_clock": 1560, "block_size_x": 1024, "block_size_y": 1, "tile_size_x": 1, "tile_size_y": 1, "use_shared_mem": 1, "loop_unroll_factor_x": 1, "loop_unroll_factor_y": 1, "use_column": 1, "use_separate_acc": 0, "n_y_blocks": 1024, "core_freqs": [1560.0, 1560.0, 1560.0, 1560.0, 1560.0, 1560.0, 1560.0, 1560.0, 1560.0, 1560.0, 1560.0, 1560.0, 1560.0, 1560.0, 1560.0, 1560.0, 1560.0, 1560.0, 1560.0, 1560.0, 1560.0, 1560.0, 1560.0, 1560.0, 1560.0, 1560.0, 1560.0, 1560.0, 1560.0, 1560.0, 1560.0, 1560.0], "core_freq": 1560.0, "mem_freqs": [6501.0, 6501.0, 6501.0, 6501.0, 6501.0, 6501.0, 6501.0, 6501.0, 6501.0, 6501.0, 6501.0, 6501.0, 6501.0, 6501.0, 6501.0, 6501.0, 6501.0, 6501.0, 6501.0, 6501.0, 6501.0, 6501.0, 6501.0, 6501.0, 6501.0, 6501.0, 6501.0, 6501.0, 6501.0, 6501.0, 6501.0, 6501.0], "mem_freq": 6501.0, "temperatures": [53.935510371739575, 54.0, 54.0, 54.0, 54.0, 54.0, 54.08150277150482, 54.14366610738255, 54.22680194462059, 54.240033051022515, 54.38488395974533, 54.46095355528155, 54.71116554398857, 54.69529484281899, 54.995282051282054, 55.0, 55.0, 55.0, 55.0, 55.0, 55.0, 55.0, 55.0, 55.0, 55.0, 55.0, 55.0, 55.0, 55.0, 55.0, 55.0, 55.0], "temperature": 54.65234669373083, "num_regs": 38, "time": 389.0672264099121, "times": [389.11077880859375, 389.0636901855469, 389.0759582519531, 389.0616455078125, 389.0759582519531, 389.0697937011719, 389.0616455078125, 389.0585632324219, 389.0718688964844, 389.0595703125, 389.06982421875, 389.0626525878906, 389.0595703125, 389.0534362792969, 389.05035400390625, 389.0780029296875, 389.0821228027344, 389.06060791015625, 389.0769958496094, 389.0544738769531, 389.06878662109375, 389.06573486328125, 389.0595703125, 389.06878662109375, 389.07904052734375, 389.05242919921875, 389.0718688964844, 389.0697326660156, 389.0677795410156, 389.0810852050781, 389.0585632324219, 389.05035400390625], "pwr_core_freqs": [1560.0], "pwr_core_freq": 1560.0, "pwr_mem_freqs": [6501.0], "pwr_mem_freq": 6501.0, "pwr_temperatures": [55.0], "pwr_temperature": 55.0, "nvml_energy": 22.386539140399933, "compile_time": 2857.170592993498, "verification_time": 0, "benchmark_time": 13662.612498737872, "registers": 38, "GFLOP/s": 99.34955828758349, "strategy_time": 0, "framework_time": 2.1288394927978516, "timestamp": "2024-01-19 09:52:15.792626+00:00"},
"1560,1024,1,1,1,2,1,1,1,0,1": {"nvml_gr_clock": 1560, "block_size_x": 1024, "block_size_y": 1, "tile_size_x": 1, "tile_size_y": 1, "use_shared_mem": 2, "loop_unroll_factor_x": 1, "loop_unroll_factor_y": 1, "use_column": 1, "use_separate_acc": 0, "n_y_blocks": 1, "core_freqs": [1560.0, 1560.0, 1560.0, 1560.0, 1560.0, 1560.0, 1560.0, 1560.0, 1560.0, 1560.0, 1560.0, 1560.0, 1560.0, 1560.0, 1560.0, 1560.0, 1560.0, 1560.0, 1560.0, 1560.0, 1560.0, 1560.0, 1560.0, 1560.0, 1560.0, 1560.0, 1560.0, 1560.0, 1560.0, 1560.0, 1560.0, 1560.0], "core_freq": 1560.0, "mem_freqs": [6501.0, 6501.0, 6501.0, 6501.0, 6501.0, 6501.0, 6501.0, 6501.0, 6501.0, 6501.0, 6501.0, 6501.0, 6501.0, 6501.0, 6501.0, 6501.0, 6501.0, 6501.0, 6501.0, 6501.0, 6501.0, 6501.0, 6501.0, 6501.0, 6501.0, 6501.0, 6501.0, 6501.0, 6501.0, 6501.0, 6501.0, 6501.0], "mem_freq": 6501.0, "temperatures": [53.89605734767025, 54.0, 54.0, 54.0, 54.0, 54.0, 54.0, 54.0, 54.0, 54.0, 54.0, 54.0, 54.0, 54.0, 54.0, 54.0, 54.0, 54.0, 54.0, 54.0, 54.0, 54.0, 54.0, 54.0, 54.0, 54.0, 54.0, 54.0, 54.0, 54.0, 54.0, 54.0], "temperature": 53.996751792114694, "num_regs": 39, "time": 581.0751991271973, "times": [581.1189575195312, 581.0677490234375, 581.086181640625, 581.085205078125, 581.064697265625, 581.0677490234375, 581.0872192382812, 581.0811157226562, 581.080078125, 581.080078125, 581.0780029296875, 581.074951171875, 581.080078125, 581.0728759765625, 581.06982421875, 581.0780029296875, 581.0739135742188, 581.074951171875, 581.060546875, 581.064697265625, 581.0616455078125, 581.086181640625, 581.0759887695312, 581.0667724609375, 581.0820922851562, 581.0718994140625, 581.0739135742188, 581.064697265625, 581.064697265625, 581.0657958984375, 581.06982421875, 581.0759887695312], "pwr_core_freqs": [1560.0], "pwr_core_freq": 1560.0, "pwr_mem_freqs": [6501.0], "pwr_mem_freq": 6501.0, "pwr_temperatures": [54.0], "pwr_temperature": 54.0, "nvml_energy": 30.343746898422243, "compile_time": 2858.585203997791, "verification_time": 0, "benchmark_time": 19820.076240226626, "registers": 39, "GFLOP/s": 66.52092043518574, "strategy_time": 0, "framework_time": 1.642327755689621, "timestamp": "2024-01-19 09:52:38.472960+00:00"},
"1560,1024,1,1,1,2,1,1,1,0,2": {"nvml_gr_clock": 1560, "block_size_x": 1024, "block_size_y": 1, "tile_size_x": 1, "tile_size_y": 1, "use_shared_mem": 2, "loop_unroll_factor_x": 1, "loop_unroll_factor_y": 1, "use_column": 1, "use_separate_acc": 0, "n_y_blocks": 2, "core_freqs": [1560.0, 1560.0, 1560.0, 1560.0, 1560.0, 1560.0, 1560.0, 1560.0, 1560.0, 1560.0, 1560.0, 1560.0, 1560.0, 1560.0, 1560.0, 1560.0, 1560.0, 1560.0, 1560.0, 1560.0, 1560.0, 1560.0, 1560.0, 1560.0, 1560.0, 1560.0, 1560.0, 1560.0, 1560.0, 1560.0, 1560.0, 1560.0], "core_freq": 1560.0, "mem_freqs": [6501.0, 6501.0, 6501.0, 6501.0, 6501.0, 6501.0, 6501.0, 6501.0, 6501.0, 6501.0, 6501.0, 6501.0, 6501.0, 6501.0, 6501.0, 6501.0, 6501.0, 6501.0, 6501.0, 6501.0, 6501.0, 6501.0, 6501.0, 6501.0, 6501.0, 6501.0, 6501.0, 6501.0, 6501.0, 6501.0, 6501.0, 6501.0], "mem_freq": 6501.0, "temperatures": [53.0, 53.048575038607325, 53.20290673063356, 53.263566986998306, 53.25924879977408, 53.31841145102442, 53.36878531073447, 53.36581515499426, 53.41550610193826, 53.315058790196915, 53.2540333993773, 53.317950169875424, 53.31483562798539, 53.30448309998586, 53.26532634857709, 53.26592131333145, 53.255389479735555, 53.26669551420741, 53.32061826432218, 53.31569239500568, 53.36508383824151, 53.366907474298415, 53.417837174417016, 53.4700272479564, 53.41841460092618, 53.357455830388695, 53.364048961628384, 53.31147764449291, 53.31305415359432, 53.31358361774744, 53.26393442622951, 53.25890055926886], "temperature": 53.30186079707795, "num_regs": 39, "time": 574.1356964111328, "times": [574.1731567382812, 574.13427734375, 574.1455078125, 574.1322021484375, 574.1362915039062, 574.1300659179688, 574.1353149414062, 574.1353149414062, 574.1322021484375, 574.1372680664062, 574.1312255859375, 574.1383666992188, 574.1312255859375, 574.1465454101562, 574.1414184570312, 574.1404418945312, 574.1332397460938, 574.1240234375, 574.1404418945312, 574.1209106445312, 574.13427734375, 574.1270751953125, 574.1270751953125, 574.1322021484375, 574.1383666992188, 574.1281127929688, 574.1332397460938, 574.1332397460938, 574.1455078125, 574.14453125, 574.1362915039062, 574.1229248046875], "pwr_core_freqs": [1560.0], "pwr_core_freq": 1560.0, "pwr_mem_freqs": [6501.0], "pwr_mem_freq": 6501.0, "pwr_temperatures": [53.28829285973179], "pwr_temperature": 53.28829285973179, "nvml_energy": 29.782715115631106, "compile_time": 2696.2870731949806, "verification_time": 0, "benchmark_time": 19579.51186131686, "registers": 39, "GFLOP/s": 67.32495005905452, "strategy_time": 0, "framework_time": 1.7302026972174644, "timestamp": "2024-01-19 09:53:00.750524+00:00"},
