compare_real_world_impact/results/hotspot/A100_f=pythonconstraint_i=5.json
{
"device_name": "NVIDIA A100-PCIE-40GB",
"kernel_name": "calculate_temp",
"problem_size": [
4096,
4096
],
"tune_params_keys": [
"grid_width",
"grid_height",
"block_size_x",
"block_size_y",
"tile_size_x",
"tile_size_y",
"temporal_tiling_factor",
"max_tfactor",
"loop_unroll_factor_t",
"sh_power",
"blocks_per_sm"
],
"tune_params": {
"grid_width": [
4096
],
"grid_height": [
4096
],
"block_size_x": [
1,
2,
4,
8,
16,
32,
64,
96,
128,
160,
192,
224,
256,
288,
320,
352,
384,
416,
448,
480,
512,
544,
576,
608,
640,
672,
704,
736,
768,
800,
832,
864,
896,
928,
960,
992,
1024
],
"block_size_y": [
1,
2,
4,
8,
16,
32
],
"tile_size_x": [
1,
2,
3,
4,
5,
6,
7,
8,
9,
10
],
"tile_size_y": [
1,
2,
3,
4,
5,
6,
7,
8,
9,
10
],
"temporal_tiling_factor": [
1,
2,
3,
4,
5,
6,
7,
8,
9,
10
],
"max_tfactor": [
10
],
"loop_unroll_factor_t": [
1,
2,
3,
4,
5,
6,
7,
8,
9,
10
],
"sh_power": [
0,
1
],
"blocks_per_sm": [
0,
1,
2,
3,
4
]
},
"objective": "GFLOP/s",
"cache": {
"4096,4096,8,8,1,3,9,10,9,0,0": {"grid_width": 4096, "grid_height": 4096, "block_size_x": 8, "block_size_y": 8, "tile_size_x": 1, "tile_size_y": 3, "temporal_tiling_factor": 9, "max_tfactor": 10, "loop_unroll_factor_t": 9, "sh_power": 0, "blocks_per_sm": 0, "time": 3.915584020316601, "times": [4.116479873657227, 4.063231945037842, 4.060160160064697, 4.061183929443359, 4.059135913848877, 4.06220817565918, 4.058112144470215, 4.058112144470215, 4.060160160064697, 4.061183929443359, 4.061183929443359, 4.059135913848877, 4.060160160064697, 4.0570878982543945, 4.061183929443359, 4.0570878982543945, 4.059135913848877, 4.059135913848877, 4.060160160064697, 4.059135913848877, 4.059135913848877, 4.058112144470215, 4.061183929443359, 4.058112144470215, 4.058112144470215, 4.060160160064697, 3.8389759063720703, 3.1723520755767822, 3.1682560443878174, 3.1692800521850586, 3.171328067779541, 3.1703040599823], "compile_time": 1243.7679100548849, "verification_time": 0, "benchmark_time": 127.1157959708944, "GFLOP/s": 578.4384010783828, "gridpoints/s": 38562560071.89219, "strategy_time": 2366.522314026952, "framework_time": 0, "timestamp": "2025-04-19 00:37:24.183256+00:00"},
"4096,4096,32,1,8,6,6,10,2,0,3": {"grid_width": 4096, "grid_height": 4096, "block_size_x": 32, "block_size_y": 1, "tile_size_x": 8, "tile_size_y": 6, "temporal_tiling_factor": 6, "max_tfactor": 10, "loop_unroll_factor_t": 2, "sh_power": 0, "blocks_per_sm": 3, "time": 3.2869759798049927, "times": [3.338239908218384, 3.290112018585205, 3.2860159873962402, 3.2931840419769287, 3.289088010787964, 3.2860159873962402, 3.2870399951934814, 3.2870399951934814, 3.2860159873962402, 3.283967971801758, 3.289088010787964, 3.2819199562072754, 3.289088010787964, 3.2880640029907227, 3.2860159873962402, 3.280895948410034, 3.2880640029907227, 3.2829439640045166, 3.2819199562072754, 3.2880640029907227, 3.2778239250183105, 3.283967971801758, 3.2870399951934814, 3.283967971801758, 3.2788479328155518, 3.2860159873962402, 3.283967971801758, 3.283967971801758, 3.283967971801758, 3.284991979598999, 3.284991979598999, 3.280895948410034], "compile_time": 912.3300550272688, "verification_time": 0, "benchmark_time": 106.86367691960186, "GFLOP/s": 459.37343299039907, "gridpoints/s": 30624895532.69327, "strategy_time": 0.009458046406507492, "framework_time": 1.647886005230248, "timestamp": "2025-04-19 00:37:25.204141+00:00"},
"4096,4096,16,4,5,6,4,10,1,0,0": {"grid_width": 4096, "grid_height": 4096, "block_size_x": 16, "block_size_y": 4, "tile_size_x": 5, "tile_size_y": 6, "temporal_tiling_factor": 4, "max_tfactor": 10, "loop_unroll_factor_t": 1, "sh_power": 0, "blocks_per_sm": 0, "time": 1.4791040159761906, "times": [1.5319039821624756, 1.481727957725525, 1.481727957725525, 1.4786560535430908, 1.4755840301513672, 1.4776320457458496, 1.4766080379486084, 1.4807039499282837, 1.4766080379486084, 1.474560022354126, 1.4786560535430908, 1.4796799421310425, 1.4786560535430908, 1.4766080379486084, 1.4755840301513672, 1.4766080379486084, 1.4776320457458496, 1.4735360145568848, 1.4786560535430908, 1.4766080379486084, 1.4766080379486084, 1.4766080379486084, 1.4796799421310425, 1.4796799421310425, 1.4766080379486084, 1.4755840301513672, 1.4735360145568848, 1.474560022354126, 1.4766080379486084, 1.4827519655227661, 1.4776320457458496, 1.4735360145568848], "compile_time": 858.5675669601187, "verification_time": 0, "benchmark_time": 48.4450189396739, "GFLOP/s": 680.5694184635381, "gridpoints/s": 45371294564.23587, "strategy_time": 0.00856595579534769, "framework_time": 1.3859661994501948, "timestamp": "2025-04-19 00:37:26.112579+00:00"},
"4096,4096,224,2,1,1,7,10,1,0,3": {"grid_width": 4096, "grid_height": 4096, "block_size_x": 224, "block_size_y": 2, "tile_size_x": 1, "tile_size_y": 1, "temporal_tiling_factor": 7, "max_tfactor": 10, "loop_unroll_factor_t": 1, "sh_power": 0, "blocks_per_sm": 3, "time": 5.77561592310667, "times": [5.975039958953857, 5.924863815307617, 5.9258880615234375, 5.923840045928955, 5.921792030334473, 5.920767784118652, 5.923840045928955, 5.921792030334473, 5.922815799713135, 5.91974401473999, 5.920767784118652, 5.921792030334473, 5.920767784118652, 5.921792030334473, 5.920767784118652, 5.91974401473999, 5.920767784118652, 5.921792030334473, 5.91974401473999, 5.921792030334473, 5.920767784118652, 5.921792030334473, 5.91974401473999, 5.920767784118652, 5.920767784118652, 5.920767784118652, 5.91974401473999, 5.920767784118652, 5.920767784118652, 5.921792030334473, 3.624959945678711, 3.496959924697876], "compile_time": 686.0827129567042, "verification_time": 0, "benchmark_time": 185.9007499879226, "GFLOP/s": 305.0077608090743, "gridpoints/s": 20333850720.604954, "strategy_time": 0.008314964361488819, "framework_time": 1.5290341107174754, "timestamp": "2025-04-19 00:37:26.986130+00:00"},
"4096,4096,8,16,1,4,10,10,1,1,3": {"grid_width": 4096, "grid_height": 4096, "block_size_x": 8, "block_size_y": 16, "tile_size_x": 1, "tile_size_y": 4, "temporal_tiling_factor": 10, "max_tfactor": 10, "loop_unroll_factor_t": 1, "sh_power": 1, "blocks_per_sm": 3, "time": 2.2880319878458977, "times": [2.3408639430999756, 2.292736053466797, 2.2906880378723145, 2.2865920066833496, 2.287616014480591, 2.2865920066833496, 2.2865920066833496, 2.2855679988861084, 2.287616014480591, 2.2855679988861084, 2.2855679988861084, 2.284543991088867, 2.283519983291626, 2.283519983291626, 2.283519983291626, 2.284543991088867, 2.283519983291626, 2.283519983291626, 2.283519983291626, 2.284543991088867, 2.283519983291626, 2.2824959754943848, 2.284543991088867, 2.283519983291626, 2.283519983291626, 2.283519983291626, 2.283519983291626, 2.283519983291626, 2.283519983291626, 2.284543991088867, 2.303999900817871, 2.3060479164123535], "compile_time": 756.1994099523872, "verification_time": 0, "benchmark_time": 74.84971103258431, "GFLOP/s": 1099.8895178774465, "gridpoints/s": 73325967858.49643, "strategy_time": 0.008395989425480366, "framework_time": 1.4157409314066172, "timestamp": "2025-04-19 00:37:27.818634+00:00"},
"4096,4096,16,4,4,9,5,10,1,0,3": {"grid_width": 4096, "grid_height": 4096, "block_size_x": 16, "block_size_y": 4, "tile_size_x": 4, "tile_size_y": 9, "temporal_tiling_factor": 5, "max_tfactor": 10, "loop_unroll_factor_t": 1, "sh_power": 0, "blocks_per_sm": 3, "time": 1.0258880369365215, "times": [1.082368016242981, 1.0291199684143066, 1.026047945022583, 1.0270719528198242, 1.0219520330429077, 1.0250240564346313, 1.0240000486373901, 1.0240000486373901, 1.0250240564346313, 1.0240000486373901, 1.022976040840149, 1.0240000486373901, 1.022976040840149, 1.0250240564346313, 1.0240000486373901, 1.0250240564346313, 1.0250240564346313, 1.0250240564346313, 1.022976040840149, 1.0240000486373901, 1.0219520330429077, 1.0250240564346313, 1.0240000486373901, 1.022976040840149, 1.022976040840149, 1.022976040840149, 1.0219520330429077, 1.0240000486373901, 1.0240000486373901, 1.022976040840149, 1.0219520330429077, 1.0240000486373901], "compile_time": 868.7302200123668, "verification_time": 0, "benchmark_time": 34.01790896896273, "GFLOP/s": 1226.5385253516304, "gridpoints/s": 81769235023.44203, "strategy_time": 0.008334987796843052, "framework_time": 1.4425130793824792, "timestamp": "2025-04-19 00:37:28.722864+00:00"},
"4096,4096,8,32,2,3,8,10,1,0,0": {"grid_width": 4096, "grid_height": 4096, "block_size_x": 8, "block_size_y": 32, "tile_size_x": 2, "tile_size_y": 3, "temporal_tiling_factor": 8, "max_tfactor": 10, "loop_unroll_factor_t": 1, "sh_power": 0, "blocks_per_sm": 0, "time": 3.506271980702877, "times": [3.5635199546813965, 3.5133440494537354, 3.506175994873047, 3.5051519870758057, 3.506175994873047, 3.5051519870758057, 3.5041279792785645, 3.5041279792785645, 3.5041279792785645, 3.5051519870758057, 3.5051519870758057, 3.5041279792785645, 3.5031039714813232, 3.5041279792785645, 3.506175994873047, 3.5051519870758057, 3.5031039714813232, 3.5041279792785645, 3.5031039714813232, 3.5031039714813232, 3.5041279792785645, 3.5031039714813232, 3.5051519870758057, 3.502079963684082, 3.502079963684082, 3.5041279792785645, 3.5031039714813232, 3.5031039714813232, 3.5031039714813232, 3.5041279792785645, 3.5051519870758057, 3.5031039714813232], "compile_time": 826.5870129689574, "verification_time": 0, "benchmark_time": 113.95341495517641, "GFLOP/s": 574.1898891700965, "gridpoints/s": 38279325944.6731, "strategy_time": 0.008255010470747948, "framework_time": 1.4130270574241877, "timestamp": "2025-04-19 00:37:29.664856+00:00"},
"4096,4096,64,2,1,7,3,10,1,0,0": {"grid_width": 4096, "grid_height": 4096, "block_size_x": 64, "block_size_y": 2, "tile_size_x": 1, "tile_size_y": 7, "temporal_tiling_factor": 3, "max_tfactor": 10, "loop_unroll_factor_t": 1, "sh_power": 0, "blocks_per_sm": 0, "time": 0.9576640073210001, "times": [1.0076160430908203, 0.9615359902381897, 0.9584640264511108, 0.9564160108566284, 0.9553920030593872, 0.9574400186538696, 0.9574400186538696, 0.9564160108566284, 0.9553920030593872, 0.9553920030593872, 0.9553920030593872, 0.9564160108566284, 0.9564160108566284, 0.9574400186538696, 0.9553920030593872, 0.9553920030593872, 0.9553920030593872, 0.9574400186538696, 0.9553920030593872, 0.9564160108566284, 0.954367995262146, 0.954367995262146, 0.954367995262146, 0.9553920030593872, 0.9564160108566284, 0.9553920030593872, 0.954367995262146, 0.954367995262146, 0.9553920030593872, 0.9564160108566284, 0.9553920030593872, 0.9564160108566284], "compile_time": 815.8672970021144, "verification_time": 0, "benchmark_time": 32.167735043913126, "GFLOP/s": 788.3503130831766, "gridpoints/s": 52556687538.87844, "strategy_time": 0.007523922249674797, "framework_time": 1.4817251358181238, "timestamp": "2025-04-19 00:37:30.514411+00:00"},
"4096,4096,8,4,3,6,2,10,1,0,3": {"grid_width": 4096, "grid_height": 4096, "block_size_x": 8, "block_size_y": 4, "tile_size_x": 3, "tile_size_y": 6, "temporal_tiling_factor": 2, "max_tfactor": 10, "loop_unroll_factor_t": 1, "sh_power": 0, "blocks_per_sm": 3, "time": 0.8726720102131367, "times": [0.92467200756073, 0.8755199909210205, 0.8724480271339417, 0.8714240193367004, 0.869376003742218, 0.8724480271339417, 0.8714240193367004, 0.8724480271339417, 0.8714240193367004, 0.8744959831237793, 0.8683519959449768, 0.8714240193367004, 0.8714240193367004, 0.8714240193367004, 0.8714240193367004, 0.8714240193367004, 0.8704000115394592, 0.869376003742218, 0.8683519959449768, 0.8704000115394592, 0.8704000115394592, 0.8714240193367004, 0.8755199909210205, 0.8673279881477356, 0.869376003742218, 0.8683519959449768, 0.8724480271339417, 0.869376003742218, 0.8704000115394592, 0.869376003742218, 0.8714240193367004, 0.8704000115394592], "compile_time": 835.6525710551068, "verification_time": 0, "benchmark_time": 29.762258986011147, "GFLOP/s": 576.7533209608415, "gridpoints/s": 38450221397.389435, "strategy_time": 0.007815076969563961, "framework_time": 1.376868924126029, "timestamp": "2025-04-19 00:37:31.381242+00:00"},
"4096,4096,8,4,9,6,10,10,2,1,1": {"grid_width": 4096, "grid_height": 4096, "block_size_x": 8, "block_size_y": 4, "tile_size_x": 9, "tile_size_y": 6, "temporal_tiling_factor": 10, "max_tfactor": 10, "loop_unroll_factor_t": 2, "sh_power": 1, "blocks_per_sm": 1, "time": 5.569567956030369, "times": [6.171648025512695, 6.122496128082275, 6.1184000968933105, 6.115327835083008, 6.11737585067749, 6.1184000968933105, 6.115327835083008, 6.11737585067749, 6.114304065704346, 6.114304065704346, 6.112256050109863, 6.113279819488525, 6.115327835083008, 6.11737585067749, 6.115327835083008, 6.115327835083008, 6.11737585067749, 6.113279819488525, 6.113279819488525, 6.1184000968933105, 6.114304065704346, 6.114304065704346, 6.116352081298828, 6.119423866271973, 6.116352081298828, 4.245503902435303, 3.5051519870758057, 3.506175994873047, 3.501055955886841, 3.5031039714813232, 3.5041279792785645, 3.5041279792785645], "compile_time": 867.5329480320215, "verification_time": 0, "benchmark_time": 179.99602109193802, "GFLOP/s": 451.84517360546914, "gridpoints/s": 30123011573.69794, "strategy_time": 0.008936971426010132, "framework_time": 1.439745887182653, "timestamp": "2025-04-19 00:37:32.430250+00:00"},
"4096,4096,32,1,2,10,3,10,3,0,1": {"grid_width": 4096, "grid_height": 4096, "block_size_x": 32, "block_size_y": 1, "tile_size_x": 2, "tile_size_y": 10, "temporal_tiling_factor": 3, "max_tfactor": 10, "loop_unroll_factor_t": 3, "sh_power": 0, "blocks_per_sm": 1, "time": 1.0208960101008415, "times": [1.077247977256775, 1.0219520330429077, 1.0199040174484253, 1.0219520330429077, 1.018880009651184, 1.0219520330429077, 1.018880009651184, 1.018880009651184, 1.0168319940567017, 1.018880009651184, 1.0199040174484253, 1.018880009651184, 1.018880009651184, 1.0178560018539429, 1.0199040174484253, 1.018880009651184, 1.0209280252456665, 1.0178560018539429, 1.0178560018539429, 1.018880009651184, 1.0209280252456665, 1.0209280252456665, 1.018880009651184, 1.018880009651184, 1.0178560018539429, 1.0168319940567017, 1.0178560018539429, 1.018880009651184, 1.018880009651184, 1.0168319940567017, 1.0199040174484253, 1.0168319940567017], "compile_time": 894.1731009399518, "verification_time": 0, "benchmark_time": 34.01223907712847, "GFLOP/s": 739.5216677606817, "gridpoints/s": 49301444517.37878, "strategy_time": 0.009358045645058155, "framework_time": 1.6042429488152266, "timestamp": "2025-04-19 00:37:33.360082+00:00"},
"4096,4096,64,1,1,2,2,10,1,0,0": {"grid_width": 4096, "grid_height": 4096, "block_size_x": 64, "block_size_y": 1, "tile_size_x": 1, "tile_size_y": 2, "temporal_tiling_factor": 2, "max_tfactor": 10, "loop_unroll_factor_t": 1, "sh_power": 0, "blocks_per_sm": 0, "time": 0.6267199907451868, "times": [0.681984007358551, 0.6297600269317627, 0.6277120113372803, 0.6256639957427979, 0.6236159801483154, 0.6246399879455566, 0.6246399879455566, 0.6246399879455566, 0.6256639957427979, 0.6246399879455566, 0.6236159801483154, 0.6256639957427979, 0.6246399879455566, 0.6236159801483154, 0.6246399879455566, 0.6256639957427979, 0.6246399879455566, 0.6246399879455566, 0.6266880035400391, 0.6236159801483154, 0.6246399879455566, 0.6256639957427979, 0.6246399879455566, 0.6246399879455566, 0.6246399879455566, 0.6236159801483154, 0.6246399879455566, 0.6256639957427979, 0.6236159801483154, 0.6246399879455566, 0.6236159801483154, 0.6246399879455566], "compile_time": 803.3480199519545, "verification_time": 0, "benchmark_time": 21.54157403856516, "GFLOP/s": 803.0962589872763, "gridpoints/s": 53539750599.15176, "strategy_time": 0.008636037819087505, "framework_time": 1.4578610425814986, "timestamp": "2025-04-19 00:37:34.186469+00:00"},
"4096,4096,16,4,8,2,8,10,1,0,1": {"grid_width": 4096, "grid_height": 4096, "block_size_x": 16, "block_size_y": 4, "tile_size_x": 8, "tile_size_y": 2, "temporal_tiling_factor": 8, "max_tfactor": 10, "loop_unroll_factor_t": 1, "sh_power": 0, "blocks_per_sm": 1, "time": 3.407775953412056, "times": [3.4560000896453857, 3.4150400161743164, 3.407871961593628, 3.407871961593628, 3.408895969390869, 3.4058239459991455, 3.4047999382019043, 3.4068479537963867, 3.4099199771881104, 3.407871961593628, 3.407871961593628, 3.4047999382019043, 3.4058239459991455, 3.4068479537963867, 3.4047999382019043, 3.4047999382019043, 3.4047999382019043, 3.4047999382019043, 3.402751922607422, 3.4068479537963867, 3.4058239459991455, 3.403775930404663, 3.4058239459991455, 3.403775930404663, 3.4058239459991455, 3.4058239459991455, 3.4058239459991455, 3.4047999382019043, 3.4047999382019043, 3.4068479537963867, 3.4068479537963867, 3.403775930404663], "compile_time": 834.6800700528547, "verification_time": 0, "benchmark_time": 110.40198395494372, "GFLOP/s": 590.78588132656, "gridpoints/s": 39385725421.77067, "strategy_time": 0.008456059731543064, "framework_time": 1.3830289244651794, "timestamp": "2025-04-19 00:37:35.132974+00:00"},
"4096,4096,4,8,7,1,3,10,3,0,3": {"grid_width": 4096, "grid_height": 4096, "block_size_x": 4, "block_size_y": 8, "tile_size_x": 7, "tile_size_y": 1, "temporal_tiling_factor": 3, "max_tfactor": 10, "loop_unroll_factor_t": 3, "sh_power": 0, "blocks_per_sm": 3, "time": 0.6455360092222691, "times": [0.7004160284996033, 0.6492159962654114, 0.6451200246810913, 0.6451200246810913, 0.6440960168838501, 0.6440960168838501, 0.6440960168838501, 0.6451200246810913, 0.6440960168838501, 0.6440960168838501, 0.6440960168838501, 0.6440960168838501, 0.6440960168838501, 0.6430720090866089, 0.6420480012893677, 0.6420480012893677, 0.6420480012893677, 0.6420480012893677, 0.6420480012893677, 0.6420480012893677, 0.6420480012893677, 0.6420480012893677, 0.6420480012893677, 0.6430720090866089, 0.6563839912414551, 0.6420480012893677, 0.6430720090866089, 0.6430720090866089, 0.6420480012893677, 0.6430720090866089, 0.6420480012893677, 0.6430720090866089], "compile_time": 872.6466450607404, "verification_time": 0, "benchmark_time": 22.275228053331375, "GFLOP/s": 1169.5315353663707, "gridpoints/s": 77968769024.42471, "strategy_time": 0.008876901119947433, "framework_time": 1.6509710112586617, "timestamp": "2025-04-19 00:37:36.029586+00:00"},
"4096,4096,8,16,3,3,9,10,3,0,4": {"grid_width": 4096, "grid_height": 4096, "block_size_x": 8, "block_size_y": 16, "tile_size_x": 3, "tile_size_y": 3, "temporal_tiling_factor": 9, "max_tfactor": 10, "loop_unroll_factor_t": 3, "sh_power": 0, "blocks_per_sm": 4, "time": 2.1482880003750324, "times": [1.802240014076233, 1.7479679584503174, 1.743872046470642, 1.743872046470642, 1.7418240308761597, 1.7418240308761597, 1.7418240308761597, 1.7448960542678833, 2.190335988998413, 2.283519983291626, 2.2865920066833496, 2.2855679988861084, 2.2855679988861084, 2.2865920066833496, 2.284543991088867, 2.283519983291626, 2.2855679988861084, 2.284543991088867, 2.284543991088867, 2.2824959754943848, 2.2855679988861084, 2.283519983291626, 2.284543991088867, 2.284543991088867, 2.284543991088867, 2.283519983291626, 2.284543991088867, 2.284543991088867, 2.284543991088867, 2.2855679988861084, 2.284543991088867, 2.283519983291626], "compile_time": 981.5680360188708, "verification_time": 0, "benchmark_time": 70.302793988958, "GFLOP/s": 1054.2926086281757, "gridpoints/s": 70286173908.54504, "strategy_time": 0.0089260283857584, "framework_time": 1.5844779554754496, "timestamp": "2025-04-19 00:37:37.083082+00:00"},
"4096,4096,8,4,5,9,2,10,2,0,3": {"grid_width": 4096, "grid_height": 4096, "block_size_x": 8, "block_size_y": 4, "tile_size_x": 5, "tile_size_y": 9, "temporal_tiling_factor": 2, "max_tfactor": 10, "loop_unroll_factor_t": 2, "sh_power": 0, "blocks_per_sm": 3, "time": 0.7676799912005663, "times": [0.822272002696991, 0.7690240144729614, 0.7690240144729614, 0.7680000066757202, 0.766975998878479, 0.7659519910812378, 0.7649279832839966, 0.7649279832839966, 0.7659519910812378, 0.7649279832839966, 0.7649279832839966, 0.7639039754867554, 0.7639039754867554, 0.7659519910812378, 0.7690240144729614, 0.766975998878479, 0.766975998878479, 0.7649279832839966, 0.7639039754867554, 0.7659519910812378, 0.7649279832839966, 0.7649279832839966, 0.7659519910812378, 0.7690240144729614, 0.7649279832839966, 0.7649279832839966, 0.7659519910812378, 0.7659519910812378, 0.7639039754867554, 0.7649279832839966, 0.766975998878479, 0.7649279832839966], "compile_time": 880.3545410046354, "verification_time": 0, "benchmark_time": 26.51655103545636, "GFLOP/s": 655.6331880069831, "gridpoints/s": 43708879200.465546, "strategy_time": 0.009326962754130363, "framework_time": 1.4784090453758836, "timestamp": "2025-04-19 00:37:37.991473+00:00"},
"4096,4096,16,2,5,3,5,10,1,0,2": {"grid_width": 4096, "grid_height": 4096, "block_size_x": 16, "block_size_y": 2, "tile_size_x": 5, "tile_size_y": 3, "temporal_tiling_factor": 5, "max_tfactor": 10, "loop_unroll_factor_t": 1, "sh_power": 0, "blocks_per_sm": 2, "time": 2.1538559421896935, "times": [2.20467209815979, 2.15449595451355, 2.1534719467163086, 2.1534719467163086, 2.151423931121826, 2.1524479389190674, 2.1524479389190674, 2.1534719467163086, 2.1565439701080322, 2.1524479389190674, 2.1534719467163086, 2.151423931121826, 2.1534719467163086, 2.1524479389190674, 2.151423931121826, 2.151423931121826, 2.1534719467163086, 2.1493759155273438, 2.1524479389190674, 2.150399923324585, 2.1534719467163086, 2.1534719467163086, 2.150399923324585, 2.1493759155273438, 2.1524479389190674, 2.1524479389190674, 2.1524479389190674, 2.150399923324585, 2.150399923324585, 2.150399923324585, 2.151423931121826, 2.1524479389190674], "compile_time": 833.3039019489661, "verification_time": 0, "benchmark_time": 71.12609699834138, "GFLOP/s": 584.2039736050185, "gridpoints/s": 38946931573.6679, "strategy_time": 0.008655944839119911, "framework_time": 1.415192149579525, "timestamp": "2025-04-19 00:37:38.897358+00:00"},
"4096,4096,16,2,7,7,8,10,4,1,3": {"grid_width": 4096, "grid_height": 4096, "block_size_x": 16, "block_size_y": 2, "tile_size_x": 7, "tile_size_y": 7, "temporal_tiling_factor": 8, "max_tfactor": 10, "loop_unroll_factor_t": 4, "sh_power": 1, "blocks_per_sm": 3, "time": 5.3887359499931335, "times": [5.578752040863037, 5.530623912811279, 5.524479866027832, 5.524479866027832, 5.52345609664917, 5.52243185043335, 5.52243185043335, 5.52345609664917, 5.52345609664917, 5.5214080810546875, 5.517312049865723, 5.5214080810546875, 5.520383834838867, 5.520383834838867, 5.516287803649902, 5.5214080810546875, 5.5214080810546875, 5.520383834838867, 5.524479866027832, 5.5214080810546875, 5.52243185043335, 5.520383834838867, 5.5214080810546875, 5.520383834838867, 5.5214080810546875, 5.516287803649902, 5.52243185043335, 5.519360065460205, 5.52243185043335, 5.52243185043335, 3.649535894393921, 3.0812160968780518], "compile_time": 975.4025090951473, "verification_time": 0, "benchmark_time": 173.6661969916895, "GFLOP/s": 373.60634083445217, "gridpoints/s": 24907089388.963478, "strategy_time": 0.009268056601285934, "framework_time": 1.5686668921262026, "timestamp": "2025-04-19 00:37:40.048037+00:00"},
"4096,4096,4,8,10,6,6,10,2,0,0": {"grid_width": 4096, "grid_height": 4096, "block_size_x": 4, "block_size_y": 8, "tile_size_x": 10, "tile_size_y": 6, "temporal_tiling_factor": 6, "max_tfactor": 10, "loop_unroll_factor_t": 2, "sh_power": 0, "blocks_per_sm": 0, "time": 2.28575998544693, "times": [2.3449599742889404, 2.287616014480591, 2.2763519287109375, 2.2804479598999023, 2.2855679988861084, 2.283519983291626, 2.287616014480591, 2.284543991088867, 2.2773759365081787, 2.2804479598999023, 2.279423952102661, 2.284543991088867, 2.284543991088867, 2.2865920066833496, 2.2855679988861084, 2.279423952102661, 2.2906880378723145, 2.284543991088867, 2.288640022277832, 2.2824959754943848, 2.2824959754943848, 2.2896640300750732, 2.284543991088867, 2.2804479598999023, 2.2855679988861084, 2.2824959754943848, 2.27839994430542, 2.283519983291626, 2.288640022277832, 2.2855679988861084, 2.287616014480591, 2.2804479598999023], "compile_time": 933.6105399997905, "verification_time": 0, "benchmark_time": 74.89716005511582, "GFLOP/s": 660.5896724125051, "gridpoints/s": 44039311494.16701, "strategy_time": 0.008887029252946377, "framework_time": 1.4476398937404156, "timestamp": "2025-04-19 00:37:41.058033+00:00"},
"4096,4096,32,1,1,9,10,10,10,1,4": {"grid_width": 4096, "grid_height": 4096, "block_size_x": 32, "block_size_y": 1, "tile_size_x": 1, "tile_size_y": 9, "temporal_tiling_factor": 10, "max_tfactor": 10, "loop_unroll_factor_t": 10, "sh_power": 1, "blocks_per_sm": 4, "time": 8.390784054994583, "times": [9.351167678833008, 9.289728164672852, 9.293824195861816, 9.290752410888672, 9.286656379699707, 9.286656379699707, 9.293824195861816, 9.289728164672852, 9.286656379699707, 9.290752410888672, 9.288703918457031, 9.285632133483887, 9.285632133483887, 9.285632133483887, 9.287679672241211, 9.287679672241211, 9.287679672241211, 9.287679672241211, 9.285632133483887, 9.284607887268066, 9.290752410888672, 9.289728164672852, 9.287679672241211, 9.291775703430176, 8.943615913391113, 5.221375942230225, 5.2254719734191895, 5.22649621963501, 5.223423957824707, 5.228544235229492, 5.224448204040527, 5.2254719734191895], "compile_time": 1160.439130035229, "verification_time": 0, "benchmark_time": 270.17816703300923, "GFLOP/s": 299.92219839122345, "gridpoints/s": 19994813226.081562, "strategy_time": 0.009036972187459469, "framework_time": 1.452839933335781, "timestamp": "2025-04-19 00:37:42.490143+00:00"},
"4096,4096,256,1,1,1,3,10,3,0,0": {"grid_width": 4096, "grid_height": 4096, "block_size_x": 256, "block_size_y": 1, "tile_size_x": 1, "tile_size_y": 1, "temporal_tiling_factor": 3, "max_tfactor": 10, "loop_unroll_factor_t": 3, "sh_power": 0, "blocks_per_sm": 0, "time": 1.2117120251059532, "times": [1.2677119970321655, 1.2154879570007324, 1.2124160528182983, 1.2113920450210571, 1.2113920450210571, 1.2083200216293335, 1.2083200216293335, 1.2093440294265747, 1.2144639492034912, 1.210368037223816, 1.210368037223816, 1.210368037223816, 1.2083200216293335, 1.210368037223816, 1.2113920450210571, 1.210368037223816, 1.2113920450210571, 1.2093440294265747, 1.210368037223816, 1.210368037223816, 1.2072960138320923, 1.210368037223816, 1.2093440294265747, 1.2093440294265747, 1.2083200216293335, 1.2083200216293335, 1.210368037223816, 1.2072960138320923, 1.2083200216293335, 1.2083200216293335, 1.2083200216293335, 1.2072960138320923], "compile_time": 861.3797839498147, "verification_time": 0, "benchmark_time": 40.82337603904307, "GFLOP/s": 623.0644776624911, "gridpoints/s": 41537631844.16607, "strategy_time": 0.00933697447180748, "framework_time": 1.527580083347857, "timestamp": "2025-04-19 00:37:43.393916+00:00"},
"4096,4096,4,8,2,1,8,10,4,0,4": {"grid_width": 4096, "grid_height": 4096, "block_size_x": 4, "block_size_y": 8, "tile_size_x": 2, "tile_size_y": 1, "temporal_tiling_factor": 8, "max_tfactor": 10, "loop_unroll_factor_t": 4, "sh_power": 0, "blocks_per_sm": 4, "time": 4.608160018920898, "times": [4.829184055328369, 4.779007911682129, 4.7769598960876465, 4.774911880493164, 4.7769598960876465, 4.7769598960876465, 4.773888111114502, 4.772863864898682, 4.772863864898682, 4.775936126708984, 4.773888111114502, 4.774911880493164, 4.774911880493164, 4.775936126708984, 4.773888111114502, 4.774911880493164, 4.773888111114502, 4.775936126708984, 4.568064212799072, 4.375552177429199, 4.375552177429199, 4.375552177429199, 4.376575946807861, 4.374527931213379, 4.375552177429199, 4.375552177429199, 4.378623962402344, 4.376575946807861, 4.376575946807861, 4.374527931213379, 4.373504161834717, 4.376575946807861], "compile_time": 976.3414280023426, "verification_time": 0, "benchmark_time": 149.587000021711, "GFLOP/s": 436.89149502917, "gridpoints/s": 29126099668.611336, "strategy_time": 0.008225906640291214, "framework_time": 1.4197680866345763, "timestamp": "2025-04-19 00:37:44.521309+00:00"},
"4096,4096,16,2,2,2,3,10,1,1,3": {"grid_width": 4096, "grid_height": 4096, "block_size_x": 16, "block_size_y": 2, "tile_size_x": 2, "tile_size_y": 2, "temporal_tiling_factor": 3, "max_tfactor": 10, "loop_unroll_factor_t": 1, "sh_power": 1, "blocks_per_sm": 3, "time": 0.9113600105047226, "times": [0.9615359902381897, 0.9144319891929626, 0.9113600254058838, 0.9103360176086426, 0.9103360176086426, 0.9103360176086426, 0.9082880020141602, 0.9093120098114014, 0.9093120098114014, 0.9093120098114014, 0.9093120098114014, 0.9093120098114014, 0.9103360176086426, 0.9103360176086426, 0.9093120098114014, 0.9093120098114014, 0.9093120098114014, 0.9082880020141602, 0.9103360176086426, 0.9093120098114014, 0.9093120098114014, 0.9093120098114014, 0.9093120098114014, 0.9103360176086426, 0.9093120098114014, 0.9093120098114014, 0.9093120098114014, 0.9093120098114014, 0.9103360176086426, 0.9093120098114014, 0.9093120098114014, 0.9093120098114014], "compile_time": 764.3796399934217, "verification_time": 0, "benchmark_time": 30.409662052989006, "GFLOP/s": 828.4044848334804, "gridpoints/s": 55226965655.56536, "strategy_time": 0.009156996384263039, "framework_time": 1.4366299146786332, "timestamp": "2025-04-19 00:37:45.317577+00:00"},
"4096,4096,128,1,1,9,1,10,1,1,0": {"grid_width": 4096, "grid_height": 4096, "block_size_x": 128, "block_size_y": 1, "tile_size_x": 1, "tile_size_y": 9, "temporal_tiling_factor": 1, "max_tfactor": 10, "loop_unroll_factor_t": 1, "sh_power": 1, "blocks_per_sm": 0, "time": 0.3993279952555895, "times": [0.45158401131629944, 0.40038400888442993, 0.3993600010871887, 0.3983359932899475, 0.3973119854927063, 0.3993600010871887, 0.3973119854927063, 0.3962880074977875, 0.3962880074977875, 0.3983359932899475, 0.3962880074977875, 0.3973119854927063, 0.3962880074977875, 0.3962880074977875, 0.3973119854927063, 0.3962880074977875, 0.3983359932899475, 0.3983359932899475, 0.3983359932899475, 0.3962880074977875, 0.3973119854927063, 0.3973119854927063, 0.3973119854927063, 0.39526399970054626, 0.3973119854927063, 0.3973119854927063, 0.3973119854927063, 0.3993600010871887, 0.3973119854927063, 0.3973119854927063, 0.3973119854927063, 0.40243199467658997], "compile_time": 729.1364250704646, "verification_time": 0, "benchmark_time": 14.227133942767978, "GFLOP/s": 630.2043507841878, "gridpoints/s": 42013623385.61252, "strategy_time": 0.008695991709828377, "framework_time": 1.4934289501979947, "timestamp": "2025-04-19 00:37:46.062474+00:00"},
"4096,4096,16,4,9,4,2,10,1,1,3": {"grid_width": 4096, "grid_height": 4096, "block_size_x": 16, "block_size_y": 4, "tile_size_x": 9, "tile_size_y": 4, "temporal_tiling_factor": 2, "max_tfactor": 10, "loop_unroll_factor_t": 1, "sh_power": 1, "blocks_per_sm": 3, "time": 0.7829439863562584, "times": [0.8366079926490784, 0.7905279994010925, 0.78438401222229, 0.7823359966278076, 0.7813119888305664, 0.7813119888305664, 0.7813119888305664, 0.7813119888305664, 0.779263973236084, 0.779263973236084, 0.779263973236084, 0.7823359966278076, 0.7802879810333252, 0.779263973236084, 0.7823359966278076, 0.7813119888305664, 0.7813119888305664, 0.7813119888305664, 0.7813119888305664, 0.7813119888305664, 0.7802879810333252, 0.7813119888305664, 0.7802879810333252, 0.7823359966278076, 0.7802879810333252, 0.7802879810333252, 0.7802879810333252, 0.7802879810333252, 0.7802879810333252, 0.7813119888305664, 0.7802879810333252, 0.779263973236084], "compile_time": 816.0862580407411, "verification_time": 0, "benchmark_time": 26.804080000147223, "GFLOP/s": 642.8511985159802, "gridpoints/s": 42856746567.73202, "strategy_time": 0.00838597770780325, "framework_time": 1.3970049330964684, "timestamp": "2025-04-19 00:37:46.906802+00:00"},
"4096,4096,16,4,2,10,7,10,7,1,2": {"grid_width": 4096, "grid_height": 4096, "block_size_x": 16, "block_size_y": 4, "tile_size_x": 2, "tile_size_y": 10, "temporal_tiling_factor": 7, "max_tfactor": 10, "loop_unroll_factor_t": 7, "sh_power": 1, "blocks_per_sm": 2, "time": 2.3314880803227425, "times": [2.387968063354492, 2.3347198963165283, 2.331648111343384, 2.32857608795166, 2.3306241035461426, 2.3306241035461426, 2.327552080154419, 2.3296000957489014, 2.3296000957489014, 2.3296000957489014, 2.3296000957489014, 2.331648111343384, 2.32857608795166, 2.32857608795166, 2.327552080154419, 2.3244800567626953, 2.3296000957489014, 2.3296000957489014, 2.32857608795166, 2.32857608795166, 2.32857608795166, 2.3306241035461426, 2.3296000957489014, 2.3296000957489014, 2.3296000957489014, 2.327552080154419, 2.32857608795166, 2.3306241035461426, 2.331648111343384, 2.3296000957489014, 2.333695888519287, 2.3306241035461426], "compile_time": 1041.1180119263008, "verification_time": 0, "benchmark_time": 76.62515598349273, "GFLOP/s": 755.5722436960282, "gridpoints/s": 50371482913.06855, "strategy_time": 0.007783994078636169, "framework_time": 1.4568890910595655, "timestamp": "2025-04-19 00:37:48.026041+00:00"},
"4096,4096,16,2,2,2,7,10,7,0,1": {"grid_width": 4096, "grid_height": 4096, "block_size_x": 16, "block_size_y": 2, "tile_size_x": 2, "tile_size_y": 2, "temporal_tiling_factor": 7, "max_tfactor": 10, "loop_unroll_factor_t": 7, "sh_power": 0, "blocks_per_sm": 1, "time": 4.631584025919437, "times": [4.87116813659668, 4.8158721923828125, 4.81382417678833, 4.811776161193848, 4.811776161193848, 4.81382417678833, 4.810751914978027, 4.81382417678833, 4.811776161193848, 4.810751914978027, 4.810751914978027, 4.81382417678833, 4.810751914978027, 4.808703899383545, 4.810751914978027, 4.810751914978027, 4.810751914978027, 4.808703899383545, 4.811776161193848, 4.81279993057251, 4.81279993057251, 4.810751914978027, 4.810751914978027, 4.809728145599365, 4.811776161193848, 4.808703899383545, 4.810751914978027, 4.811776161193848, 3.931135892868042, 3.1651840209960938, 3.166208028793335, 3.166208028793335], "compile_time": 1120.0561000732705, "verification_time": 0, "benchmark_time": 149.42407596390694, "GFLOP/s": 380.34669567509246, "gridpoints/s": 25356446378.339497, "strategy_time": 0.008366070687770844, "framework_time": 1.5811899211257696, "timestamp": "2025-04-19 00:37:49.297143+00:00"},
"4096,4096,8,32,4,1,6,10,2,1,1": {"grid_width": 4096, "grid_height": 4096, "block_size_x": 8, "block_size_y": 32, "tile_size_x": 4, "tile_size_y": 1, "temporal_tiling_factor": 6, "max_tfactor": 10, "loop_unroll_factor_t": 2, "sh_power": 1, "blocks_per_sm": 1, "time": 0.7309760041534901, "times": [0.7874559760093689, 0.7352319955825806, 0.7301120162010193, 0.7301120162010193, 0.7290880084037781, 0.7301120162010193, 0.7301120162010193, 0.7290880084037781, 0.7290880084037781, 0.7290880084037781, 0.7280640006065369, 0.7280640006065369, 0.7290880084037781, 0.7280640006065369, 0.7280640006065369, 0.7280640006065369, 0.7290880084037781, 0.7290880084037781, 0.7280640006065369, 0.7290880084037781, 0.7280640006065369, 0.7290880084037781, 0.7280640006065369, 0.7301120162010193, 0.7290880084037781, 0.7280640006065369, 0.7321599721908569, 0.7280640006065369, 0.7290880084037781, 0.7280640006065369, 0.7290880084037781, 0.7280640006065369], "compile_time": 786.0041290987283, "verification_time": 0, "benchmark_time": 24.91214603651315, "GFLOP/s": 2065.662116704643, "gridpoints/s": 137710807780.3095, "strategy_time": 0.009697978384792805, "framework_time": 1.59170082770288, "timestamp": "2025-04-19 00:37:50.109693+00:00"},
"4096,4096,1,32,8,2,6,10,1,1,2": {"grid_width": 4096, "grid_height": 4096, "block_size_x": 1, "block_size_y": 32, "tile_size_x": 8, "tile_size_y": 2, "temporal_tiling_factor": 6, "max_tfactor": 10, "loop_unroll_factor_t": 1, "sh_power": 1, "blocks_per_sm": 2, "time": 2.0276159271597862, "times": [2.0838398933410645, 2.0387840270996094, 2.0295679569244385, 2.0254719257354736, 2.0285439491271973, 2.027519941329956, 2.0295679569244385, 2.0254719257354736, 2.027519941329956, 2.027519941329956, 2.0285439491271973, 2.0244479179382324, 2.0295679569244385, 2.026495933532715, 2.0254719257354736, 2.0254719257354736, 2.0285439491271973, 2.023423910140991, 2.0203518867492676, 2.0244479179382324, 2.021375894546509, 2.026495933532715, 2.02239990234375, 2.021375894546509, 2.023423910140991, 2.02239990234375, 2.023423910140991, 2.0254719257354736, 2.0254719257354736, 2.0244479179382324, 2.0244479179382324, 2.02239990234375], "compile_time": 760.0606110645458, "verification_time": 0, "benchmark_time": 66.03294797241688, "GFLOP/s": 744.6920394411601, "gridpoints/s": 49646135962.744, "strategy_time": 0.008816015906631947, "framework_time": 1.4185479376465082, "timestamp": "2025-04-19 00:37:50.937246+00:00"},
"4096,4096,96,8,1,5,4,10,2,0,1": {"grid_width": 4096, "grid_height": 4096, "block_size_x": 96, "block_size_y": 8, "tile_size_x": 1, "tile_size_y": 5, "temporal_tiling_factor": 4, "max_tfactor": 10, "loop_unroll_factor_t": 2, "sh_power": 0, "blocks_per_sm": 1, "time": 0.9742400106042624, "times": [1.0240000486373901, 0.9779199957847595, 0.9748479723930359, 0.9758719801902771, 0.9728000164031982, 0.9738240242004395, 0.9738240242004395, 0.9707520008087158, 0.9728000164031982, 0.971776008605957, 0.9728000164031982, 0.971776008605957, 0.9738240242004395, 0.971776008605957, 0.9738240242004395, 0.9728000164031982, 0.971776008605957, 0.9728000164031982, 0.9738240242004395, 0.9707520008087158, 0.971776008605957, 0.9707520008087158, 0.971776008605957, 0.9707520008087158, 0.9707520008087158, 0.9728000164031982, 0.9728000164031982, 0.971776008605957, 0.971776008605957, 0.971776008605957, 0.9728000164031982, 0.971776008605957], "compile_time": 695.0799530604854, "verification_time": 0, "benchmark_time": 32.248746952973306, "GFLOP/s": 1033.249455004056, "gridpoints/s": 68883297000.2704, "strategy_time": 0.008335919119417667, "framework_time": 1.4100600965321064, "timestamp": "2025-04-19 00:37:51.666023+00:00"},
"4096,4096,64,1,2,8,6,10,6,1,2": {"grid_width": 4096, "grid_height": 4096, "block_size_x": 64, "block_size_y": 1, "tile_size_x": 2, "tile_size_y": 8, "temporal_tiling_factor": 6, "max_tfactor": 10, "loop_unroll_factor_t": 6, "sh_power": 1, "blocks_per_sm": 2, "time": 3.7384640723466873, "times": [3.792896032333374, 3.7396481037139893, 3.7365760803222656, 3.738624095916748, 3.7365760803222656, 3.7416958808898926, 3.737600088119507, 3.737600088119507, 3.7355520725250244, 3.7355520725250244, 3.734528064727783, 3.732480049133301, 3.737600088119507, 3.733504056930542, 3.737600088119507, 3.7365760803222656, 3.7355520725250244, 3.7355520725250244, 3.7396481037139893, 3.737600088119507, 3.7355520725250244, 3.737600088119507, 3.7365760803222656, 3.734528064727783, 3.7355520725250244, 3.738624095916748, 3.7355520725250244, 3.737600088119507, 3.734528064727783, 3.737600088119507, 3.738624095916748, 3.7355520725250244], "compile_time": 977.711722953245, "verification_time": 0, "benchmark_time": 121.08092394191772, "GFLOP/s": 403.89566698502017, "gridpoints/s": 26926377799.001343, "strategy_time": 0.009619048796594143, "framework_time": 1.5081730671226978, "timestamp": "2025-04-19 00:37:52.766365+00:00"},
"4096,4096,4,8,3,5,6,10,1,0,1": {"grid_width": 4096, "grid_height": 4096, "block_size_x": 4, "block_size_y": 8, "tile_size_x": 3, "tile_size_y": 5, "temporal_tiling_factor": 6, "max_tfactor": 10, "loop_unroll_factor_t": 1, "sh_power": 0, "blocks_per_sm": 1, "time": 2.261600039899349, "times": [2.3152639865875244, 2.263040065765381, 2.2620160579681396, 2.2609920501708984, 2.257920026779175, 2.2620160579681396, 2.2609920501708984, 2.2609920501708984, 2.2599680423736572, 2.2609920501708984, 2.258944034576416, 2.258944034576416, 2.258944034576416, 2.258944034576416, 2.258944034576416, 2.2599680423736572, 2.258944034576416, 2.2599680423736572, 2.2599680423736572, 2.257920026779175, 2.258944034576416, 2.2599680423736572, 2.2599680423736572, 2.2599680423736572, 2.2599680423736572, 2.257920026779175, 2.2620160579681396, 2.2599680423736572, 2.2599680423736572, 2.257920026779175, 2.258944034576416, 2.2599680423736572], "compile_time": 837.8662369213998, "verification_time": 0, "benchmark_time": 74.17439599521458, "GFLOP/s": 667.6465393355754, "gridpoints/s": 44509769289.03836, "strategy_time": 0.008846982382237911, "framework_time": 1.4669271185994148, "timestamp": "2025-04-19 00:37:53.679915+00:00"},
"4096,4096,16,8,1,9,8,10,8,1,3": {"grid_width": 4096, "grid_height": 4096, "block_size_x": 16, "block_size_y": 8, "tile_size_x": 1, "tile_size_y": 9, "temporal_tiling_factor": 8, "max_tfactor": 10, "loop_unroll_factor_t": 8, "sh_power": 1, "blocks_per_sm": 3, "time": 2.526879921555519, "times": [2.5825281143188477, 2.530303955078125, 2.5272319316864014, 2.52620792388916, 2.525183916091919, 2.5272319316864014, 2.525183916091919, 2.52620792388916, 2.5241599082946777, 2.5241599082946777, 2.525183916091919, 2.5241599082946777, 2.525183916091919, 2.5241599082946777, 2.5272319316864014, 2.5241599082946777, 2.525183916091919, 2.5241599082946777, 2.525183916091919, 2.525183916091919, 2.5241599082946777, 2.52620792388916, 2.5231359004974365, 2.52620792388916, 2.525183916091919, 2.5231359004974365, 2.5241599082946777, 2.5241599082946777, 2.5241599082946777, 2.525183916091919, 2.5241599082946777, 2.5221118927001953], "compile_time": 1044.9136710958555, "verification_time": 0, "benchmark_time": 81.98308991268277, "GFLOP/s": 796.7398461738759, "gridpoints/s": 53115989744.92506, "strategy_time": 0.009287032298743725, "framework_time": 1.451198011636734, "timestamp": "2025-04-19 00:37:54.808310+00:00"},
"4096,4096,8,4,2,2,4,10,2,0,1": {"grid_width": 4096, "grid_height": 4096, "block_size_x": 8, "block_size_y": 4, "tile_size_x": 2, "tile_size_y": 2, "temporal_tiling_factor": 4, "max_tfactor": 10, "loop_unroll_factor_t": 2, "sh_power": 0, "blocks_per_sm": 1, "time": 1.4564479887485504, "times": [1.511423945426941, 1.4592000246047974, 1.4581760168075562, 1.4551039934158325, 1.4551039934158325, 1.45305597782135, 1.4540799856185913, 1.4540799856185913, 1.457152009010315, 1.4561280012130737, 1.4551039934158325, 1.4520319700241089, 1.4551039934158325, 1.4551039934158325, 1.4540799856185913, 1.45305597782135, 1.4540799856185913, 1.4551039934158325, 1.4551039934158325, 1.4561280012130737, 1.4540799856185913, 1.4551039934158325, 1.4540799856185913, 1.45305597782135, 1.4540799856185913, 1.4540799856185913, 1.4551039934158325, 1.45305597782135, 1.4540799856185913, 1.4540799856185913, 1.45305597782135, 1.4540799856185913], "compile_time": 826.2337909545749, "verification_time": 0, "benchmark_time": 48.21128200273961, "GFLOP/s": 691.156133124223, "gridpoints/s": 46077075541.61486, "strategy_time": 0.008526025339961052, "framework_time": 1.5088660875335336, "timestamp": "2025-04-19 00:37:55.684305+00:00"},
"4096,4096,1,32,5,5,8,10,8,0,1": {"grid_width": 4096, "grid_height": 4096, "block_size_x": 1, "block_size_y": 32, "tile_size_x": 5, "tile_size_y": 5, "temporal_tiling_factor": 8, "max_tfactor": 10, "loop_unroll_factor_t": 8, "sh_power": 0, "blocks_per_sm": 1, "time": 6.673216015100479, "times": [6.7788801193237305, 6.724607944488525, 6.723584175109863, 6.726655960083008, 6.721536159515381, 6.717440128326416, 6.725632190704346, 6.724607944488525, 6.723584175109863, 6.722559928894043, 6.724607944488525, 6.719488143920898, 6.702079772949219, 6.633471965789795, 6.63756799697876, 6.639616012573242, 6.639616012573242, 6.634496212005615, 6.634496212005615, 6.63756799697876, 6.6314239501953125, 6.636544227600098, 6.634496212005615, 6.634496212005615, 6.640639781951904, 6.633471965789795, 6.642687797546387, 6.640639781951904, 6.636544227600098, 6.640639781951904, 6.640639781951904, 6.638591766357422], "compile_time": 1153.1404410488904, "verification_time": 0, "benchmark_time": 214.89886799827218, "GFLOP/s": 301.6935036186875, "gridpoints/s": 20112900241.245834, "strategy_time": 0.00899704173207283, "framework_time": 1.5380599070340395, "timestamp": "2025-04-19 00:37:57.053921+00:00"},
"4096,4096,2,32,9,1,8,10,2,1,4": {"grid_width": 4096, "grid_height": 4096, "block_size_x": 2, "block_size_y": 32, "tile_size_x": 9, "tile_size_y": 1, "temporal_tiling_factor": 8, "max_tfactor": 10, "loop_unroll_factor_t": 2, "sh_power": 1, "blocks_per_sm": 4, "time": 1.1768320053815842, "times": [1.230847954750061, 1.1786240339279175, 1.1776000261306763, 1.176576018333435, 1.1776000261306763, 1.176576018333435, 1.1776000261306763, 1.176576018333435, 1.1735039949417114, 1.1755520105361938, 1.1776000261306763, 1.176576018333435, 1.1745280027389526, 1.1745280027389526, 1.1755520105361938, 1.1755520105361938, 1.1735039949417114, 1.1745280027389526, 1.1755520105361938, 1.1735039949417114, 1.1735039949417114, 1.1745280027389526, 1.1735039949417114, 1.1755520105361938, 1.1735039949417114, 1.1735039949417114, 1.171455979347229, 1.1735039949417114, 1.1755520105361938, 1.1735039949417114, 1.1745280027389526, 1.1735039949417114], "compile_time": 786.3893000176176, "verification_time": 0, "benchmark_time": 39.338913979008794, "GFLOP/s": 1710.7504816264786, "gridpoints/s": 114050032108.4319, "strategy_time": 0.009226961992681026, "framework_time": 1.4426830457523465, "timestamp": "2025-04-19 00:37:57.881140+00:00"},
"4096,4096,2,16,10,5,1,10,1,0,1": {"grid_width": 4096, "grid_height": 4096, "block_size_x": 2, "block_size_y": 16, "tile_size_x": 10, "tile_size_y": 5, "temporal_tiling_factor": 1, "max_tfactor": 10, "loop_unroll_factor_t": 1, "sh_power": 0, "blocks_per_sm": 1, "time": 0.5262080021202564, "times": [0.579584002494812, 0.5304319858551025, 0.5314559936523438, 0.52019202709198, 0.5232639908790588, 0.5253120064735413, 0.5191680192947388, 0.5273600220680237, 0.5212159752845764, 0.5253120064735413, 0.5232639908790588, 0.5253120064735413, 0.5242879986763, 0.5222399830818176, 0.5253120064735413, 0.5273600220680237, 0.5222399830818176, 0.5273600220680237, 0.5263360142707825, 0.5242879986763, 0.5242879986763, 0.5263360142707825, 0.5232639908790588, 0.5212159752845764, 0.5273600220680237, 0.5181440114974976, 0.5232639908790588, 0.5273600220680237, 0.5222399830818176, 0.5232639908790588, 0.5263360142707825, 0.5242879986763], "compile_time": 816.5876460261643, "verification_time": 0, "benchmark_time": 18.812282010912895, "GFLOP/s": 478.24859938653594, "gridpoints/s": 31883239959.102398, "strategy_time": 0.008665956556797028, "framework_time": 1.4333250001072884, "timestamp": "2025-04-19 00:37:58.718013+00:00"},
"4096,4096,96,2,2,4,8,10,2,0,2": {"grid_width": 4096, "grid_height": 4096, "block_size_x": 96, "block_size_y": 2, "tile_size_x": 2, "tile_size_y": 4, "temporal_tiling_factor": 8, "max_tfactor": 10, "loop_unroll_factor_t": 2, "sh_power": 0, "blocks_per_sm": 2, "time": 3.208863988518715, "times": [3.2778239250183105, 3.226624011993408, 3.225600004196167, 3.2235519886016846, 3.2276480197906494, 3.2235519886016846, 3.229696035385132, 3.2235519886016846, 3.2235519886016846, 3.224575996398926, 3.2225279808044434, 3.2225279808044434, 3.2225279808044434, 3.224575996398926, 3.2174079418182373, 3.2225279808044434, 3.221503973007202, 3.2276480197906494, 3.220479965209961, 3.230720043182373, 3.2235519886016846, 3.2235519886016846, 3.2184319496154785, 3.225600004196167, 3.225600004196167, 3.2235519886016846, 3.220479965209961, 3.2174079418182373, 3.215359926223755, 3.2235519886016846, 3.2092161178588867, 2.718719959259033], "compile_time": 714.501135982573, "verification_time": 0, "benchmark_time": 104.59150199312717, "GFLOP/s": 627.4076829692522, "gridpoints/s": 41827178864.61681, "strategy_time": 0.009367940947413445, "framework_time": 1.7617291305214167, "timestamp": "2025-04-19 00:37:59.538908+00:00"},
"4096,4096,64,8,1,4,6,10,6,0,4": {"grid_width": 4096, "grid_height": 4096, "block_size_x": 64, "block_size_y": 8, "tile_size_x": 1, "tile_size_y": 4, "temporal_tiling_factor": 6, "max_tfactor": 10, "loop_unroll_factor_t": 6, "sh_power": 0, "blocks_per_sm": 4, "time": 1.1548479571938515, "times": [1.21343994140625, 1.1581439971923828, 1.154047966003418, 1.154047966003418, 1.154047966003418, 1.1550719738006592, 1.1519999504089355, 1.1530239582061768, 1.1509759426116943, 1.1550719738006592, 1.154047966003418, 1.1519999504089355, 1.1519999504089355, 1.1509759426116943, 1.154047966003418, 1.1509759426116943, 1.1519999504089355, 1.1530239582061768, 1.1519999504089355, 1.1519999504089355, 1.1519999504089355, 1.1509759426116943, 1.1530239582061768, 1.1530239582061768, 1.1530239582061768, 1.1530239582061768, 1.1519999504089355, 1.154047966003418, 1.1519999504089355, 1.1519999504089355, 1.1519999504089355, 1.1550719738006592], "compile_time": 1064.7519150516018, "verification_time": 0, "benchmark_time": 39.17436592746526, "GFLOP/s": 1307.4876485637162, "gridpoints/s": 87165843237.58109, "strategy_time": 0.00819494016468525, "framework_time": 1.5972021501511335, "timestamp": "2025-04-19 00:38:00.644476+00:00"},
"4096,4096,128,4,1,6,3,10,3,0,2": {"grid_width": 4096, "grid_height": 4096, "block_size_x": 128, "block_size_y": 4, "tile_size_x": 1, "tile_size_y": 6, "temporal_tiling_factor": 3, "max_tfactor": 10, "loop_unroll_factor_t": 3, "sh_power": 0, "blocks_per_sm": 2, "time": 1.0512960031628609, "times": [1.1059199571609497, 1.052672028541565, 1.0516480207443237, 1.0485759973526, 1.0496000051498413, 1.0506240129470825, 1.0496000051498413, 1.0516480207443237, 1.0485759973526, 1.0485759973526, 1.0485759973526, 1.0516480207443237, 1.0496000051498413, 1.0496000051498413, 1.0506240129470825, 1.0496000051498413, 1.0496000051498413, 1.0496000051498413, 1.0506240129470825, 1.0485759973526, 1.0485759973526, 1.0475519895553589, 1.0485759973526, 1.0496000051498413, 1.0496000051498413, 1.0496000051498413, 1.0496000051498413, 1.0475519895553589, 1.0496000051498413, 1.0485759973526, 1.0496000051498413, 1.0475519895553589], "compile_time": 879.9500429304317, "verification_time": 0, "benchmark_time": 35.73688899632543, "GFLOP/s": 718.1371542635301, "gridpoints/s": 47875810284.23534, "strategy_time": 0.008695991709828377, "framework_time": 1.658095046877861, "timestamp": "2025-04-19 00:38:01.561862+00:00"},
"4096,4096,8,32,10,1,1,10,1,1,0": {"grid_width": 4096, "grid_height": 4096, "block_size_x": 8, "block_size_y": 32, "tile_size_x": 10, "tile_size_y": 1, "temporal_tiling_factor": 1, "max_tfactor": 10, "loop_unroll_factor_t": 1, "sh_power": 1, "blocks_per_sm": 0, "time": 0.4101120000705123, "times": [0.46489599347114563, 0.41676801443099976, 0.4106239974498749, 0.40755200386047363, 0.4055039882659912, 0.4106239974498749, 0.4106239974498749, 0.40857601165771484, 0.4065279960632324, 0.40857601165771484, 0.40857601165771484, 0.40755200386047363, 0.40959998965263367, 0.4055039882659912, 0.40755200386047363, 0.4065279960632324, 0.40755200386047363, 0.40755200386047363, 0.4065279960632324, 0.4106239974498749, 0.40857601165771484, 0.4065279960632324, 0.4055039882659912, 0.4065279960632324, 0.4065279960632324, 0.40755200386047363, 0.4106239974498749, 0.4065279960632324, 0.40857601165771484, 0.40857601165771484, 0.4106239974498749, 0.40959998965263367], "compile_time": 728.9745620219037, "verification_time": 0, "benchmark_time": 14.618047047406435, "GFLOP/s": 613.6329586959936, "gridpoints/s": 40908863913.06624, "strategy_time": 0.008987030014395714, "framework_time": 1.7445168923586607, "timestamp": "2025-04-19 00:38:02.307240+00:00"},
"4096,4096,16,4,6,2,8,10,8,1,0": {"grid_width": 4096, "grid_height": 4096, "block_size_x": 16, "block_size_y": 4, "tile_size_x": 6, "tile_size_y": 2, "temporal_tiling_factor": 8, "max_tfactor": 10, "loop_unroll_factor_t": 8, "sh_power": 1, "blocks_per_sm": 0, "time": 3.143936075270176, "times": [3.200000047683716, 3.1498239040374756, 3.14572811126709, 3.142656087875366, 3.14572811126709, 3.1447041034698486, 3.142656087875366, 3.141632080078125, 3.142656087875366, 3.141632080078125, 3.140608072280884, 3.140608072280884, 3.141632080078125, 3.141632080078125, 3.142656087875366, 3.140608072280884, 3.141632080078125, 3.1436800956726074, 3.141632080078125, 3.140608072280884, 3.1395840644836426, 3.141632080078125, 3.141632080078125, 3.1395840644836426, 3.140608072280884, 3.141632080078125, 3.142656087875366, 3.140608072280884, 3.141632080078125, 3.141632080078125, 3.141632080078125, 3.140608072280884], "compile_time": 1071.7782530700788, "verification_time": 0, "benchmark_time": 101.65913007222116, "GFLOP/s": 640.3647758095682, "gridpoints/s": 42690985053.971214, "strategy_time": 0.008706003427505493, "framework_time": 1.5907908091321588, "timestamp": "2025-04-19 00:38:03.482308+00:00"},
"4096,4096,16,4,6,5,6,10,3,0,3": {"grid_width": 4096, "grid_height": 4096, "block_size_x": 16, "block_size_y": 4, "tile_size_x": 6, "tile_size_y": 5, "temporal_tiling_factor": 6, "max_tfactor": 10, "loop_unroll_factor_t": 3, "sh_power": 0, "blocks_per_sm": 3, "time": 1.9571519903838634, "times": [2.012160062789917, 1.9568639993667603, 1.9589120149612427, 1.9589120149612427, 1.9517439603805542, 1.955839991569519, 1.9578880071640015, 1.9568639993667603, 1.9537919759750366, 1.9496959447860718, 1.9589120149612427, 1.9589120149612427, 1.9527679681777954, 1.9548159837722778, 1.9568639993667603, 1.9578880071640015, 1.9568639993667603, 1.9537919759750366, 1.9527679681777954, 1.950719952583313, 1.9568639993667603, 1.9578880071640015, 1.955839991569519, 1.9578880071640015, 1.955839991569519, 1.9589120149612427, 1.950719952583313, 1.9527679681777954, 1.950719952583313, 1.9548159837722778, 1.9527679681777954, 1.9568639993667603], "compile_time": 1029.3375700712204, "verification_time": 0, "benchmark_time": 64.22811804804951, "GFLOP/s": 771.5034128258216, "gridpoints/s": 51433560855.05477, "strategy_time": 0.008875969797372818, "framework_time": 1.6699680127203465, "timestamp": "2025-04-19 00:38:04.577584+00:00"},
"4096,4096,8,4,2,1,6,10,3,1,0": {"grid_width": 4096, "grid_height": 4096, "block_size_x": 8, "block_size_y": 4, "tile_size_x": 2, "tile_size_y": 1, "temporal_tiling_factor": 6, "max_tfactor": 10, "loop_unroll_factor_t": 3, "sh_power": 1, "blocks_per_sm": 0, "time": 3.4274240732192993, "times": [3.545088052749634, 3.492863893508911, 3.490816116333008, 3.4897921085357666, 3.4897921085357666, 3.4897921085357666, 3.4887681007385254, 3.487744092941284, 3.4887681007385254, 3.487744092941284, 3.487744092941284, 3.487744092941284, 3.487744092941284, 3.487744092941284, 3.4887681007385254, 3.4887681007385254, 3.487744092941284, 3.4887681007385254, 3.487744092941284, 3.487744092941284, 3.4887681007385254, 3.487744092941284, 3.487744092941284, 3.487744092941284, 3.4887681007385254, 3.487744092941284, 3.487744092941284, 3.487744092941284, 3.487744092941284, 2.835455894470215, 2.8098559379577637, 2.8088319301605225], "compile_time": 879.7387880040333, "verification_time": 0, "benchmark_time": 111.88322806265205, "GFLOP/s": 440.54934777351315, "gridpoints/s": 29369956518.234207, "strategy_time": 0.009428011253476143, "framework_time": 1.618669950403273, "timestamp": "2025-04-19 00:38:05.570866+00:00"},
"4096,4096,16,8,1,7,2,10,1,1,4": {"grid_width": 4096, "grid_height": 4096, "block_size_x": 16, "block_size_y": 8, "tile_size_x": 1, "tile_size_y": 7, "temporal_tiling_factor": 2, "max_tfactor": 10, "loop_unroll_factor_t": 1, "sh_power": 1, "blocks_per_sm": 4, "time": 0.4559679999947548, "times": [0.5079039931297302, 0.45977601408958435, 0.4567039906978607, 0.4546560049057007, 0.4546560049057007, 0.4536319971084595, 0.4546560049057007, 0.45260798931121826, 0.4536319971084595, 0.4546560049057007, 0.4546560049057007, 0.4546560049057007, 0.4546560049057007, 0.4536319971084595, 0.4546560049057007, 0.4536319971084595, 0.4536319971084595, 0.4536319971084595, 0.4546560049057007, 0.45260798931121826, 0.4546560049057007, 0.4536319971084595, 0.4556800127029419, 0.4536319971084595, 0.4546560049057007, 0.4536319971084595, 0.4536319971084595, 0.4536319971084595, 0.4536319971084595, 0.4536319971084595, 0.4546560049057007, 0.45260798931121826], "compile_time": 762.4138089595363, "verification_time": 0, "benchmark_time": 16.192806069739163, "GFLOP/s": 1103.8416731125644, "gridpoints/s": 73589444874.17096, "strategy_time": 0.00887701753526926, "framework_time": 1.785913947969675, "timestamp": "2025-04-19 00:38:06.351299+00:00"},
"4096,4096,4,8,9,7,4,10,4,1,0": {"grid_width": 4096, "grid_height": 4096, "block_size_x": 4, "block_size_y": 8, "tile_size_x": 9, "tile_size_y": 7, "temporal_tiling_factor": 4, "max_tfactor": 10, "loop_unroll_factor_t": 4, "sh_power": 1, "blocks_per_sm": 0, "time": 1.840480025857687, "times": [1.8954240083694458, 1.844223976135254, 1.840127944946289, 1.837056040763855, 1.8360320329666138, 1.8380800485610962, 1.8380800485610962, 1.8360320329666138, 1.837056040763855, 1.8380800485610962, 1.837056040763855, 1.8380800485610962, 1.8360320329666138, 1.8339840173721313, 1.8360320329666138, 1.8360320329666138, 1.8350080251693726, 1.8350080251693726, 1.8350080251693726, 1.8360320329666138, 1.8360320329666138, 1.8360320329666138, 1.8350080251693726, 1.8350080251693726, 1.8360320329666138, 1.8360320329666138, 1.8360320329666138, 1.8360320329666138, 1.8360320329666138, 1.8350080251693726, 1.8360320329666138, 1.903615951538086], "compile_time": 957.5691999634728, "verification_time": 0, "benchmark_time": 60.69458008278161, "GFLOP/s": 546.9404426331095, "gridpoints/s": 36462696175.54063, "strategy_time": 0.008756062015891075, "framework_time": 1.5363178681582212, "timestamp": "2025-04-19 00:38:07.371140+00:00"},
"4096,4096,32,4,1,6,8,10,8,1,3": {"grid_width": 4096, "grid_height": 4096, "block_size_x": 32, "block_size_y": 4, "tile_size_x": 1, "tile_size_y": 6, "temporal_tiling_factor": 8, "max_tfactor": 10, "loop_unroll_factor_t": 8, "sh_power": 1, "blocks_per_sm": 3, "time": 2.319232001900673, "times": [2.376703977584839, 2.3214080333709717, 2.3193600177764893, 2.318336009979248, 2.318336009979248, 2.318336009979248, 2.318336009979248, 2.318336009979248, 2.317312002182007, 2.317312002182007, 2.317312002182007, 2.3162879943847656, 2.3162879943847656, 2.3162879943847656, 2.3162879943847656, 2.3162879943847656, 2.317312002182007, 2.3162879943847656, 2.3162879943847656, 2.317312002182007, 2.3162879943847656, 2.3193600177764893, 2.317312002182007, 2.3162879943847656, 2.317312002182007, 2.317312002182007, 2.317312002182007, 2.3162879943847656, 2.318336009979248, 2.317312002182007, 2.3152639865875244, 2.317312002182007], "compile_time": 1056.6773019963875, "verification_time": 0, "benchmark_time": 76.47274993360043, "GFLOP/s": 868.074396330369, "gridpoints/s": 57871626422.024605, "strategy_time": 0.009526964277029037, "framework_time": 1.5317100333049893, "timestamp": "2025-04-19 00:38:08.505864+00:00"},
"4096,4096,4,16,5,4,9,10,9,0,2": {"grid_width": 4096, "grid_height": 4096, "block_size_x": 4, "block_size_y": 16, "tile_size_x": 5, "tile_size_y": 4, "temporal_tiling_factor": 9, "max_tfactor": 10, "loop_unroll_factor_t": 9, "sh_power": 0, "blocks_per_sm": 2, "time": 2.6667840257287025, "times": [2.7258880138397217, 2.6695680618286133, 2.667520046234131, 2.6654720306396484, 2.6644480228424072, 2.6654720306396484, 2.663424015045166, 2.663424015045166, 2.6654720306396484, 2.6654720306396484, 2.6664960384368896, 2.667520046234131, 2.6664960384368896, 2.6644480228424072, 2.663424015045166, 2.663424015045166, 2.6664960384368896, 2.6664960384368896, 2.6664960384368896, 2.6613759994506836, 2.6644480228424072, 2.662400007247925, 2.6654720306396484, 2.6644480228424072, 2.6644480228424072, 2.6613759994506836, 2.6644480228424072, 2.662400007247925, 2.663424015045166, 2.6644480228424072, 2.667520046234131, 2.663424015045166], "compile_time": 1269.7330790106207, "verification_time": 0, "benchmark_time": 87.29845494963229, "GFLOP/s": 849.3091822016244, "gridpoints/s": 56620612146.774956, "strategy_time": 0.010089017450809479, "framework_time": 1.7066060099750757, "timestamp": "2025-04-19 00:38:09.864644+00:00"},
"4096,4096,4,8,5,3,10,10,2,0,1": {"grid_width": 4096, "grid_height": 4096, "block_size_x": 4, "block_size_y": 8, "tile_size_x": 5, "tile_size_y": 3, "temporal_tiling_factor": 10, "max_tfactor": 10, "loop_unroll_factor_t": 2, "sh_power": 0, "blocks_per_sm": 1, "time": 3.768288068473339, "times": [3.821568012237549, 3.772416114807129, 3.7662720680236816, 3.767296075820923, 3.767296075820923, 3.767296075820923, 3.7662720680236816, 3.768320083618164, 3.7652480602264404, 3.7662720680236816, 3.767296075820923, 3.768320083618164, 3.7652480602264404, 3.7652480602264404, 3.767296075820923, 3.763200044631958, 3.768320083618164, 3.767296075820923, 3.7652480602264404, 3.768320083618164, 3.767296075820923, 3.764224052429199, 3.7662720680236816, 3.764224052429199, 3.764224052429199, 3.768320083618164, 3.764224052429199, 3.764224052429199, 3.767296075820923, 3.767296075820923, 3.7652480602264404, 3.768320083618164], "compile_time": 846.8519559828565, "verification_time": 0, "benchmark_time": 122.79793003108352, "GFLOP/s": 667.8317459470535, "gridpoints/s": 44522116396.47023, "strategy_time": 0.00871601514518261, "framework_time": 1.5825029695406556, "timestamp": "2025-04-19 00:38:10.835918+00:00"},
"4096,4096,192,1,1,5,6,10,1,1,2": {"grid_width": 4096, "grid_height": 4096, "block_size_x": 192, "block_size_y": 1, "tile_size_x": 1, "tile_size_y": 5, "temporal_tiling_factor": 6, "max_tfactor": 10, "loop_unroll_factor_t": 1, "sh_power": 1, "blocks_per_sm": 2, "time": 4.006752088665962, "times": [4.058112144470215, 4.014080047607422, 4.0069122314453125, 4.00486421585083, 4.0069122314453125, 4.007936000823975, 4.00486421585083, 4.005887985229492, 4.005887985229492, 4.001791954040527, 4.005887985229492, 4.00486421585083, 4.005887985229492, 4.0069122314453125, 4.00383996963501, 4.002816200256348, 4.00383996963501, 4.005887985229492, 4.00383996963501, 4.0069122314453125, 4.00383996963501, 4.00486421585083, 4.002816200256348, 4.001791954040527, 4.00486421585083, 4.005887985229492, 4.00383996963501, 4.005887985229492, 4.000768184661865, 4.0069122314453125, 4.00383996963501, 4.002816200256348], "compile_time": 686.5489670308307, "verification_time": 0, "benchmark_time": 129.9559250473976, "GFLOP/s": 376.8512267757334, "gridpoints/s": 25123415118.382225, "strategy_time": 0.00920705497264862, "framework_time": 1.608310965821147, "timestamp": "2025-04-19 00:38:11.654079+00:00"},
"4096,4096,16,2,6,10,8,10,4,0,4": {"grid_width": 4096, "grid_height": 4096, "block_size_x": 16, "block_size_y": 2, "tile_size_x": 6, "tile_size_y": 10, "temporal_tiling_factor": 8, "max_tfactor": 10, "loop_unroll_factor_t": 4, "sh_power": 0, "blocks_per_sm": 4, "time": 5.173535913228989, "times": [5.228544235229492, 5.173247814178467, 5.180416107177734, 5.173247814178467, 5.173247814178467, 5.1763200759887695, 5.171199798583984, 5.169151782989502, 5.170176029205322, 5.170176029205322, 5.165056228637695, 5.170176029205322, 5.1671037673950195, 5.174272060394287, 5.169151782989502, 5.170176029205322, 5.173247814178467, 5.171199798583984, 5.171199798583984, 5.172224044799805, 5.173247814178467, 5.16812801361084, 5.173247814178467, 5.171199798583984, 5.172224044799805, 5.16812801361084, 5.1671037673950195, 5.171199798583984, 5.173247814178467, 5.173247814178467, 5.175295829772949, 5.177343845367432], "compile_time": 1074.8530919663608, "verification_time": 0, "benchmark_time": 167.33842599205673, "GFLOP/s": 389.14698839762156, "gridpoints/s": 25943132559.84144, "strategy_time": 0.009487965144217014, "framework_time": 1.7748040845617652, "timestamp": "2025-04-19 00:38:12.898087+00:00"},
"4096,4096,2,32,10,1,8,10,2,1,3": {"grid_width": 4096, "grid_height": 4096, "block_size_x": 2, "block_size_y": 32, "tile_size_x": 10, "tile_size_y": 1, "temporal_tiling_factor": 8, "max_tfactor": 10, "loop_unroll_factor_t": 2, "sh_power": 1, "blocks_per_sm": 3, "time": 1.6217920184135437, "times": [1.6752640008926392, 1.6250879764556885, 1.6209919452667236, 1.6220159530639648, 1.6220159530639648, 1.6209919452667236, 1.6220159530639648, 1.619968056678772, 1.619968056678772, 1.6209919452667236, 1.6189440488815308, 1.6209919452667236, 1.6189440488815308, 1.619968056678772, 1.619968056678772, 1.6179200410842896, 1.619968056678772, 1.6189440488815308, 1.6209919452667236, 1.619968056678772, 1.6179200410842896, 1.6189440488815308, 1.6189440488815308, 1.6179200410842896, 1.619968056678772, 1.619968056678772, 1.6209919452667236, 1.6189440488815308, 1.619968056678772, 1.6189440488815308, 1.619968056678772, 1.6189440488815308], "compile_time": 791.2887160200626, "verification_time": 0, "benchmark_time": 53.52886999025941, "GFLOP/s": 1241.3835418732672, "gridpoints/s": 82758902791.55113, "strategy_time": 0.009016948752105236, "framework_time": 1.697549014352262, "timestamp": "2025-04-19 00:38:13.744643+00:00"},
