compare_real_world_impact/results/hotspot/A4000_f=bruteforce_i=8.json
{"device_name": "NVIDIA RTX A4000", "kernel_name": "calculate_temp", "problem_size": [4096, 4096], "tune_params_keys": ["grid_width", "grid_height", "block_size_x", "block_size_y", "tile_size_x", "tile_size_y", "temporal_tiling_factor", "max_tfactor", "loop_unroll_factor_t", "sh_power", "blocks_per_sm"], "tune_params": {"grid_width": [4096], "grid_height": [4096], "block_size_x": [1, 2, 4, 8, 16, 32, 64, 96, 128, 160, 192, 224, 256, 288, 320, 352, 384, 416, 448, 480, 512, 544, 576, 608, 640, 672, 704, 736, 768, 800, 832, 864, 896, 928, 960, 992, 1024], "block_size_y": [1, 2, 4, 8, 16, 32], "tile_size_x": [1, 2, 3, 4, 5, 6, 7, 8, 9, 10], "tile_size_y": [1, 2, 3, 4, 5, 6, 7, 8, 9, 10], "temporal_tiling_factor": [1, 2, 3, 4, 5, 6, 7, 8, 9, 10], "max_tfactor": [10], "loop_unroll_factor_t": [1, 2, 3, 4, 5, 6, 7, 8, 9, 10], "sh_power": [0, 1], "blocks_per_sm": [0, 1, 2, 3, 4]}, "objective": "GFLOP/s", "cache": {"4096,4096,16,16,5,1,5,10,1,0,0": {"grid_width": 4096, "grid_height": 4096, "block_size_x": 16, "block_size_y": 16, "tile_size_x": 5, "tile_size_y": 1, "temporal_tiling_factor": 5, "max_tfactor": 10, "loop_unroll_factor_t": 1, "sh_power": 0, "blocks_per_sm": 0, "time": 10.201168060302734, "times": [10.250240325927734, 10.207232475280762, 10.202207565307617, 10.200063705444336, 10.198016166687012, 10.199040412902832, 10.199135780334473, 10.200063705444336, 10.201024055480957, 10.201087951660156, 10.200063705444336, 10.199040412902832, 10.199040412902832, 10.198016166687012, 10.198016166687012, 10.199040412902832, 10.198944091796875, 10.199904441833496, 10.198016166687012, 10.198016166687012, 10.198975563049316, 10.198016166687012, 10.200063705444336, 10.198016166687012, 10.199040412902832, 10.200063705444336, 10.199999809265137, 10.199040412902832, 10.199999809265137, 10.200063705444336, 10.198847770690918, 10.199040412902832], "compile_time": 818.8816970214248, "verification_time": 0, "benchmark_time": 327.39272608887404, "GFLOP/s": 123.34775709622592, "strategy_time": 454927.83913807943, "framework_time": 0, "timestamp": "2025-04-08 05:24:00.635159+00:00", "gridpoints/s": 8223183806.415061}, "4096,4096,160,1,1,10,6,10,1,0,1": {"grid_width": 4096, "grid_height": 4096, "block_size_x": 160, "block_size_y": 1, "tile_size_x": 1, "tile_size_y": 10, "temporal_tiling_factor": 6, "max_tfactor": 10, "loop_unroll_factor_t": 1, "sh_power": 0, "blocks_per_sm": 1, "time": 17.24734604358673, "times": [17.270816802978516, 17.271615982055664, 17.2093448638916, 17.273855209350586, 17.269760131835938, 17.2410888671875, 17.24620819091797, 17.22879981994629, 17.22265625, 17.192960739135742, 17.267616271972656, 17.23699188232422, 17.21343994140625, 17.22265625, 17.20832061767578, 17.24518394470215, 17.274879455566406, 17.273855209350586, 17.266687393188477, 17.261568069458008, 17.275903701782227, 17.25542449951172, 17.277952194213867, 17.22879981994629, 17.266687393188477, 17.266496658325195, 17.260543823242188, 17.284095764160156, 17.191936492919922, 17.21139144897461, 17.275903701782227, 17.22163200378418], "compile_time": 717.3771871021017, "verification_time": 0, "benchmark_time": 553.5922540584579, "GFLOP/s": 87.54677016302232, "strategy_time": 0.008646049536764622, "framework_time": 1.93827785551548, "timestamp": "2025-04-08 05:24:01.908107+00:00", "gridpoints/s": 5836451344.2014885}, "4096,4096,32,1,3,9,2,10,2,1,1": {"grid_width": 4096, "grid_height": 4096, "block_size_x": 32, "block_size_y": 1, "tile_size_x": 3, "tile_size_y": 9, "temporal_tiling_factor": 2, "max_tfactor": 10, "loop_unroll_factor_t": 2, "sh_power": 1, "blocks_per_sm": 1, "time": 5.4320879727602005, "times": [5.488639831542969, 5.4345598220825195, 5.434368133544922, 5.430272102355957, 5.433311939239502, 5.428224086761475, 5.431295871734619, 5.429247856140137, 5.428224086761475, 5.429120063781738, 5.426176071166992, 5.427135944366455, 5.430272102355957, 5.4301438331604, 5.429247856140137, 5.433343887329102, 5.4323201179504395, 5.433343887329102, 5.4323201179504395, 5.427199840545654, 5.4323201179504395, 5.433343887329102, 5.433343887329102, 5.428224086761475, 5.430272102355957, 5.434368133544922, 5.419007778167725, 5.429247856140137, 5.429247856140137, 5.430272102355957, 5.4251837730407715, 5.433216094970703], "compile_time": 806.380482041277, "verification_time": 0, "benchmark_time": 175.1063399715349, "GFLOP/s": 92.65617245595718, "strategy_time": 0.008906004950404167, "framework_time": 1.581741962581873, "timestamp": "2025-04-08 05:24:02.891217+00:00", "gridpoints/s": 6177078163.730478}, "4096,4096,256,1,1,8,1,10,1,0,0": {"grid_width": 4096, "grid_height": 4096, "block_size_x": 256, "block_size_y": 1, "tile_size_x": 1, "tile_size_y": 8, "temporal_tiling_factor": 1, "max_tfactor": 10, "loop_unroll_factor_t": 1, "sh_power": 0, "blocks_per_sm": 0, "time": 1.4343350119888783, "times": [1.4878720045089722, 1.4387199878692627, 1.4335999488830566, 1.4325759410858154, 1.4315520524978638, 1.4315520524978638, 1.431488037109375, 1.4315520524978638, 1.4315520524978638, 1.4325759410858154, 1.4315520524978638, 1.4315520524978638, 1.4325759410858154, 1.4325120449066162, 1.432479977607727, 1.4315520524978638, 1.431488037109375, 1.4324159622192383, 1.4325759410858154, 1.4325120449066162, 1.4325759410858154, 1.4315520524978638, 1.4315520524978638, 1.4305280447006226, 1.4315520524978638, 1.4305280447006226, 1.432479977607727, 1.4305280447006226, 1.4324480295181274, 1.4313600063323975, 1.4477440118789673, 1.431615948677063], "compile_time": 760.2964689722285, "verification_time": 0, "benchmark_time": 47.42853902280331, "GFLOP/s": 175.45290179526853, "strategy_time": 0.00919797457754612, "framework_time": 1.6759861027821898, "timestamp": "2025-04-08 05:24:03.700659+00:00", "gridpoints/s": 11696860119.684568}, "4096,4096,2,16,1,3,5,10,5,0,2": {"grid_width": 4096, "grid_height": 4096, "block_size_x": 2, "block_size_y": 16, "tile_size_x": 1, "tile_size_y": 3, "temporal_tiling_factor": 5, "max_tfactor": 10, "loop_unroll_factor_t": 5, "sh_power": 0, "blocks_per_sm": 2, "time": 27.60584408044815, "times": [27.106304168701172, 27.057151794433594, 27.614208221435547, 29.837312698364258, 29.836223602294922, 29.703264236450195, 29.57209587097168, 29.57414436340332, 29.57107162475586, 28.39244842529297, 27.049856185913086, 27.049983978271484, 27.048959732055664, 27.049983978271484, 27.049983978271484, 27.054975509643555, 27.05289649963379, 27.049983978271484, 27.051008224487305, 27.052032470703125, 27.05193519592285, 27.049983978271484, 27.048959732055664, 27.052032470703125, 27.051008224487305, 27.051008224487305, 27.053056716918945, 27.049983978271484, 27.053056716918945, 27.050079345703125, 27.051008224487305, 27.051008224487305], "compile_time": 984.3096559634432, "verification_time": 0, "benchmark_time": 885.3530850028619, "GFLOP/s": 45.58060953807912, "strategy_time": 0.008615897968411446, "framework_time": 1.5286600682884455, "timestamp": "2025-04-08 05:24:05.571890+00:00", "gridpoints/s": 3038707302.538608}, "4096,4096,16,4,3,10,10,10,1,0,2": {"grid_width": 4096, "grid_height": 4096, "block_size_x": 16, "block_size_y": 4, "tile_size_x": 3, "tile_size_y": 10, "temporal_tiling_factor": 10, "max_tfactor": 10, "loop_unroll_factor_t": 1, "sh_power": 0, "blocks_per_sm": 2, "time": 34.26768350601196, "times": [34.312191009521484, 34.270206451416016, 34.260990142822266, 34.26710510253906, 34.26406478881836, 34.25996780395508, 34.26406478881836, 34.263038635253906, 34.26406478881836, 34.263038635253906, 34.25484848022461, 34.25270462036133, 34.260990142822266, 34.262943267822266, 34.260990142822266, 34.260990142822266, 34.26387023925781, 34.26310348510742, 34.26598358154297, 34.26713562011719, 34.25894546508789, 34.260990142822266, 34.263038635253906, 34.25996780395508, 34.25881576538086, 34.268192291259766, 34.26406478881836, 34.26406478881836, 34.260990142822266, 34.26201629638672, 34.26393508911133, 34.37855911254883], "compile_time": 861.3376610446721, "verification_time": 0, "benchmark_time": 1097.9597650002688, "GFLOP/s": 73.43894137339304, "strategy_time": 0.009206938557326794, "framework_time": 1.606035977602005, "timestamp": "2025-04-08 05:24:07.532833+00:00", "gridpoints/s": 4895929424.892869}, "4096,4096,32,1,2,6,4,10,4,0,1": {"grid_width": 4096, "grid_height": 4096, "block_size_x": 32, "block_size_y": 1, "tile_size_x": 2, "tile_size_y": 6, "temporal_tiling_factor": 4, "max_tfactor": 10, "loop_unroll_factor_t": 4, "sh_power": 0, "blocks_per_sm": 1, "time": 11.694611936807632, "times": [11.74732780456543, 11.704319953918457, 11.691007614135742, 11.699199676513672, 11.700096130371094, 11.692031860351562, 11.687935829162598, 11.689984321594238, 11.691007614135742, 11.689984321594238, 11.691007614135742, 11.688960075378418, 11.699199676513672, 11.688960075378418, 11.699199676513672, 11.687935829162598, 11.695103645324707, 11.687935829162598, 11.688960075378418, 11.690848350524902, 11.695103645324707, 11.68892765045166, 11.698176383972168, 11.698176383972168, 11.688960075378418, 11.697152137756348, 11.691007614135742, 11.687935829162598, 11.692031860351562, 11.690176010131836, 11.699040412902832, 11.689888000488281], "compile_time": 946.5801470214501, "verification_time": 0, "benchmark_time": 375.4044569795951, "GFLOP/s": 86.0766449916754, "strategy_time": 0.008977018296718597, "framework_time": 1.5878709964454174, "timestamp": "2025-04-08 05:24:08.856444+00:00", "gridpoints/s": 5738442999.445026}, "4096,4096,32,8,1,4,8,10,2,0,1": {"grid_width": 4096, "grid_height": 4096, "block_size_x": 32, "block_size_y": 8, "tile_size_x": 1, "tile_size_y": 4, "temporal_tiling_factor": 8, "max_tfactor": 10, "loop_unroll_factor_t": 2, "sh_power": 0, "blocks_per_sm": 1, "time": 24.98677909374237, "times": [25.038848876953125, 24.993791580200195, 24.987648010253906, 24.986623764038086, 24.989696502685547, 24.984575271606445, 24.986591339111328, 24.982528686523438, 24.999935150146484, 24.98543930053711, 24.985599517822266, 24.978431701660156, 24.978431701660156, 24.984575271606445, 24.981504440307617, 24.982528686523438, 24.980480194091797, 24.981504440307617, 24.985599517822266, 24.980480194091797, 24.988704681396484, 24.981504440307617, 24.978431701660156, 24.987648010253906, 24.982528686523438, 24.989696502685547, 24.983552932739258, 24.989696502685547, 24.983552932739258, 24.986623764038086, 24.986623764038086, 24.983552932739258], "compile_time": 832.9282240010798, "verification_time": 0, "benchmark_time": 800.9230890311301, "GFLOP/s": 80.57324685374104, "strategy_time": 0.009016948752105236, "framework_time": 1.6085200477391481, "timestamp": "2025-04-08 05:24:10.491944+00:00", "gridpoints/s": 5371549790.249403}, "4096,4096,4,8,3,5,10,10,1,0,3": {"grid_width": 4096, "grid_height": 4096, "block_size_x": 4, "block_size_y": 8, "tile_size_x": 3, "tile_size_y": 5, "temporal_tiling_factor": 10, "max_tfactor": 10, "loop_unroll_factor_t": 1, "sh_power": 0, "blocks_per_sm": 3, "time": 37.836138010025024, "times": [37.87980651855469, 37.84908676147461, 37.82451248168945, 37.835777282714844, 37.8337287902832, 37.82451248168945, 37.827457427978516, 37.84703826904297, 37.82246398925781, 37.837825775146484, 37.83168029785156, 37.828609466552734, 37.8337287902832, 37.82553482055664, 37.83065414428711, 37.827423095703125, 37.82041549682617, 37.82451248168945, 37.83475112915039, 37.82451248168945, 37.83475112915039, 37.83987045288086, 37.821441650390625, 37.82236862182617, 37.871456146240234, 37.85113525390625, 37.84294509887695, 37.8337287902832, 37.841758728027344, 37.82758331298828, 37.86751937866211, 37.837825775146484], "compile_time": 824.0838020574301, "verification_time": 0, "benchmark_time": 1212.5415080226958, "GFLOP/s": 66.51266573066228, "strategy_time": 0.008606933988630772, "framework_time": 1.6109939897432923, "timestamp": "2025-04-08 05:24:12.530219+00:00", "gridpoints/s": 4434177715.377485}, "4096,4096,4,32,1,8,3,10,1,1,0": {"grid_width": 4096, "grid_height": 4096, "block_size_x": 4, "block_size_y": 32, "tile_size_x": 1, "tile_size_y": 8, "temporal_tiling_factor": 3, "max_tfactor": 10, "loop_unroll_factor_t": 1, "sh_power": 1, "blocks_per_sm": 0, "time": 7.089726954698563, "times": [7.140192031860352, 7.0952959060668945, 7.09116792678833, 7.089151859283447, 7.094207763671875, 7.085055828094482, 7.089216232299805, 7.078911781311035, 7.084896087646484, 7.090176105499268, 7.088128089904785, 7.089151859283447, 7.081984043121338, 7.084928035736084, 7.098368167877197, 7.090176105499268, 7.09119987487793, 7.087103843688965, 7.087103843688965, 7.08076810836792, 7.09116792678833, 7.088031768798828, 7.089151859283447, 7.094175815582275, 7.0839362144470215, 7.093247890472412, 7.0860161781311035, 7.086080074310303, 7.085055828094482, 7.089151859283447, 7.085055828094482, 7.0830078125], "compile_time": 766.4340040646493, "verification_time": 0, "benchmark_time": 227.88741800468415, "GFLOP/s": 106.48854671330564, "strategy_time": 0.00840495340526104, "framework_time": 1.5265779802575707, "timestamp": "2025-04-08 05:24:13.526106+00:00", "gridpoints/s": 7099236447.553709}, "4096,4096,32,1,7,3,10,10,10,0,2": {"grid_width": 4096, "grid_height": 4096, "block_size_x": 32, "block_size_y": 1, "tile_size_x": 7, "tile_size_y": 3, "temporal_tiling_factor": 10, "max_tfactor": 10, "loop_unroll_factor_t": 10, "sh_power": 0, "blocks_per_sm": 2, "time": 101.38971185684204, "times": [101.46902465820312, 101.31251525878906, 101.40057373046875, 101.38406372070312, 101.40160369873047, 101.4537582397461, 101.42310333251953, 101.32479858398438, 101.3934097290039, 101.4312973022461, 101.44153594970703, 101.47225952148438, 101.42822265625, 101.34425354003906, 101.3729248046875, 101.40160369873047, 101.41081237792969, 101.34732818603516, 101.35346984863281, 101.35040283203125, 101.29714965820312, 101.37702178955078, 101.39750671386719, 101.3749771118164, 101.4118423461914, 101.40364837646484, 101.33497619628906, 101.3779525756836, 101.3391342163086, 101.43846130371094, 101.4097900390625, 101.391357421875], "compile_time": 1323.4495850047097, "verification_time": 0, "benchmark_time": 3245.9258530288935, "GFLOP/s": 24.820885215191332, "strategy_time": 0.010980991646647453, "framework_time": 1.5319960657507181, "timestamp": "2025-04-08 05:24:18.097055+00:00", "gridpoints/s": 1654725681.0127556}, "4096,4096,2,16,2,7,6,10,3,0,0": {"grid_width": 4096, "grid_height": 4096, "block_size_x": 2, "block_size_y": 16, "tile_size_x": 2, "tile_size_y": 7, "temporal_tiling_factor": 6, "max_tfactor": 10, "loop_unroll_factor_t": 3, "sh_power": 0, "blocks_per_sm": 0, "time": 21.357099890708923, "times": [21.367807388305664, 21.31865692138672, 21.308319091796875, 21.311487197875977, 21.307392120361328, 21.311487197875977, 21.312511444091797, 21.30944061279297, 21.30944061279297, 21.319679260253906, 21.320703506469727, 21.31046485900879, 21.312511444091797, 21.311359405517578, 21.319679260253906, 21.30841636657715, 21.30841636657715, 21.31046485900879, 21.387327194213867, 21.50092887878418, 21.4783992767334, 21.45075225830078, 21.39740753173828, 21.396352767944336, 21.396448135375977, 21.391359329223633, 21.395519256591797, 21.396480560302734, 21.377920150756836, 21.387104034423828, 21.398527145385742, 21.394432067871094], "compile_time": 977.0755979698151, "verification_time": 0, "benchmark_time": 684.838543063961, "GFLOP/s": 70.70011601420097, "strategy_time": 0.009267940185964108, "framework_time": 1.5992519911378622, "timestamp": "2025-04-08 05:24:19.760609+00:00", "gridpoints/s": 4713341067.613399}, "4096,4096,8,4,5,7,10,10,10,0,2": {"grid_width": 4096, "grid_height": 4096, "block_size_x": 8, "block_size_y": 4, "tile_size_x": 5, "tile_size_y": 7, "temporal_tiling_factor": 10, "max_tfactor": 10, "loop_unroll_factor_t": 10, "sh_power": 0, "blocks_per_sm": 2, "time": 26.74084895849228, "times": [26.787839889526367, 26.74166488647461, 26.720256805419922, 26.70899200439453, 26.74278450012207, 26.7192325592041, 26.73664093017578, 26.73766326904297, 26.75814437866211, 26.744831085205078, 26.73766326904297, 26.73971176147461, 26.73766326904297, 26.73868751525879, 26.75814437866211, 26.75507164001465, 26.73664093017578, 26.73971176147461, 26.731327056884766, 26.76019287109375, 26.74790382385254, 26.738752365112305, 26.727359771728516, 26.734527587890625, 26.72742462158203, 26.74995231628418, 26.74367904663086, 26.73356819152832, 26.73049545288086, 26.753023147583008, 26.73766326904297, 26.74995231628418], "compile_time": 1350.6606789305806, "verification_time": 0, "benchmark_time": 857.0671390043572, "GFLOP/s": 94.1100413044587, "strategy_time": 0.009467941708862782, "framework_time": 1.396093051880598, "timestamp": "2025-04-08 05:24:21.969774+00:00", "gridpoints/s": 6274002753.630581}, "4096,4096,16,2,4,1,6,10,2,0,1": {"grid_width": 4096, "grid_height": 4096, "block_size_x": 16, "block_size_y": 2, "tile_size_x": 4, "tile_size_y": 1, "temporal_tiling_factor": 6, "max_tfactor": 10, "loop_unroll_factor_t": 2, "sh_power": 0, "blocks_per_sm": 1, "time": 35.71582913398743, "times": [35.764225006103516, 35.720191955566406, 35.71712112426758, 35.71712112426758, 35.716094970703125, 35.716094970703125, 35.718143463134766, 35.71507263183594, 35.7130241394043, 35.71913528442383, 35.714046478271484, 35.716094970703125, 35.71200180053711, 35.714046478271484, 35.716094970703125, 35.71200180053711, 35.70995330810547, 35.71507263183594, 35.711936950683594, 35.710975646972656, 35.710880279541016, 35.7130241394043, 35.70995330810547, 35.710975646972656, 35.710975646972656, 35.716094970703125, 35.714046478271484, 35.71596908569336, 35.710975646972656, 35.71507263183594, 35.71811294555664, 35.71200180053711], "compile_time": 840.1409930083901, "verification_time": 0, "benchmark_time": 1145.084897056222, "GFLOP/s": 42.27675729815612, "strategy_time": 0.00900693703442812, "framework_time": 1.5853459481149912, "timestamp": "2025-04-08 05:24:23.956626+00:00", "gridpoints/s": 2818450486.543741}, "4096,4096,2,16,8,1,8,10,8,1,3": {"grid_width": 4096, "grid_height": 4096, "block_size_x": 2, "block_size_y": 16, "tile_size_x": 8, "tile_size_y": 1, "temporal_tiling_factor": 8, "max_tfactor": 10, "loop_unroll_factor_t": 8, "sh_power": 1, "blocks_per_sm": 3, "time": 30.226348876953125, "times": [30.279680252075195, 30.230527877807617, 30.229503631591797, 30.227455139160156, 30.223360061645508, 30.223360061645508, 30.225311279296875, 30.22540855407715, 30.224384307861328, 30.222335815429688, 30.222335815429688, 30.223360061645508, 30.219263076782227, 30.223295211791992, 30.219263076782227, 30.223360061645508, 30.22540855407715, 30.223264694213867, 30.223360061645508, 30.219263076782227, 30.22540855407715, 30.227455139160156, 30.22540855407715, 30.222335815429688, 30.22332763671875, 30.22643280029297, 30.226303100585938, 30.229503631591797, 30.224384307861328, 30.226240158081055, 30.22540855407715, 30.227455139160156], "compile_time": 1043.4200270101428, "verification_time": 0, "benchmark_time": 969.0913759404793, "GFLOP/s": 66.60632179545401, "strategy_time": 0.009558047167956829, "framework_time": 1.539871096611023, "timestamp": "2025-04-08 05:24:25.970719+00:00", "gridpoints/s": 4440421453.030268}, "4096,4096,32,2,3,7,6,10,6,0,1": {"grid_width": 4096, "grid_height": 4096, "block_size_x": 32, "block_size_y": 2, "tile_size_x": 3, "tile_size_y": 7, "temporal_tiling_factor": 6, "max_tfactor": 10, "loop_unroll_factor_t": 6, "sh_power": 0, "blocks_per_sm": 1, "time": 24.457711040973663, "times": [24.51763153076172, 24.48076820373535, 24.474624633789062, 24.48067283630371, 24.454143524169922, 24.47667121887207, 24.457216262817383, 24.463327407836914, 24.449983596801758, 24.43564796447754, 24.455167770385742, 24.47667121887207, 24.449024200439453, 24.430591583251953, 24.464384078979492, 24.46028709411621, 24.452096939086914, 24.444927215576172, 24.434688568115234, 24.450048446655273, 24.44576072692871, 24.46950340270996, 24.456192016601562, 24.46441650390625, 24.441856384277344, 24.452096939086914, 24.458240509033203, 24.434560775756836, 24.456192016601562, 24.47667121887207, 24.442880630493164, 24.439807891845703], "compile_time": 1091.5164860198274, "verification_time": 0, "benchmark_time": 784.1693160589784, "GFLOP/s": 61.73715264974726, "strategy_time": 0.008817063644528389, "framework_time": 1.6619799425825477, "timestamp": "2025-04-08 05:24:27.848107+00:00", "gridpoints/s": 4115810176.6498175}, "4096,4096,32,2,1,10,10,10,2,1,0": {"grid_width": 4096, "grid_height": 4096, "block_size_x": 32, "block_size_y": 2, "tile_size_x": 1, "tile_size_y": 10, "temporal_tiling_factor": 10, "max_tfactor": 10, "loop_unroll_factor_t": 2, "sh_power": 1, "blocks_per_sm": 0, "time": 38.38494300842285, "times": [38.424415588378906, 38.41126251220703, 38.381568908691406, 38.366207122802734, 38.375423431396484, 38.3744010925293, 38.41331100463867, 38.39702224731445, 38.388736724853516, 38.39884948730469, 38.36617660522461, 38.36723327636719, 38.39487838745117, 38.3856315612793, 38.397953033447266, 38.37644958496094, 38.375423431396484, 38.37849426269531, 38.3713264465332, 38.379520416259766, 38.381568908691406, 38.403072357177734, 38.36928176879883, 38.388736724853516, 38.37628936767578, 38.388736724853516, 38.381568908691406, 38.37849426269531, 38.37644958496094, 38.37839889526367, 38.388702392578125, 38.382591247558594], "compile_time": 797.7821899112314, "verification_time": 0, "benchmark_time": 1229.989240062423, "GFLOP/s": 65.56170734571062, "strategy_time": 0.00981893390417099, "framework_time": 1.4663240872323513, "timestamp": "2025-04-08 05:24:29.877386+00:00", "gridpoints/s": 4370780489.714041}, "4096,4096,32,4,5,1,5,10,1,0,4": {"grid_width": 4096, "grid_height": 4096, "block_size_x": 32, "block_size_y": 4, "tile_size_x": 5, "tile_size_y": 1, "temporal_tiling_factor": 5, "max_tfactor": 10, "loop_unroll_factor_t": 1, "sh_power": 0, "blocks_per_sm": 4, "time": 16.45781898498535, "times": [16.505855560302734, 16.457727432250977, 16.457664489746094, 16.456703186035156, 16.45465660095215, 16.457727432250977, 16.45465660095215, 16.45465660095215, 16.456703186035156, 16.472063064575195, 16.456703186035156, 16.457727432250977, 16.453632354736328, 16.455615997314453, 16.45359992980957, 16.456703186035156, 16.456703186035156, 16.45465660095215, 16.45568084716797, 16.456703186035156, 16.453632354736328, 16.453632354736328, 16.454687118530273, 16.45465660095215, 16.45568084716797, 16.457727432250977, 16.45568084716797, 16.457727432250977, 16.45465660095215, 16.45568084716797, 16.45465660095215, 16.45564842224121], "compile_time": 814.0800109831616, "verification_time": 0, "benchmark_time": 528.1718720216304, "GFLOP/s": 76.45552555584386, "strategy_time": 0.009707990102469921, "framework_time": 1.4820430660620332, "timestamp": "2025-04-08 05:24:31.221164+00:00", "gridpoints/s": 5097035037.056257}, "4096,4096,4,8,8,1,2,10,1,0,3": {"grid_width": 4096, "grid_height": 4096, "block_size_x": 4, "block_size_y": 8, "tile_size_x": 8, "tile_size_y": 1, "temporal_tiling_factor": 2, "max_tfactor": 10, "loop_unroll_factor_t": 1, "sh_power": 0, "blocks_per_sm": 3, "time": 4.529078051447868, "times": [4.583424091339111, 4.533247947692871, 4.528128147125244, 4.529151916503906, 4.527103900909424, 4.527103900909424, 4.528128147125244, 4.5279998779296875, 4.5272321701049805, 4.527103900909424, 4.526080131530762, 4.527040004730225, 4.527103900909424, 4.528128147125244, 4.526080131530762, 4.528128147125244, 4.526080131530762, 4.527103900909424, 4.526080131530762, 4.526080131530762, 4.526080131530762, 4.528128147125244, 4.529151916503906, 4.526080131530762, 4.5280961990356445, 4.527103900909424, 4.526080131530762, 4.526944160461426, 4.526080131530762, 4.527040004730225, 4.527103900909424, 4.526080131530762], "compile_time": 823.3084320090711, "verification_time": 0, "benchmark_time": 146.00024092942476, "GFLOP/s": 111.13000798012266, "strategy_time": 0.009638024494051933, "framework_time": 1.5869390917941928, "timestamp": "2025-04-08 05:24:32.192100+00:00", "gridpoints/s": 7408667198.674844}, "4096,4096,8,8,8,3,7,10,1,0,1": {"grid_width": 4096, "grid_height": 4096, "block_size_x": 8, "block_size_y": 8, "tile_size_x": 8, "tile_size_y": 3, "temporal_tiling_factor": 7, "max_tfactor": 10, "loop_unroll_factor_t": 1, "sh_power": 0, "blocks_per_sm": 1, "time": 14.359477996826172, "times": [14.420991897583008, 14.366720199584961, 14.347264289855957, 14.364543914794922, 14.349311828613281, 14.354432106018066, 14.351360321044922, 14.348287582397461, 14.36569595336914, 14.354432106018066, 14.336000442504883, 14.360511779785156, 14.357503890991211, 14.36467170715332, 14.349311828613281, 14.360447883605957, 14.349344253540039, 14.367712020874023, 14.355487823486328, 14.367744445800781, 14.35647964477539, 14.360575675964355, 14.360575675964355, 14.357503890991211, 14.367744445800781, 14.366720199584961, 14.359552383422852, 14.349311828613281, 14.345184326171875, 14.35647964477539, 14.369791984558105, 14.361599922180176], "compile_time": 847.1217470942065, "verification_time": 0, "benchmark_time": 460.674243979156, "GFLOP/s": 122.67908905806759, "strategy_time": 0.009748968295753002, "framework_time": 1.609650906175375, "timestamp": "2025-04-08 05:24:33.501547+00:00", "gridpoints/s": 8178605937.204507}, "4096,4096,8,8,4,4,10,10,2,0,4": {"grid_width": 4096, "grid_height": 4096, "block_size_x": 8, "block_size_y": 8, "tile_size_x": 4, "tile_size_y": 4, "temporal_tiling_factor": 10, "max_tfactor": 10, "loop_unroll_factor_t": 2, "sh_power": 0, "blocks_per_sm": 4, "time": 25.283562123775482, "times": [25.33990478515625, 25.282560348510742, 25.276416778564453, 25.2805118560791, 25.28044891357422, 25.284608840942383, 25.28044891357422, 25.27743911743164, 25.2805118560791, 25.283584594726562, 25.291616439819336, 25.2805118560791, 25.281536102294922, 25.283584594726562, 25.284608840942383, 25.284608840942383, 25.27846336364746, 25.287647247314453, 25.282432556152344, 25.276416778564453, 25.281536102294922, 25.27948760986328, 25.27743911743164, 25.27948760986328, 25.297855377197266, 25.2805118560791, 25.281503677368164, 25.283424377441406, 25.275392532348633, 25.2805118560791, 25.27846336364746, 25.2805118560791], "compile_time": 849.0944289369509, "verification_time": 0, "benchmark_time": 810.8590529300272, "GFLOP/s": 99.53432936704449, "strategy_time": 0.008916016668081284, "framework_time": 1.5113590052351356, "timestamp": "2025-04-08 05:24:35.163053+00:00", "gridpoints/s": 6635621957.802966}, "4096,4096,2,16,8,1,10,10,5,1,1": {"grid_width": 4096, "grid_height": 4096, "block_size_x": 2, "block_size_y": 16, "tile_size_x": 8, "tile_size_y": 1, "temporal_tiling_factor": 10, "max_tfactor": 10, "loop_unroll_factor_t": 5, "sh_power": 1, "blocks_per_sm": 1, "time": 44.44215524196625, "times": [44.38528060913086, 44.33919906616211, 44.333984375, 44.335105895996094, 44.33612823486328, 44.33295822143555, 44.339168548583984, 44.325889587402344, 44.335105895996094, 44.33407974243164, 44.330047607421875, 44.34636688232422, 44.33305740356445, 44.3238410949707, 44.32777786254883, 44.33715057373047, 44.33100891113281, 44.33305740356445, 44.3238410949707, 44.33203125, 44.57062530517578, 44.6300163269043, 44.620704650878906, 44.62483215332031, 44.62489700317383, 44.614654541015625, 44.623870849609375, 44.62268829345703, 44.625919342041016, 44.62384033203125, 44.625919342041016, 44.625919342041016], "compile_time": 993.8170580426231, "verification_time": 0, "benchmark_time": 1423.9261610200629, "GFLOP/s": 56.626020639602515, "strategy_time": 0.00902591273188591, "framework_time": 1.6681430861353874, "timestamp": "2025-04-08 05:24:37.582504+00:00", "gridpoints/s": 3775068042.6401677}, "4096,4096,2,16,2,5,10,10,5,1,1": {"grid_width": 4096, "grid_height": 4096, "block_size_x": 2, "block_size_y": 16, "tile_size_x": 2, "tile_size_y": 5, "temporal_tiling_factor": 10, "max_tfactor": 10, "loop_unroll_factor_t": 5, "sh_power": 1, "blocks_per_sm": 1, "time": 59.72275388240814, "times": [59.77088165283203, 59.72787094116211, 59.72275161743164, 59.7022705078125, 59.72787094116211, 59.72275161743164, 59.72172927856445, 59.73503875732422, 59.71968078613281, 59.70943832397461, 59.71865463256836, 59.75251388549805, 59.718624114990234, 59.720703125, 59.72787094116211, 59.71865463256836, 59.72889709472656, 59.71459197998047, 59.70124816894531, 59.74732971191406, 59.72684860229492, 59.707393646240234, 59.73299026489258, 59.71558380126953, 59.70841598510742, 59.73401641845703, 59.705345153808594, 59.74220657348633, 59.71763229370117, 59.71148681640625, 59.69510269165039, 59.72172927856445], "compile_time": 999.6117820264772, "verification_time": 0, "benchmark_time": 1912.7920429455116, "GFLOP/s": 42.13774878759034, "strategy_time": 0.009448034688830376, "framework_time": 1.5563740162178874, "timestamp": "2025-04-08 05:24:40.496503+00:00", "gridpoints/s": 2809183252.5060225}, "4096,4096,16,2,2,1,10,10,5,0,4": {"grid_width": 4096, "grid_height": 4096, "block_size_x": 16, "block_size_y": 2, "tile_size_x": 2, "tile_size_y": 1, "temporal_tiling_factor": 10, "max_tfactor": 10, "loop_unroll_factor_t": 5, "sh_power": 0, "blocks_per_sm": 4, "time": 140.79498434066772, "times": [140.84915161132812, 140.7958984375, 140.7948760986328, 140.801025390625, 140.7906951904297, 140.79180908203125, 140.78976440429688, 140.79689025878906, 140.7958984375, 140.79898071289062, 140.79283142089844, 140.79171752929688, 140.79283142089844, 140.79283142089844, 140.7948760986328, 140.79180908203125, 140.79180908203125, 140.79469299316406, 140.791748046875, 140.79385375976562, 140.79180908203125, 140.78770446777344, 140.79180908203125, 140.7907257080078, 140.7969207763672, 140.79469299316406, 140.79180908203125, 140.79385375976562, 140.7928009033203, 140.79078674316406, 140.78976440429688, 140.79283142089844], "compile_time": 1120.10330602061, "verification_time": 0, "benchmark_time": 4506.854222971015, "GFLOP/s": 17.874091266709286, "strategy_time": 0.009386916644871235, "framework_time": 1.6062561189755797, "timestamp": "2025-04-08 05:24:46.125111+00:00", "gridpoints/s": 1191606084.4472857}, "4096,4096,64,2,2,9,5,10,5,0,2": {"grid_width": 4096, "grid_height": 4096, "block_size_x": 64, "block_size_y": 2, "tile_size_x": 2, "tile_size_y": 9, "temporal_tiling_factor": 5, "max_tfactor": 10, "loop_unroll_factor_t": 5, "sh_power": 0, "blocks_per_sm": 2, "time": 10.303284019231796, "times": [10.356736183166504, 10.307583808898926, 10.304512023925781, 10.30246353149414, 10.301440238952637, 10.301440238952637, 10.300415992736816, 10.30246353149414, 10.300415992736816, 10.303359985351562, 10.301440238952637, 10.30134391784668, 10.298368453979492, 10.3023681640625, 10.301440238952637, 10.299391746520996, 10.300415992736816, 10.300415992736816, 10.299391746520996, 10.301312446594238, 10.302399635314941, 10.301440238952637, 10.301440238952637, 10.300415992736816, 10.301440238952637, 10.300415992736816, 10.304512023925781, 10.300415992736816, 10.30246353149414, 10.29849624633789, 10.301440238952637, 10.303487777709961], "compile_time": 1023.9447699859738, "verification_time": 0, "benchmark_time": 330.8627689257264, "GFLOP/s": 122.12525614661422, "strategy_time": 0.008777016773819923, "framework_time": 1.7594931414350867, "timestamp": "2025-04-08 05:24:47.481718+00:00", "gridpoints/s": 8141683743.107615}, "4096,4096,4,32,3,4,4,10,4,0,1": {"grid_width": 4096, "grid_height": 4096, "block_size_x": 4, "block_size_y": 32, "tile_size_x": 3, "tile_size_y": 4, "temporal_tiling_factor": 4, "max_tfactor": 10, "loop_unroll_factor_t": 4, "sh_power": 0, "blocks_per_sm": 1, "time": 9.253196060657501, "times": [9.308159828186035, 9.258943557739258, 9.254912376403809, 9.251839637756348, 9.250816345214844, 9.251839637756348, 9.251999855041504, 9.25171184539795, 9.250816345214844, 9.250720024108887, 9.250687599182129, 9.251839637756348, 9.250816345214844, 9.250816345214844, 9.249695777893066, 9.250816345214844, 9.250816345214844, 9.250816345214844, 9.251775741577148, 9.252703666687012, 9.251839637756348, 9.250816345214844, 9.250816345214844, 9.250816345214844, 9.250816345214844, 9.250816345214844, 9.250752449035645, 9.250816345214844, 9.250816345214844, 9.249792098999023, 9.251839637756348, 9.249792098999023], "compile_time": 949.7527349740267, "verification_time": 0, "benchmark_time": 297.12766606826335, "GFLOP/s": 108.78759656676635, "strategy_time": 0.009047100320458412, "framework_time": 1.5775918727740645, "timestamp": "2025-04-08 05:24:48.730216+00:00", "gridpoints/s": 7252506437.784424}, "4096,4096,32,1,4,5,1,10,1,1,2": {"grid_width": 4096, "grid_height": 4096, "block_size_x": 32, "block_size_y": 1, "tile_size_x": 4, "tile_size_y": 5, "temporal_tiling_factor": 1, "max_tfactor": 10, "loop_unroll_factor_t": 1, "sh_power": 1, "blocks_per_sm": 2, "time": 1.4693029820919037, "times": [1.5247360467910767, 1.4755840301513672, 1.4663679599761963, 1.4704320430755615, 1.465343952178955, 1.4725120067596436, 1.4673919677734375, 1.4684159755706787, 1.4694080352783203, 1.465343952178955, 1.4673919677734375, 1.4684159755706787, 1.4673919677734375, 1.4684159755706787, 1.46943998336792, 1.4684159755706787, 1.4684159755706787, 1.465343952178955, 1.465216040611267, 1.4643199443817139, 1.4684159755706787, 1.4642879962921143, 1.465343952178955, 1.4654719829559326, 1.467360019683838, 1.465343952178955, 1.4643199443817139, 1.4663679599761963, 1.4672319889068604, 1.4673919677734375, 1.4673919677734375, 1.4704639911651611], "compile_time": 742.5072070909664, "verification_time": 0, "benchmark_time": 48.22769504971802, "GFLOP/s": 171.2772947902851, "strategy_time": 0.009116949513554573, "framework_time": 1.6119668725878, "timestamp": "2025-04-08 05:24:49.522603+00:00", "gridpoints/s": 11418486319.352343}, "4096,4096,4,8,9,8,4,10,4,0,2": {"grid_width": 4096, "grid_height": 4096, "block_size_x": 4, "block_size_y": 8, "tile_size_x": 9, "tile_size_y": 8, "temporal_tiling_factor": 4, "max_tfactor": 10, "loop_unroll_factor_t": 4, "sh_power": 0, "blocks_per_sm": 2, "time": 8.366937980055809, "times": [9.070591926574707, 9.007200241088867, 9.029631614685059, 9.03270435333252, 9.035807609558105, 9.00812816619873, 9.021439552307129, 9.024383544921875, 9.01529598236084, 9.004032135009766, 9.004032135009766, 9.040800094604492, 9.035776138305664, 9.01529598236084, 9.027584075927734, 8.99788761138916, 9.02451229095459, 8.972288131713867, 7.515232086181641, 7.527328014373779, 7.510015964508057, 7.528543949127197, 7.498623847961426, 7.5438079833984375, 7.520256042480469, 7.539711952209473, 7.540736198425293, 7.541759967803955, 7.528448104858398, 7.523263931274414, 7.533567905426025, 7.523327827453613], "compile_time": 1061.0309350304306, "verification_time": 0, "benchmark_time": 269.02286999393255, "GFLOP/s": 120.31079498850134, "strategy_time": 0.008876901119947433, "framework_time": 1.5787241281941533, "timestamp": "2025-04-08 05:24:50.854275+00:00", "gridpoints/s": 8020719665.900089}, "4096,4096,96,1,3,10,4,10,1,0,2": {"grid_width": 4096, "grid_height": 4096, "block_size_x": 96, "block_size_y": 1, "tile_size_x": 3, "tile_size_y": 10, "temporal_tiling_factor": 4, "max_tfactor": 10, "loop_unroll_factor_t": 1, "sh_power": 0, "blocks_per_sm": 2, "time": 11.67006003856659, "times": [11.721728324890137, 11.676671981811523, 11.668479919433594, 11.669407844543457, 11.6746244430542, 11.655167579650879, 11.668479919433594, 11.667455673217773, 11.676671981811523, 11.664383888244629, 11.661312103271484, 11.664383888244629, 11.661312103271484, 11.67033576965332, 11.6746244430542, 11.677696228027344, 11.663200378417969, 11.669407844543457, 11.675647735595703, 11.665504455566406, 11.662336349487305, 11.667424201965332, 11.668479919433594, 11.668319702148438, 11.670528411865234, 11.668479919433594, 11.670528411865234, 11.663359642028809, 11.675647735595703, 11.662336349487305, 11.671551704406738, 11.66643238067627], "compile_time": 750.0405251048505, "verification_time": 0, "benchmark_time": 375.2670190297067, "GFLOP/s": 86.25773617901993, "strategy_time": 0.01076993066817522, "framework_time": 1.6487159300595522, "timestamp": "2025-04-08 05:24:51.981273+00:00", "gridpoints/s": 5750515745.267995}, "4096,4096,16,8,7,1,3,10,3,1,4": {"grid_width": 4096, "grid_height": 4096, "block_size_x": 16, "block_size_y": 8, "tile_size_x": 7, "tile_size_y": 1, "temporal_tiling_factor": 3, "max_tfactor": 10, "loop_unroll_factor_t": 3, "sh_power": 1, "blocks_per_sm": 4, "time": 7.509393021464348, "times": [7.562240123748779, 7.510015964508057, 7.517183780670166, 7.509823799133301, 7.507967948913574, 7.505919933319092, 7.505919933319092, 7.505919933319092, 7.505919933319092, 7.505919933319092, 7.506944179534912, 7.505919933319092, 7.505824089050293, 7.506944179534912, 7.5141119956970215, 7.506944179534912, 7.5070719718933105, 7.507967948913574, 7.505919933319092, 7.505919933319092, 7.505887985229492, 7.506944179534912, 7.506783962249756, 7.506944179534912, 7.511040210723877, 7.505919933319092, 7.507967948913574, 7.505919933319092, 7.513984203338623, 7.506944179534912, 7.50489616394043, 7.506944179534912], "compile_time": 823.0824089841917, "verification_time": 0, "benchmark_time": 241.9875250197947, "GFLOP/s": 100.53738269418454, "strategy_time": 0.008946983143687248, "framework_time": 1.6107640694826841, "timestamp": "2025-04-08 05:24:53.047995+00:00", "gridpoints/s": 6702492179.612303}, "4096,4096,16,4,4,10,6,10,3,1,1": {"grid_width": 4096, "grid_height": 4096, "block_size_x": 16, "block_size_y": 4, "tile_size_x": 4, "tile_size_y": 10, "temporal_tiling_factor": 6, "max_tfactor": 10, "loop_unroll_factor_t": 3, "sh_power": 1, "blocks_per_sm": 1, "time": 12.096303939819336, "times": [12.14361572265625, 12.092415809631348, 12.107744216918945, 12.089344024658203, 12.109824180603027, 12.096511840820312, 12.084223747253418, 12.086272239685059, 12.106623649597168, 12.09552001953125, 12.097472190856934, 12.106752395629883, 12.087295532226562, 12.075008392333984, 12.095487594604492, 12.095487594604492, 12.087295532226562, 12.076031684875488, 12.096511840820312, 12.091391563415527, 12.095487594604492, 12.099583625793457, 12.100607872009277, 12.082048416137695, 12.096320152282715, 12.094464302062988, 12.110848426818848, 12.096511840820312, 12.093440055847168, 12.103679656982422, 12.102656364440918, 12.085247993469238], "compile_time": 948.1343650259078, "verification_time": 0, "benchmark_time": 388.37359694298357, "GFLOP/s": 124.82733961648054, "strategy_time": 0.009127077646553516, "framework_time": 1.5610120026394725, "timestamp": "2025-04-08 05:24:54.386104+00:00", "gridpoints/s": 8321822641.098703}, "4096,4096,8,16,6,1,2,10,1,1,4": {"grid_width": 4096, "grid_height": 4096, "block_size_x": 8, "block_size_y": 16, "tile_size_x": 6, "tile_size_y": 1, "temporal_tiling_factor": 2, "max_tfactor": 10, "loop_unroll_factor_t": 1, "sh_power": 1, "blocks_per_sm": 4, "time": 3.492114059627056, "times": [3.5449280738830566, 3.496959924697876, 3.492863893508911, 3.490816116333008, 3.492863893508911, 3.49183988571167, 3.490783929824829, 3.490816116333008, 3.4897921085357666, 3.4897921085357666, 3.4897921085357666, 3.4887681007385254, 3.4899520874023438, 3.4887681007385254, 3.4897921085357666, 3.491647958755493, 3.4887681007385254, 3.4897921085357666, 3.4887681007385254, 3.4897921085357666, 3.490816116333008, 3.4897921085357666, 3.4887681007385254, 3.490816116333008, 3.4897921085357666, 3.490816116333008, 3.4897921085357666, 3.4907519817352295, 3.4887681007385254, 3.4897921085357666, 3.4897921085357666, 3.4906558990478516], "compile_time": 764.081662055105, "verification_time": 0, "benchmark_time": 113.92769799567759, "GFLOP/s": 144.12945035757284, "strategy_time": 0.009548035450279713, "framework_time": 1.6690839547663927, "timestamp": "2025-04-08 05:24:55.265823+00:00", "gridpoints/s": 9608630023.83819}, "4096,4096,32,4,3,3,7,10,1,1,2": {"grid_width": 4096, "grid_height": 4096, "block_size_x": 32, "block_size_y": 4, "tile_size_x": 3, "tile_size_y": 3, "temporal_tiling_factor": 7, "max_tfactor": 10, "loop_unroll_factor_t": 1, "sh_power": 1, "blocks_per_sm": 2, "time": 32.921213150024414, "times": [32.97177505493164, 32.92252731323242, 32.9194221496582, 32.92652893066406, 32.912384033203125, 32.90419387817383, 32.90825653076172, 32.923648834228516, 32.916481018066406, 32.9277458190918, 32.90003204345703, 32.925697326660156, 32.9246711730957, 32.90214538574219, 32.92979049682617, 32.908287048339844, 32.932865142822266, 32.92156982421875, 32.923648834228516, 32.917503356933594, 32.91340637207031, 32.93695831298828, 32.923648834228516, 32.911231994628906, 32.917503356933594, 32.91545486450195, 32.92041778564453, 32.91340637207031, 32.916481018066406, 32.921409606933594, 32.92979049682617, 32.939937591552734], "compile_time": 770.4309750115499, "verification_time": 0, "benchmark_time": 1054.615679080598, "GFLOP/s": 53.509804513345934, "strategy_time": 0.01172209158539772, "framework_time": 1.5313548501580954, "timestamp": "2025-04-08 05:24:57.092444+00:00", "gridpoints/s": 3567320300.889729}, "4096,4096,16,4,2,4,9,10,9,0,1": {"grid_width": 4096, "grid_height": 4096, "block_size_x": 16, "block_size_y": 4, "tile_size_x": 2, "tile_size_y": 4, "temporal_tiling_factor": 9, "max_tfactor": 10, "loop_unroll_factor_t": 9, "sh_power": 0, "blocks_per_sm": 1, "time": 27.20053595304489, "times": [27.396095275878906, 27.34079933166504, 27.33782386779785, 27.33772850036621, 27.33875274658203, 27.33363151550293, 27.330400466918945, 27.33363151550293, 27.331584930419922, 27.3305606842041, 27.334495544433594, 27.331584930419922, 27.34899139404297, 27.333599090576172, 27.210752487182617, 27.083776473999023, 27.084640502929688, 27.078655242919922, 27.088895797729492, 27.084800720214844, 27.08582305908203, 27.089920043945312, 27.08684730529785, 27.090944290161133, 27.08393669128418, 27.071487426757812, 27.088895797729492, 27.080703735351562, 27.091968536376953, 27.078655242919922, 27.089920043945312, 27.08684730529785], "compile_time": 1260.1999569451436, "verification_time": 0, "benchmark_time": 871.7911640414968, "GFLOP/s": 83.26762986986141, "strategy_time": 0.01014897134155035, "framework_time": 1.5260559739544988, "timestamp": "2025-04-08 05:24:59.226002+00:00", "gridpoints/s": 5551175324.657427}, "4096,4096,8,8,4,1,9,10,3,1,2": {"grid_width": 4096, "grid_height": 4096, "block_size_x": 8, "block_size_y": 8, "tile_size_x": 4, "tile_size_y": 1, "temporal_tiling_factor": 9, "max_tfactor": 10, "loop_unroll_factor_t": 3, "sh_power": 1, "blocks_per_sm": 2, "time": 35.91367948055267, "times": [35.96799850463867, 35.920894622802734, 35.913726806640625, 35.908607482910156, 35.90963363647461, 35.911678314208984, 35.91475296020508, 35.9106559753418, 35.911678314208984, 35.908607482910156, 35.911678314208984, 35.9106559753418, 35.908447265625, 35.90848159790039, 35.9106559753418, 35.908607482910156, 35.9095344543457, 35.911678314208984, 35.9106559753418, 35.915775299072266, 35.915775299072266, 35.913726806640625, 35.911678314208984, 35.91270446777344, 35.913726806640625, 35.91263961791992, 35.908607482910156, 35.9106559753418, 35.915775299072266, 35.91468811035156, 35.9106559753418, 35.91270446777344], "compile_time": 896.2137500056997, "verification_time": 0, "benchmark_time": 1150.4221650538966, "GFLOP/s": 63.06577863252527, "strategy_time": 0.009217998012900352, "framework_time": 1.6589539591223001, "timestamp": "2025-04-08 05:25:01.274338+00:00", "gridpoints/s": 4204385242.1683517}, "4096,4096,8,16,2,1,10,10,2,0,3": {"grid_width": 4096, "grid_height": 4096, "block_size_x": 8, "block_size_y": 16, "tile_size_x": 2, "tile_size_y": 1, "temporal_tiling_factor": 10, "max_tfactor": 10, "loop_unroll_factor_t": 2, "sh_power": 0, "blocks_per_sm": 3, "time": 51.643497943878174, "times": [51.690494537353516, 51.64944076538086, 51.63827133178711, 51.640289306640625, 51.63827133178711, 51.64134216308594, 51.64851379394531, 51.644256591796875, 51.64339065551758, 51.63929748535156, 51.64236831665039, 51.63724899291992, 51.63929748535156, 51.64543914794922, 51.63929748535156, 51.63417434692383, 51.64118576049805, 51.64022445678711, 51.64031982421875, 51.64031982421875, 51.64441680908203, 51.64339065551758, 51.64339065551758, 51.64236831665039, 51.64236831665039, 51.64134216308594, 51.64543914794922, 51.64339065551758, 51.64019012451172, 51.645408630371094, 51.64441680908203, 51.64236831665039], "compile_time": 825.7995940512046, "verification_time": 0, "benchmark_time": 1653.5941109759733, "GFLOP/s": 48.7298982484651, "strategy_time": 0.0101790064945817, "framework_time": 1.8894559470936656, "timestamp": "2025-04-08 05:25:03.755665+00:00", "gridpoints/s": 3248659883.231006}, "4096,4096,32,2,6,1,6,10,3,0,3": {"grid_width": 4096, "grid_height": 4096, "block_size_x": 32, "block_size_y": 2, "tile_size_x": 6, "tile_size_y": 1, "temporal_tiling_factor": 6, "max_tfactor": 10, "loop_unroll_factor_t": 3, "sh_power": 0, "blocks_per_sm": 3, "time": 33.974280834198, "times": [34.01932907104492, 33.9865608215332, 33.97836685180664, 33.95993423461914, 33.96198272705078, 33.980384826660156, 33.97919845581055, 33.978431701660156, 33.97836685180664, 33.96403121948242, 33.96915054321289, 33.97321701049805, 33.9681282043457, 33.96588897705078, 33.97324752807617, 33.974143981933594, 33.979393005371094, 33.963008880615234, 33.976318359375, 33.97417449951172, 33.969024658203125, 33.972225189208984, 33.967105865478516, 33.974273681640625, 33.976318359375, 33.96403121948242, 33.97324752807617, 33.98348617553711, 33.97836685180664, 33.965057373046875, 33.974273681640625, 33.976318359375], "compile_time": 977.771861013025, "verification_time": 0, "benchmark_time": 1088.2781259715557, "GFLOP/s": 44.44389705756796, "strategy_time": 0.009397976100444794, "framework_time": 1.5760591486468911, "timestamp": "2025-04-08 05:25:05.823332+00:00", "gridpoints/s": 2962926470.504531}, "4096,4096,4,16,2,2,2,10,2,0,3": {"grid_width": 4096, "grid_height": 4096, "block_size_x": 4, "block_size_y": 16, "tile_size_x": 2, "tile_size_y": 2, "temporal_tiling_factor": 2, "max_tfactor": 10, "loop_unroll_factor_t": 2, "sh_power": 0, "blocks_per_sm": 3, "time": 4.0428739339113235, "times": [4.093952178955078, 4.0447998046875, 4.0438079833984375, 4.042751789093018, 4.0417280197143555, 4.0417280197143555, 4.040703773498535, 4.0417280197143555, 4.039680004119873, 4.0405120849609375, 4.040703773498535, 4.040703773498535, 4.0406718254089355, 4.056064128875732, 4.039680004119873, 4.040703773498535, 4.039680004119873, 4.039680004119873, 4.040703773498535, 4.039680004119873, 4.039680004119873, 4.040703773498535, 4.039680004119873, 4.0406718254089355, 4.040703773498535, 4.040703773498535, 4.039680004119873, 4.040703773498535, 4.040544033050537, 4.039872169494629, 4.039680004119873, 4.039680004119873], "compile_time": 805.2380139706656, "verification_time": 0, "benchmark_time": 130.29590097721666, "GFLOP/s": 124.4947253433304, "strategy_time": 0.009097042493522167, "framework_time": 1.641681999899447, "timestamp": "2025-04-08 05:25:06.760550+00:00", "gridpoints/s": 8299648356.222027}, "4096,4096,16,2,1,4,10,10,1,1,4": {"grid_width": 4096, "grid_height": 4096, "block_size_x": 16, "block_size_y": 2, "tile_size_x": 1, "tile_size_y": 4, "temporal_tiling_factor": 10, "max_tfactor": 10, "loop_unroll_factor_t": 1, "sh_power": 1, "blocks_per_sm": 4, "time": 61.22117507457733, "times": [61.267967224121094, 61.22188949584961, 61.218753814697266, 61.216766357421875, 61.216766357421875, 61.21868896484375, 61.220863342285156, 61.21574401855469, 61.218814849853516, 61.220863342285156, 61.21984100341797, 61.218814849853516, 61.22188949584961, 61.22380828857422, 61.22188949584961, 61.21574401855469, 61.216766357421875, 61.21779251098633, 61.22496032714844, 61.21574401855469, 61.21984100341797, 61.218814849853516, 61.216766357421875, 61.2229118347168, 61.22089767456055, 61.22188949584961, 61.21779251098633, 61.223934173583984, 61.2229118347168, 61.21779251098633, 61.22188949584961, 61.21779251098633], "compile_time": 757.9247900284827, "verification_time": 0, "benchmark_time": 1961.0718769254163, "GFLOP/s": 41.10640471919061, "strategy_time": 0.00900693703442812, "framework_time": 1.632876112125814, "timestamp": "2025-04-08 05:25:09.481219+00:00", "gridpoints/s": 2740426981.2793736}, "4096,4096,8,4,3,5,4,10,1,1,0": {"grid_width": 4096, "grid_height": 4096, "block_size_x": 8, "block_size_y": 4, "tile_size_x": 3, "tile_size_y": 5, "temporal_tiling_factor": 4, "max_tfactor": 10, "loop_unroll_factor_t": 1, "sh_power": 1, "blocks_per_sm": 0, "time": 13.601931005716324, "times": [13.645824432373047, 13.624320030212402, 13.595647811889648, 13.589695930480957, 13.618176460266113, 13.593600273132324, 13.593600273132324, 13.607935905456543, 13.607935905456543, 13.586560249328613, 13.593600273132324, 13.597599983215332, 13.590496063232422, 13.593600273132324, 13.595647811889648, 13.591551780700684, 13.588479995727539, 13.594623565673828, 13.596672058105469, 13.624383926391602, 13.588479995727539, 13.621248245239258, 13.594623565673828, 13.622271537780762, 13.619199752807617, 13.593600273132324, 13.591551780700684, 13.596672058105469, 13.600895881652832, 13.61404800415039, 13.594688415527344, 13.594559669494629], "compile_time": 777.6478410232812, "verification_time": 0, "benchmark_time": 436.4666809560731, "GFLOP/s": 74.00662152873397, "strategy_time": 0.00880600418895483, "framework_time": 1.6189799644052982, "timestamp": "2025-04-08 05:25:10.696992+00:00", "gridpoints/s": 4933774768.582265}, "4096,4096,192,2,1,3,4,10,1,0,3": {"grid_width": 4096, "grid_height": 4096, "block_size_x": 192, "block_size_y": 2, "tile_size_x": 1, "tile_size_y": 3, "temporal_tiling_factor": 4, "max_tfactor": 10, "loop_unroll_factor_t": 1, "sh_power": 0, "blocks_per_sm": 3, "time": 9.72676706314087, "times": [9.778176307678223, 9.732095718383789, 9.730048179626465, 9.72697639465332, 9.72390365600586, 9.721983909606934, 9.722880363464355, 9.72492790222168, 9.722880363464355, 9.724032402038574, 9.7259521484375, 9.722880363464355, 9.722880363464355, 9.72374439239502, 9.724800109863281, 9.722880363464355, 9.72275161743164, 9.721856117248535, 9.721823692321777, 9.72390365600586, 9.72390365600586, 9.725760459899902, 9.72492790222168, 9.722944259643555, 9.72492790222168, 9.72492790222168, 9.726943969726562, 9.740287780761719, 9.722880363464355, 9.726783752441406, 9.7259521484375, 9.72492790222168], "compile_time": 692.4489761004224, "verification_time": 0, "benchmark_time": 313.083887915127, "GFLOP/s": 103.4910112954785, "strategy_time": 0.011982046999037266, "framework_time": 1.5330089954659343, "timestamp": "2025-04-08 05:25:11.704100+00:00", "gridpoints/s": 6899400753.0319}, "4096,4096,16,2,6,2,6,10,1,0,4": {"grid_width": 4096, "grid_height": 4096, "block_size_x": 16, "block_size_y": 2, "tile_size_x": 6, "tile_size_y": 2, "temporal_tiling_factor": 6, "max_tfactor": 10, "loop_unroll_factor_t": 1, "sh_power": 0, "blocks_per_sm": 4, "time": 21.539065957069397, "times": [21.590015411376953, 21.540864944458008, 21.535743713378906, 21.536767959594727, 21.540735244750977, 21.534719467163086, 21.534719467163086, 21.539840698242188, 21.533695220947266, 21.534719467163086, 21.539840698242188, 21.537792205810547, 21.543935775756836, 21.545984268188477, 21.535743713378906, 21.531648635864258, 21.537792205810547, 21.538816452026367, 21.534719467163086, 21.539840698242188, 21.536767959594727, 21.538816452026367, 21.542911529541016, 21.533632278442383, 21.534719467163086, 21.532672882080078, 21.541887283325195, 21.533695220947266, 21.531648635864258, 21.533695220947266, 21.537792205810547, 21.543935775756836], "compile_time": 829.4881460024044, "verification_time": 0, "benchmark_time": 690.2918589767069, "GFLOP/s": 70.10282818250136, "strategy_time": 0.009477953426539898, "framework_time": 1.5785441501066089, "timestamp": "2025-04-08 05:25:13.225500+00:00", "gridpoints/s": 4673521878.833424}, "4096,4096,8,4,1,9,2,10,1,1,4": {"grid_width": 4096, "grid_height": 4096, "block_size_x": 8, "block_size_y": 4, "tile_size_x": 1, "tile_size_y": 9, "temporal_tiling_factor": 2, "max_tfactor": 10, "loop_unroll_factor_t": 1, "sh_power": 1, "blocks_per_sm": 4, "time": 4.484560936689377, "times": [4.5352959632873535, 4.487167835235596, 4.484096050262451, 4.484127998352051, 4.483071804046631, 4.483071804046631, 4.482048034667969, 4.482048034667969, 4.482048034667969, 4.483071804046631, 4.485119819641113, 4.483071804046631, 4.483071804046631, 4.4819841384887695, 4.482048034667969, 4.482048034667969, 4.482048034667969, 4.482048034667969, 4.483071804046631, 4.483071804046631, 4.482975959777832, 4.483071804046631, 4.482975959777832, 4.482048034667969, 4.48195219039917, 4.482048034667969, 4.483071804046631, 4.483071804046631, 4.482912063598633, 4.483071804046631, 4.483071804046631, 4.482048034667969], "compile_time": 768.4745739679784, "verification_time": 0, "benchmark_time": 144.32130893692374, "GFLOP/s": 112.23316777395866, "strategy_time": 0.00893592368811369, "framework_time": 1.5990821411833167, "timestamp": "2025-04-08 05:25:14.139935+00:00", "gridpoints/s": 7482211184.930576}, "4096,4096,224,1,1,2,3,10,3,0,2": {"grid_width": 4096, "grid_height": 4096, "block_size_x": 224, "block_size_y": 1, "tile_size_x": 1, "tile_size_y": 2, "temporal_tiling_factor": 3, "max_tfactor": 10, "loop_unroll_factor_t": 3, "sh_power": 0, "blocks_per_sm": 2, "time": 9.699762046337128, "times": [9.751551628112793, 9.703424453735352, 9.699295997619629, 9.70019245147705, 9.696255683898926, 9.701375961303711, 9.699263572692871, 9.697279930114746, 9.697152137756348, 9.699328422546387, 9.694208145141602, 9.698464393615723, 9.696255683898926, 9.696255683898926, 9.70025634765625, 9.699328422546387, 9.697279930114746, 9.695232391357422, 9.697279930114746, 9.697279930114746, 9.698271751403809, 9.697279930114746, 9.699328422546387, 9.69820785522461, 9.698304176330566, 9.697279930114746, 9.698304176330566, 9.697279930114746, 9.696255683898926, 9.698304176330566, 9.698304176330566, 9.698304176330566], "compile_time": 696.9349510036409, "verification_time": 0, "benchmark_time": 311.32894300390035, "GFLOP/s": 77.83435473915542, "strategy_time": 0.00984896905720234, "framework_time": 1.6389370430260897, "timestamp": "2025-04-08 05:25:15.149878+00:00", "gridpoints/s": 5188956982.610361}, "4096,4096,16,4,3,7,6,10,2,0,1": {"grid_width": 4096, "grid_height": 4096, "block_size_x": 16, "block_size_y": 4, "tile_size_x": 3, "tile_size_y": 7, "temporal_tiling_factor": 6, "max_tfactor": 10, "loop_unroll_factor_t": 2, "sh_power": 0, "blocks_per_sm": 1, "time": 21.06699925661087, "times": [21.118976593017578, 21.07391929626465, 21.06879997253418, 21.06675148010254, 21.06368064880371, 21.06470489501953, 21.06572723388672, 21.06153678894043, 21.06675148010254, 21.06265640258789, 21.065824508666992, 21.06470489501953, 21.06265640258789, 21.06368064880371, 21.06675148010254, 21.06470489501953, 21.06368064880371, 21.06470489501953, 21.06870460510254, 21.06470489501953, 21.06572723388672, 21.06470489501953, 21.06572723388672, 21.06572723388672, 21.06470489501953, 21.065696716308594, 21.06265640258789, 21.06265640258789, 21.06368064880371, 21.06470489501953, 21.06572723388672, 21.068639755249023], "compile_time": 866.3308360846713, "verification_time": 0, "benchmark_time": 675.757980090566, "GFLOP/s": 71.67368364178276, "strategy_time": 0.008926959708333015, "framework_time": 1.4367979019880295, "timestamp": "2025-04-08 05:25:16.693444+00:00", "gridpoints/s": 4778245576.118851}, "4096,4096,8,8,5,1,2,10,1,0,4": {"grid_width": 4096, "grid_height": 4096, "block_size_x": 8, "block_size_y": 8, "tile_size_x": 5, "tile_size_y": 1, "temporal_tiling_factor": 2, "max_tfactor": 10, "loop_unroll_factor_t": 1, "sh_power": 0, "blocks_per_sm": 4, "time": 3.9445229917764664, "times": [3.99564790725708, 3.948415994644165, 3.9443840980529785, 3.9434239864349365, 3.9454081058502197, 3.9444479942321777, 3.9433279037475586, 3.9434239864349365, 3.9423999786376953, 3.9434239864349365, 3.9423999786376953, 3.9434239864349365, 3.941472053527832, 3.943392038345337, 3.9423999786376953, 3.941375970840454, 3.941375970840454, 3.9423999786376953, 3.941375970840454, 3.9423999786376953, 3.9423999786376953, 3.9422719478607178, 3.9422719478607178, 3.9423999786376953, 3.9423999786376953, 3.9423999786376953, 3.943392038345337, 3.9434239864349365, 3.942336082458496, 3.9422719478607178, 3.941375970840454, 3.941472053527832], "compile_time": 814.8326489608735, "verification_time": 0, "benchmark_time": 128.19706299342215, "GFLOP/s": 127.59882019937852, "strategy_time": 0.009076902642846107, "framework_time": 1.6432361444458365, "timestamp": "2025-04-08 05:25:17.638160+00:00", "gridpoints/s": 8506588013.291902}, "4096,4096,288,1,1,7,3,10,3,0,3": {"grid_width": 4096, "grid_height": 4096, "block_size_x": 288, "block_size_y": 1, "tile_size_x": 1, "tile_size_y": 7, "temporal_tiling_factor": 3, "max_tfactor": 10, "loop_unroll_factor_t": 3, "sh_power": 0, "blocks_per_sm": 3, "time": 6.188124015927315, "times": [6.239232063293457, 6.191103935241699, 6.19001579284668, 6.189184188842773, 6.189055919647217, 6.185984134674072, 6.18393611907959, 6.184959888458252, 6.184959888458252, 6.184959888458252, 6.1848320960998535, 6.18393611907959, 6.184959888458252, 6.184959888458252, 6.187007904052734, 6.184959888458252, 6.185984134674072, 6.188032150268555, 6.185984134674072, 6.187007904052734, 6.18393611907959, 6.184959888458252, 6.185952186584473, 6.186975955963135, 6.188032150268555, 6.185984134674072, 6.188032150268555, 6.185984134674072, 6.187007904052734, 6.188032150268555, 6.187007904052734, 6.187007904052734], "compile_time": 707.4939520098269, "verification_time": 0, "benchmark_time": 199.33937198948115, "GFLOP/s": 122.00381214998389, "strategy_time": 0.009127077646553516, "framework_time": 1.5719019575044513, "timestamp": "2025-04-08 05:25:18.546605+00:00", "gridpoints/s": 8133587476.665592}, "4096,4096,32,1,1,1,6,10,1,0,1": {"grid_width": 4096, "grid_height": 4096, "block_size_x": 32, "block_size_y": 1, "tile_size_x": 1, "tile_size_y": 1, "temporal_tiling_factor": 6, "max_tfactor": 10, "loop_unroll_factor_t": 1, "sh_power": 0, "blocks_per_sm": 1, "time": 97.32923722267151, "times": [97.38240051269531, 97.3301773071289, 97.32195281982422, 97.32403564453125, 97.328125, 97.32403564453125, 97.32505798339844, 97.32710266113281, 97.32096099853516, 97.31993865966797, 97.32096099853516, 97.31993865966797, 97.31993865966797, 97.32198333740234, 97.32803344726562, 97.33010864257812, 97.33734130859375, 97.34553527832031, 97.3371810913086, 97.33734130859375, 97.3301773071289, 97.32505798339844, 97.32096099853516, 97.33324432373047, 97.33324432373047, 97.33222198486328, 97.32505798339844, 97.32403564453125, 97.32915496826172, 97.31890869140625, 97.32198333740234, 97.33939361572266], "compile_time": 804.2333730263636, "verification_time": 0, "benchmark_time": 3116.6105769807473, "GFLOP/s": 15.513832051776093, "strategy_time": 0.009807990863919258, "framework_time": 1.454784069210291, "timestamp": "2025-04-08 05:25:22.468943+00:00", "gridpoints/s": 1034255470.1184062}, "4096,4096,32,1,10,2,5,10,1,1,2": {"grid_width": 4096, "grid_height": 4096, "block_size_x": 32, "block_size_y": 1, "tile_size_x": 10, "tile_size_y": 2, "temporal_tiling_factor": 5, "max_tfactor": 10, "loop_unroll_factor_t": 1, "sh_power": 1, "blocks_per_sm": 2, "time": 30.388174057006836, "times": [30.41587257385254, 30.38924789428711, 30.382080078125, 30.394367218017578, 30.38719940185547, 30.3687686920166, 30.411775588989258, 30.38310432434082, 30.38719940185547, 30.384000778198242, 30.40768051147461, 30.396352767944336, 30.39014434814453, 30.395263671875, 30.382080078125, 30.40153694152832, 30.36262321472168, 30.38515281677246, 30.383007049560547, 30.382080078125, 30.37286376953125, 30.39641571044922, 30.370784759521484, 30.37593650817871, 30.40153694152832, 30.37798309326172, 30.412799835205078, 30.382080078125, 30.39743995666504, 30.37183952331543, 30.37593650817871, 30.39641571044922], "compile_time": 786.3520099781454, "verification_time": 0, "benchmark_time": 974.1252859821543, "GFLOP/s": 41.407265788313005, "strategy_time": 0.009798095561563969, "framework_time": 1.5921499580144882, "timestamp": "2025-04-08 05:25:24.231055+00:00", "gridpoints/s": 2760484385.8875337}, "4096,4096,32,8,1,3,2,10,1,0,4": {"grid_width": 4096, "grid_height": 4096, "block_size_x": 32, "block_size_y": 8, "tile_size_x": 1, "tile_size_y": 3, "temporal_tiling_factor": 2, "max_tfactor": 10, "loop_unroll_factor_t": 1, "sh_power": 0, "blocks_per_sm": 4, "time": 4.457128942012787, "times": [4.510591983795166, 4.4615678787231445, 4.456448078155518, 4.456448078155518, 4.45747184753418, 4.45747184753418, 4.456319808959961, 4.455359935760498, 4.455423831939697, 4.454400062561035, 4.455423831939697, 4.455423831939697, 4.455423831939697, 4.454400062561035, 4.454239845275879, 4.455423831939697, 4.454400062561035, 4.455423831939697, 4.454400062561035, 4.455423831939697, 4.454400062561035, 4.454400062561035, 4.455423831939697, 4.454400062561035, 4.455327987670898, 4.455296039581299, 4.454400062561035, 4.455423831939697, 4.453375816345215, 4.454400062561035, 4.454400062561035, 4.455391883850098], "compile_time": 810.2646410698071, "verification_time": 0, "benchmark_time": 144.17997398413718, "GFLOP/s": 112.92392177748131, "strategy_time": 0.009548035450279713, "framework_time": 1.8394219223409891, "timestamp": "2025-04-08 05:25:25.187379+00:00", "gridpoints/s": 7528261451.8320875}, "4096,4096,8,16,4,2,1,10,1,0,3": {"grid_width": 4096, "grid_height": 4096, "block_size_x": 8, "block_size_y": 16, "tile_size_x": 4, "tile_size_y": 2, "temporal_tiling_factor": 1, "max_tfactor": 10, "loop_unroll_factor_t": 1, "sh_power": 0, "blocks_per_sm": 3, "time": 1.4357959777116776, "times": [1.4888960123062134, 1.4387199878692627, 1.435647964477539, 1.4335360527038574, 1.435647964477539, 1.4335999488830566, 1.4346239566802979, 1.4335999488830566, 1.4344639778137207, 1.4325759410858154, 1.4335999488830566, 1.4325759410858154, 1.4335999488830566, 1.4335999488830566, 1.4346239566802979, 1.433568000793457, 1.4334720373153687, 1.4334720373153687, 1.4326720237731934, 1.4325759410858154, 1.4335999488830566, 1.4325759410858154, 1.4325759410858154, 1.4315520524978638, 1.4315520524978638, 1.4325759410858154, 1.4336960315704346, 1.4335360527038574, 1.4335999488830566, 1.4325759410858154, 1.4489599466323853, 1.4335999488830566], "compile_time": 755.9185860445723, "verification_time": 0, "benchmark_time": 47.825852991081774, "GFLOP/s": 175.2743731745817, "strategy_time": 0.008985982276499271, "framework_time": 1.4327919343486428, "timestamp": "2025-04-08 05:25:25.992602+00:00", "gridpoints/s": 11684958211.638783}, "4096,4096,4,16,6,2,10,10,5,0,3": {"grid_width": 4096, "grid_height": 4096, "block_size_x": 4, "block_size_y": 16, "tile_size_x": 6, "tile_size_y": 2, "temporal_tiling_factor": 10, "max_tfactor": 10, "loop_unroll_factor_t": 5, "sh_power": 0, "blocks_per_sm": 3, "time": 29.408595144748688, "times": [34.488319396972656, 34.43507385253906, 34.42892837524414, 34.42585754394531, 34.42585754394531, 34.42483139038086, 28.76518440246582, 28.178272247314453, 28.17638397216797, 28.17740821838379, 28.17945671081543, 28.181503295898438, 28.178239822387695, 28.180479049682617, 28.180479049682617, 28.17945671081543, 28.17843246459961, 28.17535972595215, 28.207103729248047, 28.328960418701172, 28.262399673461914, 28.263423919677734, 28.261375427246094, 28.264448165893555, 28.268512725830078, 28.265439987182617, 28.268543243408203, 28.260351181030273, 28.266496658325195, 28.266496658325195, 28.267520904541016, 28.264448165893555], "compile_time": 1132.2710760869086, "verification_time": 0, "benchmark_time": 942.7711289608851, "GFLOP/s": 85.57302338358623, "strategy_time": 0.009448034688830376, "framework_time": 1.5346209984272718, "timestamp": "2025-04-08 05:25:28.069218+00:00", "gridpoints/s": 5704868225.572415}, "4096,4096,128,1,4,4,3,10,3,0,2": {"grid_width": 4096, "grid_height": 4096, "block_size_x": 128, "block_size_y": 1, "tile_size_x": 4, "tile_size_y": 4, "temporal_tiling_factor": 3, "max_tfactor": 10, "loop_unroll_factor_t": 3, "sh_power": 0, "blocks_per_sm": 2, "time": 6.7169089913368225, "times": [6.