compare_real_world_impact/results/hotspot/A4000_f=bruteforce_i=2.json
{"device_name": "NVIDIA RTX A4000", "kernel_name": "calculate_temp", "problem_size": [4096, 4096], "tune_params_keys": ["grid_width", "grid_height", "block_size_x", "block_size_y", "tile_size_x", "tile_size_y", "temporal_tiling_factor", "max_tfactor", "loop_unroll_factor_t", "sh_power", "blocks_per_sm"], "tune_params": {"grid_width": [4096], "grid_height": [4096], "block_size_x": [1, 2, 4, 8, 16, 32, 64, 96, 128, 160, 192, 224, 256, 288, 320, 352, 384, 416, 448, 480, 512, 544, 576, 608, 640, 672, 704, 736, 768, 800, 832, 864, 896, 928, 960, 992, 1024], "block_size_y": [1, 2, 4, 8, 16, 32], "tile_size_x": [1, 2, 3, 4, 5, 6, 7, 8, 9, 10], "tile_size_y": [1, 2, 3, 4, 5, 6, 7, 8, 9, 10], "temporal_tiling_factor": [1, 2, 3, 4, 5, 6, 7, 8, 9, 10], "max_tfactor": [10], "loop_unroll_factor_t": [1, 2, 3, 4, 5, 6, 7, 8, 9, 10], "sh_power": [0, 1], "blocks_per_sm": [0, 1, 2, 3, 4]}, "objective": "GFLOP/s", "cache": {"4096,4096,8,8,2,3,10,10,2,0,0": {"grid_width": 4096, "grid_height": 4096, "block_size_x": 8, "block_size_y": 8, "tile_size_x": 2, "tile_size_y": 3, "temporal_tiling_factor": 10, "max_tfactor": 10, "loop_unroll_factor_t": 2, "sh_power": 0, "blocks_per_sm": 0, "time": 44.72686195373535, "times": [44.706817626953125, 44.664833068847656, 44.661598205566406, 44.651519775390625, 44.655616760253906, 44.65049743652344, 44.65254211425781, 44.65971374511719, 44.660736083984375, 44.658687591552734, 44.656639099121094, 44.65049743652344, 44.651519775390625, 44.65049743652344, 44.651519775390625, 44.65254211425781, 44.82252883911133, 44.96486282348633, 44.77030563354492, 44.77439880371094, 44.7762565612793, 44.78156661987305, 44.77849578857422, 44.7825927734375, 44.78771209716797, 44.779518127441406, 44.77628707885742, 44.78361511230469, 44.78668975830078, 44.788734436035156, 44.78559875488281, 44.78464126586914], "compile_time": 833.8504030834883, "verification_time": 0, "benchmark_time": 1432.9767040908337, "GFLOP/s": 56.26557039935211, "strategy_time": 454909.05010607094, "framework_time": 0, "timestamp": "2025-04-07 23:23:39.128217+00:00", "gridpoints/s": 3751038026.6234736}, "4096,4096,16,32,2,2,10,10,2,0,2": {"grid_width": 4096, "grid_height": 4096, "block_size_x": 16, "block_size_y": 32, "tile_size_x": 2, "tile_size_y": 2, "temporal_tiling_factor": 10, "max_tfactor": 10, "loop_unroll_factor_t": 2, "sh_power": 0, "blocks_per_sm": 2, "time": 26.043671011924744, "times": [26.091520309448242, 26.049535751342773, 26.048511505126953, 26.045440673828125, 26.043392181396484, 26.043392181396484, 26.042367935180664, 26.041343688964844, 26.044416427612305, 26.044416427612305, 26.042367935180664, 26.040319442749023, 26.043392181396484, 26.042367935180664, 26.044416427612305, 26.044416427612305, 26.039295196533203, 26.041343688964844, 26.040319442749023, 26.041343688964844, 26.041343688964844, 26.041343688964844, 26.041215896606445, 26.041343688964844, 26.040191650390625, 26.037120819091797, 26.038272857666016, 26.042367935180664, 26.037248611450195, 26.041343688964844, 26.041343688964844, 26.040416717529297], "compile_time": 826.2862779665738, "verification_time": 0, "benchmark_time": 834.7309010569006, "GFLOP/s": 96.62932690432619, "strategy_time": 0.009226961992681026, "framework_time": 1.8879820127040148, "timestamp": "2025-04-07 23:23:40.791162+00:00", "gridpoints/s": 6441955126.955079}, "4096,4096,2,32,2,5,4,10,2,1,2": {"grid_width": 4096, "grid_height": 4096, "block_size_x": 2, "block_size_y": 32, "tile_size_x": 2, "tile_size_y": 5, "temporal_tiling_factor": 4, "max_tfactor": 10, "loop_unroll_factor_t": 2, "sh_power": 1, "blocks_per_sm": 2, "time": 10.602306067943573, "times": [10.648575782775879, 10.605567932128906, 10.600447654724121, 10.599424362182617, 10.610688209533691, 10.603520393371582, 10.601344108581543, 10.602496147155762, 10.601471900939941, 10.603520393371582, 10.60035228729248, 10.59222412109375, 10.606592178344727, 10.599264144897461, 10.599424362182617, 10.594304084777832, 10.598336219787598, 10.596351623535156, 10.598431587219238, 10.596351623535156, 10.602496147155762, 10.594304084777832, 10.614656448364258, 10.595328330993652, 10.604479789733887, 10.594304084777832, 10.611712455749512, 10.592255592346191, 10.604543685913086, 10.602335929870605, 10.598400115966797, 10.600288391113281], "compile_time": 786.2040820764378, "verification_time": 0, "benchmark_time": 341.0837840056047, "GFLOP/s": 94.9447180216376, "strategy_time": 0.00883603934198618, "framework_time": 1.4487907756119967, "timestamp": "2025-04-07 23:23:41.919940+00:00", "gridpoints/s": 6329647868.109174}, "4096,4096,192,1,1,2,5,10,5,0,3": {"grid_width": 4096, "grid_height": 4096, "block_size_x": 192, "block_size_y": 1, "tile_size_x": 1, "tile_size_y": 2, "temporal_tiling_factor": 5, "max_tfactor": 10, "loop_unroll_factor_t": 5, "sh_power": 0, "blocks_per_sm": 3, "time": 24.693108022212982, "times": [24.74291229248047, 24.698976516723633, 24.69273567199707, 24.69683265686035, 24.69478416442871, 24.69171142578125, 24.69068717956543, 24.69171142578125, 24.688640594482422, 24.69161605834961, 24.69068717956543, 24.697664260864258, 24.689664840698242, 24.68659210205078, 24.68659210205078, 24.68556785583496, 24.69375991821289, 24.69068717956543, 24.69580841064453, 24.689664840698242, 24.6876163482666, 24.69273567199707, 24.69478416442871, 24.69375991821289, 24.69375991821289, 24.689664840698242, 24.69478416442871, 24.69171142578125, 24.687551498413086, 24.6876163482666, 24.68953514099121, 24.688640594482422], "compile_time": 721.9446121016517, "verification_time": 0, "benchmark_time": 791.3018920226023, "GFLOP/s": 50.95718201483948, "strategy_time": 0.008987030014395714, "framework_time": 1.5459328424185514, "timestamp": "2025-04-07 23:23:43.434772+00:00", "gridpoints/s": 3397145467.655966}, "4096,4096,16,16,5,2,4,10,1,1,1": {"grid_width": 4096, "grid_height": 4096, "block_size_x": 16, "block_size_y": 16, "tile_size_x": 5, "tile_size_y": 2, "temporal_tiling_factor": 4, "max_tfactor": 10, "loop_unroll_factor_t": 1, "sh_power": 1, "blocks_per_sm": 1, "time": 7.037271052598953, "times": [7.089151859283447, 7.038976192474365, 7.037888050079346, 7.039968013763428, 7.0359039306640625, 7.0348801612854, 7.037951946258545, 7.0359039306640625, 7.0348801612854, 7.0359039306640625, 7.036928176879883, 7.037951946258545, 7.0348801612854, 7.0359039306640625, 7.0348801612854, 7.0348801612854, 7.036928176879883, 7.0348801612854, 7.03385591506958, 7.0348801612854, 7.03385591506958, 7.03385591506958, 7.03385591506958, 7.0348801612854, 7.033664226531982, 7.032832145690918, 7.0348801612854, 7.0359039306640625, 7.03385591506958, 7.0348801612854, 7.037951946258545, 7.0348801612854], "compile_time": 769.2475809017196, "verification_time": 0, "benchmark_time": 226.01152793504298, "GFLOP/s": 143.04308480888164, "strategy_time": 0.00916793942451477, "framework_time": 1.371525228023529, "timestamp": "2025-04-07 23:23:44.431442+00:00", "gridpoints/s": 9536205653.925444}, "4096,4096,16,8,3,3,6,10,6,0,3": {"grid_width": 4096, "grid_height": 4096, "block_size_x": 16, "block_size_y": 8, "tile_size_x": 3, "tile_size_y": 3, "temporal_tiling_factor": 6, "max_tfactor": 10, "loop_unroll_factor_t": 6, "sh_power": 0, "blocks_per_sm": 3, "time": 21.29077911376953, "times": [21.346303939819336, 21.298175811767578, 21.29203224182129, 21.288959503173828, 21.28691291809082, 21.28691291809082, 21.288959503173828, 21.285888671875, 21.289024353027344, 21.28998374938965, 21.285888671875, 21.28691291809082, 21.29408073425293, 21.287935256958008, 21.287839889526367, 21.28985595703125, 21.29203224182129, 21.29212760925293, 21.288959503173828, 21.285888671875, 21.29203224182129, 21.287935256958008, 21.29203224182129, 21.28691291809082, 21.285888671875, 21.29203224182129, 21.28998374938965, 21.288959503173828, 21.287935256958008, 21.284767150878906, 21.285888671875, 21.285888671875], "compile_time": 1070.9453809540719, "verification_time": 0, "benchmark_time": 682.8522890573367, "GFLOP/s": 70.92034687558522, "strategy_time": 0.009597977623343468, "framework_time": 1.3814650010317564, "timestamp": "2025-04-07 23:23:46.186661+00:00", "gridpoints/s": 4728023125.039015}, "4096,4096,2,16,6,4,8,10,1,0,1": {"grid_width": 4096, "grid_height": 4096, "block_size_x": 2, "block_size_y": 16, "tile_size_x": 6, "tile_size_y": 4, "temporal_tiling_factor": 8, "max_tfactor": 10, "loop_unroll_factor_t": 1, "sh_power": 0, "blocks_per_sm": 1, "time": 21.279363095760345, "times": [21.332992553710938, 21.27155113220215, 21.279743194580078, 21.27564811706543, 21.27449607849121, 21.28281593322754, 21.27872085571289, 21.27667236328125, 21.27667236328125, 21.290847778320312, 21.27667236328125, 21.27564811706543, 21.27257537841797, 21.281600952148438, 21.27769660949707, 21.27462387084961, 21.28691291809082, 21.27257537841797, 21.285888671875, 21.274463653564453, 21.28175926208496, 21.277536392211914, 21.27667236328125, 21.285888671875, 21.27564811706543, 21.27155113220215, 21.27564811706543, 21.27052879333496, 21.27667236328125, 21.27564811706543, 21.27462387084961, 21.278623580932617], "compile_time": 831.9779890589416, "verification_time": 0, "benchmark_time": 682.8422999242321, "GFLOP/s": 94.6111925878608, "strategy_time": 0.00933697447180748, "framework_time": 1.4147281181067228, "timestamp": "2025-04-07 23:23:47.702936+00:00", "gridpoints/s": 6307412839.19072}, "4096,4096,8,4,1,3,9,10,3,1,2": {"grid_width": 4096, "grid_height": 4096, "block_size_x": 8, "block_size_y": 4, "tile_size_x": 1, "tile_size_y": 3, "temporal_tiling_factor": 9, "max_tfactor": 10, "loop_unroll_factor_t": 3, "sh_power": 1, "blocks_per_sm": 2, "time": 53.341716170310974, "times": [53.315486907958984, 53.270591735839844, 53.26540756225586, 53.26950454711914, 53.2674560546875, 53.26438522338867, 53.26643371582031, 53.26124954223633, 53.26131057739258, 53.26233673095703, 53.26233673095703, 53.26028823852539, 53.2632942199707, 53.26630401611328, 53.26233673095703, 53.280799865722656, 53.26438522338867, 53.26233673095703, 53.26131057739258, 53.26335906982422, 53.26438522338867, 53.26540756225586, 53.26335906982422, 53.26643371582031, 53.27769470214844, 53.60435104370117, 53.607425689697266, 53.609310150146484, 53.607425689697266, 53.6064338684082, 53.60639953613281, 53.605377197265625], "compile_time": 882.257818011567, "verification_time": 0, "benchmark_time": 1708.5813659941778, "GFLOP/s": 42.46065411109918, "strategy_time": 0.00945699866861105, "framework_time": 1.5725030098110437, "timestamp": "2025-04-07 23:23:50.295387+00:00", "gridpoints/s": 2830710274.073279}, "4096,4096,8,8,1,5,9,10,3,0,3": {"grid_width": 4096, "grid_height": 4096, "block_size_x": 8, "block_size_y": 8, "tile_size_x": 1, "tile_size_y": 5, "temporal_tiling_factor": 9, "max_tfactor": 10, "loop_unroll_factor_t": 3, "sh_power": 0, "blocks_per_sm": 3, "time": 36.39957892894745, "times": [36.45132827758789, 36.401153564453125, 36.39603042602539, 36.397056579589844, 36.40012741088867, 36.39807891845703, 36.39692687988281, 36.3950080871582, 36.401153564453125, 36.397056579589844, 36.399105072021484, 36.40108871459961, 36.402015686035156, 36.400062561035156, 36.40012741088867, 36.401153564453125, 36.39807891845703, 36.3950080871582, 36.39807891845703, 36.39798355102539, 36.39801788330078, 36.39692687988281, 36.397056579589844, 36.39603042602539, 36.397056579589844, 36.395904541015625, 36.3950080871582, 36.39603042602539, 36.39593505859375, 36.39801788330078, 36.39788818359375, 36.39603042602539], "compile_time": 974.2305979598314, "verification_time": 0, "benchmark_time": 1166.4221780374646, "GFLOP/s": 62.2239110079039, "strategy_time": 0.008775969035923481, "framework_time": 1.4687690418213606, "timestamp": "2025-04-07 23:23:52.437551+00:00", "gridpoints/s": 4148260733.86026}, "4096,4096,512,1,1,1,3,10,3,1,2": {"grid_width": 4096, "grid_height": 4096, "block_size_x": 512, "block_size_y": 1, "tile_size_x": 1, "tile_size_y": 1, "temporal_tiling_factor": 3, "max_tfactor": 10, "loop_unroll_factor_t": 3, "sh_power": 1, "blocks_per_sm": 2, "time": 13.440403908491135, "times": [13.492223739624023, 13.443072319030762, 13.438976287841797, 13.435903549194336, 13.4399995803833, 13.437952041625977, 13.436927795410156, 13.43785572052002, 13.438976287841797, 13.438976287841797, 13.437952041625977, 13.44099235534668, 13.438912391662598, 13.435903549194336, 13.43779182434082, 13.439871788024902, 13.438976287841797, 13.437952041625977, 13.441023826599121, 13.437952041625977, 13.435903549194336, 13.438048362731934, 13.4399995803833, 13.436927795410156, 13.4399995803833, 13.436927795410156, 13.4399995803833, 13.437952041625977, 13.4399995803833, 13.441023826599121, 13.4399995803833, 13.437952041625977], "compile_time": 808.6572579341009, "verification_time": 0, "benchmark_time": 432.13594995904714, "GFLOP/s": 56.1720261638146, "strategy_time": 0.009136972948908806, "framework_time": 1.4449451118707657, "timestamp": "2025-04-07 23:23:53.679829+00:00", "gridpoints/s": 3744801744.2543063}, "4096,4096,16,2,1,3,9,10,1,1,4": {"grid_width": 4096, "grid_height": 4096, "block_size_x": 16, "block_size_y": 2, "tile_size_x": 1, "tile_size_y": 3, "temporal_tiling_factor": 9, "max_tfactor": 10, "loop_unroll_factor_t": 1, "sh_power": 1, "blocks_per_sm": 4, "time": 56.244067549705505, "times": [56.29132843017578, 56.25020980834961, 56.2421760559082, 56.24099349975586, 56.24012756347656, 56.24518585205078, 56.2421760559082, 56.24012756347656, 56.241024017333984, 56.241153717041016, 56.24012756347656, 56.237056732177734, 56.241153717041016, 56.239105224609375, 56.2421760559082, 56.24012756347656, 56.239009857177734, 56.24319839477539, 56.2410888671875, 56.239105224609375, 56.248321533203125, 56.241153717041016, 56.24300765991211, 56.248321533203125, 56.24729537963867, 56.241153717041016, 56.244224548339844, 56.239105224609375, 56.239105224609375, 56.24319839477539, 56.25849533081055, 56.24012756347656], "compile_time": 756.5957660553977, "verification_time": 0, "benchmark_time": 1801.110255997628, "GFLOP/s": 40.269565461252974, "strategy_time": 0.008926959708333015, "framework_time": 1.472154981456697, "timestamp": "2025-04-07 23:23:56.239047+00:00", "gridpoints/s": 2684637697.416865}, "4096,4096,32,1,1,8,10,10,2,0,2": {"grid_width": 4096, "grid_height": 4096, "block_size_x": 32, "block_size_y": 1, "tile_size_x": 1, "tile_size_y": 8, "temporal_tiling_factor": 10, "max_tfactor": 10, "loop_unroll_factor_t": 2, "sh_power": 0, "blocks_per_sm": 2, "time": 57.02267801761627, "times": [57.0880012512207, 57.007102966308594, 56.997886657714844, 56.994815826416016, 57.06035232543945, 57.042945861816406, 56.999839782714844, 57.038848876953125, 56.990718841552734, 57.021278381347656, 57.011199951171875, 57.05215835571289, 57.020416259765625, 57.020416259765625, 57.00505447387695, 57.016319274902344, 56.98457717895508, 57.02348709106445, 56.9989128112793, 57.00300979614258, 57.03065490722656, 56.99897766113281, 57.038848876953125, 57.055233001708984, 57.04499053955078, 57.027584075927734, 57.016319274902344, 57.03065490722656, 57.011199951171875, 57.050048828125, 56.98969650268555, 57.05414581298828], "compile_time": 836.1593630397692, "verification_time": 0, "benchmark_time": 1826.3219950022176, "GFLOP/s": 44.13300966367348, "strategy_time": 0.009387964382767677, "framework_time": 1.4274209970608354, "timestamp": "2025-04-07 23:23:58.902996+00:00", "gridpoints/s": 2942200644.2448983}, "4096,4096,8,16,9,1,3,10,3,1,2": {"grid_width": 4096, "grid_height": 4096, "block_size_x": 8, "block_size_y": 16, "tile_size_x": 9, "tile_size_y": 1, "temporal_tiling_factor": 3, "max_tfactor": 10, "loop_unroll_factor_t": 3, "sh_power": 1, "blocks_per_sm": 2, "time": 5.250581011176109, "times": [5.303296089172363, 5.255104064941406, 5.251071929931641, 5.249023914337158, 5.2500481605529785, 5.2500481605529785, 5.249023914337158, 5.248991966247559, 5.249023914337158, 5.248960018157959, 5.248928070068359, 5.248000144958496, 5.249023914337158, 5.248000144958496, 5.246975898742676, 5.249023914337158, 5.249023914337158, 5.249087810516357, 5.2500481605529785, 5.249023914337158, 5.249023914337158, 5.2481279373168945, 5.249023914337158, 5.248000144958496, 5.248000144958496, 5.2478718757629395, 5.245952129364014, 5.248000144958496, 5.24783992767334, 5.249023914337158, 5.248000144958496, 5.248000144958496], "compile_time": 824.0776750026271, "verification_time": 0, "benchmark_time": 169.1090550739318, "GFLOP/s": 143.78879563861614, "strategy_time": 0.009177019819617271, "framework_time": 1.3825568603351712, "timestamp": "2025-04-07 23:23:59.897604+00:00", "gridpoints/s": 9585919709.241077}, "4096,4096,8,4,2,1,7,10,1,0,1": {"grid_width": 4096, "grid_height": 4096, "block_size_x": 8, "block_size_y": 4, "tile_size_x": 2, "tile_size_y": 1, "temporal_tiling_factor": 7, "max_tfactor": 10, "loop_unroll_factor_t": 1, "sh_power": 0, "blocks_per_sm": 1, "time": 60.412755846977234, "times": [60.44569778442383, 60.39955139160156, 60.3955192565918, 60.39756774902344, 60.39449691772461, 60.393470764160156, 60.39539337158203, 60.39449691772461, 60.39433670043945, 60.391422271728516, 60.39756774902344, 60.39654541015625, 60.393470764160156, 60.3955192565918, 60.3955192565918, 60.393470764160156, 60.3955192565918, 60.39961624145508, 60.393470764160156, 60.3955192565918, 60.393470764160156, 60.391422271728516, 60.39654541015625, 60.39756774902344, 60.39753723144531, 60.39961624145508, 60.3955192565918, 60.393470764160156, 60.39244842529297, 60.39654541015625, 60.50406265258789, 60.79180908203125], "compile_time": 805.668024928309, "verification_time": 0, "benchmark_time": 1934.919113991782, "GFLOP/s": 29.15953187869913, "strategy_time": 0.009236973710358143, "framework_time": 1.3742921873927116, "timestamp": "2025-04-07 23:24:02.639606+00:00", "gridpoints/s": 1943968791.9132755}, "4096,4096,64,1,1,5,2,10,2,1,0": {"grid_width": 4096, "grid_height": 4096, "block_size_x": 64, "block_size_y": 1, "tile_size_x": 1, "tile_size_y": 5, "temporal_tiling_factor": 2, "max_tfactor": 10, "loop_unroll_factor_t": 2, "sh_power": 1, "blocks_per_sm": 0, "time": 4.382594048976898, "times": [4.433919906616211, 4.385791778564453, 4.3816962242126465, 4.382719993591309, 4.380671977996826, 4.382719993591309, 4.3816962242126465, 4.3816962242126465, 4.381631851196289, 4.379648208618164, 4.380671977996826, 4.380671977996826, 4.3816962242126465, 4.380671977996826, 4.380671977996826, 4.379648208618164, 4.380671977996826, 4.380671977996826, 4.3797760009765625, 4.380671977996826, 4.380671977996826, 4.379648208618164, 4.380671977996826, 4.3816962242126465, 4.380671977996826, 4.380671977996826, 4.380671977996826, 4.379648208618164, 4.380671977996826, 4.379648208618164, 4.380671977996826, 4.379648208618164], "compile_time": 767.0496279606596, "verification_time": 0, "benchmark_time": 142.36342604272068, "GFLOP/s": 114.84442190521787, "strategy_time": 0.008817063644528389, "framework_time": 1.545351929962635, "timestamp": "2025-04-07 23:24:03.550605+00:00", "gridpoints/s": 7656294793.681191}, "4096,4096,1,32,6,5,6,10,3,0,4": {"grid_width": 4096, "grid_height": 4096, "block_size_x": 1, "block_size_y": 32, "tile_size_x": 6, "tile_size_y": 5, "temporal_tiling_factor": 6, "max_tfactor": 10, "loop_unroll_factor_t": 3, "sh_power": 0, "blocks_per_sm": 4, "time": 19.695051908493042, "times": [19.734527587890625, 19.701759338378906, 19.700735092163086, 19.689472198486328, 19.70899200439453, 19.692447662353516, 19.668960571289062, 19.697664260864258, 19.687231063842773, 19.68726348876953, 19.696640014648438, 19.69152069091797, 19.698688507080078, 19.694591522216797, 19.69152069091797, 19.689472198486328, 19.69049644470215, 19.6997127532959, 19.690399169921875, 19.69049644470215, 19.702783584594727, 19.694591522216797, 19.69548797607422, 19.689472198486328, 19.708927154541016, 19.678207397460938, 19.694591522216797, 19.686399459838867, 19.694591522216797, 19.704832077026367, 19.707904815673828, 19.6812801361084], "compile_time": 980.1264209672809, "verification_time": 0, "benchmark_time": 631.4423040021211, "GFLOP/s": 76.66643616962841, "strategy_time": 0.008706003427505493, "framework_time": 1.3383650220930576, "timestamp": "2025-04-07 23:24:05.163550+00:00", "gridpoints/s": 5111095744.641894}, "4096,4096,16,2,10,2,9,10,3,0,0": {"grid_width": 4096, "grid_height": 4096, "block_size_x": 16, "block_size_y": 2, "tile_size_x": 10, "tile_size_y": 2, "temporal_tiling_factor": 9, "max_tfactor": 10, "loop_unroll_factor_t": 3, "sh_power": 0, "blocks_per_sm": 0, "time": 44.46632421016693, "times": [44.51123046875, 44.501953125, 44.483585357666016, 44.48854446411133, 44.46003341674805, 44.495872497558594, 44.481536865234375, 44.46207809448242, 44.4681282043457, 44.455936431884766, 44.4323844909668, 44.448768615722656, 44.45286560058594, 44.46412658691406, 44.465152740478516, 44.461055755615234, 44.47840118408203, 44.470272064208984, 44.485633850097656, 44.47129440307617, 44.457984924316406, 44.46412658691406, 44.48051071166992, 44.448768615722656, 44.465152740478516, 44.4508171081543, 44.46003341674805, 44.45491027832031, 44.440574645996094, 44.4692497253418, 44.442623138427734, 44.448768615722656], "compile_time": 1005.5057529825717, "verification_time": 0, "benchmark_time": 1424.3809080217034, "GFLOP/s": 50.93571821441764, "strategy_time": 0.00909692607820034, "framework_time": 1.3561591040343046, "timestamp": "2025-04-07 23:24:07.594835+00:00", "gridpoints/s": 3395714547.627843}, "4096,4096,1,32,4,3,3,10,1,1,2": {"grid_width": 4096, "grid_height": 4096, "block_size_x": 1, "block_size_y": 32, "tile_size_x": 4, "tile_size_y": 3, "temporal_tiling_factor": 3, "max_tfactor": 10, "loop_unroll_factor_t": 1, "sh_power": 1, "blocks_per_sm": 2, "time": 7.963929936289787, "times": [8.014847755432129, 7.965695858001709, 7.9655680656433105, 7.9626240730285645, 7.963647842407227, 7.961599826812744, 7.965695858001709, 7.963647842407227, 7.956480026245117, 7.965695858001709, 7.959519863128662, 7.9626240730285645, 7.959455966949463, 7.961599826812744, 7.9585280418396, 7.959551811218262, 7.961599826812744, 7.96073579788208, 7.974912166595459, 7.961599826812744, 7.965695858001709, 7.9626240730285645, 7.9626240730285645, 7.960576057434082, 7.9585280418396, 7.961599826812744, 7.963647842407227, 7.960576057434082, 7.960576057434082, 7.959551811218262, 7.960480213165283, 7.963647842407227], "compile_time": 757.2768899844959, "verification_time": 0, "benchmark_time": 256.1822870047763, "GFLOP/s": 94.7992669498202, "strategy_time": 0.008867005817592144, "framework_time": 1.7600120045244694, "timestamp": "2025-04-07 23:24:08.610095+00:00", "gridpoints/s": 6319951129.988012}, "4096,4096,4,16,3,2,2,10,2,0,1": {"grid_width": 4096, "grid_height": 4096, "block_size_x": 4, "block_size_y": 16, "tile_size_x": 3, "tile_size_y": 2, "temporal_tiling_factor": 2, "max_tfactor": 10, "loop_unroll_factor_t": 2, "sh_power": 0, "blocks_per_sm": 1, "time": 5.4947719424963, "times": [5.552127838134766, 5.497856140136719, 5.494783878326416, 5.493760108947754, 5.494783878326416, 5.49289608001709, 5.494783878326416, 5.492735862731934, 5.492735862731934, 5.494592189788818, 5.492735862731934, 5.492735862731934, 5.492735862731934, 5.493599891662598, 5.4917120933532715, 5.492735862731934, 5.492735862731934, 5.4917120933532715, 5.492735862731934, 5.492703914642334, 5.492735862731934, 5.492735862731934, 5.4917120933532715, 5.490687847137451, 5.492735862731934, 5.4917120933532715, 5.492735862731934, 5.492735862731934, 5.492735862731934, 5.4925761222839355, 5.4917120933532715, 5.490687847137451], "compile_time": 813.8655649963766, "verification_time": 0, "benchmark_time": 177.95748403295875, "GFLOP/s": 91.59915739311667, "strategy_time": 0.009167008101940155, "framework_time": 1.3678889954462647, "timestamp": "2025-04-07 23:24:09.603326+00:00", "gridpoints/s": 6106610492.874445}, "4096,4096,8,16,1,5,6,10,2,1,3": {"grid_width": 4096, "grid_height": 4096, "block_size_x": 8, "block_size_y": 16, "tile_size_x": 1, "tile_size_y": 5, "temporal_tiling_factor": 6, "max_tfactor": 10, "loop_unroll_factor_t": 2, "sh_power": 1, "blocks_per_sm": 3, "time": 18.294896125793457, "times": [18.344959259033203, 18.298816680908203, 18.294784545898438, 18.293760299682617, 18.29475212097168, 18.291711807250977, 18.293760299682617, 18.293760299682617, 18.29680061340332, 18.291648864746094, 18.294784545898438, 18.294784545898438, 18.293760299682617, 18.292736053466797, 18.289663314819336, 18.290687561035156, 18.293760299682617, 18.292736053466797, 18.292736053466797, 18.291711807250977, 18.294784545898438, 18.292736053466797, 18.292736053466797, 18.293760299682617, 18.293760299682617, 18.29462432861328, 18.292736053466797, 18.292736053466797, 18.290687561035156, 18.292736053466797, 18.291711807250977, 18.29155158996582], "compile_time": 790.3844650136307, "verification_time": 0, "benchmark_time": 586.8932789890096, "GFLOP/s": 82.53391708910361, "strategy_time": 0.00933697447180748, "framework_time": 1.405842020176351, "timestamp": "2025-04-07 23:24:10.982050+00:00", "gridpoints/s": 5502261139.273574}, "4096,4096,128,1,2,6,8,10,2,0,0": {"grid_width": 4096, "grid_height": 4096, "block_size_x": 128, "block_size_y": 1, "tile_size_x": 2, "tile_size_y": 6, "temporal_tiling_factor": 8, "max_tfactor": 10, "loop_unroll_factor_t": 2, "sh_power": 0, "blocks_per_sm": 0, "time": 28.043156266212463, "times": [28.099584579467773, 28.076032638549805, 28.018688201904297, 28.000255584716797, 28.11084747314453, 28.07699203491211, 28.037120819091797, 28.044288635253906, 28.037120819091797, 27.992063522338867, 28.022783279418945, 28.091392517089844, 28.087295532226562, 28.053504943847656, 27.97260856628418, 28.051456451416016, 28.036096572875977, 28.042240142822266, 28.019712448120117, 28.058624267578125, 28.026880264282227, 28.021728515625, 28.067840576171875, 28.044160842895508, 28.027904510498047, 28.0053768157959, 28.028928756713867, 28.06870460510254, 28.071935653686523, 28.055551528930664, 27.97158432006836, 28.061695098876953], "compile_time": 846.9145700801164, "verification_time": 0, "benchmark_time": 898.8483339780942, "GFLOP/s": 71.79170207833076, "strategy_time": 0.00846607144922018, "framework_time": 1.4334628358483315, "timestamp": "2025-04-07 23:24:12.729285+00:00", "gridpoints/s": 4786113471.888718}, "4096,4096,16,4,5,6,4,10,2,0,4": {"grid_width": 4096, "grid_height": 4096, "block_size_x": 16, "block_size_y": 4, "tile_size_x": 5, "tile_size_y": 6, "temporal_tiling_factor": 4, "max_tfactor": 10, "loop_unroll_factor_t": 2, "sh_power": 0, "blocks_per_sm": 4, "time": 7.371660947799683, "times": [7.420928001403809, 7.3717122077941895, 7.368703842163086, 7.3737921714782715, 7.363584041595459, 7.376895904541016, 7.3666558265686035, 7.412735939025879, 7.3666558265686035, 7.370751857757568, 7.374752044677734, 7.377920150756836, 7.3666558265686035, 7.368703842163086, 7.363552093505859, 7.361536026000977, 7.3666558265686035, 7.374847888946533, 7.365632057189941, 7.3666558265686035, 7.362559795379639, 7.365471839904785, 7.367680072784424, 7.374815940856934, 7.368639945983887, 7.362559795379639, 7.373824119567871, 7.366528034210205, 7.364607810974121, 7.3666558265686035, 7.368703842163086, 7.371776103973389], "compile_time": 873.1059019919485, "verification_time": 0, "benchmark_time": 236.87687003985047, "GFLOP/s": 136.55443015192702, "strategy_time": 0.009427894838154316, "framework_time": 1.4637691201642156, "timestamp": "2025-04-07 23:24:13.840772+00:00", "gridpoints/s": 9103628676.795134}, "4096,4096,96,1,2,6,4,10,4,0,3": {"grid_width": 4096, "grid_height": 4096, "block_size_x": 96, "block_size_y": 1, "tile_size_x": 2, "tile_size_y": 6, "temporal_tiling_factor": 4, "max_tfactor": 10, "loop_unroll_factor_t": 4, "sh_power": 0, "blocks_per_sm": 3, "time": 9.961743891239166, "times": [10.01574420928955, 9.951231956481934, 9.957311630249023, 9.961471557617188, 9.959424018859863, 9.963520050048828, 9.961471557617188, 9.955360412597656, 9.953280448913574, 9.957344055175781, 9.952256202697754, 9.963520050048828, 9.960448265075684, 9.961471557617188, 9.958399772644043, 9.965567588806152, 9.958399772644043, 9.964639663696289, 9.948160171508789, 9.966591835021973, 9.965567588806152, 9.95315170288086, 9.955327987670898, 9.954303741455078, 9.961343765258789, 9.962495803833008, 9.966591835021973, 9.967424392700195, 9.960351943969727, 9.962495803833008, 9.965567588806152, 9.965567588806152], "compile_time": 723.0354939820245, "verification_time": 0, "benchmark_time": 320.19626698456705, "GFLOP/s": 101.04987349506958, "strategy_time": 0.00954698771238327, "framework_time": 1.3967540580779314, "timestamp": "2025-04-07 23:24:14.885442+00:00", "gridpoints/s": 6736658233.004639}, "4096,4096,96,4,2,3,4,10,2,0,0": {"grid_width": 4096, "grid_height": 4096, "block_size_x": 96, "block_size_y": 4, "tile_size_x": 2, "tile_size_y": 3, "temporal_tiling_factor": 4, "max_tfactor": 10, "loop_unroll_factor_t": 2, "sh_power": 0, "blocks_per_sm": 0, "time": 8.183306962251663, "times": [8.23193645477295, 8.186752319335938, 8.184831619262695, 8.18175983428955, 8.181599617004395, 8.181599617004395, 8.183808326721191, 8.179712295532227, 8.178688049316406, 8.18073558807373, 8.182784080505371, 8.18175983428955, 8.180831909179688, 8.18073558807373, 8.18175983428955, 8.18073558807373, 8.18073558807373, 8.179712295532227, 8.18175983428955, 8.182784080505371, 8.18175983428955, 8.183744430541992, 8.183808326721191, 8.182592391967773, 8.18175983428955, 8.18175983428955, 8.18175983428955, 8.18073558807373, 8.18175983428955, 8.179712295532227, 8.181695938110352, 8.179712295532227], "compile_time": 705.2751780720428, "verification_time": 0, "benchmark_time": 263.28157202806324, "GFLOP/s": 123.0105340840131, "strategy_time": 0.009207986295223236, "framework_time": 1.3417609734460711, "timestamp": "2025-04-07 23:24:15.855380+00:00", "gridpoints/s": 8200702272.267541}, "4096,4096,8,8,1,4,2,10,2,1,1": {"grid_width": 4096, "grid_height": 4096, "block_size_x": 8, "block_size_y": 8, "tile_size_x": 1, "tile_size_y": 4, "temporal_tiling_factor": 2, "max_tfactor": 10, "loop_unroll_factor_t": 2, "sh_power": 1, "blocks_per_sm": 1, "time": 4.596310049295425, "times": [4.647871971130371, 4.600831985473633, 4.596735954284668, 4.59657621383667, 4.59555196762085, 4.593696117401123, 4.593664169311523, 4.595712184906006, 4.610047817230225, 4.593664169311523, 4.593664169311523, 4.593664169311523, 4.593664169311523, 4.592639923095703, 4.593599796295166, 4.592703819274902, 4.591648101806641, 4.593664169311523, 4.593664169311523, 4.592639923095703, 4.593664169311523, 4.593664169311523, 4.5946879386901855, 4.5946879386901855, 4.592639923095703, 4.5946879386901855, 4.5946879386901855, 4.593664169311523, 4.592639923095703, 4.593664169311523, 4.593664169311523, 4.593664169311523], "compile_time": 763.9880980132148, "verification_time": 0, "benchmark_time": 147.89693197235465, "GFLOP/s": 109.50446653988323, "strategy_time": 0.009328010492026806, "framework_time": 1.458008075132966, "timestamp": "2025-04-07 23:24:16.768767+00:00", "gridpoints/s": 7300297769.325548}, "4096,4096,32,2,8,3,4,10,4,1,0": {"grid_width": 4096, "grid_height": 4096, "block_size_x": 32, "block_size_y": 2, "tile_size_x": 8, "tile_size_y": 3, "temporal_tiling_factor": 4, "max_tfactor": 10, "loop_unroll_factor_t": 4, "sh_power": 1, "blocks_per_sm": 0, "time": 9.83722499012947, "times": [9.920384407043457, 9.866239547729492, 9.837568283081055, 9.853919982910156, 9.867263793945312, 9.860095977783203, 9.859071731567383, 9.850751876831055, 9.811967849731445, 9.848832130432129, 9.836416244506836, 9.810943603515625, 9.847807884216309, 9.822208404541016, 9.802656173706055, 9.83027172088623, 9.816032409667969, 9.828351974487305, 9.792511940002441, 9.822208404541016, 9.868288040161133, 9.851903915405273, 9.830400466918945, 9.825247764587402, 9.82425594329834, 9.827327728271484, 9.81503963470459, 9.858016014099121, 9.848832130432129, 9.819135665893555, 9.795583724975586, 9.84166431427002], "compile_time": 895.1942360727116, "verification_time": 0, "benchmark_time": 316.22986390721053, "GFLOP/s": 102.32895567703706, "strategy_time": 0.009136972948908806, "framework_time": 1.3234671205282211, "timestamp": "2025-04-07 23:24:17.981555+00:00", "gridpoints/s": 6821930378.469137}, "4096,4096,4,8,4,1,8,10,1,1,3": {"grid_width": 4096, "grid_height": 4096, "block_size_x": 4, "block_size_y": 8, "tile_size_x": 4, "tile_size_y": 1, "temporal_tiling_factor": 8, "max_tfactor": 10, "loop_unroll_factor_t": 1, "sh_power": 1, "blocks_per_sm": 3, "time": 42.45463979244232, "times": [42.5082893371582, 42.46412658691406, 42.454017639160156, 42.45094299316406, 42.45292663574219, 42.44883346557617, 42.44976043701172, 42.44889450073242, 42.451969146728516, 42.44889450073242, 42.451969146728516, 42.45094299316406, 42.45094299316406, 42.447872161865234, 42.45094299316406, 42.449920654296875, 42.4529914855957, 42.45094299316406, 42.45289611816406, 42.451969146728516, 42.454017639160156, 42.45811080932617, 42.45606231689453, 42.457088470458984, 42.45094299316406, 42.45094299316406, 42.455039978027344, 42.455039978027344, 42.455039978027344, 42.45606231689453, 42.457088470458984, 42.4529914855957], "compile_time": 753.4024299820885, "verification_time": 0, "benchmark_time": 1360.2362640667707, "GFLOP/s": 47.4215758240492, "strategy_time": 0.008345930837094784, "framework_time": 1.331071020103991, "timestamp": "2025-04-07 23:24:20.096563+00:00", "gridpoints/s": 3161438388.2699466}, "4096,4096,8,4,7,5,7,10,1,1,2": {"grid_width": 4096, "grid_height": 4096, "block_size_x": 8, "block_size_y": 4, "tile_size_x": 7, "tile_size_y": 5, "temporal_tiling_factor": 7, "max_tfactor": 10, "loop_unroll_factor_t": 1, "sh_power": 1, "blocks_per_sm": 2, "time": 18.893776953220367, "times": [18.9520320892334, 18.902015686035156, 18.898944854736328, 18.887680053710938, 18.892799377441406, 18.886655807495117, 18.86515235900879, 18.9071044921875, 18.900863647460938, 18.896896362304688, 18.903039932250977, 18.89187240600586, 18.880512237548828, 18.899839401245117, 18.88979148864746, 18.88969612121582, 18.886655807495117, 18.884607315063477, 18.885631561279297, 18.881376266479492, 18.894847869873047, 18.886655807495117, 18.915327072143555, 18.908159255981445, 18.896896362304688, 18.887680053710938, 18.904064178466797, 18.887680053710938, 18.8907527923584, 18.889728546142578, 18.868223190307617, 18.887680053710938], "compile_time": 809.4681759830564, "verification_time": 0, "benchmark_time": 606.2981620198116, "GFLOP/s": 93.2374550817242, "strategy_time": 0.00976806040853262, "framework_time": 1.3477818574756384, "timestamp": "2025-04-07 23:24:21.513718+00:00", "gridpoints/s": 6215830338.781614}, "4096,4096,16,4,8,1,10,10,10,0,3": {"grid_width": 4096, "grid_height": 4096, "block_size_x": 16, "block_size_y": 4, "tile_size_x": 8, "tile_size_y": 1, "temporal_tiling_factor": 10, "max_tfactor": 10, "loop_unroll_factor_t": 10, "sh_power": 0, "blocks_per_sm": 3, "time": 50.78225779533386, "times": [50.78105545043945, 50.72902297973633, 50.73100662231445, 50.724735260009766, 50.73100662231445, 50.727935791015625, 50.725887298583984, 50.73408126831055, 50.727935791015625, 50.73408126831055, 50.733055114746094, 50.73100662231445, 50.733055114746094, 50.735008239746094, 50.73100662231445, 50.727935791015625, 50.73420715332031, 50.73091125488281, 50.73827362060547, 50.73408126831055, 50.73408126831055, 50.734046936035156, 50.73513412475586, 50.90604782104492, 51.08204650878906, 50.8804817199707, 50.881534576416016, 50.87846374511719, 50.87948989868164, 50.883583068847656, 50.87948989868164, 50.88256072998047], "compile_time": 1305.3093190537766, "verification_time": 0, "benchmark_time": 1626.732942997478, "GFLOP/s": 49.55633146801985, "strategy_time": 0.008967006579041481, "framework_time": 1.4187430497258902, "timestamp": "2025-04-07 23:24:24.447220+00:00", "gridpoints/s": 3303755431.2013235}, "4096,4096,4,32,3,4,9,10,3,0,2": {"grid_width": 4096, "grid_height": 4096, "block_size_x": 4, "block_size_y": 32, "tile_size_x": 3, "tile_size_y": 4, "temporal_tiling_factor": 9, "max_tfactor": 10, "loop_unroll_factor_t": 3, "sh_power": 0, "blocks_per_sm": 2, "time": 25.504352807998657, "times": [25.556991577148438, 25.518047332763672, 25.49964714050293, 25.49555206298828, 25.50271987915039, 25.50374412536621, 25.4781436920166, 25.490367889404297, 25.491455078125, 25.49350357055664, 25.475967407226562, 25.51603126525879, 25.5098876953125, 25.51910400390625, 25.49964714050293, 25.476032257080078, 25.480192184448242, 25.51705551147461, 25.51705551147461, 25.523040771484375, 25.518943786621094, 25.499584197998047, 25.50271987915039, 25.506816864013672, 25.497472763061523, 25.51091194152832, 25.52934455871582, 25.47590446472168, 25.49964714050293, 25.52422332763672, 25.50169563293457, 25.50783920288086], "compile_time": 990.0104469852522, "verification_time": 0, "benchmark_time": 817.7033469546586, "GFLOP/s": 88.80539635923151, "strategy_time": 0.009377952665090561, "framework_time": 1.4705010689795017, "timestamp": "2025-04-07 23:24:26.256449+00:00", "gridpoints/s": 5920359757.282101}, "4096,4096,8,16,2,2,6,10,6,0,2": {"grid_width": 4096, "grid_height": 4096, "block_size_x": 8, "block_size_y": 16, "tile_size_x": 2, "tile_size_y": 2, "temporal_tiling_factor": 6, "max_tfactor": 10, "loop_unroll_factor_t": 6, "sh_power": 0, "blocks_per_sm": 2, "time": 17.801522850990295, "times": [17.853439331054688, 17.80512046813965, 17.80019187927246, 17.80019187927246, 17.80019187927246, 17.803264617919922, 17.79814338684082, 17.797119140625, 17.79814338684082, 17.79916763305664, 17.80019187927246, 17.799135208129883, 17.79814338684082, 17.798112869262695, 17.7992000579834, 17.8022403717041, 17.800064086914062, 17.80121612548828, 17.79916763305664, 17.79916763305664, 17.80019187927246, 17.797119140625, 17.80121612548828, 17.800128936767578, 17.79814338684082, 17.80019187927246, 17.79916763305664, 17.80121612548828, 17.80121612548828, 17.80121612548828, 17.80019187927246, 17.797119140625], "compile_time": 1056.870462023653, "verification_time": 0, "benchmark_time": 570.8899130113423, "GFLOP/s": 84.82136346644083, "strategy_time": 0.0101790064945817, "framework_time": 1.413194928318262, "timestamp": "2025-04-07 23:24:27.885665+00:00", "gridpoints/s": 5654757564.429388}, "4096,4096,16,4,9,1,8,10,2,1,2": {"grid_width": 4096, "grid_height": 4096, "block_size_x": 16, "block_size_y": 4, "tile_size_x": 9, "tile_size_y": 1, "temporal_tiling_factor": 8, "max_tfactor": 10, "loop_unroll_factor_t": 2, "sh_power": 1, "blocks_per_sm": 2, "time": 35.48216497898102, "times": [35.560447692871094, 35.52153778076172, 35.42937469482422, 35.51948928833008, 35.48672103881836, 35.47430419921875, 35.43244934082031, 35.4600944519043, 35.48876953125, 35.507198333740234, 35.49593734741211, 35.51945495605469, 35.48057556152344, 35.4703369140625, 35.523582458496094, 35.4600944519043, 35.48057556152344, 35.48774337768555, 35.4785270690918, 35.48262405395508, 35.42220687866211, 35.4785270690918, 35.47443389892578, 35.518463134765625, 35.42323303222656, 35.514366149902344, 35.45804977416992, 35.44985580444336, 35.46521759033203, 35.472320556640625, 35.49184036254883, 35.50092697143555], "compile_time": 793.8279189402238, "verification_time": 0, "benchmark_time": 1136.812089011073, "GFLOP/s": 56.74022205783163, "strategy_time": 0.009548035450279713, "framework_time": 1.540520926937461, "timestamp": "2025-04-07 23:24:29.817886+00:00", "gridpoints/s": 3782681470.5221086}, "4096,4096,32,1,7,4,4,10,2,1,2": {"grid_width": 4096, "grid_height": 4096, "block_size_x": 32, "block_size_y": 1, "tile_size_x": 7, "tile_size_y": 4, "temporal_tiling_factor": 4, "max_tfactor": 10, "loop_unroll_factor_t": 2, "sh_power": 1, "blocks_per_sm": 2, "time": 19.159414052963257, "times": [19.23686408996582, 19.156991958618164, 19.166208267211914, 19.184640884399414, 19.184640884399414, 19.154943466186523, 19.142719268798828, 19.133440017700195, 19.161088943481445, 19.159040451049805, 19.183616638183594, 19.167232513427734, 19.12713623046875, 19.197952270507812, 19.189760208129883, 19.153919219970703, 19.149824142456055, 19.163135528564453, 19.140607833862305, 19.125152587890625, 19.170303344726562, 19.142656326293945, 19.153919219970703, 19.127296447753906, 19.146751403808594, 19.124223709106445, 19.163135528564453, 19.175296783447266, 19.140607833862305, 19.170303344726562, 19.161088943481445, 19.146751403808594], "compile_time": 820.8823259919882, "verification_time": 0, "benchmark_time": 614.5886060548946, "GFLOP/s": 52.539861460132215, "strategy_time": 0.008887029252946377, "framework_time": 1.3739998685196042, "timestamp": "2025-04-07 23:24:31.254771+00:00", "gridpoints/s": 3502657430.6754813}, "4096,4096,64,1,3,1,7,10,7,0,1": {"grid_width": 4096, "grid_height": 4096, "block_size_x": 64, "block_size_y": 1, "tile_size_x": 3, "tile_size_y": 1, "temporal_tiling_factor": 7, "max_tfactor": 10, "loop_unroll_factor_t": 7, "sh_power": 0, "blocks_per_sm": 1, "time": 116.80911111831665, "times": [116.84761810302734, 116.8189468383789, 116.81587219238281, 116.81177520751953, 116.8199691772461, 116.80361938476562, 116.81177520751953, 116.81791687011719, 116.8136978149414, 116.80870056152344, 116.81075286865234, 116.8055648803711, 116.81791687011719, 116.82406616210938, 116.80461120605469, 116.79641723632812, 116.80563354492188, 116.80973052978516, 116.81075286865234, 116.80358123779297, 116.80767822265625, 116.80767822265625, 116.80870056152344, 116.8005142211914, 116.80767822265625, 116.80255889892578, 116.80870056152344, 116.79641723632812, 116.79232025146484, 116.80461120605469, 116.80857849121094, 116.78720092773438], "compile_time": 1118.0943519575521, "verification_time": 0, "benchmark_time": 3739.1516730422154, "GFLOP/s": 15.08108111717122, "strategy_time": 0.009377952665090561, "framework_time": 1.3929260894656181, "timestamp": "2025-04-07 23:24:36.113451+00:00", "gridpoints/s": 1005405407.8114146}, "4096,4096,32,1,8,4,8,10,4,0,0": {"grid_width": 4096, "grid_height": 4096, "block_size_x": 32, "block_size_y": 1, "tile_size_x": 8, "tile_size_y": 4, "temporal_tiling_factor": 8, "max_tfactor": 10, "loop_unroll_factor_t": 4, "sh_power": 0, "blocks_per_sm": 0, "time": 44.38185119628906, "times": [44.42931365966797, 44.38016128540039, 44.3955192565918, 44.400577545166016, 44.37299346923828, 44.38220977783203, 44.4128303527832, 44.36991882324219, 44.39449691772461, 44.38118362426758, 44.38220977783203, 44.37401580810547, 44.38323211669922, 44.36684799194336, 44.36787033081055, 44.38323211669922, 44.375038146972656, 44.39756774902344, 44.37299346923828, 44.36582565307617, 44.40473556518555, 44.36070251464844, 44.39961624145508, 44.39244842529297, 44.37299346923828, 44.38630294799805, 44.37606430053711, 44.35456085205078, 44.36172866821289, 44.37401580810547, 44.37913513183594, 44.368896484375], "compile_time": 1036.0261560417712, "verification_time": 0, "benchmark_time": 1421.6812669765204, "GFLOP/s": 45.362369205733735, "strategy_time": 0.009206938557326794, "framework_time": 1.524734077975154, "timestamp": "2025-04-07 23:24:38.572725+00:00", "gridpoints/s": 3024157947.0489154}, "4096,4096,8,4,4,9,5,10,1,1,2": {"grid_width": 4096, "grid_height": 4096, "block_size_x": 8, "block_size_y": 4, "tile_size_x": 4, "tile_size_y": 9, "temporal_tiling_factor": 5, "max_tfactor": 10, "loop_unroll_factor_t": 1, "sh_power": 1, "blocks_per_sm": 2, "time": 9.788885027170181, "times": [9.834495544433594, 9.793696403503418, 9.783295631408691, 9.783295631408691, 9.791487693786621, 9.780223846435547, 9.779040336608887, 9.786368370056152, 9.794560432434082, 9.771903991699219, 9.783295631408691, 9.795552253723145, 9.801728248596191, 9.792511940002441, 9.791487693786621, 9.781248092651367, 9.77609634399414, 9.786368370056152, 9.790464401245117, 9.791487693786621, 9.791487693786621, 9.789440155029297, 9.798656463623047, 9.779199600219727, 9.794560432434082, 9.79036808013916, 9.797568321228027, 9.792511940002441, 9.779199600219727, 9.789440155029297, 9.792511940002441, 9.760767936706543], "compile_time": 811.4527199650183, "verification_time": 0, "benchmark_time": 314.7984950337559, "GFLOP/s": 128.54285207227048, "strategy_time": 0.009807990863919258, "framework_time": 1.5337510267272592, "timestamp": "2025-04-07 23:24:39.700551+00:00", "gridpoints/s": 8569523471.484698}, "4096,4096,32,1,4,9,3,10,3,0,3": {"grid_width": 4096, "grid_height": 4096, "block_size_x": 32, "block_size_y": 1, "tile_size_x": 4, "tile_size_y": 9, "temporal_tiling_factor": 3, "max_tfactor": 10, "loop_unroll_factor_t": 3, "sh_power": 0, "blocks_per_sm": 3, "time": 6.056586965918541, "times": [6.111231803894043, 6.0649919509887695, 6.060031890869141, 6.054912090301514, 6.053887844085693, 6.052864074707031, 6.052864074707031, 6.0548481941223145, 6.052864074707031, 6.055935859680176, 6.054815769195557, 6.053887844085693, 6.053728103637695, 6.052735805511475, 6.057983875274658, 6.051839828491211, 6.053887844085693, 6.053887844085693, 6.054912090301514, 6.053887844085693, 6.054912090301514, 6.053887844085693, 6.052864074707031, 6.057983875274658, 6.052864074707031, 6.0590081214904785, 6.053887844085693, 6.052864074707031, 6.050784111022949, 6.054912090301514, 6.0569281578063965, 6.053887844085693], "compile_time": 920.8472809987143, "verification_time": 0, "benchmark_time": 195.7310540601611, "GFLOP/s": 124.65349284149191, "strategy_time": 0.008906004950404167, "framework_time": 1.6611990286037326, "timestamp": "2025-04-07 23:24:40.818830+00:00", "gridpoints/s": 8310232856.099461}, "4096,4096,64,4,2,2,8,10,1,0,2": {"grid_width": 4096, "grid_height": 4096, "block_size_x": 64, "block_size_y": 4, "tile_size_x": 2, "tile_size_y": 2, "temporal_tiling_factor": 8, "max_tfactor": 10, "loop_unroll_factor_t": 1, "sh_power": 0, "blocks_per_sm": 2, "time": 25.52618783712387, "times": [25.575424194335938, 25.52729606628418, 25.52524757385254, 25.5231990814209, 25.523296356201172, 25.52524757385254, 25.52627182006836, 25.52115249633789, 25.5231990814209, 25.52524757385254, 25.52524757385254, 25.52524757385254, 25.5231990814209, 25.524032592773438, 25.52217674255371, 25.52115249633789, 25.52422332763672, 25.52217674255371, 25.52217674255371, 25.52217674255371, 25.523103713989258, 25.52524757385254, 25.52422332763672, 25.52422332763672, 25.54265594482422, 25.52524757385254, 25.5231990814209, 25.52422332763672, 25.5251522064209, 25.52409553527832, 25.52614402770996, 25.523103713989258], "compile_time": 810.7422300381586, "verification_time": 0, "benchmark_time": 818.0578199680895, "GFLOP/s": 78.87060664311251, "strategy_time": 0.009056995622813702, "framework_time": 1.5479869907721877, "timestamp": "2025-04-07 23:24:42.449218+00:00", "gridpoints/s": 5258040442.8741665}, "4096,4096,4,8,6,4,4,10,2,0,4": {"grid_width": 4096, "grid_height": 4096, "block_size_x": 4, "block_size_y": 8, "tile_size_x": 6, "tile_size_y": 4, "temporal_tiling_factor": 4, "max_tfactor": 10, "loop_unroll_factor_t": 2, "sh_power": 0, "blocks_per_sm": 4, "time": 8.656372994184494, "times": [8.699904441833496, 8.669183731079102, 8.65071964263916, 8.648703575134277, 8.648703575134277, 8.648608207702637, 8.664064407348633, 8.663040161132812, 8.647583961486816, 8.648703575134277, 8.662015914916992, 8.665087699890137, 8.664064407348633, 8.665087699890137, 8.647680282592773, 8.664992332458496, 8.645631790161133, 8.645631790161133, 8.646656036376953, 8.664064407348633, 8.646656036376953, 8.665056228637695, 8.645631790161133, 8.664064407348633, 8.646656036376953, 8.645631790161133, 8.646656036376953, 8.645631790161133, 8.648703575134277, 8.664064407348633, 8.663040161132812, 8.662015914916992], "compile_time": 872.3614090122283, "verification_time": 0, "benchmark_time": 278.391067055054, "GFLOP/s": 116.28807592698165, "strategy_time": 0.00909692607820034, "framework_time": 1.4881739625707269, "timestamp": "2025-04-07 23:24:43.601497+00:00", "gridpoints/s": 7752538395.13211}, "4096,4096,256,2,2,1,4,10,2,0,0": {"grid_width": 4096, "grid_height": 4096, "block_size_x": 256, "block_size_y": 2, "tile_size_x": 2, "tile_size_y": 1, "temporal_tiling_factor": 4, "max_tfactor": 10, "loop_unroll_factor_t": 2, "sh_power": 0, "blocks_per_sm": 0, "time": 14.807089000940323, "times": [14.858240127563477, 14.810015678405762, 14.809087753295898, 14.80396842956543, 14.806015968322754, 14.805983543395996, 14.804991722106934, 14.806015968322754, 14.80396842956543, 14.807040214538574, 14.806015968322754, 14.807040214538574, 14.80396842956543, 14.804991722106934, 14.807040214538574, 14.806976318359375, 14.807040214538574, 14.803903579711914, 14.80396842956543, 14.804991722106934, 14.806015968322754, 14.801919937133789, 14.80294418334961, 14.80294418334961, 14.804991722106934, 14.806976318359375, 14.804991722106934, 14.804991722106934, 14.80294418334961, 14.806879997253418, 14.804991722106934, 14.804991722106934], "compile_time": 831.1238199239597, "verification_time": 0, "benchmark_time": 474.880418041721, "GFLOP/s": 67.98317751288411, "strategy_time": 0.009538023732602596, "framework_time": 1.34306401014328, "timestamp": "2025-04-07 23:24:44.908885+00:00", "gridpoints/s": 4532211834.192274}, "4096,4096,16,16,3,3,3,10,3,0,2": {"grid_width": 4096, "grid_height": 4096, "block_size_x": 16, "block_size_y": 16, "tile_size_x": 3, "tile_size_y": 3, "temporal_tiling_factor": 3, "max_tfactor": 10, "loop_unroll_factor_t": 3, "sh_power": 0, "blocks_per_sm": 2, "time": 8.421974927186966, "times": [8.473600387573242, 8.423423767089844, 8.423423767089844, 8.423423767089844, 8.419327735900879, 8.4203519821167, 8.42137622833252, 8.4203519821167, 8.419327735900879, 8.4203519821167, 8.42131233215332, 8.419327735900879, 8.4203519821167, 8.4203519821167, 8.419327735900879, 8.418304443359375, 8.419327735900879, 8.419360160827637, 8.4203519821167, 8.4203519821167, 8.42137622833252, 8.419327735900879, 8.419327735900879, 8.419327735900879, 8.41919994354248, 8.420319557189941, 8.419327735900879, 8.42137622833252, 8.420319557189941, 8.419327735900879, 8.419327735900879, 8.42131233215332], "compile_time": 880.574146984145, "verification_time": 0, "benchmark_time": 270.4438449582085, "GFLOP/s": 89.64343001816202, "strategy_time": 0.008776085451245308, "framework_time": 1.3818159932270646, "timestamp": "2025-04-07 23:24:46.061326+00:00", "gridpoints/s": 5976228667.877468}, "4096,4096,2,32,7,3,4,10,1,1,2": {"grid_width": 4096, "grid_height": 4096, "block_size_x": 2, "block_size_y": 32, "tile_size_x": 7, "tile_size_y": 3, "temporal_tiling_factor": 4, "max_tfactor": 10, "loop_unroll_factor_t": 1, "sh_power": 1, "blocks_per_sm": 2, "time": 7.784001007676125, "times": [7.8438401222229, 7.789567947387695, 7.792640209197998, 7.782400131225586, 7.786496162414551, 7.7854719161987305, 7.775231838226318, 7.7751359939575195, 7.775328159332275, 7.776256084442139, 7.782400131225586, 7.787519931793213, 7.779327869415283, 7.7854719161987305, 7.787519931793213, 7.7854719161987305, 7.787519931793213, 7.789567947387695, 7.787519931793213, 7.784448146820068, 7.773280143737793, 7.779327869415283, 7.787487983703613, 7.788544178009033, 7.788512229919434, 7.774208068847656, 7.777279853820801, 7.775231838226318, 7.777279853820801, 7.772160053253174, 7.778304100036621, 7.777279853820801], "compile_time": 778.5413630772382, "verification_time": 0, "benchmark_time": 250.85351499728858, "GFLOP/s": 129.32076434822113, "strategy_time": 0.009287032298743725, "framework_time": 1.3986468547955155, "timestamp": "2025-04-07 23:24:47.092161+00:00", "gridpoints/s": 8621384289.881409}, "4096,4096,96,4,1,3,4,10,2,0,1": {"grid_width": 4096, "grid_height": 4096, "block_size_x": 96, "block_size_y": 4, "tile_size_x": 1, "tile_size_y": 3, "temporal_tiling_factor": 4, "max_tfactor": 10, "loop_unroll_factor_t": 2, "sh_power": 0, "blocks_per_sm": 1, "time": 10.191668957471848, "times": [10.244095802307129, 10.196895599365234, 10.194944381713867, 10.191807746887207, 10.190848350524902, 10.191871643066406, 10.188799858093262, 10.190848350524902, 10.191871643066406, 10.188896179199219, 10.187775611877441, 10.190848350524902, 10.188799858093262, 10.187775611877441, 10.188799858093262, 10.187775611877441, 10.189663887023926, 10.191807746887207, 10.188799858093262, 10.186752319335938, 10.190848350524902, 10.189824104309082, 10.189824104309082, 10.191871643066406, 10.189824104309082, 10.189824104309082, 10.189824104309082, 10.187775611877441, 10.188799858093262, 10.188672065734863, 10.186816215515137, 10.189824104309082], "compile_time": 704.3572310358286, "verification_time": 0, "benchmark_time": 327.3179929237813, "GFLOP/s": 98.77017828978876, "strategy_time": 0.008875969797372818, "framework_time": 1.5171500854194164, "timestamp": "2025-04-07 23:24:48.125393+00:00", "gridpoints/s": 6584678552.652584}, "4096,4096,16,8,9,2,3,10,1,0,0": {"grid_width": 4096, "grid_height": 4096, "block_size_x": 16, "block_size_y": 8, "tile_size_x": 9, "tile_size_y": 2, "temporal_tiling_factor": 3, "max_tfactor": 10, "loop_unroll_factor_t": 1, "sh_power": 0, "blocks_per_sm": 0, "time": 5.204708948731422, "times": [5.258080005645752, 5.2008957862854, 5.201920032501221, 5.206975936889648, 5.206975936889648, 5.2008957862854, 5.203775882720947, 5.208064079284668, 5.200960159301758, 5.2008957862854, 5.199872016906738, 5.205887794494629, 5.199872016906738, 5.2008957862854, 5.199711799621582, 5.198847770690918, 5.201920032501221, 5.198847770690918, 5.201920032501221, 5.199872016906738, 5.222400188446045, 5.212160110473633, 5.195775985717773, 5.199872016906738, 5.203968048095703, 5.196800231933594, 5.213183879852295, 5.201920032501221, 5.20908784866333, 5.198847770690918, 5.199872016906738, 5.199711799621582], "compile_time": 834.2824920546263, "verification_time": 0, "benchmark_time": 167.66203800216317, "GFLOP/s": 145.0560881380341, "strategy_time": 0.009597977623343468, "framework_time": 1.447157934308052, "timestamp": "2025-04-07 23:24:49.128828+00:00", "gridpoints/s": 9670405875.86894}, "4096,4096,2,32,4,1,4,10,1,1,2": {"grid_width": 4096, "grid_height": 4096, "block_size_x": 2, "block_size_y": 32, "tile_size_x": 4, "tile_size_y": 1, "temporal_tiling_factor": 4, "max_tfactor": 10, "loop_unroll_factor_t": 1, "sh_power": 1, "blocks_per_sm": 2, "time": 10.841813892126083, "times": [10.890239715576172, 10.845088005065918, 10.844032287597656, 10.84006404876709, 10.83903980255127, 10.84006404876709, 10.841983795166016, 10.83903980255127, 10.84006404876709, 10.84006404876709, 10.84006404876709, 10.83903980255127, 10.85427188873291, 10.84006404876709, 10.839103698730469, 10.84006404876709, 10.83903980255127, 10.83903980255127, 10.83903980255127, 10.83903980255127, 10.84006404876709, 10.83801555633545, 10.83801555633545, 10.83801555633545, 10.84006404876709, 10.84006404876709, 10.840160369873047, 10.84006404876709, 10.83801555633545, 10.83903980255127, 10.83903980255127, 10.83903980255127], "compile_time": 747.3593009635806, "verification_time": 0, "benchmark_time": 348.65532210096717, "GFLOP/s": 92.84728275321822, "strategy_time": 0.009196926839649677, "framework_time": 1.5571750700473785, "timestamp": "2025-04-07 23:24:50.226439+00:00", "gridpoints/s": 6189818850.214549}, "4096,4096,16,4,4,9,2,10,2,1,3": {"grid_width": 4096, "grid_height": 4096, "block_size_x": 16, "block_size_y": 4, "tile_size_x": 4, "tile_size_y": 9, "temporal_tiling_factor": 2, "max_tfactor": 10, "loop_unroll_factor_t": 2, "sh_power": 1, "blocks_per_sm": 3, "time": 3.303103029727936, "times": [3.3556480407714844, 3.3075199127197266, 3.3024001121520996, 3.3013761043548584, 3.3075199127197266, 3.299168109893799, 3.299328088760376, 3.300352096557617, 3.2972800731658936, 3.3024001121520996, 3.299328088760376, 3.300352096557617, 3.3034238815307617, 3.2983040809631348, 3.299328088760376, 3.300352096557617, 3.3004159927368164, 3.3023359775543213, 3.3013761043548584, 3.3034238815307617, 3.2983040809631348, 3.299328088760376, 3.2972800731658936, 3.2972800731658936, 3.299328088760376, 3.3013761043548584, 3.3064959049224854, 3.304447889328003, 3.304447889328003, 3.305471897125244, 3.3024001121520996, 3.301503896713257], "compile_time": 813.7540959287435, "verification_time": 0, "benchmark_time": 106.8572229705751, "GFLOP/s": 152.37686365522066, "strategy_time": 0.009387964382767677, "framework_time": 1.4610441867262125, "timestamp": "2025-04-07 23:24:51.148551+00:00", "gridpoints/s": 10158457577.014711}, "4096,4096,2,16,6,8,8,10,1,0,3": {"grid_width": 4096, "grid_height": 4096, "block_size_x": 2, "block_size_y": 16, "tile_size_x": 6, "tile_size_y": 8, "temporal_tiling_factor": 8, "max_tfactor": 10, "loop_unroll_factor_t": 1, "sh_power": 0, "blocks_per_sm": 3, "time": 21.04116690158844, "times": [21.147647857666016, 21.113887786865234, 21.13555145263672, 21.108736038208008, 21.07904052734375, 21.079999923706055, 21.1015682220459, 21.090303421020508, 21.099519729614258, 21.098495483398438, 21.0882568359375, 21.099519729614258, 21.06768035888672, 21.081087112426758, 21.122047424316406, 21.09235191345215, 21.110591888427734, 21.100383758544922, 21.091327667236328, 21.089279174804688, 21.102432250976562, 21.0882568359375, 20.968448638916016, 20.907007217407227, 20.912128448486328, 20.919296264648438, 20.904863357543945, 20.912128448486328, 20.899839401245117, 20.890623092651367, 20.902912139892578, 20.912128448486328], "compile_time": 874.891031999141, "verification_time": 0, "benchmark_time": 674.7837699949741, "GFLOP/s": 95.6822370839145, "strategy_time": 0.0096180010586977, "framework_time": 1.3406990328803658, "timestamp": "2025-04-07 23:24:52.699608+00:00", "gridpoints/s": 6378815805.5943}, "4096,4096,4,8,3,7,10,10,1,1,0": {"grid_width": 4096, "grid_height": 4096, "block_size_x": 4, "block_size_y": 8, "tile_size_x": 3, "tile_size_y": 7, "temporal_tiling_factor": 10, "max_tfactor": 10, "loop_unroll_factor_t": 1, "sh_power": 1, "blocks_per_sm": 0, "time": 38.02258479595184, "times": [38.08153533935547, 38.00883102416992, 38.014976501464844, 38.0313606262207, 38.0283203125, 38.032318115234375, 38.0313606262207, 38.02009582519531, 38.028289794921875, 38.004608154296875, 38.0211181640625, 38.019073486328125, 38.02316665649414, 38.01087951660156, 38.033409118652344, 37.99961471557617, 38.0241584777832, 38.03033447265625, 38.01599884033203, 38.0313606262207, 38.033409118652344, 38.016990661621094, 38.011905670166016, 37.99039840698242, 38.01804733276367, 38.02214431762695, 38.03647994995117, 38.03033447265625, 38.01804733276367, 38.009857177734375, 38.01599884033203, 38.028289794921875], "compile_time": 782.5945370132104, "verification_time": 0, "benchmark_time": 1218.0205140030012, "GFLOP/s": 66.18651555398552, "strategy_time": 0.009668059647083282, "framework_time": 1.4029459562152624, "timestamp": "2025-04-07 23:24:54.701666+00:00", "gridpoints/s": 4412434370.2657}, "4096,4096,8,8,8,6,10,10,1,0,0": {"grid_width": 4096, "grid_height": 4096, "block_size_x": 8, "block_size_y": 8, "tile_size_x": 8, "tile_size_y": 6, "temporal_tiling_factor": 10, "max_tfactor": 10, "loop_unroll_factor_t": 1, "sh_power": 0, "blocks_per_sm": 0, "time": 21.013712882995605, "times": [21.01043128967285, 21.02886390686035, 21.028799057006836, 21.025951385498047, 21.021696090698242, 21.02783966064453, 20.976640701293945, 21.015520095825195, 21.00819206237793, 21.01968002319336, 21.009408950805664, 20.995071411132812, 21.004287719726562, 21.006336212158203, 21.007328033447266, 21.02569580078125, 21.02681541442871, 20.993024826049805, 21.015552520751953, 21.02467155456543, 20.988800048828125, 21.008384704589844, 21.034975051879883, 21.03500747680664, 21.02579116821289, 20.986879348754883, 21.000192642211914, 20.981760025024414, 21.03500747680664, 21.0196475982666, 21.023744583129883, 21.02681541442871], "compile_time": 885.3679379681125, "verification_time": 0, "benchmark_time": 673.8045670790598, "GFLOP/s": 119.75905514710017, "strategy_time": 0.009277020581066608, "framework_time": 1.5631659189239144, "timestamp": "2025-04-07 23:24:56.262441+00:00", "gridpoints/s": 7983937009.806678}, "4096,4096,8,16,1,2,2,10,2,1,3": {"grid_width": 4096, "grid_height": 4096, "block_size_x": 8, "block_size_y": 16, "tile_size_x": 1, "tile_size_y": 2, "temporal_tiling_factor": 2, "max_tfactor": 10, "loop_unroll_factor_t": 2, "sh_power": 1, "blocks_per_sm": 3, "time": 4.626327008008957, "times": [4.678656101226807, 4.630527973175049, 4.626431941986084, 4.625408172607422, 4.626431941986084, 4.625408172607422, 4.624383926391602, 4.624288082122803, 4.624383926391602, 4.625311851501465, 4.624383926391602, 4.624288082122803, 4.624383926391602, 4.6253437995910645, 4.624383926391602, 4.6233601570129395, 4.624383926391602, 4.625408172607422, 4.624383926391602, 4.624383926391602, 4.6233601570129395, 4.624383926391602, 4.624351978302002, 4.6242241859436035, 4.6233601570129395, 4.623456001281738, 4.624447822570801, 4.622432231903076, 4.624383926391602, 4.624383926391602, 4.6233601570129395, 4.624383926391602], "compile_time": 759.2953270068392, "verification_time": 0, "benchmark_time": 149.55899200867862, "GFLOP/s": 108.79396962831935, "strategy_time": 0.009487033821642399, "framework_time": 1.4922328991815448, "timestamp": "2025-04-07 23:24:57.172828+00:00", "gridpoints/s": 7252931308.554624}, "4096,4096,2,16,4,1,4,10,2,1,2": {"grid_width": 4096, "grid_height": 4096, "block_size_x": 2, "block_size_y": 16, "tile_size_x": 4, "tile_size_y": 1, "temporal_tiling_factor": 4, "max_tfactor": 10, "loop_unroll_factor_t": 2, "sh_power": 1, "blocks_per_sm": 2, "time": 13.816752940416336, "times": [13.872127532958984, 13.818880081176758, 13.819904327392578, 13.814784049987793, 13.815808296203613, 13.816831588745117, 13.816831588745117, 13.814784049987793, 13.814623832702637, 13.814784049987793, 13.813759803771973, 13.815679550170898, 13.814687728881836, 13.814784049987793, 13.814784049987793, 13.814784049987793, 13.815808296203613, 13.814784049987793, 13.813728332519531, 13.812735557556152, 13.813759803771973, 13.816831588745117, 13.813664436340332, 13.812895774841309, 13.814623832702637, 13.813759803771973, 13.815808296203613, 13.814784049987793, 13.814784049987793, 13.81276798248291, 13.813759803771973, 13.813759803771973], "compile_time": 776.9891670905054, "verification_time": 0, "benchmark_time": 442.98967090435326, "GFLOP/s": 72.85597161221783, "strategy_time": 0.00871601514518261, "framework_time": 1.5014209784567356, "timestamp": "2025-04-07 23:24:58.394347+00:00", "gridpoints/s": 4857064774.147856}, "4096,4096,2,32,5,1,10,10,10,1,0": {"grid_width": 4096, "grid_height": 4096, "block_size_x": 2, "block_size_y": 32, "tile_size_x": 5, "tile_size_y": 1, "temporal_tiling_factor": 10, "max_tfactor": 10, "loop_unroll_factor_t": 10, "sh_power": 1, "blocks_per_sm": 0, "time": 40.334861159324646, "times": [40.386558532714844, 40.33843231201172, 40.3322868347168, 40.33331298828125, 40.33536148071289, 40.33536148071289, 40.33427047729492, 40.33331298828125, 40.33331298828125, 40.33420944213867, 40.33932876586914, 40.33420944213867, 40.333152770996094, 40.33126449584961, 40.33331298828125, 40.33126449584961, 40.33126449584961, 40.33126449584961, 40.33331298828125, 40.33126449584961, 40.3322868347168, 40.33433532714844, 40.330238342285156, 40.3322868347168, 40.3322868347168, 40.3322868347168, 40.33331298828125, 40.33536148071289, 40.33126449584961, 40.33331298828125, 40.3322868347168, 40.330238342285156], "compile_time": 1130.6879080366343, "verification_time": 0, "benchmark_time": 1292.591018951498, "GFLOP/s": 62.392241541612805, "strategy_time": 0.009228009730577469, "framework_time": 1.38778705149889, "timestamp": "2025-04-07 23:25:00.819055+00:00", "gridpoints/s": 4159482769.440854}, "4096,4096,128,4,1,3,2,10,2,1,0": {"grid_width": 4096, "grid_height": 4096, "block_size_x": 128, "block_size_y": 4, "tile_size_x": 1, "tile_size_y": 3, "temporal_tiling_factor": 2, "max_tfactor": 10, "loop_unroll_factor_t": 2, "sh_power": 1, "blocks_per_sm": 0, "time": 3.511860027909279, "times": [3.561471939086914, 3.5153920650482178, 3.512320041656494, 3.5102720260620117, 3.511296033859253, 3.5174400806427, 3.51145601272583, 3.511136054992676, 3.5102720260620117, 3.511296033859253, 3.511296033859253, 3.511136054992676, 3.509216070175171, 3.5