compare_real_world_impact/results/hotspot/A4000_f=pyatf_i=7.json
{"device_name": "NVIDIA RTX A4000", "kernel_name": "calculate_temp", "problem_size": [4096, 4096], "tune_params_keys": ["grid_width", "grid_height", "block_size_x", "block_size_y", "tile_size_x", "tile_size_y", "temporal_tiling_factor", "max_tfactor", "loop_unroll_factor_t", "sh_power", "blocks_per_sm"], "tune_params": {"grid_width": [4096], "grid_height": [4096], "block_size_x": [1, 2, 4, 8, 16, 32, 64, 96, 128, 160, 192, 224, 256, 288, 320, 352, 384, 416, 448, 480, 512, 544, 576, 608, 640, 672, 704, 736, 768, 800, 832, 864, 896, 928, 960, 992, 1024], "block_size_y": [1, 2, 4, 8, 16, 32], "tile_size_x": [1, 2, 3, 4, 5, 6, 7, 8, 9, 10], "tile_size_y": [1, 2, 3, 4, 5, 6, 7, 8, 9, 10], "temporal_tiling_factor": [1, 2, 3, 4, 5, 6, 7, 8, 9, 10], "max_tfactor": [10], "loop_unroll_factor_t": [1, 2, 3, 4, 5, 6, 7, 8, 9, 10], "sh_power": [0, 1], "blocks_per_sm": [0, 1, 2, 3, 4]}, "objective": "GFLOP/s", "cache": {"4096,4096,16,4,8,3,2,10,2,0,0": {"grid_width": 4096, "grid_height": 4096, "block_size_x": 16, "block_size_y": 4, "tile_size_x": 8, "tile_size_y": 3, "temporal_tiling_factor": 2, "max_tfactor": 10, "loop_unroll_factor_t": 2, "sh_power": 0, "blocks_per_sm": 0, "time": 3.377069965004921, "times": [3.430272102355957, 3.3812479972839355, 3.3761279582977295, 3.3751039505004883, 3.378175973892212, 3.3771519660949707, 3.3751039505004883, 3.3751039505004883, 3.3759679794311523, 3.3761279582977295, 3.3761279582977295, 3.3730878829956055, 3.374079942703247, 3.3771519660949707, 3.3761279582977295, 3.373055934906006, 3.3761279582977295, 3.3751039505004883, 3.3750081062316895, 3.374079942703247, 3.374079942703247, 3.374079942703247, 3.379199981689453, 3.373055934906006, 3.375040054321289, 3.3751039505004883, 3.37391996383667, 3.374079942703247, 3.3751039505004883, 3.373055934906006, 3.374079942703247, 3.3751039505004883], "compile_time": 841.5759230265394, "verification_time": 0, "benchmark_time": 109.25127402879298, "GFLOP/s": 149.03939960250915, "strategy_time": 1075429.8275129404, "framework_time": 0, "timestamp": "2025-04-08 08:14:29.564885+00:00", "gridpoints/s": 9935959973.50061}, "4096,4096,2,16,4,7,9,10,3,0,0": {"grid_width": 4096, "grid_height": 4096, "block_size_x": 2, "block_size_y": 16, "tile_size_x": 4, "tile_size_y": 7, "temporal_tiling_factor": 9, "max_tfactor": 10, "loop_unroll_factor_t": 3, "sh_power": 0, "blocks_per_sm": 0, "time": 31.38857090473175, "times": [37.4200325012207, 37.46815872192383, 37.487518310546875, 37.43231964111328, 32.18841552734375, 30.455808639526367, 30.455808639526367, 30.439424514770508, 30.501888275146484, 30.435327529907227, 30.443519592285156, 30.481407165527344, 30.441471099853516, 30.448640823364258, 30.438400268554688, 30.457855224609375, 30.460927963256836, 30.478336334228516, 30.450687408447266, 30.478303909301758, 30.437376022338867, 30.520320892333984, 30.454784393310547, 30.45065689086914, 30.469120025634766, 30.451711654663086, 30.428159713745117, 30.497791290283203, 30.487552642822266, 30.487552642822266, 30.443519592285156, 30.441471099853516], "compile_time": 997.4630820797756, "verification_time": 0, "benchmark_time": 1006.1078100698069, "GFLOP/s": 72.15760688418497, "strategy_time": 0.008756062015891075, "framework_time": 1.9520638743415475, "timestamp": "2025-04-08 08:14:31.570449+00:00", "gridpoints/s": 4810507125.612331}, "4096,4096,8,16,1,8,6,10,2,0,2": {"grid_width": 4096, "grid_height": 4096, "block_size_x": 8, "block_size_y": 16, "tile_size_x": 1, "tile_size_y": 8, "temporal_tiling_factor": 6, "max_tfactor": 10, "loop_unroll_factor_t": 2, "sh_power": 0, "blocks_per_sm": 2, "time": 17.24465000629425, "times": [17.294336318969727, 17.24825668334961, 17.244159698486328, 17.240928649902344, 17.252159118652344, 17.24518394470215, 17.243135452270508, 17.24518394470215, 17.2410888671875, 17.2410888671875, 17.242080688476562, 17.238975524902344, 17.242111206054688, 17.244064331054688, 17.24006462097168, 17.24006462097168, 17.2410888671875, 17.243135452270508, 17.24403190612793, 17.23801612854004, 17.24518394470215, 17.244159698486328, 17.24518394470215, 17.23904037475586, 17.243104934692383, 17.244159698486328, 17.242111206054688, 17.244159698486328, 17.244159698486328, 17.242111206054688, 17.243135452270508, 17.243135452270508], "compile_time": 842.9948190459982, "verification_time": 0, "benchmark_time": 553.1255149981007, "GFLOP/s": 87.56045726929062, "strategy_time": 0.00859599094837904, "framework_time": 1.554999966174364, "timestamp": "2025-04-08 08:14:32.968168+00:00", "gridpoints/s": 5837363817.952708}, "4096,4096,32,4,9,1,2,10,2,0,1": {"grid_width": 4096, "grid_height": 4096, "block_size_x": 32, "block_size_y": 4, "tile_size_x": 9, "tile_size_y": 1, "temporal_tiling_factor": 2, "max_tfactor": 10, "loop_unroll_factor_t": 2, "sh_power": 0, "blocks_per_sm": 1, "time": 3.8797039687633514, "times": [3.932159900665283, 3.881983995437622, 3.8830080032348633, 3.8789119720458984, 3.879807949066162, 3.880959987640381, 3.8778879642486572, 3.8789119720458984, 3.876863956451416, 3.876863956451416, 3.8768320083618164, 3.8789119720458984, 3.877824068069458, 3.8778879642486572, 3.876863956451416, 3.876863956451416, 3.8778879642486572, 3.876863956451416, 3.876863956451416, 3.876863956451416, 3.877023935317993, 3.876863956451416, 3.8778879642486572, 3.876863956451416, 3.876863956451416, 3.8778879642486572, 3.8797760009765625, 3.8789119720458984, 3.875839948654175, 3.878848075866699, 3.876863956451416, 3.8758718967437744], "compile_time": 819.8338659713045, "verification_time": 0, "benchmark_time": 126.29095208831131, "GFLOP/s": 129.73064028914328, "strategy_time": 0.008126022294163704, "framework_time": 1.66498392354697, "timestamp": "2025-04-08 08:14:33.915998+00:00", "gridpoints/s": 8648709352.609552}, "4096,4096,16,4,6,10,4,10,2,0,1": {"grid_width": 4096, "grid_height": 4096, "block_size_x": 16, "block_size_y": 4, "tile_size_x": 6, "tile_size_y": 10, "temporal_tiling_factor": 4, "max_tfactor": 10, "loop_unroll_factor_t": 2, "sh_power": 0, "blocks_per_sm": 1, "time": 7.417340010404587, "times": [7.480319976806641, 7.41977596282959, 7.428095817565918, 7.428095817565918, 7.417856216430664, 7.393280029296875, 7.414783954620361, 7.409664154052734, 7.403520107269287, 7.400447845458984, 7.385087966918945, 7.403456211090088, 7.418879985809326, 7.4403839111328125, 7.434207916259766, 7.408639907836914, 7.4106879234313965, 7.418879985809326, 7.401472091674805, 7.384064197540283, 7.422976016998291, 7.4199042320251465, 7.434239864349365, 7.437312126159668, 7.425024032592773, 7.402495861053467, 7.413760185241699, 7.432191848754883, 7.414783954620361, 7.429215908050537, 7.417856216430664, 7.403520107269287], "compile_time": 931.8537700455636, "verification_time": 0, "benchmark_time": 238.74426796101034, "GFLOP/s": 135.71347121582096, "strategy_time": 0.0076249707490205765, "framework_time": 1.5836840029805899, "timestamp": "2025-04-08 08:14:35.088220+00:00", "gridpoints/s": 9047564747.721397}, "4096,4096,8,16,4,1,8,10,1,0,4": {"grid_width": 4096, "grid_height": 4096, "block_size_x": 8, "block_size_y": 16, "tile_size_x": 4, "tile_size_y": 1, "temporal_tiling_factor": 8, "max_tfactor": 10, "loop_unroll_factor_t": 1, "sh_power": 0, "blocks_per_sm": 4, "time": 21.841626226902008, "times": [21.89311981201172, 21.8470401763916, 21.841920852661133, 21.840896606445312, 21.838848114013672, 21.839712142944336, 21.841920852661133, 21.839872360229492, 21.841920852661133, 21.840896606445312, 21.839872360229492, 21.839872360229492, 21.83679962158203, 21.838848114013672, 21.839872360229492, 21.840864181518555, 21.839872360229492, 21.838848114013672, 21.839872360229492, 21.838848114013672, 21.838848114013672, 21.83782386779785, 21.83782386779785, 21.83679962158203, 21.83577537536621, 21.8470401763916, 21.838848114013672, 21.838848114013672, 21.840896606445312, 21.839872360229492, 21.840896606445312, 21.838848114013672], "compile_time": 807.7970200683922, "verification_time": 0, "benchmark_time": 700.635215966031, "GFLOP/s": 92.1756420096728, "strategy_time": 0.008174916729331017, "framework_time": 1.5800170367583632, "timestamp": "2025-04-08 08:14:36.598274+00:00", "gridpoints/s": 6145042800.644854}, "4096,4096,32,2,6,1,10,10,5,0,0": {"grid_width": 4096, "grid_height": 4096, "block_size_x": 32, "block_size_y": 2, "tile_size_x": 6, "tile_size_y": 1, "temporal_tiling_factor": 10, "max_tfactor": 10, "loop_unroll_factor_t": 5, "sh_power": 0, "blocks_per_sm": 0, "time": 94.59614658355713, "times": [94.271484375, 94.1998062133789, 94.19878387451172, 94.19058990478516, 94.19366455078125, 94.20185852050781, 94.22233581542969, 94.21408081054688, 94.19468688964844, 94.19468688964844, 94.42713928222656, 94.77120208740234, 94.7957763671875, 94.79065704345703, 94.78742218017578, 94.78656005859375, 94.74150085449219, 94.78553771972656, 94.79679870605469, 94.80089569091797, 94.80294036865234, 94.79065704345703, 94.75174713134766, 94.82035064697266, 94.77324676513672, 94.78348541259766, 94.81097412109375, 94.7619857788086, 94.77423858642578, 94.80601501464844, 94.82035064697266, 94.81523132324219], "compile_time": 1125.5398170324042, "verification_time": 0, "benchmark_time": 3028.419415000826, "GFLOP/s": 26.603434610067264, "strategy_time": 0.008986913599073887, "framework_time": 1.6138290520757437, "timestamp": "2025-04-08 08:14:40.753888+00:00", "gridpoints/s": 1773562307.3378177}, "4096,4096,32,2,6,1,2,10,2,1,2": {"grid_width": 4096, "grid_height": 4096, "block_size_x": 32, "block_size_y": 2, "tile_size_x": 6, "tile_size_y": 1, "temporal_tiling_factor": 2, "max_tfactor": 10, "loop_unroll_factor_t": 2, "sh_power": 1, "blocks_per_sm": 2, "time": 4.744075953960419, "times": [4.79641580581665, 4.749120235443115, 4.746175765991211, 4.741119861602783, 4.743167877197266, 4.743167877197266, 4.743167877197266, 4.743167877197266, 4.741119861602783, 4.7421441078186035, 4.741119861602783, 4.7421441078186035, 4.742080211639404, 4.740096092224121, 4.740992069244385, 4.741119861602783, 4.740096092224121, 4.741119861602783, 4.7421441078186035, 4.7420477867126465, 4.741119861602783, 4.7421441078186035, 4.740096092224121, 4.745215892791748, 4.741119861602783, 4.743072032928467, 4.743167877197266, 4.743167877197266, 4.741119861602783, 4.743167877197266, 4.7421441078186035, 4.743167877197266], "compile_time": 769.9238630011678, "verification_time": 0, "benchmark_time": 153.08721899054945, "GFLOP/s": 106.09368081044835, "strategy_time": 0.007864902727305889, "framework_time": 1.7180651193484664, "timestamp": "2025-04-08 08:14:41.678657+00:00", "gridpoints/s": 7072912054.02989}, "4096,4096,8,16,1,4,7,10,1,1,1": {"grid_width": 4096, "grid_height": 4096, "block_size_x": 8, "block_size_y": 16, "tile_size_x": 1, "tile_size_y": 4, "temporal_tiling_factor": 7, "max_tfactor": 10, "loop_unroll_factor_t": 1, "sh_power": 1, "blocks_per_sm": 1, "time": 23.0706689953804, "times": [23.122943878173828, 23.07276725769043, 23.071744918823242, 23.06662368774414, 23.068511962890625, 23.06867218017578, 23.06559944152832, 23.0645751953125, 23.06867218017578, 23.069503784179688, 23.06764793395996, 23.06867218017578, 23.06764793395996, 23.0696964263916, 23.068767547607422, 23.06867218017578, 23.070720672607422, 23.07062339782715, 23.06867218017578, 23.06764793395996, 23.070720672607422, 23.070720672607422, 23.06867218017578, 23.06867218017578, 23.0696964263916, 23.06867218017578, 23.067583084106445, 23.07263946533203, 23.068607330322266, 23.06867218017578, 23.06867218017578, 23.0696964263916], "compile_time": 757.1486750384793, "verification_time": 0, "benchmark_time": 739.7636220557615, "GFLOP/s": 76.35702633299185, "strategy_time": 0.008485978469252586, "framework_time": 1.548787928186357, "timestamp": "2025-04-08 08:14:43.177158+00:00", "gridpoints/s": 5090468422.199457}, "4096,4096,96,1,3,4,2,10,1,0,1": {"grid_width": 4096, "grid_height": 4096, "block_size_x": 96, "block_size_y": 1, "tile_size_x": 3, "tile_size_y": 4, "temporal_tiling_factor": 2, "max_tfactor": 10, "loop_unroll_factor_t": 1, "sh_power": 0, "blocks_per_sm": 1, "time": 4.6574360728263855, "times": [4.7032318115234375, 4.659200191497803, 4.660223960876465, 4.66534423828125, 4.65715217590332, 4.6530561447143555, 4.659200191497803, 4.6530561447143555, 4.65715217590332, 4.654079914093018, 4.6561279296875, 4.65715217590332, 4.645887851715088, 4.65715217590332, 4.655104160308838, 4.659200191497803, 4.652031898498535, 4.64793586730957, 4.648960113525391, 4.661248207092285, 4.654079914093018, 4.648960113525391, 4.6561279296875, 4.6530561447143555, 4.662271976470947, 4.659200191497803, 4.6530561447143555, 4.655104160308838, 4.6530561447143555, 4.663296222686768, 4.6561279296875, 4.6611199378967285], "compile_time": 715.1069489773363, "verification_time": 0, "benchmark_time": 150.713566923514, "GFLOP/s": 108.0672868354713, "strategy_time": 0.008355011232197285, "framework_time": 1.5872300136834383, "timestamp": "2025-04-08 08:14:44.044605+00:00", "gridpoints/s": 7204485789.03142}, "4096,4096,32,4,2,2,4,10,2,0,1": {"grid_width": 4096, "grid_height": 4096, "block_size_x": 32, "block_size_y": 4, "tile_size_x": 2, "tile_size_y": 2, "temporal_tiling_factor": 4, "max_tfactor": 10, "loop_unroll_factor_t": 2, "sh_power": 0, "blocks_per_sm": 1, "time": 10.607728093862534, "times": [10.661696434020996, 10.611712455749512, 10.610688209533691, 10.610655784606934, 10.608511924743652, 10.606592178344727, 10.604543685913086, 10.603520393371582, 10.607616424560547, 10.605567932128906, 10.604543685913086, 10.60540771484375, 10.606592178344727, 10.604543685913086, 10.606592178344727, 10.605567932128906, 10.606592178344727, 10.607616424560547, 10.607616424560547, 10.604543685913086, 10.603520393371582, 10.602496147155762, 10.605567932128906, 10.604543685913086, 10.605567932128906, 10.605567932128906, 10.606592178344727, 10.603520393371582, 10.606592178344727, 10.605567932128906, 10.603520393371582, 10.603520393371582], "compile_time": 831.2678330112249, "verification_time": 0, "benchmark_time": 341.5319959167391, "GFLOP/s": 94.8961880520318, "strategy_time": 0.008204951882362366, "framework_time": 1.7185871256515384, "timestamp": "2025-04-08 08:14:45.219163+00:00", "gridpoints/s": 6326412536.80212}, "4096,4096,4,16,5,3,10,10,10,1,0": {"grid_width": 4096, "grid_height": 4096, "block_size_x": 4, "block_size_y": 16, "tile_size_x": 5, "tile_size_y": 3, "temporal_tiling_factor": 10, "max_tfactor": 10, "loop_unroll_factor_t": 10, "sh_power": 1, "blocks_per_sm": 0, "time": 27.47229903936386, "times": [27.5230712890625, 27.466655731201172, 27.475967407226562, 27.471712112426758, 27.475967407226562, 27.468799591064453, 27.464704513549805, 27.470848083496094, 27.480064392089844, 27.444223403930664, 27.480064392089844, 27.473920822143555, 27.456512451171875, 27.450368881225586, 27.481088638305664, 27.473920822143555, 27.476831436157227, 27.468704223632812, 27.475967407226562, 27.460607528686523, 27.475967407226562, 27.479040145874023, 27.473920822143555, 27.464704513549805, 27.457536697387695, 27.476991653442383, 27.48303985595703, 27.47283172607422, 27.475967407226562, 27.480064392089844, 27.478015899658203, 27.455488204956055], "compile_time": 1167.220578994602, "verification_time": 0, "benchmark_time": 880.2635939791799, "GFLOP/s": 91.6043610472534, "strategy_time": 0.008416012860834599, "framework_time": 1.5899549471214414, "timestamp": "2025-04-08 08:14:47.268278+00:00", "gridpoints/s": 6106957403.150227}, "4096,4096,8,4,8,2,6,10,6,0,3": {"grid_width": 4096, "grid_height": 4096, "block_size_x": 8, "block_size_y": 4, "tile_size_x": 8, "tile_size_y": 2, "temporal_tiling_factor": 6, "max_tfactor": 10, "loop_unroll_factor_t": 6, "sh_power": 0, "blocks_per_sm": 3, "time": 16.44009906053543, "times": [16.494592666625977, 16.444223403930664, 16.440160751342773, 16.442367553710938, 16.43916893005371, 16.441343307495117, 16.440288543701172, 16.441343307495117, 16.43622398376465, 16.443391799926758, 16.43724822998047, 16.43929672241211, 16.440319061279297, 16.43929672241211, 16.43724822998047, 16.43724822998047, 16.43712043762207, 16.435199737548828, 16.43609619140625, 16.43622398376465, 16.435199737548828, 16.43622398376465, 16.440319061279297, 16.435199737548828, 16.43619155883789, 16.435199737548828, 16.437152862548828, 16.435199737548828, 16.440288543701172, 16.43929672241211, 16.43724822998047, 16.43724822998047], "compile_time": 1081.5988848917186, "verification_time": 0, "benchmark_time": 528.1994680408388, "GFLOP/s": 91.84551957017364, "strategy_time": 0.008425908163189888, "framework_time": 1.6046122182160616, "timestamp": "2025-04-08 08:14:48.879721+00:00", "gridpoints/s": 6123034638.011576}, "4096,4096,32,2,4,1,4,10,2,1,2": {"grid_width": 4096, "grid_height": 4096, "block_size_x": 32, "block_size_y": 2, "tile_size_x": 4, "tile_size_y": 1, "temporal_tiling_factor": 4, "max_tfactor": 10, "loop_unroll_factor_t": 2, "sh_power": 1, "blocks_per_sm": 2, "time": 16.620943069458008, "times": [16.675840377807617, 16.62575912475586, 16.62054443359375, 16.61952018737793, 16.61859130859375, 16.61952018737793, 16.62054443359375, 16.61644744873047, 16.61747169494629, 16.61644744873047, 16.61952018737793, 16.61747169494629, 16.62054443359375, 16.621408462524414, 16.62054443359375, 16.61952018737793, 16.61952018737793, 16.62054443359375, 16.62054443359375, 16.618303298950195, 16.621440887451172, 16.61747169494629, 16.61836814880371, 16.616256713867188, 16.62054443359375, 16.61952018737793, 16.619487762451172, 16.61644744873047, 16.61440086364746, 16.61952018737793, 16.62054443359375, 16.61756706237793], "compile_time": 784.4753450481221, "verification_time": 0, "benchmark_time": 533.5175599902868, "GFLOP/s": 60.56413019365604, "strategy_time": 0.00850600190460682, "framework_time": 1.575387897901237, "timestamp": "2025-04-08 08:14:50.199328+00:00", "gridpoints/s": 4037608679.5770698}, "4096,4096,8,16,2,3,6,10,1,0,3": {"grid_width": 4096, "grid_height": 4096, "block_size_x": 8, "block_size_y": 16, "tile_size_x": 2, "tile_size_y": 3, "temporal_tiling_factor": 6, "max_tfactor": 10, "loop_unroll_factor_t": 1, "sh_power": 0, "blocks_per_sm": 3, "time": 16.6473930478096, "times": [16.674816131591797, 16.63164710998535, 16.630752563476562, 16.623615264892578, 16.62553596496582, 16.62566375732422, 16.624576568603516, 16.6246395111084, 16.62259292602539, 16.62259292602539, 16.62758445739746, 16.62566375732422, 16.628671646118164, 16.626527786254883, 16.625600814819336, 16.62668800354004, 16.62259292602539, 16.62668800354004, 16.62259292602539, 16.626495361328125, 16.62668800354004, 16.6246395111084, 16.6246395111084, 16.6246395111084, 16.65331268310547, 16.723968505859375, 16.752639770507812, 16.754688262939453, 16.746496200561523, 16.673791885375977, 16.674816131591797, 16.670719146728516], "compile_time": 813.6732069542632, "verification_time": 0, "benchmark_time": 534.1448150575161, "GFLOP/s": 90.70185557964425, "strategy_time": 0.008244998753070831, "framework_time": 1.6399880405515432, "timestamp": "2025-04-08 08:14:51.548826+00:00", "gridpoints/s": 6046790371.976283}, "4096,4096,8,4,7,4,4,10,2,0,1": {"grid_width": 4096, "grid_height": 4096, "block_size_x": 8, "block_size_y": 4, "tile_size_x": 7, "tile_size_y": 4, "temporal_tiling_factor": 4, "max_tfactor": 10, "loop_unroll_factor_t": 2, "sh_power": 0, "blocks_per_sm": 1, "time": 10.154358983039856, "times": [10.210304260253906, 10.160127639770508, 10.159040451049805, 10.158080101013184, 10.148863792419434, 10.155008316040039, 10.155008316040039, 10.14681625366211, 10.145792007446289, 10.155936241149902, 10.145792007446289, 10.155008316040039, 10.155008316040039, 10.147839546203613, 10.155008316040039, 10.14681625366211, 10.156031608581543, 10.151935577392578, 10.152959823608398, 10.153984069824219, 10.157055854797363, 10.147839546203613, 10.147839546203613, 10.156031608581543, 10.14681625366211, 10.14681625366211, 10.15283203125, 10.156031608581543, 10.149888038635254, 10.157055854797363, 10.151935577392578, 10.153984069824219], "compile_time": 877.8683610726148, "verification_time": 0, "benchmark_time": 326.50558603927493, "GFLOP/s": 99.13308773909917, "strategy_time": 0.008695991709828377, "framework_time": 1.4767248649150133, "timestamp": "2025-04-08 08:14:52.754717+00:00", "gridpoints/s": 6608872515.939944}, "4096,4096,4,16,6,2,8,10,2,0,1": {"grid_width": 4096, "grid_height": 4096, "block_size_x": 4, "block_size_y": 16, "tile_size_x": 6, "tile_size_y": 2, "temporal_tiling_factor": 8, "max_tfactor": 10, "loop_unroll_factor_t": 2, "sh_power": 0, "blocks_per_sm": 1, "time": 20.500168025493622, "times": [20.549631118774414, 20.505599975585938, 20.50150489807129, 20.50048065185547, 20.499359130859375, 20.49945640563965, 20.496383666992188, 20.49945640563965, 20.49945640563965, 20.497407913208008, 20.497215270996094, 20.49830436706543, 20.497407913208008, 20.495359420776367, 20.496383666992188, 20.498432159423828, 20.497407913208008, 20.499263763427734, 20.497407913208008, 20.49945640563965, 20.498432159423828, 20.495359420776367, 20.50150489807129, 20.498432159423828, 20.497407913208008, 20.50048065185547, 20.49945640563965, 20.498432159423828, 20.49945640563965, 20.496383666992188, 20.49724769592285, 20.497407913208008], "compile_time": 848.813357995823, "verification_time": 0, "benchmark_time": 657.9609949840233, "GFLOP/s": 98.20728871569933, "strategy_time": 0.008176080882549286, "framework_time": 1.574154943227768, "timestamp": "2025-04-08 08:14:54.263105+00:00", "gridpoints/s": 6547152581.046622}, "4096,4096,64,1,8,6,1,10,1,0,0": {"grid_width": 4096, "grid_height": 4096, "block_size_x": 64, "block_size_y": 1, "tile_size_x": 8, "tile_size_y": 6, "temporal_tiling_factor": 1, "max_tfactor": 10, "loop_unroll_factor_t": 1, "sh_power": 0, "blocks_per_sm": 0, "time": 1.5556940250098705, "times": [1.6034560203552246, 1.5605759620666504, 1.5534080266952515, 1.5575040578842163, 1.5534080266952515, 1.556480050086975, 1.5534080266952515, 1.5554560422897339, 1.553279995918274, 1.5575040578842163, 1.5544320344924927, 1.5554560422897339, 1.5542720556259155, 1.5554560422897339, 1.5534080266952515, 1.5554560422897339, 1.551360011100769, 1.5523840188980103, 1.5523200035095215, 1.5523840188980103, 1.5523840188980103, 1.5554560422897339, 1.5523840188980103, 1.556480050086975, 1.5523840188980103, 1.5534080266952515, 1.551360011100769, 1.5534080266952515, 1.5522559881210327, 1.5523840188980103, 1.5523840188980103, 1.5565119981765747], "compile_time": 818.645060993731, "verification_time": 0, "benchmark_time": 51.71037092804909, "GFLOP/s": 161.76589737715503, "strategy_time": 0.008516013622283936, "framework_time": 1.65902404114604, "timestamp": "2025-04-08 08:14:55.135159+00:00", "gridpoints/s": 10784393158.477001}, "4096,4096,64,1,1,6,5,10,5,0,3": {"grid_width": 4096, "grid_height": 4096, "block_size_x": 64, "block_size_y": 1, "tile_size_x": 1, "tile_size_y": 6, "temporal_tiling_factor": 5, "max_tfactor": 10, "loop_unroll_factor_t": 5, "sh_power": 0, "blocks_per_sm": 3, "time": 17.573099970817566, "times": [20.24652862548828, 20.198335647583008, 20.197376251220703, 20.169727325439453, 20.163583755493164, 20.162559509277344, 20.161535263061523, 20.161535263061523, 20.162431716918945, 16.81804847717285, 16.539648056030273, 16.539648056030273, 16.539648056030273, 16.540544509887695, 16.540672302246094, 16.541696548461914, 16.539648056030273, 16.538623809814453, 16.540672302246094, 16.540672302246094, 16.543743133544922, 16.541696548461914, 16.542591094970703, 16.542720794677734, 16.541696548461914, 16.539648056030273, 16.540672302246094, 16.541696548461914, 16.538623809814453, 16.538623809814453, 16.540607452392578, 16.543743133544922], "compile_time": 995.2198039973155, "verification_time": 0, "benchmark_time": 563.5009610559791, "GFLOP/s": 71.60325737004611, "strategy_time": 0.00868597999215126, "framework_time": 1.3583629624918103, "timestamp": "2025-04-08 08:14:56.695278+00:00", "gridpoints/s": 4773550491.336408}, "4096,4096,8,32,4,1,5,10,5,0,2": {"grid_width": 4096, "grid_height": 4096, "block_size_x": 8, "block_size_y": 32, "tile_size_x": 4, "tile_size_y": 1, "temporal_tiling_factor": 5, "max_tfactor": 10, "loop_unroll_factor_t": 5, "sh_power": 0, "blocks_per_sm": 2, "time": 9.536438018083572, "times": [9.597951889038086, 9.545727729797363, 9.538559913635254, 9.53548812866211, 9.53548812866211, 9.53651237487793, 9.534463882446289, 9.53439998626709, 9.533439636230469, 9.533439636230469, 9.532416343688965, 9.531392097473145, 9.532352447509766, 9.531392097473145, 9.534463882446289, 9.532383918762207, 9.534463882446289, 9.53548812866211, 9.53548812866211, 9.53548812866211, 9.534463882446289, 9.535360336303711, 9.534463882446289, 9.53548812866211, 9.532416343688965, 9.532416343688965, 9.532416343688965, 9.531359672546387, 9.534463882446289, 9.533439636230469, 9.53548812866211, 9.533439636230469], "compile_time": 998.4316349728033, "verification_time": 0, "benchmark_time": 306.0609359527007, "GFLOP/s": 131.94561718053973, "strategy_time": 0.008275965228676796, "framework_time": 1.6367731150239706, "timestamp": "2025-04-08 08:14:58.001447+00:00", "gridpoints/s": 8796374478.702648}, "4096,4096,2,16,1,5,9,10,1,1,1": {"grid_width": 4096, "grid_height": 4096, "block_size_x": 2, "block_size_y": 16, "tile_size_x": 1, "tile_size_y": 5, "temporal_tiling_factor": 9, "max_tfactor": 10, "loop_unroll_factor_t": 1, "sh_power": 1, "blocks_per_sm": 1, "time": 76.22262191772461, "times": [76.29106903076172, 76.16499328613281, 76.22239685058594, 76.2070083618164, 76.21017456054688, 76.20301055908203, 76.22144317626953, 76.2419204711914, 76.20403289794922, 76.20198059082031, 76.21119689941406, 76.22246551513672, 76.22041320800781, 76.22144317626953, 76.22434997558594, 76.2245101928711, 76.20301055908203, 76.22342681884766, 76.21529388427734, 76.22025299072266, 76.2429428100586, 76.21836853027344, 76.17520141601562, 76.20800018310547, 76.24393463134766, 76.25523376464844, 76.25421142578125, 76.20198059082031, 76.24797058105469, 76.2234878540039, 76.26239776611328, 76.23577880859375], "compile_time": 748.791306046769, "verification_time": 0, "benchmark_time": 2440.6670479802415, "GFLOP/s": 29.71459263687859, "strategy_time": 0.008516013622283936, "framework_time": 1.6008559614419937, "timestamp": "2025-04-08 08:15:01.192547+00:00", "gridpoints/s": 1980972842.4585726}, "4096,4096,4,16,1,2,7,10,1,0,3": {"grid_width": 4096, "grid_height": 4096, "block_size_x": 4, "block_size_y": 16, "tile_size_x": 1, "tile_size_y": 2, "temporal_tiling_factor": 7, "max_tfactor": 10, "loop_unroll_factor_t": 1, "sh_power": 0, "blocks_per_sm": 3, "time": 41.29764938354492, "times": [41.35014343261719, 41.30201721191406, 41.29171371459961, 41.28972625732422, 41.29177474975586, 41.29484939575195, 41.29792022705078, 41.29484939575195, 41.29670333862305, 41.29792022705078, 41.29478454589844, 41.29280090332031, 41.29587173461914, 41.2938232421875, 41.295745849609375, 41.296897888183594, 41.29808044433594, 41.296897888183594, 41.29587173461914, 41.29484939575195, 41.29996871948242, 41.30303955078125, 41.29792022705078, 41.29996871948242, 41.29782485961914, 41.29894256591797, 41.29484939575195, 41.29177474975586, 41.29081726074219, 41.29471969604492, 41.29280090332031, 41.298912048339844], "compile_time": 806.1054740101099, "verification_time": 0, "benchmark_time": 1322.8673780104145, "GFLOP/s": 42.65636679800748, "strategy_time": 0.007934984751045704, "framework_time": 1.7237450229004025, "timestamp": "2025-04-08 08:15:03.323283+00:00", "gridpoints/s": 2843757786.533832}, "4096,4096,16,32,2,1,6,10,3,1,1": {"grid_width": 4096, "grid_height": 4096, "block_size_x": 16, "block_size_y": 32, "tile_size_x": 2, "tile_size_y": 1, "temporal_tiling_factor": 6, "max_tfactor": 10, "loop_unroll_factor_t": 3, "sh_power": 1, "blocks_per_sm": 1, "time": 13.720851868391037, "times": [13.77177619934082, 13.722623825073242, 13.721599578857422, 13.717503547668457, 13.722623825073242, 13.718527793884277, 13.719552040100098, 13.719552040100098, 13.721599578857422, 13.718527793884277, 13.718527793884277, 13.724512100219727, 13.719552040100098, 13.719552040100098, 13.718527793884277, 13.721599578857422, 13.717503547668457, 13.715456008911133, 13.718496322631836, 13.717503547668457, 13.720576286315918, 13.715456008911133, 13.719552040100098, 13.723648071289062, 13.717503547668457, 13.718527793884277, 13.719552040100098, 13.716480255126953, 13.717503547668457, 13.71731185913086, 13.717503547668457, 13.718527793884277], "compile_time": 877.587866038084, "verification_time": 0, "benchmark_time": 441.0920739173889, "GFLOP/s": 110.04779109076286, "strategy_time": 0.008165021426975727, "framework_time": 1.659217057749629, "timestamp": "2025-04-08 08:15:04.643663+00:00", "gridpoints/s": 7336519406.050858}, "4096,4096,4,8,3,4,2,10,1,0,4": {"grid_width": 4096, "grid_height": 4096, "block_size_x": 4, "block_size_y": 8, "tile_size_x": 3, "tile_size_y": 4, "temporal_tiling_factor": 2, "max_tfactor": 10, "loop_unroll_factor_t": 1, "sh_power": 0, "blocks_per_sm": 4, "time": 5.446398019790649, "times": [5.498879909515381, 5.450751781463623, 5.4476799964904785, 5.448703765869141, 5.4476799964904785, 5.445568084716797, 5.443583965301514, 5.444511890411377, 5.444479942321777, 5.444608211517334, 5.443583965301514, 5.443583965301514, 5.443583965301514, 5.443583965301514, 5.44758415222168, 5.445568084716797, 5.444608211517334, 5.444416046142578, 5.443583965301514, 5.444608211517334, 5.444608211517334, 5.444511890411377, 5.443583965301514, 5.444543838500977, 5.443583965301514, 5.442560195922852, 5.443583965301514, 5.443488121032715, 5.443583965301514, 5.442560195922852, 5.442560195922852, 5.444416046142578], "compile_time": 835.9860219061375, "verification_time": 0, "benchmark_time": 176.21284699998796, "GFLOP/s": 92.4127245513626, "strategy_time": 0.008536037057638168, "framework_time": 1.5948150539770722, "timestamp": "2025-04-08 08:15:05.657497+00:00", "gridpoints/s": 6160848303.424173}, "4096,4096,8,4,4,6,6,10,3,0,1": {"grid_width": 4096, "grid_height": 4096, "block_size_x": 8, "block_size_y": 4, "tile_size_x": 4, "tile_size_y": 6, "temporal_tiling_factor": 6, "max_tfactor": 10, "loop_unroll_factor_t": 3, "sh_power": 0, "blocks_per_sm": 1, "time": 13.13213300704956, "times": [13.188032150268555, 13.133824348449707, 13.131744384765625, 13.123583793640137, 13.133824348449707, 13.128704071044922, 13.134847640991211, 13.126655578613281, 13.123583793640137, 13.131775856018066, 13.132800102233887, 13.132800102233887, 13.128704071044922, 13.130751609802246, 13.127679824829102, 13.127679824829102, 13.131775856018066, 13.127584457397461, 13.133824348449707, 13.132800102233887, 13.130751609802246, 13.130592346191406, 13.137887954711914, 13.130592346191406, 13.129728317260742, 13.131648063659668, 13.130751609802246, 13.130751609802246, 13.130592346191406, 13.129695892333984, 13.126655578613281, 13.125632286071777], "compile_time": 1007.2831789730117, "verification_time": 0, "benchmark_time": 421.5408560121432, "GFLOP/s": 114.98127830333674, "strategy_time": 0.00818504486232996, "framework_time": 1.6924579394981265, "timestamp": "2025-04-08 08:15:07.088054+00:00", "gridpoints/s": 7665418553.555782}, "4096,4096,160,4,1,7,4,10,4,0,2": {"grid_width": 4096, "grid_height": 4096, "block_size_x": 160, "block_size_y": 4, "tile_size_x": 1, "tile_size_y": 7, "temporal_tiling_factor": 4, "max_tfactor": 10, "loop_unroll_factor_t": 4, "sh_power": 0, "blocks_per_sm": 2, "time": 7.310426950454712, "times": [7.358463764190674, 7.313407897949219, 7.3072638511657715, 7.310336112976074, 7.3072638511657715, 7.311359882354736, 7.309311866760254, 7.308288097381592, 7.310336112976074, 7.3072638511657715, 7.308288097381592, 7.308224201202393, 7.309311866760254, 7.308288097381592, 7.309311866760254, 7.309311866760254, 7.308288097381592, 7.318528175354004, 7.308288097381592, 7.309311866760254, 7.3072638511657715, 7.3072638511657715, 7.307231903076172, 7.3072638511657715, 7.3072638511657715, 7.308224201202393, 7.3072638511657715, 7.309311866760254, 7.3072638511657715, 7.308288097381592, 7.309311866760254, 7.3072638511657715], "compile_time": 716.0011120140553, "verification_time": 0, "benchmark_time": 234.95899396948516, "GFLOP/s": 137.698244825138, "strategy_time": 0.00871601514518261, "framework_time": 1.6060259658843279, "timestamp": "2025-04-08 08:15:08.040659+00:00", "gridpoints/s": 9179882988.342533}, "4096,4096,1,32,4,6,6,10,6,1,2": {"grid_width": 4096, "grid_height": 4096, "block_size_x": 1, "block_size_y": 32, "tile_size_x": 4, "tile_size_y": 6, "temporal_tiling_factor": 6, "max_tfactor": 10, "loop_unroll_factor_t": 6, "sh_power": 1, "blocks_per_sm": 2, "time": 27.391964852809906, "times": [27.395999908447266, 27.299840927124023, 27.313152313232422, 27.34899139404297, 27.294719696044922, 27.294719696044922, 27.262975692749023, 27.325439453125, 27.33772850036621, 27.2936954498291, 27.2936954498291, 27.32134437561035, 27.273216247558594, 27.287551879882812, 27.313152313232422, 27.29267120361328, 27.296768188476562, 27.479040145874023, 27.50771141052246, 27.475967407226562, 27.465728759765625, 27.451391220092773, 27.468799591064453, 27.49849510192871, 27.454463958740234, 27.505664825439453, 27.51487922668457, 27.485183715820312, 27.483135223388672, 27.470848083496094, 27.505664825439453, 27.53023910522461], "compile_time": 952.1047180751339, "verification_time": 0, "benchmark_time": 877.9813229339197, "GFLOP/s": 55.12380904815257, "strategy_time": 0.008426024578511715, "framework_time": 1.5985820209607482, "timestamp": "2025-04-08 08:15:09.872384+00:00", "gridpoints/s": 3674920603.2101717}, "4096,4096,4,16,5,2,10,10,10,1,3": {"grid_width": 4096, "grid_height": 4096, "block_size_x": 4, "block_size_y": 16, "tile_size_x": 5, "tile_size_y": 2, "temporal_tiling_factor": 10, "max_tfactor": 10, "loop_unroll_factor_t": 10, "sh_power": 1, "blocks_per_sm": 3, "time": 30.432473063468933, "times": [30.477312088012695, 30.445568084716797, 30.418943405151367, 30.419967651367188, 30.441471099853516, 30.41689682006836, 30.419967651367188, 30.420991897583008, 30.440448760986328, 30.434303283691406, 30.43836784362793, 30.440448760986328, 30.440448760986328, 30.419967651367188, 30.442495346069336, 30.42304039001465, 30.439424514770508, 30.421951293945312, 30.417919158935547, 30.440448760986328, 30.42406463623047, 30.442399978637695, 30.418943405151367, 30.43939208984375, 30.42304039001465, 30.439424514770508, 30.422016143798828, 30.440448760986328, 30.438400268554688, 30.438400268554688, 30.437376022338867, 30.41484832763672], "compile_time": 1159.4427119707689, "verification_time": 0, "benchmark_time": 975.3909360151738, "GFLOP/s": 82.69398266619676, "strategy_time": 0.008656061254441738, "framework_time": 1.7870658775791526, "timestamp": "2025-04-08 08:15:12.009053+00:00", "gridpoints/s": 5512932177.74645}, "4096,4096,16,2,7,3,8,10,8,1,2": {"grid_width": 4096, "grid_height": 4096, "block_size_x": 16, "block_size_y": 2, "tile_size_x": 7, "tile_size_y": 3, "temporal_tiling_factor": 8, "max_tfactor": 10, "loop_unroll_factor_t": 8, "sh_power": 1, "blocks_per_sm": 2, "time": 42.17631661891937, "times": [42.231807708740234, 42.191871643066406, 42.19801712036133, 42.16729736328125, 42.145790100097656, 42.178497314453125, 42.164222717285156, 42.16729736328125, 42.17958450317383, 42.178558349609375, 42.14271926879883, 42.15705490112305, 42.16115188598633, 42.182655334472656, 42.17446517944336, 42.15705490112305, 42.16115188598633, 42.16320037841797, 42.185791015625, 42.15804672241211, 42.18880081176758, 42.171390533447266, 42.162174224853516, 42.15193557739258, 42.204158782958984, 42.162174224853516, 42.173439025878906, 42.20307159423828, 42.17548751831055, 42.18880081176758, 42.17753601074219, 42.2369270324707], "compile_time": 1088.497866061516, "verification_time": 0, "benchmark_time": 1351.2219410622492, "GFLOP/s": 47.734512669532, "strategy_time": 0.008775969035923481, "framework_time": 1.7411579610779881, "timestamp": "2025-04-08 08:15:14.450555+00:00", "gridpoints/s": 3182300844.635467}, "4096,4096,2,16,1,4,7,10,1,1,3": {"grid_width": 4096, "grid_height": 4096, "block_size_x": 2, "block_size_y": 16, "tile_size_x": 1, "tile_size_y": 4, "temporal_tiling_factor": 7, "max_tfactor": 10, "loop_unroll_factor_t": 1, "sh_power": 1, "blocks_per_sm": 3, "time": 47.98113572597504, "times": [48.031742095947266, 47.98566436767578, 47.98566436767578, 47.98463821411133, 47.9815673828125, 47.97644805908203, 47.97439956665039, 47.99078369140625, 47.9804801940918, 47.97951889038086, 47.98054504394531, 47.97951889038086, 47.97747039794922, 47.97836685180664, 47.975425720214844, 47.97951889038086, 47.97849655151367, 47.975425720214844, 47.9815673828125, 47.97951889038086, 47.97747039794922, 47.9815673828125, 47.98054504394531, 47.97644805908203, 47.9733772277832, 47.985599517822266, 47.97644805908203, 47.98972702026367, 47.97635269165039, 47.97439956665039, 47.97734451293945, 47.97030258178711], "compile_time": 749.461930943653, "verification_time": 0, "benchmark_time": 1536.468221922405, "GFLOP/s": 36.71458904309214, "strategy_time": 0.008495990186929703, "framework_time": 1.6360811423510313, "timestamp": "2025-04-08 08:15:16.738162+00:00", "gridpoints/s": 2447639269.539476}, "4096,4096,2,16,6,3,6,10,3,0,3": {"grid_width": 4096, "grid_height": 4096, "block_size_x": 2, "block_size_y": 16, "tile_size_x": 6, "tile_size_y": 3, "temporal_tiling_factor": 6, "max_tfactor": 10, "loop_unroll_factor_t": 3, "sh_power": 0, "blocks_per_sm": 3, "time": 15.479952037334442, "times": [15.540224075317383, 15.484928131103516, 15.481856346130371, 15.474687576293945, 15.477760314941406, 15.477760314941406, 15.490015983581543, 15.48083209991455, 15.475711822509766, 15.476736068725586, 15.473664283752441, 15.484736442565918, 15.476736068725586, 15.472607612609863, 15.481856346130371, 15.457280158996582, 15.47980785369873, 15.477760314941406, 15.477760314941406, 15.492095947265625, 15.468544006347656, 15.48476791381836, 15.474687576293945, 15.484928131103516, 15.465472221374512, 15.482879638671875, 15.484928131103516, 15.476736068725586, 15.472607612609863, 15.468544006347656, 15.476736068725586, 15.482815742492676], "compile_time": 976.6256780130789, "verification_time": 0, "benchmark_time": 496.5210750233382, "GFLOP/s": 97.54225570972793, "strategy_time": 0.008775969035923481, "framework_time": 1.58933294005692, "timestamp": "2025-04-08 08:15:18.212937+00:00", "gridpoints/s": 6502817047.315195}, "4096,4096,288,2,1,5,2,10,2,0,2": {"grid_width": 4096, "grid_height": 4096, "block_size_x": 288, "block_size_y": 2, "tile_size_x": 1, "tile_size_y": 5, "temporal_tiling_factor": 2, "max_tfactor": 10, "loop_unroll_factor_t": 2, "sh_power": 0, "blocks_per_sm": 2, "time": 3.535126969218254, "times": [3.586047887802124, 3.5389440059661865, 3.536895990371704, 3.5328640937805176, 3.536895990371704, 3.5348479747772217, 3.5338239669799805, 3.5348479747772217, 3.5327999591827393, 3.5327999591827393, 3.5348479747772217, 3.532639980316162, 3.5327999591827393, 3.5327999591827393, 3.5338239669799805, 3.5327999591827393, 3.535871982574463, 3.5327999591827393, 3.532639980316162, 3.531775951385498, 3.531775951385498, 3.5327999591827393, 3.5327999591827393, 3.531775951385498, 3.5327999591827393, 3.5338239669799805, 3.531775951385498, 3.5327999591827393, 3.531775951385498, 3.531775951385498, 3.533792018890381, 3.5327999591827393], "compile_time": 692.3743259394541, "verification_time": 0, "benchmark_time": 114.06004289165139, "GFLOP/s": 142.37578575892044, "strategy_time": 0.008967006579041481, "framework_time": 1.6349491197615862, "timestamp": "2025-04-08 08:15:19.021046+00:00", "gridpoints/s": 9491719050.594696}, "4096,4096,8,8,2,1,8,10,2,1,1": {"grid_width": 4096, "grid_height": 4096, "block_size_x": 8, "block_size_y": 8, "tile_size_x": 2, "tile_size_y": 1, "temporal_tiling_factor": 8, "max_tfactor": 10, "loop_unroll_factor_t": 2, "sh_power": 1, "blocks_per_sm": 1, "time": 54.61745524406433, "times": [54.66726303100586, 54.621185302734375, 54.61606216430664, 54.617088317871094, 54.61600112915039, 54.61811065673828, 54.619136810302734, 54.61606216430664, 54.617088317871094, 54.61503982543945, 54.61606216430664, 54.61692810058594, 54.61503982543945, 54.614017486572266, 54.615936279296875, 54.61600112915039, 54.614017486572266, 54.611968994140625, 54.61503982543945, 54.61503982543945, 54.614017486572266, 54.61702346801758, 54.61705780029297, 54.614017486572266, 54.617088317871094, 54.618080139160156, 54.614017486572266, 54.617088317871094, 54.61299133300781, 54.617088317871094, 54.61503982543945, 54.611968994140625], "compile_time": 779.8813469707966, "verification_time": 0, "benchmark_time": 1749.5545340934768, "GFLOP/s": 36.861217920232484, "strategy_time": 0.008765957318246365, "framework_time": 1.532378955744207, "timestamp": "2025-04-08 08:15:21.552054+00:00", "gridpoints/s": 2457414528.0154986}, "4096,4096,64,1,2,2,2,10,1,0,3": {"grid_width": 4096, "grid_height": 4096, "block_size_x": 64, "block_size_y": 1, "tile_size_x": 2, "tile_size_y": 2, "temporal_tiling_factor": 2, "max_tfactor": 10, "loop_unroll_factor_t": 1, "sh_power": 0, "blocks_per_sm": 3, "time": 4.9486470222473145, "times": [5.002175807952881, 4.952064037322998, 4.948991775512695, 4.947968006134033, 4.948991775512695, 4.946944236755371, 4.946944236755371, 4.946784019470215, 4.945919990539551, 4.948991775512695, 4.946944236755371, 4.945919990539551, 4.946944236755371, 4.945919990539551, 4.945919990539551, 4.945919990539551, 4.946944236755371, 4.945919990539551, 4.945919990539551, 4.945919990539551, 4.946879863739014, 4.946752071380615, 4.946944236755371, 4.946944236755371, 4.945919990539551, 4.945919990539551, 4.945919990539551, 4.9468159675598145, 4.947968006134033, 4.945919990539551, 4.945919990539551, 4.946752071380615], "compile_time": 805.7934190146625, "verification_time": 0, "benchmark_time": 160.19232501275837, "GFLOP/s": 101.70789667100368, "strategy_time": 0.008956994861364365, "framework_time": 1.632415922358632, "timestamp": "2025-04-08 08:15:22.519711+00:00", "gridpoints/s": 6780526444.733579}, "4096,4096,64,1,3,3,4,10,4,0,0": {"grid_width": 4096, "grid_height": 4096, "block_size_x": 64, "block_size_y": 1, "tile_size_x": 3, "tile_size_y": 3, "temporal_tiling_factor": 4, "max_tfactor": 10, "loop_unroll_factor_t": 4, "sh_power": 0, "blocks_per_sm": 0, "time": 18.183769941329956, "times": [18.23744010925293, 18.185312271118164, 18.183168411254883, 18.180095672607422, 18.18623924255371, 18.180095672607422, 18.182144165039062, 18.177024841308594, 18.181983947753906, 18.18511962890625, 18.183135986328125, 18.181119918823242, 18.180095672607422, 18.184192657470703, 18.181119918823242, 18.18320083618164, 18.1790714263916, 18.183168411254883, 18.180063247680664, 18.189311981201172, 18.182144165039062, 18.184192657470703, 18.18623924255371, 18.181119918823242, 18.182144165039062, 18.17804718017578, 18.183168411254883, 18.181119918823242, 18.180095672607422, 18.180095672607422, 18.181119918823242, 18.17804718017578], "compile_time": 936.340447049588, "verification_time": 0, "benchmark_time": 583.2968569593504, "GFLOP/s": 55.35887020391851, "strategy_time": 0.008435919880867004, "framework_time": 1.5510630328208208, "timestamp": "2025-04-08 08:15:24.040940+00:00", "gridpoints/s": 3690591346.9279003}, "4096,4096,4,8,7,8,10,10,2,1,0": {"grid_width": 4096, "grid_height": 4096, "block_size_x": 4, "block_size_y": 8, "tile_size_x": 7, "tile_size_y": 8, "temporal_tiling_factor": 10, "max_tfactor": 10, "loop_unroll_factor_t": 2, "sh_power": 1, "blocks_per_sm": 0, "time": 29.408592879772186, "times": [29.455360412597656, 29.409151077270508, 29.421663284301758, 29.404159545898438, 29.41644859313965, 29.40108871459961, 29.410303115844727, 29.396991729736328, 29.422592163085938, 29.407072067260742, 29.404159545898438, 29.41644859313965, 29.413375854492188, 29.3939208984375, 29.39904022216797, 29.411327362060547, 29.405183792114258, 29.409183502197266, 29.40928077697754, 29.410303115844727, 29.411327362060547, 29.403135299682617, 29.414400100708008, 29.402111053466797, 29.403135299682617, 29.39904022216797, 29.40108871459961, 29.397823333740234, 29.427711486816406, 29.40006446838379, 29.39904022216797, 29.39904022216797], "compile_time": 868.1870140135288, "verification_time": 0, "benchmark_time": 942.4198840279132, "GFLOP/s": 85.57302997420713, "strategy_time": 0.008336035534739494, "framework_time": 1.6319139394909143, "timestamp": "2025-04-08 08:15:25.853218+00:00", "gridpoints/s": 5704868664.947143}, "4096,4096,4,8,8,6,7,10,1,1,2": {"grid_width": 4096, "grid_height": 4096, "block_size_x": 4, "block_size_y": 8, "tile_size_x": 8, "tile_size_y": 6, "temporal_tiling_factor": 7, "max_tfactor": 10, "loop_unroll_factor_t": 1, "sh_power": 1, "blocks_per_sm": 2, "time": 18.676436960697174, "times": [18.698240280151367, 18.684768676757812, 18.686880111694336, 18.66752052307129, 18.671615600585938, 18.693119049072266, 18.680831909179688, 18.66752052307129, 18.62348747253418, 18.679807662963867, 18.662399291992188, 18.664447784423828, 18.677759170532227, 18.677759170532227, 18.69206428527832, 18.65011215209961, 18.679807662963867, 18.678783416748047, 18.6746883392334, 18.681856155395508, 18.691072463989258, 18.664447784423828, 18.702272415161133, 18.680831909179688, 18.67571258544922, 18.664447784423828, 18.646015167236328, 18.690048217773438, 18.708480834960938, 18.65011215209961, 18.67571258544922, 18.703359603881836], "compile_time": 832.9098260728642, "verification_time": 0, "benchmark_time": 599.0765480091795, "GFLOP/s": 94.3224708067786, "strategy_time": 0.008776085451245308, "framework_time": 1.5836938982829452, "timestamp": "2025-04-08 08:15:27.286828+00:00", "gridpoints/s": 6288164720.451906}, "4096,4096,32,4,7,1,7,10,7,0,0": {"grid_width": 4096, "grid_height": 4096, "block_size_x": 32, "block_size_y": 4, "tile_size_x": 7, "tile_size_y": 1, "temporal_tiling_factor": 7, "max_tfactor": 10, "loop_unroll_factor_t": 7, "sh_power": 0, "blocks_per_sm": 0, "time": 39.31956493854523, "times": [39.376705169677734, 39.33184051513672, 39.32876968383789, 39.330814361572266, 39.323646545410156, 39.31545639038086, 39.32774353027344, 39.32160186767578, 39.31033706665039, 39.31545639038086, 39.30828857421875, 39.31126403808594, 39.32057571411133, 39.3256950378418, 39.31340789794922, 39.3072624206543, 39.31135940551758, 39.30201721191406, 39.30828857421875, 39.32262420654297, 39.314430236816406, 39.32262420654297, 39.31852722167969, 39.323646545410156, 39.30931091308594, 39.31340789794922, 39.33184051513672, 39.32048034667969, 39.30009460449219, 39.31740951538086, 39.323646545410156, 39.3175048828125], "compile_time": 1133.2053319783881, "verification_time": 0, "benchmark_time": 1259.714041952975, "GFLOP/s": 44.80231871215555, "strategy_time": 0.00838597770780325, "framework_time": 1.5991220716387033, "timestamp": "2025-04-08 08:15:29.681385+00:00", "gridpoints/s": 2986821247.4770365}, "4096,4096,4,32,5,1,7,10,7,1,1": {"grid_width": 4096, "grid_height": 4096, "block_size_x": 4, "block_size_y": 32, "tile_size_x": 5, "tile_size_y": 1, "temporal_tiling_factor": 7, "max_tfactor": 10, "loop_unroll_factor_t": 7, "sh_power": 1, "blocks_per_sm": 1, "time": 18.192235827445984, "times": [18.306047439575195, 18.25484848022461, 18.25177574157715, 18.250751495361328, 18.249727249145508, 18.24870491027832, 18.249631881713867, 18.24870491027832, 18.24563217163086, 18.249727249145508, 18.2476806640625, 18.24665641784668, 18.24665641784668, 18.25071907043457, 18.250591278076172, 18.25279998779297, 18.249727249145508, 18.25177574157715, 18.249727249145508, 18.249664306640625, 18.24870491027832, 18.24959945678711, 18.130943298339844, 18.052095413208008, 18.053119659423828, 18.05414390563965, 18.050048828125, 18.052095413208008, 18.051071166992188, 18.05193519592285, 18.053119659423828, 18.053119659423828], "compile_time": 1017.900999984704, "verification_time": 0, "benchmark_time": 583.4802410099655, "GFLOP/s": 96.83293998103986, "strategy_time": 0.008144997991621494, "framework_time": 1.8455230165272951, "timestamp": "2025-04-08 08:15:31.284663+00:00", "gridpoints/s": 6455529332.069324}, "4096,4096,128,4,1,1,6,10,3,0,1": {"grid_width": 4096, "grid_height": 4096, "block_size_x": 128, "block_size_y": 4, "tile_size_x": 1, "tile_size_y": 1, "temporal_tiling_factor": 6, "max_tfactor": 10, "loop_unroll_factor_t": 3, "sh_power": 0, "blocks_per_sm": 1, "time": 23.10369211435318, "times": [23.153663635253906, 23.111679077148438, 23.10348892211914, 23.10041618347168, 23.1014404296875, 23.0994873046875, 23.101408004760742, 23.10246467590332, 23.10348892211914, 23.1014404296875, 23.09836769104004, 23.10041618347168, 23.10028839111328, 23.105440139770508, 23.1014404296875, 23.1014404296875, 23.104511260986328, 23.10246467590332, 23.0963191986084, 23.099231719970703, 23.09939193725586, 23.10041618347168, 23.10655975341797, 23.1014404296875, 23.10246467590332, 23.102367401123047, 23.1014404296875, 23.102336883544922, 23.10348892211914, 23.104415893554688, 23.104511260986328, 23.10041618347168], "compile_time": 959.6945120720193, "verification_time": 0, "benchmark_time": 741.4233980234712, "GFLOP/s": 65.35533076386277, "strategy_time": 0.008785980753600597, "framework_time": 1.5622938517481089, "timestamp": "2025-04-08 08:15:32.987384+00:00", "gridpoints/s": 4357022050.924185}, "4096,4096,4,8,7,4,8,10,8,0,2": {"grid_width": 4096, "grid_height": 4096, "block_size_x": 4, "block_size_y": 8, "tile_size_x": 7, "tile_size_y": 4, "temporal_tiling_factor": 8, "max_tfactor": 10, "loop_unroll_factor_t": 8, "sh_power": 0, "blocks_per_sm": 2, "time": 19.66139006614685, "times": [19.703807830810547, 19.66988754272461, 19.66694450378418, 19.6628475189209, 19.66387176513672, 19.65465545654297, 19.65465545654297, 19.6628475189209, 19.65260887145996, 19.65363121032715, 19.66592025756836, 19.662656784057617, 19.65875244140625, 19.66489601135254, 19.66489601135254, 19.6628475189209, 19.66694450378418, 19.65670394897461, 19.664735794067383, 19.65158462524414, 19.64851188659668, 19.65260887145996, 19.65465545654297, 19.656639099121094, 19.66796875, 19.65260887145996, 19.657695770263672, 19.66387176513672, 19.65260887145996, 19.66489601135254, 19.65875244140625, 19.66796875], "compile_time": 1228.5456230165437, "verification_time": 0, "benchmark_time": 631.1215169262141, "GFLOP/s": 102.3969268310514, "strategy_time": 0.008034985512495041, "framework_time": 1.8510340014472604, "timestamp": "2025-04-08 08:15:34.848945+00:00", "gridpoints/s": 6826461788.73676}, "4096,4096,16,16,5,2,7,10,1,0,0": {"grid_width": 4096, "grid_height": 4096, "block_size_x": 16, "block_size_y": 16, "tile_size_x": 5, "tile_size_y": 2, "temporal_tiling_factor": 7, "max_tfactor": 10, "loop_unroll_factor_t": 1, "sh_power": 0, "blocks_per_sm": 0, "time": 13.742552101612091, "times": [13.792256355285645, 13.747200012207031, 13.743103981018066, 13.740032196044922, 13.741056442260742, 13.743103981018066, 13.741056442260742, 13.739999771118164, 13.739999771118164, 13.742079734802246, 13.739999771118164, 13.739935874938965, 13.743103981018066, 13.741056442260742, 13.739007949829102, 13.739007949829102, 13.740032196044922, 13.739007949829102, 13.740032196044922, 13.744128227233887, 13.741024017333984, 13.740032196044922, 13.740032196044922, 13.739007949829102, 13.741056442260742, 13.739007949829102, 13.744095802307129, 13.741056442260742, 13.740032196044922, 13.740032196044922, 13.741056442260742, 13.740032196044922], "compile_time": 820.2431809622794, "verification_time": 0, "benchmark_time": 441.07723608613014, "GFLOP/s": 128.18635628773436, "strategy_time": 0.008626957423985004, "framework_time": 1.5177300665527582, "timestamp": "2025-04-08 08:15:36.111823+00:00", "gridpoints/s": 8545757085.848957}, "4096,4096,4,8,10,2,5,10,1,1,1": {"grid_width": 4096, "grid_height": 4096, "block_size_x": 4, "block_size_y": 8, "tile_size_x": 10, "tile_size_y": 2, "temporal_tiling_factor": 5, "max_tfactor": 10, "loop_unroll_factor_t": 1, "sh_power": 1, "blocks_per_sm": 1, "time": 11.527190923690796, "times": [11.581439971923828, 11.529215812683105, 11.529215812683105, 11.528191566467285, 11.517951965332031, 11.522047996520996, 11.527135848999023, 11.527168273925781, 11.530240058898926, 11.52511978149414, 11.52511978149414, 11.52409553527832, 11.528191566467285, 11.529215812683105, 11.526144027709961, 11.523072242736816, 11.527168273925781, 11.527168273925781, 11.522047996520996, 11.529120445251465, 11.52409553527832, 11.531264305114746, 11.526080131530762, 11.52409553527832, 11.529215812683105, 11.522047996520996, 11.521023750305176, 11.523072242736816, 11.52409553527832, 11.523039817810059, 11.519935607910156, 11.523072242736816], "compile_time": 782.7652250416577, "verification_time": 0, "benchmark_time": 370.0363900279626, "GFLOP/s": 109.15852858947166, "strategy_time": 0.008285976946353912, "framework_time": 1.4941449044272304, "timestamp": "2025-04-08 08:15:37.266158+00:00", "gridpoints/s": 7277235239.298111}, "4096,4096,64,1,1,8,6,10,3,0,4": {"grid_width": 4096, "grid_height": 4096, "block_size_x": 64, "block_size_y": 1, "tile_size_x": 1, "tile_size_y": 8, "temporal_tiling_factor": 6, "max_tfactor": 10, "loop_unroll_factor_t": 3, "sh_power": 0, "blocks_per_sm": 4, "time": 19.388424158096313, "times": [19.44576072692871, 19.3832950592041, 19.394559860229492, 19.390464782714844, 19.373056411743164, 19.373952865600586, 19.39251136779785, 19.393535614013672, 19.375104904174805, 19.392480850219727, 19.39251136779785, 19.37596893310547, 19.39251136779785, 19.374080657958984, 19.374080657958984, 19.394559860229492, 19.374080657958984, 19.39446449279785, 19.374080657958984, 19.375104904174805, 19.396608352661133, 19.39743995666504, 19.39251136779785, 19.394432067871094, 19.395584106445312, 19.39148712158203, 19.388383865356445, 19.390464782714844, 19.393535614013672, 19.376127243041992, 19.395584106445312, 19.381248474121094], "compile_time": 976.0356720071286, "verification_time": 0, "benchmark_time": 622.0614319900051, "GFLOP/s": 77.87891515512712, "strategy_time": 0.008304952643811703, "framework_time": 1.5877430560067296, "timestamp": "2025-04-08 08:15:38.865882+00:00", "gridpoints/s": 5191927677.008474}, "4096,4096,64,1,1,10,9,10,9,0,1": {"grid_width": 4096, "grid_height": 4096, "block_size_x": 64, "block_size_y": 1, "tile_size_x": 1, "tile_size_y": 10, "temporal_tiling_factor": 9, "max_tfactor": 10, "loop_unroll_factor_t": 9, "sh_power": 0, "blocks_per_sm": 1, "time": 32.7134929895401, "times": [32.77107238769531, 32.719871520996094, 32.723968505859375, 32.710655212402344, 32.712703704833984, 32.7116813659668, 32.719871520996094, 32.71782302856445, 32.712703704833984, 32.70655822753906, 32.70848083496094, 32.70655822753906, 32.707584381103516, 32.71161651611328, 32.709632873535156, 32.710655212402344, 32.70451354980469, 32.7116813659668, 32.712703704833984, 32.7086067199707, 32.710655212402344, 32.709632873535156, 32.7116813659668, 32.710655212402344, 32.710655212402344, 32.707584381103516, 32.71459197998047, 32.709632873535156, 32.718849182128906, 32.710655212402344, 32.70655822753906, 32.7116813659668], "compile_time": 1252.6627860497683, "verification_time": 0, "benchmark_time": 1048.580463975668, "GFLOP/s": 69.23516729699861, "strategy_time": 0.008426024578511715, "framework_time": 1.6114949248731136, "timestamp": "2025-04-08 08:15:41.168777+00:00", "gridpoints/s": 4615677819.799908}, "4096,4096,8,4,4,1,9,10,9,0,2": {"grid_width": 4096, "grid_height": 4096, "block_size_x": 8, "block_size_y": 4, "tile_size_x": 4, "tile_size_y": 1, "temporal_tiling_factor": 9, "max_tfactor": 10, "loop_unroll_factor_t": 9, "sh_power": 0, "blocks_per_sm": 2, "time": 55.40750479698181, "times": [55.46598434448242, 55.416831970214844, 55.409664154052734, 55.411712646484375, 55.40652847290039, 55.40147018432617, 55.407615661621094, 55.411712646484375, 55.40243148803711, 55.40351867675781, 55.404544830322266, 55.40556716918945, 55.40351867675781, 55.400447845458984, 55.402496337890625, 55.40556716918945, 55.406593322753906, 55.406593322753906, 55.41068649291992, 55.407615661621094, 55.40147018432617, 55.402496337890625, 55.40864181518555, 55.40854263305664, 55.3994255065918, 55.41068649291992, 55.40447998046875, 55.40147018432617, 55.398399353027344, 55.404544830322266, 55.404544830322266, 55.40435028076172], "compile_time": 1250.711063039489, "verification_time": 0, "benchmark_time": 1774.4338039774448, "GFLOP/s": 40.87757007464766, "strategy_time": 0.009067007340490818, "framework_time": 1.7038780497387052, "timestamp": "2025-04-08 08:15:44.195668+00:00", "gridpoints/s": 2725171338.309844}, "4096,4096,64,1,3,1,1,10,1,0,4": {"grid_width": 4096, "grid_height": 4096, "block_size_x": 64, "block_size_y": 1, "tile_size_x": 3, "tile_size_y": 1, "temporal_tiling_factor": 1, "max_tfactor": 10, "loop_unroll_factor_t": 1, "sh_power": 0, "blocks_per_sm": 4, "time": 1.560135018080473, "times": [1.610751986503601, 1.563647985458374, 1.5595519542694092, 1.5575040578842163, 1.5575040578842163, 1.5575040578842163, 1.556480050086975, 1.556480050086975, 1.5575679540634155, 1.557536005973816, 1.556480050086975, 1.5586559772491455, 1.556480050086975, 1.556480050086975, 1.5575040578842163, 1.5575040578842163, 1.5575040578842163, 1.556480050086975, 1.556480050086975, 1.5575040578842163, 1.556480050086975, 1.5575040578842163, 1.5605759620666504, 1.5666559934616089, 1.5605759620666504, 1.5595519542694092, 1.5605759620666504, 1.55948805809021, 1.5595200061798096, 1.5595519542694092, 1.5597120523452759, 1.558527946472168], "compile_time": 744.6873050648719, "verification_time": 0, "benchmark_time": 51.753741921857, "GFLOP/s": 161.3054236226491, "strategy_time": 0.008415081538259983, "framework_time": 1.5605719527229667, "timestamp": "2025-04-08 08:15:44.993710+00:00", "gridpoints/s": 10753694908.176607}, "4096,4096,16,2,8,2,7,10,1,0,2": {"grid_width": 4096, "grid_height": 4096, "block_size_x": 16, "block_size_y": 2, "tile_size_x": 8, "tile_size_y": 2, "temporal_tiling_factor": 7, "max_tfactor": 10, "loop_unroll_factor_t": 1, "sh_power": 0, "blocks_per_sm": 2, "time": 27.227301955223083, "times": [27.27619171142578, 27.234304428100586, 27.225088119506836, 27.229087829589844, 27.236352920532227, 27.2291202545166, 27.220895767211914, 27.214847564697266, 27.232255935668945, 27.21785545349121, 27.216896057128906, 27.225088119506836, 27.23107147216797, 27.233280181884766, 27.219968795776367, 27.230207443237305, 27.231264114379883, 27.231231689453125, 27.230207443237305, 27.233280181884766, 27.222015380859375, 27.242496490478516, 27.226112365722656, 27.209728240966797, 27.212799072265625, 27.229087829589844, 27.217727661132812, 27.227136611938477, 27.215871810913086, 27.238399505615234, 27.218944549560547, 27.214847564697266], "compile_time": 828.7002380238846, "verification_time": 0, "benchmark_time": 873.0828859843314, "GFLOP/s": 64.70004567096176, "strategy_time": 0.007995055057108402, "framework_time": 1.5179909532889724, "timestamp": "2025-04-08 08:15:46.697050+00:00", "gridpoints/s": 4313336378.0641165}, "4096,4096,16,2,9,7,1,10,1,0,0": {"grid_width": 4096, "grid_height": 4096, "block_size_x": 16, "block_size_y": 2, "tile_size_x": 9, "tile_size_y": 7, "temporal_tiling_factor": 1, "max_tfactor": 10, "loop_unroll_factor_t": 1, "sh_power": 0, "blocks_per_sm": 0, "time": 1.6939150020480156, "times": [1.7457599639892578, 1.698815941810608, 1.695647954940796, 1.6957440376281738, 1.6926720142364502, 1.6895999908447266, 1.6875519752502441, 1.696768045425415, 1.6936960220336914, 1.6895999908447266, 1.691648006439209, 1.6947200298309326, 1.6926720142364502, 1.686527967453003, 1.6947200298309326, 1.6926720142364502, 1.6906239986419678, 1.691648006439209, 1.6936960220336914, 1.6906239986419678, 1.691648006439209, 1.6936960220336914, 1.6936960220336914, 1.691648006439209, 1.6895999908447266, 1.6926720142364502, 1.6906239986419678, 1.6926720142364502, 1.6926720142364502, 1.691648006439209, 1.6906239986419678, 1.6886719465255737], "compile_time": 847.7190199773759, "verification_time": 0, "benchmark_time": 55.30402704607695, "GFLOP/s": 148.56603766761285, "strategy_time": 0.00856595579534769, "framework_time": 1.6024579526856542, "timestamp": "2025-04-08 08:15:47.601714+00:00", "gridpoints/s": 9904402511.17419}, "4096,4096,4,8,3,7,9,10,1,1,1": {"grid_width": 4096, "grid_height": 4096, "block_size_x": 4, "block_size_y": 8, "tile_size_x": 3, "tile_size_y": 7, "temporal_tiling_factor": 9, "max_tfactor": 10, "loop_unroll_factor_t": 1, "sh_power": 1, "blocks_per_sm": 1, "time": 30.105904936790466, "times": [30.166847229003906, 30.090240478515625, 30.076927185058594, 30.094335556030273, 30.066688537597656, 30.115840911865234, 30.127103805541992, 30.108671188354492, 30.113792419433594, 30.104576110839844, 30.097408294677734, 30.10963249206543, 30.096256256103516, 30.101503372192383, 30.076927185058594, 30.12403106689453, 30.130176544189453, 30.097408294677734, 30.100479125976562, 30.110719680786133, 30.108671188354492, 30.111711502075195, 30.110719680786133, 30.127103805541992, 30.103551864624023, 30.091264724731445, 30.072832107543945, 30.10348892211914, 30.106624603271484, 30.118911743164062, 30.103551864624023, 30.120960235595703], "compile_time": 784.0417239349335, "verification_time": 0, "benchmark_time": 965.1073119603097, "GFLOP/s": 75.23189104447691, "strategy_time": 0.008406001143157482, "framework_time": 1.5441389987245202, "timestamp": "2025-04-08 08:15:49.352447+00:00", "gridpoints/s": 5015459402.965128}, "4096,4096,8,4,9,7,3,10,3,1,1": {"grid_width": 4096, "grid_height": 4096, "block_size_x": 8, "block_size_y": 4, "tile_size_x": 9, "tile_size_y": 7, "temporal_tiling_factor": 3, "max_tfactor": 10, "loop_unroll_factor_t": 3, "sh_power": 1, "blocks_per_sm": 1, "time": 5.531083032488823, "times": [5.57260799407959, 5.553152084350586, 5.533696174621582, 5.534719944000244, 5.52345609664917, 5.534719944000244, 5.529600143432617, 5.52239990234375, 5.517312049865723, 5.538784027099609, 5.540800094604492, 5.529600143432617, 5.524415969848633, 5.5316481590271, 5.517312049865723, 5.530655860900879, 5.52345609664917, 5.538656234741211, 5.527552127838135, 5.532671928405762, 5.539775848388672, 5.511168003082275, 5.524479866027832, 5.533504009246826, 5.529632091522217, 5.530623912811279, 5.529600143432617, 5.513216018676758, 5.52243185043335, 5.542912006378174, 5.539840221405029, 5.520256042480469], "compile_time": 910.4749920079485, "verification_time": 0, "benchmark_time": 178.1523060053587, "GFLOP/s": 136.49672506548572, "strategy_time": 0.00924698542803526, "framework_time": 1.6050440026447177, "timestamp": "2025-04-08 08:15:50.442719+00:00", "gridpoints/s": 9099781671.032381}, "4096,4096,1,32,3,8,1,10,1,1,4": {"grid_width": 4096, "grid_height": 4096, "block_size_x": 1, "block_size_y": 32, "tile_size_x": 3, "tile_size_y": 8, "temporal_tiling_factor": 1, "max_tfactor": 10, "loop_unroll_factor_t": 1, "sh_power": 1, "blocks_per_sm": 4, "time": 2.3335000053048134, "times": [2.2804479598999023, 2.2364161014556885, 2.1985280513763428, 2.229248046875, 2.283519983291626, 2.2261760234832764, 2.240511894226074, 2.2855679988861084, 2.2374401092529297, 2.228224039077759, 2.1872639656066895, 2.2179839611053467, 2.2323200702667236, 2.249727964401245, 2.3203840255737305, 2.3961598873138428, 2.4084479808807373, 2.382848024368286, 2.4186880588531494, 2.4299519062042236, 2.3848960399627686, 2.3900160789489746, 2.398207902908325, 2.4238080978393555, 2.4299519062042236, 2.3992319107055664, 2.437119960784912, 2.4535040855407715, 2.4268798828125, 2.4197120666503906, 2.4267520904541016, 2.392064094543457], "compile_time": 739.2686150269583, "verification_time": 0, "benchmark_time": 76.09592692460865, "GFLOP/s": 107.84582790996271, "strategy_time": 0.00871601514518261, "framework_time": 1.589384046383202, "timestamp": "2025-04-08 08:15:51.259714+00:00", "gridpoints/s": 7189721860.664181}, "4096,4096,128,4,1,8,5,10,5,0,0": {"grid_width": 4096, "grid_height": 4096, "block_size_x": 128, "block_size_y": 4, "tile_size_x": 1, "tile_size_y": 8, "temporal_tiling_factor": 5, "max_tfactor": 10, "loop_unroll_factor_t": 5, "sh_p