compare_real_world_impact/results/hotspot/A4000_f=pythonconstraint_i=6.json
{"device_name": "NVIDIA RTX A4000", "kernel_name": "calculate_temp", "problem_size": [4096, 4096], "tune_params_keys": ["grid_width", "grid_height", "block_size_x", "block_size_y", "tile_size_x", "tile_size_y", "temporal_tiling_factor", "max_tfactor", "loop_unroll_factor_t", "sh_power", "blocks_per_sm"], "tune_params": {"grid_width": [4096], "grid_height": [4096], "block_size_x": [1, 2, 4, 8, 16, 32, 64, 96, 128, 160, 192, 224, 256, 288, 320, 352, 384, 416, 448, 480, 512, 544, 576, 608, 640, 672, 704, 736, 768, 800, 832, 864, 896, 928, 960, 992, 1024], "block_size_y": [1, 2, 4, 8, 16, 32], "tile_size_x": [1, 2, 3, 4, 5, 6, 7, 8, 9, 10], "tile_size_y": [1, 2, 3, 4, 5, 6, 7, 8, 9, 10], "temporal_tiling_factor": [1, 2, 3, 4, 5, 6, 7, 8, 9, 10], "max_tfactor": [10], "loop_unroll_factor_t": [1, 2, 3, 4, 5, 6, 7, 8, 9, 10], "sh_power": [0, 1], "blocks_per_sm": [0, 1, 2, 3, 4]}, "objective": "GFLOP/s", "cache": {"4096,4096,32,1,8,1,4,10,1,1,0": {"grid_width": 4096, "grid_height": 4096, "block_size_x": 32, "block_size_y": 1, "tile_size_x": 8, "tile_size_y": 1, "temporal_tiling_factor": 4, "max_tfactor": 10, "loop_unroll_factor_t": 1, "sh_power": 1, "blocks_per_sm": 0, "time": 26.968150079250336, "times": [27.039743423461914, 26.97420883178711, 26.968063354492188, 26.92403221130371, 26.97318458557129, 26.93222427368164, 26.93836784362793, 26.96294403076172, 26.96601676940918, 27.014144897460938, 26.96601676940918, 26.962879180908203, 26.96294403076172, 26.92095947265625, 27.010944366455078, 26.9619197845459, 26.95769691467285, 27.007999420166016, 26.92915153503418, 26.899456024169922, 26.92812728881836, 26.992639541625977, 26.9486083984375, 27.005952835083008, 26.979328155517578, 27.017215728759766, 26.960895538330078, 26.994688034057617, 26.94758415222168, 26.94758415222168, 27.014144897460938, 26.97113609313965], "compile_time": 766.4920610841364, "verification_time": 0, "benchmark_time": 864.4981000106782, "GFLOP/s": 37.32673383386861, "strategy_time": 2128.8145990110934, "framework_time": 0, "timestamp": "2025-04-08 02:36:17.552820+00:00", "gridpoints/s": 2488448922.257907}, "4096,4096,64,2,1,7,1,10,1,1,2": {"grid_width": 4096, "grid_height": 4096, "block_size_x": 64, "block_size_y": 2, "tile_size_x": 1, "tile_size_y": 7, "temporal_tiling_factor": 1, "max_tfactor": 10, "loop_unroll_factor_t": 1, "sh_power": 1, "blocks_per_sm": 2, "time": 1.4707759879529476, "times": [1.5175679922103882, 1.4704639911651611, 1.4663679599761963, 1.465343952178955, 1.4643199443817139, 1.465343952178955, 1.465343952178955, 1.4643199443817139, 1.465343952178955, 1.4653120040893555, 1.4643199443817139, 1.4643199443817139, 1.465343952178955, 1.4643199443817139, 1.4643199443817139, 1.4643199443817139, 1.4643199443817139, 1.4652800559997559, 1.4642879962921143, 1.465343952178955, 1.4643199443817139, 1.4714879989624023, 1.4776320457458496, 1.4776320457458496, 1.4776320457458496, 1.4765440225601196, 1.478592038154602, 1.4766080379486084, 1.4776320457458496, 1.4766080379486084, 1.4766080379486084, 1.4776320457458496], "compile_time": 726.6104170121253, "verification_time": 0, "benchmark_time": 48.22302400134504, "GFLOP/s": 171.10575781853933, "strategy_time": 0.008236034773290157, "framework_time": 1.6291389474645257, "timestamp": "2025-04-08 02:36:18.329322+00:00", "gridpoints/s": 11407050521.235956}, "4096,4096,8,16,3,10,3,10,1,0,0": {"grid_width": 4096, "grid_height": 4096, "block_size_x": 8, "block_size_y": 16, "tile_size_x": 3, "tile_size_y": 10, "temporal_tiling_factor": 3, "max_tfactor": 10, "loop_unroll_factor_t": 1, "sh_power": 0, "blocks_per_sm": 0, "time": 8.90822297334671, "times": [8.957951545715332, 8.90982437133789, 8.923135757446289, 8.91801643371582, 8.90675163269043, 8.90880012512207, 8.90675163269043, 8.904704093933105, 8.888319969177246, 8.90982437133789, 8.910847663879395, 8.902655601501465, 8.904704093933105, 8.905728340148926, 8.919039726257324, 8.901632308959961, 8.90060806274414, 8.90982437133789, 8.900511741638184, 8.897536277770996, 8.903679847717285, 8.902655601501465, 8.898655891418457, 8.901632308959961, 8.911871910095215, 8.89958381652832, 8.907744407653809, 8.912896156311035, 8.910847663879395, 8.902655601501465, 8.912896156311035, 8.910847663879395], "compile_time": 850.5112549755722, "verification_time": 0, "benchmark_time": 286.4434689981863, "GFLOP/s": 84.75031689921488, "strategy_time": 0.009186915121972561, "framework_time": 1.5044070314615965, "timestamp": "2025-04-08 02:36:19.467821+00:00", "gridpoints/s": 5650021126.614325}, "4096,4096,32,2,1,7,5,10,1,1,1": {"grid_width": 4096, "grid_height": 4096, "block_size_x": 32, "block_size_y": 2, "tile_size_x": 1, "tile_size_y": 7, "temporal_tiling_factor": 5, "max_tfactor": 10, "loop_unroll_factor_t": 1, "sh_power": 1, "blocks_per_sm": 1, "time": 16.41051286458969, "times": [16.457727432250977, 16.41472053527832, 16.412704467773438, 16.409503936767578, 16.4136962890625, 16.4105281829834, 16.4085750579834, 16.40959930419922, 16.4085750579834, 16.40959930419922, 16.41062355041504, 16.406431198120117, 16.4085750579834, 16.40959930419922, 16.40959930419922, 16.40550422668457, 16.40652847290039, 16.41059112548828, 16.4085750579834, 16.40755271911621, 16.4085750579834, 16.40652847290039, 16.41062355041504, 16.411680221557617, 16.40755271911621, 16.407424926757812, 16.40652847290039, 16.407520294189453, 16.40652847290039, 16.408544540405273, 16.407455444335938, 16.408639907836914], "compile_time": 761.1671570921317, "verification_time": 0, "benchmark_time": 526.3991319807246, "GFLOP/s": 76.67592173277644, "strategy_time": 0.009036972187459469, "framework_time": 1.5671319561079144, "timestamp": "2025-04-08 02:36:20.756994+00:00", "gridpoints/s": 5111728115.51843}, "4096,4096,32,2,5,3,6,10,2,1,0": {"grid_width": 4096, "grid_height": 4096, "block_size_x": 32, "block_size_y": 2, "tile_size_x": 5, "tile_size_y": 3, "temporal_tiling_factor": 6, "max_tfactor": 10, "loop_unroll_factor_t": 2, "sh_power": 1, "blocks_per_sm": 0, "time": 19.524553060531616, "times": [19.572736740112305, 19.53273582458496, 19.522560119628906, 19.51628875732422, 19.520511627197266, 19.507200241088867, 19.526655197143555, 19.52454376220703, 19.514368057250977, 19.521472930908203, 19.52444839477539, 19.526655197143555, 19.520511627197266, 19.520448684692383, 19.524608612060547, 19.524511337280273, 19.524608612060547, 19.526655197143555, 19.521535873413086, 19.511199951171875, 19.530752182006836, 19.526655197143555, 19.524608612060547, 19.523584365844727, 19.520511627197266, 19.528703689575195, 19.525632858276367, 19.537919998168945, 19.520511627197266, 19.514368057250977, 19.522560119628906, 19.525632858276367], "compile_time": 800.4177008988336, "verification_time": 0, "benchmark_time": 625.9969900129363, "GFLOP/s": 77.33592852644213, "strategy_time": 0.00921695027500391, "framework_time": 1.5436680987477303, "timestamp": "2025-04-08 02:36:22.184991+00:00", "gridpoints/s": 5155728568.429476}, "4096,4096,448,1,1,6,3,10,3,0,2": {"grid_width": 4096, "grid_height": 4096, "block_size_x": 448, "block_size_y": 1, "tile_size_x": 1, "tile_size_y": 6, "temporal_tiling_factor": 3, "max_tfactor": 10, "loop_unroll_factor_t": 3, "sh_power": 0, "blocks_per_sm": 2, "time": 6.658284023404121, "times": [6.709216117858887, 6.662144184112549, 6.65996789932251, 6.658048152923584, 6.656000137329102, 6.659071922302246, 6.657023906707764, 6.656000137329102, 6.658048152923584, 6.656864166259766, 6.657023906707764, 6.657023906707764, 6.657023906707764, 6.656000137329102, 6.654975891113281, 6.654975891113281, 6.657023906707764, 6.656000137329102, 6.6559038162231445, 6.656832218170166, 6.654975891113281, 6.656000137329102, 6.654975891113281, 6.654975891113281, 6.657023906707764, 6.656000137329102, 6.658048152923584, 6.653952121734619, 6.656000137329102, 6.656991958618164, 6.656000137329102, 6.654975891113281], "compile_time": 703.856335952878, "verification_time": 0, "benchmark_time": 215.29213793110102, "GFLOP/s": 113.3887826572485, "strategy_time": 0.00957702286541462, "framework_time": 1.5328481094911695, "timestamp": "2025-04-08 02:36:23.105712+00:00", "gridpoints/s": 7559252177.1499}, "4096,4096,32,1,3,6,6,10,2,0,0": {"grid_width": 4096, "grid_height": 4096, "block_size_x": 32, "block_size_y": 1, "tile_size_x": 3, "tile_size_y": 6, "temporal_tiling_factor": 6, "max_tfactor": 10, "loop_unroll_factor_t": 2, "sh_power": 0, "blocks_per_sm": 0, "time": 34.14664888381958, "times": [34.21593475341797, 34.14527893066406, 34.16166305541992, 34.12684631347656, 34.1473274230957, 34.14323043823242, 34.13606262207031, 34.109439849853516, 34.15654373168945, 34.16057586669922, 34.140159606933594, 34.153472900390625, 34.13811111450195, 34.142208099365234, 34.164737701416016, 34.15039825439453, 34.15536117553711, 34.130943298339844, 34.153472900390625, 34.125823974609375, 34.114559173583984, 34.155521392822266, 34.144256591796875, 34.14118576049805, 34.129920959472656, 34.158592224121094, 34.148353576660156, 34.140159606933594, 34.142208099365234, 34.13811111450195, 34.16678237915039, 34.155521392822266], "compile_time": 856.7981410305947, "verification_time": 0, "benchmark_time": 1094.2022480303422, "GFLOP/s": 44.219549775951535, "strategy_time": 0.01013907603919506, "framework_time": 1.4615448890253901, "timestamp": "2025-04-08 02:36:25.058216+00:00", "gridpoints/s": 2947969985.063436}, "4096,4096,8,16,2,4,8,10,4,0,2": {"grid_width": 4096, "grid_height": 4096, "block_size_x": 8, "block_size_y": 16, "tile_size_x": 2, "tile_size_y": 4, "temporal_tiling_factor": 8, "max_tfactor": 10, "loop_unroll_factor_t": 4, "sh_power": 0, "blocks_per_sm": 2, "time": 27.953063130378723, "times": [28.001279830932617, 27.95315170288086, 27.95008087158203, 27.947872161865234, 27.94598388671875, 27.94700813293457, 27.949247360229492, 27.95008087158203, 27.95417594909668, 27.95929527282715, 27.9552001953125, 27.95929527282715, 27.9550724029541, 27.95417594909668, 27.95929527282715, 27.95929527282715, 27.95315170288086, 27.95008087158203, 27.95008087158203, 27.94915199279785, 27.94918441772461, 27.94803237915039, 27.94803237915039, 27.946048736572266, 27.94495964050293, 27.94905662536621, 27.94803237915039, 27.94803237915039, 27.947040557861328, 27.95724868774414, 27.95315170288086, 27.95622444152832], "compile_time": 988.5308149969205, "verification_time": 0, "benchmark_time": 896.1849689949304, "GFLOP/s": 72.02308779577113, "strategy_time": 0.008967006579041481, "framework_time": 1.6346679767593741, "timestamp": "2025-04-08 02:36:26.944607+00:00", "gridpoints/s": 4801539186.384742}, "4096,4096,8,32,4,1,7,10,1,0,4": {"grid_width": 4096, "grid_height": 4096, "block_size_x": 8, "block_size_y": 32, "tile_size_x": 4, "tile_size_y": 1, "temporal_tiling_factor": 7, "max_tfactor": 10, "loop_unroll_factor_t": 1, "sh_power": 0, "blocks_per_sm": 4, "time": 15.285296946763992, "times": [15.336416244506836, 15.28934383392334, 15.2871675491333, 15.28217601776123, 15.281248092651367, 15.28320026397705, 15.284223556518555, 15.284223556518555, 15.284223556518555, 15.284223556518555, 15.28320026397705, 15.28115177154541, 15.28115177154541, 15.285247802734375, 15.284159660339355, 15.284223556518555, 15.28320026397705, 15.283103942871094, 15.28217601776123, 15.28217601776123, 15.28217601776123, 15.286144256591797, 15.286272048950195, 15.28115177154541, 15.284223556518555, 15.284128189086914, 15.28320026397705, 15.28217601776123, 15.28320026397705, 15.28320026397705, 15.28320026397705, 15.284192085266113], "compile_time": 806.7048259545118, "verification_time": 0, "benchmark_time": 490.87126494850963, "GFLOP/s": 115.24850882095195, "strategy_time": 0.009789015166461468, "framework_time": 1.4861200470477343, "timestamp": "2025-04-08 02:36:28.243709+00:00", "gridpoints/s": 7683233921.396796}, "4096,4096,8,4,1,1,6,10,1,0,0": {"grid_width": 4096, "grid_height": 4096, "block_size_x": 8, "block_size_y": 4, "tile_size_x": 1, "tile_size_y": 1, "temporal_tiling_factor": 6, "max_tfactor": 10, "loop_unroll_factor_t": 1, "sh_power": 0, "blocks_per_sm": 0, "time": 46.27770400047302, "times": [46.32575988769531, 46.280704498291016, 46.27763366699219, 46.276607513427734, 46.27251052856445, 46.27241516113281, 46.276607513427734, 46.276607513427734, 46.27558517456055, 46.27251052856445, 46.27439880371094, 46.271488189697266, 46.27558517456055, 46.27558517456055, 46.27558517456055, 46.27654266357422, 46.276607513427734, 46.27859115600586, 46.277503967285156, 46.276607513427734, 46.27763366699219, 46.280609130859375, 46.278526306152344, 46.278656005859375, 46.278656005859375, 46.276607513427734, 46.275550842285156, 46.273536682128906, 46.27558517456055, 46.27558517456055, 46.278656005859375, 46.271488189697266], "compile_time": 802.9004769632593, "verification_time": 0, "benchmark_time": 1482.837109011598, "GFLOP/s": 32.62801110410677, "strategy_time": 0.00912696123123169, "framework_time": 1.5073700342327356, "timestamp": "2025-04-08 02:36:30.530993+00:00", "gridpoints/s": 2175200740.2737846}, "4096,4096,4,32,2,1,8,10,2,0,2": {"grid_width": 4096, "grid_height": 4096, "block_size_x": 4, "block_size_y": 32, "tile_size_x": 2, "tile_size_y": 1, "temporal_tiling_factor": 8, "max_tfactor": 10, "loop_unroll_factor_t": 2, "sh_power": 0, "blocks_per_sm": 2, "time": 32.545905351638794, "times": [32.59584045410156, 32.55091094970703, 32.55091094970703, 32.546817779541016, 32.542720794677734, 32.54579162597656, 32.54374313354492, 32.542720794677734, 32.54169464111328, 32.544769287109375, 32.54579162597656, 32.542625427246094, 32.53862380981445, 32.54169464111328, 32.546817779541016, 32.54374313354492, 32.540672302246094, 32.542720794677734, 32.544769287109375, 32.542720794677734, 32.546817779541016, 32.54256057739258, 32.54774475097656, 32.546817779541016, 32.54579162597656, 32.542720794677734, 32.540672302246094, 32.542720794677734, 32.544769287109375, 32.54374313354492, 32.54169464111328, 32.546817779541016], "compile_time": 837.289000977762, "verification_time": 0, "benchmark_time": 1043.3770229574293, "GFLOP/s": 61.85926918449129, "strategy_time": 0.009348033927381039, "framework_time": 1.5747570432722569, "timestamp": "2025-04-08 02:36:32.413274+00:00", "gridpoints/s": 4123951278.966086}, "4096,4096,2,16,8,6,2,10,1,0,1": {"grid_width": 4096, "grid_height": 4096, "block_size_x": 2, "block_size_y": 16, "tile_size_x": 8, "tile_size_y": 6, "temporal_tiling_factor": 2, "max_tfactor": 10, "loop_unroll_factor_t": 1, "sh_power": 0, "blocks_per_sm": 1, "time": 3.3504039868712425, "times": [3.412992000579834, 3.357599973678589, 3.3556160926818848, 3.353600025177002, 3.3515520095825195, 3.3454079627990723, 3.3474559783935547, 3.357696056365967, 3.344383955001831, 3.350399971008301, 3.3494720458984375, 3.34335994720459, 3.3454079627990723, 3.34335994720459, 3.3464319705963135, 3.346303939819336, 3.3474559783935547, 3.353600025177002, 3.34335994720459, 3.3483200073242188, 3.3464319705963135, 3.34335994720459, 3.3413119316101074, 3.3474559783935547, 3.348479986190796, 3.348479986190796, 3.3513920307159424, 3.3515520095825195, 3.3464319705963135, 3.3454079627990723, 3.3525760173797607, 3.3462719917297363], "compile_time": 875.6934209959581, "verification_time": 0, "benchmark_time": 108.63144195172936, "GFLOP/s": 150.2256092018382, "strategy_time": 0.009638955816626549, "framework_time": 1.354064093902707, "timestamp": "2025-04-08 02:36:33.398993+00:00", "gridpoints/s": 10015040613.45588}, "4096,4096,192,1,3,2,4,10,1,0,1": {"grid_width": 4096, "grid_height": 4096, "block_size_x": 192, "block_size_y": 1, "tile_size_x": 3, "tile_size_y": 2, "temporal_tiling_factor": 4, "max_tfactor": 10, "loop_unroll_factor_t": 1, "sh_power": 0, "blocks_per_sm": 1, "time": 21.723200857639313, "times": [20.71251106262207, 21.327871322631836, 24.974336624145508, 24.959999084472656, 24.945663452148438, 24.954879760742188, 24.91993522644043, 24.952831268310547, 24.954879760742188, 24.30361557006836, 20.65100860595703, 20.620288848876953, 20.643840789794922, 20.64896011352539, 20.6428165435791, 20.66124725341797, 20.64793586730957, 20.6376953125, 20.647872924804688, 20.65203285217285, 20.6376953125, 20.65007972717285, 20.62950325012207, 20.65100860595703, 20.63871955871582, 20.64076805114746, 20.618240356445312, 20.64793586730957, 20.63155174255371, 20.66431999206543, 20.64486312866211, 20.627519607543945], "compile_time": 710.385704995133, "verification_time": 0, "benchmark_time": 696.4223040267825, "GFLOP/s": 46.339071603529426, "strategy_time": 0.009116949513554573, "framework_time": 1.488003064878285, "timestamp": "2025-04-08 02:36:34.807329+00:00", "gridpoints/s": 3089271440.2352953}, "4096,4096,4,16,1,6,8,10,2,0,3": {"grid_width": 4096, "grid_height": 4096, "block_size_x": 4, "block_size_y": 16, "tile_size_x": 1, "tile_size_y": 6, "temporal_tiling_factor": 8, "max_tfactor": 10, "loop_unroll_factor_t": 2, "sh_power": 0, "blocks_per_sm": 3, "time": 42.49015498161316, "times": [42.54412841796875, 42.4969596862793, 42.4898567199707, 42.48780822753906, 42.4898567199707, 42.48969650268555, 42.48883056640625, 42.48780822753906, 42.49087905883789, 42.48883056640625, 42.486785888671875, 42.48668670654297, 42.48883056640625, 42.486785888671875, 42.4898567199707, 42.48883056640625, 42.486785888671875, 42.48780822753906, 42.49292755126953, 42.49087905883789, 42.48767852783203, 42.48883056640625, 42.4898567199707, 42.49087905883789, 42.4857292175293, 42.484737396240234, 42.48771286010742, 42.48883056640625, 42.484737396240234, 42.48371124267578, 42.48371124267578, 42.48771286010742], "compile_time": 837.5725720543414, "verification_time": 0, "benchmark_time": 1361.6919080959633, "GFLOP/s": 47.38193873077667, "strategy_time": 0.009206938557326794, "framework_time": 1.5291610034182668, "timestamp": "2025-04-08 02:36:37.008164+00:00", "gridpoints/s": 3158795915.385111}, "4096,4096,16,4,1,10,6,10,3,1,0": {"grid_width": 4096, "grid_height": 4096, "block_size_x": 16, "block_size_y": 4, "tile_size_x": 1, "tile_size_y": 10, "temporal_tiling_factor": 6, "max_tfactor": 10, "loop_unroll_factor_t": 3, "sh_power": 1, "blocks_per_sm": 0, "time": 17.385352909564972, "times": [17.43462371826172, 17.3885440826416, 17.390592575073242, 17.381376266479492, 17.38444709777832, 17.38547134399414, 17.381376266479492, 17.381376266479492, 17.381376266479492, 17.381343841552734, 17.38444709777832, 17.381376266479492, 17.38649559020996, 17.382240295410156, 17.38444709777832, 17.38547134399414, 17.383424758911133, 17.382400512695312, 17.382400512695312, 17.383392333984375, 17.38649559020996, 17.381216049194336, 17.386335372924805, 17.382400512695312, 17.38444709777832, 17.383424758911133, 17.3853759765625, 17.382400512695312, 17.381376266479492, 17.38444709777832, 17.38444709777832, 17.38230323791504], "compile_time": 903.7995289545506, "verification_time": 0, "benchmark_time": 558.418803033419, "GFLOP/s": 86.85181415956559, "strategy_time": 0.010269926860928535, "framework_time": 1.5710190637037158, "timestamp": "2025-04-08 02:36:38.471994+00:00", "gridpoints/s": 5790120943.97104}, "4096,4096,4,8,6,3,8,10,2,0,4": {"grid_width": 4096, "grid_height": 4096, "block_size_x": 4, "block_size_y": 8, "tile_size_x": 6, "tile_size_y": 3, "temporal_tiling_factor": 8, "max_tfactor": 10, "loop_unroll_factor_t": 2, "sh_power": 0, "blocks_per_sm": 4, "time": 22.400527954101562, "times": [22.452064514160156, 22.399999618530273, 22.401119232177734, 22.401023864746094, 22.397951126098633, 22.394880294799805, 22.40297508239746, 22.395904541015625, 22.4050235748291, 22.394880294799805, 22.394880294799805, 22.394880294799805, 22.404096603393555, 22.406143188476562, 22.40496063232422, 22.405120849609375, 22.403072357177734, 22.395904541015625, 22.399967193603516, 22.401023864746094, 22.399999618530273, 22.401023864746094, 22.396928787231445, 22.393856048583984, 22.39379119873047, 22.393856048583984, 22.393856048583984, 22.396928787231445, 22.397951126098633, 22.397951126098633, 22.391807556152344, 22.403072357177734], "compile_time": 857.8771390020847, "verification_time": 0, "benchmark_time": 718.3993910439312, "GFLOP/s": 89.87582453972334, "strategy_time": 0.009597977623343468, "framework_time": 1.516828895546496, "timestamp": "2025-04-08 02:36:40.049828+00:00", "gridpoints/s": 5991721635.981556}, "4096,4096,32,1,4,9,8,10,4,1,1": {"grid_width": 4096, "grid_height": 4096, "block_size_x": 32, "block_size_y": 1, "tile_size_x": 4, "tile_size_y": 9, "temporal_tiling_factor": 8, "max_tfactor": 10, "loop_unroll_factor_t": 4, "sh_power": 1, "blocks_per_sm": 1, "time": 28.66984397172928, "times": [28.708864212036133, 28.648448944091797, 28.716032028198242, 28.658687591552734, 28.642112731933594, 28.706815719604492, 28.660736083984375, 28.660736083984375, 28.650495529174805, 28.652544021606445, 28.656639099121094, 28.663808822631836, 28.687360763549805, 28.664831161499023, 28.676095962524414, 28.647327423095703, 28.663808822631836, 28.711936950683594, 28.644351959228516, 28.688383102416992, 28.674047470092773, 28.693504333496094, 28.627967834472656, 28.679168701171875, 28.691455841064453, 28.669952392578125, 28.656639099121094, 28.661760330200195, 28.669952392578125, 28.692415237426758, 28.656639099121094, 28.651487350463867], "compile_time": 948.9267400931567, "verification_time": 0, "benchmark_time": 919.0457200165838, "GFLOP/s": 70.2224233234488, "strategy_time": 0.009638024494051933, "framework_time": 1.4867119025439024, "timestamp": "2025-04-08 02:36:41.919328+00:00", "gridpoints/s": 4681494888.229919}, "4096,4096,2,16,7,6,1,10,1,1,0": {"grid_width": 4096, "grid_height": 4096, "block_size_x": 2, "block_size_y": 16, "tile_size_x": 7, "tile_size_y": 6, "temporal_tiling_factor": 1, "max_tfactor": 10, "loop_unroll_factor_t": 1, "sh_power": 1, "blocks_per_sm": 0, "time": 1.7815079987049103, "times": [1.810431957244873, 1.751039981842041, 1.7551360130310059, 1.7469439506530762, 1.740671992301941, 1.760256052017212, 1.743872046470642, 1.756160020828247, 1.763327956199646, 1.7479679584503174, 1.7508800029754639, 1.7571840286254883, 1.7571840286254883, 1.7592320442199707, 1.7612799406051636, 1.7520639896392822, 1.7829439640045166, 1.8053120374679565, 1.8165760040283203, 1.8012160062789917, 1.8044480085372925, 1.8063360452651978, 1.8135039806365967, 1.8095999956130981, 1.8063360452651978, 1.8113600015640259, 1.814527988433838, 1.8042880296707153, 1.8012160062789917, 1.798143982887268, 1.8094079494476318, 1.8094079494476318], "compile_time": 774.7862739488482, "verification_time": 0, "benchmark_time": 58.01635200623423, "GFLOP/s": 141.2613584575237, "strategy_time": 0.009248033165931702, "framework_time": 1.5979090239852667, "timestamp": "2025-04-08 02:36:42.753770+00:00", "gridpoints/s": 9417423897.168247}, "4096,4096,32,2,5,5,7,10,1,0,3": {"grid_width": 4096, "grid_height": 4096, "block_size_x": 32, "block_size_y": 2, "tile_size_x": 5, "tile_size_y": 5, "temporal_tiling_factor": 7, "max_tfactor": 10, "loop_unroll_factor_t": 1, "sh_power": 0, "blocks_per_sm": 3, "time": 19.701104938983917, "times": [19.735551834106445, 19.69139289855957, 19.705856323242188, 19.717119216918945, 19.671039581298828, 19.65465545654297, 19.694496154785156, 19.69254493713379, 19.680160522460938, 19.686399459838867, 19.724288940429688, 19.671039581298828, 19.716096878051758, 19.702783584594727, 19.718143463134766, 19.719167709350586, 19.68332862854004, 19.719167709350586, 19.671039581298828, 19.714048385620117, 19.706880569458008, 19.697664260864258, 19.72822380065918, 19.701759338378906, 19.708927154541016, 19.693567276000977, 19.719167709350586, 19.68332862854004, 19.700735092163086, 19.708927154541016, 19.69152069091797, 19.726335525512695], "compile_time": 844.1209270386025, "verification_time": 0, "benchmark_time": 631.9621519651264, "GFLOP/s": 89.41669441667644, "strategy_time": 0.009178067557513714, "framework_time": 1.317193964496255, "timestamp": "2025-04-08 02:36:44.231210+00:00", "gridpoints/s": 5961112961.111762}, "4096,4096,256,1,1,7,6,10,3,0,2": {"grid_width": 4096, "grid_height": 4096, "block_size_x": 256, "block_size_y": 1, "tile_size_x": 1, "tile_size_y": 7, "temporal_tiling_factor": 6, "max_tfactor": 10, "loop_unroll_factor_t": 3, "sh_power": 0, "blocks_per_sm": 2, "time": 16.232659995555878, "times": [16.288768768310547, 16.2293758392334, 16.232383728027344, 16.235519409179688, 16.22323226928711, 16.234495162963867, 16.22323226928711, 16.22323226928711, 16.23142433166504, 16.226303100585938, 16.234495162963867, 16.23040008544922, 16.226303100585938, 16.22528076171875, 16.228351593017578, 16.23040008544922, 16.2293758392334, 16.22831916809082, 16.23244857788086, 16.23244857788086, 16.23142433166504, 16.234464645385742, 16.2293758392334, 16.237567901611328, 16.234495162963867, 16.23244857788086, 16.23961639404297, 16.22323226928711, 16.2293758392334, 16.23641586303711, 16.23347282409668, 16.23744010925293], "compile_time": 974.1946050198749, "verification_time": 0, "benchmark_time": 521.1115279234946, "GFLOP/s": 93.01922423148078, "strategy_time": 0.009357929229736328, "framework_time": 1.6059151384979486, "timestamp": "2025-04-08 02:36:45.728162+00:00", "gridpoints/s": 6201281615.432052}, "4096,4096,8,8,1,5,8,10,4,0,3": {"grid_width": 4096, "grid_height": 4096, "block_size_x": 8, "block_size_y": 8, "tile_size_x": 1, "tile_size_y": 5, "temporal_tiling_factor": 8, "max_tfactor": 10, "loop_unroll_factor_t": 4, "sh_power": 0, "blocks_per_sm": 3, "time": 30.943826019763947, "times": [30.99648094177246, 30.946304321289062, 30.94220733642578, 30.94108772277832, 30.94121551513672, 30.940160751342773, 30.9432315826416, 30.94316864013672, 30.944255828857422, 30.94108772277832, 30.944255828857422, 30.94118309020996, 30.94220733642578, 30.944255828857422, 30.944255828857422, 30.944255828857422, 30.94118309020996, 30.944255828857422, 30.940160751342773, 30.938112258911133, 30.939136505126953, 30.94316864013672, 30.945215225219727, 30.940160751342773, 30.9432315826416, 30.9432315826416, 30.94419288635254, 30.941152572631836, 30.940160751342773, 30.938112258911133, 30.939136505126953, 30.94220733642578], "compile_time": 971.1879689712077, "verification_time": 0, "benchmark_time": 992.2070848988369, "GFLOP/s": 65.06195836009803, "strategy_time": 0.009928015060722828, "framework_time": 1.5110780950635672, "timestamp": "2025-04-08 02:36:47.693110+00:00", "gridpoints/s": 4337463890.673202}, "4096,4096,8,4,6,5,10,10,5,0,1": {"grid_width": 4096, "grid_height": 4096, "block_size_x": 8, "block_size_y": 4, "tile_size_x": 6, "tile_size_y": 5, "temporal_tiling_factor": 10, "max_tfactor": 10, "loop_unroll_factor_t": 5, "sh_power": 0, "blocks_per_sm": 1, "time": 30.631282806396484, "times": [30.680063247680664, 30.629728317260742, 30.6298885345459, 30.624767303466797, 30.641151428222656, 30.638944625854492, 30.625791549682617, 30.61248016357422, 30.623743057250977, 30.61452865600586, 30.631935119628906, 30.635007858276367, 30.617599487304688, 30.640127182006836, 30.627840042114258, 30.62067222595215, 30.619647979736328, 30.632959365844727, 30.626815795898438, 30.640127182006836, 30.632959365844727, 30.640031814575195, 30.628864288330078, 30.619647979736328, 30.634143829345703, 30.625791549682617, 30.632959365844727, 30.636032104492188, 30.638080596923828, 30.636032104492188, 30.631935119628906, 30.630752563476562], "compile_time": 1169.5947969565168, "verification_time": 0, "benchmark_time": 981.5539889968932, "GFLOP/s": 82.15726438575672, "strategy_time": 0.009697978384792805, "framework_time": 1.6434550052508712, "timestamp": "2025-04-08 02:36:49.845944+00:00", "gridpoints/s": 5477150959.050447}, "4096,4096,2,16,2,4,8,10,4,1,0": {"grid_width": 4096, "grid_height": 4096, "block_size_x": 2, "block_size_y": 16, "tile_size_x": 2, "tile_size_y": 4, "temporal_tiling_factor": 8, "max_tfactor": 10, "loop_unroll_factor_t": 4, "sh_power": 1, "blocks_per_sm": 0, "time": 37.7750289440155, "times": [37.827552795410156, 37.7784309387207, 37.7784309387207, 37.77334213256836, 37.77619171142578, 37.771263122558594, 37.7784309387207, 37.77228927612305, 37.77519989013672, 37.779457092285156, 37.775360107421875, 37.77228927612305, 37.770240783691406, 37.773311614990234, 37.76921463012695, 37.76716613769531, 37.770240783691406, 37.7784309387207, 37.77228927612305, 37.773311614990234, 37.771263122558594, 37.77433776855469, 37.775360107421875, 37.771263122558594, 37.773311614990234, 37.768192291259766, 37.77228927612305, 37.771263122558594, 37.77433776855469, 37.775360107421875, 37.77228927612305, 37.76921463012695], "compile_time": 898.2441120315343, "verification_time": 0, "benchmark_time": 1210.8803889714181, "GFLOP/s": 53.29621118183024, "strategy_time": 0.010189018212258816, "framework_time": 1.6632229089736938, "timestamp": "2025-04-08 02:36:51.956773+00:00", "gridpoints/s": 3553080745.4553494}, "4096,4096,288,1,1,5,1,10,1,0,1": {"grid_width": 4096, "grid_height": 4096, "block_size_x": 288, "block_size_y": 1, "tile_size_x": 1, "tile_size_y": 5, "temporal_tiling_factor": 1, "max_tfactor": 10, "loop_unroll_factor_t": 1, "sh_power": 0, "blocks_per_sm": 1, "time": 1.5703869946300983, "times": [1.6190719604492188, 1.5697920322418213, 1.5677440166473389, 1.5656960010528564, 1.5656960010528564, 1.5646719932556152, 1.565567970275879, 1.5656960010528564, 1.5665919780731201, 1.5656960010528564, 1.5646719932556152, 1.5667200088500977, 1.5646719932556152, 1.5646719932556152, 1.5646719932556152, 1.5646719932556152, 1.5646719932556152, 1.5646719932556152, 1.5646719932556152, 1.5646719932556152, 1.564512014389038, 1.5646719932556152, 1.5656640529632568, 1.5697920322418213, 1.5779520273208618, 1.5779199600219727, 1.5779839754104614, 1.5779839754104614, 1.5779839754104614, 1.5769599676132202, 1.5779839754104614, 1.5779839754104614], "compile_time": 686.1042040400207, "verification_time": 0, "benchmark_time": 51.76115594804287, "GFLOP/s": 160.25237146037216, "strategy_time": 0.01029903069138527, "framework_time": 1.5860979910939932, "timestamp": "2025-04-08 02:36:52.696265+00:00", "gridpoints/s": 10683491430.691477}, "4096,4096,8,8,2,4,9,10,1,1,2": {"grid_width": 4096, "grid_height": 4096, "block_size_x": 8, "block_size_y": 8, "tile_size_x": 2, "tile_size_y": 4, "temporal_tiling_factor": 9, "max_tfactor": 10, "loop_unroll_factor_t": 1, "sh_power": 1, "blocks_per_sm": 2, "time": 35.87529158592224, "times": [35.917823791503906, 35.884033203125, 35.87059020996094, 35.88710403442383, 35.86867141723633, 35.85638427734375, 35.88505554199219, 35.86457443237305, 35.86764907836914, 35.88300704956055, 35.88710403442383, 35.8737907409668, 35.87993621826172, 35.87071990966797, 35.86048126220703, 35.88703918457031, 35.86150360107422, 35.87977600097656, 35.88300704956055, 35.871742248535156, 35.86646270751953, 35.84921646118164, 35.888126373291016, 35.890174865722656, 35.88300704956055, 35.86441421508789, 35.88198471069336, 35.87772750854492, 35.86764907836914, 35.86547088623047, 35.86345672607422, 35.871646881103516], "compile_time": 768.9930519554764, "verification_time": 0, "benchmark_time": 1149.43961892277, "GFLOP/s": 63.13326135832092, "strategy_time": 0.009848037734627724, "framework_time": 1.7004321562126279, "timestamp": "2025-04-08 02:36:54.616438+00:00", "gridpoints/s": 4208884090.554728}, "4096,4096,32,1,1,3,10,10,2,1,1": {"grid_width": 4096, "grid_height": 4096, "block_size_x": 32, "block_size_y": 1, "tile_size_x": 1, "tile_size_y": 3, "temporal_tiling_factor": 10, "max_tfactor": 10, "loop_unroll_factor_t": 2, "sh_power": 1, "blocks_per_sm": 1, "time": 109.2479612827301, "times": [109.28230285644531, 109.25769805908203, 109.24765014648438, 109.24543762207031, 109.24748992919922, 109.24748992919922, 109.24237060546875, 109.2495346069336, 109.24441528320312, 109.25055694580078, 109.2515869140625, 109.24441528320312, 109.2515869140625, 109.23206329345703, 109.23725128173828, 109.2432632446289, 109.24339294433594, 109.24031829833984, 109.24134063720703, 109.23417663574219, 109.24339294433594, 109.23725128173828, 109.24543762207031, 109.2515869140625, 109.24835205078125, 109.26182556152344, 109.25670623779297, 109.2485122680664, 109.25055694580078, 109.25260925292969, 109.25465393066406, 109.2495346069336], "compile_time": 787.9578430438414, "verification_time": 0, "benchmark_time": 3497.1372860018164, "GFLOP/s": 23.035509042472363, "strategy_time": 0.008646980859339237, "framework_time": 1.5389679465442896, "timestamp": "2025-04-08 02:36:58.903110+00:00", "gridpoints/s": 1535700602.8314908}, "4096,4096,8,8,9,4,1,10,1,0,3": {"grid_width": 4096, "grid_height": 4096, "block_size_x": 8, "block_size_y": 8, "tile_size_x": 9, "tile_size_y": 4, "temporal_tiling_factor": 1, "max_tfactor": 10, "loop_unroll_factor_t": 1, "sh_power": 0, "blocks_per_sm": 3, "time": 1.4369569830596447, "times": [1.4898879528045654, 1.439743995666504, 1.435647964477539, 1.435647964477539, 1.4315520524978638, 1.4315520524978638, 1.4314559698104858, 1.4335999488830566, 1.4325759410858154, 1.4335999488830566, 1.4325759410858154, 1.4335999488830566, 1.4325759410858154, 1.4335999488830566, 1.4315199851989746, 1.4315520524978638, 1.4315520524978638, 1.431615948677063, 1.4325759410858154, 1.4325759410858154, 1.4316799640655518, 1.4314240217208862, 1.4335999488830566, 1.4326720237731934, 1.4335999488830566, 1.4325759410858154, 1.4438400268554688, 1.44486403465271, 1.4458880424499512, 1.4458880424499512, 1.4437439441680908, 1.4438400268554688], "compile_time": 816.4250560803339, "verification_time": 0, "benchmark_time": 47.75709204841405, "GFLOP/s": 175.1327582988295, "strategy_time": 0.009487965144217014, "framework_time": 1.8806799780577421, "timestamp": "2025-04-08 02:36:59.769213+00:00", "gridpoints/s": 11675517219.921967}, "4096,4096,8,4,6,1,7,10,1,0,3": {"grid_width": 4096, "grid_height": 4096, "block_size_x": 8, "block_size_y": 4, "tile_size_x": 6, "tile_size_y": 1, "temporal_tiling_factor": 7, "max_tfactor": 10, "loop_unroll_factor_t": 1, "sh_power": 0, "blocks_per_sm": 3, "time": 38.12920010089874, "times": [38.1767692565918, 38.1317138671875, 38.13257598876953, 38.12761688232422, 38.12761688232422, 38.12761688232422, 38.1317138671875, 38.12966537475586, 38.12758255004883, 38.128639221191406, 38.126590728759766, 38.126590728759766, 38.12351989746094, 38.126590728759766, 38.12556838989258, 38.12761688232422, 38.126590728759766, 38.12351989746094, 38.12761688232422, 38.13068771362305, 38.13052749633789, 38.12752151489258, 38.12761688232422, 38.128639221191406, 38.1317138671875, 38.126590728759766, 38.12345504760742, 38.124542236328125, 38.12249755859375, 38.126590728759766, 38.12966537475586, 38.128639221191406], "compile_time": 816.21915102005, "verification_time": 0, "benchmark_time": 1221.539917984046, "GFLOP/s": 46.201013274298326, "strategy_time": 0.009506940841674805, "framework_time": 1.5933220274746418, "timestamp": "2025-04-08 02:37:01.808605+00:00", "gridpoints/s": 3080067551.6198883}, "4096,4096,16,4,3,10,3,10,3,0,4": {"grid_width": 4096, "grid_height": 4096, "block_size_x": 16, "block_size_y": 4, "tile_size_x": 3, "tile_size_y": 10, "temporal_tiling_factor": 3, "max_tfactor": 10, "loop_unroll_factor_t": 3, "sh_power": 0, "blocks_per_sm": 4, "time": 8.67087009549141, "times": [8.736767768859863, 8.668160438537598, 8.665087699890137, 8.668160438537598, 8.678400039672852, 8.669183731079102, 8.659968376159668, 8.671232223510742, 8.66096019744873, 8.670207977294922, 8.665087699890137, 8.665087699890137, 8.680447578430176, 8.667136192321777, 8.668160438537598, 8.673279762268066, 8.671232223510742, 8.652799606323242, 8.668160438537598, 8.664064407348633, 8.672256469726562, 8.664064407348633, 8.671232223510742, 8.671232223510742, 8.667136192321777, 8.674304008483887, 8.687456130981445, 8.666080474853516, 8.670207977294922, 8.663040161132812, 8.667072296142578, 8.670175552368164], "compile_time": 920.9140569437295, "verification_time": 0, "benchmark_time": 279.24770303070545, "GFLOP/s": 87.07023766767814, "strategy_time": 0.009356997907161713, "framework_time": 1.5163690550252795, "timestamp": "2025-04-08 02:37:03.010324+00:00", "gridpoints/s": 5804682511.178543}, "4096,4096,4,16,1,10,2,10,1,0,2": {"grid_width": 4096, "grid_height": 4096, "block_size_x": 4, "block_size_y": 16, "tile_size_x": 1, "tile_size_y": 10, "temporal_tiling_factor": 2, "max_tfactor": 10, "loop_unroll_factor_t": 1, "sh_power": 0, "blocks_per_sm": 2, "time": 4.448981955647469, "times": [4.481023788452148, 4.433919906616211, 4.428671836853027, 4.428736209869385, 4.427775859832764, 4.43068790435791, 4.425727844238281, 4.425663948059082, 4.427775859832764, 4.426752090454102, 4.425727844238281, 4.425727844238281, 4.430848121643066, 4.464640140533447, 4.462592124938965, 4.465663909912109, 4.465663909912109, 4.465663909912109, 4.465663909912109, 4.464640140533447, 4.462687969207764, 4.463615894317627, 4.45747184753418, 4.45747184753418, 4.456448078155518, 4.456448078155518, 4.45849609375, 4.456448078155518, 4.45849609375, 4.45747184753418, 4.455423831939697, 4.453375816345215], "compile_time": 809.6696540014818, "verification_time": 0, "benchmark_time": 143.6713261064142, "GFLOP/s": 113.13070833229563, "strategy_time": 0.009707990102469921, "framework_time": 1.619060873053968, "timestamp": "2025-04-08 02:37:03.965324+00:00", "gridpoints/s": 7542047222.153042}, "4096,4096,96,2,3,2,4,10,4,1,0": {"grid_width": 4096, "grid_height": 4096, "block_size_x": 96, "block_size_y": 2, "tile_size_x": 3, "tile_size_y": 2, "temporal_tiling_factor": 4, "max_tfactor": 10, "loop_unroll_factor_t": 4, "sh_power": 1, "blocks_per_sm": 0, "time": 11.321786016225815, "times": [11.365376472473145, 11.316224098205566, 11.325440406799316, 11.31827163696289, 11.320320129394531, 11.321215629577637, 11.328512191772461, 11.324416160583496, 11.319295883178711, 11.320320129394531, 11.31827163696289, 11.31827163696289, 11.320320129394531, 11.319295883178711, 11.317248344421387, 11.31827163696289, 11.320320129394531, 11.317248344421387, 11.314208030700684, 11.323391914367676, 11.311103820800781, 11.320320129394531, 11.323391914367676, 11.323391914367676, 11.32646369934082, 11.319295883178711, 11.321344375610352, 11.320320129394531, 11.319295883178711, 11.325440406799316, 11.324319839477539, 11.316224098205566], "compile_time": 712.7291799988598, "verification_time": 0, "benchmark_time": 363.9329440193251, "GFLOP/s": 88.91114516361148, "strategy_time": 0.009146984666585922, "framework_time": 1.5168280806392431, "timestamp": "2025-04-08 02:37:05.043542+00:00", "gridpoints/s": 5927409677.574099}, "4096,4096,32,8,3,4,3,10,3,0,3": {"grid_width": 4096, "grid_height": 4096, "block_size_x": 32, "block_size_y": 8, "tile_size_x": 3, "tile_size_y": 4, "temporal_tiling_factor": 3, "max_tfactor": 10, "loop_unroll_factor_t": 3, "sh_power": 0, "blocks_per_sm": 3, "time": 8.521716952323914, "times": [8.574975967407227, 8.526847839355469, 8.523776054382324, 8.520768165588379, 8.52070426940918, 8.520607948303223, 8.518655776977539, 8.518655776977539, 8.51968002319336, 8.522720336914062, 8.51968002319336, 8.51968002319336, 8.51968002319336, 8.51968002319336, 8.518655776977539, 8.51968002319336, 8.517631530761719, 8.51968002319336, 8.52070426940918, 8.518655776977539, 8.51968002319336, 8.51968002319336, 8.517631530761719, 8.517631530761719, 8.519519805908203, 8.52070426940918, 8.51968002319336, 8.51968002319336, 8.518655776977539, 8.521727561950684, 8.519552230834961, 8.51968002319336], "compile_time": 890.1009630644694, "verification_time": 0, "benchmark_time": 273.99756805971265, "GFLOP/s": 88.59420281427145, "strategy_time": 0.009807990863919258, "framework_time": 1.5901969745755196, "timestamp": "2025-04-08 02:37:06.209272+00:00", "gridpoints/s": 5906280187.618097}, "4096,4096,64,2,1,7,6,10,2,0,2": {"grid_width": 4096, "grid_height": 4096, "block_size_x": 64, "block_size_y": 2, "tile_size_x": 1, "tile_size_y": 7, "temporal_tiling_factor": 6, "max_tfactor": 10, "loop_unroll_factor_t": 2, "sh_power": 0, "blocks_per_sm": 2, "time": 16.29514193534851, "times": [16.349184036254883, 16.299007415771484, 16.295936584472656, 16.29475212097168, 16.293888092041016, 16.292863845825195, 16.293760299682617, 16.291839599609375, 16.291839599609375, 16.294912338256836, 16.292863845825195, 16.293888092041016, 16.292863845825195, 16.291839599609375, 16.292863845825195, 16.294719696044922, 16.293888092041016, 16.293888092041016, 16.292863845825195, 16.292863845825195, 16.292863845825195, 16.291776657104492, 16.291839599609375, 16.291839599609375, 16.292863845825195, 16.291839599609375, 16.292863845825195, 16.294912338256836, 16.294912338256836, 16.292736053466797, 16.29372787475586, 16.291839599609375], "compile_time": 846.133362967521, "verification_time": 0, "benchmark_time": 522.8838740149513, "GFLOP/s": 92.6625521883008, "strategy_time": 0.009909039363265038, "framework_time": 1.445092959329486, "timestamp": "2025-04-08 02:37:07.579776+00:00", "gridpoints/s": 6177503479.220053}, "4096,4096,8,16,6,3,6,10,6,1,0": {"grid_width": 4096, "grid_height": 4096, "block_size_x": 8, "block_size_y": 16, "tile_size_x": 6, "tile_size_y": 3, "temporal_tiling_factor": 6, "max_tfactor": 10, "loop_unroll_factor_t": 6, "sh_power": 1, "blocks_per_sm": 0, "time": 12.149831026792526, "times": [12.215167999267578, 12.156928062438965, 12.148736000061035, 12.15283203125, 12.147711753845215, 12.15078353881836, 12.142463684082031, 12.145503997802734, 12.134400367736816, 12.142592430114746, 12.15174388885498, 12.156928062438965, 12.141568183898926, 12.139519691467285, 12.140543937683105, 12.15180778503418, 12.159903526306152, 12.15180778503418, 12.14566421508789, 12.138496398925781, 12.138496398925781, 12.15283203125, 12.148736000061035, 12.15385627746582, 12.146688461303711, 12.148736000061035, 12.149760246276855, 12.148544311523438, 12.145631790161133, 12.147711753845215, 12.14463996887207, 12.15385627746582], "compile_time": 984.2779859900475, "verification_time": 0, "benchmark_time": 390.0407920591533, "GFLOP/s": 124.2774024322062, "strategy_time": 0.009176903404295444, "framework_time": 1.3641819823533297, "timestamp": "2025-04-08 02:37:08.955500+00:00", "gridpoints/s": 8285160162.14708}, "4096,4096,8,16,3,2,6,10,1,0,2": {"grid_width": 4096, "grid_height": 4096, "block_size_x": 8, "block_size_y": 16, "tile_size_x": 3, "tile_size_y": 2, "temporal_tiling_factor": 6, "max_tfactor": 10, "loop_unroll_factor_t": 1, "sh_power": 0, "blocks_per_sm": 2, "time": 18.107601046562195, "times": [18.156543731689453, 18.11235237121582, 18.109439849853516, 18.107391357421875, 18.110464096069336, 18.104320526123047, 18.108415603637695, 18.105344772338867, 18.105344772338867, 18.105344772338867, 18.103296279907227, 18.104320526123047, 18.106271743774414, 18.107391357421875, 18.104320526123047, 18.106304168701172, 18.106367111206055, 18.108415603637695, 18.106367111206055, 18.107391357421875, 18.102272033691406, 18.103296279907227, 18.106239318847656, 18.104320526123047, 18.105344772338867, 18.104320526123047, 18.108415603637695, 18.105344772338867, 18.106367111206055, 18.104320526123047, 18.10633659362793, 18.101247787475586], "compile_time": 821.751945069991, "verification_time": 0, "benchmark_time": 581.4827861031517, "GFLOP/s": 83.3876025939212, "strategy_time": 0.009177019819617271, "framework_time": 1.550871878862381, "timestamp": "2025-04-08 02:37:10.360326+00:00", "gridpoints/s": 5559173506.261414}, "4096,4096,8,4,4,7,3,10,1,1,3": {"grid_width": 4096, "grid_height": 4096, "block_size_x": 8, "block_size_y": 4, "tile_size_x": 4, "tile_size_y": 7, "temporal_tiling_factor": 3, "max_tfactor": 10, "loop_unroll_factor_t": 1, "sh_power": 1, "blocks_per_sm": 3, "time": 5.4217509329319, "times": [5.470208168029785, 5.426176071166992, 5.418911933898926, 5.422080039978027, 5.4240641593933105, 5.422080039978027, 5.422080039978027, 5.42412805557251, 5.419007778167725, 5.4231038093566895, 5.422080039978027, 5.421055793762207, 5.41593599319458, 5.4231038093566895, 5.417952060699463, 5.419007778167725, 5.424223899841309, 5.420959949493408, 5.427199840545654, 5.416959762573242, 5.417920112609863, 5.416959762573242, 5.41593599319458, 5.421055793762207, 5.419007778167725, 5.414912223815918, 5.41487979888916, 5.416959762573242, 5.422080039978027, 5.421055793762207, 5.4179840087890625, 5.416959762573242], "compile_time": 804.2258460773155, "verification_time": 0, "benchmark_time": 174.44297205656767, "GFLOP/s": 139.24924426429436, "strategy_time": 0.00928796362131834, "framework_time": 1.6824189806357026, "timestamp": "2025-04-08 02:37:11.340717+00:00", "gridpoints/s": 9283282950.95296}, "4096,4096,16,2,1,4,4,10,4,1,1": {"grid_width": 4096, "grid_height": 4096, "block_size_x": 16, "block_size_y": 2, "tile_size_x": 1, "tile_size_y": 4, "temporal_tiling_factor": 4, "max_tfactor": 10, "loop_unroll_factor_t": 4, "sh_power": 1, "blocks_per_sm": 1, "time": 13.93759086728096, "times": [13.990912437438965, 13.94371223449707, 13.938624382019043, 13.936639785766602, 13.934592247009277, 13.936639785766602, 13.935615539550781, 13.936639785766602, 13.937631607055664, 13.935615539550781, 13.935647964477539, 13.935615539550781, 13.935551643371582, 13.935615539550781, 13.935615539550781, 13.936479568481445, 13.933568000793457, 13.935615539550781, 13.934592247009277, 13.935615539550781, 13.935615539550781, 13.937664031982422, 13.935711860656738, 13.934592247009277, 13.935615539550781, 13.933568000793457, 13.934592247009277, 13.932543754577637, 13.934592247009277, 13.936639785766602, 13.936639785766602, 13.934592247009277], "compile_time": 867.9772210307419, "verification_time": 0, "benchmark_time": 448.1043010018766, "GFLOP/s": 72.22431549222112, "strategy_time": 0.009136972948908806, "framework_time": 1.5423469012603164, "timestamp": "2025-04-08 02:37:12.658380+00:00", "gridpoints/s": 4814954366.148075}, "4096,4096,4,8,3,2,4,10,4,1,4": {"grid_width": 4096, "grid_height": 4096, "block_size_x": 4, "block_size_y": 8, "tile_size_x": 3, "tile_size_y": 2, "temporal_tiling_factor": 4, "max_tfactor": 10, "loop_unroll_factor_t": 4, "sh_power": 1, "blocks_per_sm": 4, "time": 12.544485092163086, "times": [12.597248077392578, 12.547072410583496, 12.546048164367676, 12.546048164367676, 12.542976379394531, 12.542976379394531, 12.542976379394531, 12.541952133178711, 12.542911529541016, 12.542976379394531, 12.542880058288574, 12.543999671936035, 12.541952133178711, 12.541952133178711, 12.543968200683594, 12.542976379394531, 12.541952133178711, 12.543807983398438, 12.542976379394531, 12.53990364074707, 12.541952133178711, 12.542976379394531, 12.543871879577637, 12.541791915893555, 12.542976379394531, 12.542783737182617, 12.541952133178711, 12.541952133178711, 12.54092788696289, 12.54092788696289, 12.54092788696289, 12.54092788696289], "compile_time": 871.0564440116286, "verification_time": 0, "benchmark_time": 403.16716593224555, "GFLOP/s": 80.24506008850643, "strategy_time": 0.00993895810097456, "framework_time": 1.679171109572053, "timestamp": "2025-04-08 02:37:13.934329+00:00", "gridpoints/s": 5349670672.567096}, "4096,4096,16,4,3,2,4,10,1,0,2": {"grid_width": 4096, "grid_height": 4096, "block_size_x": 16, "block_size_y": 4, "tile_size_x": 3, "tile_size_y": 2, "temporal_tiling_factor": 4, "max_tfactor": 10, "loop_unroll_factor_t": 1, "sh_power": 0, "blocks_per_sm": 2, "time": 16.09543865919113, "times": [16.145408630371094, 16.099327087402344, 16.096223831176758, 16.096256256103516, 16.09609603881836, 16.093183517456055, 16.094207763671875, 16.094207763671875, 16.093183517456055, 16.093055725097656, 16.093183517456055, 16.094207763671875, 16.094207763671875, 16.094207763671875, 16.093183517456055, 16.093183517456055, 16.092159271240234, 16.091136932373047, 16.092159271240234, 16.092159271240234, 16.094207763671875, 16.094207763671875, 16.09404754638672, 16.094207763671875, 16.093183517456055, 16.093183517456055, 16.093183517456055, 16.09516716003418, 16.092159271240234, 16.092159271240234, 16.093183517456055, 16.094207763671875], "compile_time": 819.9440309545025, "verification_time": 0, "benchmark_time": 515.8330589765683, "GFLOP/s": 62.54150516271718, "strategy_time": 0.010068994015455246, "framework_time": 1.6174771590158343, "timestamp": "2025-04-08 02:37:15.271764+00:00", "gridpoints/s": 4169433677.5144787}, "4096,4096,4,8,7,4,1,10,1,0,3": {"grid_width": 4096, "grid_height": 4096, "block_size_x": 4, "block_size_y": 8, "tile_size_x": 7, "tile_size_y": 4, "temporal_tiling_factor": 1, "max_tfactor": 10, "loop_unroll_factor_t": 1, "sh_power": 0, "blocks_per_sm": 3, "time": 1.458963006734848, "times": [1.4959360361099243, 1.4458880424499512, 1.4417920112609863, 1.4417920112609863, 1.4417920112609863, 1.4407680034637451, 1.4417920112609863, 1.4407680034637451, 1.4416639804840088, 1.4407680034637451, 1.440608024597168, 1.439743995666504, 1.4428160190582275, 1.4407680034637451, 1.4407680034637451, 1.4387199878692627, 1.4407680034637451, 1.4407680034637451, 1.4407680034637451, 1.4387199878692627, 1.439743995666504, 1.4826560020446777, 1.4888960123062134, 1.4878720045089722, 1.4878720045089722, 1.4888960123062134, 1.4880319833755493, 1.4899200201034546, 1.4888960123062134, 1.4888319969177246, 1.4888960123062134, 1.4888960123062134], "compile_time": 790.269668912515, "verification_time": 0, "benchmark_time": 48.698063008487225, "GFLOP/s": 172.49117272905355, "strategy_time": 0.00968901440501213, "framework_time": 1.5544290654361248, "timestamp": "2025-04-08 02:37:16.112326+00:00", "gridpoints/s": 11499411515.270237}, "4096,4096,2,16,3,2,4,10,2,1,3": {"grid_width": 4096, "grid_height": 4096, "block_size_x": 2, "block_size_y": 16, "tile_size_x": 3, "tile_size_y": 2, "temporal_tiling_factor": 4, "max_tfactor": 10, "loop_unroll_factor_t": 2, "sh_power": 1, "blocks_per_sm": 3, "time": 11.844861924648285, "times": [11.895808219909668, 11.850591659545898, 11.845503807067871, 11.844608306884766, 11.843584060668945, 11.843584060668945, 11.844608306884766, 11.843584060668945, 11.842559814453125, 11.843584060668945, 11.843584060668945, 11.841535568237305, 11.841471672058105, 11.841440200805664, 11.842559814453125, 11.842559814453125, 11.843456268310547, 11.842559814453125, 11.842559814453125, 11.842559814453125, 11.84563159942627, 11.842559814453125, 11.842559814453125, 11.842528343200684, 11.841535568237305, 11.842432022094727, 11.842432022094727, 11.841535568237305, 11.842559814453125, 11.842399597167969, 11.844608306884766, 11.842495918273926], "compile_time": 778.7486989982426, "verification_time": 0, "benchmark_time": 380.65437600016594, "GFLOP/s": 84.98477790655127, "strategy_time": 0.009517068974673748, "framework_time": 1.49972690269351, "timestamp": "2025-04-08 02:37:17.273270+00:00", "gridpoints/s": 5665651860.436751}, "4096,4096,1,32,6,3,4,10,2,1,1": {"grid_width": 4096, "grid_height": 4096, "block_size_x": 1, "block_size_y": 32, "tile_size_x": 6, "tile_size_y": 3, "temporal_tiling_factor": 4, "max_tfactor": 10, "loop_unroll_factor_t": 2, "sh_power": 1, "blocks_per_sm": 1, "time": 10.761494874954224, "times": [10.81446361541748, 10.766336441040039, 10.763263702392578, 10.759167671203613, 10.760191917419434, 10.759167671203613, 10.759167671203613, 10.759167671203613, 10.759008407592773, 10.759231567382812, 10.760160446166992, 10.759167671203613, 10.75814437866211, 10.759167671203613, 10.759167671203613, 10.760191917419434, 10.760128021240234, 10.759167671203613, 10.759008407592773, 10.760191917419434, 10.759167671203613, 10.759167671203613, 10.760191917419434, 10.760191917419434, 10.75814437866211, 10.759167671203613, 10.75830364227295, 10.759167671203613, 10.760191917419434, 10.759167671203613, 10.760191917419434, 10.761119842529297], "compile_time": 785.9447250375524, "verification_time": 0, "benchmark_time": 345.4682190204039, "GFLOP/s": 93.54025362617494, "strategy_time": 0.009868061169981956, "framework_time": 1.603530952706933, "timestamp": "2025-04-08 02:37:18.406327+00:00", "gridpoints/s": 6236016908.411663}, "4096,4096,1,32,5,6,2,10,2,0,4": {"grid_width": 4096, "grid_height": 4096, "block_size_x": 1, "block_size_y": 32, "tile_size_x": 5, "tile_size_y": 6, "temporal_tiling_factor": 2, "max_tfactor": 10, "loop_unroll_factor_t": 2, "sh_power": 0, "blocks_per_sm": 4, "time": 3.9764420241117477, "times": [3.9434239864349365, 3.8942720890045166, 3.8901760578155518, 3.887104034423828, 3.8891520500183105, 3.8881280422210693, 3.8881280422210693, 3.8881280422210693, 3.887104034423828, 3.930111885070801, 4.017151832580566, 4.020224094390869, 4.018176078796387, 4.022143840789795, 4.018176078796387, 4.019199848175049, 4.014080047607422, 4.016128063201904, 4.016128063201904, 4.019199848175049, 4.009984016418457, 4.00486421585083, 4.005887985229492, 4.009856224060059, 4.00383996963501, 4.008959770202637, 4.0069122314453125, 4.0069122314453125, 4.00383996963501, 4.00486421585083, 4.007936000823975, 4.005951881408691], "compile_time": 827.9320308938622, "verification_time": 0, "benchmark_time": 128.82871995680034, "GFLOP/s": 126.57458022726489, "strategy_time": 0.009749084711074829, "framework_time": 1.5846941387280822, "timestamp": "2025-04-08 02:37:19.364712+00:00", "gridpoints/s": 8438305348.484326}, "4096,4096,32,2,3,10,4,10,4,0,3": {"grid_width": 4096, "grid_height": 4096, "block_size_x": 32, "block_size_y": 2, "tile_size_x": 3, "tile_size_y": 10, "temporal_tiling_factor": 4, "max_tfactor": 10, "loop_unroll_factor_t": 4, "sh_power": 0, "blocks_per_sm": 3, "time": 13.287090957164764, "times": [13.334527969360352, 13.282303810119629, 13.277183532714844, 13.28332805633545, 13.288448333740234, 13.26694393157959, 13.301759719848633, 13.312000274658203, 13.27616024017334, 13.302656173706055, 13.27513599395752, 13.316160202026367, 13.310976028442383, 13.266912460327148, 13.285375595092773, 13.271936416625977, 13.272064208984375, 13.305855751037598, 13.306879997253418, 13.26694393157959, 13.291520118713379, 13.27616024017334, 13.271200180053711, 13.277183532714844, 13.306879997253418, 13.281279563903809, 13.277183532714844, 13.305855751037598, 13.2741117477417, 13.270015716552734, 13.267775535583496, 13.284192085266113], "compile_time": 977.7095241006464, "verification_time": 0, "benchmark_time": 426.79325002245605, "GFLOP/s": 75.76022195115597, "strategy_time": 0.009978888556361198, "framework_time": 1.516396994702518, "timestamp": "2025-04-08 02:37:20.770773+00:00", "gridpoints/s": 5050681463.4103985}, "4096,4096,4,16,4,6,8,10,8,0,3": {"grid_width": 4096, "grid_height": 4096, "block_size_x": 4, "block_size_y": 16, "tile_size_x": 4, "tile_size_y": 6, "temporal_tiling_factor": 8, "max_tfactor": 10, "loop_unroll_factor_t": 8, "sh_power": 0, "blocks_per_sm": 3, "time": 19.85372531414032, "times": [19.905439376831055, 19.85843276977539, 19.85331153869629, 19.85126495361328, 19.85228729248047, 19.85024070739746, 19.85331153869629, 19.85126495361328, 19.85228729248047, 19.85126495361328, 19.85126495361328, 19.85126495361328, 19.84921646118164, 19.85126495361328, 19.850112915039062, 19.85024070739746, 19.852256774902344, 19.85024070739746, 19.85126495361328, 19.85126495361328, 19.85024070739746, 19.86355209350586, 19.85228729248047, 19.85024070739746, 19.85024070739746, 19.85228729248047, 19.85228729248047, 19.85228729248047, 19.852352142333984, 19.85228729248047, 19.852384567260742, 19.85126495361328], "compile_time": 1216.9163950020447, "verification_time": 0, "benchmark_time": 636.648984043859, "GFLOP/s": 101.40494482242592, "strategy_time": 0.00921695027500391, "framework_time": 1.5045260079205036, "timestamp": "2025-04-08 02:37:22.625885+00:00", "gridpoints/s": 6760329654.828395}, "4096,4096,8,8,1,8,1,10,1,1,3": {"grid_width": 4096, "grid_height": 4096, "block_size_x": 8, "block_size_y": 8, "tile_size_x": 1, "tile_size_y": 8, "temporal_tiling_factor": 1, "max_tfactor": 10, "loop_unroll_factor_t": 1, "sh_power": 1, "blocks_per_sm": 3, "time": 1.4750250242650509, "times": [1.5165120363235474, 1.4673919677734375, 1.4643199443817139, 1.4632960557937622, 1.462272047996521, 1.4632960557937622, 1.462272047996521, 1.462272047996521, 1.4631999731063843, 1.4632960557937622, 1.462272047996521, 1.4612480401992798, 1.4632960557937622, 1.462272047996521, 1.4621440172195435, 1.4735360145568848, 1.474560022354126, 1.4755200147628784, 1.4755840301513672, 1.474560022354126, 1.4755840301513672, 1.474560022354126, 1.474560022354126, 1.4744000434875488, 1.474560022354126, 1.4735360145568848, 1.4735360145568848, 1.474560022354126, 1.5001599788665771, 1.511423945426941, 1.5104000568389893, 1.5104000568389893], "compile_time": 722.941230982542, "verification_time": 0, "benchmark_time": 48.4005770413205, "GFLOP/s": 170.61286138205807, "strategy_time": 0.009477022103965282, "framework_time": 1.443150918930769, "timestamp": "2025-04-08 02:37:23.398711+00:00", "gridpoints/s": 11374190758.803871}, "4096,4096,352,1,3,1,1,10,1,1,0": {"grid_width": 4096, "grid_height": 4096, "block_size_x": 352, "block_size_y": 1, "tile_size_x": 3, "tile_size_y": 1, "temporal_tiling_factor": 1, "max_tfactor": 10, "loop_unroll_factor_t": 1, "sh_power": 1, "blocks_per_sm": 0, "time": 1.5894309990108013, "times": [1.6321280002593994, 1.58515202999115, 1.581055998802185, 1.581055998802185, 1.5800319910049438, 1.578976035118103, 1.5809600353240967, 1.579103946685791, 1.5800319910049438, 1.5800319910049438, 1.5790079832077026, 1.5800319910049438, 1.5788480043411255, 1.5791679620742798, 1.5790079832077026, 1.5790079832077026, 1.5780160427093506, 1.5779839754104614, 1.5790079832077026, 1.5788480043411255, 1.5790079832077026, 1.5790079832077026, 1.5789439678192139, 1.5800319910049438, 1.5974400043487549, 1.6158720254898071, 1.614848017692566, 1.6128000020980835, 1.614848017692566, 1.6128000020980835, 1.614848017692566, 1.6138880252838135], "compile_time": 672.6511279121041, "verification_time": 0, "benchmark_time": 52.124855923466384, "GFLOP/s": 158.3322837899991, "strategy_time": 0.009577954187989235, "framework_time": 1.459602266550064, "timestamp": "2025-04-08 02:37:24.124987+00:00", "gridpoints/s": 10555485585.99994}, "4096,4096,32,2,8,1,6,10,6,0,3": {"grid_width": 4096, "grid_height": 4096, "block_size_x": 32, "block_size_y": 2, "tile_size_x": 8, "tile_size_y": 1, "temporal_tiling_factor": 6, "max_tfactor": 10, "loop_unroll_factor_t": 6, "sh_power": 0, "blocks_per_sm": 3, "time": 32.83022081851959, "times": [38.88332748413086, 38.85055923461914, 38.83820724487305, 35.80108642578125, 32.080894470214844, 32.082847595214844, 32.08086395263672, 32.073726654052734, 32.080894470214844, 32.077823638916016, 32.075775146484375, 32.07680130004883, 32.07475280761719, 32.079872131347656, 32.07680130004883, 32.084991455078125, 32.080894470214844, 32.073726654052734, 32.07356643676758, 32.077823638916016, 32.07475280761719, 32.07680130004883, 32.07475280761719, 32.07468795776367, 32.075775146484375, 32.07884979248047, 32.07680130004883, 32.07680130004883, 32.082942962646484, 32.08598327636719, 32.080833435058594, 32.082847595214844], "compile_time": 1068.6900040600449, "verification_time": 0, "benchmark_time": 1051.7969600623474, "GFLOP/s": 45.99266780283837, "strategy_time": 0.010089017450809479, "framework_time": 1.4854908222332597, "timestamp": "2025-04-08 02:37:26.247000+00:00", "gridpoints/s": 3066177853.522558}, "4096,4096,32,1,8,3,5,10,1,1,2": {"grid_width": 4096, "grid_height": 4096, "block_size_x": 32, "block_size_y": 1, "tile_size_x": 8, "tile_size_y": 3, "temporal_tiling_factor": 5, "max_tfactor": 10, "loop_unroll_factor_t": 1, "sh_power": 1, "blocks_per_sm": 2, "time": 23.608373999595642, "times": [23.66156768798828, 23.550975799560547, 23.607295989990234, 23.602176666259766, 23.640064239501953, 23.611391067504883, 23.586816787719727, 23.608320236206055, 23.608320236206055, 23.615488052368164, 23.602176666259766, 23.62259292602539, 23.608320236206055, 23.589887619018555, 23.597055435180664, 23.604223251342773, 23.632896423339844, 23.628799438476562, 23.608320236206055, 23.592927932739258, 23.592927932739258, 23.617536544799805, 23.634784698486328, 23.614463806152344, 23.573503494262695, 23.600128173828125, 23.61347198486328, 23.580671310424805, 23.632896423339844, 23.605247497558594, 23.614463806152344, 23.60825538635254], "compile_time": 789.4951000344008, "verification_time": 0, "benchmark_time": 757.0604810025543, "GFLOP/s": 53.298511791686785, "strategy_time": 0.00932707916945219, "framework_time": 1.505036954768002, "timestamp": "2025-04-08 02:37:27.795103+00:00", "gridpoints/s": 3553234119.4457855}, "4096,4096,16,2,9,5,4,10,2,0,3": {"grid_width": 4096, "grid_height": 4096, "block_size_x": 16, "block_size_y": 2, "tile_size_x": 9, "tile_size_y": 5, "temporal_tiling_factor": 4, "max_tfactor": 10, "loop_unroll_factor_t": 2, "sh_power": 0, "blocks_per_sm": 3, "time": 8.228829056024551, "times": [8.284159660339355, 8.224767684936523, 8.21555233001709, 8.247296333312988, 8.236960411071777, 8.23193645477295, 8.23193645477295, 8.221695899963379, 8.224767684936523, 8.227904319763184, 8.237055778503418, 8.232064247131348, 8.226816177368164, 8.21350383758545, 8.21350383758545, 8.23193645477295, 8.225791931152344, 8.240096092224121, 8.228863716125488, 8.219648361206055, 8.218624114990234, 8.221695899963379, 8.224703788757324, 8.229887962341309, 8.230912208557129, 8.22374439239502, 8.2227201461792, 8.242079734802246, 8.226816177368164, 8.224767684936523, 8.21452808380127, 8.225791931152344], "compile_time": 903.2398910494521, "verification_time": 0, "benchmark_time": 265.10201091878116, "GFLOP/s": 122.33003664877646, "strategy_time": 0.00924698542803526, "framework_time": 1.563296071253717, "timestamp": "2025-04-08 02:37:28.965048+00:00", "gridpoints/s": 8155335776.585097}, "4096,4096,4,16,4,5,1,10,1,1,2": {"grid_width": 4096, "grid_height": 4096, "block_size_x": 4, "block_size_y": 16, "tile_size_x": 4, "tile_size_y": 5, "temporal_tiling_factor": 1, "max_tfactor": 10, "loop_unroll_factor_t": 1, "sh_power": 1, "blocks_per_sm": 2, "time": 1.4693360067903996, "times": [1.5175679922103882, 1.4673919677734375, 1.462272047996521, 1.4602240324020386, 1.4581760168075562, 1.4592000246047974, 1.461184024810791, 1.4592000246047974, 1.4602240324020386, 1.462272047996521, 1.459231972694397, 1.4581760168075562, 1.4612480401992798, 1.4612480401992798, 1.4592000246047974, 1.4581760168075562, 1.4713599681854248, 1.4725120067596436, 1.4704639911651611, 1.4714879989624023, 1.4704639911651611, 1.46943998336792, 1.4714879989624023, 1.4725120067596436, 1.46943998336792, 1.4735039472579956, 1.4704639911651611, 1.46943998336792, 1.4714239835739136, 1.4847999811172485, 1.4929920434951782, 1.491968035697937], "compile_time": 740.4285769443959, "verification_time": 0, "benchmark_time": 48.305419040843844, "GFLOP/s": 171.27344517318357, "strategy_time": 0.00984896905720234, "framework_time": 1.4964790316298604, "timestamp": "2025-04-08 02:37:29.755321+00:00", "gridpoints/s": 11418229678.212238}, "4096,4096,16,2,4,1,1,10,1,0,4": {"grid_width": 4096, "grid_height": 4096, "block_size_x": 16, "block_size_y": 2, "tile_size_x": 4, "tile_size_y": 1, "temporal_tiling_factor": 1, "max_tfactor": 10, "loop_unroll_factor_t": 1, "sh_power": 0, "blocks_per_sm": 4, "time": 1.504113007336855, "times": [1.5493119955062866, 1.5030720233917236, 1.4981119632720947, 1.4981119632720947, 1.4970879554748535, 1.4981119632720947, 1.4979840517044067, 1.4970879554748535, 1.4981119632720947, 1.4970240592956543, 1.4960639476776123, 1.4960639476776123, 1.4950400590896606, 1.4970879554748535, 1.4960319995880127, 1.4950400590896606, 1.4970879554748535, 1.497056007385254, 1.5083520412445068, 1.509503960609436, 1.5083520412445068, 1.5104000568389893, 1.509376049041748, 1.5083520412445068, 1.509376049041748, 1.509376049041748, 1.509376049041748, 1.5094399452209473, 1.5083520412445068, 1.5083520412445068, 1.5092480182647705, 1.5102720260620117], "compile_time": 746.4216219959781, "verification_time": 0, "benchmark_time": 49.941270030103624, "GFLOP/s": 167.31338587755437, "strategy_time": 0.011049909517168999, "framework_time": 1.4861321542412043, "timestamp": "2025-04-08 02:37:30.553211+00:00", "gridpoints/s": 11154225725.170292}, "4096,4096,8,4,5,4,9,10,9,0,4": {"grid_width": 4096, "grid_height": 4096, "block_size_x": 8, "block_size_y": 4, "tile_size_x": 5, "tile_size_y": 4, "temporal_ti