compare_real_world_impact/results/hotspot/A4000_f=pyatf_i=5.json
{"device_name": "NVIDIA RTX A4000", "kernel_name": "calculate_temp", "problem_size": [4096, 4096], "tune_params_keys": ["grid_width", "grid_height", "block_size_x", "block_size_y", "tile_size_x", "tile_size_y", "temporal_tiling_factor", "max_tfactor", "loop_unroll_factor_t", "sh_power", "blocks_per_sm"], "tune_params": {"grid_width": [4096], "grid_height": [4096], "block_size_x": [1, 2, 4, 8, 16, 32, 64, 96, 128, 160, 192, 224, 256, 288, 320, 352, 384, 416, 448, 480, 512, 544, 576, 608, 640, 672, 704, 736, 768, 800, 832, 864, 896, 928, 960, 992, 1024], "block_size_y": [1, 2, 4, 8, 16, 32], "tile_size_x": [1, 2, 3, 4, 5, 6, 7, 8, 9, 10], "tile_size_y": [1, 2, 3, 4, 5, 6, 7, 8, 9, 10], "temporal_tiling_factor": [1, 2, 3, 4, 5, 6, 7, 8, 9, 10], "max_tfactor": [10], "loop_unroll_factor_t": [1, 2, 3, 4, 5, 6, 7, 8, 9, 10], "sh_power": [0, 1], "blocks_per_sm": [0, 1, 2, 3, 4]}, "objective": "GFLOP/s", "cache": {"4096,4096,288,2,1,1,2,10,1,1,1": {"grid_width": 4096, "grid_height": 4096, "block_size_x": 288, "block_size_y": 2, "tile_size_x": 1, "tile_size_y": 1, "temporal_tiling_factor": 2, "max_tfactor": 10, "loop_unroll_factor_t": 1, "sh_power": 1, "blocks_per_sm": 1, "time": 5.377342075109482, "times": [5.42412805557251, 5.381120204925537, 5.377151966094971, 5.377024173736572, 5.377024173736572, 5.375999927520752, 5.375999927520752, 5.377024173736572, 5.375999927520752, 5.375999927520752, 5.377024173736572, 5.37497615814209, 5.3739519119262695, 5.3739519119262695, 5.375999927520752, 5.375999927520752, 5.37497615814209, 5.377024173736572, 5.375904083251953, 5.37497615814209, 5.37497615814209, 5.37497615814209, 5.37497615814209, 5.37497615814209, 5.375999927520752, 5.375999927520752, 5.37497615814209, 5.37497615814209, 5.37497615814209, 5.37497615814209, 5.375904083251953, 5.37497615814209], "compile_time": 690.538238035515, "verification_time": 0, "benchmark_time": 173.68564696516842, "GFLOP/s": 93.59949078369772, "strategy_time": 1074719.4114020094, "framework_time": 0, "timestamp": "2025-04-08 02:14:05.110436+00:00", "gridpoints/s": 6239966052.246515}, "4096,4096,128,1,5,4,2,10,1,0,0": {"grid_width": 4096, "grid_height": 4096, "block_size_x": 128, "block_size_y": 1, "tile_size_x": 5, "tile_size_y": 4, "temporal_tiling_factor": 2, "max_tfactor": 10, "loop_unroll_factor_t": 1, "sh_power": 0, "blocks_per_sm": 0, "time": 4.29599492251873, "times": [4.35097599029541, 4.296703815460205, 4.30079984664917, 4.291584014892578, 4.290559768676758, 4.295551776885986, 4.2987518310546875, 4.295680046081543, 4.2936320304870605, 4.296703815460205, 4.288512229919434, 4.294655799865723, 4.2936320304870605, 4.2936320304870605, 4.294655799865723, 4.29260778427124, 4.289535999298096, 4.296703815460205, 4.2936320304870605, 4.295648097991943, 4.298655986785889, 4.29260778427124, 4.2936320304870605, 4.297728061676025, 4.29260778427124, 4.294655799865723, 4.294559955596924, 4.295680046081543, 4.292799949645996, 4.29260778427124, 4.291584014892578, 4.290559768676758], "compile_time": 839.4634480355307, "verification_time": 0, "benchmark_time": 138.8516379520297, "GFLOP/s": 117.15946808077392, "strategy_time": 0.008535920642316341, "framework_time": 2.1928941132500768, "timestamp": "2025-04-08 02:14:06.090985+00:00", "gridpoints/s": 7810631205.384929}, "4096,4096,32,4,5,4,4,10,4,0,1": {"grid_width": 4096, "grid_height": 4096, "block_size_x": 32, "block_size_y": 4, "tile_size_x": 5, "tile_size_y": 4, "temporal_tiling_factor": 4, "max_tfactor": 10, "loop_unroll_factor_t": 4, "sh_power": 0, "blocks_per_sm": 1, "time": 7.6128189265728, "times": [7.667712211608887, 7.6175360679626465, 7.614463806152344, 7.612415790557861, 7.610367774963379, 7.611392021179199, 7.611392021179199, 7.609344005584717, 7.609344005584717, 7.611392021179199, 7.612287998199463, 7.611392021179199, 7.611392021179199, 7.610367774963379, 7.609344005584717, 7.610367774963379, 7.611328125, 7.610367774963379, 7.612415790557861, 7.610367774963379, 7.611392021179199, 7.609344005584717, 7.6102399826049805, 7.61030387878418, 7.610367774963379, 7.6113600730896, 7.609344005584717, 7.609344005584717, 7.610367774963379, 7.610367774963379, 7.610367774963379, 7.612415790557861], "compile_time": 965.4569639824331, "verification_time": 0, "benchmark_time": 245.53203000687063, "GFLOP/s": 132.2286750426066, "strategy_time": 0.008726026862859726, "framework_time": 1.5937439166009426, "timestamp": "2025-04-08 02:14:07.303608+00:00", "gridpoints/s": 8815245002.84044}, "4096,4096,32,4,1,6,9,10,9,0,2": {"grid_width": 4096, "grid_height": 4096, "block_size_x": 32, "block_size_y": 4, "tile_size_x": 1, "tile_size_y": 6, "temporal_tiling_factor": 9, "max_tfactor": 10, "loop_unroll_factor_t": 9, "sh_power": 0, "blocks_per_sm": 2, "time": 31.161477863788605, "times": [31.222719192504883, 31.16748809814453, 31.16326332092285, 31.162368774414062, 31.1592960357666, 31.160320281982422, 31.16339111328125, 31.15827178955078, 31.160287857055664, 31.15827178955078, 31.15827178955078, 31.158079147338867, 31.1592960357666, 31.1592960357666, 31.160320281982422, 31.15827178955078, 31.16035270690918, 31.160320281982422, 31.161344528198242, 31.16124725341797, 31.1592960357666, 31.158239364624023, 31.1592960357666, 31.160320281982422, 31.15724754333496, 31.15519905090332, 31.1592960357666, 31.153152465820312, 31.15622329711914, 31.158111572265625, 31.161184310913086, 31.15724754333496], "compile_time": 1263.0688869394362, "verification_time": 0, "benchmark_time": 999.3261769413948, "GFLOP/s": 72.6834641765168, "strategy_time": 0.00875699333846569, "framework_time": 1.7880551749840379, "timestamp": "2025-04-08 02:14:09.567832+00:00", "gridpoints/s": 4845564278.434453}, "4096,4096,32,2,7,4,3,10,3,0,1": {"grid_width": 4096, "grid_height": 4096, "block_size_x": 32, "block_size_y": 2, "tile_size_x": 7, "tile_size_y": 4, "temporal_tiling_factor": 3, "max_tfactor": 10, "loop_unroll_factor_t": 3, "sh_power": 0, "blocks_per_sm": 1, "time": 7.5187259167432785, "times": [7.5786237716674805, 7.519231796264648, 7.516992092132568, 7.517183780670166, 7.520256042480469, 7.519231796264648, 7.515135765075684, 7.517183780670166, 7.5232319831848145, 7.513984203338623, 7.517183780670166, 7.521279811859131, 7.5141119956970215, 7.5141119956970215, 7.513088226318359, 7.515135765075684, 7.515135765075684, 7.518208026885986, 7.515071868896484, 7.514944076538086, 7.517183780670166, 7.5232319831848145, 7.510015964508057, 7.517183780670166, 7.52016019821167, 7.517183780670166, 7.515135765075684, 7.516223907470703, 7.517151832580566, 7.5141119956970215, 7.516160011291504, 7.516160011291504], "compile_time": 921.6602720553055, "verification_time": 0, "benchmark_time": 241.96729995310307, "GFLOP/s": 100.41258696752917, "strategy_time": 0.008265022188425064, "framework_time": 1.8237329786643386, "timestamp": "2025-04-08 02:14:10.733324+00:00", "gridpoints/s": 6694172464.501944}, "4096,4096,16,4,2,4,4,10,2,0,3": {"grid_width": 4096, "grid_height": 4096, "block_size_x": 16, "block_size_y": 4, "tile_size_x": 2, "tile_size_y": 4, "temporal_tiling_factor": 4, "max_tfactor": 10, "loop_unroll_factor_t": 2, "sh_power": 0, "blocks_per_sm": 3, "time": 9.070831060409546, "times": [9.114591598510742, 9.066368103027344, 9.063424110412598, 9.061375617980957, 9.060352325439453, 9.059328079223633, 9.060352325439453, 9.060352325439453, 9.059295654296875, 9.062399864196777, 9.059328079223633, 9.057279586791992, 9.059328079223633, 9.062399864196777, 9.060352325439453, 9.058303833007812, 9.058303833007812, 9.06118392944336, 9.060352325439453, 9.059231758117676, 9.060352325439453, 9.060352325439453, 9.060288429260254, 9.058303833007812, 9.059328079223633, 9.059328079223633, 9.060352325439453, 9.076736450195312, 9.127936363220215, 9.126912117004395, 9.125887870788574, 9.126912117004395], "compile_time": 840.6470230547711, "verification_time": 0, "benchmark_time": 291.9752449961379, "GFLOP/s": 110.97472252498888, "strategy_time": 0.007844995707273483, "framework_time": 1.6718389233574271, "timestamp": "2025-04-08 02:14:11.867657+00:00", "gridpoints/s": 7398314834.999258}, "4096,4096,32,4,3,6,6,10,2,1,1": {"grid_width": 4096, "grid_height": 4096, "block_size_x": 32, "block_size_y": 4, "tile_size_x": 3, "tile_size_y": 6, "temporal_tiling_factor": 6, "max_tfactor": 10, "loop_unroll_factor_t": 2, "sh_power": 1, "blocks_per_sm": 1, "time": 21.637752056121826, "times": [21.691328048706055, 21.641216278076172, 21.63916778564453, 21.643264770507812, 21.633024215698242, 21.64019203186035, 21.635072708129883, 21.634048461914062, 21.63711929321289, 21.634048461914062, 21.633024215698242, 21.63497543334961, 21.631999969482422, 21.63711929321289, 21.63711929321289, 21.634048461914062, 21.63711929321289, 21.633024215698242, 21.637088775634766, 21.635072708129883, 21.62892723083496, 21.63814353942871, 21.635072708129883, 21.632959365844727, 21.635072708129883, 21.635072708129883, 21.63814353942871, 21.63814353942871, 21.634048461914062, 21.635072708129883, 21.63916778564453, 21.63916778564453], "compile_time": 809.1761389514431, "verification_time": 0, "benchmark_time": 693.5194180114195, "GFLOP/s": 69.78310113193112, "strategy_time": 0.008926959708333015, "framework_time": 1.6006340738385916, "timestamp": "2025-04-08 02:14:13.371994+00:00", "gridpoints/s": 4652206742.128741}, "4096,4096,4,32,10,4,2,10,2,0,1": {"grid_width": 4096, "grid_height": 4096, "block_size_x": 4, "block_size_y": 32, "tile_size_x": 10, "tile_size_y": 4, "temporal_tiling_factor": 2, "max_tfactor": 10, "loop_unroll_factor_t": 2, "sh_power": 0, "blocks_per_sm": 1, "time": 3.26330603659153, "times": [3.3228800296783447, 3.2674241065979004, 3.2603518962860107, 3.2624640464782715, 3.2675840854644775, 3.264512062072754, 3.2614400386810303, 3.2634880542755127, 3.2624640464782715, 3.2573440074920654, 3.2593600749969482, 3.259200096130371, 3.2614400386810303, 3.2573440074920654, 3.260416030883789, 3.259392023086548, 3.260416030883789, 3.264512062072754, 3.2532479763031006, 3.260416030883789, 3.2634239196777344, 3.2634880542755127, 3.2583680152893066, 3.256319999694824, 3.265536069869995, 3.2624640464782715, 3.2573440074920654, 3.2614400386810303, 3.2624640464782715, 3.265536069869995, 3.2624640464782715, 3.2612481117248535], "compile_time": 868.4732479741797, "verification_time": 0, "benchmark_time": 105.58220802340657, "GFLOP/s": 154.23514508179744, "strategy_time": 0.008476083166897297, "framework_time": 1.685212948359549, "timestamp": "2025-04-08 02:14:14.347773+00:00", "gridpoints/s": 10282343005.453163}, "4096,4096,2,32,6,6,2,10,1,0,3": {"grid_width": 4096, "grid_height": 4096, "block_size_x": 2, "block_size_y": 32, "tile_size_x": 6, "tile_size_y": 6, "temporal_tiling_factor": 2, "max_tfactor": 10, "loop_unroll_factor_t": 1, "sh_power": 0, "blocks_per_sm": 3, "time": 3.4199870377779007, "times": [3.476480007171631, 3.4211840629577637, 3.422208070755005, 3.4150400161743164, 3.417088031768799, 3.422208070755005, 3.41811203956604, 3.4160640239715576, 3.422208070755005, 3.417088031768799, 3.414016008377075, 3.4169600009918213, 3.4211840629577637, 3.4150400161743164, 3.41811203956604, 3.4201600551605225, 3.4109439849853516, 3.4160640239715576, 3.4099199771881104, 3.4191360473632812, 3.417088031768799, 3.4201600551605225, 3.4201600551605225, 3.4211840629577637, 3.41811203956604, 3.41811203956604, 3.4191360473632812, 3.418976068496704, 3.4160640239715576, 3.4190080165863037, 3.4211840629577637, 3.4211840629577637], "compile_time": 852.5018390500918, "verification_time": 0, "benchmark_time": 110.44063896406442, "GFLOP/s": 147.16911919263424, "strategy_time": 0.007914029993116856, "framework_time": 1.5132030239328742, "timestamp": "2025-04-08 02:14:15.312269+00:00", "gridpoints/s": 9811274612.842283}, "4096,4096,16,2,6,9,6,10,1,1,2": {"grid_width": 4096, "grid_height": 4096, "block_size_x": 16, "block_size_y": 2, "tile_size_x": 6, "tile_size_y": 9, "temporal_tiling_factor": 6, "max_tfactor": 10, "loop_unroll_factor_t": 1, "sh_power": 1, "blocks_per_sm": 2, "time": 16.45637607574463, "times": [16.515104293823242, 16.450559616088867, 16.46486473083496, 16.462848663330078, 16.456640243530273, 16.453632354736328, 16.456703186035156, 16.45568084716797, 16.463903427124023, 16.449535369873047, 16.451583862304688, 16.44745635986328, 16.458751678466797, 16.45568084716797, 16.45568084716797, 16.457727432250977, 16.44748878479004, 16.448511123657227, 16.45568084716797, 16.44748878479004, 16.4638729095459, 16.457727432250977, 16.448511123657227, 16.4638729095459, 16.444416046142578, 16.438335418701172, 16.456575393676758, 16.44940757751465, 16.457727432250977, 16.461824417114258, 16.45465660095215, 16.451583862304688], "compile_time": 844.4375770632178, "verification_time": 0, "benchmark_time": 528.199155931361, "GFLOP/s": 91.75467509068073, "strategy_time": 0.008124974556267262, "framework_time": 1.6051350394263864, "timestamp": "2025-04-08 02:14:16.686550+00:00", "gridpoints/s": 6116978339.378716}, "4096,4096,16,2,1,8,5,10,1,0,1": {"grid_width": 4096, "grid_height": 4096, "block_size_x": 16, "block_size_y": 2, "tile_size_x": 1, "tile_size_y": 8, "temporal_tiling_factor": 5, "max_tfactor": 10, "loop_unroll_factor_t": 1, "sh_power": 0, "blocks_per_sm": 1, "time": 15.793560892343521, "times": [15.844351768493652, 15.798272132873535, 15.797087669372559, 15.79315185546875, 15.788031578063965, 15.79423999786377, 15.789055824279785, 15.78707218170166, 15.79315185546875, 15.79212760925293, 15.794048309326172, 15.788031578063965, 15.79417610168457, 15.79315185546875, 15.791104316711426, 15.791104316711426, 15.794079780578613, 15.785087585449219, 15.79212760925293, 15.791104316711426, 15.79212760925293, 15.79417610168457, 15.79315185546875, 15.789983749389648, 15.79417610168457, 15.79417610168457, 15.788031578063965, 15.79315185546875, 15.787008285522461, 15.79212760925293, 15.79315185546875, 15.79212760925293], "compile_time": 815.0137530174106, "verification_time": 0, "benchmark_time": 506.8800599547103, "GFLOP/s": 79.671152603084, "strategy_time": 0.008255010470747948, "framework_time": 1.6289390623569489, "timestamp": "2025-04-08 02:14:18.010113+00:00", "gridpoints/s": 5311410173.538934}, "4096,4096,4,8,8,2,9,10,1,1,2": {"grid_width": 4096, "grid_height": 4096, "block_size_x": 4, "block_size_y": 8, "tile_size_x": 8, "tile_size_y": 2, "temporal_tiling_factor": 9, "max_tfactor": 10, "loop_unroll_factor_t": 1, "sh_power": 1, "blocks_per_sm": 2, "time": 28.16615903377533, "times": [28.215295791625977, 28.1680965423584, 28.15692710876465, 28.17228889465332, 28.15180778503418, 28.15692710876465, 28.15590476989746, 28.15999984741211, 28.17638397216797, 28.16307258605957, 28.16716766357422, 28.17228889465332, 28.17535972595215, 28.15180778503418, 28.173152923583984, 28.1661434173584, 28.17024040222168, 28.15488052368164, 28.16102409362793, 28.163904190063477, 28.15897560119629, 28.16716766357422, 28.16409683227539, 28.1661434173584, 28.16819190979004, 28.16409683227539, 28.1680965423584, 28.1661434173584, 28.17535972595215, 28.15795135498047, 28.165119171142578, 28.16307258605957], "compile_time": 776.3987589860335, "verification_time": 0, "benchmark_time": 903.1567450147122, "GFLOP/s": 80.41295787913523, "strategy_time": 0.007745111361145973, "framework_time": 1.5629229601472616, "timestamp": "2025-04-08 02:14:19.691269+00:00", "gridpoints/s": 5360863858.609015}, "4096,4096,8,16,3,4,10,10,5,0,2": {"grid_width": 4096, "grid_height": 4096, "block_size_x": 8, "block_size_y": 16, "tile_size_x": 3, "tile_size_y": 4, "temporal_tiling_factor": 10, "max_tfactor": 10, "loop_unroll_factor_t": 5, "sh_power": 0, "blocks_per_sm": 2, "time": 28.501194894313812, "times": [28.5532169342041, 28.504928588867188, 28.499967575073242, 28.503904342651367, 28.498912811279297, 28.496896743774414, 28.498943328857422, 28.499967575073242, 28.503040313720703, 28.499967575073242, 28.49785614013672, 28.4979190826416, 28.496896743774414, 28.502016067504883, 28.502016067504883, 28.499967575073242, 28.5, 28.499807357788086, 28.498943328857422, 28.502016067504883, 28.499839782714844, 28.499967575073242, 28.498943328857422, 28.500991821289062, 28.4979190826416, 28.4979190826416, 28.495872497558594, 28.4979190826416, 28.495872497558594, 28.496896743774414, 28.500991821289062, 28.4979190826416], "compile_time": 1139.7807149915025, "verification_time": 0, "benchmark_time": 913.9668749412522, "GFLOP/s": 88.29743487358405, "strategy_time": 0.008365954272449017, "framework_time": 1.6104531241580844, "timestamp": "2025-04-08 02:14:21.746665+00:00", "gridpoints/s": 5886495658.238936}, "4096,4096,16,4,3,10,9,10,1,0,0": {"grid_width": 4096, "grid_height": 4096, "block_size_x": 16, "block_size_y": 4, "tile_size_x": 3, "tile_size_y": 10, "temporal_tiling_factor": 9, "max_tfactor": 10, "loop_unroll_factor_t": 1, "sh_power": 0, "blocks_per_sm": 0, "time": 31.196429014205933, "times": [31.246400833129883, 31.2042236328125, 31.19206428527832, 31.19615936279297, 31.1910400390625, 31.20025634765625, 31.20025634765625, 31.19603157043457, 31.19718360900879, 31.19820785522461, 31.1910400390625, 31.20012855529785, 31.19308853149414, 31.19513511657715, 31.19308853149414, 31.19513511657715, 31.19615936279297, 31.192960739135742, 31.19411277770996, 31.19001579284668, 31.19923210144043, 31.19718360900879, 31.18899154663086, 31.19513511657715, 31.19820785522461, 31.18592071533203, 31.195199966430664, 31.191999435424805, 31.1910400390625, 31.19308853149414, 31.193952560424805, 31.19308853149414], "compile_time": 859.8103360272944, "verification_time": 0, "benchmark_time": 999.3671539705247, "GFLOP/s": 72.60203271882882, "strategy_time": 0.008255010470747948, "framework_time": 1.6692039789631963, "timestamp": "2025-04-08 02:14:23.607553+00:00", "gridpoints/s": 4840135514.588589}, "4096,4096,4,8,6,1,9,10,1,1,1": {"grid_width": 4096, "grid_height": 4096, "block_size_x": 4, "block_size_y": 8, "tile_size_x": 6, "tile_size_y": 1, "temporal_tiling_factor": 9, "max_tfactor": 10, "loop_unroll_factor_t": 1, "sh_power": 1, "blocks_per_sm": 1, "time": 42.537145256996155, "times": [42.52979278564453, 42.4898567199707, 42.48166275024414, 42.48662567138672, 42.48575973510742, 42.48575973510742, 42.4796142578125, 42.486785888671875, 42.4898567199707, 42.48780822753906, 42.491905212402344, 42.486785888671875, 42.484737396240234, 42.48780822753906, 42.4857292175293, 42.48064041137695, 42.4796142578125, 42.47449493408203, 42.48166275024414, 42.48064041137695, 42.477569580078125, 42.621952056884766, 42.80012893676758, 42.63014221191406, 42.610687255859375, 42.614784240722656, 42.6168327331543, 42.61888122558594, 42.61171340942383, 42.61171340942383, 42.61894226074219, 42.617759704589844], "compile_time": 758.8039110414684, "verification_time": 0, "benchmark_time": 1362.7463339362293, "GFLOP/s": 53.24579602876581, "strategy_time": 0.007985043339431286, "framework_time": 1.6810569213703275, "timestamp": "2025-04-08 02:14:25.730823+00:00", "gridpoints/s": 3549719735.251054}, "4096,4096,8,8,3,4,5,10,1,1,2": {"grid_width": 4096, "grid_height": 4096, "block_size_x": 8, "block_size_y": 8, "tile_size_x": 3, "tile_size_y": 4, "temporal_tiling_factor": 5, "max_tfactor": 10, "loop_unroll_factor_t": 1, "sh_power": 1, "blocks_per_sm": 2, "time": 14.9097238779068, "times": [14.965567588806152, 14.911487579345703, 14.908415794372559, 14.909440040588379, 14.909279823303223, 14.912511825561523, 14.915583610534668, 14.9104642868042, 14.906368255615234, 14.907391548156738, 14.907391548156738, 14.907296180725098, 14.908255577087402, 14.907296180725098, 14.905344009399414, 14.907391548156738, 14.906368255615234, 14.903200149536133, 14.906368255615234, 14.90617561340332, 14.907391548156738, 14.906368255615234, 14.905344009399414, 14.905344009399414, 14.902239799499512, 14.905344009399414, 14.913408279418945, 14.908415794372559, 14.905344009399414, 14.907391548156738, 14.911487579345703, 14.911487579345703], "compile_time": 770.6329378997907, "verification_time": 0, "benchmark_time": 478.42663095798343, "GFLOP/s": 84.39399752161296, "strategy_time": 0.008546048775315285, "framework_time": 1.5739070950075984, "timestamp": "2025-04-08 02:14:26.981497+00:00", "gridpoints/s": 5626266501.440864}, "4096,4096,1,32,1,6,4,10,4,1,4": {"grid_width": 4096, "grid_height": 4096, "block_size_x": 1, "block_size_y": 32, "tile_size_x": 1, "tile_size_y": 6, "temporal_tiling_factor": 4, "max_tfactor": 10, "loop_unroll_factor_t": 4, "sh_power": 1, "blocks_per_sm": 4, "time": 27.03101795911789, "times": [27.11039924621582, 27.036672592163086, 26.997760772705078, 27.021312713623047, 27.010047912597656, 27.060224533081055, 26.97612762451172, 27.00783920288086, 27.033567428588867, 27.02012825012207, 27.016191482543945, 27.030527114868164, 27.041791915893555, 27.023231506347656, 27.069440841674805, 27.028480529785156, 27.071487426757812, 27.040767669677734, 27.042816162109375, 27.003904342651367, 27.012096405029297, 27.024383544921875, 27.044864654541016, 27.043743133544922, 27.017215728759766, 26.996736526489258, 27.038719177246094, 27.053056716918945, 27.057151794433594, 26.995712280273438, 27.056127548217773, 27.010047912597656], "compile_time": 839.215875021182, "verification_time": 0, "benchmark_time": 866.6484829736874, "GFLOP/s": 37.23992050622905, "strategy_time": 0.008656992577016354, "framework_time": 1.4833160676062107, "timestamp": "2025-04-08 02:14:28.688885+00:00", "gridpoints/s": 2482661367.081937}, "4096,4096,8,16,3,1,7,10,1,1,0": {"grid_width": 4096, "grid_height": 4096, "block_size_x": 8, "block_size_y": 16, "tile_size_x": 3, "tile_size_y": 1, "temporal_tiling_factor": 7, "max_tfactor": 10, "loop_unroll_factor_t": 1, "sh_power": 1, "blocks_per_sm": 0, "time": 24.93317300081253, "times": [24.982528686523438, 24.937471389770508, 24.929279327392578, 24.928255081176758, 24.92518424987793, 24.9303035736084, 24.928255081176758, 24.93235206604004, 24.93132781982422, 24.93337631225586, 24.934303283691406, 24.93337631225586, 24.93440055847168, 24.93328094482422, 24.93129539489746, 24.93440055847168, 24.93132781982422, 24.93337631225586, 24.93337631225586, 24.93235206604004, 24.93337631225586, 24.929279327392578, 24.93440055847168, 24.928255081176758, 24.9303035736084, 24.92518424987793, 24.92723274230957, 24.93120002746582, 24.93337631225586, 24.93440055847168, 24.9303035736084, 24.93440055847168], "compile_time": 755.3026899695396, "verification_time": 0, "benchmark_time": 799.5945269940421, "GFLOP/s": 70.65316877007962, "strategy_time": 0.008415081538259983, "framework_time": 1.62179593462497, "timestamp": "2025-04-08 02:14:30.245443+00:00", "gridpoints/s": 4710211251.338641}, "4096,4096,1,32,6,1,8,10,8,0,3": {"grid_width": 4096, "grid_height": 4096, "block_size_x": 1, "block_size_y": 32, "tile_size_x": 6, "tile_size_y": 1, "temporal_tiling_factor": 8, "max_tfactor": 10, "loop_unroll_factor_t": 8, "sh_power": 0, "blocks_per_sm": 3, "time": 46.24571466445923, "times": [46.28889465332031, 46.251007080078125, 46.243839263916016, 46.239742279052734, 46.245887756347656, 46.243839263916016, 46.24483108520508, 46.2479362487793, 46.23871994018555, 46.243839263916016, 46.245887756347656, 46.239742279052734, 46.241790771484375, 46.239742279052734, 46.243839263916016, 46.23769760131836, 46.24076843261719, 46.241790771484375, 46.243873596191406, 46.241790771484375, 46.24671936035156, 46.248958587646484, 46.2479362487793, 46.23769760131836, 46.24486541748047, 46.24272155761719, 46.243839263916016, 46.25392150878906, 46.248958587646484, 46.24079895019531, 46.251007080078125, 46.24998474121094], "compile_time": 1128.210772993043, "verification_time": 0, "benchmark_time": 1481.0789129696786, "GFLOP/s": 43.53410763802587, "strategy_time": 0.008606002666056156, "framework_time": 1.5571929980069399, "timestamp": "2025-04-08 02:14:32.856331+00:00", "gridpoints/s": 2902273842.535058}, "4096,4096,8,4,10,5,4,10,2,1,2": {"grid_width": 4096, "grid_height": 4096, "block_size_x": 8, "block_size_y": 4, "tile_size_x": 10, "tile_size_y": 5, "temporal_tiling_factor": 4, "max_tfactor": 10, "loop_unroll_factor_t": 2, "sh_power": 1, "blocks_per_sm": 2, "time": 7.800511062145233, "times": [7.856128215789795, 7.799808025360107, 7.795551776885986, 7.795711994171143, 7.798816204071045, 7.7946882247924805, 7.786496162414551, 7.803840160369873, 7.798783779144287, 7.805952072143555, 7.8151679039001465, 7.803904056549072, 7.792640209197998, 7.795711994171143, 7.787519931793213, 7.80185604095459, 7.808000087738037, 7.796864032745361, 7.812096118927002, 7.789728164672852, 7.797760009765625, 7.7946882247924805, 7.7946882247924805, 7.797760009765625, 7.80185604095459, 7.798783779144287, 7.789567947387695, 7.805952072143555, 7.791488170623779, 7.814144134521484, 7.788544178009033, 7.80185604095459], "compile_time": 863.9635079307482, "verification_time": 0, "benchmark_time": 250.8863810217008, "GFLOP/s": 129.04705242776285, "strategy_time": 0.01624098513275385, "framework_time": 1.432339078746736, "timestamp": "2025-04-08 02:14:33.972661+00:00", "gridpoints/s": 8603136828.517523}, "4096,4096,4,16,1,4,4,10,2,1,0": {"grid_width": 4096, "grid_height": 4096, "block_size_x": 4, "block_size_y": 16, "tile_size_x": 1, "tile_size_y": 4, "temporal_tiling_factor": 4, "max_tfactor": 10, "loop_unroll_factor_t": 2, "sh_power": 1, "blocks_per_sm": 0, "time": 12.323893874883652, "times": [12.374015808105469, 12.327936172485352, 12.325887680053711, 12.323840141296387, 12.32265567779541, 12.32374382019043, 12.323840141296387, 12.322815895080566, 12.321791648864746, 12.322815895080566, 12.320768356323242, 12.321791648864746, 12.321791648864746, 12.321791648864746, 12.321791648864746, 12.320768356323242, 12.321791648864746, 12.323840141296387, 12.322784423828125, 12.320768356323242, 12.321791648864746, 12.321791648864746, 12.321791648864746, 12.321791648864746, 12.321791648864746, 12.321791648864746, 12.318719863891602, 12.320735931396484, 12.321791648864746, 12.321791648864746, 12.320768356323242, 12.322815895080566], "compile_time": 781.7484199767932, "verification_time": 0, "benchmark_time": 396.1492870002985, "GFLOP/s": 81.68140445054776, "strategy_time": 0.008736969903111458, "framework_time": 1.5017000259831548, "timestamp": "2025-04-08 02:14:35.152101+00:00", "gridpoints/s": 5445426963.369851}, "4096,4096,8,4,7,7,8,10,2,0,3": {"grid_width": 4096, "grid_height": 4096, "block_size_x": 8, "block_size_y": 4, "tile_size_x": 7, "tile_size_y": 7, "temporal_tiling_factor": 8, "max_tfactor": 10, "loop_unroll_factor_t": 2, "sh_power": 0, "blocks_per_sm": 3, "time": 19.889090955257416, "times": [19.933120727539062, 19.901439666748047, 19.8973445892334, 19.87276840209961, 19.894271850585938, 19.8973445892334, 19.89308738708496, 19.886079788208008, 19.89017677307129, 19.883007049560547, 19.886079788208008, 19.883071899414062, 19.88812828063965, 19.891199111938477, 19.89308738708496, 19.886079788208008, 19.88096046447754, 19.892127990722656, 19.896320343017578, 19.891103744506836, 19.883007049560547, 19.89619255065918, 19.895296096801758, 19.88185691833496, 19.896160125732422, 19.875839233398438, 19.887104034423828, 19.87071990966797, 19.87174415588379, 19.883007049560547, 19.88096046447754, 19.892223358154297], "compile_time": 911.8689190363511, "verification_time": 0, "benchmark_time": 638.1932499352843, "GFLOP/s": 101.22463236399548, "strategy_time": 0.008816015906631947, "framework_time": 1.6253420617431402, "timestamp": "2025-04-08 02:14:36.703829+00:00", "gridpoints/s": 6748308824.266366}, "4096,4096,32,16,1,1,8,10,4,0,4": {"grid_width": 4096, "grid_height": 4096, "block_size_x": 32, "block_size_y": 16, "tile_size_x": 1, "tile_size_y": 1, "temporal_tiling_factor": 8, "max_tfactor": 10, "loop_unroll_factor_t": 4, "sh_power": 0, "blocks_per_sm": 4, "time": 30.450232088565826, "times": [30.499839782714844, 30.454784393310547, 30.449663162231445, 30.447616577148438, 30.448640823364258, 30.447616577148438, 30.445568084716797, 30.447616577148438, 30.449663162231445, 30.450592041015625, 30.447616577148438, 30.446592330932617, 30.449663162231445, 30.444543838500977, 30.448640823364258, 30.447616577148438, 30.448640823364258, 30.446592330932617, 30.44963264465332, 30.450687408447266, 30.446592330932617, 30.449663162231445, 30.445568084716797, 30.448640823364258, 30.446592330932617, 30.448640823364258, 30.447551727294922, 30.449663162231445, 30.449663162231445, 30.451648712158203, 30.450687408447266, 30.450687408447266], "compile_time": 968.2942340150476, "verification_time": 0, "benchmark_time": 976.1896790005267, "GFLOP/s": 66.11660345130797, "strategy_time": 0.008295988664031029, "framework_time": 1.5336490469053388, "timestamp": "2025-04-08 02:14:38.649886+00:00", "gridpoints/s": 4407773563.420531}, "4096,4096,1,32,7,9,6,10,3,0,2": {"grid_width": 4096, "grid_height": 4096, "block_size_x": 1, "block_size_y": 32, "tile_size_x": 7, "tile_size_y": 9, "temporal_tiling_factor": 6, "max_tfactor": 10, "loop_unroll_factor_t": 3, "sh_power": 0, "blocks_per_sm": 2, "time": 21.362609922885895, "times": [21.384191513061523, 21.326847076416016, 21.322751998901367, 21.326847076416016, 21.320703506469727, 21.314559936523438, 21.319679260253906, 21.325824737548828, 21.337087631225586, 21.329919815063477, 21.314464569091797, 21.322751998901367, 21.340160369873047, 21.336063385009766, 21.329919815063477, 21.344160079956055, 21.334016799926758, 21.326751708984375, 21.328895568847656, 21.329824447631836, 21.337055206298828, 21.328895568847656, 21.434368133544922, 21.4466552734375, 21.443552017211914, 21.443584442138672, 21.43027114868164, 21.434368133544922, 21.419008255004883, 21.436416625976562, 21.421056747436523, 21.412864685058594], "compile_time": 1045.7251489860937, "verification_time": 0, "benchmark_time": 685.4026380460709, "GFLOP/s": 70.68188041866466, "strategy_time": 0.008406001143157482, "framework_time": 1.498313038609922, "timestamp": "2025-04-08 02:14:40.382551+00:00", "gridpoints/s": 4712125361.24431}, "4096,4096,32,1,3,2,10,10,10,1,0": {"grid_width": 4096, "grid_height": 4096, "block_size_x": 32, "block_size_y": 1, "tile_size_x": 3, "tile_size_y": 2, "temporal_tiling_factor": 10, "max_tfactor": 10, "loop_unroll_factor_t": 10, "sh_power": 1, "blocks_per_sm": 0, "time": 184.46459197998047, "times": [184.4910125732422, 184.50125122070312, 184.4529266357422, 184.5278778076172, 184.46234130859375, 184.51539611816406, 184.53709411621094, 184.3251190185547, 184.45619201660156, 184.4305877685547, 184.52890014648438, 184.39065551757812, 184.43673706054688, 184.4602813720703, 184.35276794433594, 184.44192504882812, 184.41830444335938, 184.627197265625, 184.42752075195312, 184.50534057617188, 184.40602111816406, 184.4111328125, 184.38861083984375, 184.53196716308594, 184.4521026611328, 184.38348388671875, 184.36402893066406, 184.47666931152344, 184.50927734375, 184.53709411621094, 184.53907775878906, 184.5780487060547], "compile_time": 1150.7097278954461, "verification_time": 0, "benchmark_time": 5904.364265035838, "GFLOP/s": 13.642631211702238, "strategy_time": 0.008776085451245308, "framework_time": 1.6083299415186048, "timestamp": "2025-04-08 02:14:47.439274+00:00", "gridpoints/s": 909508747.4468158}, "4096,4096,4,16,9,1,6,10,6,0,0": {"grid_width": 4096, "grid_height": 4096, "block_size_x": 4, "block_size_y": 16, "tile_size_x": 9, "tile_size_y": 1, "temporal_tiling_factor": 6, "max_tfactor": 10, "loop_unroll_factor_t": 6, "sh_power": 0, "blocks_per_sm": 0, "time": 15.757012993097305, "times": [15.80953598022461, 15.762432098388672, 15.756287574768066, 15.756287574768066, 15.759360313415527, 15.757311820983887, 15.753215789794922, 15.756095886230469, 15.7543363571167, 15.754240036010742, 15.757184028625488, 15.754240036010742, 15.755264282226562, 15.755264282226562, 15.754240036010742, 15.75324821472168, 15.754240036010742, 15.755200386047363, 15.754207611083984, 15.752191543579102, 15.757311820983887, 15.753215789794922, 15.755264282226562, 15.755264282226562, 15.753215789794922, 15.753215789794922, 15.755264282226562, 15.756223678588867, 15.756287574768066, 15.755264282226562, 15.754240036010742, 15.755264282226562], "compile_time": 1072.4093449534848, "verification_time": 0, "benchmark_time": 505.18247310537845, "GFLOP/s": 95.82713682228132, "strategy_time": 0.00879692379385233, "framework_time": 1.697286032140255, "timestamp": "2025-04-08 02:14:49.018607+00:00", "gridpoints/s": 6388475788.152087}, "4096,4096,16,8,2,1,2,10,1,1,1": {"grid_width": 4096, "grid_height": 4096, "block_size_x": 16, "block_size_y": 8, "tile_size_x": 2, "tile_size_y": 1, "temporal_tiling_factor": 2, "max_tfactor": 10, "loop_unroll_factor_t": 1, "sh_power": 1, "blocks_per_sm": 1, "time": 4.140090927481651, "times": [4.189184188842773, 4.14412784576416, 4.140927791595459, 4.139008045196533, 4.139008045196533, 4.139008045196533, 4.139008045196533, 4.137983798980713, 4.137919902801514, 4.137983798980713, 4.139008045196533, 4.137983798980713, 4.136960029602051, 4.137919902801514, 4.139008045196533, 4.138976097106934, 4.137983798980713, 4.139008045196533, 4.137983798980713, 4.136960029602051, 4.137951850891113, 4.137983798980713, 4.139008045196533, 4.137119770050049, 4.136960029602051, 4.139008045196533, 4.139008045196533, 4.137983798980713, 4.137983798980713, 4.137983798980713, 4.137983798980713, 4.137983798980713], "compile_time": 754.7203799476847, "verification_time": 0, "benchmark_time": 133.5282459622249, "GFLOP/s": 121.5713588943224, "strategy_time": 0.008356058970093727, "framework_time": 1.5414340887218714, "timestamp": "2025-04-08 02:14:49.908437+00:00", "gridpoints/s": 8104757259.621493}, "4096,4096,4,32,1,3,6,10,2,1,2": {"grid_width": 4096, "grid_height": 4096, "block_size_x": 4, "block_size_y": 32, "tile_size_x": 1, "tile_size_y": 3, "temporal_tiling_factor": 6, "max_tfactor": 10, "loop_unroll_factor_t": 2, "sh_power": 1, "blocks_per_sm": 2, "time": 27.822860062122345, "times": [27.876352310180664, 27.828224182128906, 27.825151443481445, 27.817983627319336, 27.820032119750977, 27.820032119750977, 27.820959091186523, 27.82195281982422, 27.820032119750977, 27.822080612182617, 27.822080612182617, 27.828224182128906, 27.82089614868164, 27.821056365966797, 27.82294464111328, 27.822080612182617, 27.819007873535156, 27.817983627319336, 27.819007873535156, 27.823104858398438, 27.822111129760742, 27.821056365966797, 27.82204818725586, 27.819007873535156, 27.817983627319336, 27.832319259643555, 27.816959381103516, 27.822080612182617, 27.820032119750977, 27.82009506225586, 27.815776824951172, 27.812864303588867], "compile_time": 785.1055129431188, "verification_time": 0, "benchmark_time": 892.0958949020132, "GFLOP/s": 54.27010151467585, "strategy_time": 0.008244998753070831, "framework_time": 1.4759231125935912, "timestamp": "2025-04-08 02:14:51.587154+00:00", "gridpoints/s": 3618006767.6450567}, "4096,4096,64,1,1,3,5,10,1,0,4": {"grid_width": 4096, "grid_height": 4096, "block_size_x": 64, "block_size_y": 1, "tile_size_x": 1, "tile_size_y": 3, "temporal_tiling_factor": 5, "max_tfactor": 10, "loop_unroll_factor_t": 1, "sh_power": 0, "blocks_per_sm": 4, "time": 23.57116597890854, "times": [23.621631622314453, 23.572351455688477, 23.57030487060547, 23.567359924316406, 23.568384170532227, 23.567359924316406, 23.56934356689453, 23.57030487060547, 23.566335678100586, 23.569408416748047, 23.569408416748047, 23.566335678100586, 23.566335678100586, 23.569408416748047, 23.572288513183594, 23.569408416748047, 23.568384170532227, 23.567359924316406, 23.572479248046875, 23.572479248046875, 23.565311431884766, 23.567359924316406, 23.56835174560547, 23.567264556884766, 23.571456909179688, 23.569215774536133, 23.572479248046875, 23.57548713684082, 23.570432662963867, 23.573440551757812, 23.573503494262695, 23.566335678100586], "compile_time": 807.5448860181496, "verification_time": 0, "benchmark_time": 755.752912024036, "GFLOP/s": 53.382645607176066, "strategy_time": 0.00930693931877613, "framework_time": 1.6071480931714177, "timestamp": "2025-04-08 02:14:53.152100+00:00", "gridpoints/s": 3558843040.478404}, "4096,4096,224,2,1,8,2,10,2,0,0": {"grid_width": 4096, "grid_height": 4096, "block_size_x": 224, "block_size_y": 2, "tile_size_x": 1, "tile_size_y": 8, "temporal_tiling_factor": 2, "max_tfactor": 10, "loop_unroll_factor_t": 2, "sh_power": 0, "blocks_per_sm": 0, "time": 3.3713769242167473, "times": [3.4263041019439697, 3.3751039505004883, 3.370944023132324, 3.3689279556274414, 3.3710079193115234, 3.368959903717041, 3.3710079193115234, 3.3699519634246826, 3.368959903717041, 3.368959903717041, 3.368959903717041, 3.3679358959198, 3.3699839115142822, 3.3699839115142822, 3.3679358959198, 3.368959903717041, 3.368959903717041, 3.368959903717041, 3.3699839115142822, 3.369823932647705, 3.368959903717041, 3.3699839115142822, 3.368959903717041, 3.3679358959198, 3.368959903717041, 3.3697919845581055, 3.3699839115142822, 3.3710079193115234, 3.3679358959198, 3.3679358959198, 3.3710079193115234, 3.3699839115142822], "compile_time": 696.5251819929108, "verification_time": 0, "benchmark_time": 108.7399369571358, "GFLOP/s": 149.29107344380742, "strategy_time": 0.007884926162660122, "framework_time": 1.5285111730918288, "timestamp": "2025-04-08 02:14:53.958932+00:00", "gridpoints/s": 9952738229.587162}, "4096,4096,16,4,6,1,9,10,1,1,3": {"grid_width": 4096, "grid_height": 4096, "block_size_x": 16, "block_size_y": 4, "tile_size_x": 6, "tile_size_y": 1, "temporal_tiling_factor": 9, "max_tfactor": 10, "loop_unroll_factor_t": 1, "sh_power": 1, "blocks_per_sm": 3, "time": 43.53000736236572, "times": [43.575294494628906, 43.53433609008789, 43.5333137512207, 43.51795196533203, 43.54048156738281, 43.54048156738281, 43.53126525878906, 43.52921676635742, 43.51884841918945, 43.53023910522461, 43.52204895019531, 43.52921676635742, 43.52598571777344, 43.51897430419922, 43.52204895019531, 43.52204895019531, 43.532318115234375, 43.52716827392578, 43.52918243408203, 43.516929626464844, 43.5333137512207, 43.509761810302734, 43.5333137512207, 43.53638458251953, 43.51795196533203, 43.53126525878906, 43.53126525878906, 43.53945541381836, 43.53535842895508, 43.53740692138672, 43.53023910522461, 43.52716827392578], "compile_time": 759.1504500014707, "verification_time": 0, "benchmark_time": 1394.0786599414423, "GFLOP/s": 52.03132958709678, "strategy_time": 0.008304952643811703, "framework_time": 1.5677341725677252, "timestamp": "2025-04-08 02:14:56.113768+00:00", "gridpoints/s": 3468755305.806452}, "4096,4096,2,32,3,2,3,10,1,1,1": {"grid_width": 4096, "grid_height": 4096, "block_size_x": 2, "block_size_y": 32, "tile_size_x": 3, "tile_size_y": 2, "temporal_tiling_factor": 3, "max_tfactor": 10, "loop_unroll_factor_t": 1, "sh_power": 1, "blocks_per_sm": 1, "time": 6.642902970314026, "times": [6.694911956787109, 6.646783828735352, 6.6447038650512695, 6.642687797546387, 6.641664028167725, 6.642528057098389, 6.641664028167725, 6.640639781951904, 6.641600131988525, 6.642528057098389, 6.641664028167725, 6.641664028167725, 6.640639781951904, 6.640639781951904, 6.641664028167725, 6.641536235809326, 6.639616012573242, 6.640639781951904, 6.639808177947998, 6.639616012573242, 6.6405439376831055, 6.641664028167725, 6.640639781951904, 6.639679908752441, 6.641759872436523, 6.639616012573242, 6.640639781951904, 6.639616012573242, 6.640480041503906, 6.639776229858398, 6.641664028167725, 6.639616012573242], "compile_time": 754.0979949990287, "verification_time": 0, "benchmark_time": 213.58390303794295, "GFLOP/s": 113.65132433423312, "strategy_time": 0.009107054211199284, "framework_time": 1.6095618484541774, "timestamp": "2025-04-08 02:14:57.083099+00:00", "gridpoints/s": 7576754955.615541}, "4096,4096,1,32,10,1,10,10,10,1,3": {"grid_width": 4096, "grid_height": 4096, "block_size_x": 1, "block_size_y": 32, "tile_size_x": 10, "tile_size_y": 1, "temporal_tiling_factor": 10, "max_tfactor": 10, "loop_unroll_factor_t": 10, "sh_power": 1, "blocks_per_sm": 3, "time": 51.11382699012756, "times": [51.11705780029297, 51.08224105834961, 51.07609558105469, 51.069950103759766, 51.08224105834961, 51.0810546875, 51.07302474975586, 51.06687927246094, 51.06880187988281, 51.07814407348633, 51.06175994873047, 51.0648307800293, 51.07609558105469, 51.0648307800293, 51.0750732421875, 51.07814407348633, 51.069759368896484, 51.0750732421875, 51.071998596191406, 51.071998596191406, 51.08224105834961, 51.06070327758789, 51.078208923339844, 51.08924865722656, 51.27977752685547, 51.21433639526367, 51.22457504272461, 51.223487854003906, 51.21945571899414, 51.22457504272461, 51.22150421142578, 51.219295501708984], "compile_time": 1105.838254909031, "verification_time": 0, "benchmark_time": 1637.1616770047694, "GFLOP/s": 49.23486555772997, "strategy_time": 0.008646049536764622, "framework_time": 1.526747946627438, "timestamp": "2025-04-08 02:14:59.827665+00:00", "gridpoints/s": 3282324370.515331}, "4096,4096,4,32,2,1,9,10,3,0,4": {"grid_width": 4096, "grid_height": 4096, "block_size_x": 4, "block_size_y": 32, "tile_size_x": 2, "tile_size_y": 1, "temporal_tiling_factor": 9, "max_tfactor": 10, "loop_unroll_factor_t": 3, "sh_power": 0, "blocks_per_sm": 4, "time": 38.67898368835449, "times": [38.73468780517578, 38.686527252197266, 38.68262481689453, 38.68262481689453, 38.68057632446289, 38.68262481689453, 38.67536163330078, 38.67852783203125, 38.68057632446289, 38.67638397216797, 38.68057632446289, 38.67955017089844, 38.67955017089844, 38.68057632446289, 38.68057632446289, 38.67955017089844, 38.68262481689453, 38.67852783203125, 38.69286346435547, 38.67955017089844, 38.67337417602539, 38.67238235473633, 38.67340850830078, 38.67238235473633, 38.67340850830078, 38.671295166015625, 38.67033767700195, 38.67337417602539, 38.6693115234375, 38.6693115234375, 38.66521453857422, 38.66921615600586], "compile_time": 969.557577976957, "verification_time": 0, "benchmark_time": 1239.3120679771528, "GFLOP/s": 58.55697187519241, "strategy_time": 0.008585979230701923, "framework_time": 1.560982083901763, "timestamp": "2025-04-08 02:15:02.038134+00:00", "gridpoints/s": 3903798125.0128274}, "4096,4096,4,8,1,3,5,10,5,1,2": {"grid_width": 4096, "grid_height": 4096, "block_size_x": 4, "block_size_y": 8, "tile_size_x": 1, "tile_size_y": 3, "temporal_tiling_factor": 5, "max_tfactor": 10, "loop_unroll_factor_t": 5, "sh_power": 1, "blocks_per_sm": 2, "time": 20.011820554733276, "times": [20.06220817565918, 20.015104293823242, 20.01100730895996, 20.01203155517578, 20.00998306274414, 20.006912231445312, 20.00998306274414, 20.00998306274414, 20.00998306274414, 20.00998306274414, 20.007936477661133, 20.00998306274414, 20.009855270385742, 20.00998306274414, 20.008960723876953, 20.01203155517578, 20.01103973388672, 20.01203155517578, 20.00998306274414, 20.00998306274414, 20.00998306274414, 20.01100730895996, 20.00998306274414, 20.011871337890625, 20.00998306274414, 20.00998306274414, 20.008960723876953, 20.00998306274414, 20.009855270385742, 20.008800506591797, 20.008960723876953, 20.009920120239258], "compile_time": 911.0129770124331, "verification_time": 0, "benchmark_time": 641.9625040143728, "GFLOP/s": 62.87739771394182, "strategy_time": 0.006943009793758392, "framework_time": 1.409568008966744, "timestamp": "2025-04-08 02:15:03.592554+00:00", "gridpoints/s": 4191826514.262788}, "4096,4096,160,4,1,2,4,10,1,0,0": {"grid_width": 4096, "grid_height": 4096, "block_size_x": 160, "block_size_y": 4, "tile_size_x": 1, "tile_size_y": 2, "temporal_tiling_factor": 4, "max_tfactor": 10, "loop_unroll_factor_t": 1, "sh_power": 0, "blocks_per_sm": 0, "time": 10.69683501124382, "times": [10.744832038879395, 10.70076847076416, 10.69974422454834, 10.696703910827637, 10.69654369354248, 10.697600364685059, 10.694656372070312, 10.695679664611816, 10.695679664611816, 10.695679664611816, 10.696703910827637, 10.695615768432617, 10.695679664611816, 10.691583633422852, 10.694656372070312, 10.693471908569336, 10.693632125854492, 10.695679664611816, 10.694656372070312, 10.695679664611816, 10.696703910827637, 10.695584297180176, 10.692607879638672, 10.694592475891113, 10.693632125854492, 10.693632125854492, 10.693632125854492, 10.6976957321167, 10.693632125854492, 10.694496154785156, 10.692607879638672, 10.694656372070312], "compile_time": 705.439314013347, "verification_time": 0, "benchmark_time": 343.3167759794742, "GFLOP/s": 94.10568256329022, "strategy_time": 0.009077019058167934, "framework_time": 1.5823320718482137, "timestamp": "2025-04-08 02:15:04.642932+00:00", "gridpoints/s": 6273712170.886015}, "4096,4096,8,32,1,5,3,10,3,1,0": {"grid_width": 4096, "grid_height": 4096, "block_size_x": 8, "block_size_y": 32, "tile_size_x": 1, "tile_size_y": 5, "temporal_tiling_factor": 3, "max_tfactor": 10, "loop_unroll_factor_t": 3, "sh_power": 1, "blocks_per_sm": 0, "time": 7.2496810257434845, "times": [7.304031848907471, 7.25494384765625, 7.249919891357422, 7.249728202819824, 7.250944137573242, 7.245823860168457, 7.249824047088623, 7.246848106384277, 7.246848106384277, 7.2478718757629395, 7.2478718757629395, 7.24886417388916, 7.24889612197876, 7.244800090789795, 7.2479681968688965, 7.245823860168457, 7.2478718757629395, 7.2478718757629395, 7.244800090789795, 7.246848106384277, 7.246848106384277, 7.2478718757629395, 7.246848106384277, 7.24889612197876, 7.246848106384277, 7.246848106384277, 7.2478718757629395, 7.246848106384277, 7.2478718757629395, 7.24889612197876, 7.24889612197876, 7.246848106384277], "compile_time": 816.0270089283586, "verification_time": 0, "benchmark_time": 233.1064670579508, "GFLOP/s": 104.13902588529048, "strategy_time": 0.009256997145712376, "framework_time": 1.5557020669803023, "timestamp": "2025-04-08 02:15:05.693662+00:00", "gridpoints/s": 6942601725.686032}, "4096,4096,8,16,2,1,5,10,1,1,0": {"grid_width": 4096, "grid_height": 4096, "block_size_x": 8, "block_size_y": 16, "tile_size_x": 2, "tile_size_y": 1, "temporal_tiling_factor": 5, "max_tfactor": 10, "loop_unroll_factor_t": 1, "sh_power": 1, "blocks_per_sm": 0, "time": 12.859563082456589, "times": [12.910431861877441, 12.86348819732666, 12.859392166137695, 12.858176231384277, 12.85632038116455, 12.85529613494873, 12.85632038116455, 12.857343673706055, 12.85529613494873, 12.857343673706055, 12.85632038116455, 12.858367919921875, 12.85427188873291, 12.859392166137695, 12.858367919921875, 12.858367919921875, 12.858304023742676, 12.859392166137695, 12.859359741210938, 12.85529613494873, 12.858367919921875, 12.857151985168457, 12.857343673706055, 12.858367919921875, 12.85632038116455, 12.85632038116455, 12.860416412353516, 12.859359741210938, 12.860416412353516, 12.85632038116455, 12.859392166137695, 12.859392166137695], "compile_time": 752.3453450994566, "verification_time": 0, "benchmark_time": 412.71028900519013, "GFLOP/s": 97.84867432367119, "strategy_time": 0.00875699333846569, "framework_time": 1.7347059911116958, "timestamp": "2025-04-08 02:15:06.860492+00:00", "gridpoints/s": 6523244954.911412}, "4096,4096,4,8,1,5,8,10,1,0,3": {"grid_width": 4096, "grid_height": 4096, "block_size_x": 4, "block_size_y": 8, "tile_size_x": 1, "tile_size_y": 5, "temporal_tiling_factor": 8, "max_tfactor": 10, "loop_unroll_factor_t": 1, "sh_power": 0, "blocks_per_sm": 3, "time": 49.26436197757721, "times": [49.30867385864258, 49.2677116394043, 49.25747299194336, 49.259521484375, 49.2625617980957, 49.2606086730957, 49.26460647583008, 49.26668930053711, 49.26668930053711, 49.26464080810547, 49.26259231567383, 49.26444625854492, 49.26553726196289, 49.2677116394043, 49.26464080810547, 49.265663146972656, 49.26054382324219, 49.26054382324219, 49.26259231567383, 49.2655029296875, 49.263614654541016, 49.261566162109375, 49.261566162109375, 49.259422302246094, 49.26249694824219, 49.25747299194336, 49.265663146972656, 49.263614654541016, 49.26051330566406, 49.261566162109375, 49.263614654541016, 49.259521484375], "compile_time": 815.780328004621, "verification_time": 0, "benchmark_time": 1577.9660780681297, "GFLOP/s": 40.8665785810104, "strategy_time": 0.008636037819087505, "framework_time": 1.547285937704146, "timestamp": "2025-04-08 02:15:09.255824+00:00", "gridpoints/s": 2724438572.06736}, "4096,4096,64,8,1,2,10,10,5,1,0": {"grid_width": 4096, "grid_height": 4096, "block_size_x": 64, "block_size_y": 8, "tile_size_x": 1, "tile_size_y": 2, "temporal_tiling_factor": 10, "max_tfactor": 10, "loop_unroll_factor_t": 5, "sh_power": 1, "blocks_per_sm": 0, "time": 31.773812353610992, "times": [31.82899284362793, 31.77574348449707, 31.773664474487305, 31.771648406982422, 31.771488189697266, 31.771648406982422, 31.773696899414062, 31.773696899414062, 31.773632049560547, 31.772672653198242, 31.7706241607666, 31.7706241607666, 31.773696899414062, 31.771583557128906, 31.771648406982422, 31.76857566833496, 31.76959991455078, 31.772672653198242, 31.76755142211914, 31.7706241607666, 31.772672653198242, 31.773696899414062, 31.771648406982422, 31.76959991455078, 31.7706241607666, 31.7706241607666, 31.772672653198242, 31.772672653198242, 31.771648406982422, 31.774656295776367, 31.773696899414062, 31.773696899414062], "compile_time": 1003.9371559396386, "verification_time": 0, "benchmark_time": 1018.8820239854977, "GFLOP/s": 79.20303588354258, "strategy_time": 0.008785980753600597, "framework_time": 1.5364961000159383, "timestamp": "2025-04-08 02:15:11.280220+00:00", "gridpoints/s": 5280202392.236173}, "4096,4096,4,16,7,6,10,10,10,0,0": {"grid_width": 4096, "grid_height": 4096, "block_size_x": 4, "block_size_y": 16, "tile_size_x": 7, "tile_size_y": 6, "temporal_tiling_factor": 10, "max_tfactor": 10, "loop_unroll_factor_t": 10, "sh_power": 0, "blocks_per_sm": 0, "time": 23.90321683883667, "times": [23.961599349975586, 23.90630340576172, 23.91551971435547, 23.88684844970703, 23.90118408203125, 23.90937614440918, 23.91449546813965, 23.89299201965332, 23.89811134338379, 23.90630340576172, 23.90732765197754, 23.89811134338379, 23.90323257446289, 23.89913558959961, 23.887775421142578, 23.910400390625, 23.902175903320312, 23.897119522094727, 23.89708709716797, 23.899200439453125, 23.897056579589844, 23.89811134338379, 23.90732765197754, 23.90015983581543, 23.90323257446289, 23.90835189819336, 23.904224395751953, 23.900127410888672, 23.90118408203125, 23.894847869873047, 23.8887996673584, 23.905216217041016], "compile_time": 1369.8296900838614, "verification_time": 0, "benchmark_time": 766.4598289411515, "GFLOP/s": 105.28216419436866, "strategy_time": 0.008585979230701923, "framework_time": 1.6697749961167574, "timestamp": "2025-04-08 02:15:13.418221+00:00", "gridpoints/s": 7018810946.2912445}, "4096,4096,32,2,2,2,10,10,2,1,3": {"grid_width": 4096, "grid_height": 4096, "block_size_x": 32, "block_size_y": 2, "tile_size_x": 2, "tile_size_y": 2, "temporal_tiling_factor": 10, "max_tfactor": 10, "loop_unroll_factor_t": 2, "sh_power": 1, "blocks_per_sm": 3, "time": 65.95612144470215, "times": [65.9947509765625, 65.94560241699219, 65.93843078613281, 65.97119903564453, 65.9609603881836, 65.95072174072266, 65.9578857421875, 65.9648666381836, 65.96403503417969, 65.96607971191406, 65.9415054321289, 65.9578857421875, 65.96505737304688, 65.9599380493164, 65.94764709472656, 65.96300506591797, 65.96198272705078, 65.95584106445312, 65.98345947265625, 65.95891571044922, 65.9609603881836, 65.95072174072266, 65.96198272705078, 65.93536376953125, 65.97126770019531, 65.9425277709961, 65.95577239990234, 65.94457244873047, 65.93740844726562, 65.94764709472656, 65.92716979980469, 65.95072174072266], "compile_time": 784.3827300239354, "verification_time": 0, "benchmark_time": 2112.1769848978147, "GFLOP/s": 38.15540309036989, "strategy_time": 0.008795992471277714, "framework_time": 1.5917100245133042, "timestamp": "2025-04-08 02:15:16.316411+00:00", "gridpoints/s": 2543693539.3579926}, "4096,4096,64,1,1,3,2,10,2,0,3": {"grid_width": 4096, "grid_height": 4096, "block_size_x": 64, "block_size_y": 1, "tile_size_x": 1, "tile_size_y": 3, "temporal_tiling_factor": 2, "max_tfactor": 10, "loop_unroll_factor_t": 2, "sh_power": 0, "blocks_per_sm": 3, "time": 4.988060966134071, "times": [5.046271800994873, 4.990975856781006, 4.986976146697998, 4.987904071807861, 4.987904071807861, 4.986879825592041, 4.986048221588135, 4.986879825592041, 4.987904071807861, 4.985856056213379, 4.985856056213379, 4.985856056213379, 4.984831809997559, 4.985727787017822, 4.9850239753723145, 4.984831809997559, 4.985856056213379, 4.985856056213379, 4.985856056213379, 4.985695838928223, 4.985856056213379, 4.985856056213379, 4.984831809997559, 4.986847877502441, 4.984831809997559, 4.985856056213379, 4.985856056213379, 4.985856056213379, 4.986847877502441, 4.985695838928223, 4.98579216003418, 4.984831809997559], "compile_time": 811.3901419565082, "verification_time": 0, "benchmark_time": 160.92587797902524, "GFLOP/s": 100.9042358177287, "strategy_time": 0.008195056580007076, "framework_time": 1.5047260094434023, "timestamp": "2025-04-08 02:15:17.290270+00:00", "gridpoints/s": 6726949054.515246}, "4096,4096,2,16,2,8,5,10,5,0,4": {"grid_width": 4096, "grid_height": 4096, "block_size_x": 2, "block_size_y": 16, "tile_size_x": 2, "tile_size_y": 8, "temporal_tiling_factor": 5, "max_tfactor": 10, "loop_unroll_factor_t": 5, "sh_power": 0, "blocks_per_sm": 4, "time": 15.502324879169464, "times": [15.562751770019531, 15.507455825805664, 15.502335548400879, 15.499263763427734, 15.502335548400879, 15.502304077148438, 15.500288009643555, 15.502335548400879, 15.5033597946167, 15.507455825805664, 15.506431579589844, 15.5033597946167, 15.502335548400879, 15.499263763427734, 15.5033597946167, 15.49728012084961, 15.499263763427734, 15.496159553527832, 15.49516773223877, 15.499263763427734, 15.49824047088623, 15.49500846862793, 15.49407958984375, 15.501312255859375, 15.499263763427734, 15.507455825805664, 15.49721622467041, 15.49721622467041, 15.502335548400879, 15.500160217285156, 15.494144439697266, 15.49619197845459], "compile_time": 996.5521459234878, "verification_time": 0, "benchmark_time": 497.96416400931776, "GFLOP/s": 81.16790286667072, "strategy_time": 0.008826027624309063, "framework_time": 1.4494030037894845, "timestamp": "2025-04-08 02:15:18.786276+00:00", "gridpoints/s": 5411193524.444715}, "4096,4096,4,16,8,2,9,10,9,0,1": {"grid_width": 4096, "grid_height": 4096, "block_size_x": 4, "block_size_y": 16, "tile_size_x": 8, "tile_size_y": 2, "temporal_tiling_factor": 9, "max_tfactor": 10, "loop_unroll_factor_t": 9, "sh_power": 0, "blocks_per_sm": 1, "time": 22.341422080993652, "times": [22.388736724853516, 22.347776412963867, 22.341632843017578, 22.339584350585938, 22.341632843017578, 22.336511611938477, 22.338560104370117, 22.334463119506836, 22.341472625732422, 22.340608596801758, 22.341567993164062, 22.341535568237305, 22.335487365722656, 22.339584350585938, 22.340608596801758, 22.344703674316406, 22.341632843017578, 22.336511611938477, 22.3374080657959, 22.339584350585938, 22.344703674316406, 22.335487365722656, 22.335359573364258, 22.337535858154297, 22.340608596801758, 22.338560104370117, 22.342655181884766, 22.339584350585938, 22.335487365722656, 22.344703674316406, 22.340608596801758, 22.340608596801758], "compile_time": 1263.9614079380408, "verification_time": 0, "benchmark_time": 716.6514380369335, "GFLOP/s": 101.37779733935655, "strategy_time": 0.008956994861364365, "framework_time": 1.5760770766064525, "timestamp": "2025-04-08 02:15:20.768505+00:00", "gridpoints/s": 6758519822.62377}, "4096,4096,16,4,1,2,9,10,1,1,1": {"grid_width": 4096, "grid_height": 4096, "block_size_x": 16, "block_size_y": 4, "tile_size_x": 1, "tile_size_y": 2, "temporal_tiling_factor": 9, "max_tfactor": 10, "loop_unroll_factor_t": 1, "sh_power": 1, "blocks_per_sm": 1, "time": 48.48703193664551, "times": [48.530433654785156, 48.48844909667969, 48.485374450683594, 48.482303619384766, 48.485374450683594, 48.48332977294922, 48.485374450683594, 48.47923278808594, 48.482303619384766, 48.487422943115234, 48.484352111816406, 48.48128128051758, 48.487327575683594, 48.484352111816406, 48.48332977294922, 48.49241638183594, 48.485374450683594, 48.489471435546875, 48.485374450683594, 48.496673583984375, 48.4925422668457, 48.487422943115234, 48.484352111816406, 48.485374450683594, 48.48640060424805, 48.48128128051758, 48.482303619384766, 48.48735809326172, 48.48128128051758, 48.487422943115234, 48.48640060424805, 48.48332977294922], "compile_time": 749.006788013503, "verification_time": 0, "benchmark_time": 1552.9978120466694, "GFLOP/s": 46.711957188045915, "strategy_time": 0.008906936272978783, "framework_time": 1.55899696983397, "timestamp": "2025-04-08 02:15:23.072109+00:00", "gridpoints/s": 3114130479.203061}, "4096,4096,32,2,4,2,8,10,8,0,2": {"grid_width": 4096, "grid_height": 4096, "block_size_x": 32, "block_size_y": 2, "tile_size_x": 4, "tile_size_y": 2, "temporal_tiling_factor": 8, "max_tfactor": 10, "loop_unroll_factor_t": 8, "sh_power": 0, "blocks_per_sm": 2, "time": 37.19528889656067, "times": [37.350399017333984, 37.32070541381836, 37.30326461791992, 37.30121612548828, 37.29817581176758, 37.301246643066406, 37.308414459228516, 37.295169830322266, 37.28895950317383, 37.304351806640625, 37.30534362792969, 37.30534362792969, 37.31865692138672, 37.29510498046875, 37.293983459472656, 37.30022430419922, 37.30636978149414, 37.310462951660156, 37.310462951660156, 37.31148910522461, 37.30944061279297, 37.06265640258789, 36.975616455078125, 36.973567962646484, 36.975486755371094, 36.96742248535156, 36.97148895263672, 36.97663879394531, 36.97868728637695, 36.973567962646484, 36.973567962646484, 36.98175811767578], "compile_time": 1187.5574550358579, "verification_time": 0, "benchmark_time": 1191.389166051522, "GFLOP/s": 54.12690638319415, "strategy_time": 0.008845934644341469, "framework_time": 1.460761995986104, "timestamp": "2025-04-08 02:15:25.452556+00:00", "gridpoints/s": 3608460425.5462766}, "4096,4096,160,2,1,4,6,10,2,0,2": {"grid_width": 4096, "grid_height": 4096, "block_size_x": 160, "block_size_y": 2, "tile_size_x": 1, "tile_size_y": 4, "temporal_tiling_factor": 6, "max_tfactor": 10, "loop_unroll_factor_t": 2, "sh_power": 0, "blocks_per_sm": 2, "time": 16.034809947013855, "times": [16.084991455078125, 16.039936065673828, 16.035839080810547, 16.034751892089844, 16.036863327026367, 16.03276824951172, 16.03481674194336, 16.0317440032959, 16.03481674194336, 16.03379249572754, 16.030719757080078, 16.029695510864258, 16.03276824951172, 16.03276824951172, 16.035839080810547, 16.03276824951172, 16.035839080810547, 16.03379249572754, 16.03379249572754, 16.03276824951172, 16.030719757080078, 16.03379249572754, 16.029695510864258, 16.03276824951172, 16.0317440032959, 16.028671264648438, 16.03276824951172, 16.029695510864258, 16.03366470336914, 16.03276824951172, 16.030719757080078, 16.035839080810547], "compile_time": 690.3168950229883, "verification_time": 0, "benchmark_time": 514.0752849401906, "GFLOP/s": 94.16696830143573, "strategy_time": 0.008134986273944378, "framework_time": 1.4547620667144656, "timestamp": "2025-04-08 02:15:26.658444+00:00", "gridpoints/s": 6277797886.762382}, "4096,4096,32,8,2,2,4,10,2,1,2": {"grid_width": 4096, "grid_height": 4096, "block_size_x": 32, "block_size_y": 8, "tile_size_x": 2, "tile_size_y": 2, "temporal_tiling_factor": 4, "max_tfactor": 10, "loop_unroll_factor_t": 2, "sh_power": 1, "blocks_per_sm": 2, "time": 9.133615106344223, "times": [9.18825626373291, 9.137151718139648, 9.136128425598145, 9.134079933166504, 9.132960319519043, 9.13100814819336, 9.13203239440918, 9.13100814819336, 9.13203239440918, 9.128959655761719, 9.133055686950684, 9.13203239440918, 9.13100814819336, 9.132896423339844, 9.128959655761719, 9.12985610961914, 9.13100814819336, 9.13100814819336, 9.13203239440918, 9.13100814819336, 9.129983901977539, 9.13100814819336, 9.13100814819336, 9.13203239440918, 9.133055686950684, 9.129983901977539, 9.13203239440918, 9.13203239440918, 9.133055686950684, 9.13203239440918, 9.132991790771484, 9.129983901977539], "compile_time": 778.8846309995279, "verification_time": 0, "benchmark_time": 293.5742969857529, "GFLOP/s": 110.21188743773439, "strategy_time": 0.009276904165744781, "framework_time": 1.441839151084423, "timestamp": "2025-04-08 02:15:27.732383+00:00", "gridpoints/s": 7347459162.515626}, "4096,4096,64,1,2,7,3,10,3,0,0": {"grid_width": 4096, "grid_height": 4096, "block_size_x": 64, "block_size_y": 1, "tile_size_x": 2, "tile_size_y": 7, "temporal_tiling_factor": 3, "max_tfactor": 10, "loop_unroll_factor_t": 3, "sh_power": 0, "blocks_per_sm": 0, "time": 6.405393004417419, "times": [6.451200008392334, 6.395904064178467, 6.400991916656494, 6.417407989501953, 6.414336204528809, 6.402048110961914, 6.40393590927124, 6.407167911529541, 6.410240173339844, 6.390751838684082, 6.400000095367432, 6.4235520362854, 6.403071880340576, 6.408192157745361, 6.404928207397461, 6.3887038230896, 6.412288188934326, 6.411263942718506, 6.401023864746094, 6.408192157745361, 6.407167911529541, 6.406144142150879, 6.407167911529541, 6.391871929168701, 6.425600051879883, 6.406047821044922, 6.398975849151611, 6.3897600173950195, 6.396927833557129, 6.397952079772949, 6.402048110961914, 6.387712001800537], "compile_time": 878.9624170167372, "verification_time": 0, "benchmark_time": 206.40186208765954, "GFLOP/s": 117.86547983540413, "strategy_time": 0.008636037819087505, "framework_time": 1.5302839456126094, "timestamp": "2025-04-08 02:15:28.819324+00:00", "gridpoints/s": 7857698655.693608}, "4096,4096,16,8,8,1,6,10,3,1,3": {"grid_width": 4096, "grid_height": 4096, "block_size_x": 16, "block_size_y": 8, "tile_size_x": 8, "tile_size_y": 1, "temporal_tiling_factor": 6, "max_tfactor": 10, "loop_unroll_factor_t": 3, "sh_power": 1, "blocks_per_sm": 3, "time": 15.28891196846962, "times": [15.340543746948242, 15.295488357543945, 15.28934383392334, 15.29036808013916, 15.286272048950195, 15.286272048950195, 15.28320026397705, 15.286175727844238, 15.287296295166016, 15.284223556518555, 15.287296295166016, 15.28831958770752, 15.285247802734375, 15.285247802734375, 15.284223556518555, 15.28934383392334, 15.287296295166016, 15.28831958770752, 15.287103652954102, 15.286272048950195, 15.287296295166016, 15.285247802734375, 15.286208152770996, 15.291328430175781, 15.28320026397705, 15.28831958770752, 15.287296295166016, 15.287199974060059, 15.28934383392334, 15.286272048950195, 15.28831958770752, 15.287296295166016], "compile_time": 887.7034049946815, "verification_time": 0, "benchmark_time": 490.859888959676, "GFLOP/s": 98.76107882064953, "strategy_time": 0.00868597999215126, "framework_time": 1.455684076063335, "timestamp": "2025-04-08 02:15:30.199383+00:00", "gridpoints/s": 6584071921.376636}, "4096,4096,32,4,5,2,6,10,6,1,1": {"grid_width": 4096, "grid_height": 4096, "block_size_x": 32, "block_size_y": 4, "tile_size_x": 5, "tile_size_y": 2, "temporal_tiling_factor": 6, "max_tfactor": 10, "loop_unroll_factor_t": 6, "sh_power": 1, "blocks_per_sm": 1, "time": 15.939606994390488, "times": [15.99283218383789, 15.942655563354492, 15.940608024597168, 15.940447807312012, 15.937536239624023, 15.934464454650879, 15.937536239624023, 15.938559532165527, 15.939583778381348, 15.940608024597168, 15.936511993408203, 15.937536239624023, 15.939583778381348, 15.937536239624023, 15.940608024597168, 15.935487747192383, 15.935487747192383, 15.933440208435059, 15.936511993408203, 15.936511993408203, 15.937536239624023, 15.934464454650879, 15.938431739807129, 15.939583778381348, 15.933440208435059, 15.938559532165527, 15.941632270812988, 15.936511993408203, 15.933440208435059, 15.939583778381348, 15.940608024597168, 15.939583778381348], "compile_time": 969.0281070070341, "verification_time": 0, "benchmark_time": 512.1758000459522, "GFLOP/s": 94.72940208195759, "strategy_time": 0.00985804945230484, "framework_time": 1.4759618788957596, "timestamp": "2025-04-08 02:15:31.682110+00:00", "gridpoints/s": 6315293472.130506}, "4096,4096,8,4,3,6,8,10,4,1,2": {"grid_width": 4096, "grid_height": 4096, "block_size_x": 8, "block_size_y": 4, "tile_size_x": 3, "tile_size_y": 6, "temporal_tiling_factor": 8, "max_tfactor": 10, "loop_unroll_factor_t": 4, "sh_power": 1, "blocks_per_sm": 2, "time": 26.325402319431305, "times": [26.377216339111328, 26.32806396484375, 26.32601547241211, 26.32601547241211, 26.32