compare_real_world_impact/results/hotspot/A4000_f=pythonconstraint_i=5.json
{"device_name": "NVIDIA RTX A4000", "kernel_name": "calculate_temp", "problem_size": [4096, 4096], "tune_params_keys": ["grid_width", "grid_height", "block_size_x", "block_size_y", "tile_size_x", "tile_size_y", "temporal_tiling_factor", "max_tfactor", "loop_unroll_factor_t", "sh_power", "blocks_per_sm"], "tune_params": {"grid_width": [4096], "grid_height": [4096], "block_size_x": [1, 2, 4, 8, 16, 32, 64, 96, 128, 160, 192, 224, 256, 288, 320, 352, 384, 416, 448, 480, 512, 544, 576, 608, 640, 672, 704, 736, 768, 800, 832, 864, 896, 928, 960, 992, 1024], "block_size_y": [1, 2, 4, 8, 16, 32], "tile_size_x": [1, 2, 3, 4, 5, 6, 7, 8, 9, 10], "tile_size_y": [1, 2, 3, 4, 5, 6, 7, 8, 9, 10], "temporal_tiling_factor": [1, 2, 3, 4, 5, 6, 7, 8, 9, 10], "max_tfactor": [10], "loop_unroll_factor_t": [1, 2, 3, 4, 5, 6, 7, 8, 9, 10], "sh_power": [0, 1], "blocks_per_sm": [0, 1, 2, 3, 4]}, "objective": "GFLOP/s", "cache": {"4096,4096,4,16,8,1,7,10,7,1,4": {"grid_width": 4096, "grid_height": 4096, "block_size_x": 4, "block_size_y": 16, "tile_size_x": 8, "tile_size_y": 1, "temporal_tiling_factor": 7, "max_tfactor": 10, "loop_unroll_factor_t": 7, "sh_power": 1, "blocks_per_sm": 4, "time": 18.889214754104614, "times": [18.948095321655273, 18.894847869873047, 18.88969612121582, 18.887680053710938, 18.888704299926758, 18.885631561279297, 18.887615203857422, 18.89072036743164, 18.887680053710938, 18.884607315063477, 18.888704299926758, 18.888832092285156, 18.888704299926758, 18.886751174926758, 18.887680053710938, 18.883583068847656, 18.883583068847656, 18.885631561279297, 18.887680053710938, 18.889728546142578, 18.887615203857422, 18.886655807495117, 18.884735107421875, 18.887680053710938, 18.885631561279297, 18.889728546142578, 18.887487411499023, 18.883583068847656, 18.883583068847656, 18.888704299926758, 18.883583068847656, 18.889728546142578], "compile_time": 1015.4196450021118, "verification_time": 0, "benchmark_time": 606.407069019042, "GFLOP/s": 93.25997416685645, "strategy_time": 2136.29156909883, "framework_time": 0, "timestamp": "2025-04-08 01:36:12.959775+00:00", "gridpoints/s": 6217331611.123763}, "4096,4096,8,8,8,1,6,10,1,1,4": {"grid_width": 4096, "grid_height": 4096, "block_size_x": 8, "block_size_y": 8, "tile_size_x": 8, "tile_size_y": 1, "temporal_tiling_factor": 6, "max_tfactor": 10, "loop_unroll_factor_t": 1, "sh_power": 1, "blocks_per_sm": 4, "time": 16.619571924209595, "times": [16.669696807861328, 16.623615264892578, 16.6246395111084, 16.62054443359375, 16.61952018737793, 16.61644744873047, 16.616416931152344, 16.61747169494629, 16.61542320251465, 16.61849594116211, 16.61849594116211, 16.616352081298828, 16.61747169494629, 16.61644744873047, 16.61644744873047, 16.61542320251465, 16.61337661743164, 16.61849594116211, 16.61542320251465, 16.614303588867188, 16.622432708740234, 16.61542320251465, 16.61440086364746, 16.61747169494629, 16.61747169494629, 16.61644744873047, 16.62259292602539, 16.61542320251465, 16.62259292602539, 16.61849594116211, 16.61644744873047, 16.62259292602539], "compile_time": 762.4087729491293, "verification_time": 0, "benchmark_time": 533.5132849868387, "GFLOP/s": 90.85369026866866, "strategy_time": 0.007483991794288158, "framework_time": 1.704610069282353, "timestamp": "2025-04-08 01:36:14.257440+00:00", "gridpoints/s": 6056912684.57791}, "4096,4096,96,1,2,4,3,10,3,0,4": {"grid_width": 4096, "grid_height": 4096, "block_size_x": 96, "block_size_y": 1, "tile_size_x": 2, "tile_size_y": 4, "temporal_tiling_factor": 3, "max_tfactor": 10, "loop_unroll_factor_t": 3, "sh_power": 0, "blocks_per_sm": 4, "time": 7.320855036377907, "times": [7.369728088378906, 7.323647975921631, 7.321599960327148, 7.319551944732666, 7.320576190948486, 7.318528175354004, 7.318528175354004, 7.318528175354004, 7.318528175354004, 7.319551944732666, 7.319551944732666, 7.318528175354004, 7.319551944732666, 7.318367958068848, 7.317503929138184, 7.3164801597595215, 7.318528175354004, 7.319551944732666, 7.320576190948486, 7.319519996643066, 7.318528175354004, 7.319551944732666, 7.319551944732666, 7.320511817932129, 7.318528175354004, 7.318528175354004, 7.319456100463867, 7.319615840911865, 7.321599960327148, 7.317503929138184, 7.317503929138184, 7.319551944732666], "compile_time": 704.3704120442271, "verification_time": 0, "benchmark_time": 235.45699892565608, "GFLOP/s": 103.12657691601198, "strategy_time": 0.008395989425480366, "framework_time": 1.460873056203127, "timestamp": "2025-04-08 01:36:15.198768+00:00", "gridpoints/s": 6875105127.734132}, "4096,4096,16,16,1,2,6,10,3,0,1": {"grid_width": 4096, "grid_height": 4096, "block_size_x": 16, "block_size_y": 16, "tile_size_x": 1, "tile_size_y": 2, "temporal_tiling_factor": 6, "max_tfactor": 10, "loop_unroll_factor_t": 3, "sh_power": 0, "blocks_per_sm": 1, "time": 17.760888636112213, "times": [17.81145668029785, 17.7653751373291, 17.762304306030273, 17.759231567382812, 17.761280059814453, 17.760255813598633, 17.760255813598633, 17.760255813598633, 17.757183074951172, 17.759231567382812, 17.760255813598633, 17.758207321166992, 17.759231567382812, 17.759231567382812, 17.759231567382812, 17.759071350097656, 17.758207321166992, 17.759231567382812, 17.760255813598633, 17.760255813598633, 17.758207321166992, 17.759231567382812, 17.757183074951172, 17.759231567382812, 17.760255813598633, 17.75814437866211, 17.758207321166992, 17.756160736083984, 17.760255813598633, 17.757183074951172, 17.757183074951172, 17.757183074951172], "compile_time": 967.563199927099, "verification_time": 0, "benchmark_time": 569.1723430063576, "GFLOP/s": 85.01542185957435, "strategy_time": 0.008316012099385262, "framework_time": 1.5664910897612572, "timestamp": "2025-04-08 01:36:16.737107+00:00", "gridpoints/s": 5667694790.638289}, "4096,4096,16,16,1,8,4,10,2,0,3": {"grid_width": 4096, "grid_height": 4096, "block_size_x": 16, "block_size_y": 16, "tile_size_x": 1, "tile_size_y": 8, "temporal_tiling_factor": 4, "max_tfactor": 10, "loop_unroll_factor_t": 2, "sh_power": 0, "blocks_per_sm": 3, "time": 9.945007115602493, "times": [9.998335838317871, 9.94918441772461, 9.948160171508789, 9.944928169250488, 9.943039894104004, 9.945088386535645, 9.943039894104004, 9.942015647888184, 9.94099235534668, 9.944064140319824, 9.939871788024902, 9.944064140319824, 9.943872451782227, 9.94099235534668, 9.94099235534668, 9.940959930419922, 9.941920280456543, 9.93996810913086, 9.942015647888184, 9.94099235534668, 9.94099235534668, 9.943039894104004, 9.94099235534668, 9.94099235534668, 9.959424018859863, 9.946111679077148, 9.943072319030762, 9.943039894104004, 9.94099235534668, 9.94099235534668, 9.943039894104004, 9.943039894104004], "compile_time": 842.1397439669818, "verification_time": 0, "benchmark_time": 320.194398984313, "GFLOP/s": 101.21993361077807, "strategy_time": 0.008195056580007076, "framework_time": 1.5174399595707655, "timestamp": "2025-04-08 01:36:17.900999+00:00", "gridpoints/s": 6747995574.051871}, "4096,4096,32,4,3,2,8,10,2,0,2": {"grid_width": 4096, "grid_height": 4096, "block_size_x": 32, "block_size_y": 4, "tile_size_x": 3, "tile_size_y": 2, "temporal_tiling_factor": 8, "max_tfactor": 10, "loop_unroll_factor_t": 2, "sh_power": 0, "blocks_per_sm": 2, "time": 46.76602804660797, "times": [46.81523132324219, 46.77427291870117, 46.77529525756836, 46.76403045654297, 46.75571060180664, 46.76300811767578, 46.75481414794922, 46.75686264038086, 46.76505661010742, 46.76403045654297, 46.76095962524414, 46.75993728637695, 46.76710510253906, 46.76707077026367, 46.76300811767578, 46.76607894897461, 46.761985778808594, 46.76723098754883, 46.76598358154297, 46.77222442626953, 46.762977600097656, 46.761985778808594, 46.7589111328125, 46.766048431396484, 46.7608642578125, 46.76505661010742, 46.77529525756836, 46.76486587524414, 46.761985778808594, 46.7691535949707, 46.76591873168945, 46.75993728637695], "compile_time": 837.931678048335, "verification_time": 0, "benchmark_time": 1498.162630945444, "GFLOP/s": 43.04975222598632, "strategy_time": 0.00819494016468525, "framework_time": 1.418435131199658, "timestamp": "2025-04-08 01:36:20.238550+00:00", "gridpoints/s": 2869983481.7324214}, "4096,4096,32,2,3,6,6,10,3,1,1": {"grid_width": 4096, "grid_height": 4096, "block_size_x": 32, "block_size_y": 2, "tile_size_x": 3, "tile_size_y": 6, "temporal_tiling_factor": 6, "max_tfactor": 10, "loop_unroll_factor_t": 3, "sh_power": 1, "blocks_per_sm": 1, "time": 25.770742058753967, "times": [25.823232650756836, 25.774112701416016, 25.76076889038086, 25.763839721679688, 25.76793670654297, 25.769983291625977, 25.763744354248047, 25.772031784057617, 25.778175354003906, 25.771007537841797, 25.773056030273438, 25.75155258178711, 25.76896095275879, 25.756671905517578, 25.75872039794922, 25.782272338867188, 25.7761287689209, 25.761791229248047, 25.758655548095703, 25.7576961517334, 25.7761287689209, 25.753599166870117, 25.777023315429688, 25.775039672851562, 25.778175354003906, 25.772031784057617, 25.7761287689209, 25.775104522705078, 25.778175354003906, 25.775104522705078, 25.76691246032715, 25.769983291625977], "compile_time": 908.6862889816985, "verification_time": 0, "benchmark_time": 826.3995460001752, "GFLOP/s": 58.59161666969116, "strategy_time": 0.008977018296718597, "framework_time": 1.4847370330244303, "timestamp": "2025-04-08 01:36:21.975159+00:00", "gridpoints/s": 3906107777.9794106}, "4096,4096,256,2,1,2,4,10,4,0,3": {"grid_width": 4096, "grid_height": 4096, "block_size_x": 256, "block_size_y": 2, "tile_size_x": 1, "tile_size_y": 2, "temporal_tiling_factor": 4, "max_tfactor": 10, "loop_unroll_factor_t": 4, "sh_power": 0, "blocks_per_sm": 3, "time": 10.934960007667542, "times": [10.985471725463867, 10.93939208984375, 10.936320304870605, 10.933247566223145, 10.935296058654785, 10.933183670043945, 10.934271812438965, 10.934271812438965, 10.93222427368164, 10.933247566223145, 10.93120002746582, 10.93222427368164, 10.933055877685547, 10.932160377502441, 10.93120002746582, 10.933152198791504, 10.93222427368164, 10.933247566223145, 10.93222427368164, 10.933247566223145, 10.932352066040039, 10.934271812438965, 10.933152198791504, 10.93222427368164, 10.93222427368164, 10.93222427368164, 10.934240341186523, 10.935199737548828, 10.93222427368164, 10.93222427368164, 10.934271812438965, 10.933247566223145], "compile_time": 937.8174690064043, "verification_time": 0, "benchmark_time": 352.05608990509063, "GFLOP/s": 92.05639154547924, "strategy_time": 0.00871601514518261, "framework_time": 1.6431250842288136, "timestamp": "2025-04-08 01:36:23.266717+00:00", "gridpoints/s": 6137092769.698617}, "4096,4096,4,16,1,8,3,10,3,0,0": {"grid_width": 4096, "grid_height": 4096, "block_size_x": 4, "block_size_y": 16, "tile_size_x": 1, "tile_size_y": 8, "temporal_tiling_factor": 3, "max_tfactor": 10, "loop_unroll_factor_t": 3, "sh_power": 0, "blocks_per_sm": 0, "time": 7.355713069438934, "times": [7.406591892242432, 7.360511779785156, 7.35641622543335, 7.355391979217529, 7.353343963623047, 7.354368209838867, 7.353343963623047, 7.353343963623047, 7.354368209838867, 7.352320194244385, 7.354207992553711, 7.353343963623047, 7.353504180908203, 7.354368209838867, 7.354368209838867, 7.354368209838867, 7.353343963623047, 7.353343963623047, 7.353343963623047, 7.354368209838867, 7.353343963623047, 7.352320194244385, 7.354368209838867, 7.353343963623047, 7.354368209838867, 7.353343963623047, 7.353343963623047, 7.355391979217529, 7.354368209838867, 7.354368209838867, 7.352352142333984, 7.353343963623047], "compile_time": 880.8609719853848, "verification_time": 0, "benchmark_time": 236.66362697258592, "GFLOP/s": 102.63786975823223, "strategy_time": 0.008465955033898354, "framework_time": 1.432631048373878, "timestamp": "2025-04-08 01:36:24.385716+00:00", "gridpoints/s": 6842524650.548815}, "4096,4096,64,4,1,3,4,10,2,1,2": {"grid_width": 4096, "grid_height": 4096, "block_size_x": 64, "block_size_y": 4, "tile_size_x": 1, "tile_size_y": 3, "temporal_tiling_factor": 4, "max_tfactor": 10, "loop_unroll_factor_t": 2, "sh_power": 1, "blocks_per_sm": 2, "time": 9.794066995382309, "times": [9.844736099243164, 9.794560432434082, 9.795583724975586, 9.793536186218262, 9.793536186218262, 9.792511940002441, 9.791423797607422, 9.794560432434082, 9.792511940002441, 9.792511940002441, 9.793536186218262, 9.790464401245117, 9.791487693786621, 9.790335655212402, 9.79145622253418, 9.792511940002441, 9.791487693786621, 9.792415618896484, 9.790464401245117, 9.792511940002441, 9.792511940002441, 9.792511940002441, 9.791487693786621, 9.792511940002441, 9.792511940002441, 9.792511940002441, 9.79139232635498, 9.792511940002441, 9.791487693786621, 9.794560432434082, 9.792511940002441, 9.791487693786621], "compile_time": 791.5581479901448, "verification_time": 0, "benchmark_time": 314.86300099641085, "GFLOP/s": 102.7798728020347, "strategy_time": 0.009106937795877457, "framework_time": 1.5383291756734252, "timestamp": "2025-04-08 01:36:25.493715+00:00", "gridpoints/s": 6851991520.135647}, "4096,4096,2,16,8,7,8,10,2,0,2": {"grid_width": 4096, "grid_height": 4096, "block_size_x": 2, "block_size_y": 16, "tile_size_x": 8, "tile_size_y": 7, "temporal_tiling_factor": 8, "max_tfactor": 10, "loop_unroll_factor_t": 2, "sh_power": 0, "blocks_per_sm": 2, "time": 19.48560804128647, "times": [19.538944244384766, 19.48569679260254, 19.49888038635254, 19.489791870117188, 19.4652156829834, 19.489791870117188, 19.482624053955078, 19.47443199157715, 19.481599807739258, 19.495744705200195, 19.483583450317383, 19.46828842163086, 19.4703369140625, 19.464191436767578, 19.500896453857422, 19.488672256469727, 19.47750473022461, 19.49286460876465, 19.480575561523438, 19.481599807739258, 19.487743377685547, 19.486719131469727, 19.49388885498047, 19.49180793762207, 19.497983932495117, 19.495935440063477, 19.472383499145508, 19.471359252929688, 19.481504440307617, 19.499008178710938, 19.47648048400879, 19.473407745361328], "compile_time": 922.6840559858829, "verification_time": 0, "benchmark_time": 625.1332660904154, "GFLOP/s": 103.32066188205441, "strategy_time": 0.008665956556797028, "framework_time": 1.648775883950293, "timestamp": "2025-04-08 01:36:27.043219+00:00", "gridpoints/s": 6888044125.470294}, "4096,4096,32,1,5,3,7,10,7,0,3": {"grid_width": 4096, "grid_height": 4096, "block_size_x": 32, "block_size_y": 1, "tile_size_x": 5, "tile_size_y": 3, "temporal_tiling_factor": 7, "max_tfactor": 10, "loop_unroll_factor_t": 7, "sh_power": 0, "blocks_per_sm": 3, "time": 35.51089000701904, "times": [35.548160552978516, 35.52153778076172, 35.506046295166016, 35.514366149902344, 35.5153923034668, 35.507198333740234, 35.518463134765625, 35.505088806152344, 35.505088806152344, 35.48979187011719, 35.49798583984375, 35.48262405395508, 35.4969596862793, 35.511295318603516, 35.52460861206055, 35.4969596862793, 35.51011276245117, 35.509246826171875, 35.50310516357422, 35.51123046875, 35.51123046875, 35.516414642333984, 35.50515365600586, 35.5153923034668, 35.507102966308594, 35.513343811035156, 35.49798583984375, 35.5307502746582, 35.52870559692383, 35.52665710449219, 35.499969482421875, 35.520511627197266], "compile_time": 1137.2193989809602, "verification_time": 0, "benchmark_time": 1137.903860071674, "GFLOP/s": 49.60753390443897, "strategy_time": 0.008406001143157482, "framework_time": 1.6143309185281396, "timestamp": "2025-04-08 01:36:29.319996+00:00", "gridpoints/s": 3307168926.962598}, "4096,4096,32,1,1,10,9,10,1,0,4": {"grid_width": 4096, "grid_height": 4096, "block_size_x": 32, "block_size_y": 1, "tile_size_x": 1, "tile_size_y": 10, "temporal_tiling_factor": 9, "max_tfactor": 10, "loop_unroll_factor_t": 1, "sh_power": 0, "blocks_per_sm": 4, "time": 43.55940389633179, "times": [43.60995101928711, 43.589630126953125, 43.56095886230469, 43.55686569213867, 43.54150390625, 43.57427215576172, 43.53638458251953, 43.55788803100586, 43.54150390625, 43.54252624511719, 43.58143997192383, 43.56390380859375, 43.5599365234375, 43.55583953857422, 43.55891036987305, 43.563934326171875, 43.5333137512207, 43.573150634765625, 43.55686569213867, 43.57126235961914, 43.57120132446289, 43.554656982421875, 43.55583953857422, 43.56300735473633, 43.54764938354492, 43.53116989135742, 43.582462310791016, 43.567134857177734, 43.54457473754883, 43.53843307495117, 43.56403350830078, 43.55072021484375], "compile_time": 823.6772599630058, "verification_time": 0, "benchmark_time": 1395.483292057179, "GFLOP/s": 51.99621568261941, "strategy_time": 0.008425908163189888, "framework_time": 1.5781631227582693, "timestamp": "2025-04-08 01:36:31.540774+00:00", "gridpoints/s": 3466414378.841294}, "4096,4096,32,1,6,4,4,10,2,0,4": {"grid_width": 4096, "grid_height": 4096, "block_size_x": 32, "block_size_y": 1, "tile_size_x": 6, "tile_size_y": 4, "temporal_tiling_factor": 4, "max_tfactor": 10, "loop_unroll_factor_t": 2, "sh_power": 0, "blocks_per_sm": 4, "time": 11.526953011751175, "times": [11.573247909545898, 11.53321647644043, 11.538335800170898, 11.53433609008789, 11.53331184387207, 11.513855934143066, 11.536383628845215, 11.526144027709961, 11.523072242736816, 11.522944450378418, 11.527168273925781, 11.530240058898926, 11.527039527893066, 11.517919540405273, 11.527104377746582, 11.517888069152832, 11.528191566467285, 11.518976211547852, 11.523072242736816, 11.527168273925781, 11.529215812683105, 11.526144027709961, 11.531264305114746, 11.523072242736816, 11.512703895568848, 11.521023750305176, 11.521023750305176, 11.522047996520996, 11.522047996520996, 11.53228759765625, 11.510784149169922, 11.531264305114746], "compile_time": 869.3796240258962, "verification_time": 0, "benchmark_time": 370.05882302764803, "GFLOP/s": 87.32862526409069, "strategy_time": 0.008124974556267262, "framework_time": 1.576620968990028, "timestamp": "2025-04-08 01:36:32.781828+00:00", "gridpoints/s": 5821908350.939379}, "4096,4096,128,1,2,4,1,10,1,0,0": {"grid_width": 4096, "grid_height": 4096, "block_size_x": 128, "block_size_y": 1, "tile_size_x": 2, "tile_size_y": 4, "temporal_tiling_factor": 1, "max_tfactor": 10, "loop_unroll_factor_t": 1, "sh_power": 0, "blocks_per_sm": 0, "time": 1.4585460014641285, "times": [1.5063040256500244, 1.4581760168075562, 1.4531519412994385, 1.45305597782135, 1.4520319700241089, 1.45305597782135, 1.4520319700241089, 1.451904058456421, 1.45305597782135, 1.454975962638855, 1.4520319700241089, 1.45305597782135, 1.452191948890686, 1.4520319700241089, 1.4520000219345093, 1.452895998954773, 1.4520319700241089, 1.4520319700241089, 1.4520319700241089, 1.4520319700241089, 1.4632960557937622, 1.4612480401992798, 1.462272047996521, 1.4612480401992798, 1.462272047996521, 1.462272047996521, 1.4612480401992798, 1.4632960557937622, 1.4795199632644653, 1.462272047996521, 1.4612480401992798, 1.4631999731063843], "compile_time": 755.5693929316476, "verification_time": 0, "benchmark_time": 48.19207394029945, "GFLOP/s": 172.54048877949583, "strategy_time": 0.008264905773103237, "framework_time": 1.6370943048968911, "timestamp": "2025-04-08 01:36:33.587265+00:00", "gridpoints/s": 11502699251.966389}, "4096,4096,128,2,1,7,1,10,1,1,3": {"grid_width": 4096, "grid_height": 4096, "block_size_x": 128, "block_size_y": 2, "tile_size_x": 1, "tile_size_y": 7, "temporal_tiling_factor": 1, "max_tfactor": 10, "loop_unroll_factor_t": 1, "sh_power": 1, "blocks_per_sm": 3, "time": 1.468950979411602, "times": [1.5175679922103882, 1.4725120067596436, 1.4684159755706787, 1.4673919677734375, 1.4673919677734375, 1.46943998336792, 1.4673919677734375, 1.4663679599761963, 1.4673919677734375, 1.4684159755706787, 1.4684480428695679, 1.4673919677734375, 1.4684159755706787, 1.4673919677734375, 1.4673919677734375, 1.4672960042953491, 1.4663679599761963, 1.4673919677734375, 1.4673919677734375, 1.466528058052063, 1.4663679599761963, 1.4673919677734375, 1.4662400484085083, 1.4673919677734375, 1.4673919677734375, 1.4673919677734375, 1.465343952178955, 1.4663679599761963, 1.466271996498108, 1.465343952178955, 1.4672319889068604, 1.4673919677734375], "compile_time": 730.9541850117967, "verification_time": 0, "benchmark_time": 48.21765108499676, "GFLOP/s": 171.3183377302375, "strategy_time": 0.00815500970929861, "framework_time": 1.5699488576501608, "timestamp": "2025-04-08 01:36:34.368044+00:00", "gridpoints/s": 11421222515.349165}, "4096,4096,2,16,8,4,7,10,1,0,4": {"grid_width": 4096, "grid_height": 4096, "block_size_x": 2, "block_size_y": 16, "tile_size_x": 8, "tile_size_y": 4, "temporal_tiling_factor": 7, "max_tfactor": 10, "loop_unroll_factor_t": 1, "sh_power": 0, "blocks_per_sm": 4, "time": 17.822069942951202, "times": [19.808256149291992, 19.760000228881836, 19.750911712646484, 19.756032943725586, 19.751935958862305, 19.749887466430664, 19.751935958862305, 19.752960205078125, 19.752960205078125, 19.753984451293945, 19.749887466430664, 19.752960205078125, 19.752960205078125, 18.994176864624023, 16.36147117614746, 16.348127365112305, 16.355327606201172, 16.357376098632812, 16.368640899658203, 16.357311248779297, 16.353151321411133, 16.362464904785156, 16.36966323852539, 16.359487533569336, 16.358400344848633, 16.36249542236328, 16.36249542236328, 16.360448837280273, 16.350208282470703, 16.365568161010742, 16.36147117614746, 16.35327911376953], "compile_time": 847.7039569988847, "verification_time": 0, "benchmark_time": 571.4270430617034, "GFLOP/s": 98.84416824975668, "strategy_time": 0.008485978469252586, "framework_time": 1.557083916850388, "timestamp": "2025-04-08 01:36:35.788772+00:00", "gridpoints/s": 6589611216.650446}, "4096,4096,4,8,3,9,4,10,1,0,0": {"grid_width": 4096, "grid_height": 4096, "block_size_x": 4, "block_size_y": 8, "tile_size_x": 3, "tile_size_y": 9, "temporal_tiling_factor": 4, "max_tfactor": 10, "loop_unroll_factor_t": 1, "sh_power": 0, "blocks_per_sm": 0, "time": 9.676333993673325, "times": [9.719807624816895, 9.678848266601562, 9.674752235412598, 9.677727699279785, 9.674752235412598, 9.675775527954102, 9.682944297790527, 9.676735877990723, 9.675616264343262, 9.674752235412598, 9.674752235412598, 9.681920051574707, 9.679871559143066, 9.672703742980957, 9.678848266601562, 9.669535636901855, 9.673727989196777, 9.677824020385742, 9.682944297790527, 9.667584419250488, 9.670656204223633, 9.669631958007812, 9.677887916564941, 9.672703742980957, 9.669568061828613, 9.664352416992188, 9.672703742980957, 9.676799774169922, 9.675775527954102, 9.666560173034668, 9.679871559143066, 9.674752235412598], "compile_time": 856.704953010194, "verification_time": 0, "benchmark_time": 311.30902003496885, "GFLOP/s": 104.03040662488154, "strategy_time": 0.00844593159854412, "framework_time": 1.6164040425792336, "timestamp": "2025-04-08 01:36:36.958442+00:00", "gridpoints/s": 6935360441.658769}, "4096,4096,32,4,1,9,6,10,1,0,2": {"grid_width": 4096, "grid_height": 4096, "block_size_x": 32, "block_size_y": 4, "tile_size_x": 1, "tile_size_y": 9, "temporal_tiling_factor": 6, "max_tfactor": 10, "loop_unroll_factor_t": 1, "sh_power": 0, "blocks_per_sm": 2, "time": 17.540563881397247, "times": [17.58310317993164, 17.542144775390625, 17.535999298095703, 17.537023544311523, 17.535999298095703, 17.533952713012695, 17.534975051879883, 17.542144775390625, 17.539072036743164, 17.539072036743164, 17.540096282958984, 17.535999298095703, 17.540096282958984, 17.540096282958984, 17.541120529174805, 17.540096282958984, 17.538047790527344, 17.543167114257812, 17.54105567932129, 17.539072036743164, 17.538047790527344, 17.541120529174805, 17.5380802154541, 17.537023544311523, 17.54096031188965, 17.538047790527344, 17.538015365600586, 17.536863327026367, 17.545215606689453, 17.543167114257812, 17.540096282958984, 17.539072036743164], "compile_time": 824.8700130498037, "verification_time": 0, "benchmark_time": 562.2940990142524, "GFLOP/s": 86.08328958006794, "strategy_time": 0.00818504486232996, "framework_time": 1.511388923972845, "timestamp": "2025-04-08 01:36:38.347156+00:00", "gridpoints/s": 5738885972.00453}, "4096,4096,32,1,1,1,9,10,1,1,4": {"grid_width": 4096, "grid_height": 4096, "block_size_x": 32, "block_size_y": 1, "tile_size_x": 1, "tile_size_y": 1, "temporal_tiling_factor": 9, "max_tfactor": 10, "loop_unroll_factor_t": 1, "sh_power": 1, "blocks_per_sm": 4, "time": 222.72085332870483, "times": [222.7559051513672, 222.7158966064453, 222.71385192871094, 222.7046356201172, 222.71795654296875, 222.7210235595703, 222.7158966064453, 222.72921752929688, 222.7230682373047, 222.72409057617188, 222.71795654296875, 222.73228454589844, 222.74134826660156, 222.73023986816406, 222.73126220703125, 222.72921752929688, 222.70361328125, 222.7077178955078, 222.71282958984375, 222.7281951904297, 222.7025909423828, 222.72000122070312, 222.71897888183594, 222.71897888183594, 222.7270050048828, 222.72511291503906, 222.71180725097656, 222.71385192871094, 222.71072387695312, 222.7210235595703, 222.71897888183594, 222.7220458984375], "compile_time": 754.2779359500855, "verification_time": 0, "benchmark_time": 7128.868247964419, "GFLOP/s": 10.169340347566326, "strategy_time": 0.016742036677896976, "framework_time": 1.5999950701370835, "timestamp": "2025-04-08 01:36:46.231951+00:00", "gridpoints/s": 677956023.1710885}, "4096,4096,1,32,4,4,3,10,3,1,1": {"grid_width": 4096, "grid_height": 4096, "block_size_x": 1, "block_size_y": 32, "tile_size_x": 4, "tile_size_y": 4, "temporal_tiling_factor": 3, "max_tfactor": 10, "loop_unroll_factor_t": 3, "sh_power": 1, "blocks_per_sm": 1, "time": 7.66636198759079, "times": [7.7117438316345215, 7.666687965393066, 7.673855781555176, 7.673855781555176, 7.655424118041992, 7.657472133636475, 7.675903797149658, 7.672800064086914, 7.666560173034668, 7.669760227203369, 7.654399871826172, 7.664639949798584, 7.671807765960693, 7.660543918609619, 7.657472133636475, 7.662591934204102, 7.664639949798584, 7.664639949798584, 7.669760227203369, 7.664544105529785, 7.661632061004639, 7.671807765960693, 7.660543918609619, 7.657472133636475, 7.668735980987549, 7.668735980987549, 7.667776107788086, 7.664639949798584, 7.655392169952393, 7.668735980987549, 7.668704032897949, 7.650303840637207], "compile_time": 828.0326810199767, "verification_time": 0, "benchmark_time": 247.1544409636408, "GFLOP/s": 98.47887710260031, "strategy_time": 0.018324004486203194, "framework_time": 1.7979650292545557, "timestamp": "2025-04-08 01:36:47.308991+00:00", "gridpoints/s": 6565258473.506687}, "4096,4096,4,8,3,7,8,10,1,0,0": {"grid_width": 4096, "grid_height": 4096, "block_size_x": 4, "block_size_y": 8, "tile_size_x": 3, "tile_size_y": 7, "temporal_tiling_factor": 8, "max_tfactor": 10, "loop_unroll_factor_t": 1, "sh_power": 0, "blocks_per_sm": 0, "time": 24.155334174633026, "times": [24.189855575561523, 24.157087326049805, 24.155136108398438, 24.1582088470459, 24.155136108398438, 24.156160354614258, 24.156160354614258, 24.151039123535156, 24.15001678466797, 24.154111862182617, 24.157184600830078, 24.142719268798828, 24.161279678344727, 24.166400909423828, 24.15705680847168, 24.146944046020508, 24.161279678344727, 24.15292739868164, 24.162303924560547, 24.14182472229004, 24.14899253845215, 24.143871307373047, 24.170368194580078, 24.15001678466797, 24.15001678466797, 24.146944046020508, 24.164352416992188, 24.15001678466797, 24.145919799804688, 24.164352416992188, 24.1582088470459, 24.144800186157227], "compile_time": 845.4396799206734, "verification_time": 0, "benchmark_time": 774.5487239444628, "GFLOP/s": 83.34663910856807, "strategy_time": 0.008436036296188831, "framework_time": 1.6417921287938952, "timestamp": "2025-04-08 01:36:48.930662+00:00", "gridpoints/s": 5556442607.237871}, "4096,4096,16,2,2,6,3,10,3,1,3": {"grid_width": 4096, "grid_height": 4096, "block_size_x": 16, "block_size_y": 2, "tile_size_x": 2, "tile_size_y": 6, "temporal_tiling_factor": 3, "max_tfactor": 10, "loop_unroll_factor_t": 3, "sh_power": 1, "blocks_per_sm": 3, "time": 6.640795856714249, "times": [6.699039936065674, 6.643712043762207, 6.642687797546387, 6.639616012573242, 6.638591766357422, 6.638591766357422, 6.638591766357422, 6.638591766357422, 6.638591766357422, 6.638591766357422, 6.638591766357422, 6.639616012573242, 6.639679908752441, 6.638591766357422, 6.638591766357422, 6.63756799697876, 6.638591766357422, 6.638591766357422, 6.63756799697876, 6.638591766357422, 6.639423847198486, 6.638688087463379, 6.638527870178223, 6.63756799697876, 6.638591766357422, 6.63756799697876, 6.638591766357422, 6.638591766357422, 6.638591766357422, 6.638591766357422, 6.639616012573242, 6.638527870178223], "compile_time": 833.9841000270098, "verification_time": 0, "benchmark_time": 213.55601004324853, "GFLOP/s": 113.68738571246315, "strategy_time": 0.008525908924639225, "framework_time": 1.6937799518927932, "timestamp": "2025-04-08 01:36:49.979937+00:00", "gridpoints/s": 7579159047.497543}, "4096,4096,2,16,10,4,8,10,1,1,1": {"grid_width": 4096, "grid_height": 4096, "block_size_x": 2, "block_size_y": 16, "tile_size_x": 10, "tile_size_y": 4, "temporal_tiling_factor": 8, "max_tfactor": 10, "loop_unroll_factor_t": 1, "sh_power": 1, "blocks_per_sm": 1, "time": 23.146895051002502, "times": [23.194623947143555, 23.17305564880371, 23.1331844329834, 23.184383392333984, 23.112703323364258, 23.161855697631836, 23.138303756713867, 23.146495819091797, 23.138303756713867, 23.177120208740234, 23.182336807250977, 23.150592803955078, 23.10963249206543, 23.186431884765625, 23.137279510498047, 23.12704086303711, 23.180288314819336, 23.139328002929688, 23.152639389038086, 23.128896713256836, 23.136255264282227, 23.10348892211914, 23.156736373901367, 23.151615142822266, 23.122943878173828, 23.1362247467041, 23.16681671142578, 23.149568557739258, 23.113727569580078, 23.12396812438965, 23.147520065307617, 23.137279510498047], "compile_time": 815.1558119570836, "verification_time": 0, "benchmark_time": 742.0804080320522, "GFLOP/s": 86.97779618233524, "strategy_time": 0.008735922165215015, "framework_time": 1.6158950747922063, "timestamp": "2025-04-08 01:36:51.538828+00:00", "gridpoints/s": 5798519745.489016}, "4096,4096,192,2,1,3,4,10,4,0,2": {"grid_width": 4096, "grid_height": 4096, "block_size_x": 192, "block_size_y": 2, "tile_size_x": 1, "tile_size_y": 3, "temporal_tiling_factor": 4, "max_tfactor": 10, "loop_unroll_factor_t": 4, "sh_power": 0, "blocks_per_sm": 2, "time": 9.950377076864243, "times": [9.999296188354492, 9.953280448913574, 9.951231956481934, 9.94918441772461, 9.949119567871094, 9.94918441772461, 9.948063850402832, 9.949055671691895, 9.948160171508789, 9.948160171508789, 9.947135925292969, 9.947999954223633, 9.950112342834473, 9.948160171508789, 9.946111679077148, 9.949088096618652, 9.948160171508789, 9.948160171508789, 9.951231956481934, 9.948160171508789, 9.94918441772461, 9.946111679077148, 9.947135925292969, 9.946111679077148, 9.947104454040527, 9.948160171508789, 9.947135925292969, 9.947135925292969, 9.948160171508789, 9.94700813293457, 9.963520050048828, 9.946240425109863], "compile_time": 716.3220309885219, "verification_time": 0, "benchmark_time": 320.1888980111107, "GFLOP/s": 101.16530782944255, "strategy_time": 0.009417999535799026, "framework_time": 1.6644439892843366, "timestamp": "2025-04-08 01:36:52.577043+00:00", "gridpoints/s": 6744353855.29617}, "4096,4096,32,2,5,6,4,10,4,1,0": {"grid_width": 4096, "grid_height": 4096, "block_size_x": 32, "block_size_y": 2, "tile_size_x": 5, "tile_size_y": 6, "temporal_tiling_factor": 4, "max_tfactor": 10, "loop_unroll_factor_t": 4, "sh_power": 1, "blocks_per_sm": 0, "time": 9.117419987916946, "times": [9.166720390319824, 9.128959655761719, 9.11564826965332, 9.119584083557129, 9.12384033203125, 9.119744300842285, 9.101311683654785, 9.108480453491211, 9.116671562194824, 9.116671562194824, 9.108480453491211, 9.110527992248535, 9.11257553100586, 9.104384422302246, 9.11257553100586, 9.119744300842285, 9.11564826965332, 9.12384033203125, 9.126912117004395, 9.11359977722168, 9.117695808410645, 9.116671562194824, 9.109503746032715, 9.110527992248535, 9.119711875915527, 9.118720054626465, 9.12179183959961, 9.121664047241211, 9.12281608581543, 9.111552238464355, 9.10540771484375, 9.115455627441406], "compile_time": 907.4772560270503, "verification_time": 0, "benchmark_time": 293.5386010212824, "GFLOP/s": 110.40765494340083, "strategy_time": 0.008616014383733273, "framework_time": 1.6170160379260778, "timestamp": "2025-04-08 01:36:53.779716+00:00", "gridpoints/s": 7360510329.560056}, "4096,4096,8,4,1,4,9,10,9,1,3": {"grid_width": 4096, "grid_height": 4096, "block_size_x": 8, "block_size_y": 4, "tile_size_x": 1, "tile_size_y": 4, "temporal_tiling_factor": 9, "max_tfactor": 10, "loop_unroll_factor_t": 9, "sh_power": 1, "blocks_per_sm": 3, "time": 47.81045591831207, "times": [47.857662200927734, 47.80748748779297, 47.81158447265625, 47.802207946777344, 47.80851364135742, 47.806400299072266, 47.80748748779297, 47.81260681152344, 47.80339050292969, 47.8125114440918, 47.81363296508789, 47.80543899536133, 47.81465530395508, 47.80659103393555, 47.8012809753418, 47.79520034790039, 47.81062316894531, 47.81568145751953, 47.80441665649414, 47.81363296508789, 47.81465530395508, 47.80031967163086, 47.81158447265625, 47.80953598022461, 47.79929733276367, 47.81977462768555, 47.807456970214844, 47.8105583190918, 47.81353759765625, 47.8125114440918, 47.812767028808594, 47.81158447265625], "compile_time": 1115.2512350818142, "verification_time": 0, "benchmark_time": 1530.9579989407212, "GFLOP/s": 47.37298811518973, "strategy_time": 0.008406001143157482, "framework_time": 1.5348319429904222, "timestamp": "2025-04-08 01:36:56.427498+00:00", "gridpoints/s": 3158199207.679315}, "4096,4096,64,1,6,2,2,10,2,0,4": {"grid_width": 4096, "grid_height": 4096, "block_size_x": 64, "block_size_y": 1, "tile_size_x": 6, "tile_size_y": 2, "temporal_tiling_factor": 2, "max_tfactor": 10, "loop_unroll_factor_t": 2, "sh_power": 0, "blocks_per_sm": 4, "time": 4.576296970248222, "times": [4.628479957580566, 4.581376075744629, 4.576288223266602, 4.575232028961182, 4.574207782745361, 4.576320171356201, 4.575232028961182, 4.573184013366699, 4.573184013366699, 4.574207782745361, 4.576223850250244, 4.572159767150879, 4.576096057891846, 4.575200080871582, 4.575232028961182, 4.574207782745361, 4.573184013366699, 4.575232028961182, 4.573184013366699, 4.574207782745361, 4.575104236602783, 4.574207782745361, 4.575104236602783, 4.572159767150879, 4.573184013366699, 4.573184013366699, 4.575071811676025, 4.575232028961182, 4.573184013366699, 4.574207782745361, 4.574207782745361, 4.574016094207764], "compile_time": 824.2211689939722, "verification_time": 0, "benchmark_time": 147.767614107579, "GFLOP/s": 109.98335188301812, "strategy_time": 0.008205068297684193, "framework_time": 1.4701108448207378, "timestamp": "2025-04-08 01:36:57.400996+00:00", "gridpoints/s": 7332223458.867874}, "4096,4096,4,8,4,10,9,10,1,1,2": {"grid_width": 4096, "grid_height": 4096, "block_size_x": 4, "block_size_y": 8, "tile_size_x": 4, "tile_size_y": 10, "temporal_tiling_factor": 9, "max_tfactor": 10, "loop_unroll_factor_t": 1, "sh_power": 1, "blocks_per_sm": 2, "time": 30.307314038276672, "times": [30.351360321044922, 30.32044792175293, 30.300159454345703, 30.334976196289062, 30.312416076660156, 30.291967391967773, 30.290943145751953, 30.309375762939453, 30.296064376831055, 30.333951950073242, 30.327808380126953, 30.33907127380371, 30.3503360748291, 30.295040130615234, 30.289920806884766, 30.281728744506836, 30.317567825317383, 30.290943145751953, 30.296064376831055, 30.324607849121094, 30.320640563964844, 30.289920806884766, 30.308351516723633, 30.291967391967773, 30.299135208129883, 30.272512435913086, 30.310400009155273, 30.299072265625, 30.273536682128906, 30.3175048828125, 30.3155517578125, 30.280704498291016], "compile_time": 820.53197408095, "verification_time": 0, "benchmark_time": 971.2560309562832, "GFLOP/s": 74.73193293010098, "strategy_time": 0.008646049536764622, "framework_time": 1.6208839369937778, "timestamp": "2025-04-08 01:36:59.194445+00:00", "gridpoints/s": 4982128862.006732}, "4096,4096,16,2,3,3,10,10,1,0,3": {"grid_width": 4096, "grid_height": 4096, "block_size_x": 16, "block_size_y": 2, "tile_size_x": 3, "tile_size_y": 3, "temporal_tiling_factor": 10, "max_tfactor": 10, "loop_unroll_factor_t": 1, "sh_power": 0, "blocks_per_sm": 3, "time": 70.6022584438324, "times": [70.65497589111328, 70.62016296386719, 70.59046173095703, 70.57612609863281, 70.5728988647461, 70.60675048828125, 70.60684967041016, 70.62220764160156, 70.61811065673828, 70.57510375976562, 70.59967803955078, 70.60479736328125, 70.61299133300781, 70.60479736328125, 70.58124542236328, 70.6046371459961, 70.56588745117188, 70.61913299560547, 70.61196899414062, 70.62016296386719, 70.60889434814453, 70.58841705322266, 70.61196899414062, 70.58841705322266, 70.5771484375, 70.61504364013672, 70.6170883178711, 70.6170883178711, 70.60889434814453, 70.5792007446289, 70.5771484375, 70.614013671875], "compile_time": 816.5709510212764, "verification_time": 0, "benchmark_time": 2260.921720066108, "GFLOP/s": 35.64450281717356, "strategy_time": 0.009206938557326794, "framework_time": 1.5757589135318995, "timestamp": "2025-04-08 01:37:02.273553+00:00", "gridpoints/s": 2376300187.8115706}, "4096,4096,1,32,3,3,5,10,5,1,2": {"grid_width": 4096, "grid_height": 4096, "block_size_x": 1, "block_size_y": 32, "tile_size_x": 3, "tile_size_y": 3, "temporal_tiling_factor": 5, "max_tfactor": 10, "loop_unroll_factor_t": 5, "sh_power": 1, "blocks_per_sm": 2, "time": 21.286768317222595, "times": [21.334016799926758, 21.29199981689453, 21.285888671875, 21.28486442565918, 21.28486442565918, 21.28473663330078, 21.28281593322754, 21.28384017944336, 21.28384017944336, 21.28486442565918, 21.287839889526367, 21.285888671875, 21.28486442565918, 21.28384017944336, 21.284832000732422, 21.28384017944336, 21.28384017944336, 21.28691291809082, 21.28281593322754, 21.28384017944336, 21.28384017944336, 21.28384017944336, 21.285888671875, 21.28691291809082, 21.287935256958008, 21.285888671875, 21.28691291809082, 21.28473663330078, 21.285823822021484, 21.285856246948242, 21.28384017944336, 21.28486442565918], "compile_time": 890.4450500849634, "verification_time": 0, "benchmark_time": 682.8375320183113, "GFLOP/s": 59.111424583033006, "strategy_time": 0.008947099559009075, "framework_time": 1.5713197644799948, "timestamp": "2025-04-08 01:37:03.848446+00:00", "gridpoints/s": 3940761638.868867}, "4096,4096,8,4,6,7,3,10,3,1,4": {"grid_width": 4096, "grid_height": 4096, "block_size_x": 8, "block_size_y": 4, "tile_size_x": 6, "tile_size_y": 7, "temporal_tiling_factor": 3, "max_tfactor": 10, "loop_unroll_factor_t": 3, "sh_power": 1, "blocks_per_sm": 4, "time": 5.506523013114929, "times": [5.56441593170166, 5.506015777587891, 5.517312049865723, 5.504000186920166, 5.511295795440674, 5.532671928405762, 5.5214080810546875, 5.492735862731934, 5.4917120933532715, 5.487616062164307, 5.499904155731201, 5.504000186920166, 5.505023956298828, 5.510272026062012, 5.485536098480225, 5.499904155731201, 5.498720169067383, 5.502975940704346, 5.517312049865723, 5.51423978805542, 5.5070719718933105, 5.510015964508057, 5.494783878326416, 5.517312049865723, 5.500927925109863, 5.504000186920166, 5.525440216064453, 5.492735862731934, 5.5070719718933105, 5.481472015380859, 5.500927925109863, 5.499904155731201], "compile_time": 877.7383989654481, "verification_time": 0, "benchmark_time": 177.84151807427406, "GFLOP/s": 137.1055234313687, "strategy_time": 0.008836970664560795, "framework_time": 1.7062029801309109, "timestamp": "2025-04-08 01:37:04.905772+00:00", "gridpoints/s": 9140368228.757914}, "4096,4096,1,32,10,1,9,10,9,1,2": {"grid_width": 4096, "grid_height": 4096, "block_size_x": 1, "block_size_y": 32, "tile_size_x": 10, "tile_size_y": 1, "temporal_tiling_factor": 9, "max_tfactor": 10, "loop_unroll_factor_t": 9, "sh_power": 1, "blocks_per_sm": 2, "time": 43.48069512844086, "times": [43.53228759765625, 43.485023498535156, 43.474945068359375, 43.480064392089844, 43.4780158996582, 43.47596740722656, 43.480064392089844, 43.480064392089844, 43.476993560791016, 43.474945068359375, 43.476993560791016, 43.476993560791016, 43.4780158996582, 43.47903823852539, 43.47596740722656, 43.476993560791016, 43.476959228515625, 43.48108673095703, 43.480064392089844, 43.484161376953125, 43.474945068359375, 43.48099136352539, 43.48108673095703, 43.48313522338867, 43.482112884521484, 43.48108673095703, 43.480064392089844, 43.48108673095703, 43.480064392089844, 43.4780158996582, 43.476993560791016, 43.4780158996582], "compile_time": 1065.6989350682124, "verification_time": 0, "benchmark_time": 1392.3238690476865, "GFLOP/s": 52.09033924847504, "strategy_time": 0.009156996384263039, "framework_time": 1.54882890637964, "timestamp": "2025-04-08 01:37:07.365384+00:00", "gridpoints/s": 3472689283.231669}, "4096,4096,128,1,5,2,1,10,1,0,0": {"grid_width": 4096, "grid_height": 4096, "block_size_x": 128, "block_size_y": 1, "tile_size_x": 5, "tile_size_y": 2, "temporal_tiling_factor": 1, "max_tfactor": 10, "loop_unroll_factor_t": 1, "sh_power": 0, "blocks_per_sm": 0, "time": 1.5786609686911106, "times": [1.6291840076446533, 1.5831040143966675, 1.5790079832077026, 1.5769599676132202, 1.5769599676132202, 1.5779839754104614, 1.5769599676132202, 1.575935959815979, 1.5771839618682861, 1.5789120197296143, 1.575935959815979, 1.5779839754104614, 1.575935959815979, 1.5769599676132202, 1.5769599676132202, 1.575935959815979, 1.5769599676132202, 1.5749119520187378, 1.5778559446334839, 1.5769599676132202, 1.575935959815979, 1.5769599676132202, 1.575935959815979, 1.575935959815979, 1.575935959815979, 1.5769599676132202, 1.5779839754104614, 1.575935959815979, 1.575935959815979, 1.575935959815979, 1.5769599676132202, 1.5781439542770386], "compile_time": 760.7657180633396, "verification_time": 0, "benchmark_time": 51.77611205726862, "GFLOP/s": 159.4124672687976, "strategy_time": 0.009187962859869003, "framework_time": 1.6316629480570555, "timestamp": "2025-04-08 01:37:08.179605+00:00", "gridpoints/s": 10627497817.91984}, "4096,4096,16,4,9,1,2,10,1,0,3": {"grid_width": 4096, "grid_height": 4096, "block_size_x": 16, "block_size_y": 4, "tile_size_x": 9, "tile_size_y": 1, "temporal_tiling_factor": 2, "max_tfactor": 10, "loop_unroll_factor_t": 1, "sh_power": 0, "blocks_per_sm": 3, "time": 3.829129032790661, "times": [3.8798720836639404, 3.833695888519287, 3.8287360668182373, 3.830687999725342, 3.827712059020996, 3.8287360668182373, 3.827712059020996, 3.827712059020996, 3.8287360668182373, 3.827712059020996, 3.826688051223755, 3.826688051223755, 3.826688051223755, 3.826688051223755, 3.827615976333618, 3.826688051223755, 3.826688051223755, 3.826688051223755, 3.827712059020996, 3.8267838954925537, 3.826688051223755, 3.8265600204467773, 3.826591968536377, 3.826688051223755, 3.826688051223755, 3.8276479244232178, 3.826688051223755, 3.826688051223755, 3.826688051223755, 3.826688051223755, 3.826688051223755, 3.8275840282440186], "compile_time": 822.4051189608872, "verification_time": 0, "benchmark_time": 124.62505197618157, "GFLOP/s": 131.44411580018863, "strategy_time": 0.008677016012370586, "framework_time": 1.664895098656416, "timestamp": "2025-04-08 01:37:09.128339+00:00", "gridpoints/s": 8762941053.34591}, "4096,4096,4,8,8,2,8,10,4,1,3": {"grid_width": 4096, "grid_height": 4096, "block_size_x": 4, "block_size_y": 8, "tile_size_x": 8, "tile_size_y": 2, "temporal_tiling_factor": 8, "max_tfactor": 10, "loop_unroll_factor_t": 4, "sh_power": 1, "blocks_per_sm": 3, "time": 25.28048276901245, "times": [29.165536880493164, 29.11846351623535, 29.113344192504883, 29.102079391479492, 29.079551696777344, 29.078527450561523, 29.081600189208984, 28.077056884765625, 24.046592712402344, 24.053760528564453, 24.050687789916992, 24.04863929748535, 24.051712036132812, 24.049728393554688, 24.049663543701172, 24.049663543701172, 24.04761505126953, 24.04863929748535, 24.04761505126953, 24.046527862548828, 24.04863929748535, 24.04863929748535, 24.04761505126953, 24.04863929748535, 24.04761505126953, 24.04863929748535, 24.046592712402344, 24.0446720123291, 24.04761505126953, 24.045568466186523, 24.04863929748535, 24.045568466186523], "compile_time": 921.5159099549055, "verification_time": 0, "benchmark_time": 810.9573340043426, "GFLOP/s": 79.63716272332269, "strategy_time": 0.008556060492992401, "framework_time": 1.6499890480190516, "timestamp": "2025-04-08 01:37:10.862502+00:00", "gridpoints/s": 5309144181.554846}, "4096,4096,64,8,3,2,2,10,2,0,1": {"grid_width": 4096, "grid_height": 4096, "block_size_x": 64, "block_size_y": 8, "tile_size_x": 3, "tile_size_y": 2, "temporal_tiling_factor": 2, "max_tfactor": 10, "loop_unroll_factor_t": 2, "sh_power": 0, "blocks_per_sm": 1, "time": 4.652861014008522, "times": [4.70527982711792, 4.65715217590332, 4.653952121734619, 4.651008129119873, 4.652031898498535, 4.652192115783691, 4.651008129119873, 4.651008129119873, 4.651008129119873, 4.649983882904053, 4.651904106140137, 4.652031898498535, 4.652031898498535, 4.649983882904053, 4.652031898498535, 4.651008129119873, 4.651008129119873, 4.651008129119873, 4.651103973388672, 4.651008129119873, 4.651008129119873, 4.649983882904053, 4.651008129119873, 4.649983882904053, 4.651936054229736, 4.651008129119873, 4.649983882904053, 4.649983882904053, 4.649983882904053, 4.649983882904053, 4.651008129119873, 4.64793586730957], "compile_time": 817.0198310399428, "verification_time": 0, "benchmark_time": 149.69354798085988, "GFLOP/s": 108.17354708955381, "strategy_time": 0.008266069926321507, "framework_time": 1.5698479255661368, "timestamp": "2025-04-08 01:37:11.830826+00:00", "gridpoints/s": 7211569805.970254}, "4096,4096,1,32,4,6,6,10,2,0,0": {"grid_width": 4096, "grid_height": 4096, "block_size_x": 1, "block_size_y": 32, "tile_size_x": 4, "tile_size_y": 6, "temporal_tiling_factor": 6, "max_tfactor": 10, "loop_unroll_factor_t": 2, "sh_power": 0, "blocks_per_sm": 0, "time": 24.411398947238922, "times": [24.450048446655273, 24.408063888549805, 24.407039642333984, 24.4019832611084, 24.415231704711914, 24.432512283325195, 24.397823333740234, 24.4069766998291, 24.387584686279297, 24.418304443359375, 24.407039642333984, 24.404991149902344, 24.398847579956055, 24.394752502441406, 24.422399520874023, 24.424448013305664, 24.412063598632812, 24.393695831298828, 24.402944564819336, 24.415231704711914, 24.403968811035156, 24.421279907226562, 24.423263549804688, 24.418304443359375, 24.42838478088379, 24.404991149902344, 24.417280197143555, 24.413183212280273, 24.424448013305664, 24.417280197143555, 24.396799087524414, 24.393600463867188], "compile_time": 851.4115259749815, "verification_time": 0, "benchmark_time": 782.4750079307705, "GFLOP/s": 61.854277309690374, "strategy_time": 0.008865958079695702, "framework_time": 1.6301121795549989, "timestamp": "2025-04-08 01:37:13.466381+00:00", "gridpoints/s": 4123618487.3126917}, "4096,4096,16,16,2,1,6,10,3,1,4": {"grid_width": 4096, "grid_height": 4096, "block_size_x": 16, "block_size_y": 16, "tile_size_x": 2, "tile_size_y": 1, "temporal_tiling_factor": 6, "max_tfactor": 10, "loop_unroll_factor_t": 3, "sh_power": 1, "blocks_per_sm": 4, "time": 15.643152981996536, "times": [15.69587230682373, 15.646559715270996, 15.644672393798828, 15.641599655151367, 15.642623901367188, 15.641599655151367, 15.641568183898926, 15.640576362609863, 15.641599655151367, 15.657983779907227, 15.642623901367188, 15.639552116394043, 15.640447616577148, 15.638527870178223, 15.639552116394043, 15.641599655151367, 15.641599655151367, 15.640576362609863, 15.639552116394043, 15.640576362609863, 15.638527870178223, 15.640576362609863, 15.642623901367188, 15.638527870178223, 15.639616012573242, 15.641599655151367, 15.638527870178223, 15.640416145324707, 15.639552116394043, 15.641535758972168, 15.640576362609863, 15.639552116394043], "compile_time": 887.2142229229212, "verification_time": 0, "benchmark_time": 501.60490709822625, "GFLOP/s": 96.52462273671922, "strategy_time": 0.009136972948908806, "framework_time": 1.6374840633943677, "timestamp": "2025-04-08 01:37:14.856885+00:00", "gridpoints/s": 6434974849.1146145}, "4096,4096,448,1,1,2,3,10,3,1,0": {"grid_width": 4096, "grid_height": 4096, "block_size_x": 448, "block_size_y": 1, "tile_size_x": 1, "tile_size_y": 2, "temporal_tiling_factor": 3, "max_tfactor": 10, "loop_unroll_factor_t": 3, "sh_power": 1, "blocks_per_sm": 0, "time": 10.063791036605835, "times": [10.112000465393066, 10.066944122314453, 10.065728187561035, 10.064031600952148, 10.061823844909668, 10.062687873840332, 10.062848091125488, 10.062848091125488, 10.061823844909668, 10.062848091125488, 10.059776306152344, 10.061792373657227, 10.063872337341309, 10.062848091125488, 10.062848091125488, 10.060704231262207, 10.062848091125488, 10.059776306152344, 10.06380844116211, 10.060799598693848, 10.061951637268066, 10.060735702514648, 10.061759948730469, 10.060640335083008, 10.060799598693848, 10.063872337341309, 10.061823844909668, 10.061823844909668, 10.060799598693848, 10.059776306152344, 10.062848091125488, 10.061823844909668], "compile_time": 694.04162093997, "verification_time": 0, "benchmark_time": 323.7333919387311, "GFLOP/s": 75.01891854211497, "strategy_time": 0.008536037057638168, "framework_time": 1.572303008288145, "timestamp": "2025-04-08 01:37:15.876270+00:00", "gridpoints/s": 5001261236.140998}, "4096,4096,4,16,1,9,3,10,1,0,4": {"grid_width": 4096, "grid_height": 4096, "block_size_x": 4, "block_size_y": 16, "tile_size_x": 1, "tile_size_y": 9, "temporal_tiling_factor": 3, "max_tfactor": 10, "loop_unroll_factor_t": 1, "sh_power": 0, "blocks_per_sm": 4, "time": 7.429256945848465, "times": [7.478271961212158, 7.432159900665283, 7.428095817565918, 7.429120063781738, 7.428095817565918, 7.428095817565918, 7.428095817565918, 7.427072048187256, 7.426943778991699, 7.432191848754883, 7.4258880615234375, 7.427072048187256, 7.425951957702637, 7.427072048187256, 7.427072048187256, 7.428095817565918, 7.4260478019714355, 7.428959846496582, 7.4260478019714355, 7.427072048187256, 7.427072048187256, 7.427072048187256, 7.425024032592773, 7.4260478019714355, 7.427072048187256, 7.427072048187256, 7.428063869476318, 7.429120063781738, 7.428095817565918, 7.4279680252075195, 7.427072048187256, 7.429120063781738], "compile_time": 828.0479200184345, "verification_time": 0, "benchmark_time": 238.54333499912173, "GFLOP/s": 101.62183452571075, "strategy_time": 0.009227078408002853, "framework_time": 1.5908878995105624, "timestamp": "2025-04-08 01:37:16.944492+00:00", "gridpoints/s": 6774788968.380717}, "4096,4096,4,8,4,1,4,10,4,1,3": {"grid_width": 4096, "grid_height": 4096, "block_size_x": 4, "block_size_y": 8, "tile_size_x": 4, "tile_size_y": 1, "temporal_tiling_factor": 4, "max_tfactor": 10, "loop_unroll_factor_t": 4, "sh_power": 1, "blocks_per_sm": 3, "time": 12.547544986009598, "times": [12.595199584960938, 12.55014419555664, 12.549247741699219, 12.547072410583496, 12.547072410583496, 12.546048164367676, 12.547967910766602, 12.546048164367676, 12.542880058288574, 12.545023918151855, 12.543999671936035, 12.545023918151855, 12.545056343078613, 12.543999671936035, 12.545023918151855, 12.546976089477539, 12.5480318069458, 12.545120239257812, 12.543999671936035, 12.546976089477539, 12.541952133178711, 12.545023918151855, 12.56447982788086, 12.543999671936035, 12.543999671936035, 12.542976379394531, 12.542976379394531, 12.5448637008667, 12.546048164367676, 12.545184135437012, 12.543999671936035, 12.545023918151855], "compile_time": 867.6647649845108, "verification_time": 0, "benchmark_time": 403.6532959435135, "GFLOP/s": 80.2254912114192, "strategy_time": 0.008495990186929703, "framework_time": 1.5359651297330856, "timestamp": "2025-04-08 01:37:18.217386+00:00", "gridpoints/s": 5348366080.761279}, "4096,4096,1,32,5,3,8,10,1,1,1": {"grid_width": 4096, "grid_height": 4096, "block_size_x": 1, "block_size_y": 32, "tile_size_x": 5, "tile_size_y": 3, "temporal_tiling_factor": 8, "max_tfactor": 10, "loop_unroll_factor_t": 1, "sh_power": 1, "blocks_per_sm": 1, "time": 36.974355936050415, "times": [37.02169418334961, 36.96742248535156, 37.0063362121582, 36.95817565917969, 36.988929748535156, 36.98585510253906, 36.986881256103516, 36.959232330322266, 37.00428771972656, 36.933631896972656, 36.93564987182617, 36.94281768798828, 36.998207092285156, 36.96025466918945, 36.96332931518555, 36.988929748535156, 36.99711990356445, 37.008384704589844, 36.964351654052734, 36.975616455078125, 36.94182586669922, 36.973567962646484, 36.97459030151367, 36.962303161621094, 37.00223922729492, 36.93056106567383, 36.98774337768555, 36.96742248535156, 36.98883056640625, 36.97663879394531, 36.94073486328125, 36.98582458496094], "compile_time": 761.7705090669915, "verification_time": 0, "benchmark_time": 1184.8574050236493, "GFLOP/s": 54.450331020831726, "strategy_time": 0.008175033144652843, "framework_time": 1.6048549441620708, "timestamp": "2025-04-08 01:37:20.165666+00:00", "gridpoints/s": 3630022068.0554485}, "4096,4096,4,8,7,3,5,10,5,1,4": {"grid_width": 4096, "grid_height": 4096, "block_size_x": 4, "block_size_y": 8, "tile_size_x": 7, "tile_size_y": 3, "temporal_tiling_factor": 5, "max_tfactor": 10, "loop_unroll_factor_t": 5, "sh_power": 1, "blocks_per_sm": 4, "time": 11.28235599398613, "times": [11.339776039123535, 11.289600372314453, 11.282431602478027, 11.281375885009766, 11.279359817504883, 11.284480094909668, 11.280384063720703, 11.279359817504883, 11.281408309936523, 11.281375885009766, 11.28121566772461, 11.281408309936523, 11.281408309936523, 11.280384063720703, 11.263968467712402, 11.280287742614746, 11.281408309936523, 11.282431602478027, 11.279359817504883, 11.277312278747559, 11.281408309936523, 11.280384063720703, 11.279359817504883, 11.280384063720703, 11.279359817504883, 11.278335571289062, 11.282431602478027, 11.280384063720703, 11.280384063720703, 11.280384063720703, 11.283455848693848, 11.280384063720703], "compile_time": 941.1595239071175, "verification_time": 0, "benchmark_time": 362.8200649982318, "GFLOP/s": 111.52734417090818, "strategy_time": 0.008436036296188831, "framework_time": 1.4238340081647038, "timestamp": "2025-04-08 01:37:21.471108+00:00", "gridpoints/s": 7435156278.060545}, "4096,4096,16,16,1,5,10,10,10,1,0": {"grid_width": 4096, "grid_height": 4096, "block_size_x": 16, "block_size_y": 16, "tile_size_x": 1, "tile_size_y": 5, "temporal_tiling_factor": 10, "max_tfactor": 10, "loop_unroll_factor_t": 10, "sh_power": 1, "blocks_per_sm": 0, "time": 31.458900034427643, "times": [31.507455825805664, 31.468544006347656, 31.45916748046875, 31.460351943969727, 31.45916748046875, 31.459327697753906, 31.456256866455078, 31.465471267700195, 31.459327697753906, 31.458303451538086, 31.454208374023438, 31.456256866455078, 31.4550724029541, 31.458303451538086, 31.459327697753906, 31.450111389160156, 31.454208374023438, 31.459327697753906, 31.453184127807617, 31.461376190185547, 31.456256866455078, 31.456256866455078, 31.455232620239258, 31.460447311401367, 31.454208374023438, 31.458303451538086, 31.458303451538086, 31.451135635375977, 31.456256866455078, 31.454208374023438, 31.453184127807617, 31.456256866455078], "compile_time": 1161.26289695967, "verification_time": 0, "benchmark_time": 1008.2218940369785, "GFLOP/s": 79.9958802515641, "strategy_time": 0.00844593159854412, "framework_time": 1.5864800661802292, "timestamp": "2025-04-08 01:37:23.642218+00:00", "gridpoints/s": 5333058683.437607}, "4096,4096,4,16,8,8,3,10,1,0,2": {"grid_width": 4096, "grid_height": 4096, "block_size_x": 4, "block_size_y": 16, "tile_size_x": 8, "tile_size_y": 8, "temporal_tiling_factor": 3, "max_tfactor": 10, "loop_unroll_factor_t": 1, "sh_power": 0, "blocks_per_sm": 2, "time": 5.407584011554718, "times": [5.4620161056518555, 5.408768177032471, 5.4119038581848145, 5.411839962005615, 5.408768177032471, 5.398528099060059, 5.409791946411133, 5.405695915222168, 5.409791946411133, 5.40169620513916, 5.409791946411133, 5.413887977600098, 5.404543876647949, 5.405695915222168, 5.4036478996276855, 5.411839962005615, 5.397503852844238, 5.40774393081665, 5.395455837249756, 5.400576114654541, 5.41593599319458, 5.402624130249023, 5.413887977600098, 5.405695915222168, 5.401599884033203, 5.4036478996276855, 5.404672145843506, 5.397632122039795, 5.410816192626953, 5.409632205963135, 5.404672145843506, 5.392384052276611], "compile_time": 930.6795699521899, "verification_time": 0, "benchmark_time": 174.42054604180157, "GFLOP/s": 139.61405285369565, "strategy_time": 0.008436036296188831, "framework_time": 1.6905140364542603, "timestamp": "2025-04-08 01:37:24.749049+00:00", "gridpoints/s": 9307603523.57971}, "4096,4096,16,4,3,8,1,10,1,0,4": {"grid_width": 4096, "grid_height": 4096, "block_size_x": 16, "block_size_y": 4, "tile_size_x": 3, "tile_size_y": 8, "temporal_tiling_factor": 1, "max_tfactor": 10, "loop_unroll_factor_t": 1, "sh_power": 0, "blocks_per_sm": 4, "time": 1.549009993672371, "times": [1.5953919887542725, 1.556480050086975, 1.5441919565200806, 1.5452159643173218, 1.546239972114563, 1.5360000133514404, 1.551360011100769, 1.551360011100769, 1.532863974571228, 1.5370240211486816, 1.5431679487228394, 1.546239972114563, 1.5378880500793457, 1.5523840188980103, 1.5452159643173218, 1.5452159643173218, 1.5534080266952515, 1.5431679487228394, 1.5503360033035278, 1.5503360033035278, 1.5421439409255981, 1.5411200523376465, 1.537951946258545, 1.5472639799118042, 1.5493119955062866, 1.5471359491348267, 1.5482879877090454, 1.5575040578842163, 1.5523840188980103, 1.5503360033035278, 1.563647985458374, 1.5677440166473389], "compile_time": 784.1474780580029, "verification_time": 0, "benchmark_time": 51.15614098031074, "GFLOP/s": 162.463922781655, "strategy_time": 0.008566072210669518, "framework_time": 1.598140923306346, "timestamp": "2025-04-08 01:37:25.585991+00:00", "gridpoints/s": 10830928185.443666}, "4096,4096,16,4,3,5,6,10,3,0,4": {"grid_width": 4096, "grid_height": 4096, "block_size_x": 16, "block_size_y": 4, "tile_size_x": 3, "tile_size_y": 5, "temporal_tiling_factor": 6, "max_tfactor": 10, "loop_unroll_factor_t": 3, "sh_power": 0, "blocks_per_sm": 4, "time": 23.81316602230072, "times": [27.374591827392578, 27.32748794555664, 27.32134437561035, 26.09663963317871, 25.603071212768555, 25.600000381469727, 25.598976135253906, 25.601024627685547, 25.601024627685547, 25.598976135253906, 25.60201644897461, 22.816768646240234, 22.5883846282959, 22.594560623168945, 22.589439392089844, 22.589439392089844, 22.602752685546875, 22.599679946899414, 22.584320068359375, 22.589439392089844, 22.598655700683594, 22.590463638305664, 22.60051155090332, 22.60259246826172, 22.586368560791016, 22.597631454467773, 22.590463638305664, 22.598655700683594, 22.589311599731445, 22.590431213378906, 22.593536376953125, 22.602752685546875], "compile_time": 996.0217110347003, "verification_time": 0, "benchmark_time": 763.6087199207395, "GFLOP/s": 63.40817674499694, "strategy_time": 0.008616014383733273, "framework_time": 1.5588271198794246, "timestamp": "2025-04-08 01:37:27.347219+00:00", "gridpoints/s": 4227211782.999796}, "4096,4096,8,4,9,2,9,10,3,1,3": {"grid_width": 4096, "grid_height": 4096, "block_size_x": 8, "block_size_y": 4, "tile_size_x": 9, "tile_size_y": 2, "temporal_tiling_factor": 9, "max_tfactor": 10, "loop_unroll_factor_t": 3, "sh_power": 1, "blocks_per_sm": 3, "time": 32.80753314495087, "times": [32.857086181640625, 32.82320022583008, 32.81292724609375, 32.79155349731445, 32.81305694580078, 32.79462432861328, 32.82636642456055, 32.80998229980469, 32.82841491699219, 32.78623962402344, 32.80588912963867, 32.79462432861328, 32.80486297607422, 32.80691146850586, 32.78745651245117, 32.80691146850586, 32.81919860839844, 32.81612777709961, 32.83148956298828, 32.777217864990234, 32.81817626953125, 32.82022476196289, 32.80694580078125, 32.80575942993164, 32.820159912109375, 32.80281448364258, 32.8007698059082, 32.7823371887207, 32.766849517822266, 32.82329559326172, 32.80803298950195, 32.79155349731445], "compile_time": 912.7326220041141, "verification_time": 0, "benchmark_time": 1051.3486280106008, "GFLOP/s": 69.03671025776517, "strategy_time": 0.016530975699424744, "framework_time": 1.5386990271508694, "timestamp": "2025-04-08 01:37:29.312885+00:00", "gridpoints/s": 4602447350.517678}, "4096,4096,8,4,9,6,6,10,2,0,2": {"grid_width": 4096, "grid_height": 4096, "block_size_x": 8, "block_size_y": 4, "tile_size_x": 9, "tile_size_y": 6, "temporal_tiling_factor": 6, "max_tfactor": 10, "loop_unroll_factor_t": 2, "sh_power": 0, "blocks_per_sm": 2, "time": 11.897810995578766, "times": [11.949055671691895, 11.886591911315918, 11.898719787597656, 11.893759727478027, 11.896832466125488, 11.894783973693848, 11.897791862487793, 11.882495880126953, 11.922431945800781, 11.913215637207031, 11.902976036071777, 11.893759727478027, 11.893728256225586, 11.896832466125488, 11.884544372558594, 11.890687942504883, 11.890687942504883, 11.889663696289062, 11.906047821044922, 11.886591911315918, 11.898880004882812, 11.899904251098633, 11.898880004882812, 11.897855758666992, 11.890687942504883, 11.915264129638672, 11.895808219909668, 11.883520126342773, 11.888640403747559, 11.895808219909668, 11.889663696289062, 11.903840065002441], "compile_time": 926.9372060662135, "verification_time": 0, "benchmark_time": 382.4041880434379, "GFLOP/s": 126.90985262424309, "strategy_time": 0.008836970664560795, "framework_time": 1.726600923575461, "timestamp": "2025-04-08 01:37:30.623994+00:00", "gridpoints/s": 8460656841.616206}, "4096,4096,8,8,10,5,6,10,2,0,0": {"grid_width": 4096, "grid_height": 4096, "block_size_x": 8, "block_size_y": 8, "tile_size_x": 10, "tile_size_y": 5, "temporal_tiling_factor": 6, "max_tfactor": 10, "loop_unroll_factor_t": 2, "sh_power": 0, "blocks_per_sm": 0, "time": 12.14140111207962, "times": [12.191743850708008, 12.14463996887207, 12.140607833862305, 12.15180778503418, 12.141504287719727, 12.142592430114746, 12.138496398925781, 12.137472152709961, 12.141568183898926, 12.14566421508789, 12.148736000061035, 12.142592430114746, 12.146688461303711, 12.134400367736816, 12.138496398925781, 12.14463996887207, 12.120063781738281, 12.134431838989258, 12.141504287719727, 12.13542366027832, 12.142592430114746, 12.133184432983398, 12.14566421508789, 12.131327629089355, 12.138496398925781, 12.115967750549316, 12.142592430114746, 12.14566421508789, 12.140543937683105, 12.137472152709961, 12.14463996887207, 12.14361572265625], "compile_time": 920.5189230851829, "verification_time": 0, "benchmark_time": 389.57953604403883, "GFLOP/s": 124.36368966492127, "strategy_time": 0.00871601514518261, "framework_time": 1.583574921824038, "timestamp": "2025-04-08 01:37:31.935716+00:00", "gridpoints/s": 8290912644.328084}, "4096,4096,16,4,8,2,8,10,4,0,1": {"grid_width": 4096, "grid_height": 4096, "block_size_x": 16, "block_size_y": 4, "tile_size_x": 8, "tile_size_y": 2, "temporal_tiling_factor": 8, "max_tfactor": 10, "loop_unroll_factor_t": 4, "sh_power": 0, "blocks_per_sm": 1, "time": 22.990319907665253, "times": [23.038976669311523, 22.992895126342773, 22.988704681396484, 22.984703063964844, 22.98569679260254, 22.986751556396484, 22.994943618774414, 22.987775802612305, 22.985727310180664, 22.989824295043945, 22.985727310180664, 22.987775802612305, 22.984703063964844, 22.98863983154297, 22.989696502685547, 22.999040603637695, 22.986751556396484, 22.987775802612305, 22.986751556396484, 22.9866886138916, 22.987775802612305, 22.984703063964844, 22.98784065246582, 22.984703063964844, 23.008256912231445, 22.989824295043945, 22.987680435180664, 22.988800048828125, 22.990848541259766, 22.985727310180664, 22.987775802612305, 22.986751556396484], "compile_time": 1001.0947859846056, "verification_time": 0, "benchmark_time": 737.553474958986, "GFLOP/s": 87.5701568349535, "strategy_time": 0.008807051926851273, "framework_time": 1.6472130082547665, "timestamp": "2025-04-08 01:37:33.676052+00:00", "gridpoints/s": 5838010455.663566}, "4096,4096,16,8,3,10,6,10,2,0,0": {"grid_width": 4096, "grid_height": 4096, "block_size_x": 16, "block_size_y": 8, "tile_size_x": 3, "tile_size_y": 10, "temporal_tiling_factor": 6, "max_tfactor": 10, "loop_unroll_factor_t": 2, "sh_power": 0, "blocks_per_sm": 0, "time": 20.01655685901642, "times": [20.0683517