compare_real_world_impact/results/hotspot/A4000_f=pyatf_i=0.json
{"device_name": "NVIDIA RTX A4000", "kernel_name": "calculate_temp", "problem_size": [4096, 4096], "tune_params_keys": ["grid_width", "grid_height", "block_size_x", "block_size_y", "tile_size_x", "tile_size_y", "temporal_tiling_factor", "max_tfactor", "loop_unroll_factor_t", "sh_power", "blocks_per_sm"], "tune_params": {"grid_width": [4096], "grid_height": [4096], "block_size_x": [1, 2, 4, 8, 16, 32, 64, 96, 128, 160, 192, 224, 256, 288, 320, 352, 384, 416, 448, 480, 512, 544, 576, 608, 640, 672, 704, 736, 768, 800, 832, 864, 896, 928, 960, 992, 1024], "block_size_y": [1, 2, 4, 8, 16, 32], "tile_size_x": [1, 2, 3, 4, 5, 6, 7, 8, 9, 10], "tile_size_y": [1, 2, 3, 4, 5, 6, 7, 8, 9, 10], "temporal_tiling_factor": [1, 2, 3, 4, 5, 6, 7, 8, 9, 10], "max_tfactor": [10], "loop_unroll_factor_t": [1, 2, 3, 4, 5, 6, 7, 8, 9, 10], "sh_power": [0, 1], "blocks_per_sm": [0, 1, 2, 3, 4]}, "objective": "GFLOP/s", "cache": {"4096,4096,4,32,1,1,10,10,1,0,3": {"grid_width": 4096, "grid_height": 4096, "block_size_x": 4, "block_size_y": 32, "tile_size_x": 1, "tile_size_y": 1, "temporal_tiling_factor": 10, "max_tfactor": 10, "loop_unroll_factor_t": 1, "sh_power": 0, "blocks_per_sm": 3, "time": 75.10063552856445, "times": [75.14214324951172, 75.1032943725586, 75.09606170654297, 75.08992004394531, 75.09503936767578, 75.10224151611328, 75.10527801513672, 75.10514831542969, 75.10015869140625, 75.09913635253906, 75.10012817382812, 75.09196472167969, 75.10118103027344, 75.09913635253906, 75.09709167480469, 75.10323333740234, 75.09302520751953, 75.10015869140625, 75.0940170288086, 75.10118103027344, 75.09913635253906, 75.10118103027344, 75.10323333740234, 75.09814453125, 75.09913635253906, 75.10015869140625, 75.10425567626953, 75.10015869140625, 75.10105895996094, 75.0909423828125, 75.10425567626953, 75.09913635253906], "compile_time": 808.0141119426116, "verification_time": 0, "benchmark_time": 2405.056727002375, "GFLOP/s": 33.50946875866077, "strategy_time": 1076187.6733449753, "framework_time": 0, "timestamp": "2025-04-07 20:23:19.404125+00:00", "gridpoints/s": 2233964583.9107184}, "4096,4096,64,4,5,2,4,10,4,0,0": {"grid_width": 4096, "grid_height": 4096, "block_size_x": 64, "block_size_y": 4, "tile_size_x": 5, "tile_size_y": 2, "temporal_tiling_factor": 4, "max_tfactor": 10, "loop_unroll_factor_t": 4, "sh_power": 0, "blocks_per_sm": 0, "time": 8.315320938825607, "times": [8.368127822875977, 8.318976402282715, 8.315903663635254, 8.316927909851074, 8.31488037109375, 8.315711975097656, 8.31488037109375, 8.312928199768066, 8.316767692565918, 8.31385612487793, 8.31385612487793, 8.311840057373047, 8.312895774841309, 8.312671661376953, 8.314047813415527, 8.311807632446289, 8.315903663635254, 8.310848236083984, 8.31385612487793, 8.311807632446289, 8.31283187866211, 8.311807632446289, 8.31379222869873, 8.312864303588867, 8.31283187866211, 8.312735557556152, 8.311807632446289, 8.311807632446289, 8.31385612487793, 8.311807632446289, 8.312800407409668, 8.31283187866211], "compile_time": 949.1830640472472, "verification_time": 0, "benchmark_time": 267.067909007892, "GFLOP/s": 121.0576197125314, "strategy_time": 0.010218936949968338, "framework_time": 1.8637469038367271, "timestamp": "2025-04-07 20:23:20.622287+00:00", "gridpoints/s": 8070507980.835427}, "4096,4096,32,1,5,8,9,10,1,0,1": {"grid_width": 4096, "grid_height": 4096, "block_size_x": 32, "block_size_y": 1, "tile_size_x": 5, "tile_size_y": 8, "temporal_tiling_factor": 9, "max_tfactor": 10, "loop_unroll_factor_t": 1, "sh_power": 0, "blocks_per_sm": 1, "time": 40.33736217021942, "times": [40.36812973022461, 40.34355163574219, 40.330238342285156, 40.34150314331055, 40.33843231201172, 40.3507194519043, 40.31488037109375, 40.35059356689453, 40.33126449584961, 40.33433532714844, 40.35686492919922, 40.34249496459961, 40.33327865600586, 40.34150314331055, 40.33536148071289, 40.311744689941406, 40.362945556640625, 40.32819366455078, 40.30771255493164, 40.335262298583984, 40.342529296875, 40.33843231201172, 40.32102584838867, 40.32614517211914, 40.32716751098633, 40.353790283203125, 40.33843231201172, 40.34457778930664, 40.32511901855469, 40.34969711303711, 40.346622467041016, 40.32304000854492], "compile_time": 873.907539062202, "verification_time": 0, "benchmark_time": 1292.508874903433, "GFLOP/s": 56.149535768904734, "strategy_time": 0.009567942470312119, "framework_time": 1.4292850391939282, "timestamp": "2025-04-07 20:23:22.790176+00:00", "gridpoints/s": 3743302384.593649}, "4096,4096,2,32,2,5,10,10,1,0,2": {"grid_width": 4096, "grid_height": 4096, "block_size_x": 2, "block_size_y": 32, "tile_size_x": 2, "tile_size_y": 5, "temporal_tiling_factor": 10, "max_tfactor": 10, "loop_unroll_factor_t": 1, "sh_power": 0, "blocks_per_sm": 2, "time": 52.54219603538513, "times": [52.587520599365234, 52.56800079345703, 52.550655364990234, 52.54963302612305, 52.51686477661133, 52.54963302612305, 52.548606872558594, 52.51891326904297, 52.539390563964844, 52.548606872558594, 52.51686477661133, 52.523006439208984, 52.536319732666016, 52.552703857421875, 52.56089782714844, 52.56700897216797, 52.551551818847656, 52.543487548828125, 52.536319732666016, 52.538368225097656, 52.55168151855469, 52.5055046081543, 52.51065444946289, 52.525054931640625, 52.52608108520508, 52.5557746887207, 52.5404167175293, 52.53529739379883, 52.561920166015625, 52.534271240234375, 52.54655838012695, 52.552703857421875], "compile_time": 801.9562549889088, "verification_time": 0, "benchmark_time": 1682.8938400140032, "GFLOP/s": 47.8964068860993, "strategy_time": 0.008856994099915028, "framework_time": 1.7772259889170527, "timestamp": "2025-04-07 20:23:25.276845+00:00", "gridpoints/s": 3193093792.4066195}, "4096,4096,8,4,5,10,4,10,4,1,1": {"grid_width": 4096, "grid_height": 4096, "block_size_x": 8, "block_size_y": 4, "tile_size_x": 5, "tile_size_y": 10, "temporal_tiling_factor": 4, "max_tfactor": 10, "loop_unroll_factor_t": 4, "sh_power": 1, "blocks_per_sm": 1, "time": 7.695299997925758, "times": [7.7414398193359375, 7.693408012390137, 7.721983909606934, 7.692287921905518, 7.685120105743408, 7.70252799987793, 7.719935894012451, 7.693312168121338, 7.692287921905518, 7.6820478439331055, 7.687071800231934, 7.673855781555176, 7.704576015472412, 7.689216136932373, 7.697408199310303, 7.696383953094482, 7.693312168121338, 7.675903797149658, 7.6820478439331055, 7.701504230499268, 7.685120105743408, 7.698431968688965, 7.679135799407959, 7.696383953094482, 7.687168121337891, 7.715839862823486, 7.699456214904785, 7.692255973815918, 7.697408199310303, 7.679999828338623, 7.701504230499268, 7.6912641525268555], "compile_time": 944.3574730539694, "verification_time": 0, "benchmark_time": 247.51920707058161, "GFLOP/s": 130.81139920098428, "strategy_time": 0.008887029252946377, "framework_time": 1.4688287628814578, "timestamp": "2025-04-07 20:23:26.470234+00:00", "gridpoints/s": 8720759946.732286}, "4096,4096,384,1,1,4,5,10,5,0,2": {"grid_width": 4096, "grid_height": 4096, "block_size_x": 384, "block_size_y": 1, "tile_size_x": 1, "tile_size_y": 4, "temporal_tiling_factor": 5, "max_tfactor": 10, "loop_unroll_factor_t": 5, "sh_power": 0, "blocks_per_sm": 2, "time": 15.370670944452286, "times": [15.409055709838867, 15.364095687866211, 15.356927871704102, 15.355903625488281, 15.352831840515137, 15.355968475341797, 15.359999656677246, 15.356927871704102, 15.353856086730957, 15.357952117919922, 15.354880332946777, 15.355903625488281, 15.356927871704102, 15.355903625488281, 15.356927871704102, 15.356927871704102, 15.356927871704102, 15.354880332946777, 15.347711563110352, 15.353856086730957, 15.356927871704102, 15.352831840515137, 15.35478401184082, 15.353728294372559, 15.353728294372559, 15.353856086730957, 15.357952117919922, 15.38969612121582, 15.453023910522461, 15.455231666564941, 15.451135635375977, 15.454208374023438], "compile_time": 727.7242939453572, "verification_time": 0, "benchmark_time": 493.1753580458462, "GFLOP/s": 81.86312780667218, "strategy_time": 0.009056995622813702, "framework_time": 1.6600260278210044, "timestamp": "2025-04-07 20:23:27.692835+00:00", "gridpoints/s": 5457541853.778146}, "4096,4096,480,1,1,4,4,10,2,0,1": {"grid_width": 4096, "grid_height": 4096, "block_size_x": 480, "block_size_y": 1, "tile_size_x": 1, "tile_size_y": 4, "temporal_tiling_factor": 4, "max_tfactor": 10, "loop_unroll_factor_t": 2, "sh_power": 0, "blocks_per_sm": 1, "time": 11.284952938556671, "times": [11.333727836608887, 11.287551879882812, 11.286527633666992, 11.284480094909668, 11.283455848693848, 11.284480094909668, 11.283455848693848, 11.285504341125488, 11.280384063720703, 11.281408309936523, 11.283455848693848, 11.283455848693848, 11.282431602478027, 11.281408309936523, 11.28332805633545, 11.284480094909668, 11.283455848693848, 11.283455848693848, 11.282431602478027, 11.28444766998291, 11.281408309936523, 11.281408309936523, 11.284640312194824, 11.282431602478027, 11.282367706298828, 11.284480094909668, 11.282431602478027, 11.28335952758789, 11.283455848693848, 11.283455848693848, 11.28435230255127, 11.281375885009766], "compile_time": 705.229528946802, "verification_time": 0, "benchmark_time": 362.8546770196408, "GFLOP/s": 89.20134319397054, "strategy_time": 0.008775969035923481, "framework_time": 1.6052430728450418, "timestamp": "2025-04-07 20:23:28.762562+00:00", "gridpoints/s": 5946756212.93137}, "4096,4096,16,2,7,5,3,10,1,0,4": {"grid_width": 4096, "grid_height": 4096, "block_size_x": 16, "block_size_y": 2, "tile_size_x": 7, "tile_size_y": 5, "temporal_tiling_factor": 3, "max_tfactor": 10, "loop_unroll_factor_t": 1, "sh_power": 0, "blocks_per_sm": 4, "time": 7.155927002429962, "times": [7.2130560874938965, 7.159808158874512, 7.160831928253174, 7.154687881469727, 7.156735897064209, 7.151616096496582, 7.155712127685547, 7.152639865875244, 7.156735897064209, 7.157760143280029, 7.1495680809021, 7.154687881469727, 7.151616096496582, 7.158783912658691, 7.1536641120910645, 7.1536641120910645, 7.156735897064209, 7.148543834686279, 7.154560089111328, 7.154687881469727, 7.150591850280762, 7.158720016479492, 7.146495819091797, 7.1495680809021, 7.157760143280029, 7.157760143280029, 7.151616096496582, 7.1536641120910645, 7.147359848022461, 7.158783912658691, 7.147456169128418, 7.153791904449463], "compile_time": 867.3922970192507, "verification_time": 0, "benchmark_time": 230.6937410030514, "GFLOP/s": 105.503412729564, "strategy_time": 0.01562910620123148, "framework_time": 1.688850810751319, "timestamp": "2025-04-07 20:23:29.862382+00:00", "gridpoints/s": 7033560848.637601}, "4096,4096,4,16,7,5,8,10,8,0,2": {"grid_width": 4096, "grid_height": 4096, "block_size_x": 4, "block_size_y": 16, "tile_size_x": 7, "tile_size_y": 5, "temporal_tiling_factor": 8, "max_tfactor": 10, "loop_unroll_factor_t": 8, "sh_power": 0, "blocks_per_sm": 2, "time": 17.68315100669861, "times": [17.726463317871094, 17.684480667114258, 17.681407928466797, 17.683456420898438, 17.686527252197266, 17.67215919494629, 17.683456420898438, 17.675199508666992, 17.674240112304688, 17.688575744628906, 17.684480667114258, 17.679359436035156, 17.676288604736328, 17.684480667114258, 17.679359436035156, 17.679296493530273, 17.676288604736328, 17.680383682250977, 17.69158363342285, 17.676288604736328, 17.666048049926758, 17.686399459838867, 17.683456420898438, 17.689504623413086, 17.679359436035156, 17.686527252197266, 17.686527252197266, 17.679264068603516, 17.674240112304688, 17.690624237060547, 17.691648483276367, 17.683456420898438], "compile_time": 1243.2451469358057, "verification_time": 0, "benchmark_time": 567.2906909603626, "GFLOP/s": 113.85221554899059, "strategy_time": 0.009016948752105236, "framework_time": 1.5973291592672467, "timestamp": "2025-04-07 20:23:31.674562+00:00", "gridpoints/s": 7590147703.266039}, "4096,4096,32,1,2,1,10,10,10,1,0": {"grid_width": 4096, "grid_height": 4096, "block_size_x": 32, "block_size_y": 1, "tile_size_x": 2, "tile_size_y": 1, "temporal_tiling_factor": 10, "max_tfactor": 10, "loop_unroll_factor_t": 10, "sh_power": 1, "blocks_per_sm": 0, "time": 208.50863885879517, "times": [208.58265686035156, 208.49356079101562, 208.48434448242188, 208.51712036132812, 208.50277709960938, 208.53146362304688, 208.5242919921875, 208.4997100830078, 208.4822998046875, 208.50994873046875, 208.51097106933594, 208.4864044189453, 208.49459838867188, 208.50892639160156, 208.5201873779297, 208.5017547607422, 208.4792022705078, 208.51609802246094, 208.50274658203125, 208.5181427001953, 208.51405334472656, 208.50892639160156, 208.51100158691406, 208.5068817138672, 208.5201873779297, 208.4884490966797, 208.51715087890625, 208.50381469726562, 208.51712036132812, 208.5017547607422, 208.4997100830078, 208.5201873779297], "compile_time": 1149.5646010152996, "verification_time": 0, "benchmark_time": 6673.784395097755, "GFLOP/s": 12.069439490726632, "strategy_time": 0.00920705497264862, "framework_time": 1.6625807620584965, "timestamp": "2025-04-07 20:23:39.499615+00:00", "gridpoints/s": 804629299.3817754}, "4096,4096,2,16,3,2,10,10,10,1,1": {"grid_width": 4096, "grid_height": 4096, "block_size_x": 2, "block_size_y": 16, "tile_size_x": 3, "tile_size_y": 2, "temporal_tiling_factor": 10, "max_tfactor": 10, "loop_unroll_factor_t": 10, "sh_power": 1, "blocks_per_sm": 1, "time": 53.622159242630005, "times": [53.49375915527344, 53.44768142700195, 53.44358444213867, 53.43734359741211, 53.43948745727539, 53.441505432128906, 53.44358444213867, 53.440513610839844, 53.43948745727539, 53.442527770996094, 53.44358444213867, 53.4384651184082, 53.433345794677734, 53.440513610839844, 53.508094787597656, 53.77228927612305, 53.77939224243164, 53.771263122558594, 53.77724838256836, 53.773311614990234, 53.775360107421875, 53.77433776855469, 53.77228927612305, 53.7784309387207, 53.77638244628906, 53.773311614990234, 53.780479431152344, 53.771263122558594, 53.770240783691406, 53.779296875, 53.773311614990234, 53.777408599853516], "compile_time": 1127.938662073575, "verification_time": 0, "benchmark_time": 1717.932058032602, "GFLOP/s": 46.931761710917804, "strategy_time": 0.008356058970093727, "framework_time": 1.8562028417363763, "timestamp": "2025-04-07 20:23:42.347383+00:00", "gridpoints/s": 3128784114.061187}, "4096,4096,8,4,4,10,8,10,4,1,3": {"grid_width": 4096, "grid_height": 4096, "block_size_x": 8, "block_size_y": 4, "tile_size_x": 4, "tile_size_y": 10, "temporal_tiling_factor": 8, "max_tfactor": 10, "loop_unroll_factor_t": 4, "sh_power": 1, "blocks_per_sm": 3, "time": 18.507686853408813, "times": [18.577407836914062, 18.501632690429688, 18.512895584106445, 18.498464584350586, 18.490367889404297, 18.497535705566406, 18.49238395690918, 18.532255172729492, 18.520063400268555, 18.529279708862305, 18.490367889404297, 18.49635124206543, 18.513919830322266, 18.512767791748047, 18.519039154052734, 18.513919830322266, 18.516992568969727, 18.502656936645508, 18.490272521972656, 18.518016815185547, 18.506752014160156, 18.488351821899414, 18.489343643188477, 18.498559951782227, 18.495487213134766, 18.496511459350586, 18.51171112060547, 18.51590347290039, 18.498559951782227, 18.495487213134766, 18.497535705566406, 18.525184631347656], "compile_time": 963.8350120512769, "verification_time": 0, "benchmark_time": 593.9964860444888, "GFLOP/s": 108.7799861725664, "strategy_time": 0.008516013622283936, "framework_time": 1.6783819301053882, "timestamp": "2025-04-07 20:23:43.906938+00:00", "gridpoints/s": 7251999078.171093}, "4096,4096,16,8,3,2,9,10,3,0,4": {"grid_width": 4096, "grid_height": 4096, "block_size_x": 16, "block_size_y": 8, "tile_size_x": 3, "tile_size_y": 2, "temporal_tiling_factor": 9, "max_tfactor": 10, "loop_unroll_factor_t": 3, "sh_power": 0, "blocks_per_sm": 4, "time": 39.069263100624084, "times": [39.116798400878906, 39.07379150390625, 39.07072067260742, 39.07379150390625, 39.069664001464844, 39.07072067260742, 39.0747184753418, 39.07072067260742, 39.070655822753906, 39.071617126464844, 39.06560134887695, 39.067649841308594, 39.06867218017578, 39.06662368774414, 39.07072067260742, 39.06969451904297, 39.0645751953125, 39.06560134887695, 39.06867218017578, 39.068607330322266, 39.07276916503906, 39.06560134887695, 39.06560134887695, 39.06560134887695, 39.05740737915039, 39.05535888671875, 39.066558837890625, 39.06355285644531, 39.07174301147461, 39.06560134887695, 39.06550216674805, 39.06150436401367], "compile_time": 981.4798509469256, "verification_time": 0, "benchmark_time": 1251.752977957949, "GFLOP/s": 57.97202148826351, "strategy_time": 0.008084927685558796, "framework_time": 1.5077011194080114, "timestamp": "2025-04-07 20:23:46.141718+00:00", "gridpoints/s": 3864801432.5509005}, "4096,4096,16,4,8,3,7,10,1,1,0": {"grid_width": 4096, "grid_height": 4096, "block_size_x": 16, "block_size_y": 4, "tile_size_x": 8, "tile_size_y": 3, "temporal_tiling_factor": 7, "max_tfactor": 10, "loop_unroll_factor_t": 1, "sh_power": 1, "blocks_per_sm": 0, "time": 17.08451795578003, "times": [17.143648147583008, 17.08844757080078, 17.086368560791016, 17.083391189575195, 17.080320358276367, 17.084415435791016, 17.076223373413086, 17.078271865844727, 17.085439682006836, 17.084352493286133, 17.086463928222656, 17.082239151000977, 17.080320358276367, 17.084415435791016, 17.080320358276367, 17.077247619628906, 17.083200454711914, 17.080320358276367, 17.08844757080078, 17.077247619628906, 17.08233642578125, 17.088512420654297, 17.084415435791016, 17.085439682006836, 17.083391189575195, 17.082368850708008, 17.077247619628906, 17.082368850708008, 17.080320358276367, 17.081344604492188, 17.08233642578125, 17.083391189575195], "compile_time": 797.1270079724491, "verification_time": 0, "benchmark_time": 547.8396620601416, "GFLOP/s": 103.11134821360373, "strategy_time": 0.008114962838590145, "framework_time": 1.482816063798964, "timestamp": "2025-04-07 20:23:47.488206+00:00", "gridpoints/s": 6874089880.906916}, "4096,4096,4,32,3,9,1,10,1,0,0": {"grid_width": 4096, "grid_height": 4096, "block_size_x": 4, "block_size_y": 32, "tile_size_x": 3, "tile_size_y": 9, "temporal_tiling_factor": 1, "max_tfactor": 10, "loop_unroll_factor_t": 1, "sh_power": 0, "blocks_per_sm": 0, "time": 1.746275007724762, "times": [1.8072320222854614, 1.7560640573501587, 1.751039981842041, 1.7396160364151, 1.7776639461517334, 1.741760015487671, 1.756160020828247, 1.751039981842041, 1.73363196849823, 1.7354880571365356, 1.7428480386734009, 1.7448960542678833, 1.7397760152816772, 1.7489919662475586, 1.7448960542678833, 1.7366399765014648, 1.7478079795837402, 1.7416640520095825, 1.751039981842041, 1.7346559762954712, 1.7244160175323486, 1.7489919662475586, 1.7397760152816772, 1.7541120052337646, 1.726464033126831, 1.7469439506530762, 1.7346559762954712, 1.7327040433883667, 1.7541120052337646, 1.751039981842041, 1.743872046470642, 1.7408000230789185], "compile_time": 785.9060700284317, "verification_time": 0, "benchmark_time": 57.196241919882596, "GFLOP/s": 144.11145947045753, "strategy_time": 0.00844593159854412, "framework_time": 1.471174182370305, "timestamp": "2025-04-07 20:23:48.332818+00:00", "gridpoints/s": 9607430631.363834}, "4096,4096,4,16,1,6,4,10,4,0,0": {"grid_width": 4096, "grid_height": 4096, "block_size_x": 4, "block_size_y": 16, "tile_size_x": 1, "tile_size_y": 6, "temporal_tiling_factor": 4, "max_tfactor": 10, "loop_unroll_factor_t": 4, "sh_power": 0, "blocks_per_sm": 0, "time": 12.027956038713455, "times": [12.083200454711914, 12.033023834228516, 12.028863906860352, 12.025856018066406, 12.025856018066406, 12.025856018066406, 12.025856018066406, 12.026880264282227, 12.024831771850586, 12.025856018066406, 12.026880264282227, 12.025856018066406, 12.024831771850586, 12.025856018066406, 12.025856018066406, 12.025856018066406, 12.026816368103027, 12.024831771850586, 12.025856018066406, 12.02672004699707, 12.025856018066406, 12.024831771850586, 12.025856018066406, 12.025856018066406, 12.025856018066406, 12.025856018066406, 12.026752471923828, 12.026880264282227, 12.024831771850586, 12.026880264282227, 12.025856018066406, 12.023839950561523], "compile_time": 934.081423911266, "verification_time": 0, "benchmark_time": 386.06396911200136, "GFLOP/s": 83.6911073469198, "strategy_time": 0.007955008186399937, "framework_time": 1.5480660367757082, "timestamp": "2025-04-07 20:23:49.654550+00:00", "gridpoints/s": 5579407156.46132}, "4096,4096,32,2,2,8,4,10,2,1,0": {"grid_width": 4096, "grid_height": 4096, "block_size_x": 32, "block_size_y": 2, "tile_size_x": 2, "tile_size_y": 8, "temporal_tiling_factor": 4, "max_tfactor": 10, "loop_unroll_factor_t": 2, "sh_power": 1, "blocks_per_sm": 0, "time": 9.159863978624344, "times": [9.210880279541016, 9.163776397705078, 9.165823936462402, 9.166848182678223, 9.164799690246582, 9.164799690246582, 9.161727905273438, 9.162752151489258, 9.157631874084473, 9.158656120300293, 9.164799690246582, 9.161727905273438, 9.167872428894043, 9.156607627868652, 9.150367736816406, 9.160703659057617, 9.145248413085938, 9.156607627868652, 9.14851188659668, 9.160703659057617, 9.162752151489258, 9.166848182678223, 9.146368026733398, 9.151488304138184, 9.157631874084473, 9.143296241760254, 9.156607627868652, 9.151519775390625, 9.157631874084473, 9.160575866699219, 9.151488304138184, 9.158592224121094], "compile_time": 806.6718600457534, "verification_time": 0, "benchmark_time": 294.9445649283007, "GFLOP/s": 109.89605984860695, "strategy_time": 0.008285976946353912, "framework_time": 1.4527980238199234, "timestamp": "2025-04-07 20:23:50.757658+00:00", "gridpoints/s": 7326403989.90713}, "4096,4096,8,4,9,2,6,10,2,1,2": {"grid_width": 4096, "grid_height": 4096, "block_size_x": 8, "block_size_y": 4, "tile_size_x": 9, "tile_size_y": 2, "temporal_tiling_factor": 6, "max_tfactor": 10, "loop_unroll_factor_t": 2, "sh_power": 1, "blocks_per_sm": 2, "time": 16.60769098997116, "times": [16.66035270690918, 16.62156867980957, 16.608095169067383, 16.611328125, 16.61440086364746, 16.609216690063477, 16.59903907775879, 16.59699249267578, 16.594911575317383, 16.61952018737793, 16.60723114013672, 16.60723114013672, 16.62259292602539, 16.60006332397461, 16.60825538635254, 16.59596824645996, 16.60006332397461, 16.60620880126953, 16.611328125, 16.60620880126953, 16.602975845336914, 16.60927963256836, 16.602048873901367, 16.61747169494629, 16.597951889038086, 16.60927963256836, 16.60108757019043, 16.5980167388916, 16.60006332397461, 16.60620880126953, 16.59903907775879, 16.60211181640625], "compile_time": 810.4264859575778, "verification_time": 0, "benchmark_time": 533.300795010291, "GFLOP/s": 90.91868586137645, "strategy_time": 0.008406001143157482, "framework_time": 1.4633580576628447, "timestamp": "2025-04-07 20:23:52.102886+00:00", "gridpoints/s": 6061245724.0917635}, "4096,4096,2,16,5,10,4,10,2,0,1": {"grid_width": 4096, "grid_height": 4096, "block_size_x": 2, "block_size_y": 16, "tile_size_x": 5, "tile_size_y": 10, "temporal_tiling_factor": 4, "max_tfactor": 10, "loop_unroll_factor_t": 2, "sh_power": 0, "blocks_per_sm": 1, "time": 8.13196513056755, "times": [8.20019245147705, 8.132608413696289, 8.140800476074219, 8.119296073913574, 8.139776229858398, 8.117088317871094, 8.127488136291504, 8.152064323425293, 8.112128257751465, 8.130559921264648, 8.131584167480469, 8.121343612670898, 8.138751983642578, 8.134655952453613, 8.129535675048828, 8.131584167480469, 8.134655952453613, 8.12441635131836, 8.118271827697754, 8.119296073913574, 8.12441635131836, 8.128512382507324, 8.128512382507324, 8.139776229858398, 8.136704444885254, 8.148991584777832, 8.125439643859863, 8.127488136291504, 8.121472358703613, 8.131584167480469, 8.134655952453613, 8.119232177734375], "compile_time": 903.4218799788505, "verification_time": 0, "benchmark_time": 261.56429992988706, "GFLOP/s": 123.78717122336509, "strategy_time": 0.008456059731543064, "framework_time": 1.4128029579296708, "timestamp": "2025-04-07 20:23:53.269325+00:00", "gridpoints/s": 8252478081.557673}, "4096,4096,16,32,1,2,6,10,3,1,3": {"grid_width": 4096, "grid_height": 4096, "block_size_x": 16, "block_size_y": 32, "tile_size_x": 1, "tile_size_y": 2, "temporal_tiling_factor": 6, "max_tfactor": 10, "loop_unroll_factor_t": 3, "sh_power": 1, "blocks_per_sm": 3, "time": 16.520052134990692, "times": [16.56934356689453, 16.524288177490234, 16.519039154052734, 16.520191192626953, 16.52022361755371, 16.517120361328125, 16.51798439025879, 16.520191192626953, 16.519168853759766, 16.519039154052734, 16.518144607543945, 16.522239685058594, 16.520160675048828, 16.517120361328125, 16.516096115112305, 16.516096115112305, 16.516096115112305, 16.517152786254883, 16.518144607543945, 16.517120361328125, 16.520191192626953, 16.521215438842773, 16.519168853759766, 16.518144607543945, 16.517120361328125, 16.518144607543945, 16.519168853759766, 16.515071868896484, 16.517120361328125, 16.518144607543945, 16.517120361328125, 16.516096115112305], "compile_time": 889.6417529322207, "verification_time": 0, "benchmark_time": 529.985512024723, "GFLOP/s": 91.40100937101859, "strategy_time": 0.008616014383733273, "framework_time": 1.5570031246170402, "timestamp": "2025-04-07 20:23:54.690549+00:00", "gridpoints/s": 6093400624.734572}, "4096,4096,4,32,3,1,10,10,1,1,3": {"grid_width": 4096, "grid_height": 4096, "block_size_x": 4, "block_size_y": 32, "tile_size_x": 3, "tile_size_y": 1, "temporal_tiling_factor": 10, "max_tfactor": 10, "loop_unroll_factor_t": 1, "sh_power": 1, "blocks_per_sm": 3, "time": 40.27590095996857, "times": [40.32307052612305, 40.27699279785156, 40.27699279785156, 40.2790412902832, 40.27289581298828, 40.27391815185547, 40.271873474121094, 40.27084732055664, 40.281089782714844, 40.27084732055664, 40.271873474121094, 40.271873474121094, 40.27084732055664, 40.27391815185547, 40.27596664428711, 40.27494430541992, 40.2790412902832, 40.27289581298828, 40.2749137878418, 40.271873474121094, 40.27391815185547, 40.27084732055664, 40.27801513671875, 40.27084732055664, 40.27084732055664, 40.27494430541992, 40.27289581298828, 40.27596664428711, 40.27801513671875, 40.27180862426758, 40.27494430541992, 40.28006362915039], "compile_time": 757.5254009570926, "verification_time": 0, "benchmark_time": 1290.8388699870557, "GFLOP/s": 62.48357802104308, "strategy_time": 0.008034985512495041, "framework_time": 1.37550407089293, "timestamp": "2025-04-07 20:23:56.740327+00:00", "gridpoints/s": 4165571868.069539}, "4096,4096,2,32,3,2,10,10,1,1,1": {"grid_width": 4096, "grid_height": 4096, "block_size_x": 2, "block_size_y": 32, "tile_size_x": 3, "tile_size_y": 2, "temporal_tiling_factor": 10, "max_tfactor": 10, "loop_unroll_factor_t": 1, "sh_power": 1, "blocks_per_sm": 1, "time": 44.06856095790863, "times": [44.102657318115234, 44.07603073120117, 44.067840576171875, 44.065792083740234, 44.0709114074707, 44.0709114074707, 44.065792083740234, 44.07088088989258, 44.054527282714844, 44.05043029785156, 44.0709114074707, 44.069889068603516, 44.07088088989258, 44.06886291503906, 44.065792083740234, 44.073856353759766, 44.063743591308594, 44.075904846191406, 44.069889068603516, 44.07196807861328, 44.06169509887695, 44.069889068603516, 44.06681442260742, 44.0709114074707, 44.058624267578125, 44.063743591308594, 44.064735412597656, 44.067840576171875, 44.067840576171875, 44.06886291503906, 44.06768035888672, 44.067840576171875], "compile_time": 754.6166679821908, "verification_time": 0, "benchmark_time": 1411.731227999553, "GFLOP/s": 57.106071659650354, "strategy_time": 0.008316012099385262, "framework_time": 1.552004017867148, "timestamp": "2025-04-07 20:23:58.908268+00:00", "gridpoints/s": 3807071443.9766903}, "4096,4096,16,4,6,1,7,10,1,1,3": {"grid_width": 4096, "grid_height": 4096, "block_size_x": 16, "block_size_y": 4, "tile_size_x": 6, "tile_size_y": 1, "temporal_tiling_factor": 7, "max_tfactor": 10, "loop_unroll_factor_t": 1, "sh_power": 1, "blocks_per_sm": 3, "time": 28.25825810432434, "times": [28.298240661621094, 28.263423919677734, 28.257280349731445, 28.261375427246094, 28.262399673461914, 28.269567489624023, 28.262399673461914, 28.232704162597656, 28.262399673461914, 28.256128311157227, 28.234752655029297, 28.234752655029297, 28.254207611083984, 28.239871978759766, 28.265472412109375, 28.267520904541016, 28.26531219482422, 28.267520904541016, 28.25529670715332, 28.260351181030273, 28.25721549987793, 28.246015548706055, 28.249088287353516, 28.271615982055664, 28.251136779785156, 28.241920471191406, 28.272640228271484, 28.266496658325195, 28.252159118652344, 28.264448165893555, 28.261215209960938, 28.259328842163086], "compile_time": 764.0145340701565, "verification_time": 0, "benchmark_time": 905.6405420415103, "GFLOP/s": 62.33957073703783, "strategy_time": 0.007905066013336182, "framework_time": 1.4153578085824847, "timestamp": "2025-04-07 20:24:00.579376+00:00", "gridpoints/s": 4155971382.469189}, "4096,4096,8,4,6,1,1,10,1,0,3": {"grid_width": 4096, "grid_height": 4096, "block_size_x": 8, "block_size_y": 4, "tile_size_x": 6, "tile_size_y": 1, "temporal_tiling_factor": 1, "max_tfactor": 10, "loop_unroll_factor_t": 1, "sh_power": 0, "blocks_per_sm": 3, "time": 1.479988019913435, "times": [1.5308799743652344, 1.4858239889144897, 1.4806400537490845, 1.4796799421310425, 1.4786560535430908, 1.4776320457458496, 1.4786560535430908, 1.4796799421310425, 1.4786560535430908, 1.4796799421310425, 1.4784959554672241, 1.4776320457458496, 1.4796799421310425, 1.4776320457458496, 1.4776320457458496, 1.4776320457458496, 1.4776320457458496, 1.4776320457458496, 1.4776320457458496, 1.4776320457458496, 1.4775999784469604, 1.4776320457458496, 1.4776320457458496, 1.4776320457458496, 1.4766080379486084, 1.4786560535430908, 1.4776320457458496, 1.4776320457458496, 1.477471947669983, 1.4776320457458496, 1.4776320457458496, 1.476639986038208], "compile_time": 754.194638109766, "verification_time": 0, "benchmark_time": 48.34895592648536, "GFLOP/s": 170.04072777205286, "strategy_time": 0.008336035534739494, "framework_time": 1.5282699605450034, "timestamp": "2025-04-07 20:24:01.383487+00:00", "gridpoints/s": 11336048518.136858}, "4096,4096,8,16,2,6,7,10,7,1,1": {"grid_width": 4096, "grid_height": 4096, "block_size_x": 8, "block_size_y": 16, "tile_size_x": 2, "tile_size_y": 6, "temporal_tiling_factor": 7, "max_tfactor": 10, "loop_unroll_factor_t": 7, "sh_power": 1, "blocks_per_sm": 1, "time": 22.237819135189056, "times": [25.972736358642578, 25.88262367248535, 25.89081573486328, 25.89174461364746, 25.8734073638916, 24.407039642333984, 21.445632934570312, 21.446624755859375, 21.443584442138672, 21.44767951965332, 21.44870376586914, 21.450719833374023, 21.44972801208496, 21.435392379760742, 21.445632934570312, 21.452800750732422, 21.44256019592285, 21.4466552734375, 21.435392379760742, 21.44870376586914, 21.45075225830078, 21.45587158203125, 21.444608688354492, 21.45996856689453, 21.443584442138672, 21.45792007446289, 21.45382308959961, 21.45689582824707, 21.44972801208496, 21.46099281311035, 21.45075225830078, 21.46713638305664], "compile_time": 1027.0156529732049, "verification_time": 0, "benchmark_time": 713.3581700036302, "GFLOP/s": 79.2167464485057, "strategy_time": 0.008325092494487762, "framework_time": 1.7063039122149348, "timestamp": "2025-04-07 20:24:03.125606+00:00", "gridpoints/s": 5281116429.90038}, "4096,4096,224,1,1,2,4,10,4,0,1": {"grid_width": 4096, "grid_height": 4096, "block_size_x": 224, "block_size_y": 1, "tile_size_x": 1, "tile_size_y": 2, "temporal_tiling_factor": 4, "max_tfactor": 10, "loop_unroll_factor_t": 4, "sh_power": 0, "blocks_per_sm": 1, "time": 16.338707149028778, "times": [16.38092803955078, 16.34102439880371, 16.339967727661133, 16.336896896362305, 16.335872650146484, 16.335872650146484, 16.337919235229492, 16.344064712524414, 16.338943481445312, 16.336896896362305, 16.3450870513916, 16.336896896362305, 16.334848403930664, 16.333824157714844, 16.336896896362305, 16.339967727661133, 16.337919235229492, 16.333824157714844, 16.341983795166016, 16.333663940429688, 16.334720611572266, 16.33465576171875, 16.333887100219727, 16.34422492980957, 16.333824157714844, 16.33568000793457, 16.336896896362305, 16.334848403930664, 16.343040466308594, 16.33296012878418, 16.334815979003906, 16.33577537536621], "compile_time": 713.0602829856798, "verification_time": 0, "benchmark_time": 524.6087600244209, "GFLOP/s": 61.610319030648476, "strategy_time": 0.008114962838590145, "framework_time": 1.5035729156807065, "timestamp": "2025-04-07 20:24:04.364817+00:00", "gridpoints/s": 4107354602.0432315}, "4096,4096,16,8,6,2,7,10,1,1,2": {"grid_width": 4096, "grid_height": 4096, "block_size_x": 16, "block_size_y": 8, "tile_size_x": 6, "tile_size_y": 2, "temporal_tiling_factor": 7, "max_tfactor": 10, "loop_unroll_factor_t": 1, "sh_power": 1, "blocks_per_sm": 2, "time": 15.76945698261261, "times": [15.817728042602539, 15.780863761901855, 15.770624160766602, 15.767552375793457, 15.788031578063965, 15.773695945739746, 15.768575668334961, 15.77676773071289, 15.754240036010742, 15.778752326965332, 15.749024391174316, 15.771648406982422, 15.768575668334961, 15.740927696228027, 15.756287574768066, 15.76966381072998, 15.763487815856934, 15.778719902038574, 15.775744438171387, 15.773695945739746, 15.769599914550781, 15.77353572845459, 15.730688095092773, 15.757311820983887, 15.750144004821777, 15.774720191955566, 15.762432098388672, 15.773695945739746, 15.785920143127441, 15.774720191955566, 15.770527839660645, 15.774720191955566], "compile_time": 775.1910899532959, "verification_time": 0, "benchmark_time": 506.2243170104921, "GFLOP/s": 111.71010402846129, "strategy_time": 0.00754394568502903, "framework_time": 1.3269421178847551, "timestamp": "2025-04-07 20:24:05.647598+00:00", "gridpoints/s": 7447340268.564086}, "4096,4096,160,2,1,6,2,10,2,0,3": {"grid_width": 4096, "grid_height": 4096, "block_size_x": 160, "block_size_y": 2, "tile_size_x": 1, "tile_size_y": 6, "temporal_tiling_factor": 2, "max_tfactor": 10, "loop_unroll_factor_t": 2, "sh_power": 0, "blocks_per_sm": 3, "time": 3.4690129458904266, "times": [3.5194880962371826, 3.47324800491333, 3.4693119525909424, 3.4662399291992188, 3.4682559967041016, 3.468287944793701, 3.4641919136047363, 3.468287944793701, 3.4662399291992188, 3.4662399291992188, 3.4662399291992188, 3.4641919136047363, 3.4692161083221436, 3.4693119525909424, 3.46726393699646, 3.46726393699646, 3.46726393699646, 3.4652159214019775, 3.4672958850860596, 3.4662399291992188, 3.4693119525909424, 3.4662399291992188, 3.4662399291992188, 3.469183921813965, 3.467423915863037, 3.4662399291992188, 3.4652159214019775, 3.468287944793701, 3.46726393699646, 3.469183921813965, 3.468287944793701, 3.4662399291992188], "compile_time": 697.1318550640717, "verification_time": 0, "benchmark_time": 112.17676801607013, "GFLOP/s": 145.0892481091069, "strategy_time": 0.008084927685558796, "framework_time": 1.3154129264876246, "timestamp": "2025-04-07 20:24:06.458258+00:00", "gridpoints/s": 9672616540.607126}, "4096,4096,320,1,1,8,3,10,3,0,0": {"grid_width": 4096, "grid_height": 4096, "block_size_x": 320, "block_size_y": 1, "tile_size_x": 1, "tile_size_y": 8, "temporal_tiling_factor": 3, "max_tfactor": 10, "loop_unroll_factor_t": 3, "sh_power": 0, "blocks_per_sm": 0, "time": 5.750633984804153, "times": [5.797887802124023, 5.754879951477051, 5.750847816467285, 5.750783920288086, 5.750624179840088, 5.750783920288086, 5.7487359046936035, 5.7487359046936035, 5.74889612197876, 5.747712135314941, 5.74886417388916, 5.747712135314941, 5.7487359046936035, 5.7487359046936035, 5.747712135314941, 5.7487359046936035, 5.74783992767334, 5.7487359046936035, 5.7487359046936035, 5.7487359046936035, 5.7487359046936035, 5.7488322257995605, 5.7487359046936035, 5.7487359046936035, 5.749760150909424, 5.7487359046936035, 5.747712135314941, 5.749760150909424, 5.747712135314941, 5.749631881713867, 5.748767852783203, 5.7487359046936035], "compile_time": 708.1436020089313, "verification_time": 0, "benchmark_time": 185.07799005601555, "GFLOP/s": 131.2854760005582, "strategy_time": 0.007984926924109459, "framework_time": 1.6892299754545093, "timestamp": "2025-04-07 20:24:07.353206+00:00", "gridpoints/s": 8752365066.70388}, "4096,4096,4,16,1,1,10,10,2,1,0": {"grid_width": 4096, "grid_height": 4096, "block_size_x": 4, "block_size_y": 16, "tile_size_x": 1, "tile_size_y": 1, "temporal_tiling_factor": 10, "max_tfactor": 10, "loop_unroll_factor_t": 2, "sh_power": 1, "blocks_per_sm": 0, "time": 101.07426524162292, "times": [101.11180877685547, 101.08108520507812, 101.07884979248047, 101.08108520507812, 101.07904052734375, 101.06982421875, 101.07177734375, 101.06774139404297, 101.06982421875, 101.07084655761719, 101.07186889648438, 101.06777954101562, 101.07801818847656, 101.0851821899414, 101.07504272460938, 101.07801818847656, 101.07494354248047, 101.07596588134766, 101.07186889648438, 101.0728988647461, 101.0728988647461, 101.06880187988281, 101.06777954101562, 101.07084655761719, 101.06470489501953, 101.06982421875, 101.07494354248047, 101.06982421875, 101.06777954101562, 101.07084655761719, 101.07596588134766, 101.06880187988281], "compile_time": 778.1761649530381, "verification_time": 0, "benchmark_time": 3235.745409037918, "GFLOP/s": 24.898349683611233, "strategy_time": 0.00794499646872282, "framework_time": 1.3327039778232574, "timestamp": "2025-04-07 20:24:11.368499+00:00", "gridpoints/s": 1659889978.9074156}, "4096,4096,64,1,1,4,4,10,1,0,4": {"grid_width": 4096, "grid_height": 4096, "block_size_x": 64, "block_size_y": 1, "tile_size_x": 1, "tile_size_y": 4, "temporal_tiling_factor": 4, "max_tfactor": 10, "loop_unroll_factor_t": 1, "sh_power": 0, "blocks_per_sm": 4, "time": 13.933180212974548, "times": [13.981696128845215, 13.935615539550781, 13.933568000793457, 13.931488037109375, 13.931551933288574, 13.931551933288574, 13.929471969604492, 13.930496215820312, 13.931520462036133, 13.931520462036133, 13.931520462036133, 13.931520462036133, 13.933504104614258, 13.929471969604492, 13.930496215820312, 13.930496215820312, 13.931520462036133, 13.931520462036133, 13.930496215820312, 13.932543754577637, 13.931520462036133, 13.931520462036133, 13.930496215820312, 13.931520462036133, 13.931520462036133, 13.931424140930176, 13.931520462036133, 13.931520462036133, 13.930496215820312, 13.934592247009277, 13.932543754577637, 13.931520462036133], "compile_time": 812.590675894171, "verification_time": 0, "benchmark_time": 447.77835602872074, "GFLOP/s": 72.24717864932411, "strategy_time": 0.008005066774785519, "framework_time": 1.6353699611499906, "timestamp": "2025-04-07 20:24:12.630542+00:00", "gridpoints/s": 4816478576.621608}, "4096,4096,128,2,1,2,2,10,2,0,2": {"grid_width": 4096, "grid_height": 4096, "block_size_x": 128, "block_size_y": 2, "tile_size_x": 1, "tile_size_y": 2, "temporal_tiling_factor": 2, "max_tfactor": 10, "loop_unroll_factor_t": 2, "sh_power": 0, "blocks_per_sm": 2, "time": 4.172446921467781, "times": [4.221951961517334, 4.176896095275879, 4.171775817871094, 4.172800064086914, 4.171775817871094, 4.172671794891357, 4.171775817871094, 4.170623779296875, 4.170752048492432, 4.170752048492432, 4.171679973602295, 4.170752048492432, 4.170752048492432, 4.169727802276611, 4.172639846801758, 4.171743869781494, 4.169727802276611, 4.170815944671631, 4.169727802276611, 4.170752048492432, 4.168704032897949, 4.168704032897949, 4.169727802276611, 4.169727802276611, 4.170752048492432, 4.169856071472168, 4.171775817871094, 4.169727802276611, 4.169919967651367, 4.169727802276611, 4.170752048492432, 4.168831825256348], "compile_time": 811.4769719541073, "verification_time": 0, "benchmark_time": 135.2813249686733, "GFLOP/s": 120.62861181297988, "strategy_time": 0.00847596675157547, "framework_time": 1.7008210998028517, "timestamp": "2025-04-07 20:24:13.579040+00:00", "gridpoints/s": 8041907454.198659}, "4096,4096,128,2,3,2,4,10,1,0,0": {"grid_width": 4096, "grid_height": 4096, "block_size_x": 128, "block_size_y": 2, "tile_size_x": 3, "tile_size_y": 2, "temporal_tiling_factor": 4, "max_tfactor": 10, "loop_unroll_factor_t": 1, "sh_power": 0, "blocks_per_sm": 0, "time": 13.487438023090363, "times": [13.535103797912598, 13.485119819641113, 13.48300838470459, 13.483936309814453, 13.486016273498535, 13.487104415893555, 13.485055923461914, 13.48799991607666, 13.485055923461914, 13.484031677246094, 13.487104415893555, 13.486080169677734, 13.485055923461914, 13.488127708435059, 13.487104415893555, 13.489151954650879, 13.485055923461914, 13.484992027282715, 13.48300838470459, 13.484031677246094, 13.484031677246094, 13.486080169677734, 13.488127708435059, 13.487039566040039, 13.485055923461914, 13.487104415893555, 13.489151954650879, 13.485983848571777, 13.486080169677734, 13.486080169677734, 13.486080169677734, 13.485055923461914], "compile_time": 826.7805090872571, "verification_time": 0, "benchmark_time": 432.834982057102, "GFLOP/s": 74.63485343003275, "strategy_time": 0.008726026862859726, "framework_time": 1.4064217684790492, "timestamp": "2025-04-07 20:24:14.840100+00:00", "gridpoints/s": 4975656895.335516}, "4096,4096,64,2,1,6,4,10,4,1,3": {"grid_width": 4096, "grid_height": 4096, "block_size_x": 64, "block_size_y": 2, "tile_size_x": 1, "tile_size_y": 6, "temporal_tiling_factor": 4, "max_tfactor": 10, "loop_unroll_factor_t": 4, "sh_power": 1, "blocks_per_sm": 3, "time": 9.769881010055542, "times": [9.822208404541016, 9.772159576416016, 9.770912170410156, 9.768959999084473, 9.768959999084473, 9.766912460327148, 9.768959999084473, 9.768959999084473, 9.767935752868652, 9.765888214111328, 9.766912460327148, 9.766912460327148, 9.767935752868652, 9.767935752868652, 9.766912460327148, 9.768959999084473, 9.767935752868652, 9.767935752868652, 9.767935752868652, 9.768896102905273, 9.767871856689453, 9.768959999084473, 9.767935752868652, 9.768959999084473, 9.768959999084473, 9.767935752868652, 9.767904281616211, 9.765888214111328, 9.768863677978516, 9.766912460327148, 9.767935752868652, 9.767935752868652], "compile_time": 876.0362620232627, "verification_time": 0, "benchmark_time": 314.8556250380352, "GFLOP/s": 103.03431116140862, "strategy_time": 0.00889599323272705, "framework_time": 1.4055019710212946, "timestamp": "2025-04-07 20:24:16.032438+00:00", "gridpoints/s": 6868954077.427242}, "4096,4096,160,1,1,2,6,10,1,1,1": {"grid_width": 4096, "grid_height": 4096, "block_size_x": 160, "block_size_y": 1, "tile_size_x": 1, "tile_size_y": 2, "temporal_tiling_factor": 6, "max_tfactor": 10, "loop_unroll_factor_t": 1, "sh_power": 1, "blocks_per_sm": 1, "time": 42.5554484128952, "times": [42.60044860839844, 42.56140899658203, 42.56051254272461, 42.55846405029297, 42.5615348815918, 42.559486389160156, 42.55436706542969, 42.56256103515625, 42.56972885131836, 42.56563186645508, 42.55744171142578, 42.54822540283203, 42.5533447265625, 42.54604721069336, 42.557376861572266, 42.55129623413086, 42.55027389526367, 42.56051254272461, 42.55129623413086, 42.55539321899414, 42.55641555786133, 42.55129623413086, 42.55027389526367, 42.55027389526367, 42.54924774169922, 42.55436706542969, 42.54105758666992, 42.54412841796875, 42.54515075683594, 42.5533447265625, 42.542144775390625, 42.55129623413086], "compile_time": 689.5422029774636, "verification_time": 0, "benchmark_time": 1363.6872930219397, "GFLOP/s": 35.4819299599356, "strategy_time": 0.008504954166710377, "framework_time": 1.5096961287781596, "timestamp": "2025-04-07 20:24:18.087216+00:00", "gridpoints/s": 2365461997.32904}, "4096,4096,4,8,7,1,2,10,1,0,3": {"grid_width": 4096, "grid_height": 4096, "block_size_x": 4, "block_size_y": 8, "tile_size_x": 7, "tile_size_y": 1, "temporal_tiling_factor": 2, "max_tfactor": 10, "loop_unroll_factor_t": 1, "sh_power": 0, "blocks_per_sm": 3, "time": 5.832635939121246, "times": [5.8818559646606445, 5.8368000984191895, 5.833727836608887, 5.832704067230225, 5.832704067230225, 5.831679821014404, 5.830687999725342, 5.831679821014404, 5.830656051635742, 5.830656051635742, 5.830656051635742, 5.829631805419922, 5.830656051635742, 5.830656051635742, 5.829631805419922, 5.830656051635742, 5.831679821014404, 5.831647872924805, 5.830656051635742, 5.829631805419922, 5.830656051635742, 5.831679821014404, 5.829631805419922, 5.830560207366943, 5.829631805419922, 5.829631805419922, 5.830656051635742, 5.829631805419922, 5.830656051635742, 5.83081579208374, 5.831615924835205, 5.8305277824401855], "compile_time": 830.968467053026, "verification_time": 0, "benchmark_time": 188.63509700167924, "GFLOP/s": 86.29314177216251, "strategy_time": 0.008345930837094784, "framework_time": 1.5718700597062707, "timestamp": "2025-04-07 20:24:19.108432+00:00", "gridpoints/s": 5752876118.144168}, "4096,4096,32,4,2,4,4,10,4,1,4": {"grid_width": 4096, "grid_height": 4096, "block_size_x": 32, "block_size_y": 4, "tile_size_x": 2, "tile_size_y": 4, "temporal_tiling_factor": 4, "max_tfactor": 10, "loop_unroll_factor_t": 4, "sh_power": 1, "blocks_per_sm": 4, "time": 9.2119360268116, "times": [9.268223762512207, 9.21497631072998, 9.21395206451416, 9.211008071899414, 9.209856033325195, 9.209792137145996, 9.209856033325195, 9.209856033325195, 9.209728240966797, 9.208800315856934, 9.209856033325195, 9.207776069641113, 9.208831787109375, 9.21190357208252, 9.210880279541016, 9.208800315856934, 9.208831787109375, 9.207903861999512, 9.210880279541016, 9.208831787109375, 9.209983825683594, 9.210880279541016, 9.209823608398438, 9.208864212036133, 9.210880279541016, 9.208831787109375, 9.210880279541016, 9.207807540893555, 9.208767890930176, 9.210880279541016, 9.210880279541016, 9.21292781829834], "compile_time": 879.1850449051708, "verification_time": 0, "benchmark_time": 296.63840495049953, "GFLOP/s": 109.27485352375074, "strategy_time": 0.007914961315691471, "framework_time": 1.4762921491637826, "timestamp": "2025-04-07 20:24:20.285769+00:00", "gridpoints/s": 7284990234.916716}, "4096,4096,8,4,1,8,3,10,1,1,2": {"grid_width": 4096, "grid_height": 4096, "block_size_x": 8, "block_size_y": 4, "tile_size_x": 1, "tile_size_y": 8, "temporal_tiling_factor": 3, "max_tfactor": 10, "loop_unroll_factor_t": 1, "sh_power": 1, "blocks_per_sm": 2, "time": 7.676373928785324, "times": [7.725183963775635, 7.678976058959961, 7.678976058959961, 7.675903797149658, 7.675903797149658, 7.674880027770996, 7.675903797149658, 7.6748480796813965, 7.674880027770996, 7.674880027770996, 7.675903797149658, 7.674880027770996, 7.674880027770996, 7.674880027770996, 7.674880027770996, 7.673855781555176, 7.674880027770996, 7.673855781555176, 7.673855781555176, 7.672832012176514, 7.672832012176514, 7.673759937286377, 7.674880027770996, 7.67471981048584, 7.673855781555176, 7.674880027770996, 7.67471981048584, 7.673855781555176, 7.673855781555176, 7.673855781555176, 7.674880027770996, 7.672832012176514], "compile_time": 769.9374279472977, "verification_time": 0, "benchmark_time": 247.27360799442977, "GFLOP/s": 98.35043563588674, "strategy_time": 0.008625909686088562, "framework_time": 1.6827081562951207, "timestamp": "2025-04-07 20:24:21.304702+00:00", "gridpoints/s": 6556695709.059115}, "4096,4096,4,8,9,1,4,10,2,1,0": {"grid_width": 4096, "grid_height": 4096, "block_size_x": 4, "block_size_y": 8, "tile_size_x": 9, "tile_size_y": 1, "temporal_tiling_factor": 4, "max_tfactor": 10, "loop_unroll_factor_t": 2, "sh_power": 1, "blocks_per_sm": 0, "time": 10.99202498793602, "times": [11.042816162109375, 10.994688034057617, 10.993632316589355, 10.989567756652832, 10.990592002868652, 10.990592002868652, 10.989567756652832, 10.989567756652832, 10.989567756652832, 10.989567756652832, 10.990592002868652, 10.989567756652832, 10.988544464111328, 10.988544464111328, 10.988544464111328, 10.989567756652832, 10.988544464111328, 10.992639541625977, 10.989567756652832, 10.990528106689453, 10.989567756652832, 10.989567756652832, 10.991616249084473, 10.990528106689453, 10.989631652832031, 10.989407539367676, 10.990592002868652, 10.990592002868652, 10.991616249084473, 10.990592002868652, 10.993696212768555, 10.990592002868652], "compile_time": 797.9019079357386, "verification_time": 0, "benchmark_time": 353.95744699053466, "GFLOP/s": 91.57848177244874, "strategy_time": 0.008146045729517937, "framework_time": 1.6664080321788788, "timestamp": "2025-04-07 20:24:22.458266+00:00", "gridpoints/s": 6105232118.16325}, "4096,4096,32,16,1,2,8,10,1,0,3": {"grid_width": 4096, "grid_height": 4096, "block_size_x": 32, "block_size_y": 16, "tile_size_x": 1, "tile_size_y": 2, "temporal_tiling_factor": 8, "max_tfactor": 10, "loop_unroll_factor_t": 1, "sh_power": 0, "blocks_per_sm": 3, "time": 25.5226508975029, "times": [25.567232131958008, 25.52627182006836, 25.5231990814209, 25.52524757385254, 25.52115249633789, 25.5231990814209, 25.52217674255371, 25.51705551147461, 25.52524757385254, 25.520160675048828, 25.5231990814209, 25.52422332763672, 25.51807975769043, 25.51807975769043, 25.51910400390625, 25.52115249633789, 25.51910400390625, 25.5231990814209, 25.52217674255371, 25.51910400390625, 25.52012825012207, 25.51807975769043, 25.51807975769043, 25.5230712890625, 25.51910400390625, 25.52115249633789, 25.52124786376953, 25.522016525268555, 25.52115249633789, 25.52012825012207, 25.5231990814209, 25.51910400390625], "compile_time": 799.5966400485486, "verification_time": 0, "benchmark_time": 817.9987260373309, "GFLOP/s": 78.88153656472161, "strategy_time": 0.0077339354902505875, "framework_time": 1.587721984833479, "timestamp": "2025-04-07 20:24:24.077488+00:00", "gridpoints/s": 5258769104.3147745}, "4096,4096,8,4,7,3,2,10,1,0,3": {"grid_width": 4096, "grid_height": 4096, "block_size_x": 8, "block_size_y": 4, "tile_size_x": 7, "tile_size_y": 3, "temporal_tiling_factor": 2, "max_tfactor": 10, "loop_unroll_factor_t": 1, "sh_power": 0, "blocks_per_sm": 3, "time": 4.391928985714912, "times": [4.440063953399658, 4.395008087158203, 4.392960071563721, 4.3919358253479, 4.390912055969238, 4.390912055969238, 4.390912055969238, 4.389887809753418, 4.3908162117004395, 4.390912055969238, 4.391808032989502, 4.388864040374756, 4.391871929168701, 4.390912055969238, 4.388991832733154, 4.390912055969238, 4.390912055969238, 4.389887809753418, 4.389023780822754, 4.388864040374756, 4.390912055969238, 4.389887809753418, 4.388864040374756, 4.3887038230896, 4.389887809753418, 4.392960071563721, 4.388864040374756, 4.388864040374756, 4.389887809753418, 4.388800144195557, 4.388864040374756, 4.388864040374756], "compile_time": 838.0607479484752, "verification_time": 0, "benchmark_time": 142.38196203950793, "GFLOP/s": 114.60032291894419, "strategy_time": 0.00746303703635931, "framework_time": 1.4646828640252352, "timestamp": "2025-04-07 20:24:25.059432+00:00", "gridpoints/s": 7640021527.929612}, "4096,4096,4,16,5,5,6,10,3,0,3": {"grid_width": 4096, "grid_height": 4096, "block_size_x": 4, "block_size_y": 16, "tile_size_x": 5, "tile_size_y": 5, "temporal_tiling_factor": 6, "max_tfactor": 10, "loop_unroll_factor_t": 3, "sh_power": 0, "blocks_per_sm": 3, "time": 13.357783883810043, "times": [13.444095611572266, 13.37446403503418, 13.388799667358398, 13.352928161621094, 13.390848159790039, 13.390815734863281, 13.353983879089355, 13.36524772644043, 13.387871742248535, 13.34665584564209, 13.352959632873535, 13.342656135559082, 13.34886360168457, 13.34886360168457, 13.34988784790039, 13.391807556152344, 13.347840309143066, 13.353983879089355, 13.390848159790039, 13.385727882385254, 13.392895698547363, 13.36627197265625, 13.38265609741211, 13.395071983337402, 13.383584022521973, 13.353983879089355, 13.402079582214355, 13.379584312438965, 13.236224174499512, 13.235199928283691, 13.270015716552734, 13.2423677444458], "compile_time": 1020.4158119158819, "verification_time": 0, "benchmark_time": 429.05678204260767, "GFLOP/s": 113.038918216823, "strategy_time": 0.007995055057108402, "framework_time": 1.2715599732473493, "timestamp": "2025-04-07 20:24:26.510213+00:00", "gridpoints/s": 7535927881.121534}, "4096,4096,8,16,3,4,6,10,2,0,0": {"grid_width": 4096, "grid_height": 4096, "block_size_x": 8, "block_size_y": 16, "tile_size_x": 3, "tile_size_y": 4, "temporal_tiling_factor": 6, "max_tfactor": 10, "loop_unroll_factor_t": 2, "sh_power": 0, "blocks_per_sm": 0, "time": 16.61751478910446, "times": [16.670719146728516, 16.624448776245117, 16.61849594116211, 16.61542320251465, 16.61542320251465, 16.61542320251465, 16.61542320251465, 16.61440086364746, 16.61734390258789, 16.61644744873047, 16.61542320251465, 16.615360260009766, 16.61849594116211, 16.61644744873047, 16.61542320251465, 16.61542320251465, 16.614336013793945, 16.61644744873047, 16.61440086364746, 16.61644744873047, 16.61440086364746, 16.61542320251465, 16.616384506225586, 16.61542320251465, 16.61542320251465, 16.61235237121582, 16.61440086364746, 16.615360260009766, 16.615327835083008, 16.61542320251465, 16.61542320251465, 16.61337661743164], "compile_time": 849.2712769657373, "verification_time": 0, "benchmark_time": 533.5164489224553, "GFLOP/s": 90.8649373364796, "strategy_time": 0.008124974556267262, "framework_time": 1.454021199606359, "timestamp": "2025-04-07 20:24:27.894494+00:00", "gridpoints/s": 6057662489.0986395}, "4096,4096,128,2,2,4,2,10,2,0,4": {"grid_width": 4096, "grid_height": 4096, "block_size_x": 128, "block_size_y": 2, "tile_size_x": 2, "tile_size_y": 4, "temporal_tiling_factor": 2, "max_tfactor": 10, "loop_unroll_factor_t": 2, "sh_power": 0, "blocks_per_sm": 4, "time": 3.3542410135269165, "times": [3.405855894088745, 3.357696056365967, 3.3525760173797607, 3.3537280559539795, 3.3547520637512207, 3.3525760173797607, 3.3525760173797607, 3.3515520095825195, 3.3525760173797607, 3.3514881134033203, 3.3515520095825195, 3.3525760173797607, 3.351680040359497, 3.3525760173797607, 3.3525760173797607, 3.353600025177002, 3.3525760173797607, 3.3515520095825195, 3.3525760173797607, 3.353600025177002, 3.3515520095825195, 3.3505280017852783, 3.3535358905792236, 3.352479934692383, 3.3525760173797607, 3.3515520095825195, 3.3535680770874023, 3.3525760173797607, 3.3515520095825195, 3.3515520095825195, 3.3515520095825195, 3.352447986602783], "compile_time": 825.3687981050462, "verification_time": 0, "benchmark_time": 108.64580003544688, "GFLOP/s": 150.0537611847912, "strategy_time": 0.00850600190460682, "framework_time": 1.387686817906797, "timestamp": "2025-04-07 20:24:28.829935+00:00", "gridpoints/s": 10003584078.98608}, "4096,4096,4,8,9,7,6,10,6,0,0": {"grid_width": 4096, "grid_height": 4096, "block_size_x": 4, "block_size_y": 8, "tile_size_x": 9, "tile_size_y": 7, "temporal_tiling_factor": 6, "max_tfactor": 10, "loop_unroll_factor_t": 6, "sh_power": 0, "blocks_per_sm": 0, "time": 12.909686952829361, "times": [12.979040145874023, 12.932095527648926, 12.904447555541992, 12.921855926513672, 12.889087677001953, 12.917759895324707, 12.921855926513672, 12.919808387756348, 12.880000114440918, 12.924927711486816, 12.922880172729492, 12.906432151794434, 12.886015892028809, 12.907520294189453, 12.906496047973633, 12.87065601348877, 12.893183708190918, 12.901375770568848, 12.901375770568848, 12.908512115478516, 12.924927711486816, 12.929023742675781, 12.894207954406738, 12.926976203918457, 12.908543586730957, 12.890111923217773, 12.921695709228516, 12.915712356567383, 12.87987232208252, 12.87987232208252, 12.916735649108887, 12.926976203918457], "compile_time": 1175.841324031353, "verification_time": 0, "benchmark_time": 414.4336470635608, "GFLOP/s": 116.96251392595316, "strategy_time": 0.008606002666056156, "framework_time": 1.4130339259281754, "timestamp": "2025-04-07 20:24:30.421663+00:00", "gridpoints/s": 7797500928.396877}, "4096,4096,288,2,1,6,4,10,4,0,1": {"grid_width": 4096, "grid_height": 4096, "block_size_x": 288, "block_size_y": 2, "tile_size_x": 1, "tile_size_y": 6, "temporal_tiling_factor": 4, "max_tfactor": 10, "loop_unroll_factor_t": 4, "sh_power": 0, "blocks_per_sm": 1, "time": 8.892544001340866, "times": [8.946687698364258, 8.89846420288086, 8.8985595703125, 8.894463539123535, 8.890368461608887, 8.888319969177246, 8.890368461608887, 8.893440246582031, 8.887295722961426, 8.890368461608887, 8.883199691772461, 8.890368461608887, 8.890368461608887, 8.885248184204102, 8.891327857971191, 8.885248184204102, 8.892352104187012, 8.890303611755371, 8.885248184204102, 8.890368461608887, 8.889504432678223, 8.889311790466309, 8.892416000366211, 8.887295722961426, 8.89139175415039, 8.89139175415039, 8.894463539123535, 8.896512031555176, 8.894463539123535, 8.892416000366211, 8.890527725219727, 8.889344215393066], "compile_time": 722.6401190273464, "verification_time": 0, "benchmark_time": 286.40644799452275, "GFLOP/s": 113.19966028261591, "strategy_time": 0.008555944077670574, "framework_time": 1.566362101584673, "timestamp": "2025-04-07 20:24:31.432315+00:00", "gridpoints/s": 7546644018.841061}, "4096,4096,8,8,6,3,8,10,8,0,4": {"grid_width": 4096, "grid_height": 4096, "block_size_x": 8, "block_size_y": 8, "tile_size_x": 6, "tile_size_y": 3, "temporal_tiling_factor": 8, "max_tfactor": 10, "loop_unroll_factor_t": 8, "sh_power": 0, "blocks_per_sm": 4, "time": 21.38706409931183, "times": [21.44153594970703, 21.394432067871094, 21.386240005493164, 21.383167266845703, 21.386240005493164, 21.382144927978516, 21.38719940185547, 21.383167266845703, 21.384191513061523, 21.388256072998047, 21.386240005493164, 21.38630485534668, 21.381120681762695, 21.387264251708984, 21.386240005493164, 21.388288497924805, 21.387264251708984, 21.387264251708984, 21.387264251708984, 21.384191513061523, 21.380096435546875, 21.388288497924805, 21.380096435546875, 21.373952865600586, 21.384191513061523, 21.385215759277344, 21.388288497924805, 21.386240005493164, 21.382047653198242, 21.386240005493164, 21.388160705566406, 21.385215759277344], "compile_time": 1215.9938919357955, "verification_time": 0, "benchmark_time": 686.3400699803606, "GFLOP/s": 94.13474942850061, "strategy_time": 0.008276081643998623, "framework_time": 1.4774339506402612, "timestamp": "2025-04-07 20:24:33.336166+00:00", "gridpoints/s": 6275649961.900041}, "4096,4096,64,1,1,2,8,10,1,1,4": {"grid_width": 4096, "grid_height": 4096, "block_size_x": 64, "block_size_y": 1, "tile_size_x": 1, "tile_size_y": 2, "temporal_tiling_factor": 8, "max_tfactor": 10, "loop_unroll_factor_t": 1, "sh_power": 1, "blocks_per_sm": 4, "time": 73.54168653488159, "times": [73.5907211303711, 73.54061126708984, 73.54061126708984, 73.53446197509766, 73.53855895996094, 73.53651428222656, 73.53753662109375, 73.53638458251953, 73.5447006225586, 73.53855895996094, 73.53958129882812, 73.53958129882812, 73.54265594482422, 73.54061126708984, 73.53958129882812, 73.5436782836914, 73.53958129882812, 73.53958129882812, 73.54573059082031, 73.53852844238281, 73.53958129882812, 73.5447006225586, 73.54163360595703, 73.53759765625, 73.54163360595703, 73.54150390625, 73.53958129882812, 73.53958129882812, 73.54061126708984, 73.54163360595703, 73.53855895996094, 73.53958129882812], "compile_time": 756.6217699786648, "verification_time": 0, "benchmark_time": 2354.713708977215, "GFLOP/s": 27.375846473755896, "strategy_time": 0.009086914360523224, "framework_time": 1.5029520727694035, "timestamp": "2025-04-07 20:24:36.449045+00:00", "gridpoints/s": 1825056431.5837264}, "4096,4096,4,8,8,9,4,10,1,1,0": {"grid_width": 4096, "grid_height": 4096, "block_size_x": 4, "block_size_y": 8, "tile_size_x": 8, "tile_size_y": 9, "temporal_tiling_factor": 4, "max_tfactor": 10, "loop_unroll_factor_t": 1, "sh_power": 1, "blocks_per_sm": 0, "time": 9.729558110237122, "times": [9.776127815246582, 9.73414421081543, 9.732095718383789, 9.721856117248535, 9.73311996459961, 9.729023933410645, 9.729023933410645, 9.731072425842285, 9.7259521484375, 9.721856117248535, 9.731072425842285, 9.731072425842285, 9.730912208557129, 9.731072425842285, 9.732064247131348, 9.730048179626465, 9.722880363464355, 9.730048179626465, 9.730048179626465, 9.72492790222168, 9.73305606842041, 9.72492790222168, 9.7259521484375, 9.714688301086426, 9.729023933410645, 9.72492790222168, 9.7259521484375, 9.7259521484375, 9.72486400604248, 9.729023933410645, 9.72390365600586, 9.73516845703125], "compile_time": 886.7752288933843, "verification_time": 0, "benchmark_time": 313.10221389867365, "GFLOP/s": 103.46132358681879, "strategy_time": 0.007965019904077053, "framework_time": 1.4135241508483887, "timestamp": "2025-04-07 20:24:37.650375+00:00", "gridpoints/s": 6897421572.454586}, "4096,4096,160,4,1,2,4,10,1,0,0": {"grid_width": 4096, "grid_height": 4096, "block_size_x": 160, "block_size_y": 4, "tile_size_x": 1, "tile_size_y": 2, "temporal_tiling_factor": 4, "max_tfactor": 10, "loop_unroll_factor_t": 1, "sh_power": 0, "blocks_per_sm": 0, "time": 10.604637116193771, "times": [10.651647567749023, 10.610688209533691, 10.606592178344727, 10.603520393371582, 10.604543685913086, 10.601632118225098, 10.601471900939941, 10.602496147155762, 10.604415893554688, 10.602496147155762, 10.603520393371582, 10.602463722229004, 10.603520393371582, 10.601471900939941, 10.601471900939941, 10.602496147155762, 10.602368354797363, 10.602496147155762, 10.602496147155762, 10.603520393371582, 10.602496147155762, 10.602496147155762, 10.603520393371582, 10.602496147155762, 10.602496147155762, 10.603520393371582, 10.603487968444824, 10.602496147155762, 10.603584289550781, 10.603520393371582, 10.601471900939941, 10.601471900939941], "compile_time": 703.8735219975933, "verification_time": 0, "benchmark_time": 341.41045704018325, "GFLOP/s": 94.92384783849178, "strategy_time": 0.008244998753070831, "framework_time": 1.676396932452917, "timestamp": "2025-04-07 20:24:38.697374+00:00", "gridpoints/s": 6328256522.566118}, "4096,4096,1,32,5,2,10,10,2,0,0": {"grid_width": 4096, "grid_height": 4096, "block_size_x": 1, "block_size_y": 32, "tile_size_x": 5, "tile_size_y": 2, "temporal_tiling_factor": 10, "max_tfactor": 10, "loop_unroll_factor_t": 2, "sh_power": 0, "blocks_per_sm": 0, "time": 57.31191396713257, "times": [57.36038589477539, 57.321407318115234, 57.30611038208008, 57.33478546142578, 57.30598449707031, 57.30611038208008, 57.30611038208008, 57.31430435180664, 57.29587173461914, 57.31532669067383, 57.33580780029297, 57.29792022705078, 57.312255859375, 57.3040657043457, 57.30303955078125, 57.33769607543945, 57.30704116821289, 57.32233428955078, 57.30303955078125, 57.2927360534668, 57.30201721191406, 57.287681579589844, 57.31532669067383, 57.32044982910156, 57.30508804321289, 57.30303955078125, 57.30918502807617, 57.30611038208008, 57.33065414428711, 57.29280090332031, 57.31430435180664, 57.312255859375], "compile_time": 818.3739789528772, "verification_time": 0, "benchmark_time": 1835.2008550427854, "GFLOP/s": 43.91028367056836, "strategy_time": 0.008526025339961052, "framework_time": 1.3345959596335888, "timestamp": "2025-04-07 20:24:41.352323+00:00", "gridpoints/s": 2927352244.7045574}, "4096,4096,8,8,1,6,8,10,4,1,3": {"grid_width": 4096, "grid_height": 4096, "block_size_x": 8, "block_size_y": 8, "tile_size_x": 1, "tile_size_y": 6, "temporal_tiling_factor": 8, "max_tfactor": 10, "loop_unroll_factor_t": 4, "sh_power": 1, "blocks_per_sm": 3, "time": 29.65927892923355, "times": [29.710336685180664, 29.66521644592285, 29.657087326049805, 29.66217613220215, 29.658111572265625, 29.655040740966797, 29.663232803344727, 29.660032272338867, 29.662208557128906, 29.65590476989746, 29.661184310913086, 29.657087326049805, 29.656063079833984, 29.654016494750977, 29.656063079833984, 29.655040740966797, 29.658111572265625, 29.658111572265625, 29.655040740966797, 29.656063079833984, 29.65488052368164, 29.656063079833984, 29.659135818481445, 29.656063079833984, 29.655040740966797, 29.657087326049805, 29.658111572265625, 29.66009521484375, 29.658111572265625, 29.658111572265625, 29.6561279296875, 29.651968002319336], "compile_time": 905.9950050432235, "verification_time": 0, "benchmark_time": 951.2941539287567, "GFLOP/s": 67.87979993726793, "strategy_time": 0.008334987796843052, "framework_time": 1.618809998035431, "timestamp": "2025-04-07 20:24:43.211270+00:00", "gridpoints/s": 4525319995.817862}, "4096,4096,2,32,2,2,5,10,5,0,0": {"grid_width": 4096, "grid_height": 4096, "block_size_x": 2, "block_size_y": 32, "tile_size_x": 2, "tile_size_y": 2, "temporal_tiling_factor": 5, "max_tfactor": 10, "loop_unroll_factor_t": 5, "sh_power": 0, "blocks_per_sm": 0, "time": 16.929777801036835, "times": [16.982976913452