compare_real_world_impact/results/hotspot/A4000_f=pythonconstraint_i=3.json
{"device_name": "NVIDIA RTX A4000", "kernel_name": "calculate_temp", "problem_size": [4096, 4096], "tune_params_keys": ["grid_width", "grid_height", "block_size_x", "block_size_y", "tile_size_x", "tile_size_y", "temporal_tiling_factor", "max_tfactor", "loop_unroll_factor_t", "sh_power", "blocks_per_sm"], "tune_params": {"grid_width": [4096], "grid_height": [4096], "block_size_x": [1, 2, 4, 8, 16, 32, 64, 96, 128, 160, 192, 224, 256, 288, 320, 352, 384, 416, 448, 480, 512, 544, 576, 608, 640, 672, 704, 736, 768, 800, 832, 864, 896, 928, 960, 992, 1024], "block_size_y": [1, 2, 4, 8, 16, 32], "tile_size_x": [1, 2, 3, 4, 5, 6, 7, 8, 9, 10], "tile_size_y": [1, 2, 3, 4, 5, 6, 7, 8, 9, 10], "temporal_tiling_factor": [1, 2, 3, 4, 5, 6, 7, 8, 9, 10], "max_tfactor": [10], "loop_unroll_factor_t": [1, 2, 3, 4, 5, 6, 7, 8, 9, 10], "sh_power": [0, 1], "blocks_per_sm": [0, 1, 2, 3, 4]}, "objective": "GFLOP/s", "cache": {"4096,4096,32,4,1,6,10,10,10,1,1": {"grid_width": 4096, "grid_height": 4096, "block_size_x": 32, "block_size_y": 4, "tile_size_x": 1, "tile_size_y": 6, "temporal_tiling_factor": 10, "max_tfactor": 10, "loop_unroll_factor_t": 10, "sh_power": 1, "blocks_per_sm": 1, "time": 36.64919924736023, "times": [36.699039459228516, 36.64691162109375, 36.64588928222656, 36.6479377746582, 36.64588928222656, 36.65510559082031, 36.648799896240234, 36.64691162109375, 36.64281463623047, 36.64390563964844, 36.64384078979492, 36.64896011352539, 36.64691162109375, 36.65305709838867, 36.64998245239258, 36.63872146606445, 36.6479377746582, 36.64681625366211, 36.65715026855469, 36.64691162109375, 36.644832611083984, 36.64691162109375, 36.64588928222656, 36.65203094482422, 36.64476776123047, 36.653953552246094, 36.64486312866211, 36.65305709838867, 36.64384078979492, 36.64896011352539, 36.64179229736328, 36.64998245239258], "compile_time": 1164.1021859832108, "verification_time": 0, "benchmark_time": 1173.8323740428314, "GFLOP/s": 68.6667772197305, "strategy_time": 2149.4173769606277, "framework_time": 0, "timestamp": "2025-04-07 23:36:06.911163+00:00", "gridpoints/s": 4577785147.982034}, "4096,4096,192,2,1,1,4,10,2,0,2": {"grid_width": 4096, "grid_height": 4096, "block_size_x": 192, "block_size_y": 2, "tile_size_x": 1, "tile_size_y": 1, "temporal_tiling_factor": 4, "max_tfactor": 10, "loop_unroll_factor_t": 2, "sh_power": 0, "blocks_per_sm": 2, "time": 16.65393817424774, "times": [16.704511642456055, 16.659456253051758, 16.657407760620117, 16.656383514404297, 16.65331268310547, 16.65328025817871, 16.651103973388672, 16.65331268310547, 16.65433692932129, 16.65331268310547, 16.65123176574707, 16.651264190673828, 16.650239944458008, 16.650239944458008, 16.650239944458008, 16.648191452026367, 16.651071548461914, 16.65225601196289, 16.65228843688965, 16.651264190673828, 16.650239944458008, 16.649215698242188, 16.649215698242188, 16.65331268310547, 16.651264190673828, 16.65433692932129, 16.651264190673828, 16.65331268310547, 16.65331268310547, 16.650239944458008, 16.65228843688965, 16.65331268310547], "compile_time": 688.3275540312752, "verification_time": 0, "benchmark_time": 534.2289279215038, "GFLOP/s": 60.444139366181446, "strategy_time": 0.0078550074249506, "framework_time": 1.5676540788263083, "timestamp": "2025-04-07 23:36:08.135327+00:00", "gridpoints/s": 4029609291.078763}, "4096,4096,8,32,4,2,5,10,1,0,3": {"grid_width": 4096, "grid_height": 4096, "block_size_x": 8, "block_size_y": 32, "tile_size_x": 4, "tile_size_y": 2, "temporal_tiling_factor": 5, "max_tfactor": 10, "loop_unroll_factor_t": 1, "sh_power": 0, "blocks_per_sm": 3, "time": 8.988863080739975, "times": [9.038847923278809, 8.994815826416016, 8.988672256469727, 8.986623764038086, 8.988672256469727, 8.985600471496582, 8.988672256469727, 8.983551979064941, 8.987648010253906, 8.984576225280762, 8.987584114074707, 8.987648010253906, 8.986623764038086, 8.98969554901123, 8.984576225280762, 8.987648010253906, 8.983551979064941, 8.992768287658691, 8.985600471496582, 8.986623764038086, 8.987648010253906, 8.987680435180664, 8.988672256469727, 8.99071979522705, 8.985600471496582, 8.984576225280762, 8.986623764038086, 8.983551979064941, 8.987648010253906, 8.985600471496582, 8.987648010253906, 8.987648010253906], "compile_time": 817.2241289867088, "verification_time": 0, "benchmark_time": 289.29596301168203, "GFLOP/s": 139.98335370087935, "strategy_time": 0.008706003427505493, "framework_time": 1.3283570297062397, "timestamp": "2025-04-07 23:36:09.243215+00:00", "gridpoints/s": 9332223580.058622}, "4096,4096,4,32,6,2,3,10,1,0,1": {"grid_width": 4096, "grid_height": 4096, "block_size_x": 4, "block_size_y": 32, "tile_size_x": 6, "tile_size_y": 2, "temporal_tiling_factor": 3, "max_tfactor": 10, "loop_unroll_factor_t": 1, "sh_power": 0, "blocks_per_sm": 1, "time": 5.07844902575016, "times": [5.1374077796936035, 5.089280128479004, 5.074912071228027, 5.086207866668701, 5.084159851074219, 5.071872234344482, 5.071872234344482, 5.083136081695557, 5.072800159454346, 5.073919773101807, 5.0728960037231445, 5.085184097290039, 5.071872234344482, 5.073823928833008, 5.0728960037231445, 5.083136081695557, 5.072768211364746, 5.083136081695557, 5.073919773101807, 5.071807861328125, 5.070847988128662, 5.0728960037231445, 5.083136081695557, 5.084159851074219, 5.072864055633545, 5.0728960037231445, 5.0728960037231445, 5.071872234344482, 5.073919773101807, 5.083136081695557, 5.072864055633545, 5.071872234344482], "compile_time": 827.4571589427069, "verification_time": 0, "benchmark_time": 163.77993300557137, "GFLOP/s": 148.66245898539452, "strategy_time": 0.008636037819087505, "framework_time": 1.5012299409136176, "timestamp": "2025-04-07 23:36:10.235992+00:00", "gridpoints/s": 9910830599.026302}, "4096,4096,2,16,7,6,5,10,1,1,0": {"grid_width": 4096, "grid_height": 4096, "block_size_x": 2, "block_size_y": 16, "tile_size_x": 7, "tile_size_y": 6, "temporal_tiling_factor": 5, "max_tfactor": 10, "loop_unroll_factor_t": 1, "sh_power": 1, "blocks_per_sm": 0, "time": 11.187569916248322, "times": [11.238240242004395, 11.189248085021973, 11.185152053833008, 11.179007530212402, 11.212800025939941, 11.188096046447754, 11.181056022644043, 11.173888206481934, 11.195487976074219, 11.189248085021973, 11.195391654968262, 11.178943634033203, 11.177984237670898, 11.179007530212402, 11.165696144104004, 11.179903984069824, 11.202560424804688, 11.168767929077148, 11.203583717346191, 11.192319869995117, 11.170751571655273, 11.172863960266113, 11.187199592590332, 11.163647651672363, 11.188223838806152, 11.182080268859863, 11.196415901184082, 11.197440147399902, 11.191295623779297, 11.188223838806152, 11.195391654968262, 11.192319869995117], "compile_time": 816.5470629464835, "verification_time": 0, "benchmark_time": 359.354653977789, "GFLOP/s": 112.4722535295636, "strategy_time": 0.008246046490967274, "framework_time": 1.3377220602706075, "timestamp": "2025-04-07 23:36:11.413270+00:00", "gridpoints/s": 7498150235.30424}, "4096,4096,4,8,1,8,8,10,4,1,0": {"grid_width": 4096, "grid_height": 4096, "block_size_x": 4, "block_size_y": 8, "tile_size_x": 1, "tile_size_y": 8, "temporal_tiling_factor": 8, "max_tfactor": 10, "loop_unroll_factor_t": 4, "sh_power": 1, "blocks_per_sm": 0, "time": 44.654513001441956, "times": [44.69862365722656, 44.655616760253906, 44.653472900390625, 44.65254211425781, 44.65049743652344, 44.65049743652344, 44.65459060668945, 44.653568267822266, 44.655487060546875, 44.65340805053711, 44.649505615234375, 44.653568267822266, 44.6484489440918, 44.653438568115234, 44.658687591552734, 44.65971374511719, 44.65971374511719, 44.655616760253906, 44.649471282958984, 44.6484489440918, 44.653568267822266, 44.66175842285156, 44.658687591552734, 44.65254211425781, 44.65254211425781, 44.647422790527344, 44.6484489440918, 44.655616760253906, 44.646400451660156, 44.646400451660156, 44.65459060668945, 44.651519775390625], "compile_time": 909.2412329046056, "verification_time": 0, "benchmark_time": 1430.5611739400774, "GFLOP/s": 45.08538520921701, "strategy_time": 0.008516013622283936, "framework_time": 1.388208125717938, "timestamp": "2025-04-07 23:36:13.754500+00:00", "gridpoints/s": 3005692347.281134}, "4096,4096,32,2,2,8,10,10,10,0,4": {"grid_width": 4096, "grid_height": 4096, "block_size_x": 32, "block_size_y": 2, "tile_size_x": 2, "tile_size_y": 8, "temporal_tiling_factor": 10, "max_tfactor": 10, "loop_unroll_factor_t": 10, "sh_power": 0, "blocks_per_sm": 4, "time": 31.705268919467926, "times": [31.755264282226562, 31.714303970336914, 31.693824768066406, 31.689727783203125, 31.700992584228516, 31.694847106933594, 31.706111907958984, 31.704063415527344, 31.695871353149414, 31.699840545654297, 31.726591110229492, 31.710208892822266, 31.690752029418945, 31.715328216552734, 31.711231231689453, 31.700927734375, 31.698944091796875, 31.703039169311523, 31.694847106933594, 31.689727783203125, 31.710208892822266, 31.71219253540039, 31.704063415527344, 31.705087661743164, 31.707136154174805, 31.719423294067383, 31.695871353149414, 31.700992584228516, 31.715328216552734, 31.696895599365234, 31.69379234313965, 31.71116828918457], "compile_time": 1319.0979120554402, "verification_time": 0, "benchmark_time": 1015.9201920032501, "GFLOP/s": 79.37426446033857, "strategy_time": 0.00883603934198618, "framework_time": 1.4398839557543397, "timestamp": "2025-04-07 23:36:16.090997+00:00", "gridpoints/s": 5291617630.689238}, "4096,4096,16,4,5,5,6,10,6,1,2": {"grid_width": 4096, "grid_height": 4096, "block_size_x": 16, "block_size_y": 4, "tile_size_x": 5, "tile_size_y": 5, "temporal_tiling_factor": 6, "max_tfactor": 10, "loop_unroll_factor_t": 6, "sh_power": 1, "blocks_per_sm": 2, "time": 13.317705005407333, "times": [13.377535820007324, 13.3406400680542, 13.318143844604492, 13.314047813415527, 13.32425594329834, 13.306879997253418, 13.315072059631348, 13.308927536010742, 13.320192337036133, 13.306879997253418, 13.309951782226562, 13.306879997253418, 13.313023567199707, 13.318079948425293, 13.319168090820312, 13.317055702209473, 13.337504386901855, 13.310976028442383, 13.309920310974121, 13.317119598388672, 13.320192337036133, 13.31612777709961, 13.324128150939941, 13.315072059631348, 13.310976028442383, 13.307904243469238, 13.317119598388672, 13.307904243469238, 13.307904243469238, 13.310848236083984, 13.321056365966797, 13.315072059631348], "compile_time": 992.1249540057033, "verification_time": 0, "benchmark_time": 427.36705602146685, "GFLOP/s": 113.3791024344601, "strategy_time": 0.007914961315691471, "framework_time": 1.4676559949293733, "timestamp": "2025-04-07 23:36:17.511996+00:00", "gridpoints/s": 7558606828.964006}, "4096,4096,64,2,2,4,4,10,2,1,0": {"grid_width": 4096, "grid_height": 4096, "block_size_x": 64, "block_size_y": 2, "tile_size_x": 2, "tile_size_y": 4, "temporal_tiling_factor": 4, "max_tfactor": 10, "loop_unroll_factor_t": 2, "sh_power": 1, "blocks_per_sm": 0, "time": 9.22763603925705, "times": [9.279487609863281, 9.2293119430542, 9.234432220458984, 9.2293119430542, 9.226240158081055, 9.227231979370117, 9.23033618927002, 9.226240158081055, 9.224096298217773, 9.226112365722656, 9.228192329406738, 9.224191665649414, 9.2293119430542, 9.23043155670166, 9.224191665649414, 9.22214412689209, 9.22316837310791, 9.22316837310791, 9.227264404296875, 9.227264404296875, 9.22009563446045, 9.224191665649414, 9.224063873291016, 9.22316837310791, 9.227264404296875, 9.2293119430542, 9.22316837310791, 9.22316837310791, 9.224191665649414, 9.224191665649414, 9.225215911865234, 9.224191665649414], "compile_time": 787.3777589993551, "verification_time": 0, "benchmark_time": 297.10327205248177, "GFLOP/s": 109.088931955865, "strategy_time": 0.008406001143157482, "framework_time": 1.3635399518534541, "timestamp": "2025-04-07 23:36:18.597882+00:00", "gridpoints/s": 7272595463.724333}, "4096,4096,2,32,3,5,8,10,2,1,2": {"grid_width": 4096, "grid_height": 4096, "block_size_x": 2, "block_size_y": 32, "tile_size_x": 3, "tile_size_y": 5, "temporal_tiling_factor": 8, "max_tfactor": 10, "loop_unroll_factor_t": 2, "sh_power": 1, "blocks_per_sm": 2, "time": 28.200683891773224, "times": [28.253183364868164, 28.206079483032227, 28.230655670166016, 28.208127975463867, 28.234752655029297, 28.253280639648438, 28.212223052978516, 28.224512100219727, 28.198911666870117, 28.207008361816406, 28.182527542114258, 28.180479049682617, 28.181568145751953, 28.225536346435547, 28.208127975463867, 28.14259147644043, 28.23561668395996, 28.17638397216797, 28.11084747314453, 28.175264358520508, 28.20697593688965, 28.11187171936035, 28.242944717407227, 28.198911666870117, 28.214271545410156, 28.192703247070312, 28.206079483032227, 28.230560302734375, 28.25814437866211, 28.206079483032227, 28.131328582763672, 28.174335479736328], "compile_time": 790.1089889928699, "verification_time": 0, "benchmark_time": 903.9017310133204, "GFLOP/s": 71.39067718096422, "strategy_time": 0.00856595579534769, "framework_time": 1.346088945865631, "timestamp": "2025-04-07 23:36:20.293277+00:00", "gridpoints/s": 4759378478.7309475}, "4096,4096,224,2,2,1,5,10,1,0,1": {"grid_width": 4096, "grid_height": 4096, "block_size_x": 224, "block_size_y": 2, "tile_size_x": 2, "tile_size_y": 1, "temporal_tiling_factor": 5, "max_tfactor": 10, "loop_unroll_factor_t": 1, "sh_power": 0, "blocks_per_sm": 1, "time": 24.516925156116486, "times": [24.560640335083008, 24.51865577697754, 24.5166072845459, 24.51456069946289, 24.516576766967773, 24.51456069946289, 24.51456069946289, 24.51148796081543, 24.51353645324707, 24.5166072845459, 24.51456069946289, 24.5166072845459, 24.51763153076172, 24.51353645324707, 24.51456069946289, 24.51558494567871, 24.5166072845459, 24.5166072845459, 24.515424728393555, 24.51568031311035, 24.51353645324707, 24.51558494567871, 24.5166072845459, 24.5166072845459, 24.5166072845459, 24.51558494567871, 24.5166072845459, 24.51456069946289, 24.51558494567871, 24.51456069946289, 24.51456069946289, 24.5166072845459], "compile_time": 699.7844540746883, "verification_time": 0, "benchmark_time": 785.9640419483185, "GFLOP/s": 51.323369141422745, "strategy_time": 0.008424976840615273, "framework_time": 1.5346830477938056, "timestamp": "2025-04-07 23:36:21.780599+00:00", "gridpoints/s": 3421557942.761516}, "4096,4096,224,1,2,2,3,10,3,0,0": {"grid_width": 4096, "grid_height": 4096, "block_size_x": 224, "block_size_y": 1, "tile_size_x": 2, "tile_size_y": 2, "temporal_tiling_factor": 3, "max_tfactor": 10, "loop_unroll_factor_t": 3, "sh_power": 0, "blocks_per_sm": 0, "time": 9.721839934587479, "times": [9.771936416625977, 9.722880363464355, 9.721856117248535, 9.720831871032715, 9.719807624816895, 9.721856117248535, 9.720831871032715, 9.719807624816895, 9.71878433227539, 9.720831871032715, 9.720895767211914, 9.719807624816895, 9.720831871032715, 9.720831871032715, 9.720831871032715, 9.720831871032715, 9.721856117248535, 9.720671653747559, 9.720671653747559, 9.71878433227539, 9.719807624816895, 9.71878433227539, 9.721695899963379, 9.719807624816895, 9.71776008605957, 9.719807624816895, 9.719807624816895, 9.71878433227539, 9.719807624816895, 9.71878433227539, 9.71878433227539, 9.719807624816895], "compile_time": 693.813189980574, "verification_time": 0, "benchmark_time": 313.04630695376545, "GFLOP/s": 77.65759620398805, "strategy_time": 0.00827503390610218, "framework_time": 1.3309300411492586, "timestamp": "2025-04-07 23:36:22.788828+00:00", "gridpoints/s": 5177173080.26587}, "4096,4096,224,1,1,4,9,10,9,0,1": {"grid_width": 4096, "grid_height": 4096, "block_size_x": 224, "block_size_y": 1, "tile_size_x": 1, "tile_size_y": 4, "temporal_tiling_factor": 9, "max_tfactor": 10, "loop_unroll_factor_t": 9, "sh_power": 0, "blocks_per_sm": 1, "time": 46.0401269197464, "times": [46.085121154785156, 46.03596878051758, 46.03596878051758, 46.0318717956543, 46.044158935546875, 46.02880096435547, 46.032798767089844, 46.027774810791016, 46.029823303222656, 46.03395080566406, 46.03392028808594, 46.029823303222656, 46.044063568115234, 46.032894134521484, 46.046207427978516, 46.05235290527344, 46.039039611816406, 46.04006576538086, 46.028865814208984, 46.0503044128418, 46.04006576538086, 46.039039611816406, 46.029823303222656, 46.04422378540039, 46.036991119384766, 46.039039611816406, 46.042110443115234, 46.03392028808594, 46.04313659667969, 46.04518508911133, 46.055423736572266, 46.051326751708984], "compile_time": 766.3465330842882, "verification_time": 0, "benchmark_time": 1474.595225066878, "GFLOP/s": 49.19456811984992, "strategy_time": 0.008034985512495041, "framework_time": 1.3539728242903948, "timestamp": "2025-04-07 23:36:25.031162+00:00", "gridpoints/s": 3279637874.6566615}, "4096,4096,32,1,7,10,6,10,1,0,1": {"grid_width": 4096, "grid_height": 4096, "block_size_x": 32, "block_size_y": 1, "tile_size_x": 7, "tile_size_y": 10, "temporal_tiling_factor": 6, "max_tfactor": 10, "loop_unroll_factor_t": 1, "sh_power": 0, "blocks_per_sm": 1, "time": 26.901292979717255, "times": [26.967071533203125, 26.902528762817383, 26.902528762817383, 26.899456024169922, 26.88921546936035, 26.918912887573242, 26.90457534790039, 26.875904083251953, 26.920896530151367, 26.893312454223633, 26.9117431640625, 26.884096145629883, 26.892160415649414, 26.92095947265625, 26.90559959411621, 26.90336036682129, 26.92505645751953, 26.901504516601562, 26.8984317779541, 26.875904083251953, 26.89833641052246, 26.92505645751953, 26.881023406982422, 26.90355110168457, 26.881023406982422, 26.90764808654785, 26.876928329467773, 26.90140724182129, 26.93120002746582, 26.868736267089844, 26.885055541992188, 26.88819122314453], "compile_time": 931.1702479608357, "verification_time": 0, "benchmark_time": 862.4594890279695, "GFLOP/s": 56.12925152476705, "strategy_time": 0.008566072210669518, "framework_time": 1.4408568385988474, "timestamp": "2025-04-07 23:36:26.826275+00:00", "gridpoints/s": 3741950101.651137}, "4096,4096,16,2,7,1,7,10,7,0,4": {"grid_width": 4096, "grid_height": 4096, "block_size_x": 16, "block_size_y": 2, "tile_size_x": 7, "tile_size_y": 1, "temporal_tiling_factor": 7, "max_tfactor": 10, "loop_unroll_factor_t": 7, "sh_power": 0, "blocks_per_sm": 4, "time": 60.712692618370056, "times": [60.76515197753906, 60.713985443115234, 60.71603012084961, 60.71500778198242, 60.71187210083008, 60.70783996582031, 60.711936950683594, 60.70783996582031, 60.71100616455078, 60.70579147338867, 60.7088623046875, 60.71388626098633, 60.70783996582031, 60.70988845825195, 60.706817626953125, 60.7088623046875, 60.70988845825195, 60.70870590209961, 60.70988845825195, 60.711936950683594, 60.713951110839844, 60.70988845825195, 60.71295928955078, 60.71295928955078, 60.71295928955078, 60.705726623535156, 60.71091079711914, 60.71603012084961, 60.7088623046875, 60.71500778198242, 60.71295928955078, 60.71091079711914], "compile_time": 1127.7884820010513, "verification_time": 0, "benchmark_time": 1944.9239569948986, "GFLOP/s": 29.015476073070495, "strategy_time": 0.00860588625073433, "framework_time": 1.4732570853084326, "timestamp": "2025-04-07 23:36:29.900501+00:00", "gridpoints/s": 1934365071.538033}, "4096,4096,320,2,3,1,2,10,2,0,1": {"grid_width": 4096, "grid_height": 4096, "block_size_x": 320, "block_size_y": 2, "tile_size_x": 3, "tile_size_y": 1, "temporal_tiling_factor": 2, "max_tfactor": 10, "loop_unroll_factor_t": 2, "sh_power": 0, "blocks_per_sm": 1, "time": 5.727085039019585, "times": [5.774335861206055, 5.730303764343262, 5.725183963775635, 5.727136135101318, 5.727104187011719, 5.7282562255859375, 5.72211217880249, 5.725183963775635, 5.724160194396973, 5.724095821380615, 5.72211217880249, 5.725183963775635, 5.725183963775635, 5.725183963775635, 5.726208209991455, 5.725183963775635, 5.724160194396973, 5.725183963775635, 5.724160194396973, 5.728096008300781, 5.726047992706299, 5.721248149871826, 5.724127769470215, 5.725183963775635, 5.727231979370117, 5.727200031280518, 5.724160194396973, 5.725088119506836, 5.726208209991455, 5.727231979370117, 5.727231979370117, 5.727231979370117], "compile_time": 686.1465530237183, "verification_time": 0, "benchmark_time": 185.08677498903126, "GFLOP/s": 87.88353526633898, "strategy_time": 0.009287032298743725, "framework_time": 1.433432917110622, "timestamp": "2025-04-07 23:36:30.773208+00:00", "gridpoints/s": 5858902351.089265}, "4096,4096,32,2,5,1,3,10,3,1,4": {"grid_width": 4096, "grid_height": 4096, "block_size_x": 32, "block_size_y": 2, "tile_size_x": 5, "tile_size_y": 1, "temporal_tiling_factor": 3, "max_tfactor": 10, "loop_unroll_factor_t": 3, "sh_power": 1, "blocks_per_sm": 4, "time": 9.889616042375565, "times": [9.943039894104004, 9.891839981079102, 9.89583969116211, 9.888768196105957, 9.888768196105957, 9.889792442321777, 9.885696411132812, 9.885727882385254, 9.887743949890137, 9.887743949890137, 9.886655807495117, 9.884672164916992, 9.886719703674316, 9.888768196105957, 9.885696411132812, 9.889792442321777, 9.88764762878418, 9.884672164916992, 9.887743949890137, 9.889792442321777, 9.889792442321777, 9.887743949890137, 9.890815734863281, 9.885696411132812, 9.888575553894043, 9.885696411132812, 9.886719703674316, 9.88764762878418, 9.887743949890137, 9.889792442321777, 9.886719703674316, 9.883647918701172], "compile_time": 815.7500809757039, "verification_time": 0, "benchmark_time": 318.433076958172, "GFLOP/s": 76.34014473009297, "strategy_time": 0.009197043254971504, "framework_time": 1.285745995119214, "timestamp": "2025-04-07 23:36:31.908716+00:00", "gridpoints/s": 5089342982.006198}, "4096,4096,16,8,4,4,3,10,3,1,3": {"grid_width": 4096, "grid_height": 4096, "block_size_x": 16, "block_size_y": 8, "tile_size_x": 4, "tile_size_y": 4, "temporal_tiling_factor": 3, "max_tfactor": 10, "loop_unroll_factor_t": 3, "sh_power": 1, "blocks_per_sm": 3, "time": 5.205586940050125, "times": [5.257215976715088, 5.20908784866333, 5.204991817474365, 5.2060160636901855, 5.208064079284668, 5.206048011779785, 5.201920032501221, 5.204991817474365, 5.203872203826904, 5.203872203826904, 5.204927921295166, 5.202943801879883, 5.202943801879883, 5.203968048095703, 5.203968048095703, 5.2038397789001465, 5.199872016906738, 5.202943801879883, 5.203968048095703, 5.201920032501221, 5.202943801879883, 5.202943801879883, 5.201920032501221, 5.201920032501221, 5.203968048095703, 5.204991817474365, 5.203968048095703, 5.202943801879883, 5.202943801879883, 5.204927921295166, 5.202943801879883, 5.204991817474365], "compile_time": 829.4213149929419, "verification_time": 0, "benchmark_time": 167.49377304222435, "GFLOP/s": 145.03162250378824, "strategy_time": 0.008817063644528389, "framework_time": 1.43080682028085, "timestamp": "2025-04-07 23:36:32.907101+00:00", "gridpoints/s": 9668774833.585882}, "4096,4096,8,16,8,1,9,10,9,0,0": {"grid_width": 4096, "grid_height": 4096, "block_size_x": 8, "block_size_y": 16, "tile_size_x": 8, "tile_size_y": 1, "temporal_tiling_factor": 9, "max_tfactor": 10, "loop_unroll_factor_t": 9, "sh_power": 0, "blocks_per_sm": 0, "time": 23.025680005550385, "times": [23.05945587158203, 23.030784606933594, 22.999040603637695, 23.026687622070312, 23.027711868286133, 23.003135681152344, 23.0020809173584, 22.995967864990234, 23.026752471923828, 23.028736114501953, 23.028736114501953, 23.027711868286133, 23.030847549438477, 23.02956771850586, 23.027616500854492, 23.027711868286133, 23.03068733215332, 23.028736114501953, 23.030624389648438, 23.025663375854492, 23.027679443359375, 23.028736114501953, 23.027711868286133, 23.030784606933594, 23.02774429321289, 23.025663375854492, 23.03379249572754, 23.029760360717773, 23.025663375854492, 23.023616790771484, 23.025663375854492, 23.026687622070312], "compile_time": 1254.075884935446, "verification_time": 0, "benchmark_time": 737.9624160239473, "GFLOP/s": 98.36513664109098, "strategy_time": 0.008556060492992401, "framework_time": 1.3694228837266564, "timestamp": "2025-04-07 23:36:34.900549+00:00", "gridpoints/s": 6557675776.072733}, "4096,4096,1,32,2,1,6,10,2,1,2": {"grid_width": 4096, "grid_height": 4096, "block_size_x": 1, "block_size_y": 32, "tile_size_x": 2, "tile_size_y": 1, "temporal_tiling_factor": 6, "max_tfactor": 10, "loop_unroll_factor_t": 2, "sh_power": 1, "blocks_per_sm": 2, "time": 56.82101094722748, "times": [56.866817474365234, 56.826881408691406, 56.81254577636719, 56.822784423828125, 56.8175048828125, 56.813568115234375, 56.81459045410156, 56.822784423828125, 56.820735931396484, 56.818687438964844, 56.8166389465332, 56.817630767822266, 56.815616607666016, 56.815616607666016, 56.81964874267578, 56.818687438964844, 56.817665100097656, 56.820735931396484, 56.81459045410156, 56.818687438964844, 56.8166389465332, 56.82175827026367, 56.82380676269531, 56.822784423828125, 56.826847076416016, 56.82377624511719, 56.822784423828125, 56.822784423828125, 56.820735931396484, 56.820735931396484, 56.81955337524414, 56.817726135253906], "compile_time": 761.1047138925642, "verification_time": 0, "benchmark_time": 1819.8301369557157, "GFLOP/s": 26.57378696416306, "strategy_time": 0.008175964467227459, "framework_time": 1.3584811240434647, "timestamp": "2025-04-07 23:36:37.482883+00:00", "gridpoints/s": 1771585797.6108706}, "4096,4096,8,32,5,1,5,10,1,1,1": {"grid_width": 4096, "grid_height": 4096, "block_size_x": 8, "block_size_y": 32, "tile_size_x": 5, "tile_size_y": 1, "temporal_tiling_factor": 5, "max_tfactor": 10, "loop_unroll_factor_t": 1, "sh_power": 1, "blocks_per_sm": 1, "time": 9.355508029460907, "times": [9.407487869262695, 9.359359741210938, 9.355263710021973, 9.354240417480469, 9.352191925048828, 9.353216171264648, 9.355104446411133, 9.356287956237793, 9.358336448669434, 9.353216171264648, 9.352191925048828, 9.353216171264648, 9.353216171264648, 9.354240417480469, 9.355263710021973, 9.35200023651123, 9.352191925048828, 9.355263710021973, 9.350144386291504, 9.355263710021973, 9.355263710021973, 9.355263710021973, 9.355263710021973, 9.353216171264648, 9.355263710021973, 9.353376388549805, 9.352191925048828, 9.35200023651123, 9.354240417480469, 9.350144386291504, 9.351167678833008, 9.351167678833008], "compile_time": 756.4658420160413, "verification_time": 0, "benchmark_time": 300.65619095694274, "GFLOP/s": 134.4973673303027, "strategy_time": 0.008867005817592144, "framework_time": 1.335768960416317, "timestamp": "2025-04-07 23:36:38.541380+00:00", "gridpoints/s": 8966491155.353512}, "4096,4096,2,16,2,1,6,10,6,0,0": {"grid_width": 4096, "grid_height": 4096, "block_size_x": 2, "block_size_y": 16, "tile_size_x": 2, "tile_size_y": 1, "temporal_tiling_factor": 6, "max_tfactor": 10, "loop_unroll_factor_t": 6, "sh_power": 0, "blocks_per_sm": 0, "time": 36.18224513530731, "times": [36.24652862548828, 36.18918228149414, 36.183040618896484, 36.1789436340332, 36.180992126464844, 36.179969787597656, 36.18492889404297, 36.18191909790039, 36.18297576904297, 36.18201446533203, 36.1789436340332, 36.17881774902344, 36.180992126464844, 36.17987060546875, 36.1789436340332, 36.179969787597656, 36.183040618896484, 36.179969787597656, 36.180992126464844, 36.18201446533203, 36.179969787597656, 36.177921295166016, 36.179969787597656, 36.1789436340332, 36.17484664916992, 36.17689514160156, 36.179935455322266, 36.17689514160156, 36.1789436340332, 36.1767692565918, 36.17689514160156, 36.1798095703125], "compile_time": 1034.1010639676824, "verification_time": 0, "benchmark_time": 1159.3210099963471, "GFLOP/s": 41.731778510520435, "strategy_time": 0.00889599323272705, "framework_time": 1.8174811266362667, "timestamp": "2025-04-07 23:36:40.736664+00:00", "gridpoints/s": 2782118567.3680286}, "4096,4096,4,8,1,9,10,10,1,0,1": {"grid_width": 4096, "grid_height": 4096, "block_size_x": 4, "block_size_y": 8, "tile_size_x": 1, "tile_size_y": 9, "temporal_tiling_factor": 10, "max_tfactor": 10, "loop_unroll_factor_t": 1, "sh_power": 0, "blocks_per_sm": 1, "time": 63.51070809364319, "times": [63.58323287963867, 63.53811264038086, 63.494144439697266, 63.505409240722656, 63.49824142456055, 63.494144439697266, 63.497215270996094, 63.492095947265625, 63.53196716308594, 63.501312255859375, 63.51155090332031, 63.51155090332031, 63.52588653564453, 63.524864196777344, 63.494110107421875, 63.4890251159668, 63.50019073486328, 63.4890251159668, 63.501312255859375, 63.4890251159668, 63.524864196777344, 63.49728012084961, 63.50950241088867, 63.497215270996094, 63.52998352050781, 63.523841857910156, 63.503360748291016, 63.49292755126953, 63.52076721191406, 63.517696380615234, 63.521793365478516, 63.531009674072266], "compile_time": 814.1708459006622, "verification_time": 0, "benchmark_time": 2034.043898107484, "GFLOP/s": 39.62453695665669, "strategy_time": 0.0091170659288764, "framework_time": 1.3544739922508597, "timestamp": "2025-04-07 23:36:43.586274+00:00", "gridpoints/s": 2641635797.110446}, "4096,4096,192,2,1,4,10,10,2,0,0": {"grid_width": 4096, "grid_height": 4096, "block_size_x": 192, "block_size_y": 2, "tile_size_x": 1, "tile_size_y": 4, "temporal_tiling_factor": 10, "max_tfactor": 10, "loop_unroll_factor_t": 2, "sh_power": 0, "blocks_per_sm": 0, "time": 38.26681625843048, "times": [38.32115173339844, 38.27199935913086, 38.26380920410156, 38.26688003540039, 38.26995086669922, 38.262657165527344, 38.26569747924805, 38.26176071166992, 38.26176071166992, 38.2658576965332, 38.26073455810547, 38.26367950439453, 38.26483154296875, 38.262718200683594, 38.26380920410156, 38.26278305053711, 38.26483154296875, 38.26380920410156, 38.26483154296875, 38.26688003540039, 38.26380920410156, 38.26569747924805, 38.263648986816406, 38.266719818115234, 38.26380920410156, 38.26787185668945, 38.26892852783203, 38.27097702026367, 38.26790237426758, 38.262752532958984, 38.26380920410156, 38.26176071166992], "compile_time": 712.4817650765181, "verification_time": 0, "benchmark_time": 1226.1566099477932, "GFLOP/s": 65.76409134756742, "strategy_time": 0.008585979230701923, "framework_time": 1.5433470252901316, "timestamp": "2025-04-07 23:36:45.526496+00:00", "gridpoints/s": 4384272756.504495}, "4096,4096,64,1,3,1,9,10,3,1,2": {"grid_width": 4096, "grid_height": 4096, "block_size_x": 64, "block_size_y": 1, "tile_size_x": 3, "tile_size_y": 1, "temporal_tiling_factor": 9, "max_tfactor": 10, "loop_unroll_factor_t": 3, "sh_power": 1, "blocks_per_sm": 2, "time": 218.70004272460938, "times": [218.756103515625, 218.69874572753906, 218.69363403320312, 218.6895294189453, 218.7018280029297, 218.68441772460938, 218.6894073486328, 218.71206665039062, 218.67213439941406, 218.7018280029297, 218.7008056640625, 218.69766235351562, 218.70166015625, 218.71002197265625, 218.69363403320312, 218.71206665039062, 218.70489501953125, 218.69766235351562, 218.71498107910156, 218.71002197265625, 218.71206665039062, 218.6946258544922, 218.71002197265625, 218.69247436523438, 218.70387268066406, 218.7018280029297, 218.67213439941406, 218.6967010498047, 218.70693969726562, 218.69261169433594, 218.68441772460938, 218.69056701660156], "compile_time": 883.0484970239922, "verification_time": 0, "benchmark_time": 6999.790992005728, "GFLOP/s": 10.356304149661412, "strategy_time": 0.008646049536764622, "framework_time": 1.5138129238039255, "timestamp": "2025-04-07 23:36:53.410890+00:00", "gridpoints/s": 690420276.6440941}, "4096,4096,128,8,1,3,8,10,8,0,1": {"grid_width": 4096, "grid_height": 4096, "block_size_x": 128, "block_size_y": 8, "tile_size_x": 1, "tile_size_y": 3, "temporal_tiling_factor": 8, "max_tfactor": 10, "loop_unroll_factor_t": 8, "sh_power": 0, "blocks_per_sm": 1, "time": 18.36772894859314, "times": [18.42483139038086, 18.373504638671875, 18.369535446166992, 18.364416122436523, 18.368511199951172, 18.365440368652344, 18.370559692382812, 18.366304397583008, 18.366464614868164, 18.362367630004883, 18.361343383789062, 18.36534309387207, 18.364543914794922, 18.366464614868164, 18.360288619995117, 18.370559692382812, 18.365440368652344, 18.364416122436523, 18.364416122436523, 18.365280151367188, 18.369535446166992, 18.365407943725586, 18.360319137573242, 18.364416122436523, 18.364416122436523, 18.368511199951172, 18.366464614868164, 18.365440368652344, 18.365440368652344, 18.361343383789062, 18.373632431030273, 18.362367630004883], "compile_time": 1198.1465939898044, "verification_time": 0, "benchmark_time": 588.745585992001, "GFLOP/s": 109.60886485393198, "strategy_time": 0.008695991709828377, "framework_time": 1.787075074389577, "timestamp": "2025-04-07 23:36:55.199612+00:00", "gridpoints/s": 7307257656.928799}, "4096,4096,2,32,4,10,4,10,1,0,2": {"grid_width": 4096, "grid_height": 4096, "block_size_x": 2, "block_size_y": 32, "tile_size_x": 4, "tile_size_y": 10, "temporal_tiling_factor": 4, "max_tfactor": 10, "loop_unroll_factor_t": 1, "sh_power": 0, "blocks_per_sm": 2, "time": 8.899124950170517, "times": [8.94870376586914, 8.904704093933105, 8.890368461608887, 8.894463539123535, 8.8985595703125, 8.889344215393066, 8.8985595703125, 8.903679847717285, 8.888319969177246, 8.8985595703125, 8.90982437133789, 8.885248184204102, 8.895296096801758, 8.90060806274414, 8.894463539123535, 8.912896156311035, 8.89958381652832, 8.90880012512207, 8.893440246582031, 8.901632308959961, 8.892416000366211, 8.894463539123535, 8.902527809143066, 8.905728340148926, 8.881152153015137, 8.893440246582031, 8.90675163269043, 8.892416000366211, 8.89958381652832, 8.90060806274414, 8.894463539123535, 8.89139175415039], "compile_time": 859.8287060158327, "verification_time": 0, "benchmark_time": 286.4303699461743, "GFLOP/s": 113.11594854960563, "strategy_time": 0.008765957318246365, "framework_time": 1.3614180497825146, "timestamp": "2025-04-07 23:36:56.347272+00:00", "gridpoints/s": 7541063236.640376}, "4096,4096,384,2,2,1,2,10,2,0,2": {"grid_width": 4096, "grid_height": 4096, "block_size_x": 384, "block_size_y": 2, "tile_size_x": 2, "tile_size_y": 1, "temporal_tiling_factor": 2, "max_tfactor": 10, "loop_unroll_factor_t": 2, "sh_power": 0, "blocks_per_sm": 2, "time": 5.0633780509233475, "times": [5.112768173217773, 5.066720008850098, 5.062528133392334, 5.062655925750732, 5.062719821929932, 5.06166410446167, 5.06163215637207, 5.059584140777588, 5.06163215637207, 5.06163215637207, 5.06163215637207, 5.06163215637207, 5.06060791015625, 5.06163215637207, 5.06163215637207, 5.06163215637207, 5.06060791015625, 5.06163215637207, 5.06163215637207, 5.061567783355713, 5.06163215637207, 5.061567783355713, 5.06163215637207, 5.06060791015625, 5.06163215637207, 5.06163215637207, 5.062655925750732, 5.062655925750732, 5.06163215637207, 5.061535835266113, 5.061535835266113, 5.06163215637207], "compile_time": 683.6599600501359, "verification_time": 0, "benchmark_time": 163.73831499367952, "GFLOP/s": 99.40329853667872, "strategy_time": 0.009277020581066608, "framework_time": 1.335318898782134, "timestamp": "2025-04-07 23:36:57.196045+00:00", "gridpoints/s": 6626886569.111915}, "4096,4096,32,1,9,1,2,10,2,0,2": {"grid_width": 4096, "grid_height": 4096, "block_size_x": 32, "block_size_y": 1, "tile_size_x": 9, "tile_size_y": 1, "temporal_tiling_factor": 2, "max_tfactor": 10, "loop_unroll_factor_t": 2, "sh_power": 0, "blocks_per_sm": 2, "time": 6.389957025647163, "times": [6.444032192230225, 6.392735958099365, 6.391808032989502, 6.390783786773682, 6.387743949890137, 6.388735771179199, 6.388735771179199, 6.387712001800537, 6.3897600173950195, 6.387712001800537, 6.387648105621338, 6.387584209442139, 6.385663986206055, 6.388735771179199, 6.3897600173950195, 6.38972806930542, 6.386688232421875, 6.3897600173950195, 6.3876800537109375, 6.385663986206055, 6.386688232421875, 6.387712001800537, 6.387551784515381, 6.386688232421875, 6.386688232421875, 6.390592098236084, 6.3856000900268555, 6.3897600173950195, 6.387712001800537, 6.385663986206055, 6.388607978820801, 6.386688232421875], "compile_time": 814.7892029955983, "verification_time": 0, "benchmark_time": 206.41056797467172, "GFLOP/s": 78.7668020269706, "strategy_time": 0.00782497227191925, "framework_time": 1.432662014849484, "timestamp": "2025-04-07 23:36:58.218717+00:00", "gridpoints/s": 5251120135.131373}, "4096,4096,4,16,5,5,6,10,6,1,2": {"grid_width": 4096, "grid_height": 4096, "block_size_x": 4, "block_size_y": 16, "tile_size_x": 5, "tile_size_y": 5, "temporal_tiling_factor": 6, "max_tfactor": 10, "loop_unroll_factor_t": 6, "sh_power": 1, "blocks_per_sm": 2, "time": 13.95761701464653, "times": [14.016511917114258, 13.96009635925293, 13.963264465332031, 13.962240219116211, 13.96735954284668, 13.963264465332031, 13.96019172668457, 13.935551643371582, 13.96127986907959, 13.965312004089355, 13.96019172668457, 13.962112426757812, 13.935615539550781, 13.957088470458984, 13.962240219116211, 13.95199966430664, 13.930335998535156, 13.9683837890625, 13.963264465332031, 13.956095695495605, 13.96121597290039, 13.96121597290039, 13.957119941711426, 13.959168434143066, 13.936639785766602, 13.964287757873535, 13.932543754577637, 13.962240219116211, 13.936639785766602, 13.958144187927246, 13.957056045532227, 13.955072402954102], "compile_time": 987.1901189908385, "verification_time": 0, "benchmark_time": 448.15635005943477, "GFLOP/s": 108.18103394121813, "strategy_time": 0.008306000381708145, "framework_time": 1.3432619161903858, "timestamp": "2025-04-07 23:36:59.655446+00:00", "gridpoints/s": 7212068929.414542}, "4096,4096,32,4,2,5,9,10,9,0,1": {"grid_width": 4096, "grid_height": 4096, "block_size_x": 32, "block_size_y": 4, "tile_size_x": 2, "tile_size_y": 5, "temporal_tiling_factor": 9, "max_tfactor": 10, "loop_unroll_factor_t": 9, "sh_power": 0, "blocks_per_sm": 1, "time": 25.666681051254272, "times": [25.73004722595215, 25.658367156982422, 25.665536880493164, 25.659391403198242, 25.672704696655273, 25.669631958007812, 25.660383224487305, 25.666528701782227, 25.671680450439453, 25.664480209350586, 25.668607711791992, 25.660480499267578, 25.659488677978516, 25.667583465576172, 25.662303924560547, 25.664447784423828, 25.652223587036133, 25.657344818115234, 25.664512634277344, 25.669631958007812, 25.667583465576172, 25.654272079467773, 25.66655921936035, 25.671680450439453, 25.664512634277344, 25.665536880493164, 25.663423538208008, 25.670656204223633, 25.661439895629883, 25.671680450439453, 25.669631958007812, 25.661439895629883], "compile_time": 1257.6559339649975, "verification_time": 0, "benchmark_time": 823.3118720818311, "GFLOP/s": 88.24374898636606, "strategy_time": 0.01877499744296074, "framework_time": 1.3083189260214567, "timestamp": "2025-04-07 23:37:01.737774+00:00", "gridpoints/s": 5882916599.09107}, "4096,4096,32,2,6,1,9,10,3,0,3": {"grid_width": 4096, "grid_height": 4096, "block_size_x": 32, "block_size_y": 2, "tile_size_x": 6, "tile_size_y": 1, "temporal_tiling_factor": 9, "max_tfactor": 10, "loop_unroll_factor_t": 3, "sh_power": 0, "blocks_per_sm": 3, "time": 76.93607759475708, "times": [76.99251556396484, 76.87474822998047, 76.95257568359375, 76.943359375, 76.90137481689453, 76.943359375, 76.98316955566406, 76.9280014038086, 76.95974731445312, 76.96176147460938, 76.92185974121094, 76.9648666381836, 76.9280014038086, 76.92288208007812, 76.9280014038086, 76.93097686767578, 76.92082977294922, 76.96281433105469, 76.87782287597656, 76.98534393310547, 76.95565032958984, 76.92185974121094, 76.94931030273438, 76.8880615234375, 76.90547180175781, 76.89625549316406, 76.89727783203125, 76.94627380371094, 76.9464340209961, 76.97100830078125, 76.95974731445312, 76.93312072753906], "compile_time": 973.4959630295634, "verification_time": 0, "benchmark_time": 2463.412119075656, "GFLOP/s": 29.439038625415268, "strategy_time": 0.009348033927381039, "framework_time": 1.6074267914518714, "timestamp": "2025-04-07 23:37:05.176331+00:00", "gridpoints/s": 1962602575.0276845}, "4096,4096,8,4,5,8,8,10,8,0,3": {"grid_width": 4096, "grid_height": 4096, "block_size_x": 8, "block_size_y": 4, "tile_size_x": 5, "tile_size_y": 8, "temporal_tiling_factor": 8, "max_tfactor": 10, "loop_unroll_factor_t": 8, "sh_power": 0, "blocks_per_sm": 3, "time": 17.97068703174591, "times": [17.9998722076416, 17.98860740661621, 17.977344512939453, 17.948671340942383, 17.977216720581055, 17.976320266723633, 17.95475196838379, 17.950559616088867, 18.002944946289062, 17.97222328186035, 17.944576263427734, 17.953760147094727, 17.961952209472656, 17.943552017211914, 17.982463836669922, 17.97939109802246, 17.976224899291992, 17.98646354675293, 17.9814395904541, 17.944416046142578, 17.975296020507812, 17.946624755859375, 17.956863403320312, 17.985536575317383, 18.008960723876953, 17.964031219482422, 18.000896453857422, 17.974271774291992, 17.991680145263672, 17.955839157104492, 17.94646453857422, 17.952768325805664], "compile_time": 1244.2066969815642, "verification_time": 0, "benchmark_time": 576.4966339338571, "GFLOP/s": 112.03054821685382, "strategy_time": 0.009116949513554573, "framework_time": 1.3676901580765843, "timestamp": "2025-04-07 23:37:06.998443+00:00", "gridpoints/s": 7468703214.456922}, "4096,4096,2,16,10,4,5,10,1,1,1": {"grid_width": 4096, "grid_height": 4096, "block_size_x": 2, "block_size_y": 16, "tile_size_x": 10, "tile_size_y": 4, "temporal_tiling_factor": 5, "max_tfactor": 10, "loop_unroll_factor_t": 1, "sh_power": 1, "blocks_per_sm": 1, "time": 10.974289983510971, "times": [11.020288467407227, 10.975232124328613, 10.969087600708008, 10.972160339355469, 10.968000411987305, 10.962911605834961, 10.967040061950684, 10.979328155517578, 10.984448432922363, 10.974207878112793, 10.978303909301758, 10.977279663085938, 10.983424186706543, 10.972160339355469, 10.979328155517578, 10.975232124328613, 10.978303909301758, 10.986368179321289, 10.989567756652832, 10.977279663085938, 10.96076774597168, 10.960895538330078, 10.974047660827637, 10.968064308166504, 10.953727722167969, 10.985471725463867, 10.969152450561523, 10.966015815734863, 10.975232124328613, 10.960895538330078, 10.972160339355469, 10.960895538330078], "compile_time": 808.3983240649104, "verification_time": 0, "benchmark_time": 352.3510479135439, "GFLOP/s": 114.65809650470332, "strategy_time": 0.00952801201492548, "framework_time": 1.3646540464833379, "timestamp": "2025-04-07 23:37:08.160600+00:00", "gridpoints/s": 7643873100.313555}, "4096,4096,8,16,7,1,6,10,2,0,4": {"grid_width": 4096, "grid_height": 4096, "block_size_x": 8, "block_size_y": 16, "tile_size_x": 7, "tile_size_y": 1, "temporal_tiling_factor": 6, "max_tfactor": 10, "loop_unroll_factor_t": 2, "sh_power": 0, "blocks_per_sm": 4, "time": 15.692730963230133, "times": [15.745023727416992, 15.69587230682373, 15.69587230682373, 15.69279956817627, 15.691776275634766, 15.689727783203125, 15.691776275634766, 15.68665599822998, 15.688703536987305, 15.690752029418945, 15.689599990844727, 15.6876802444458, 15.68665599822998, 15.691776275634766, 15.690752029418945, 15.689727783203125, 15.690752029418945, 15.688703536987305, 15.690752029418945, 15.6876802444458, 15.688703536987305, 15.690752029418945, 15.69484806060791, 15.691776275634766, 15.688703536987305, 15.69382381439209, 15.69484806060791, 15.690752029418945, 15.696895599365234, 15.692768096923828, 15.691776275634766, 15.688703536987305], "compile_time": 841.6139710461721, "verification_time": 0, "benchmark_time": 503.32024798262864, "GFLOP/s": 96.21967288791126, "strategy_time": 0.009097042493522167, "framework_time": 1.4181539881974459, "timestamp": "2025-04-07 23:37:09.506992+00:00", "gridpoints/s": 6414644859.194083}, "4096,4096,96,2,2,1,6,10,6,0,2": {"grid_width": 4096, "grid_height": 4096, "block_size_x": 96, "block_size_y": 2, "tile_size_x": 2, "tile_size_y": 1, "temporal_tiling_factor": 6, "max_tfactor": 10, "loop_unroll_factor_t": 6, "sh_power": 0, "blocks_per_sm": 2, "time": 34.70088708400726, "times": [34.75660705566406, 34.70755386352539, 34.70336151123047, 34.70336151123047, 34.69916915893555, 34.70131301879883, 34.70127868652344, 34.702335357666016, 34.698238372802734, 34.702335357666016, 34.69926452636719, 34.69619369506836, 34.69615936279297, 34.69721603393555, 34.70131301879883, 34.700286865234375, 34.698238372802734, 34.6960334777832, 34.69721603393555, 34.69724655151367, 34.695167541503906, 34.69619369506836, 34.69721603393555, 34.698238372802734, 34.69721603393555, 34.69926452636719, 34.6992301940918, 34.69926452636719, 34.69625473022461, 34.69619369506836, 34.69926452636719, 34.70016098022461], "compile_time": 732.4218190042302, "verification_time": 0, "benchmark_time": 1111.4267949014902, "GFLOP/s": 43.51328069350412, "strategy_time": 0.009397044777870178, "framework_time": 1.5599880134686828, "timestamp": "2025-04-07 23:37:11.352442+00:00", "gridpoints/s": 2900885379.5669413}, "4096,4096,4,8,1,3,10,10,10,1,2": {"grid_width": 4096, "grid_height": 4096, "block_size_x": 4, "block_size_y": 8, "tile_size_x": 1, "tile_size_y": 3, "temporal_tiling_factor": 10, "max_tfactor": 10, "loop_unroll_factor_t": 10, "sh_power": 1, "blocks_per_sm": 2, "time": 84.94329285621643, "times": [84.98687744140625, 84.94796752929688, 84.9459228515625, 84.9459228515625, 84.94080352783203, 84.93363189697266, 84.94080352783203, 84.92838287353516, 84.93571472167969, 84.93055725097656, 84.93567657470703, 84.9428482055664, 84.94080352783203, 84.94898986816406, 84.9438705444336, 84.9438705444336, 84.9438705444336, 84.93363189697266, 84.94182586669922, 84.93977355957031, 84.93465423583984, 84.93567657470703, 84.94796752929688, 84.94489288330078, 84.94796752929688, 84.95308685302734, 84.9459228515625, 84.93670654296875, 84.94694519042969, 84.94694519042969, 84.94489288330078, 84.94796752929688], "compile_time": 1160.0713040679693, "verification_time": 0, "benchmark_time": 2720.1372910058126, "GFLOP/s": 29.62661695090889, "strategy_time": 0.008465023711323738, "framework_time": 1.3648238964378834, "timestamp": "2025-04-07 23:37:15.234055+00:00", "gridpoints/s": 1975107796.7272594}, "4096,4096,96,8,1,1,3,10,1,1,0": {"grid_width": 4096, "grid_height": 4096, "block_size_x": 96, "block_size_y": 8, "tile_size_x": 1, "tile_size_y": 1, "temporal_tiling_factor": 3, "max_tfactor": 10, "loop_unroll_factor_t": 1, "sh_power": 1, "blocks_per_sm": 0, "time": 8.15879800915718, "times": [8.208224296569824, 8.161279678344727, 8.159232139587402, 8.159232139587402, 8.158207893371582, 8.158207893371582, 8.15817642211914, 8.157183647155762, 8.157183647155762, 8.157183647155762, 8.157183647155762, 8.156160354614258, 8.155967712402344, 8.155136108398438, 8.160160064697266, 8.158207893371582, 8.1560640335083, 8.1561918258667, 8.157183647155762, 8.160256385803223, 8.154111862182617, 8.157183647155762, 8.15715217590332, 8.156160354614258, 8.156160354614258, 8.155136108398438, 8.157183647155762, 8.155136108398438, 8.156160354614258, 8.156160354614258, 8.158207893371582, 8.156160354614258], "compile_time": 681.9040139671415, "verification_time": 0, "benchmark_time": 263.14321300014853, "GFLOP/s": 92.53504243549601, "strategy_time": 0.009046983905136585, "framework_time": 1.5203740913420916, "timestamp": "2025-04-07 23:37:16.180663+00:00", "gridpoints/s": 6169002829.033067}, "4096,4096,416,1,3,1,1,10,1,1,0": {"grid_width": 4096, "grid_height": 4096, "block_size_x": 416, "block_size_y": 1, "tile_size_x": 3, "tile_size_y": 1, "temporal_tiling_factor": 1, "max_tfactor": 10, "loop_unroll_factor_t": 1, "sh_power": 1, "blocks_per_sm": 0, "time": 1.8708099760115147, "times": [1.9118080139160156, 1.8625919818878174, 1.8595839738845825, 1.8585599660873413, 1.8585599660873413, 1.8585599660873413, 1.8595839738845825, 1.8595839738845825, 1.8576960563659668, 1.8585599660873413, 1.859552025794983, 1.8585599660873413, 1.8585599660873413, 1.8575359582901, 1.85862398147583, 1.8585599660873413, 1.8565119504928589, 1.8585599660873413, 1.8575359582901, 1.8565119504928589, 1.8585599660873413, 1.8862080574035645, 1.8892799615859985, 1.8892799615859985, 1.8892799615859985, 1.8903039693832397, 1.8892799615859985, 1.8892799615859985, 1.8892799615859985, 1.8901439905166626, 1.8901439905166626, 1.8892799615859985], "compile_time": 675.1159309642389, "verification_time": 0, "benchmark_time": 61.26154994126409, "GFLOP/s": 134.51833335661615, "strategy_time": 0.008795992471277714, "framework_time": 1.4653020771220326, "timestamp": "2025-04-07 23:37:16.918544+00:00", "gridpoints/s": 8967888890.441076}, "4096,4096,64,16,1,2,3,10,1,1,1": {"grid_width": 4096, "grid_height": 4096, "block_size_x": 64, "block_size_y": 16, "tile_size_x": 1, "tile_size_y": 2, "temporal_tiling_factor": 3, "max_tfactor": 10, "loop_unroll_factor_t": 1, "sh_power": 1, "blocks_per_sm": 1, "time": 6.7153740376234055, "times": [6.775807857513428, 6.715360164642334, 6.668255805969238, 6.727680206298828, 6.711296081542969, 6.71833610534668, 6.714367866516113, 6.715392112731934, 6.716256141662598, 6.719391822814941, 6.717440128326416, 6.724575996398926, 6.719488143920898, 6.713344097137451, 6.709248065948486, 6.716415882110596, 6.711296081542969, 6.713344097137451, 6.707200050354004, 6.713344097137451, 6.715392112731934, 6.711296081542969, 6.721536159515381, 6.7051520347595215, 6.717311859130859, 6.716415882110596, 6.715392112731934, 6.712319850921631, 6.706175804138184, 6.715360164642334, 6.708288192749023, 6.719488143920898], "compile_time": 748.8157770130783, "verification_time": 0, "benchmark_time": 216.86517202761024, "GFLOP/s": 112.42482038531217, "strategy_time": 0.00871601514518261, "framework_time": 1.2817889219149947, "timestamp": "2025-04-07 23:37:17.885546+00:00", "gridpoints/s": 7494988025.687479}, "4096,4096,4,16,4,4,10,10,10,0,0": {"grid_width": 4096, "grid_height": 4096, "block_size_x": 4, "block_size_y": 16, "tile_size_x": 4, "tile_size_y": 4, "temporal_tiling_factor": 10, "max_tfactor": 10, "loop_unroll_factor_t": 10, "sh_power": 0, "blocks_per_sm": 0, "time": 28.641453981399536, "times": [28.679136276245117, 28.633983612060547, 28.60748863220215, 28.609535217285156, 28.714847564697266, 28.59929656982422, 28.718080520629883, 28.601343154907227, 28.614656448364258, 28.637184143066406, 28.626943588256836, 28.710912704467773, 28.596223831176758, 28.624895095825195, 28.609535217285156, 28.606464385986328, 28.604415893554688, 28.602367401123047, 28.631040573120117, 28.603328704833984, 28.634111404418945, 28.606464385986328, 28.718944549560547, 28.60438346862793, 28.606464385986328, 28.716032028198242, 28.716032028198242, 28.637184143066406, 28.707839965820312, 28.611583709716797, 28.7139835357666, 28.621824264526367], "compile_time": 1313.2887510582805, "verification_time": 0, "benchmark_time": 918.4029070893303, "GFLOP/s": 87.86503651785033, "strategy_time": 0.008585979230701923, "framework_time": 1.273662899620831, "timestamp": "2025-04-07 23:37:20.118551+00:00", "gridpoints/s": 5857669101.1900215}, "4096,4096,16,4,2,9,6,10,3,0,2": {"grid_width": 4096, "grid_height": 4096, "block_size_x": 16, "block_size_y": 4, "tile_size_x": 2, "tile_size_y": 9, "temporal_tiling_factor": 6, "max_tfactor": 10, "loop_unroll_factor_t": 3, "sh_power": 0, "blocks_per_sm": 2, "time": 13.549148976802826, "times": [13.598719596862793, 13.548543930053711, 13.545472145080566, 13.558783531188965, 13.54751968383789, 13.54751968383789, 13.530112266540527, 13.554688453674316, 13.546496391296387, 13.54751968383789, 13.56492805480957, 13.541376113891602, 13.545280456542969, 13.54751968383789, 13.535231590270996, 13.544447898864746, 13.544447898864746, 13.541376113891602, 13.54751968383789, 13.561856269836426, 13.561856269836426, 13.545472145080566, 13.55571174621582, 13.543423652648926, 13.552672386169434, 13.542400360107422, 13.54751968383789, 13.54751968383789, 13.544447898864746, 13.544447898864746, 13.545536041259766, 13.542400360107422], "compile_time": 1000.5184209439903, "verification_time": 0, "benchmark_time": 435.5166769819334, "GFLOP/s": 111.44238229169584, "strategy_time": 0.008817063644528389, "framework_time": 1.4230119995772839, "timestamp": "2025-04-07 23:37:21.556050+00:00", "gridpoints/s": 7429492152.779722}, "4096,4096,320,1,1,1,5,10,5,0,0": {"grid_width": 4096, "grid_height": 4096, "block_size_x": 320, "block_size_y": 1, "tile_size_x": 1, "tile_size_y": 1, "temporal_tiling_factor": 5, "max_tfactor": 10, "loop_unroll_factor_t": 5, "sh_power": 0, "blocks_per_sm": 0, "time": 38.82526767253876, "times": [38.876129150390625, 38.83212661743164, 38.82067108154297, 38.82495880126953, 38.82700729370117, 38.81983947753906, 38.820865631103516, 38.8218879699707, 38.818817138671875, 38.828033447265625, 38.820865631103516, 38.82495880126953, 38.823936462402344, 38.825984954833984, 38.82495880126953, 38.823936462402344, 38.82495880126953, 38.82495880126953, 38.81983947753906, 38.82291030883789, 38.82495880126953, 38.82291030883789, 38.82291030883789, 38.830047607421875, 38.820865631103516, 38.823936462402344, 38.823936462402344, 38.82291030883789, 38.81779098510742, 38.822784423828125, 38.82495880126953, 38.82291030883789], "compile_time": 714.7699459455907, "verification_time": 0, "benchmark_time": 1244.5364139275625, "GFLOP/s": 32.40907984492773, "strategy_time": 0.0083559425547719, "framework_time": 1.4844972174614668, "timestamp": "2025-04-07 23:37:23.516880+00:00", "gridpoints/s": 2160605322.995182}, "4096,4096,32,1,6,7,2,10,2,0,4": {"grid_width": 4096, "grid_height": 4096, "block_size_x": 32, "block_size_y": 1, "tile_size_x": 6, "tile_size_y": 7, "temporal_tiling_factor": 2, "max_tfactor": 10, "loop_unroll_factor_t": 2, "sh_power": 0, "blocks_per_sm": 4, "time": 3.799042046070099, "times": [3.8543360233306885, 3.8051838874816895, 3.803136110305786, 3.8041601181030273, 3.7990400791168213, 3.800031900405884, 3.792992115020752, 3.792896032333374, 3.7991039752960205, 3.7959680557250977, 3.8000640869140625, 3.7959680557250977, 3.797152042388916, 3.796992063522339, 3.79801607131958, 3.790719985961914, 3.8000640869140625, 3.7990400791168213, 3.7990400791168213, 3.7959680557250977, 3.7939200401306152, 3.796895980834961, 3.7949440479278564, 3.7949440479278564, 3.796992063522339, 3.7949440479278564, 3.791872024536133, 3.79801607131958, 3.8000640869140625, 3.79801607131958, 3.7959680557250977, 3.792896032333374], "compile_time": 872.3392869578674, "verification_time": 0, "benchmark_time": 122.88812210317701, "GFLOP/s": 132.4851038489172, "strategy_time": 0.009226961992681026, "framework_time": 1.4580589486286044, "timestamp": "2025-04-07 23:37:24.513606+00:00", "gridpoints/s": 8832340256.594479}, "4096,4096,2,16,1,2,7,10,1,1,1": {"grid_width": 4096, "grid_height": 4096, "block_size_x": 2, "block_size_y": 16, "tile_size_x": 1, "tile_size_y": 2, "temporal_tiling_factor": 7, "max_tfactor": 10, "loop_unroll_factor_t": 1, "sh_power": 1, "blocks_per_sm": 1, "time": 57.499948263168335, "times": [57.54163360595703, 57.49964904785156, 57.49964904785156, 57.504638671875, 57.50271987915039, 57.50271987915039, 57.5016975402832, 57.500640869140625, 57.49740982055664, 57.49862289428711, 57.49555206298828, 57.49350357055664, 57.49350357055664, 57.49756622314453, 57.49657440185547, 57.49964904785156, 57.50067138671875, 57.49760055541992, 57.494529724121094, 57.49043273925781, 57.49542236328125, 57.49760055541992, 57.50067138671875, 57.49964904785156, 57.49760055541992, 57.49657440185547, 57.49964904785156, 57.50476837158203, 57.49964904785156, 57.50067138671875, 57.49856185913086, 57.49856185913086], "compile_time": 744.935214985162, "verification_time": 0, "benchmark_time": 1841.9803070137277, "GFLOP/s": 30.636682870346164, "strategy_time": 0.00883603934198618, "framework_time": 1.324377954006195, "timestamp": "2025-04-07 23:37:27.101884+00:00", "gridpoints/s": 2042445524.6897442}, "4096,4096,1,32,2,5,3,10,1,0,4": {"grid_width": 4096, "grid_height": 4096, "block_size_x": 1, "block_size_y": 32, "tile_size_x": 2, "tile_size_y": 5, "temporal_tiling_factor": 3, "max_tfactor": 10, "loop_unroll_factor_t": 1, "sh_power": 0, "blocks_per_sm": 4, "time": 10.261687010526657, "times": [10.324992179870605, 10.271743774414062, 10.264575958251953, 10.263551712036133, 10.267647743225098, 10.270719528198242, 10.270719528198242, 10.265600204467773, 10.2543363571167, 10.250240325927734, 10.264575958251953, 10.254400253295898, 10.257311820983887, 10.242239952087402, 10.239999771118164, 10.255359649658203, 10.251263618469238, 10.265503883361816, 10.269696235656738, 10.258432388305664, 10.268671989440918, 10.262528419494629, 10.251263618469238, 10.275839805603027, 10.255264282226562, 10.255359649658203, 10.278752326965332, 10.250240325927734, 10.269696235656738, 10.258432388305664, 10.234784126281738, 10.250240325927734], "compile_time": 792.5791419111192, "verification_time": 0, "benchmark_time": 329.7664850251749, "GFLOP/s": 73.57218352357958, "strategy_time": 0.008575967513024807, "framework_time": 1.5580460894852877, "timestamp": "2025-04-07 23:37:28.225826+00:00", "gridpoints/s": 4904812234.905306}, "4096,4096,16,16,1,7,4,10,4,1,1": {"grid_width": 4096, "grid_height": 4096, "block_size_x": 16, "block_size_y": 16, "tile_size_x": 1, "tile_size_y": 7, "temporal_tiling_factor": 4, "max_tfactor": 10, "loop_unroll_factor_t": 4, "sh_power": 1, "blocks_per_sm": 1, "time": 10.107873052358627, "times": [10.163200378417969, 10.110976219177246, 10.108927726745605, 10.106880187988281, 10.105855941772461, 10.105855941772461, 10.101759910583496, 10.103808403015137, 10.106880187988281, 10.103808403015137, 10.106880187988281, 10.107904434204102, 10.103808403015137, 10.105855941772461, 10.108927726745605, 10.107904434204102, 10.105855941772461, 10.105855941772461, 10.105855941772461, 10.105855941772461, 10.10483169555664, 10.106783866882324, 10.10483169555664, 10.106719970703125, 10.105855941772461, 10.105855941772461, 10.107040405273438, 10.10483169555664, 10.10598373413086, 10.103808403015137, 10.10483169555664, 10.107904434204102], "compile_time": 865.3867780230939, "verification_time": 0, "benchmark_time": 325.50478097982705, "GFLOP/s": 99.58899906890962, "strategy_time": 0.008996925316751003, "framework_time": 1.401551067829132, "timestamp": "2025-04-07 23:37:29.418159+00:00", "gridpoints/s": 6639266604.593975}, "4096,4096,64,1,4,3,1,10,1,1,3": {"grid_width": 4096, "grid_height": 4096, "block_size_x": 64, "block_size_y": 1, "tile_size_x": 4, "tile_size_y": 3, "temporal_tiling_factor": 1, "max_tfactor": 10, "loop_unroll_factor_t": 1, "sh_power": 1, "blocks_per_sm": 3, "time": 1.4496890008449554, "times": [1.4971200227737427, 1.4479360580444336, 1.4448319673538208, 1.4427520036697388, 1.4447040557861328, 1.4407680034637451, 1.4439359903335571, 1.4417920112609863, 1.44486403465271, 1.4438400268554688, 1.4438400268554688, 1.4417920112609863, 1.442911982536316, 1.4417920112609863, 1.4407680034637451, 1.4417599439620972, 1.4417920112609863, 1.4428160190582275, 1.4438400268554688, 1.456063985824585, 1.4550399780273438, 1.4552639722824097, 1.4540799856185913, 1.4561280012130737, 1.4542399644851685, 1.4549440145492554, 1.4561280012130737, 1.4550399780273438, 1.4540799856185913, 1.4561280012130737, 1.454975962638855, 1.4540799856185913], "compile_time": 725.171301048249, "verification_time": 0, "benchmark_time": 48.124807071872056, "GFLOP/s": 173.59463985263062, "strategy_time": 0.0094269635155797, "framework_time": 1.3287458568811417, "timestamp": "2025-04-07 23:37:30.192823+00:00", "gridpoints/s": 11572975990.175375}, "4096,4096,16,8,1,4,10,10,2,0,3": {"grid_width": 4096, "grid_height": 4096, "block_size_x": 16, "block_size_y": 8, "tile_size_x": 1, "tile_size_y": 4, "temporal_tiling_factor": 10, "max_tfactor": 10, "loop_unroll_factor_t": 2, "sh_power": 0, "blocks_per_sm": 3, "time": 35.868661642074585, "times": [35.920894622802734, 35.87263870239258, 35.87276840209961, 35.8737907409668, 35.8656005859375, 35.86662292480469, 35.86969757080078, 35.86457443237305, 35.86662292480469, 35.86252975463867, 35.8737907409668, 35.86355209350586, 35.86867141723633, 35.86355209350586, 35.871742248535156, 35.86457443237305, 35.86662292480469, 35.86355209350586, 35.86569595336914, 35.86764907836914, 35.871742248535156, 35.8633918762207, 35.863487243652344, 35.86252975463867, 35.86764907836914, 35.86457443237305, 35.86355209350586, 35.86457443237305, 35.87184143066406, 35.86662292480469, 35.86457443237305, 35.867488861083984], "compile_time": 824.7237340547144, "verification_time": 0, "benchmark_time": 1148.7298699794337, "GFLOP/s": 70.16103430656034, "strategy_time": 0.00940798781812191, "framework_time": 1.2949329102411866, "timestamp": "2025-04-07 23:37:32.167611+00:00", "gridpoints/s": 4677402287.104022}, "4096,4096,64,8,1,1,8,10,1,1,1": {"grid_width": 4096, "grid_height": 4096, "block_size_x": 64, "block_size_y": 8, "tile_size_x": 1, "tile_size_y": 1, "temporal_tiling_factor": 8, "max_tfactor": 10, "loop_unroll_factor_t": 1, "sh_power": 1, "blocks_per_sm": 1, "time": 30.499770045280457, "times": [30.54694366455078, 30.500864028930664, 30.498815536499023, 30.501888275146484, 30.497791290283203, 30.498815536499023, 30.496768951416016, 30.498815536499023, 30.494720458984375, 30.500864028930664, 30.500864028930664, 30.495744705200195, 30.498783111572266, 30.498815536499023, 30.498815536499023, 30.495744705200195, 30.498815536499023, 30.499839782714844, 30.494720458984375, 30.496768951416016, 30.502912521362305, 30.503904342651367, 30.497791290283203, 30.496768951416016, 30.497791290283203, 30.495712280273438, 30.497791290283203, 30.497791290283203, 30.496768951416016, 30.494720458984375, 30.496768951416016, 30.498720169067383], "compile_time": 746.7295930255204, "verification_time": 0, "benchmark_time": 977.9794029891491, "GFLOP/s": 66.00921636494546, "strategy_time": 0.008985982276499271, "framework_time": 1.5215580351650715, "timestamp": "2025-04-07 23:37:33.893881+00:00", "gridpoints/s": 4400614424.329698}, "4096,4096,4,16,1,8,6,10,6,0,2": {"grid_width": 4096, "grid_height": 4096, "block_size_x": 4, "block_size_y": 16, "tile_size_x": 1, "tile_size_y": 8, "temporal_tiling_factor": 6, "max_tfactor": 10, "loop_unroll_factor_t": 6, "sh_power": 0, "blocks_per_sm": 2, "time": 26.988851845264435, "times": [27.043840408325195, 26.98534393310547, 26.989471435546875, 26.988544464111328, 26.991615295410156, 26.984447479248047, 26.98956871032715, 26.9803524017334, 26.98646354675293, 26.98956871032715, 26.993663787841797, 26.991615295410156, 26.98240089416504, 26.978303909301758, 26.978303909301758, 26.987520217895508, 26.993663787841797, 26.998783111572266, 26.983423233032227, 26.987520217895508, 26.992639541625977, 26.983423233032227, 26.983295440673828, 26.98956871032715, 26.990591049194336, 26.988544464111328, 26.979328155517578, 26.990591049194336, 26.990591049194336, 26.983423233032227, 26.978303909301758, 26.988544464111328], "compile_time": 1069.4832749431953, "verification_time": 0, "benchmark_time": 865.2985520893708, "GFLOP/s": 55.94715361205487, "strategy_time": 0.008917064405977726, "framework_time": 1.405299874022603, "timestamp": "2025-04-07 23:37:35.830107+00:00", "gridpoints/s": 3729810240.803658}, "4096,4096,8,4,7,1,9,10,3,0,2": {"grid_width": 4096, "grid_height": 4096, "block_size_x": 8, "block_size_y": 4, "tile_size_x": 7, "tile_size_y": 1, "temporal_tiling_factor": 9, "max_tfactor": 10, "loop_unroll_factor_t": 3, "sh_power": 0, "blocks_per_sm": 2, "time": 53.97972297668457, "times": [54.02521514892578, 53.98214340209961, 53.984256744384766, 53.977088928222656, 53.97401428222656, 53.97593688964844, 53.9791374206543, 53.97401428222656, 53.98118209838867, 53.970943450927734, 53.9791374206543, 53.97600173950195, 53.976993560791016, 53.97907257080078, 53.984256744384766, 53.98204803466797, 53.98118209838867, 53.98118209838867, 53.980159759521484, 53.97196960449219, 53.972991943359375, 53.979103088378906, 53.97702407836914, 53.9791374206543, 53.978111267089844, 53.9760627746582, 53.98323059082031, 53.978111267089844, 53.977088928222656, 53.977088928222656, 53.982208251953125, 53.975040435791016], "compile_time": 973.8842599326745, "verification_time": 0, "benchmark_time": 1728.3155750483274, "GFLOP/s": 41.9587955458439, "strategy_time": 0.008576083928346634, "framework_time": 1.4281918993219733, "timestamp": "2025-04-07 23:37:38.533777+00:00", "gridpoints/s": 2797253036.389593}, "4096,4096,128,2,2,2,4,10,2,1,0": {"grid_width": 4096, "grid_height": 4096, "block_size_x": 128, "block_size_y": 2, "tile_size_x": 2, "tile_size_y": 2, "temporal_tiling_factor": 4, "max_tfactor": 10, "loop_unroll_factor_t": 2, "sh_power": 1, "blocks_per_sm": 0, "time": 10.757935971021652, "times": [10.809280395507812, 10.762240409851074, 10.7