compare_real_world_impact/results/hotspot/A4000_f=pythonconstraint_i=8.json
{"device_name": "NVIDIA RTX A4000", "kernel_name": "calculate_temp", "problem_size": [4096, 4096], "tune_params_keys": ["grid_width", "grid_height", "block_size_x", "block_size_y", "tile_size_x", "tile_size_y", "temporal_tiling_factor", "max_tfactor", "loop_unroll_factor_t", "sh_power", "blocks_per_sm"], "tune_params": {"grid_width": [4096], "grid_height": [4096], "block_size_x": [1, 2, 4, 8, 16, 32, 64, 96, 128, 160, 192, 224, 256, 288, 320, 352, 384, 416, 448, 480, 512, 544, 576, 608, 640, 672, 704, 736, 768, 800, 832, 864, 896, 928, 960, 992, 1024], "block_size_y": [1, 2, 4, 8, 16, 32], "tile_size_x": [1, 2, 3, 4, 5, 6, 7, 8, 9, 10], "tile_size_y": [1, 2, 3, 4, 5, 6, 7, 8, 9, 10], "temporal_tiling_factor": [1, 2, 3, 4, 5, 6, 7, 8, 9, 10], "max_tfactor": [10], "loop_unroll_factor_t": [1, 2, 3, 4, 5, 6, 7, 8, 9, 10], "sh_power": [0, 1], "blocks_per_sm": [0, 1, 2, 3, 4]}, "objective": "GFLOP/s", "cache": {"4096,4096,32,2,1,1,9,10,9,0,1": {"grid_width": 4096, "grid_height": 4096, "block_size_x": 32, "block_size_y": 2, "tile_size_x": 1, "tile_size_y": 1, "temporal_tiling_factor": 9, "max_tfactor": 10, "loop_unroll_factor_t": 9, "sh_power": 0, "blocks_per_sm": 1, "time": 122.262451171875, "times": [122.31372833251953, 122.2666244506836, 122.25727844238281, 122.2583999633789, 122.25536346435547, 122.25843048095703, 122.25536346435547, 122.25945281982422, 122.26032257080078, 122.25638580322266, 122.25945281982422, 122.2635498046875, 122.25331115722656, 122.25740814208984, 122.26150512695312, 122.25740814208984, 122.25740814208984, 122.25945281982422, 122.26150512695312, 122.26150512695312, 122.26048278808594, 122.25843048095703, 122.25740814208984, 122.25536346435547, 122.25843048095703, 122.26048278808594, 122.25740814208984, 122.25936126708984, 122.25331115722656, 122.25945281982422, 122.25638580322266, 122.32806396484375], "compile_time": 1244.9115649797022, "verification_time": 0, "benchmark_time": 3913.568743970245, "GFLOP/s": 18.525100210987908, "strategy_time": 2130.57738810312, "framework_time": 0, "timestamp": "2025-04-08 04:36:33.587223+00:00", "gridpoints/s": 1235006680.7325273}, "4096,4096,8,4,9,7,2,10,2,1,0": {"grid_width": 4096, "grid_height": 4096, "block_size_x": 8, "block_size_y": 4, "tile_size_x": 9, "tile_size_y": 7, "temporal_tiling_factor": 2, "max_tfactor": 10, "loop_unroll_factor_t": 2, "sh_power": 1, "blocks_per_sm": 0, "time": 3.8544239923357964, "times": [3.9004158973693848, 3.865600109100342, 3.8543360233306885, 3.8451199531555176, 3.842047929763794, 3.8684799671173096, 3.8431999683380127, 3.84499192237854, 3.8492159843444824, 3.8533120155334473, 3.8635520935058594, 3.8480958938598633, 3.8520960807800293, 3.862528085708618, 3.849087953567505, 3.8594560623168945, 3.857408046722412, 3.847007989883423, 3.8808319568634033, 3.8451199531555176, 3.8584320545196533, 3.848191976547241, 3.856384038925171, 3.8696320056915283, 3.843071937561035, 3.8533120155334473, 3.851263999938965, 3.838815927505493, 3.8492159843444824, 3.8604159355163574, 3.837951898574829, 3.8429760932922363], "compile_time": 872.4759089527652, "verification_time": 0, "benchmark_time": 124.69906092155725, "GFLOP/s": 130.58150348814846, "strategy_time": 0.009026960469782352, "framework_time": 1.7948402091860771, "timestamp": "2025-04-08 04:36:34.586233+00:00", "gridpoints/s": 8705433565.876564}, "4096,4096,4,8,2,7,3,10,1,0,3": {"grid_width": 4096, "grid_height": 4096, "block_size_x": 4, "block_size_y": 8, "tile_size_x": 2, "tile_size_y": 7, "temporal_tiling_factor": 3, "max_tfactor": 10, "loop_unroll_factor_t": 1, "sh_power": 0, "blocks_per_sm": 3, "time": 6.282238036394119, "times": [6.334464073181152, 6.285312175750732, 6.292479991912842, 6.281216144561768, 6.281216144561768, 6.281216144561768, 6.278143882751465, 6.279168128967285, 6.28223991394043, 6.280191898345947, 6.28326416015625, 6.28326416015625, 6.277120113372803, 6.28223991394043, 6.278143882751465, 6.277120113372803, 6.278143882751465, 6.28223991394043, 6.284287929534912, 6.28326416015625, 6.281216144561768, 6.28223991394043, 6.279104232788086, 6.278143882751465, 6.280096054077148, 6.2791361808776855, 6.278143882751465, 6.279168128967285, 6.27507209777832, 6.280191898345947, 6.278143882751465, 6.276224136352539], "compile_time": 830.8657199377194, "verification_time": 0, "benchmark_time": 202.88636104669422, "GFLOP/s": 120.17607668259265, "strategy_time": 0.008495990186929703, "framework_time": 1.5768910525366664, "timestamp": "2025-04-08 04:36:35.621601+00:00", "gridpoints/s": 8011738445.506177}, "4096,4096,4,8,8,9,3,10,3,0,4": {"grid_width": 4096, "grid_height": 4096, "block_size_x": 4, "block_size_y": 8, "tile_size_x": 8, "tile_size_y": 9, "temporal_tiling_factor": 3, "max_tfactor": 10, "loop_unroll_factor_t": 3, "sh_power": 0, "blocks_per_sm": 4, "time": 5.1777410209178925, "times": [5.214208126068115, 5.196671962738037, 5.172224044799805, 5.182464122772217, 5.1814398765563965, 5.177184104919434, 5.1671037673950195, 5.1814398765563965, 5.168032169342041, 5.178368091583252, 5.172224044799805, 5.172224044799805, 5.170176029205322, 5.174272060394287, 5.163871765136719, 5.184512138366699, 5.1814398765563965, 5.189631938934326, 5.183296203613281, 5.172224044799805, 5.174272060394287, 5.172224044799805, 5.173344135284424, 5.171199798583984, 5.174272060394287, 5.171199798583984, 5.175327777862549, 5.178368091583252, 5.1609601974487305, 5.184512138366699, 5.1763200759887695, 5.192704200744629], "compile_time": 995.3401369275525, "verification_time": 0, "benchmark_time": 167.29171900078654, "GFLOP/s": 145.81160335171816, "strategy_time": 0.008745933882892132, "framework_time": 1.6114570898935199, "timestamp": "2025-04-08 04:36:36.785883+00:00", "gridpoints/s": 9720773556.781212}, "4096,4096,32,8,7,2,4,10,1,0,0": {"grid_width": 4096, "grid_height": 4096, "block_size_x": 32, "block_size_y": 8, "tile_size_x": 7, "tile_size_y": 2, "temporal_tiling_factor": 4, "max_tfactor": 10, "loop_unroll_factor_t": 1, "sh_power": 0, "blocks_per_sm": 0, "time": 10.080405980348587, "times": [10.12940788269043, 10.084351539611816, 10.082304000854492, 10.081279754638672, 10.079232215881348, 10.078207969665527, 10.079232215881348, 10.078047752380371, 10.077183723449707, 10.078207969665527, 10.083392143249512, 10.080256462097168, 10.079168319702148, 10.078207969665527, 10.077183723449707, 10.077183723449707, 10.078207969665527, 10.078207969665527, 10.07817554473877, 10.079168319702148, 10.078207969665527, 10.079232215881348, 10.079232215881348, 10.076160430908203, 10.078207969665527, 10.078271865844727, 10.079232215881348, 10.077183723449707, 10.078080177307129, 10.077183723449707, 10.078207969665527, 10.077183723449707], "compile_time": 828.1247109407559, "verification_time": 0, "benchmark_time": 323.7783279037103, "GFLOP/s": 99.86035899371484, "strategy_time": 0.009066890925168991, "framework_time": 1.4970111660659313, "timestamp": "2025-04-08 04:36:37.939323+00:00", "gridpoints/s": 6657357266.247656}, "4096,4096,16,2,6,8,4,10,1,1,3": {"grid_width": 4096, "grid_height": 4096, "block_size_x": 16, "block_size_y": 2, "tile_size_x": 6, "tile_size_y": 8, "temporal_tiling_factor": 4, "max_tfactor": 10, "loop_unroll_factor_t": 1, "sh_power": 1, "blocks_per_sm": 3, "time": 8.535814046859741, "times": [8.613887786865234, 8.52889633178711, 8.552448272705078, 8.531968116760254, 8.548352241516113, 8.507231712341309, 8.555520057678223, 8.51968002319336, 8.522751808166504, 8.506303787231445, 8.524800300598145, 8.536064147949219, 8.544256210327148, 8.535039901733398, 8.543135643005371, 8.547327995300293, 8.524800300598145, 8.534879684448242, 8.51046371459961, 8.539072036743164, 8.532992362976074, 8.524703979492188, 8.525823593139648, 8.544256210327148, 8.525823593139648, 8.541184425354004, 8.547327995300293, 8.532992362976074, 8.531968116760254, 8.52889633178711, 8.55020809173584, 8.532992362976074], "compile_time": 832.0626609493047, "verification_time": 0, "benchmark_time": 274.53312010038644, "GFLOP/s": 117.93051658269574, "strategy_time": 0.009036972187459469, "framework_time": 1.5388589818030596, "timestamp": "2025-04-08 04:36:39.047498+00:00", "gridpoints/s": 7862034438.846383}, "4096,4096,96,2,2,2,1,10,1,0,2": {"grid_width": 4096, "grid_height": 4096, "block_size_x": 96, "block_size_y": 2, "tile_size_x": 2, "tile_size_y": 2, "temporal_tiling_factor": 1, "max_tfactor": 10, "loop_unroll_factor_t": 1, "sh_power": 0, "blocks_per_sm": 2, "time": 1.5401790030300617, "times": [1.5860480070114136, 1.5421439409255981, 1.5380480289459229, 1.5360640287399292, 1.5359679460525513, 1.533951997756958, 1.5360000133514404, 1.5360000133514404, 1.5360000133514404, 1.5360000133514404, 1.5349440574645996, 1.5360000133514404, 1.5360000133514404, 1.5360000133514404, 1.535904049873352, 1.5370240211486816, 1.5349760055541992, 1.5349760055541992, 1.5349760055541992, 1.533951997756958, 1.5349760055541992, 1.5349760055541992, 1.5349760055541992, 1.5349760055541992, 1.5349760055541992, 1.5431679487228394, 1.5502079725265503, 1.5493119955062866, 1.5493119955062866, 1.5492479801177979, 1.5493119955062866, 1.5493119955062866], "compile_time": 676.342835999094, "verification_time": 0, "benchmark_time": 50.363210029900074, "GFLOP/s": 163.39544916850684, "strategy_time": 0.008765957318246365, "framework_time": 1.5201059868559241, "timestamp": "2025-04-08 04:36:39.775764+00:00", "gridpoints/s": 10893029944.567122}, "4096,4096,288,2,1,1,6,10,1,0,2": {"grid_width": 4096, "grid_height": 4096, "block_size_x": 288, "block_size_y": 2, "tile_size_x": 1, "tile_size_y": 1, "temporal_tiling_factor": 6, "max_tfactor": 10, "loop_unroll_factor_t": 1, "sh_power": 0, "blocks_per_sm": 2, "time": 34.29359698295593, "times": [34.34479904174805, 34.299903869628906, 34.290687561035156, 34.29276657104492, 34.29171371459961, 34.295806884765625, 34.29683303833008, 34.290687561035156, 34.28966522216797, 34.28761672973633, 34.290687561035156, 34.28966522216797, 34.288639068603516, 34.290687561035156, 34.290687561035156, 34.2927360534668, 34.29171371459961, 34.288639068603516, 34.29478454589844, 34.28966522216797, 34.29171371459961, 34.2927360534668, 34.2927360534668, 34.2927360534668, 34.288639068603516, 34.29171371459961, 34.29177474975586, 34.29167938232422, 34.293758392333984, 34.290687561035156, 34.293758392333984, 34.29478454589844], "compile_time": 684.187046950683, "verification_time": 0, "benchmark_time": 1098.8914429908618, "GFLOP/s": 44.03006895865871, "strategy_time": 0.009177019819617271, "framework_time": 1.5627950197085738, "timestamp": "2025-04-08 04:36:41.560443+00:00", "gridpoints/s": 2935337930.577247}, "4096,4096,160,1,1,7,10,10,1,0,2": {"grid_width": 4096, "grid_height": 4096, "block_size_x": 160, "block_size_y": 1, "tile_size_x": 1, "tile_size_y": 7, "temporal_tiling_factor": 10, "max_tfactor": 10, "loop_unroll_factor_t": 1, "sh_power": 0, "blocks_per_sm": 2, "time": 50.20514738559723, "times": [50.25484848022461, 50.2108154296875, 50.19340896606445, 50.21286392211914, 50.21184158325195, 50.2026252746582, 50.181121826171875, 50.20463943481445, 50.20364761352539, 50.20774459838867, 50.20454406738281, 50.21593475341797, 50.2210578918457, 50.20057678222656, 50.19033432006836, 50.20774459838867, 50.2026252746582, 50.20876693725586, 50.21388626098633, 50.19340896606445, 50.204673767089844, 50.19340896606445, 50.19852828979492, 50.186241149902344, 50.19340896606445, 50.21388626098633, 50.204673767089844, 50.204673767089844, 50.20364761352539, 50.21900939941406, 50.186241149902344, 50.21388626098633], "compile_time": 702.3286459734663, "verification_time": 0, "benchmark_time": 1607.9909909749404, "GFLOP/s": 50.12598370982879, "strategy_time": 0.009507988579571247, "framework_time": 1.4669460942968726, "timestamp": "2025-04-08 04:36:43.872269+00:00", "gridpoints/s": 3341732247.3219194}, "4096,4096,64,2,4,1,8,10,1,0,1": {"grid_width": 4096, "grid_height": 4096, "block_size_x": 64, "block_size_y": 2, "tile_size_x": 4, "tile_size_y": 1, "temporal_tiling_factor": 8, "max_tfactor": 10, "loop_unroll_factor_t": 1, "sh_power": 0, "blocks_per_sm": 1, "time": 56.96116816997528, "times": [57.006080627441406, 56.954689025878906, 56.96819305419922, 56.96307373046875, 56.95692825317383, 56.95897674560547, 56.961952209472656, 56.9598388671875, 56.965118408203125, 56.95897674560547, 56.97740936279297, 56.96819305419922, 56.94668960571289, 56.965118408203125, 56.96409606933594, 56.96409606933594, 56.95692825317383, 56.95993423461914, 56.9620475769043, 56.95897674560547, 56.96409606933594, 56.95283126831055, 56.95283126831055, 56.953857421875, 56.96614456176758, 56.950782775878906, 56.94566345214844, 56.95897674560547, 56.9436149597168, 56.96307373046875, 56.969215393066406, 56.95897674560547], "compile_time": 806.9313101004809, "verification_time": 0, "benchmark_time": 1824.1841250564903, "GFLOP/s": 35.344533559991305, "strategy_time": 0.008956994861364365, "framework_time": 1.51281978469342, "timestamp": "2025-04-08 04:36:46.504937+00:00", "gridpoints/s": 2356302237.3327537}, "4096,4096,128,1,1,6,9,10,9,0,2": {"grid_width": 4096, "grid_height": 4096, "block_size_x": 128, "block_size_y": 1, "tile_size_x": 1, "tile_size_y": 6, "temporal_tiling_factor": 9, "max_tfactor": 10, "loop_unroll_factor_t": 9, "sh_power": 0, "blocks_per_sm": 2, "time": 36.61061489582062, "times": [36.66227340698242, 36.63974380493164, 36.63974380493164, 36.63257598876953, 36.621246337890625, 36.60287857055664, 36.60697555541992, 36.597599029541016, 36.60287857055664, 36.603904724121094, 36.59980773925781, 36.66739273071289, 36.573184967041016, 36.5926399230957, 36.60697555541992, 36.60492706298828, 36.56499099731445, 36.603904724121094, 36.65305709838867, 36.6110725402832, 36.605953216552734, 36.613121032714844, 36.63667297363281, 36.59775924682617, 36.591617584228516, 36.569087982177734, 36.62643051147461, 36.60697555541992, 36.60492706298828, 36.60185623168945, 36.61209487915039, 36.58540725708008], "compile_time": 1250.0521949259564, "verification_time": 0, "benchmark_time": 1173.2869369443506, "GFLOP/s": 61.865231339191695, "strategy_time": 0.009197043254971504, "framework_time": 1.5751280589029193, "timestamp": "2025-04-08 04:36:48.929892+00:00", "gridpoints/s": 4124348755.946113}, "4096,4096,8,16,2,3,2,10,2,0,1": {"grid_width": 4096, "grid_height": 4096, "block_size_x": 8, "block_size_y": 16, "tile_size_x": 2, "tile_size_y": 3, "temporal_tiling_factor": 2, "max_tfactor": 10, "loop_unroll_factor_t": 2, "sh_power": 0, "blocks_per_sm": 1, "time": 3.7264289930462837, "times": [3.7806079387664795, 3.7314560413360596, 3.7273600101470947, 3.7273600101470947, 3.724287986755371, 3.7263360023498535, 3.724287986755371, 3.724287986755371, 3.724287986755371, 3.724287986755371, 3.7253119945526123, 3.72544002532959, 3.72326397895813, 3.72326397895813, 3.724287986755371, 3.724287986755371, 3.72326397895813, 3.724287986755371, 3.725152015686035, 3.72326397895813, 3.724287986755371, 3.7253119945526123, 3.72326397895813, 3.724287986755371, 3.7253119945526123, 3.724287986755371, 3.724287986755371, 3.724224090576172, 3.724287986755371, 3.72326397895813, 3.72326397895813, 3.72326397895813], "compile_time": 816.5651679737493, "verification_time": 0, "benchmark_time": 121.08569894917309, "GFLOP/s": 135.0667035221161, "strategy_time": 0.008916947990655899, "framework_time": 1.6849341336637735, "timestamp": "2025-04-08 04:36:49.869268+00:00", "gridpoints/s": 9004446901.474405}, "4096,4096,64,2,5,3,5,10,5,0,1": {"grid_width": 4096, "grid_height": 4096, "block_size_x": 64, "block_size_y": 2, "tile_size_x": 5, "tile_size_y": 3, "temporal_tiling_factor": 5, "max_tfactor": 10, "loop_unroll_factor_t": 5, "sh_power": 0, "blocks_per_sm": 1, "time": 13.116706043481827, "times": [13.165568351745605, 13.026304244995117, 13.14303970336914, 13.128671646118164, 13.114368438720703, 13.137760162353516, 13.1429443359375, 13.127679824829102, 13.138751983642578, 13.104127883911133, 13.133824348449707, 13.064064025878906, 13.128704071044922, 13.132800102233887, 13.15225601196289, 13.136863708496094, 13.124608039855957, 13.121376037597656, 13.104127883911133, 13.132800102233887, 13.164544105529785, 13.114368438720703, 13.06931209564209, 13.127679824829102, 13.024255752563477, 13.135871887207031, 13.142016410827637, 13.138943672180176, 13.14185619354248, 13.036543846130371, 13.041664123535156, 13.136896133422852], "compile_time": 1020.8869960624725, "verification_time": 0, "benchmark_time": 421.0663631092757, "GFLOP/s": 95.93042611679867, "strategy_time": 0.008795992471277714, "framework_time": 1.4609037898480892, "timestamp": "2025-04-08 04:36:51.312723+00:00", "gridpoints/s": 6395361741.119912}, "4096,4096,32,4,7,3,5,10,5,0,0": {"grid_width": 4096, "grid_height": 4096, "block_size_x": 32, "block_size_y": 4, "tile_size_x": 7, "tile_size_y": 3, "temporal_tiling_factor": 5, "max_tfactor": 10, "loop_unroll_factor_t": 5, "sh_power": 0, "blocks_per_sm": 0, "time": 14.741851031780243, "times": [14.7957763671875, 14.743552207946777, 14.745599746704102, 14.740480422973633, 14.741503715515137, 14.736384391784668, 14.738431930541992, 14.736384391784668, 14.739456176757812, 14.740480422973633, 14.736384391784668, 14.738431930541992, 14.737407684326172, 14.737567901611328, 14.739456176757812, 14.738271713256836, 14.745471954345703, 14.733311653137207, 14.732288360595703, 14.738431930541992, 14.745599746704102, 14.741503715515137, 14.73744010925293, 14.743552207946777, 14.7457275390625, 14.741503715515137, 14.745599746704102, 14.738431930541992, 14.738431930541992, 14.740480422973633, 14.744576454162598, 14.741312026977539], "compile_time": 1029.710398055613, "verification_time": 0, "benchmark_time": 473.0732679599896, "GFLOP/s": 85.3550342685865, "strategy_time": 0.009086914360523224, "framework_time": 1.5641171485185623, "timestamp": "2025-04-08 04:36:52.817111+00:00", "gridpoints/s": 5690335617.905766}, "4096,4096,64,2,1,10,3,10,3,1,3": {"grid_width": 4096, "grid_height": 4096, "block_size_x": 64, "block_size_y": 2, "tile_size_x": 1, "tile_size_y": 10, "temporal_tiling_factor": 3, "max_tfactor": 10, "loop_unroll_factor_t": 3, "sh_power": 1, "blocks_per_sm": 3, "time": 6.239003956317902, "times": [6.293504238128662, 6.243231773376465, 6.241312026977539, 6.237184047698975, 6.24015998840332, 6.236159801483154, 6.23308801651001, 6.235136032104492, 6.238207817077637, 6.238207817077637, 6.238207817077637, 6.234111785888672, 6.2363200187683105, 6.23414421081543, 6.234943866729736, 6.238207817077637, 6.238207817077637, 6.238207817077637, 6.235136032104492, 6.235136032104492, 6.237184047698975, 6.238207817077637, 6.235136032104492, 6.237184047698975, 6.238207817077637, 6.234111785888672, 6.237152099609375, 6.238272190093994, 6.239232063293457, 6.239232063293457, 6.238207817077637, 6.237184047698975], "compile_time": 832.2829420212656, "verification_time": 0, "benchmark_time": 201.06980099808425, "GFLOP/s": 121.00885418344349, "strategy_time": 0.016701058484613895, "framework_time": 1.6492479480803013, "timestamp": "2025-04-08 04:36:53.852161+00:00", "gridpoints/s": 8067256945.5629}, "4096,4096,16,4,10,1,2,10,1,1,3": {"grid_width": 4096, "grid_height": 4096, "block_size_x": 16, "block_size_y": 4, "tile_size_x": 10, "tile_size_y": 1, "temporal_tiling_factor": 2, "max_tfactor": 10, "loop_unroll_factor_t": 1, "sh_power": 1, "blocks_per_sm": 3, "time": 3.7981040477752686, "times": [3.846143960952759, 3.7990400791168213, 3.796128034591675, 3.7959680557250977, 3.794816017150879, 3.7949440479278564, 3.8000640869140625, 3.8000640869140625, 3.79801607131958, 3.8010880947113037, 3.7939200401306152, 3.7939200401306152, 3.7949440479278564, 3.8000640869140625, 3.7939200401306152, 3.7949440479278564, 3.792896032333374, 3.79801607131958, 3.7999680042266846, 3.79801607131958, 3.7990400791168213, 3.7990400791168213, 3.7939200401306152, 3.7939200401306152, 3.794816017150879, 3.7939200401306152, 3.7990400791168213, 3.7939200401306152, 3.79801607131958, 3.7939200401306152, 3.7949440479278564, 3.7979519367218018], "compile_time": 767.1800289535895, "verification_time": 0, "benchmark_time": 122.88226198870689, "GFLOP/s": 132.5178230161484, "strategy_time": 0.009467941708862782, "framework_time": 1.7272221157327294, "timestamp": "2025-04-08 04:36:54.743991+00:00", "gridpoints/s": 8834521534.409893}, "4096,4096,32,2,3,6,6,10,2,0,0": {"grid_width": 4096, "grid_height": 4096, "block_size_x": 32, "block_size_y": 2, "tile_size_x": 3, "tile_size_y": 6, "temporal_tiling_factor": 6, "max_tfactor": 10, "loop_unroll_factor_t": 2, "sh_power": 0, "blocks_per_sm": 0, "time": 26.029795050621033, "times": [26.073087692260742, 26.064895629882812, 26.028032302856445, 26.028032302856445, 26.01968002319336, 26.035200119018555, 26.030080795288086, 26.031103134155273, 26.033023834228516, 26.005504608154297, 26.012672424316406, 26.028959274291992, 26.033151626586914, 26.029056549072266, 26.013696670532227, 26.037248611450195, 26.030080795288086, 26.037120819091797, 26.036224365234375, 26.01046371459961, 26.022911071777344, 26.034175872802734, 26.031967163085938, 26.022911071777344, 26.020864486694336, 26.025983810424805, 26.049535751342773, 26.013696670532227, 26.045408248901367, 26.00752067565918, 26.028032302856445, 26.033119201660156], "compile_time": 861.2371380440891, "verification_time": 0, "benchmark_time": 834.1514990897849, "GFLOP/s": 58.00850283544491, "strategy_time": 0.009628012776374817, "framework_time": 1.523480867035687, "timestamp": "2025-04-08 04:36:56.440945+00:00", "gridpoints/s": 3867233522.3629937}, "4096,4096,4,32,5,1,10,10,1,1,1": {"grid_width": 4096, "grid_height": 4096, "block_size_x": 4, "block_size_y": 32, "tile_size_x": 5, "tile_size_y": 1, "temporal_tiling_factor": 10, "max_tfactor": 10, "loop_unroll_factor_t": 1, "sh_power": 1, "blocks_per_sm": 1, "time": 30.527857840061188, "times": [30.57356834411621, 30.534496307373047, 30.531583786010742, 30.5295352935791, 30.52851104736328, 30.52851104736328, 30.522367477416992, 30.52851104736328, 30.526464462280273, 30.524415969848633, 30.523391723632812, 30.525440216064453, 30.523391723632812, 30.523391723632812, 30.521343231201172, 30.525440216064453, 30.526464462280273, 30.525440216064453, 30.524415969848633, 30.530527114868164, 30.523391723632812, 30.523391723632812, 30.524415969848633, 30.525440216064453, 30.525312423706055, 30.527488708496094, 30.525440216064453, 30.52851104736328, 30.52851104736328, 30.532480239868164, 30.524415969848633, 30.525440216064453], "compile_time": 759.7676180303097, "verification_time": 0, "benchmark_time": 977.9888059711084, "GFLOP/s": 82.43560400420667, "strategy_time": 0.009138020686805248, "framework_time": 1.642622984945774, "timestamp": "2025-04-08 04:36:58.180385+00:00", "gridpoints/s": 5495706933.613778}, "4096,4096,8,8,4,9,7,10,1,0,3": {"grid_width": 4096, "grid_height": 4096, "block_size_x": 8, "block_size_y": 8, "tile_size_x": 4, "tile_size_y": 9, "temporal_tiling_factor": 7, "max_tfactor": 10, "loop_unroll_factor_t": 1, "sh_power": 0, "blocks_per_sm": 3, "time": 13.824891030788422, "times": [13.883392333984375, 13.824000358581543, 13.821951866149902, 13.821951866149902, 13.824000358581543, 13.816991806030273, 13.81875228881836, 13.817855834960938, 13.817855834960938, 13.816831588745117, 13.817855834960938, 13.818976402282715, 13.824000358581543, 13.825023651123047, 13.822976112365723, 13.825023651123047, 13.824000358581543, 13.821951866149902, 13.829119682312012, 13.824000358581543, 13.816831588745117, 13.829119682312012, 13.819904327392578, 13.833344459533691, 13.821951866149902, 13.820768356323242, 13.822976112365723, 13.821951866149902, 13.842432022094727, 13.820863723754883, 13.818816184997559, 13.831040382385254], "compile_time": 867.1397030120715, "verification_time": 0, "benchmark_time": 444.11657797172666, "GFLOP/s": 127.42289802334429, "strategy_time": 0.00983790960162878, "framework_time": 1.524695078842342, "timestamp": "2025-04-08 04:36:59.493213+00:00", "gridpoints/s": 8494859868.222952}, "4096,4096,32,2,2,6,9,10,1,1,2": {"grid_width": 4096, "grid_height": 4096, "block_size_x": 32, "block_size_y": 2, "tile_size_x": 2, "tile_size_y": 6, "temporal_tiling_factor": 9, "max_tfactor": 10, "loop_unroll_factor_t": 1, "sh_power": 1, "blocks_per_sm": 2, "time": 30.438948929309845, "times": [30.487552642822266, 30.4333438873291, 30.444448471069336, 30.437376022338867, 30.43328094482422, 30.435327529907227, 30.43027114868164, 30.435327529907227, 30.435327529907227, 30.429183959960938, 30.436351776123047, 30.433151245117188, 30.440448760986328, 30.430208206176758, 30.434303283691406, 30.436351776123047, 30.439424514770508, 30.436288833618164, 30.439327239990234, 30.439424514770508, 30.435136795043945, 30.448640823364258, 30.440448760986328, 30.434303283691406, 30.433216094970703, 30.440448760986328, 30.433151245117188, 30.449663162231445, 30.442495346069336, 30.441471099853516, 30.439327239990234, 30.441343307495117], "compile_time": 772.5684429751709, "verification_time": 0, "benchmark_time": 976.1688800062984, "GFLOP/s": 74.40875061947659, "strategy_time": 0.008867005817592144, "framework_time": 1.4527590246871114, "timestamp": "2025-04-08 04:37:01.243442+00:00", "gridpoints/s": 4960583374.631773}, "4096,4096,4,8,3,1,9,10,3,0,4": {"grid_width": 4096, "grid_height": 4096, "block_size_x": 4, "block_size_y": 8, "tile_size_x": 3, "tile_size_y": 1, "temporal_tiling_factor": 9, "max_tfactor": 10, "loop_unroll_factor_t": 3, "sh_power": 0, "blocks_per_sm": 4, "time": 56.85375118255615, "times": [56.91084671020508, 56.85744094848633, 56.852481842041016, 56.8535041809082, 56.84940719604492, 56.850433349609375, 56.84531021118164, 56.848384857177734, 56.846336364746094, 56.848384857177734, 56.84940719604492, 56.84940719604492, 56.848384857177734, 56.846336364746094, 56.85145568847656, 56.84729766845703, 56.84940719604492, 56.85145568847656, 56.85452651977539, 56.85152053833008, 56.852481842041016, 56.84947204589844, 56.85657501220703, 56.855552673339844, 56.852481842041016, 56.85452651977539, 56.859649658203125, 56.85347366333008, 56.85657501220703, 56.857601165771484, 56.855552673339844, 56.854366302490234], "compile_time": 974.3645939743146, "verification_time": 0, "benchmark_time": 1820.6830429844558, "GFLOP/s": 39.837725970400406, "strategy_time": 0.00899704173207283, "framework_time": 1.5245620161294937, "timestamp": "2025-04-08 04:37:04.040054+00:00", "gridpoints/s": 2655848398.026694}, "4096,4096,64,1,2,5,7,10,7,0,2": {"grid_width": 4096, "grid_height": 4096, "block_size_x": 64, "block_size_y": 1, "tile_size_x": 2, "tile_size_y": 5, "temporal_tiling_factor": 7, "max_tfactor": 10, "loop_unroll_factor_t": 7, "sh_power": 0, "blocks_per_sm": 2, "time": 26.784827053546906, "times": [26.821632385253906, 26.814464569091797, 26.770431518554688, 26.76838493347168, 26.75916862487793, 26.789888381958008, 26.800128936767578, 26.811391830444336, 26.803199768066406, 26.777599334716797, 26.763263702392578, 26.769376754760742, 26.762239456176758, 26.75916862487793, 26.780672073364258, 26.772480010986328, 26.805248260498047, 26.784896850585938, 26.784767150878906, 26.77350425720215, 26.792863845825195, 26.779647827148438, 26.807296752929688, 26.81020736694336, 26.75712013244629, 26.786815643310547, 26.780672073364258, 26.761215209960938, 26.801151275634766, 26.76531219482422, 26.807296752929688, 26.792959213256836], "compile_time": 1127.2602730896324, "verification_time": 0, "benchmark_time": 858.5121480282396, "GFLOP/s": 65.76886520410532, "strategy_time": 0.009478069841861725, "framework_time": 1.740936771966517, "timestamp": "2025-04-08 04:37:06.027609+00:00", "gridpoints/s": 4384591013.607021}, "4096,4096,2,32,9,6,4,10,4,0,0": {"grid_width": 4096, "grid_height": 4096, "block_size_x": 2, "block_size_y": 32, "tile_size_x": 9, "tile_size_y": 6, "temporal_tiling_factor": 4, "max_tfactor": 10, "loop_unroll_factor_t": 4, "sh_power": 0, "blocks_per_sm": 0, "time": 7.870764970779419, "times": [7.93174409866333, 7.861216068267822, 7.87337589263916, 7.858176231384277, 7.867392063140869, 7.882751941680908, 7.871488094329834, 7.868415832519531, 7.869440078735352, 7.879680156707764, 7.868415832519531, 7.8744001388549805, 7.855072021484375, 7.870463848114014, 7.875584125518799, 7.881728172302246, 7.860223770141602, 7.876607894897461, 7.862271785736084, 7.857151985168457, 7.862239837646484, 7.872511863708496, 7.868415832519531, 7.8724799156188965, 7.873536109924316, 7.871488094329834, 7.864319801330566, 7.863296031951904, 7.860223770141602, 7.869440078735352, 7.880703926086426, 7.860223770141602], "compile_time": 1009.3150699976832, "verification_time": 0, "benchmark_time": 253.06752999313176, "GFLOP/s": 127.89518728321472, "strategy_time": 0.00908703077584505, "framework_time": 1.5172690618783236, "timestamp": "2025-04-08 04:37:07.291550+00:00", "gridpoints/s": 8526345818.880981}, "4096,4096,8,32,1,8,3,10,1,1,0": {"grid_width": 4096, "grid_height": 4096, "block_size_x": 8, "block_size_y": 32, "tile_size_x": 1, "tile_size_y": 8, "temporal_tiling_factor": 3, "max_tfactor": 10, "loop_unroll_factor_t": 1, "sh_power": 1, "blocks_per_sm": 0, "time": 7.096199035644531, "times": [7.146495819091797, 7.10041618347168, 7.096288204193115, 7.096223831176758, 7.094272136688232, 7.096223831176758, 7.0951361656188965, 7.094272136688232, 7.094272136688232, 7.094272136688232, 7.0952959060668945, 7.094272136688232, 7.094272136688232, 7.098207950592041, 7.094272136688232, 7.094272136688232, 7.093247890472412, 7.094207763671875, 7.093247890472412, 7.09222412109375, 7.093247890472412, 7.093247890472412, 7.0951361656188965, 7.094272136688232, 7.094272136688232, 7.09222412109375, 7.0952959060668945, 7.094272136688232, 7.093247890472412, 7.093247890472412, 7.094272136688232, 7.094240188598633], "compile_time": 777.3371280636638, "verification_time": 0, "benchmark_time": 227.88195800967515, "GFLOP/s": 106.39142394509054, "strategy_time": 0.009496929123997688, "framework_time": 1.7382230143994093, "timestamp": "2025-04-08 04:37:08.298549+00:00", "gridpoints/s": 7092761596.339369}, "4096,4096,16,16,4,2,7,10,1,1,2": {"grid_width": 4096, "grid_height": 4096, "block_size_x": 16, "block_size_y": 16, "tile_size_x": 4, "tile_size_y": 2, "temporal_tiling_factor": 7, "max_tfactor": 10, "loop_unroll_factor_t": 1, "sh_power": 1, "blocks_per_sm": 2, "time": 14.001289904117584, "times": [14.053376197814941, 14.00819206237793, 14.000032424926758, 14.001152038574219, 14.000127792358398, 13.998080253601074, 13.999103546142578, 14.001055717468262, 14.000127792358398, 13.997088432312012, 14.000127792358398, 14.001152038574219, 13.999103546142578, 14.001152038574219, 13.999967575073242, 13.999008178710938, 14.000127792358398, 13.995903968811035, 13.999103546142578, 13.997056007385254, 14.003199577331543, 13.998047828674316, 13.999103546142578, 14.001152038574219, 13.999103546142578, 14.003199577331543, 13.99510383605957, 13.996031761169434, 13.998080253601074, 14.000032424926758, 13.999103546142578, 13.998080253601074], "compile_time": 766.8207559036091, "verification_time": 0, "benchmark_time": 449.9338159803301, "GFLOP/s": 125.81752767521338, "strategy_time": 0.009858980774879456, "framework_time": 1.5922992024570704, "timestamp": "2025-04-08 04:37:09.516935+00:00", "gridpoints/s": 8387835178.347559}, "4096,4096,2,16,2,9,9,10,1,0,2": {"grid_width": 4096, "grid_height": 4096, "block_size_x": 2, "block_size_y": 16, "tile_size_x": 2, "tile_size_y": 9, "temporal_tiling_factor": 9, "max_tfactor": 10, "loop_unroll_factor_t": 1, "sh_power": 0, "blocks_per_sm": 2, "time": 45.72862195968628, "times": [45.839359283447266, 45.75334548950195, 45.69500732421875, 45.700096130371094, 45.71955108642578, 45.73593521118164, 45.72150421142578, 45.76051330566406, 45.72159957885742, 45.704193115234375, 45.713409423828125, 45.7789421081543, 45.74809646606445, 45.75436782836914, 45.721473693847656, 45.736961364746094, 45.73478317260742, 45.70111846923828, 45.690879821777344, 45.720577239990234, 45.813758850097656, 45.7154541015625, 45.718528747558594, 45.74105453491211, 45.706241607666016, 45.6888313293457, 45.73683166503906, 45.71238327026367, 45.697025299072266, 45.711360931396484, 45.71955108642578, 45.70316696166992], "compile_time": 820.6657520495355, "verification_time": 0, "benchmark_time": 1464.8137090262026, "GFLOP/s": 49.529683225458356, "strategy_time": 0.009156996384263039, "framework_time": 1.4336829772219062, "timestamp": "2025-04-08 04:37:11.803888+00:00", "gridpoints/s": 3301978881.697224}, "4096,4096,2,16,5,3,9,10,1,1,0": {"grid_width": 4096, "grid_height": 4096, "block_size_x": 2, "block_size_y": 16, "tile_size_x": 5, "tile_size_y": 3, "temporal_tiling_factor": 9, "max_tfactor": 10, "loop_unroll_factor_t": 1, "sh_power": 1, "blocks_per_sm": 0, "time": 30.034857988357544, "times": [30.071807861328125, 30.048255920410156, 30.032896041870117, 30.031871795654297, 30.059520721435547, 30.043136596679688, 30.0296630859375, 30.041088104248047, 30.033920288085938, 30.032896041870117, 30.024703979492188, 30.025728225708008, 30.021631240844727, 30.035968780517578, 30.04003143310547, 30.01955223083496, 30.02777671813965, 30.044031143188477, 30.02777671813965, 30.02777671813965, 30.036991119384766, 30.029823303222656, 30.03913688659668, 30.042112350463867, 30.010271072387695, 30.038015365600586, 30.02777671813965, 30.02777671813965, 30.03990364074707, 30.032703399658203, 30.038015365600586, 30.032896041870117], "compile_time": 769.9889750219882, "verification_time": 0, "benchmark_time": 962.3138520400971, "GFLOP/s": 75.40985080994743, "strategy_time": 0.009437091648578644, "framework_time": 1.5397127717733383, "timestamp": "2025-04-08 04:37:13.537770+00:00", "gridpoints/s": 5027323387.329829}, "4096,4096,32,1,9,1,6,10,1,1,1": {"grid_width": 4096, "grid_height": 4096, "block_size_x": 32, "block_size_y": 1, "tile_size_x": 9, "tile_size_y": 1, "temporal_tiling_factor": 6, "max_tfactor": 10, "loop_unroll_factor_t": 1, "sh_power": 1, "blocks_per_sm": 1, "time": 74.73933863639832, "times": [74.76428985595703, 74.73343658447266, 74.73868560791016, 74.78169250488281, 74.7673568725586, 74.71100616455078, 74.6956787109375, 74.71513366699219, 74.69462585449219, 74.74873352050781, 74.72434997558594, 74.78067016601562, 74.73152160644531, 74.69363403320312, 74.80012512207031, 74.73356628417969, 74.75814056396484, 74.72428894042969, 74.77760314941406, 74.73049926757812, 74.73971557617188, 74.77040100097656, 74.81951904296875, 74.72128295898438, 74.69465637207031, 74.73766326904297, 74.70579528808594, 74.71001434326172, 74.68851470947266, 74.7663345336914, 74.76121520996094, 74.73868560791016], "compile_time": 767.6618810510263, "verification_time": 0, "benchmark_time": 2393.3152550598606, "GFLOP/s": 20.20287398241238, "strategy_time": 0.009307055734097958, "framework_time": 1.5453628730028868, "timestamp": "2025-04-08 04:37:16.700332+00:00", "gridpoints/s": 1346858265.4941587}, "4096,4096,64,1,5,3,3,10,3,0,4": {"grid_width": 4096, "grid_height": 4096, "block_size_x": 64, "block_size_y": 1, "tile_size_x": 5, "tile_size_y": 3, "temporal_tiling_factor": 3, "max_tfactor": 10, "loop_unroll_factor_t": 3, "sh_power": 0, "blocks_per_sm": 4, "time": 7.699124068021774, "times": [7.751743793487549, 7.70252799987793, 7.701504230499268, 7.699456214904785, 7.699456214904785, 7.697408199310303, 7.700479984283447, 7.692287921905518, 7.697408199310303, 7.6943359375, 7.6943359375, 7.699456214904785, 7.698272228240967, 7.69536018371582, 7.694143772125244, 7.698431968688965, 7.6943359375, 7.698431968688965, 7.701504230499268, 7.699295997619629, 7.6912641525268555, 7.697504043579102, 7.696383953094482, 7.69536018371582, 7.698431968688965, 7.701504230499268, 7.696383953094482, 7.69536018371582, 7.6943359375, 7.700448036193848, 7.69536018371582, 7.699456214904785], "compile_time": 889.2303740140051, "verification_time": 0, "benchmark_time": 247.31215997599065, "GFLOP/s": 98.05981996520606, "strategy_time": 0.010149087756872177, "framework_time": 1.7972229979932308, "timestamp": "2025-04-08 04:37:17.838714+00:00", "gridpoints/s": 6537321331.013737}, "4096,4096,8,4,5,6,10,10,1,0,4": {"grid_width": 4096, "grid_height": 4096, "block_size_x": 8, "block_size_y": 4, "tile_size_x": 5, "tile_size_y": 6, "temporal_tiling_factor": 10, "max_tfactor": 10, "loop_unroll_factor_t": 1, "sh_power": 0, "blocks_per_sm": 4, "time": 28.44895488023758, "times": [28.478464126586914, 28.457984924316406, 28.451839447021484, 28.452863693237305, 28.422271728515625, 28.446720123291016, 28.461055755615234, 28.450815200805664, 28.42937660217285, 28.447647094726562, 28.45689582824707, 28.446720123291016, 28.44758415222168, 28.4467830657959, 28.452863693237305, 28.451839447021484, 28.451839447021484, 28.445663452148438, 28.4517765045166, 28.455936431884766, 28.445695877075195, 28.444671630859375, 28.454912185668945, 28.445695877075195, 28.452863693237305, 28.444671630859375, 28.454912185668945, 28.443647384643555, 28.453887939453125, 28.449792861938477, 28.419071197509766, 28.449792861938477], "compile_time": 853.2364659477025, "verification_time": 0, "benchmark_time": 912.0293000014499, "GFLOP/s": 88.45957296477613, "strategy_time": 0.00902707688510418, "framework_time": 1.5320259844884276, "timestamp": "2025-04-08 04:37:19.605552+00:00", "gridpoints/s": 5897304864.318408}, "4096,4096,8,4,2,1,9,10,1,0,3": {"grid_width": 4096, "grid_height": 4096, "block_size_x": 8, "block_size_y": 4, "tile_size_x": 2, "tile_size_y": 1, "temporal_tiling_factor": 9, "max_tfactor": 10, "loop_unroll_factor_t": 1, "sh_power": 0, "blocks_per_sm": 3, "time": 98.84986162185669, "times": [98.8854751586914, 98.84259033203125, 98.84153747558594, 98.84159851074219, 98.84671783447266, 98.84758758544922, 98.84569549560547, 98.84457397460938, 98.84159851074219, 98.84966278076172, 98.84671783447266, 98.84774780273438, 98.84467315673828, 98.84877014160156, 98.8436508178711, 98.84774780273438, 98.84467315673828, 98.85286712646484, 98.8486099243164, 98.85491180419922, 98.8590087890625, 98.85798645019531, 98.85491180419922, 98.8590087890625, 98.85286712646484, 98.85286712646484, 98.8559341430664, 98.8497314453125, 98.85081481933594, 98.84671783447266, 98.85081481933594, 98.8375015258789], "compile_time": 805.5246679577976, "verification_time": 0, "benchmark_time": 3164.632778032683, "GFLOP/s": 22.912770163142067, "strategy_time": 0.009658047929406166, "framework_time": 1.4684769557788968, "timestamp": "2025-04-08 04:37:23.577216+00:00", "gridpoints/s": 1527518010.8761377}, "4096,4096,4,16,3,1,9,10,9,0,2": {"grid_width": 4096, "grid_height": 4096, "block_size_x": 4, "block_size_y": 16, "tile_size_x": 3, "tile_size_y": 1, "temporal_tiling_factor": 9, "max_tfactor": 10, "loop_unroll_factor_t": 9, "sh_power": 0, "blocks_per_sm": 2, "time": 39.99202072620392, "times": [40.050689697265625, 39.995391845703125, 39.990272521972656, 39.991294860839844, 39.988224029541016, 39.9892463684082, 39.990272521972656, 39.988224029541016, 39.993343353271484, 39.9892463684082, 39.9892463684082, 39.988128662109375, 39.98931121826172, 39.9911994934082, 39.991294860839844, 39.9870719909668, 39.98720169067383, 39.98723220825195, 39.99020767211914, 39.9892463684082, 39.988224029541016, 39.9892463684082, 39.9892463684082, 39.9923210144043, 39.991294860839844, 39.99225616455078, 39.991294860839844, 39.990272521972656, 39.9923210144043, 39.991294860839844, 39.990272521972656, 39.990272521972656], "compile_time": 1248.0236879782751, "verification_time": 0, "benchmark_time": 1281.8851470947266, "GFLOP/s": 56.634401534903105, "strategy_time": 0.010240008123219013, "framework_time": 1.8296749331057072, "timestamp": "2025-04-08 04:37:26.108997+00:00", "gridpoints/s": 3775626768.9935403}, "4096,4096,32,1,1,5,6,10,6,1,4": {"grid_width": 4096, "grid_height": 4096, "block_size_x": 32, "block_size_y": 1, "tile_size_x": 1, "tile_size_y": 5, "temporal_tiling_factor": 6, "max_tfactor": 10, "loop_unroll_factor_t": 6, "sh_power": 1, "blocks_per_sm": 4, "time": 31.88689911365509, "times": [31.942655563354492, 31.894527435302734, 31.886335372924805, 31.883264541625977, 31.883264541625977, 31.886335372924805, 31.884288787841797, 31.886335372924805, 31.883264541625977, 31.885183334350586, 31.884288787841797, 31.883264541625977, 31.884288787841797, 31.884288787841797, 31.882240295410156, 31.88310432434082, 31.884288787841797, 31.882240295410156, 31.886335372924805, 31.886335372924805, 31.884288787841797, 31.884288787841797, 31.888351440429688, 31.88719940185547, 31.886335372924805, 31.886335372924805, 31.8853759765625, 31.884288787841797, 31.884288787841797, 31.886335372924805, 31.884288787841797, 31.883264541625977], "compile_time": 960.0802019704133, "verification_time": 0, "benchmark_time": 1022.3899079719558, "GFLOP/s": 47.35328558032746, "strategy_time": 0.009897979907691479, "framework_time": 1.545884064398706, "timestamp": "2025-04-08 04:37:28.093054+00:00", "gridpoints/s": 3156885705.355164}, "4096,4096,96,1,4,1,4,10,1,0,1": {"grid_width": 4096, "grid_height": 4096, "block_size_x": 96, "block_size_y": 1, "tile_size_x": 4, "tile_size_y": 1, "temporal_tiling_factor": 4, "max_tfactor": 10, "loop_unroll_factor_t": 1, "sh_power": 0, "blocks_per_sm": 1, "time": 24.895114183425903, "times": [24.94361686706543, 24.898399353027344, 24.894399642944336, 24.89651107788086, 24.895488739013672, 24.89241600036621, 24.892255783081055, 24.89753532409668, 24.892480850219727, 24.889184951782227, 24.89241600036621, 24.89446449279785, 24.89344024658203, 24.89036750793457, 24.89446449279785, 24.89139175415039, 24.895488739013672, 24.89344024658203, 24.888288497924805, 24.895423889160156, 24.89344024658203, 24.89446449279785, 24.89334487915039, 24.89139175415039, 24.89344024658203, 24.895456314086914, 24.895488739013672, 24.89241600036621, 24.89241600036621, 24.89139175415039, 24.89446449279785, 24.89446449279785], "compile_time": 700.0878729159012, "verification_time": 0, "benchmark_time": 798.3867289731279, "GFLOP/s": 40.43496055423489, "strategy_time": 0.008646049536764622, "framework_time": 1.3654159847646952, "timestamp": "2025-04-08 04:37:29.592933+00:00", "gridpoints/s": 2695664036.9489927}, "4096,4096,16,2,4,9,2,10,1,1,0": {"grid_width": 4096, "grid_height": 4096, "block_size_x": 16, "block_size_y": 2, "tile_size_x": 4, "tile_size_y": 9, "temporal_tiling_factor": 2, "max_tfactor": 10, "loop_unroll_factor_t": 1, "sh_power": 1, "blocks_per_sm": 0, "time": 3.4649849757552147, "times": [3.521536111831665, 3.471359968185425, 3.4691519737243652, 3.462143898010254, 3.4641919136047363, 3.4662399291992188, 3.4609920978546143, 3.4611198902130127, 3.4611198902130127, 3.4662399291992188, 3.4641919136047363, 3.46726393699646, 3.458048105239868, 3.458048105239868, 3.467360019683838, 3.463167905807495, 3.4744319915771484, 3.46726393699646, 3.4590721130371094, 3.4600958824157715, 3.4600000381469727, 3.462143898010254, 3.4724481105804443, 3.462143898010254, 3.458048105239868, 3.4662399291992188, 3.4611198902130127, 3.458048105239868, 3.4611198902130127, 3.4549760818481445, 3.4600958824157715, 3.4600958824157715], "compile_time": 809.7373299533501, "verification_time": 0, "benchmark_time": 112.1882590232417, "GFLOP/s": 145.25791122378504, "strategy_time": 0.009948969818651676, "framework_time": 1.3702340656891465, "timestamp": "2025-04-08 04:37:30.516269+00:00", "gridpoints/s": 9683860748.252337}, "4096,4096,1,32,6,6,10,10,5,0,1": {"grid_width": 4096, "grid_height": 4096, "block_size_x": 1, "block_size_y": 32, "tile_size_x": 6, "tile_size_y": 6, "temporal_tiling_factor": 10, "max_tfactor": 10, "loop_unroll_factor_t": 5, "sh_power": 0, "blocks_per_sm": 1, "time": 52.550387263298035, "times": [62.1926383972168, 62.099456787109375, 62.12803268432617, 55.330814361572266, 51.43142318725586, 51.47340774536133, 51.408897399902344, 51.432254791259766, 51.37305450439453, 51.43027114868164, 51.45497512817383, 51.41196823120117, 51.40991973876953, 51.41913604736328, 51.44166564941406, 51.4334716796875, 51.40787124633789, 51.410945892333984, 51.42323303222656, 51.3361930847168, 51.44166564941406, 51.44166564941406, 51.418113708496094, 51.451904296875, 51.4252815246582, 51.43040084838867, 51.42118453979492, 51.44166564941406, 51.44678497314453, 51.42425537109375, 51.39353561401367, 51.42630386352539], "compile_time": 1122.3470679251477, "verification_time": 0, "benchmark_time": 1683.1915410002694, "GFLOP/s": 47.88894109173612, "strategy_time": 0.009857933036983013, "framework_time": 1.6018491005524993, "timestamp": "2025-04-08 04:37:33.323450+00:00", "gridpoints/s": 3192596072.782408}, "4096,4096,64,1,2,7,1,10,1,1,3": {"grid_width": 4096, "grid_height": 4096, "block_size_x": 64, "block_size_y": 1, "tile_size_x": 2, "tile_size_y": 7, "temporal_tiling_factor": 1, "max_tfactor": 10, "loop_unroll_factor_t": 1, "sh_power": 1, "blocks_per_sm": 3, "time": 1.4781699925661087, "times": [1.5278079509735107, 1.4776320457458496, 1.4714879989624023, 1.4766080379486084, 1.474560022354126, 1.4725120067596436, 1.4725120067596436, 1.4755840301513672, 1.4735360145568848, 1.474560022354126, 1.4735360145568848, 1.4725120067596436, 1.4723199605941772, 1.4704639911651611, 1.474560022354126, 1.4725120067596436, 1.4735360145568848, 1.4714879989624023, 1.4725120067596436, 1.4704639911651611, 1.4796799421310425, 1.4827519655227661, 1.4837759733200073, 1.4796799421310425, 1.481727957725525, 1.4776320457458496, 1.481727957725525, 1.4837759733200073, 1.481727957725525, 1.4827519655227661, 1.4837759733200073, 1.481727957725525], "compile_time": 732.1953390492126, "verification_time": 0, "benchmark_time": 48.206474049948156, "GFLOP/s": 170.24986386249145, "strategy_time": 0.00969890970736742, "framework_time": 1.4844960533082485, "timestamp": "2025-04-08 04:37:34.105376+00:00", "gridpoints/s": 11349990924.166098}, "4096,4096,64,1,10,1,1,10,1,0,2": {"grid_width": 4096, "grid_height": 4096, "block_size_x": 64, "block_size_y": 1, "tile_size_x": 10, "tile_size_y": 1, "temporal_tiling_factor": 1, "max_tfactor": 10, "loop_unroll_factor_t": 1, "sh_power": 0, "blocks_per_sm": 2, "time": 1.5856459736824036, "times": [1.6293120384216309, 1.5830399990081787, 1.5790079832077026, 1.5779839754104614, 1.5779839754104614, 1.5769599676132202, 1.5769599676132202, 1.5769599676132202, 1.5778239965438843, 1.5779839754104614, 1.576799988746643, 1.5781439542770386, 1.5769599676132202, 1.5769599676132202, 1.5768320560455322, 1.5769280195236206, 1.5841280221939087, 1.5911999940872192, 1.5923199653625488, 1.5902719497680664, 1.5902719497680664, 1.5902719497680664, 1.5912959575653076, 1.5902719497680664, 1.5902719497680664, 1.5911359786987305, 1.5902719497680664, 1.5902719497680664, 1.5902719497680664, 1.5902719497680664, 1.5902719497680664, 1.5912319421768188], "compile_time": 754.0725299622864, "verification_time": 0, "benchmark_time": 51.73765204381198, "GFLOP/s": 158.7102317773777, "strategy_time": 0.010119052603840828, "framework_time": 1.487472909502685, "timestamp": "2025-04-08 04:37:34.912713+00:00", "gridpoints/s": 10580682118.491846}, "4096,4096,2,32,5,3,8,10,8,0,3": {"grid_width": 4096, "grid_height": 4096, "block_size_x": 2, "block_size_y": 32, "tile_size_x": 5, "tile_size_y": 3, "temporal_tiling_factor": 8, "max_tfactor": 10, "loop_unroll_factor_t": 8, "sh_power": 0, "blocks_per_sm": 3, "time": 22.8863622546196, "times": [26.703872680664062, 26.631168365478516, 26.600448608398438, 26.599424362182617, 26.596351623535156, 26.599424362182617, 22.63654327392578, 21.998592376708984, 22.000640869140625, 21.995519638061523, 21.998592376708984, 21.997568130493164, 21.997568130493164, 22.000640869140625, 22.002687454223633, 22.003711700439453, 21.999616622924805, 21.999616622924805, 21.997535705566406, 22.003711700439453, 21.998592376708984, 21.999616622924805, 21.999616622924805, 22.003711700439453, 21.99945640563965, 22.000640869140625, 21.999616622924805, 21.998592376708984, 22.001663208007812, 21.998592376708984, 21.999616622924805, 22.000640869140625], "compile_time": 1170.1022270135581, "verification_time": 0, "benchmark_time": 734.2722149332985, "GFLOP/s": 87.9679303159515, "strategy_time": 0.00939809251576662, "framework_time": 1.5902159502729774, "timestamp": "2025-04-08 04:37:36.818719+00:00", "gridpoints/s": 5864528687.730101}, "4096,4096,4,8,5,2,5,10,5,0,3": {"grid_width": 4096, "grid_height": 4096, "block_size_x": 4, "block_size_y": 8, "tile_size_x": 5, "tile_size_y": 2, "temporal_tiling_factor": 5, "max_tfactor": 10, "loop_unroll_factor_t": 5, "sh_power": 0, "blocks_per_sm": 3, "time": 12.240167111158371, "times": [12.295167922973633, 12.24499225616455, 12.24176025390625, 12.238847732543945, 12.238688468933105, 12.239871978759766, 12.238847732543945, 12.2357759475708, 12.238688468933105, 12.237824440002441, 12.237824440002441, 12.236800193786621, 12.239871978759766, 12.237824440002441, 12.2357759475708, 12.236800193786621, 12.240896224975586, 12.236800193786621, 12.239871978759766, 12.238847732543945, 12.236800193786621, 12.239871978759766, 12.238847732543945, 12.236800193786621, 12.237824440002441, 12.238847732543945, 12.236639976501465, 12.236800193786621, 12.236800193786621, 12.237792015075684, 12.238719940185547, 12.237824440002441], "compile_time": 1002.3710749810562, "verification_time": 0, "benchmark_time": 393.0967199848965, "GFLOP/s": 102.8001651099124, "strategy_time": 0.009819050319492817, "framework_time": 1.4340740162879229, "timestamp": "2025-04-08 04:37:38.215662+00:00", "gridpoints/s": 6853344340.660827}, "4096,4096,4,16,3,1,6,10,3,1,4": {"grid_width": 4096, "grid_height": 4096, "block_size_x": 4, "block_size_y": 16, "tile_size_x": 3, "tile_size_y": 1, "temporal_tiling_factor": 6, "max_tfactor": 10, "loop_unroll_factor_t": 3, "sh_power": 1, "blocks_per_sm": 4, "time": 21.59829807281494, "times": [21.64735984802246, 21.604352951049805, 21.598175048828125, 21.597152709960938, 21.595136642456055, 21.596160888671875, 21.596160888671875, 21.595136642456055, 21.596160888671875, 21.597183227539062, 21.596160888671875, 21.598207473754883, 21.596160888671875, 21.597183227539062, 21.592063903808594, 21.59401512145996, 21.593088150024414, 21.595136642456055, 21.593088150024414, 21.596160888671875, 21.598207473754883, 21.596160888671875, 21.597183227539062, 21.596160888671875, 21.59712028503418, 21.597183227539062, 21.597183227539062, 21.598207473754883, 21.597183227539062, 21.599231719970703, 21.600255966186523, 21.59721565246582], "compile_time": 880.5478559806943, "verification_time": 0, "benchmark_time": 692.4456109991297, "GFLOP/s": 69.9105751253856, "strategy_time": 0.010319054126739502, "framework_time": 1.518751960247755, "timestamp": "2025-04-08 04:37:39.790217+00:00", "gridpoints/s": 4660705008.35904}, "4096,4096,32,2,2,2,1,10,1,0,4": {"grid_width": 4096, "grid_height": 4096, "block_size_x": 32, "block_size_y": 2, "tile_size_x": 2, "tile_size_y": 2, "temporal_tiling_factor": 1, "max_tfactor": 10, "loop_unroll_factor_t": 1, "sh_power": 0, "blocks_per_sm": 4, "time": 1.4988350123167038, "times": [1.5441919565200806, 1.4970879554748535, 1.4929920434951782, 1.491968035697937, 1.4939199686050415, 1.4928959608078003, 1.4929920434951782, 1.491968035697937, 1.491968035697937, 1.491968035697937, 1.491968035697937, 1.491968035697937, 1.491968035697937, 1.4918080568313599, 1.491968035697937, 1.491968035697937, 1.491871953010559, 1.491968035697937, 1.4909440279006958, 1.4981119632720947, 1.504256010055542, 1.5052800178527832, 1.5052800178527832, 1.504256010055542, 1.504256010055542, 1.504256010055542, 1.5052800178527832, 1.504256010055542, 1.5052800178527832, 1.5052800178527832, 1.504256010055542, 1.5042879581451416], "compile_time": 743.5993599938229, "verification_time": 0, "benchmark_time": 49.81821007095277, "GFLOP/s": 167.90256294521666, "strategy_time": 0.009928946383297443, "framework_time": 1.5416051028296351, "timestamp": "2025-04-08 04:37:40.585217+00:00", "gridpoints/s": 11193504196.347776}, "4096,4096,384,1,1,1,7,10,7,0,2": {"grid_width": 4096, "grid_height": 4096, "block_size_x": 384, "block_size_y": 1, "tile_size_x": 1, "tile_size_y": 1, "temporal_tiling_factor": 7, "max_tfactor": 10, "loop_unroll_factor_t": 7, "sh_power": 0, "blocks_per_sm": 2, "time": 78.3128821849823, "times": [78.34419250488281, 78.2745590209961, 78.2479019165039, 78.32064056396484, 78.24998474121094, 78.39027404785156, 78.36653137207031, 78.30630493164062, 78.32064056396484, 78.32268524169922, 78.271484375, 78.22541046142578, 78.27241516113281, 78.34521484375, 78.33293151855469, 78.28582763671875, 78.27763366699219, 78.34614562988281, 78.31961822509766, 78.35238647460938, 78.35238647460938, 78.34521484375, 78.28070068359375, 78.2929916381836, 78.271484375, 78.32064056396484, 78.33087921142578, 78.33599853515625, 78.35234832763672, 78.28479766845703, 78.33805084228516, 78.33395385742188], "compile_time": 737.0611149817705, "verification_time": 0, "benchmark_time": 2507.7650559833273, "GFLOP/s": 22.494481506106737, "strategy_time": 0.009777955710887909, "framework_time": 1.5230500139296055, "timestamp": "2025-04-08 04:37:43.831607+00:00", "gridpoints/s": 1499632100.407116}, "4096,4096,2,16,3,6,7,10,1,0,0": {"grid_width": 4096, "grid_height": 4096, "block_size_x": 2, "block_size_y": 16, "tile_size_x": 3, "tile_size_y": 6, "temporal_tiling_factor": 7, "max_tfactor": 10, "loop_unroll_factor_t": 1, "sh_power": 0, "blocks_per_sm": 0, "time": 22.795954048633575, "times": [22.847488403320312, 22.802431106567383, 22.803552627563477, 22.794240951538086, 22.798336029052734, 22.777856826782227, 22.796287536621094, 22.791168212890625, 22.796255111694336, 22.796287536621094, 22.794240951538086, 22.802303314208984, 22.790143966674805, 22.790143966674805, 22.791168212890625, 22.788991928100586, 22.787904739379883, 22.798336029052734, 22.791168212890625, 22.795263290405273, 22.793216705322266, 22.797311782836914, 22.79315185546875, 22.790143966674805, 22.801408767700195, 22.791168212890625, 22.781951904296875, 22.788095474243164, 22.799360275268555, 22.798336029052734, 22.804479598999023, 22.798336029052734], "compile_time": 821.8293800018728, "verification_time": 0, "benchmark_time": 730.8522160165012, "GFLOP/s": 77.27720788705456, "strategy_time": 0.010258983820676804, "framework_time": 1.4983940636739135, "timestamp": "2025-04-08 04:37:45.385830+00:00", "gridpoints/s": 5151813859.136971}, "4096,4096,16,2,7,9,7,10,7,0,0": {"grid_width": 4096, "grid_height": 4096, "block_size_x": 16, "block_size_y": 2, "tile_size_x": 7, "tile_size_y": 9, "temporal_tiling_factor": 7, "max_tfactor": 10, "loop_unroll_factor_t": 7, "sh_power": 0, "blocks_per_sm": 0, "time": 21.602801024913788, "times": [21.68524742126465, 21.593088150024414, 21.584896087646484, 21.603328704833984, 21.60425567626953, 21.609472274780273, 21.619712829589844, 21.572608947753906, 21.574655532836914, 21.602304458618164, 21.624832153320312, 21.575679779052734, 21.617664337158203, 21.604352951049805, 21.561344146728516, 21.61030387878418, 21.608287811279297, 21.606399536132812, 21.605375289916992, 21.586944580078125, 21.617664337158203, 21.579776763916016, 21.601280212402344, 21.594112396240234, 21.599231719970703, 21.62892723083496, 21.597183227539062, 21.597183227539062, 21.617631912231445, 21.588991165161133, 21.619712829589844, 21.597183227539062], "compile_time": 1229.1999920271337, "verification_time": 0, "benchmark_time": 692.9243271006271, "GFLOP/s": 81.54533655003334, "strategy_time": 0.009467941708862782, "framework_time": 1.5049359062686563, "timestamp": "2025-04-08 04:37:47.309499+00:00", "gridpoints/s": 5436355770.002223}, "4096,4096,8,8,5,1,4,10,2,1,2": {"grid_width": 4096, "grid_height": 4096, "block_size_x": 8, "block_size_y": 8, "tile_size_x": 5, "tile_size_y": 1, "temporal_tiling_factor": 4, "max_tfactor": 10, "loop_unroll_factor_t": 2, "sh_power": 1, "blocks_per_sm": 2, "time": 9.830322116613388, "times": [9.886719703674316, 9.834367752075195, 9.830400466918945, 9.827327728271484, 9.828351974487305, 9.82630443572998, 9.827424049377441, 9.828255653381348, 9.82636833190918, 9.829376220703125, 9.828351974487305, 9.82630443572998, 9.830400466918945, 9.829312324523926, 9.828351974487305, 9.828351974487305, 9.829279899597168, 9.828351974487305, 9.828351974487305, 9.828351974487305, 9.82630443572998, 9.827168464660645, 9.827263832092285, 9.830400466918945, 9.828351974487305, 9.82630443572998, 9.828351974487305, 9.828351974487305, 9.829376220703125, 9.829376220703125, 9.830400466918945, 9.828351974487305], "compile_time": 784.2227329965681, "verification_time": 0, "benchmark_time": 316.62596308160573, "GFLOP/s": 102.40081129170483, "strategy_time": 0.009507988579571247, "framework_time": 1.6035899752750993, "timestamp": "2025-04-08 04:37:48.411994+00:00", "gridpoints/s": 6826720752.780322}, "4096,4096,8,16,4,2,8,10,4,0,3": {"grid_width": 4096, "grid_height": 4096, "block_size_x": 8, "block_size_y": 16, "tile_size_x": 4, "tile_size_y": 2, "temporal_tiling_factor": 8, "max_tfactor": 10, "loop_unroll_factor_t": 4, "sh_power": 0, "blocks_per_sm": 3, "time": 18.306703090667725, "times": [18.355199813842773, 18.305023193359375, 18.30191993713379, 18.308095932006836, 18.307071685791016, 18.30611228942871, 18.310144424438477, 18.30396842956543, 18.306047439575195, 18.307071685791016, 18.306047439575195, 18.304000854492188, 18.304832458496094, 18.304000854492188, 18.305023193359375, 18.306047439575195, 18.304000854492188, 18.302976608276367, 18.301952362060547, 18.304895401000977, 18.304000854492188, 18.304895401000977, 18.307071685791016, 18.304927825927734, 18.307071685791016, 18.308095932006836, 18.304000854492188, 18.304000854492188, 18.304000854492188, 18.302976608276367, 18.300928115844727, 18.308095932006836], "compile_time": 981.7680079722777, "verification_time": 0, "benchmark_time": 586.8753270478919, "GFLOP/s": 109.9742487781052, "strategy_time": 0.009939074516296387, "framework_time": 1.3189089950174093, "timestamp": "2025-04-08 04:37:49.981996+00:00", "gridpoints/s": 7331616585.207014}, "4096,4096,16,4,9,2,5,10,1,1,1": {"grid_width": 4096, "grid_height": 4096, "block_size_x": 16, "block_size_y": 4, "tile_size_x": 9, "tile_size_y": 2, "temporal_tiling_factor": 5, "max_tfactor": 10, "loop_unroll_factor_t": 1, "sh_power": 1, "blocks_per_sm": 1, "time": 12.594731003046036, "times": [12.621824264526367, 12.586976051330566, 12.604415893554688, 12.600319862365723, 12.579968452453613, 12.604415893554688, 12.607487678527832, 12.605376243591309, 12.578816413879395, 12.597248077392578, 12.603391647338867, 12.592991828918457, 12.598272323608398, 12.592032432556152, 12.57158374786377, 12.594176292419434, 12.590080261230469, 12.589056015014648, 12.595199584960938, 12.60531234741211, 12.56550407409668, 12.595199584960938, 12.585984230041504, 12.576736450195312, 12.591072082519531, 12.608511924743652, 12.607487678527832, 12.595135688781738, 12.58687973022461, 12.596223831176758, 12.608511924743652, 12.595199584960938], "compile_time": 780.4663330316544, "verification_time": 0, "benchmark_time": 404.4778790557757, "GFLOP/s": 99.90615914668462, "strategy_time": 0.00964803621172905, "framework_time": 1.513692899607122, "timestamp": "2025-04-08 04:37:51.168496+00:00", "gridpoints/s": 6660410609.778975}, "4096,4096,16,8,1,4,7,10,7,0,0": {"grid_width": 4096, "grid_height": 4096, "block_size_x": 16, "block_size_y": 8, "tile_size_x": 1, "tile_size_y": 4, "temporal_tiling_factor": 7, "max_tfactor": 10, "loop_unroll_factor_t": 7, "sh_power": 0, "blocks_per_sm": 0, "time": 21.511301159858704, "times": [21.562368392944336, 21.5152645111084, 21.50809669494629, 21.510143280029297, 21.50604820251465, 21.50912094116211, 21.50998306274414, 21.50809669494629, 21.50809669494629, 21.50912094116211, 21.511167526245117, 21.50908851623535, 21.50809669494629, 21.50809669494629, 21.50912094116211, 21.50998306274414, 21.511167526245117, 21.512191772460938, 21.50809669494629, 21.508960723876953, 21.5100154876709, 21.511104583740234, 21.509056091308594, 21.510143280029297, 21.510143280029297, 21.510143280029297, 21.513216018676758, 21.50809669494629, 21.50809669494629, 21.511072158813477, 21.510143280029297, 21.50809669494629], "compile_time": 1124.4808210758492, "verification_time": 0, "benchmark_time": 689.9862790014595, "GFLOP/s": 81.8921954980231, "strategy_time": 0.00928796362131834, "framework_time": 1.4984429581090808, "timestamp": "2025-04-08 04:37:52.984503+00:00", "gridpoints/s": 5459479699.868207}, "4096,4096,8,16,5,2,2,10,1,0,1": {"grid_width": 4096, "grid_height": 4096, "block_size_x": 8, "block_size_y": 16, "tile_size_x": 5, "tile_size_y": 2, "temporal_tiling_factor": 2, "max_tfactor": 10, "loop_unroll_factor_t": 1, "sh_power": 0, "blocks_per_sm": 1, "time": 3.322643004357815, "times": [3.373055934906006, 3.3269760608673096, 3.3228800296783447, 3.3228800296783447, 3.3228800296783447, 3.3218560218811035, 3.3218560218811035, 3.3216640949249268, 3.3218560218811035, 3.3208320140838623, 3.319808006286621, 3.319711923599243, 3.3217599391937256, 3.3207359313964844, 3.3208320140838623, 3.3218560218811035, 3.3208320140838623, 3.319808006286621, 3.319808006286621, 3.3198719024658203, 3.3208320140838623, 3.319808006286621, 3.3208320140838623, 3.319808006286621, 3.3208320140838623, 3.3208320140838623, 3.3207359313964844, 3.319808006286621, 3.31878399848938, 3.319904088973999, 3.319808006286621, 3.3208320140838623], "compile_time": 821.7349339975044, "verification_time": 0, "benchmark_time": 107.99018305260688, "GFLOP/s": 151.4807577401108, "strategy_time": 0.009367009624838829, "framework_time": 1.6095410101115704, "timestamp": "2025-04-08 04:37:53.915879+00:00", "gridpoints/s": 10098717182.674051}, "4096,4096,64,2,1,10,7,10,1,0,4": {"grid_width": 4096, "grid_height": 4096, "block_size_x": 64, "block_size_y": 2, "tile_size_x": 1, "tile_size_y": 10, "temporal_tiling_factor": 7, "max_tfactor": 10, "loop_unroll_factor_t": 1, "sh_power": 0, "blocks_per_sm": 4, "time": 18.3120139837265, "times": [18.337791442871094, 18.319360733032227, 18.316287994384766, 18.286399841308594, 18.318239212036133, 18.314239501953125, 18.310144424438477, 18.330623626708984, 18.311168670654297, 18.290687561035156, 18.294784545898438, 18.314239501953125, 18.316287994384766, 18.289663314819336, 18.315263748168945, 18.314239501953125, 18.284543991088867, 18.312192916870117, 18.311168670654297, 18.316287994384766, 18.317312240600586, 18.314239501953125, 18.318336486816406, 18.316287994384766, 18.318239212036133, 18.327552795410156, 18.312192916870117, 18.290687561035156, 18.315263748168945, 18.313215255737305, 18.31100845336914, 18.326496124267578], "compile_time": 818.2781839277595, "verification_time": 0, "benchmark_time": 587.0848790509626, "GFLOP/s": 96.19955956594963, "strategy_time": 0.009687966667115688, "framework_time": 1.4861220261082053, "timestamp": "2025-04-08 04:37:55.322769+00:00", "gridpoints/s": 6413303971.063309}, "4096,4096,32,4,1,9,6,10,2,1,0": {"grid_width": 4096, "grid_height": 4096, "block_size_x": 32, "block_size_y": 4, "tile_size_x": 1, "tile_size_y": 9, "temporal_tiling_factor": 6, "max_tfactor": 10, "loop_unroll_factor_t": 2, "sh_power": 1, "blocks_per_sm": 0, "time": 17.55847316980362, "times": [17.612607955932617, 17.565568923950195, 17.562623977661133, 17.556480407714844, 17.556480407714844, 17.557504653930664, 17.553407669067383, 17.553407669067383, 17.556480407714844, 17.556480407714844, 17.558528900146484, 17.55344009399414, 17.552383422851562, 17.55023956298828, 17.559423446655273, 17.554431915283203, 17.55743980407715, 17.557632446289062, 17.558528900146484, 17.558528900146484, 17.554431915283203, 17.556447982788086, 17.558528900146484, 17.555456161499023, 17.556415557861328, 17.55526351928711, 17.555456161499023, 17.561599731445312, 17.558528900146484, 17.553407669067383, 17.556480407714844, 17.557504653930664], "compile_time": 793.4562820009887, "verification_time": 0, "benchmark_time": 563.7428170302883, "GFLOP/s": 85.9954863613513, "strategy_time": 0.00964803621172905, "framework_time": 1.4892569743096828, "timestamp": "2025-04-08 04:37:56.681497+00:00", "gridpoints/s": 5733032424.090087}, "4096,4096,32,2,8,4,4,10,1,0,1": {"grid_width": 4096, "grid_height": 4096, "block_size_x": 32, "block_size_y": 2, "tile_size_x": 8, "tile_size_y": 4