compare_real_world_impact/results/hotspot/A4000_f=pyatf_i=3.json
{"device_name": "NVIDIA RTX A4000", "kernel_name": "calculate_temp", "problem_size": [4096, 4096], "tune_params_keys": ["grid_width", "grid_height", "block_size_x", "block_size_y", "tile_size_x", "tile_size_y", "temporal_tiling_factor", "max_tfactor", "loop_unroll_factor_t", "sh_power", "blocks_per_sm"], "tune_params": {"grid_width": [4096], "grid_height": [4096], "block_size_x": [1, 2, 4, 8, 16, 32, 64, 96, 128, 160, 192, 224, 256, 288, 320, 352, 384, 416, 448, 480, 512, 544, 576, 608, 640, 672, 704, 736, 768, 800, 832, 864, 896, 928, 960, 992, 1024], "block_size_y": [1, 2, 4, 8, 16, 32], "tile_size_x": [1, 2, 3, 4, 5, 6, 7, 8, 9, 10], "tile_size_y": [1, 2, 3, 4, 5, 6, 7, 8, 9, 10], "temporal_tiling_factor": [1, 2, 3, 4, 5, 6, 7, 8, 9, 10], "max_tfactor": [10], "loop_unroll_factor_t": [1, 2, 3, 4, 5, 6, 7, 8, 9, 10], "sh_power": [0, 1], "blocks_per_sm": [0, 1, 2, 3, 4]}, "objective": "GFLOP/s", "cache": {"4096,4096,1,32,8,2,6,10,6,1,1": {"grid_width": 4096, "grid_height": 4096, "block_size_x": 1, "block_size_y": 32, "tile_size_x": 8, "tile_size_y": 2, "temporal_tiling_factor": 6, "max_tfactor": 10, "loop_unroll_factor_t": 6, "sh_power": 1, "blocks_per_sm": 1, "time": 19.26137000322342, "times": [19.302400588989258, 19.263551712036133, 19.25836753845215, 19.272703170776367, 19.25529670715332, 19.275680541992188, 19.25836753845215, 19.266559600830078, 19.25017547607422, 19.25836753845215, 19.252159118652344, 19.25529670715332, 19.26348876953125, 19.25632095336914, 19.25017547607422, 19.27052879333496, 19.2675838470459, 19.257343292236328, 19.263423919677734, 19.25529670715332, 19.26963233947754, 19.25119972229004, 19.25119972229004, 19.25836753845215, 19.25529670715332, 19.270784378051758, 19.26038360595703, 19.25836753845215, 19.26144027709961, 19.25324821472168, 19.25324821472168, 19.2675838470459], "compile_time": 944.52335301321, "verification_time": 0, "benchmark_time": 617.6948589272797, "GFLOP/s": 78.3926293792865, "strategy_time": 1074065.2146039065, "framework_time": 0, "timestamp": "2025-04-08 00:13:58.466615+00:00", "gridpoints/s": 5226175291.952434}, "4096,4096,128,2,1,7,1,10,1,1,4": {"grid_width": 4096, "grid_height": 4096, "block_size_x": 128, "block_size_y": 2, "tile_size_x": 1, "tile_size_y": 7, "temporal_tiling_factor": 1, "max_tfactor": 10, "loop_unroll_factor_t": 1, "sh_power": 1, "blocks_per_sm": 4, "time": 1.441258992999792, "times": [1.4959360361099243, 1.44486403465271, 1.4407680034637451, 1.4416320323944092, 1.4407680034637451, 1.439743995666504, 1.4387199878692627, 1.4396159648895264, 1.4387199878692627, 1.4407680034637451, 1.439743995666504, 1.4387199878692627, 1.439743995666504, 1.4385919570922852, 1.4387199878692627, 1.4387199878692627, 1.4387199878692627, 1.4407680034637451, 1.4387199878692627, 1.4387199878692627, 1.439743995666504, 1.4387199878692627, 1.4387199878692627, 1.4396159648895264, 1.4376959800720215, 1.4387199878692627, 1.4387199878692627, 1.4387199878692627, 1.4376959800720215, 1.439743995666504, 1.439743995666504, 1.439743995666504], "compile_time": 731.0328350868076, "verification_time": 0, "benchmark_time": 48.109019990079105, "GFLOP/s": 174.61000501804762, "strategy_time": 0.008285976946353912, "framework_time": 40.42199288960546, "timestamp": "2025-04-08 00:13:59.286219+00:00", "gridpoints/s": 11640667001.203175}, "4096,4096,32,4,2,3,6,10,1,0,1": {"grid_width": 4096, "grid_height": 4096, "block_size_x": 32, "block_size_y": 4, "tile_size_x": 2, "tile_size_y": 3, "temporal_tiling_factor": 6, "max_tfactor": 10, "loop_unroll_factor_t": 1, "sh_power": 0, "blocks_per_sm": 1, "time": 16.56083995103836, "times": [16.60927963256836, 16.564224243164062, 16.562175750732422, 16.566272735595703, 16.5611515045166, 16.562175750732422, 16.56505584716797, 16.563199996948242, 16.562143325805664, 16.563199996948242, 16.562175750732422, 16.563199996948242, 16.565248489379883, 16.562175750732422, 16.58470344543457, 16.559104919433594, 16.555007934570312, 16.5548152923584, 16.556032180786133, 16.552831649780273, 16.554912567138672, 16.550912857055664, 16.557056427001953, 16.555007934570312, 16.552831649780273, 16.557056427001953, 16.553983688354492, 16.553983688354492, 16.555007934570312, 16.552959442138672, 16.553983688354492, 16.555007934570312], "compile_time": 826.5012709889561, "verification_time": 0, "benchmark_time": 531.6147929988801, "GFLOP/s": 91.17589714435508, "strategy_time": 0.008306000381708145, "framework_time": 1.4821930089965463, "timestamp": "2025-04-08 00:14:00.645857+00:00", "gridpoints/s": 6078393142.957005}, "4096,4096,16,8,3,2,6,10,6,0,4": {"grid_width": 4096, "grid_height": 4096, "block_size_x": 16, "block_size_y": 8, "tile_size_x": 3, "tile_size_y": 2, "temporal_tiling_factor": 6, "max_tfactor": 10, "loop_unroll_factor_t": 6, "sh_power": 0, "blocks_per_sm": 4, "time": 23.183986008167267, "times": [23.197696685791016, 23.147520065307617, 23.140352249145508, 23.143360137939453, 23.141376495361328, 23.14240074157715, 23.145376205444336, 23.144447326660156, 23.144512176513672, 23.149568557739258, 23.143423080444336, 23.143423080444336, 23.146495819091797, 23.145471572875977, 23.14240074157715, 23.20368003845215, 23.31443214416504, 23.31443214416504, 23.23651123046875, 23.199743270874023, 23.199743270874023, 23.206911087036133, 23.199647903442383, 23.197696685791016, 23.205888748168945, 23.196672439575195, 23.195648193359375, 23.199743270874023, 23.199743270874023, 23.197696685791016, 23.197696685791016, 23.203840255737305], "compile_time": 1066.0060310037807, "verification_time": 0, "benchmark_time": 742.9091199301183, "GFLOP/s": 65.12898340553149, "strategy_time": 0.006741960532963276, "framework_time": 1.5725531848147511, "timestamp": "2025-04-08 00:14:02.456381+00:00", "gridpoints/s": 4341932227.035433}, "4096,4096,32,1,4,7,8,10,1,1,0": {"grid_width": 4096, "grid_height": 4096, "block_size_x": 32, "block_size_y": 1, "tile_size_x": 4, "tile_size_y": 7, "temporal_tiling_factor": 8, "max_tfactor": 10, "loop_unroll_factor_t": 1, "sh_power": 1, "blocks_per_sm": 0, "time": 34.683180928230286, "times": [34.744319915771484, 34.725887298583984, 34.729984283447266, 34.64806365966797, 34.66640090942383, 34.66239929199219, 34.68492889404297, 34.674686431884766, 34.6286735534668, 34.6429443359375, 34.702335357666016, 34.66854476928711, 34.71769714355469, 34.713600158691406, 34.6511344909668, 34.709503173828125, 34.67571258544922, 34.61836624145508, 34.72275161743164, 34.66649627685547, 34.720767974853516, 34.62636947631836, 34.665409088134766, 34.6879997253418, 34.695167541503906, 34.7053108215332, 34.68902587890625, 34.68083190917969, 34.705345153808594, 34.683902740478516, 34.639774322509766, 34.707454681396484], "compile_time": 805.478089954704, "verification_time": 0, "benchmark_time": 1111.4045180147514, "GFLOP/s": 58.04732628665288, "strategy_time": 0.007804017513990402, "framework_time": 1.4599820133298635, "timestamp": "2025-04-08 00:14:04.374767+00:00", "gridpoints/s": 3869821752.443526}, "4096,4096,64,1,1,7,8,10,8,1,4": {"grid_width": 4096, "grid_height": 4096, "block_size_x": 64, "block_size_y": 1, "tile_size_x": 1, "tile_size_y": 7, "temporal_tiling_factor": 8, "max_tfactor": 10, "loop_unroll_factor_t": 8, "sh_power": 1, "blocks_per_sm": 4, "time": 32.92386066913605, "times": [32.974815368652344, 32.954368591308594, 32.917503356933594, 32.9277458190918, 32.92057418823242, 32.90214538574219, 32.905216217041016, 32.921600341796875, 32.92057418823242, 32.92262268066406, 32.92262268066406, 32.9062385559082, 32.94105529785156, 32.9093132019043, 32.92243194580078, 32.93183898925781, 32.932830810546875, 32.92057418823242, 32.91340637207031, 32.9246711730957, 32.91136169433594, 32.92979049682617, 32.912384033203125, 32.9246711730957, 32.917503356933594, 32.92262268066406, 32.91136169433594, 32.93891143798828, 32.923648834228516, 32.925697326660156, 32.91545486450195, 32.937984466552734], "compile_time": 1064.8920459207147, "verification_time": 0, "benchmark_time": 1054.7031390015036, "GFLOP/s": 61.14914469575873, "strategy_time": 0.008316012099385262, "framework_time": 1.4313880819827318, "timestamp": "2025-04-08 00:14:06.495834+00:00", "gridpoints/s": 4076609646.3839154}, "4096,4096,64,2,2,5,6,10,3,1,0": {"grid_width": 4096, "grid_height": 4096, "block_size_x": 64, "block_size_y": 2, "tile_size_x": 2, "tile_size_y": 5, "temporal_tiling_factor": 6, "max_tfactor": 10, "loop_unroll_factor_t": 3, "sh_power": 1, "blocks_per_sm": 0, "time": 16.06056296825409, "times": [16.119808197021484, 16.070655822753906, 16.060415267944336, 16.059423446655273, 16.046079635620117, 16.066560745239258, 16.055423736572266, 16.0501766204834, 16.067583084106445, 16.060415267944336, 16.046079635620117, 16.05939292907715, 16.04096031188965, 16.068511962890625, 16.04300880432129, 16.05939292907715, 16.059295654296875, 16.060415267944336, 16.063488006591797, 16.066560745239258, 16.065439224243164, 16.062463760375977, 16.048959732055664, 16.072704315185547, 16.063488006591797, 16.061439514160156, 16.049152374267578, 16.047103881835938, 16.065536499023438, 16.061439514160156, 16.05939292907715, 16.057247161865234], "compile_time": 902.1682610036805, "verification_time": 0, "benchmark_time": 515.6508180079982, "GFLOP/s": 94.01597210413001, "strategy_time": 0.008777016773819923, "framework_time": 1.6343580791726708, "timestamp": "2025-04-08 00:14:07.915329+00:00", "gridpoints/s": 6267731473.608668}, "4096,4096,16,2,8,1,5,10,5,0,3": {"grid_width": 4096, "grid_height": 4096, "block_size_x": 16, "block_size_y": 2, "tile_size_x": 8, "tile_size_y": 1, "temporal_tiling_factor": 5, "max_tfactor": 10, "loop_unroll_factor_t": 5, "sh_power": 0, "blocks_per_sm": 3, "time": 22.831450939178467, "times": [22.88630485534668, 22.833984375, 22.83193588256836, 22.829055786132812, 22.83123207092285, 22.829055786132812, 22.828031539916992, 22.829055786132812, 22.831104278564453, 22.82899284362793, 22.829984664916992, 22.829055786132812, 22.828031539916992, 22.828031539916992, 22.827007293701172, 22.829055786132812, 22.829055786132812, 22.832128524780273, 22.832128524780273, 22.831104278564453, 22.828927993774414, 22.829919815063477, 22.828031539916992, 22.82598304748535, 22.82598304748535, 22.832128524780273, 22.829919815063477, 22.830976486206055, 22.829055786132812, 22.830080032348633, 22.8288631439209, 22.832223892211914], "compile_time": 1012.4975969083607, "verification_time": 0, "benchmark_time": 732.6307860203087, "GFLOP/s": 55.112187278504884, "strategy_time": 0.008044997230172157, "framework_time": 1.557174022309482, "timestamp": "2025-04-08 00:14:09.662056+00:00", "gridpoints/s": 3674145818.5669923}, "4096,4096,32,1,1,3,3,10,3,0,3": {"grid_width": 4096, "grid_height": 4096, "block_size_x": 32, "block_size_y": 1, "tile_size_x": 1, "tile_size_y": 3, "temporal_tiling_factor": 3, "max_tfactor": 10, "loop_unroll_factor_t": 3, "sh_power": 0, "blocks_per_sm": 3, "time": 12.385171055793762, "times": [12.436479568481445, 12.388352394104004, 12.386272430419922, 12.382207870483398, 12.384256362915039, 12.385279655456543, 12.38316822052002, 12.382207870483398, 12.382207870483398, 12.382207870483398, 12.382207870483398, 12.383232116699219, 12.382111549377441, 12.383232116699219, 12.383232116699219, 12.384256362915039, 12.383232116699219, 12.383232116699219, 12.386143684387207, 12.384256362915039, 12.383232116699219, 12.384256362915039, 12.383232116699219, 12.382207870483398, 12.382207870483398, 12.383232116699219, 12.383232116699219, 12.384256362915039, 12.382207870483398, 12.383232116699219, 12.38316822052002, 12.383232116699219], "compile_time": 871.8646230408922, "verification_time": 0, "benchmark_time": 398.40197295416147, "GFLOP/s": 60.95795662400836, "strategy_time": 0.008426024578511715, "framework_time": 1.4653318794444203, "timestamp": "2025-04-08 00:14:10.933828+00:00", "gridpoints/s": 4063863774.933891}, "4096,4096,32,4,2,10,7,10,7,0,0": {"grid_width": 4096, "grid_height": 4096, "block_size_x": 32, "block_size_y": 4, "tile_size_x": 2, "tile_size_y": 10, "temporal_tiling_factor": 7, "max_tfactor": 10, "loop_unroll_factor_t": 7, "sh_power": 0, "blocks_per_sm": 0, "time": 16.55803507566452, "times": [16.61440086364746, 16.556032180786133, 16.550912857055664, 16.57036781311035, 16.564224243164062, 16.547840118408203, 16.553983688354492, 16.542720794677734, 16.546815872192383, 16.557056427001953, 16.555007934570312, 16.563039779663086, 16.559104919433594, 16.543743133544922, 16.544767379760742, 16.562175750732422, 16.563135147094727, 16.550912857055664, 16.56208038330078, 16.564191818237305, 16.553823471069336, 16.550912857055664, 16.557151794433594, 16.559104919433594, 16.552959442138672, 16.558080673217773, 16.553983688354492, 16.558080673217773, 16.546815872192383, 16.571392059326172, 16.56729507446289, 16.555007934570312], "compile_time": 1155.735015985556, "verification_time": 0, "benchmark_time": 531.7226239712909, "GFLOP/s": 106.38989903995608, "strategy_time": 0.008236034773290157, "framework_time": 1.449001021683216, "timestamp": "2025-04-08 00:14:12.622773+00:00", "gridpoints/s": 7092659935.997071}, "4096,4096,16,2,1,8,4,10,1,1,2": {"grid_width": 4096, "grid_height": 4096, "block_size_x": 16, "block_size_y": 2, "tile_size_x": 1, "tile_size_y": 8, "temporal_tiling_factor": 4, "max_tfactor": 10, "loop_unroll_factor_t": 1, "sh_power": 1, "blocks_per_sm": 2, "time": 11.643018037080765, "times": [11.686911582946777, 11.646976470947266, 11.643903732299805, 11.64185619354248, 11.64185619354248, 11.64185619354248, 11.64185619354248, 11.6397123336792, 11.642720222473145, 11.641759872436523, 11.64185619354248, 11.641759872436523, 11.64083194732666, 11.64083194732666, 11.63980770111084, 11.64083194732666, 11.63980770111084, 11.6428804397583, 11.64185619354248, 11.64185619354248, 11.63980770111084, 11.64083194732666, 11.641792297363281, 11.63980770111084, 11.64083194732666, 11.64185619354248, 11.643903732299805, 11.6428804397583, 11.640768051147461, 11.641728401184082, 11.64083194732666, 11.63980770111084], "compile_time": 763.0631250794977, "verification_time": 0, "benchmark_time": 373.5506070079282, "GFLOP/s": 86.4580778621203, "strategy_time": 0.008485978469252586, "framework_time": 1.6114568570628762, "timestamp": "2025-04-08 00:14:13.761038+00:00", "gridpoints/s": 5763871857.474687}, "4096,4096,416,1,2,2,2,10,2,0,1": {"grid_width": 4096, "grid_height": 4096, "block_size_x": 416, "block_size_y": 1, "tile_size_x": 2, "tile_size_y": 2, "temporal_tiling_factor": 2, "max_tfactor": 10, "loop_unroll_factor_t": 2, "sh_power": 0, "blocks_per_sm": 1, "time": 4.407931059598923, "times": [4.460544109344482, 4.412415981292725, 4.407296180725098, 4.407296180725098, 4.406271934509277, 4.405248165130615, 4.407167911529541, 4.4053120613098145, 4.405248165130615, 4.406208038330078, 4.405248165130615, 4.406271934509277, 4.406271934509277, 4.406271934509277, 4.405248165130615, 4.406271934509277, 4.407296180725098, 4.406271934509277, 4.405248165130615, 4.406271934509277, 4.406271934509277, 4.405248165130615, 4.407296180725098, 4.405375957489014, 4.406112194061279, 4.405248165130615, 4.404223918914795, 4.405248165130615, 4.406271934509277, 4.405248165130615, 4.406271934509277, 4.407296180725098], "compile_time": 689.2553450306877, "verification_time": 0, "benchmark_time": 142.4193880520761, "GFLOP/s": 114.18429036088344, "strategy_time": 0.008124974556267262, "framework_time": 1.401411951519549, "timestamp": "2025-04-08 00:14:14.594154+00:00", "gridpoints/s": 7612286024.058896}, "4096,4096,4,16,5,7,6,10,2,1,1": {"grid_width": 4096, "grid_height": 4096, "block_size_x": 4, "block_size_y": 16, "tile_size_x": 5, "tile_size_y": 7, "temporal_tiling_factor": 6, "max_tfactor": 10, "loop_unroll_factor_t": 2, "sh_power": 1, "blocks_per_sm": 1, "time": 13.35295507311821, "times": [13.404159545898438, 13.367263793945312, 13.345696449279785, 13.351936340332031, 13.337471961975098, 13.336576461791992, 13.364224433898926, 13.336671829223633, 13.331456184387207, 13.343744277954102, 13.34067153930664, 13.342720031738281, 13.351936340332031, 13.327360153198242, 13.3221435546875, 13.341695785522461, 13.321215629577637, 13.34988784790039, 13.338624000549316, 13.343744277954102, 13.356032371520996, 13.336576461791992, 13.339743614196777, 13.332480430603027, 13.346816062927246, 13.347840309143066, 13.341695785522461, 13.335552215576172, 13.393919944763184, 13.422592163085938, 13.423616409301758, 13.418496131896973], "compile_time": 833.3441070280969, "verification_time": 0, "benchmark_time": 428.88277396559715, "GFLOP/s": 113.07979632461937, "strategy_time": 0.00807491596788168, "framework_time": 1.353723113425076, "timestamp": "2025-04-08 00:14:15.857774+00:00", "gridpoints/s": 7538653088.307958}, "4096,4096,32,4,1,6,7,10,7,0,3": {"grid_width": 4096, "grid_height": 4096, "block_size_x": 32, "block_size_y": 4, "tile_size_x": 1, "tile_size_y": 6, "temporal_tiling_factor": 7, "max_tfactor": 10, "loop_unroll_factor_t": 7, "sh_power": 0, "blocks_per_sm": 3, "time": 22.466608941555023, "times": [22.519807815551758, 22.4716796875, 22.46451187133789, 22.46656036376953, 22.46143913269043, 22.46451187133789, 22.46758460998535, 22.46656036376953, 22.460224151611328, 22.460447311401367, 22.461631774902344, 22.46348762512207, 22.46656036376953, 22.46451187133789, 22.46348762512207, 22.465375900268555, 22.46246337890625, 22.467391967773438, 22.47577667236328, 22.46553611755371, 22.46758460998535, 22.46451187133789, 22.46143913269043, 22.459392547607422, 22.46553611755371, 22.46348762512207, 22.470495223999023, 22.46246337890625, 22.460416793823242, 22.46758460998535, 22.46451187133789, 22.46451187133789], "compile_time": 1133.2123179454356, "verification_time": 0, "benchmark_time": 720.1945229899138, "GFLOP/s": 78.41003885288931, "strategy_time": 0.007985043339431286, "framework_time": 1.444461988285184, "timestamp": "2025-04-08 00:14:17.712665+00:00", "gridpoints/s": 5227335923.525954}, "4096,4096,4,16,3,7,6,10,6,0,3": {"grid_width": 4096, "grid_height": 4096, "block_size_x": 4, "block_size_y": 16, "tile_size_x": 3, "tile_size_y": 7, "temporal_tiling_factor": 6, "max_tfactor": 10, "loop_unroll_factor_t": 6, "sh_power": 0, "blocks_per_sm": 3, "time": 15.025724083185196, "times": [15.077376365661621, 15.033344268798828, 15.022080421447754, 15.025152206420898, 15.028127670288086, 15.027199745178223, 15.02409553527832, 15.021056175231934, 15.026176452636719, 15.022080421447754, 15.026176452636719, 15.022080421447754, 15.025152206420898, 15.023103713989258, 15.024127960205078, 15.023103713989258, 15.022080421447754, 15.024127960205078, 15.021056175231934, 15.021056175231934, 15.030271530151367, 15.025152206420898, 15.022080421447754, 15.025152206420898, 15.026176452636719, 15.027199745178223, 15.019007682800293, 15.019007682800293, 15.020031929016113, 15.024127960205078, 15.024127960205078, 15.022080421447754], "compile_time": 1089.6703350590542, "verification_time": 0, "benchmark_time": 481.9978110026568, "GFLOP/s": 100.49096014545721, "strategy_time": 0.008195056580007076, "framework_time": 1.5136839356273413, "timestamp": "2025-04-08 00:14:19.285887+00:00", "gridpoints/s": 6699397343.030481}, "4096,4096,4,8,5,7,6,10,2,0,4": {"grid_width": 4096, "grid_height": 4096, "block_size_x": 4, "block_size_y": 8, "tile_size_x": 5, "tile_size_y": 7, "temporal_tiling_factor": 6, "max_tfactor": 10, "loop_unroll_factor_t": 2, "sh_power": 0, "blocks_per_sm": 4, "time": 13.644490092992783, "times": [13.69696044921875, 13.647871971130371, 13.644800186157227, 13.642751693725586, 13.645824432373047, 13.645824432373047, 13.642623901367188, 13.646656036376953, 13.644800186157227, 13.641728401184082, 13.641728401184082, 13.640704154968262, 13.64684772491455, 13.641695976257324, 13.640704154968262, 13.639679908752441, 13.639679908752441, 13.641728401184082, 13.651968002319336, 13.645824432373047, 13.641568183898926, 13.638655662536621, 13.640704154968262, 13.635552406311035, 13.642751693725586, 13.640704154968262, 13.640704154968262, 13.645759582519531, 13.637632369995117, 13.640704154968262, 13.643775939941406, 13.644767761230469], "compile_time": 890.9130990505219, "verification_time": 0, "benchmark_time": 437.6607909798622, "GFLOP/s": 110.66367667161445, "strategy_time": 0.008216011337935925, "framework_time": 1.443970948457718, "timestamp": "2025-04-08 00:14:20.615943+00:00", "gridpoints/s": 7377578444.774297}, "4096,4096,224,2,1,2,7,10,7,0,2": {"grid_width": 4096, "grid_height": 4096, "block_size_x": 224, "block_size_y": 2, "tile_size_x": 1, "tile_size_y": 2, "temporal_tiling_factor": 7, "max_tfactor": 10, "loop_unroll_factor_t": 7, "sh_power": 0, "blocks_per_sm": 2, "time": 28.538322031497955, "times": [28.58393669128418, 28.54185676574707, 28.53887939453125, 28.535808563232422, 28.53785514831543, 28.536895751953125, 28.535871505737305, 28.53878402709961, 28.53376007080078, 28.53887939453125, 28.535808563232422, 28.535808563232422, 28.53785514831543, 28.5347843170166, 28.53887939453125, 28.539871215820312, 28.5347843170166, 28.536832809448242, 28.536832809448242, 28.5347843170166, 28.53785514831543, 28.535808563232422, 28.53785514831543, 28.535808563232422, 28.53785514831543, 28.534624099731445, 28.53673553466797, 28.53785514831543, 28.535808563232422, 28.535808563232422, 28.53468894958496, 28.536832809448242], "compile_time": 746.3394099613652, "verification_time": 0, "benchmark_time": 914.1016630455852, "GFLOP/s": 61.72779457936247, "strategy_time": 0.008675968274474144, "framework_time": 1.4033960178494453, "timestamp": "2025-04-08 00:14:22.277829+00:00", "gridpoints/s": 4115186305.290831}, "4096,4096,256,2,1,8,3,10,1,0,0": {"grid_width": 4096, "grid_height": 4096, "block_size_x": 256, "block_size_y": 2, "tile_size_x": 1, "tile_size_y": 8, "temporal_tiling_factor": 3, "max_tfactor": 10, "loop_unroll_factor_t": 1, "sh_power": 0, "blocks_per_sm": 0, "time": 5.221015080809593, "times": [5.272384166717529, 5.22649621963501, 5.222271919250488, 5.2203521728515625, 5.221375942230225, 5.2203521728515625, 5.21830415725708, 5.218143939971924, 5.221375942230225, 5.219327926635742, 5.21830415725708, 5.219200134277344, 5.21830415725708, 5.21830415725708, 5.219327926635742, 5.2191362380981445, 5.219520092010498, 5.2203521728515625, 5.21830415725708, 5.219232082366943, 5.21830415725708, 5.218175888061523, 5.2182722091674805, 5.219327926635742, 5.21727991104126, 5.2191362380981445, 5.21830415725708, 5.219327926635742, 5.219327926635742, 5.21830415725708, 5.217184066772461, 5.219168186187744], "compile_time": 817.1356749953702, "verification_time": 0, "benchmark_time": 169.05865003354847, "GFLOP/s": 144.60305291493822, "strategy_time": 0.008695991709828377, "framework_time": 1.485789893195033, "timestamp": "2025-04-08 00:14:23.265549+00:00", "gridpoints/s": 9640203527.662548}, "4096,4096,16,2,2,8,1,10,1,1,1": {"grid_width": 4096, "grid_height": 4096, "block_size_x": 16, "block_size_y": 2, "tile_size_x": 2, "tile_size_y": 8, "temporal_tiling_factor": 1, "max_tfactor": 10, "loop_unroll_factor_t": 1, "sh_power": 1, "blocks_per_sm": 1, "time": 1.4481520280241966, "times": [1.4980800151824951, 1.4540799856185913, 1.4467519521713257, 1.4469120502471924, 1.4458880424499512, 1.44486403465271, 1.4479360580444336, 1.4469120502471924, 1.4469120502471924, 1.448032021522522, 1.4489599466323853, 1.4458880424499512, 1.4458880424499512, 1.4458880424499512, 1.4469120502471924, 1.4458880424499512, 1.4458880424499512, 1.4468159675598145, 1.4458880424499512, 1.4458880424499512, 1.4458880424499512, 1.4469120502471924, 1.44486403465271, 1.44486403465271, 1.4469120502471924, 1.4458880424499512, 1.4458880424499512, 1.44486403465271, 1.4458240270614624, 1.44486403465271, 1.44486403465271, 1.4489599466323853], "compile_time": 736.6510289721191, "verification_time": 0, "benchmark_time": 48.200580989941955, "GFLOP/s": 173.7788817264945, "strategy_time": 0.008326023817062378, "framework_time": 1.3795810518786311, "timestamp": "2025-04-08 00:14:24.051820+00:00", "gridpoints/s": 11585258781.766298}, "4096,4096,352,1,1,9,4,10,1,0,1": {"grid_width": 4096, "grid_height": 4096, "block_size_x": 352, "block_size_y": 1, "tile_size_x": 1, "tile_size_y": 9, "temporal_tiling_factor": 4, "max_tfactor": 10, "loop_unroll_factor_t": 1, "sh_power": 0, "blocks_per_sm": 1, "time": 9.10112002491951, "times": [9.145343780517578, 9.088000297546387, 9.153535842895508, 9.096192359924316, 9.091072082519531, 9.085951805114746, 9.082880020141602, 9.085951805114746, 9.083904266357422, 9.109503746032715, 9.119744300842285, 9.09721565246582, 9.096192359924316, 9.09823989868164, 9.11564826965332, 9.092096328735352, 9.091072082519531, 9.078783988952637, 9.083807945251465, 9.087103843688965, 9.085951805114746, 9.134143829345703, 9.11359977722168, 9.088000297546387, 9.161727905273438, 9.078783988952637, 9.085951805114746, 9.095168113708496, 9.071616172790527, 9.126879692077637, 9.083840370178223, 9.127936363220215], "compile_time": 711.2756919814274, "verification_time": 0, "benchmark_time": 292.3757799435407, "GFLOP/s": 110.6053933190385, "strategy_time": 0.0077750300988554955, "framework_time": 1.3699240516871214, "timestamp": "2025-04-08 00:14:25.056881+00:00", "gridpoints/s": 7373692887.9359}, "4096,4096,4,16,4,9,2,10,2,1,0": {"grid_width": 4096, "grid_height": 4096, "block_size_x": 4, "block_size_y": 16, "tile_size_x": 4, "tile_size_y": 9, "temporal_tiling_factor": 2, "max_tfactor": 10, "loop_unroll_factor_t": 2, "sh_power": 1, "blocks_per_sm": 0, "time": 3.8351560160517693, "times": [3.8983678817749023, 3.8440959453582764, 3.8256640434265137, 3.862528085708618, 3.8348801136016846, 3.8246400356292725, 3.832832098007202, 3.8143999576568604, 3.8388800621032715, 3.84716796875, 3.846143960952759, 3.826688051223755, 3.812351942062378, 3.8338561058044434, 3.8256640434265137, 3.8297600746154785, 3.8410239219665527, 3.8420159816741943, 3.832832098007202, 3.826688051223755, 3.821568012237549, 3.823456048965454, 3.84006404876709, 3.8451199531555176, 3.8389439582824707, 3.84716796875, 3.818495988845825, 3.826688051223755, 3.82259202003479, 3.843967914581299, 3.82259202003479, 3.8338561058044434], "compile_time": 814.665763056837, "verification_time": 0, "benchmark_time": 124.40512701869011, "GFLOP/s": 131.23755015269393, "strategy_time": 0.007763970643281937, "framework_time": 1.3306299224495888, "timestamp": "2025-04-08 00:14:25.997321+00:00", "gridpoints/s": 8749170010.179594}, "4096,4096,16,2,8,3,6,10,3,1,1": {"grid_width": 4096, "grid_height": 4096, "block_size_x": 16, "block_size_y": 2, "tile_size_x": 8, "tile_size_y": 3, "temporal_tiling_factor": 6, "max_tfactor": 10, "loop_unroll_factor_t": 3, "sh_power": 1, "blocks_per_sm": 1, "time": 17.978585183620453, "times": [18.04800033569336, 17.971200942993164, 17.986495971679688, 17.974271774291992, 17.9814395904541, 17.976320266723633, 17.9833927154541, 17.976320266723633, 17.99065589904785, 17.9671688079834, 17.98860740661621, 17.955839157104492, 17.986560821533203, 17.977344512939453, 17.963903427124023, 17.978368759155273, 17.965152740478516, 17.970176696777344, 17.976320266723633, 17.967103958129883, 17.977344512939453, 17.976320266723633, 17.99065589904785, 17.98758316040039, 17.969152450561523, 17.960960388183594, 17.969152450561523, 17.986560821533203, 17.9814395904541, 17.9649600982666, 17.983488082885742, 17.982463836669922], "compile_time": 918.7186029739678, "verification_time": 0, "benchmark_time": 576.5433599008247, "GFLOP/s": 83.98599915279499, "strategy_time": 0.008246046490967274, "framework_time": 1.486771972849965, "timestamp": "2025-04-08 00:14:27.494109+00:00", "gridpoints/s": 5599066610.186332}, "4096,4096,288,1,1,5,1,10,1,1,0": {"grid_width": 4096, "grid_height": 4096, "block_size_x": 288, "block_size_y": 1, "tile_size_x": 1, "tile_size_y": 5, "temporal_tiling_factor": 1, "max_tfactor": 10, "loop_unroll_factor_t": 1, "sh_power": 1, "blocks_per_sm": 0, "time": 1.558108039200306, "times": [1.6076799631118774, 1.5626239776611328, 1.5595519542694092, 1.556480050086975, 1.556480050086975, 1.556480050086975, 1.556480050086975, 1.5575040578842163, 1.556480050086975, 1.556480050086975, 1.556480050086975, 1.556480050086975, 1.556480050086975, 1.5554560422897339, 1.5575040578842163, 1.5554560422897339, 1.5544320344924927, 1.5554560422897339, 1.556480050086975, 1.556480050086975, 1.5554560422897339, 1.5554560422897339, 1.556480050086975, 1.5544320344924927, 1.5554560422897339, 1.5563520193099976, 1.5554560422897339, 1.5554560422897339, 1.5575040578842163, 1.5575040578842163, 1.556480050086975, 1.556480050086975], "compile_time": 676.9141090335324, "verification_time": 0, "benchmark_time": 51.74511403311044, "GFLOP/s": 161.5152695888552, "strategy_time": 0.008555944077670574, "framework_time": 1.7917330842465162, "timestamp": "2025-04-08 00:14:28.224599+00:00", "gridpoints/s": 10767684639.257013}, "4096,4096,2,16,1,2,9,10,3,0,1": {"grid_width": 4096, "grid_height": 4096, "block_size_x": 2, "block_size_y": 16, "tile_size_x": 1, "tile_size_y": 2, "temporal_tiling_factor": 9, "max_tfactor": 10, "loop_unroll_factor_t": 3, "sh_power": 0, "blocks_per_sm": 1, "time": 92.78821182250977, "times": [93.72774505615234, 101.83475494384766, 99.3280029296875, 91.80774688720703, 91.80867004394531, 91.8128662109375, 91.80467224121094, 91.80364990234375, 91.80262756347656, 91.80560302734375, 91.80569458007812, 91.80774688720703, 92.35660552978516, 92.40985870361328, 92.40576171875, 92.40678405761719, 92.40473937988281, 92.40473937988281, 92.4026870727539, 92.4037094116211, 92.40678405761719, 92.40882873535156, 92.4037094116211, 92.40473937988281, 92.40767669677734, 92.40576171875, 92.40473937988281, 92.40576171875, 92.40873718261719, 92.40985870361328, 92.4037094116211, 92.40780639648438], "compile_time": 948.7230719532818, "verification_time": 0, "benchmark_time": 2970.5416810465977, "GFLOP/s": 24.409611043399217, "strategy_time": 0.008446048013865948, "framework_time": 1.6004849458113313, "timestamp": "2025-04-08 00:14:32.145503+00:00", "gridpoints/s": 1627307402.893281}, "4096,4096,32,8,2,4,4,10,2,0,3": {"grid_width": 4096, "grid_height": 4096, "block_size_x": 32, "block_size_y": 8, "tile_size_x": 2, "tile_size_y": 4, "temporal_tiling_factor": 4, "max_tfactor": 10, "loop_unroll_factor_t": 2, "sh_power": 0, "blocks_per_sm": 3, "time": 8.331363946199417, "times": [8.383487701416016, 8.335359573364258, 8.333312034606934, 8.331263542175293, 8.328191757202148, 8.330240249633789, 8.331263542175293, 8.329216003417969, 8.329216003417969, 8.331263542175293, 8.329216003417969, 8.327168464660645, 8.328191757202148, 8.327168464660645, 8.330240249633789, 8.330240249633789, 8.329216003417969, 8.331263542175293, 8.329216003417969, 8.328191757202148, 8.330240249633789, 8.329216003417969, 8.328191757202148, 8.330240249633789, 8.329216003417969, 8.329343795776367, 8.32915210723877, 8.327263832092285, 8.331263542175293, 8.329216003417969, 8.330240249633789, 8.327136039733887], "compile_time": 839.9907340062782, "verification_time": 0, "benchmark_time": 268.65247497335076, "GFLOP/s": 120.82450922807224, "strategy_time": 0.008344999514520168, "framework_time": 1.6429669922217727, "timestamp": "2025-04-08 00:14:33.255829+00:00", "gridpoints/s": 8054967281.871484}, "4096,4096,4,8,10,1,4,10,2,1,0": {"grid_width": 4096, "grid_height": 4096, "block_size_x": 4, "block_size_y": 8, "tile_size_x": 10, "tile_size_y": 1, "temporal_tiling_factor": 4, "max_tfactor": 10, "loop_unroll_factor_t": 2, "sh_power": 1, "blocks_per_sm": 0, "time": 11.701357960700989, "times": [11.750399589538574, 11.708288192749023, 11.701248168945312, 11.697983741760254, 11.700223922729492, 11.69916820526123, 11.698176383972168, 11.699135780334473, 11.699199676513672, 11.700223922729492, 11.700223922729492, 11.703295707702637, 11.699199676513672, 11.698176383972168, 11.700223922729492, 11.699199676513672, 11.697152137756348, 11.699199676513672, 11.698176383972168, 11.699040412902832, 11.696063995361328, 11.701215744018555, 11.697279930114746, 11.698176383972168, 11.699199676513672, 11.699199676513672, 11.701248168945312, 11.701248168945312, 11.701248168945312, 11.699199676513672, 11.702239990234375, 11.699199676513672], "compile_time": 794.1940829623491, "verification_time": 0, "benchmark_time": 375.3599540796131, "GFLOP/s": 86.02702040060451, "strategy_time": 0.008134986273944378, "framework_time": 1.5083819162100554, "timestamp": "2025-04-08 00:14:34.426931+00:00", "gridpoints/s": 5735134693.373633}, "4096,4096,4,16,1,5,8,10,4,0,1": {"grid_width": 4096, "grid_height": 4096, "block_size_x": 4, "block_size_y": 16, "tile_size_x": 1, "tile_size_y": 5, "temporal_tiling_factor": 8, "max_tfactor": 10, "loop_unroll_factor_t": 4, "sh_power": 0, "blocks_per_sm": 1, "time": 43.68090605735779, "times": [43.729888916015625, 43.67871856689453, 43.677696228027344, 43.67657470703125, 43.676673889160156, 43.66950225830078, 43.676673889160156, 43.674625396728516, 43.67555236816406, 43.67871856689453, 43.681793212890625, 43.6756477355957, 43.682655334472656, 43.679744720458984, 43.67766571044922, 43.676673889160156, 43.68076705932617, 43.67567825317383, 43.68076705932617, 43.679744720458984, 43.6776008605957, 43.67967987060547, 43.682655334472656, 43.674625396728516, 43.68281555175781, 43.68281555175781, 43.68076705932617, 43.68076705932617, 43.677696228027344, 43.683841705322266, 43.68793487548828, 43.69203186035156], "compile_time": 983.1380450632423, "verification_time": 0, "benchmark_time": 1399.3355499114841, "GFLOP/s": 46.09029669293861, "strategy_time": 0.008344999514520168, "framework_time": 1.4409481082111597, "timestamp": "2025-04-08 00:14:36.810885+00:00", "gridpoints/s": 3072686446.195907}, "4096,4096,256,2,1,1,3,10,1,0,2": {"grid_width": 4096, "grid_height": 4096, "block_size_x": 256, "block_size_y": 2, "tile_size_x": 1, "tile_size_y": 1, "temporal_tiling_factor": 3, "max_tfactor": 10, "loop_unroll_factor_t": 1, "sh_power": 0, "blocks_per_sm": 2, "time": 9.43535003066063, "times": [9.482239723205566, 9.440256118774414, 9.43718433380127, 9.435135841369629, 9.433088302612305, 9.434111595153809, 9.43616008758545, 9.43404769897461, 9.433088302612305, 9.434111595153809, 9.433088302612305, 9.433088302612305, 9.433088302612305, 9.434111595153809, 9.434111595153809, 9.433088302612305, 9.433088302612305, 9.434111595153809, 9.433088302612305, 9.433088302612305, 9.432064056396484, 9.433088302612305, 9.434111595153809, 9.435135841369629, 9.433088302612305, 9.434111595153809, 9.434016227722168, 9.432064056396484, 9.432064056396484, 9.432064056396484, 9.433088302612305, 9.432928085327148], "compile_time": 803.7256299285218, "verification_time": 0, "benchmark_time": 303.7460189079866, "GFLOP/s": 80.01554977257578, "strategy_time": 0.008125090971589088, "framework_time": 1.421349123120308, "timestamp": "2025-04-08 00:14:37.919817+00:00", "gridpoints/s": 5334369984.838385}, "4096,4096,192,1,1,1,6,10,1,0,0": {"grid_width": 4096, "grid_height": 4096, "block_size_x": 192, "block_size_y": 1, "tile_size_x": 1, "tile_size_y": 1, "temporal_tiling_factor": 6, "max_tfactor": 10, "loop_unroll_factor_t": 1, "sh_power": 0, "blocks_per_sm": 0, "time": 68.17196106910706, "times": [68.21171569824219, 68.18099212646484, 68.17791748046875, 68.1717758178711, 68.16767883300781, 68.16665649414062, 68.16051483154297, 68.16973114013672, 68.168701171875, 68.16255950927734, 68.16460418701172, 68.1717758178711, 68.17279815673828, 68.1717758178711, 68.16665649414062, 68.17485046386719, 68.16973114013672, 68.16665649414062, 68.16969299316406, 68.16973114013672, 68.17059326171875, 68.16665649414062, 68.17279815673828, 68.168701171875, 68.17485046386719, 68.17587280273438, 68.17791748046875, 68.16969299316406, 68.1707534790039, 68.17279815673828, 68.16876983642578, 68.17683410644531], "compile_time": 695.1722980011255, "verification_time": 0, "benchmark_time": 2183.2651739241555, "GFLOP/s": 22.149127241173815, "strategy_time": 0.008085044100880623, "framework_time": 1.6411810647696257, "timestamp": "2025-04-08 00:14:40.799934+00:00", "gridpoints/s": 1476608482.7449212}, "4096,4096,32,1,3,1,8,10,2,1,4": {"grid_width": 4096, "grid_height": 4096, "block_size_x": 32, "block_size_y": 1, "tile_size_x": 3, "tile_size_y": 1, "temporal_tiling_factor": 8, "max_tfactor": 10, "loop_unroll_factor_t": 2, "sh_power": 1, "blocks_per_sm": 4, "time": 207.49065494537354, "times": [207.43064880371094, 207.34471130371094, 207.37831115722656, 207.4316864013672, 207.30674743652344, 207.383544921875, 207.39385986328125, 207.27398681640625, 207.30776977539062, 207.37330627441406, 207.36512756347656, 207.383544921875, 207.41632080078125, 207.33541870117188, 207.4316864013672, 207.36306762695312, 207.30572509765625, 207.33132934570312, 207.3876495361328, 207.45318603515625, 207.44090270996094, 207.42349243164062, 207.32313537597656, 207.40505981445312, 207.6426239013672, 207.89144897460938, 207.87091064453125, 207.75424194335938, 207.90988159179688, 207.9088897705078, 207.88735961914062, 207.8453826904297], "compile_time": 785.6780459405854, "verification_time": 0, "benchmark_time": 6641.236653085798, "GFLOP/s": 9.70292334625883, "strategy_time": 0.00887701753526926, "framework_time": 1.6175858909264207, "timestamp": "2025-04-08 00:14:48.228507+00:00", "gridpoints/s": 646861556.4172553}, "4096,4096,64,1,3,5,6,10,1,1,0": {"grid_width": 4096, "grid_height": 4096, "block_size_x": 64, "block_size_y": 1, "tile_size_x": 3, "tile_size_y": 5, "temporal_tiling_factor": 6, "max_tfactor": 10, "loop_unroll_factor_t": 1, "sh_power": 1, "blocks_per_sm": 0, "time": 32.14564406871796, "times": [32.19148635864258, 32.18022537231445, 32.07680130004883, 32.1607666015625, 32.10240173339844, 32.15769577026367, 32.21900939941406, 32.098304748535156, 32.092159271240234, 32.20377731323242, 32.153438568115234, 32.1525764465332, 32.16281509399414, 32.149505615234375, 32.09113693237305, 32.16998291015625, 32.16486358642578, 32.09113693237305, 32.123905181884766, 32.16179275512695, 32.14131164550781, 32.22118377685547, 32.09523010253906, 32.183135986328125, 32.11449432373047, 32.19353485107422, 32.129024505615234, 32.110591888427734, 32.147457122802734, 32.087039947509766, 32.165889739990234, 32.16793441772461], "compile_time": 777.9850399820134, "verification_time": 0, "benchmark_time": 1030.164799070917, "GFLOP/s": 46.972132111342084, "strategy_time": 0.008334987796843052, "framework_time": 1.51283189188689, "timestamp": "2025-04-08 00:14:50.038211+00:00", "gridpoints/s": 3131475474.0894723}, "4096,4096,16,16,3,3,6,10,2,1,2": {"grid_width": 4096, "grid_height": 4096, "block_size_x": 16, "block_size_y": 16, "tile_size_x": 3, "tile_size_y": 3, "temporal_tiling_factor": 6, "max_tfactor": 10, "loop_unroll_factor_t": 2, "sh_power": 1, "blocks_per_sm": 2, "time": 19.924603164196014, "times": [19.972095489501953, 19.935232162475586, 19.924991607666016, 19.919872283935547, 19.921920776367188, 19.92083168029785, 19.919872283935547, 19.921920776367188, 19.919872283935547, 19.917823791503906, 19.921920776367188, 19.921920776367188, 19.922943115234375, 19.919872283935547, 19.924991607666016, 19.926944732666016, 19.921920776367188, 19.918848037719727, 19.920896530151367, 19.929088592529297, 19.922943115234375, 19.918848037719727, 19.921920776367188, 19.933183670043945, 19.921920776367188, 19.933183670043945, 19.924991607666016, 19.921920776367188, 19.922880172729492, 19.919872283935547, 19.920896530151367, 19.92095947265625], "compile_time": 795.6526620546356, "verification_time": 0, "benchmark_time": 638.7239830801263, "GFLOP/s": 75.78316253311078, "strategy_time": 0.008817063644528389, "framework_time": 1.5894938260316849, "timestamp": "2025-04-08 00:14:51.474217+00:00", "gridpoints/s": 5052210835.540719}, "4096,4096,1,32,9,7,3,10,1,0,1": {"grid_width": 4096, "grid_height": 4096, "block_size_x": 1, "block_size_y": 32, "tile_size_x": 9, "tile_size_y": 7, "temporal_tiling_factor": 3, "max_tfactor": 10, "loop_unroll_factor_t": 1, "sh_power": 0, "blocks_per_sm": 1, "time": 6.863556995987892, "times": [6.915103912353516, 6.870016098022461, 6.860799789428711, 6.848512172698975, 6.874112129211426, 6.853631973266602, 6.864992141723633, 6.863872051239014, 6.866943836212158, 6.864895820617676, 6.845439910888672, 6.860832214355469, 6.847487926483154, 6.884352207183838, 6.8587517738342285, 6.857728004455566, 6.852575778961182, 6.877312183380127, 6.8606719970703125, 6.85584020614624, 6.855616092681885, 6.860799789428711, 6.864895820617676, 6.859744071960449, 6.849535942077637, 6.857728004455566, 6.872064113616943, 6.870016098022461, 6.860799789428711, 6.8587517738342285, 6.869984149932861, 6.870016098022461], "compile_time": 896.1040930589661, "verification_time": 0, "benchmark_time": 220.80522601027042, "GFLOP/s": 109.9975887781397, "strategy_time": 0.00834604725241661, "framework_time": 1.6078988555818796, "timestamp": "2025-04-08 00:14:52.592772+00:00", "gridpoints/s": 7333172585.209313}, "4096,4096,2,16,5,10,6,10,3,1,2": {"grid_width": 4096, "grid_height": 4096, "block_size_x": 2, "block_size_y": 16, "tile_size_x": 5, "tile_size_y": 10, "temporal_tiling_factor": 6, "max_tfactor": 10, "loop_unroll_factor_t": 3, "sh_power": 1, "blocks_per_sm": 2, "time": 17.957363188266754, "times": [18.002944946289062, 17.928192138671875, 17.963136672973633, 17.954816818237305, 17.994752883911133, 17.951616287231445, 17.969152450561523, 17.956863403320312, 17.958751678466797, 17.957887649536133, 17.977344512939453, 17.934335708618164, 17.99577522277832, 17.967103958129883, 17.938432693481445, 17.924095153808594, 17.960960388183594, 17.982463836669922, 17.963008880615234, 17.954816818237305, 17.927167892456055, 17.977344512939453, 17.929216384887695, 17.925119400024414, 17.950719833374023, 17.958911895751953, 17.922048568725586, 17.971200942993164, 17.95155143737793, 17.97216033935547, 17.951744079589844, 17.961984634399414], "compile_time": 950.7669070735574, "verification_time": 0, "benchmark_time": 576.0281460825354, "GFLOP/s": 84.08525372960062, "strategy_time": 0.008636037819087505, "framework_time": 1.5517828287556767, "timestamp": "2025-04-08 00:14:54.121158+00:00", "gridpoints/s": 5605683581.973374}, "4096,4096,8,4,9,5,8,10,2,0,3": {"grid_width": 4096, "grid_height": 4096, "block_size_x": 8, "block_size_y": 4, "tile_size_x": 9, "tile_size_y": 5, "temporal_tiling_factor": 8, "max_tfactor": 10, "loop_unroll_factor_t": 2, "sh_power": 0, "blocks_per_sm": 3, "time": 18.6458820104599, "times": [18.691072463989258, 18.6378231048584, 18.66035270690918, 18.63475227355957, 18.64396858215332, 18.64089584350586, 18.64089584350586, 18.64192008972168, 18.637792587280273, 18.662399291992188, 18.637792587280273, 18.64089584350586, 18.63372802734375, 18.64192008972168, 18.6429443359375, 18.64908790588379, 18.64908790588379, 18.64396858215332, 18.64192008972168, 18.643936157226562, 18.65011215209961, 18.63884735107422, 18.65318489074707, 18.64192008972168, 18.63475227355957, 18.64089584350586, 18.644895553588867, 18.646015167236328, 18.63884735107422, 18.646015167236328, 18.65318489074707, 18.662399291992188], "compile_time": 909.3960070749745, "verification_time": 0, "benchmark_time": 597.8223501006141, "GFLOP/s": 107.97375628949091, "strategy_time": 0.008645933121442795, "framework_time": 1.5235919272527099, "timestamp": "2025-04-08 00:14:55.629939+00:00", "gridpoints/s": 7198250419.299394}, "4096,4096,8,8,2,4,10,10,1,0,1": {"grid_width": 4096, "grid_height": 4096, "block_size_x": 8, "block_size_y": 8, "tile_size_x": 2, "tile_size_y": 4, "temporal_tiling_factor": 10, "max_tfactor": 10, "loop_unroll_factor_t": 1, "sh_power": 0, "blocks_per_sm": 1, "time": 41.53726518154144, "times": [41.58464050292969, 41.54470443725586, 41.53548812866211, 41.5365104675293, 41.53446578979492, 41.53343963623047, 41.53548812866211, 41.53446578979492, 41.53958511352539, 41.53343963623047, 41.53548812866211, 41.53843307495117, 41.53241729736328, 41.53744125366211, 41.53446578979492, 41.53343963623047, 41.534271240234375, 41.53446578979492, 41.53958511352539, 41.53855895996094, 41.53753662109375, 41.5365104675293, 41.53855895996094, 41.53753662109375, 41.534400939941406, 41.53343963623047, 41.53139114379883, 41.53139114379883, 41.5365104675293, 41.53343963623047, 41.53446578979492, 41.5365104675293], "compile_time": 823.3908800175413, "verification_time": 0, "benchmark_time": 1330.2235869923607, "GFLOP/s": 60.58613606363118, "strategy_time": 0.008665956556797028, "framework_time": 1.67849101126194, "timestamp": "2025-04-08 00:14:57.785271+00:00", "gridpoints/s": 4039075737.575412}, "4096,4096,32,2,5,8,6,10,1,0,2": {"grid_width": 4096, "grid_height": 4096, "block_size_x": 32, "block_size_y": 2, "tile_size_x": 5, "tile_size_y": 8, "temporal_tiling_factor": 6, "max_tfactor": 10, "loop_unroll_factor_t": 1, "sh_power": 0, "blocks_per_sm": 2, "time": 13.942669063806534, "times": [13.958144187927246, 13.953023910522461, 13.945856094360352, 13.953887939453125, 13.936639785766602, 13.922304153442383, 13.890560150146484, 13.987839698791504, 13.956095695495605, 13.884256362915039, 13.9518404006958, 13.954048156738281, 13.892607688903809, 13.98476791381836, 13.940735816955566, 13.914112091064453, 13.97043228149414, 13.932543754577637, 13.948927879333496, 13.950976371765137, 13.964192390441895, 13.959168434143066, 13.96019172668457, 13.922176361083984, 13.918208122253418, 13.953023910522461, 13.96940803527832, 13.97043228149414, 13.99500846862793, 13.888511657714844, 13.87827205657959, 13.957216262817383], "compile_time": 876.1910089524463, "verification_time": 0, "benchmark_time": 447.7301040897146, "GFLOP/s": 108.29701494670373, "strategy_time": 0.008114962838590145, "framework_time": 1.64826400578022, "timestamp": "2025-04-08 00:14:59.110880+00:00", "gridpoints/s": 7219800996.446915}, "4096,4096,96,1,1,2,7,10,1,0,4": {"grid_width": 4096, "grid_height": 4096, "block_size_x": 96, "block_size_y": 1, "tile_size_x": 1, "tile_size_y": 2, "temporal_tiling_factor": 7, "max_tfactor": 10, "loop_unroll_factor_t": 1, "sh_power": 0, "blocks_per_sm": 4, "time": 64.19104838371277, "times": [64.23446655273438, 64.19558715820312, 64.18828582763672, 64.18739318847656, 64.1812515258789, 64.18534088134766, 64.18637084960938, 64.18438720703125, 64.19129943847656, 64.18943786621094, 64.18729400634766, 64.1883544921875, 64.1822738647461, 64.18943786621094, 64.18739318847656, 64.18736267089844, 64.19446563720703, 64.19750213623047, 64.19149017333984, 64.19046020507812, 64.18739318847656, 64.18637084960938, 64.19046020507812, 64.18534088134766, 64.18534088134766, 64.19149017333984, 64.18739318847656, 64.18841552734375, 64.19149017333984, 64.18943786621094, 64.19149017333984, 64.21907043457031], "compile_time": 699.7656030580401, "verification_time": 0, "benchmark_time": 2055.3455309709534, "GFLOP/s": 27.44319845766803, "strategy_time": 0.008575967513024807, "framework_time": 1.8524270271882415, "timestamp": "2025-04-08 00:15:01.867884+00:00", "gridpoints/s": 1829546563.8445354}, "4096,4096,32,8,7,1,3,10,1,1,1": {"grid_width": 4096, "grid_height": 4096, "block_size_x": 32, "block_size_y": 8, "tile_size_x": 7, "tile_size_y": 1, "temporal_tiling_factor": 3, "max_tfactor": 10, "loop_unroll_factor_t": 1, "sh_power": 1, "blocks_per_sm": 1, "time": 7.7634440660476685, "times": [7.813119888305664, 7.769087791442871, 7.763967990875244, 7.7649922370910645, 7.761919975280762, 7.761792182922363, 7.7608962059021, 7.762944221496582, 7.761919975280762, 7.761919975280762, 7.762944221496582, 7.762944221496582, 7.761760234832764, 7.7618560791015625, 7.763967990875244, 7.7608962059021, 7.735392093658447, 7.763967990875244, 7.762944221496582, 7.761919975280762, 7.762944221496582, 7.761919975280762, 7.761919975280762, 7.763967990875244, 7.761919975280762, 7.761919975280762, 7.763967990875244, 7.7608962059021, 7.763967990875244, 7.762944221496582, 7.762815952301025, 7.759871959686279], "compile_time": 767.0908930012956, "verification_time": 0, "benchmark_time": 249.4815189857036, "GFLOP/s": 97.2473960753805, "strategy_time": 0.00787398312240839, "framework_time": 1.7701440956443548, "timestamp": "2025-04-08 00:15:02.886265+00:00", "gridpoints/s": 6483159738.3587}, "4096,4096,8,4,5,4,9,10,3,1,4": {"grid_width": 4096, "grid_height": 4096, "block_size_x": 8, "block_size_y": 4, "tile_size_x": 5, "tile_size_y": 4, "temporal_tiling_factor": 9, "max_tfactor": 10, "loop_unroll_factor_t": 3, "sh_power": 1, "blocks_per_sm": 4, "time": 25.640646040439606, "times": [25.672576904296875, 25.639936447143555, 25.643007278442383, 25.629695892333984, 25.65007972717285, 25.630720138549805, 25.636863708496094, 25.657344818115234, 25.629695892333984, 25.626623153686523, 25.64080047607422, 25.630720138549805, 25.644031524658203, 25.637887954711914, 25.640960693359375, 25.627647399902344, 25.647104263305664, 25.640960693359375, 25.657344818115234, 25.63667106628418, 25.651199340820312, 25.649152755737305, 25.630720138549805, 25.630592346191406, 25.63577651977539, 25.644031524658203, 25.635839462280273, 25.645055770874023, 25.625600814819336, 25.634815216064453, 25.655231475830078, 25.641984939575195], "compile_time": 915.1445539901033, "verification_time": 0, "benchmark_time": 821.7078010784462, "GFLOP/s": 88.33334996426511, "strategy_time": 0.007814960554242134, "framework_time": 1.4483699342235923, "timestamp": "2025-04-08 00:15:04.624604+00:00", "gridpoints/s": 5888889997.617674}, "4096,4096,8,8,9,6,6,10,2,0,0": {"grid_width": 4096, "grid_height": 4096, "block_size_x": 8, "block_size_y": 8, "tile_size_x": 9, "tile_size_y": 6, "temporal_tiling_factor": 6, "max_tfactor": 10, "loop_unroll_factor_t": 2, "sh_power": 0, "blocks_per_sm": 0, "time": 11.339320003986359, "times": [11.400192260742188, 11.345791816711426, 11.340800285339355, 11.329536437988281, 11.32646369934082, 11.337727546691895, 11.329536437988281, 11.329440116882324, 11.33670425415039, 11.33465576171875, 11.33568000793457, 11.33568000793457, 11.35308837890625, 11.339776039123535, 11.343968391418457, 11.33670425415039, 11.321279525756836, 11.330559730529785, 11.33459186553955, 11.322367668151855, 11.339776039123535, 11.350015640258789, 11.35103988647461, 11.34182357788086, 11.35103988647461, 11.33465576171875, 11.340800285339355, 11.34489631652832, 11.332608222961426, 11.329536437988281, 11.339776039123535, 11.337727546691895], "compile_time": 925.0760698923841, "verification_time": 0, "benchmark_time": 364.6292519988492, "GFLOP/s": 133.16049282224813, "strategy_time": 0.008384929969906807, "framework_time": 1.478868187405169, "timestamp": "2025-04-08 00:15:05.915828+00:00", "gridpoints/s": 8877366188.149876}, "4096,4096,8,4,4,10,6,10,3,0,0": {"grid_width": 4096, "grid_height": 4096, "block_size_x": 8, "block_size_y": 4, "tile_size_x": 4, "tile_size_y": 10, "temporal_tiling_factor": 6, "max_tfactor": 10, "loop_unroll_factor_t": 3, "sh_power": 0, "blocks_per_sm": 0, "time": 12.357585996389389, "times": [12.412927627563477, 12.361696243286133, 12.353535652160645, 12.35148811340332, 12.352479934692383, 12.356608390808105, 12.36070442199707, 12.353535652160645, 12.355584144592285, 12.35763168334961, 12.359519958496094, 12.356512069702148, 12.35865592956543, 12.35865592956543, 12.35865592956543, 12.35968017578125, 12.359583854675293, 12.35968017578125, 12.356608390808105, 12.35968017578125, 12.346464157104492, 12.346367835998535, 12.356608390808105, 12.353535652160645, 12.3504638671875, 12.35763168334961, 12.35859203338623, 12.35859203338623, 12.353535652160645, 12.35148811340332, 12.354559898376465, 12.35148811340332], "compile_time": 1045.367127051577, "verification_time": 0, "benchmark_time": 396.65591495577246, "GFLOP/s": 122.18805844775619, "strategy_time": 0.0096180010586977, "framework_time": 694.0488669788465, "timestamp": "2025-04-08 00:15:08.051941+00:00", "gridpoints/s": 8145870563.183746}, "4096,4096,8,4,4,6,6,10,2,1,0": {"grid_width": 4096, "grid_height": 4096, "block_size_x": 8, "block_size_y": 4, "tile_size_x": 4, "tile_size_y": 6, "temporal_tiling_factor": 6, "max_tfactor": 10, "loop_unroll_factor_t": 2, "sh_power": 1, "blocks_per_sm": 0, "time": 13.25273996591568, "times": [13.305855751037598, 13.254464149475098, 13.254591941833496, 13.252608299255371, 13.25977611541748, 13.2423677444458, 13.247488021850586, 13.254655838012695, 13.24841594696045, 13.247488021850586, 13.24953556060791, 13.253631591796875, 13.252608299255371, 13.239295959472656, 13.253536224365234, 13.247488021850586, 13.247488021850586, 13.25158405303955, 13.25055980682373, 13.25055980682373, 13.253503799438477, 13.253536224365234, 13.24937629699707, 13.250528335571289, 13.245439529418945, 13.254655838012695, 13.254655838012695, 13.253631591796875, 13.248512268066406, 13.253631591796875, 13.255616188049316, 13.250592231750488], "compile_time": 818.0941779864952, "verification_time": 0, "benchmark_time": 425.19602505490184, "GFLOP/s": 113.93488772007849, "strategy_time": 0.008606002666056156, "framework_time": 1.557905925437808, "timestamp": "2025-04-08 00:15:09.296827+00:00", "gridpoints/s": 7595659181.338566}, "4096,4096,16,4,9,5,6,10,6,0,2": {"grid_width": 4096, "grid_height": 4096, "block_size_x": 16, "block_size_y": 4, "tile_size_x": 9, "tile_size_y": 5, "temporal_tiling_factor": 6, "max_tfactor": 10, "loop_unroll_factor_t": 6, "sh_power": 0, "blocks_per_sm": 2, "time": 12.042966932058334, "times": [12.085247993469238, 12.087167739868164, 12.091391563415527, 12.029855728149414, 12.031007766723633, 12.021759986877441, 12.100447654724121, 12.042336463928223, 12.056575775146484, 12.06067180633545, 12.034048080444336, 12.073920249938965, 12.040191650390625, 12.010496139526367, 12.02790355682373, 12.031999588012695, 12.024831771850586, 12.043264389038086, 12.051456451416016, 12.035072326660156, 12.026816368103027, 12.012543678283691, 12.040191650390625, 12.023807525634766, 12.017663955688477, 12.089407920837402, 12.003392219543457, 12.02790355682373, 12.019712448120117, 12.012543678283691, 12.107744216918945, 12.013567924499512], "compile_time": 1135.0321429781616, "verification_time": 0, "benchmark_time": 386.7271359777078, "GFLOP/s": 125.38018650375267, "strategy_time": 0.008456059731543064, "framework_time": 1.4748499961569905, "timestamp": "2025-04-08 00:15:10.820102+00:00", "gridpoints/s": 8358679100.250178}, "4096,4096,2,16,6,3,6,10,1,0,3": {"grid_width": 4096, "grid_height": 4096, "block_size_x": 2, "block_size_y": 16, "tile_size_x": 6, "tile_size_y": 3, "temporal_tiling_factor": 6, "max_tfactor": 10, "loop_unroll_factor_t": 1, "sh_power": 0, "blocks_per_sm": 3, "time": 15.490674078464508, "times": [15.537152290344238, 15.504416465759277, 15.49728012084961, 15.491071701049805, 15.476608276367188, 15.485952377319336, 15.493120193481445, 15.47980785369873, 15.480768203735352, 15.466496467590332, 15.491071701049805, 15.4900484085083, 15.483903884887695, 15.492095947265625, 15.493120193481445, 15.489919662475586, 15.477760314941406, 15.498175621032715, 15.491071701049805, 15.485952377319336, 15.485952377319336, 15.491935729980469, 15.491071701049805, 15.484928131103516, 15.49619197845459, 15.493120193481445, 15.502335548400879, 15.483903884887695, 15.49824047088623, 15.48799991607666, 15.49824047088623, 15.481856346130371], "compile_time": 824.2229169700295, "verification_time": 0, "benchmark_time": 497.3745970055461, "GFLOP/s": 97.47474076025952, "strategy_time": 0.008234987035393715, "framework_time": 1.698178006336093, "timestamp": "2025-04-08 00:15:12.143437+00:00", "gridpoints/s": 6498316050.683969}, "4096,4096,1,32,5,2,5,10,5,0,4": {"grid_width": 4096, "grid_height": 4096, "block_size_x": 1, "block_size_y": 32, "tile_size_x": 5, "tile_size_y": 2, "temporal_tiling_factor": 5, "max_tfactor": 10, "loop_unroll_factor_t": 5, "sh_power": 0, "blocks_per_sm": 4, "time": 17.900524079799652, "times": [17.949535369873047, 17.907712936401367, 17.904447555541992, 17.901567459106445, 17.900543212890625, 17.89740753173828, 17.899520874023438, 17.899520874023438, 17.897472381591797, 17.898496627807617, 17.898496627807617, 17.89628791809082, 17.897472381591797, 17.896448135375977, 17.901567459106445, 17.900543212890625, 17.899520874023438, 17.897472381591797, 17.901567459106445, 17.896448135375977, 17.902591705322266, 17.896448135375977, 17.897472381591797, 17.897472381591797, 17.897472381591797, 17.895423889160156, 17.902528762817383, 17.896448135375977, 17.894399642944336, 17.895456314086914, 17.89846420288086, 17.900543212890625], "compile_time": 962.56952395197, "verification_time": 0, "benchmark_time": 574.4341529207304, "GFLOP/s": 70.293539696972, "strategy_time": 0.00844593159854412, "framework_time": 1.7398361815139651, "timestamp": "2025-04-08 00:15:13.682221+00:00", "gridpoints/s": 4686235979.798133}, "4096,4096,8,4,7,5,1,10,1,0,4": {"grid_width": 4096, "grid_height": 4096, "block_size_x": 8, "block_size_y": 4, "tile_size_x": 7, "tile_size_y": 5, "temporal_tiling_factor": 1, "max_tfactor": 10, "loop_unroll_factor_t": 1, "sh_power": 0, "blocks_per_sm": 4, "time": 1.4499840214848518, "times": [1.504256010055542, 1.45305597782135, 1.4510079622268677, 1.4479360580444336, 1.4489599466323853, 1.4479360580444336, 1.4469120502471924, 1.4469120502471924, 1.4479360580444336, 1.4479360580444336, 1.4479360580444336, 1.4489599466323853, 1.4489279985427856, 1.4488320350646973, 1.4489599466323853, 1.447775959968567, 1.4479360580444336, 1.4478399753570557, 1.4469120502471924, 1.4458880424499512, 1.4469120502471924, 1.4460480213165283, 1.4479360580444336, 1.4469120502471924, 1.456223964691162, 1.4479360580444336, 1.4469120502471924, 1.4479360580444336, 1.4489599466323853, 1.4470720291137695, 1.4458880424499512, 1.4479360580444336], "compile_time": 794.7162099881098, "verification_time": 0, "benchmark_time": 48.17609500605613, "GFLOP/s": 173.55931946221733, "strategy_time": 0.008255010470747948, "framework_time": 1.5586370136588812, "timestamp": "2025-04-08 00:15:14.526712+00:00", "gridpoints/s": 11570621297.481157}, "4096,4096,32,1,6,2,4,10,4,1,0": {"grid_width": 4096, "grid_height": 4096, "block_size_x": 32, "block_size_y": 1, "tile_size_x": 6, "tile_size_y": 2, "temporal_tiling_factor": 4, "max_tfactor": 10, "loop_unroll_factor_t": 4, "sh_power": 1, "blocks_per_sm": 0, "time": 17.874874889850616, "times": [16.7956485748291, 16.719871520996094, 19.473407745361328, 20.597759246826172, 20.607967376708984, 20.578304290771484, 20.43199920654297, 20.398080825805664, 20.39910316467285, 20.393983840942383, 20.387807846069336, 20.400127410888672, 16.916479110717773, 16.74131202697754, 16.736255645751953, 16.722944259643555, 16.738304138183594, 16.723968505859375, 16.710559844970703, 16.736255645751953, 16.722944259643555, 16.724992752075195, 16.733184814453125, 16.729087829589844, 16.741344451904297, 16.743423461914062, 16.729087829589844, 16.746496200561523, 16.731103897094727, 16.730112075805664, 16.718847274780273, 16.735231399536133], "compile_time": 868.822880089283, "verification_time": 0, "benchmark_time": 573.567891959101, "GFLOP/s": 56.31552479125702, "strategy_time": 0.008446048013865948, "framework_time": 1.4587289188057184, "timestamp": "2025-04-08 00:15:15.970600+00:00", "gridpoints/s": 3754368319.417135}, "4096,4096,4,8,10,7,1,10,1,1,3": {"grid_width": 4096, "grid_height": 4096, "block_size_x": 4, "block_size_y": 8, "tile_size_x": 10, "tile_size_y": 7, "temporal_tiling_factor": 1, "max_tfactor": 10, "loop_unroll_factor_t": 1, "sh_power": 1, "blocks_per_sm": 3, "time": 2.2135089933872223, "times": [2.264064073562622, 2.214911937713623, 2.2231040000915527, 2.214911937713623, 2.209791898727417, 2.2128639221191406, 2.213887929916382, 2.214911937713623, 2.214911937713623, 2.203648090362549, 2.2056961059570312, 2.2056961059570312, 2.2036800384521484, 2.209791898727417, 2.2118399143218994, 2.196608066558838, 2.214911937713623, 2.214911937713623, 2.2128639221191406, 2.214911937713623, 2.2026240825653076, 2.2046079635620117, 2.2067201137542725, 2.209791898727417, 2.216032028198242, 2.2210559844970703, 2.2211520671844482, 2.2106881141662598, 2.219007968902588, 2.2231040000915527, 2.213887929916382, 2.2056961059570312], "compile_time": 828.211540938355, "verification_time": 0, "benchmark_time": 72.44628295302391, "GFLOP/s": 113.69198894236249, "strategy_time": 0.008365954272449017, "framework_time": 1.3592240866273642, "timestamp": "2025-04-08 00:15:16.872656+00:00", "gridpoints/s": 7579465929.490832}, "4096,4096,16,16,5,1,5,10,5,1,1": {"grid_width": 4096, "grid_height": 4096, "block_size_x": 16, "block_size_y": 16, "tile_size_x": 5, "tile_size_y": 1, "temporal_tiling_factor": 5, "max_tfactor": 10, "loop_unroll_factor_t": 5, "sh_power": 1, "blocks_per_sm": 1, "time": 11.336608946323395, "times": [10.249216079711914, 10.198016166687012, 10.195967674255371, 10.195967674255371, 10.194944381713867, 12.533760070800781, 12.533760070800781, 12.535807609558105, 12.53171157836914, 12.536831855773926, 12.533760070800781, 12.472319602966309, 12.429311752319336, 12.427200317382812, 12.428288459777832, 12.428288459777832, 12.429311752319336, 12.427264213562012, 12.429311752319336, 12.434432029724121, 12.437503814697266, 10.260479927062988, 10.192895889282227, 10.192895889282227, 10.190848350524902, 10.193023681640625, 10.193887710571289, 10.191871643066406, 10.194944381713867, 10.192895889282227, 10.192895889282227, 10.191871643066406], "compile_time": 909.2478191014379, "verification_time": 0, "benchmark_time": 363.78511309158057, "GFLOP/s": 110.99361422430292, "strategy_time": 0.008785980753600597, "framework_time": 1.4894778141751885, "timestamp": "2025-04-08 00:15:18.147220+00:00", "gridpoints/s": 7399574281.620194}, "4096,4096,8,4,10,1,3,10,3,0,3": {"grid_width": 4096, "grid_height": 4096, "block_size_x": 8, "block_size_y": 4, "tile_size_x": 10, "tile_size_y": 1, "temporal_tiling_factor": 3, "max_tfactor": 10, "loop_unroll_factor_t": 3, "sh_power": 0, "blocks_per_sm": 3, "time": 7.578959077596664, "times": [7.630847930908203, 7.582719802856445, 7.579552173614502, 7.576576232910156, 7.577600002288818, 7.576576232910156, 7.577600002288818, 7.576511859893799, 7.577600002288818, 7.577568054199219, 7.576576232910156, 7.577568054199219, 7.577600002288818, 7.577536106109619, 7.575551986694336, 7.577600002288818, 7.575551986694336, 7.577600002288818, 7.577600002288818, 7.579584121704102, 7.576576232910156, 7.577600002288818, 7.576576232910156, 7.576576232910156, 7.576416015625, 7.574528217315674, 7.577600002288818, 7.577600002288818, 7.576576232910156, 7.576576232910156, 7.576576232910156, 7.577568054199219], "compile_time": 878.774754004553, "verification_time": 0, "benchmark_time": 243.77445899881423, "GFLOP/s": 99.61456609941312, "strategy_time": 0.008105998858809471, "framework_time": 1.4635679544880986, "timestamp": "2025-04-08 00:15:19.271271+00:00", "gridpoints/s": 6640971073.294209}, "4096,4096,2,16,10,1,8,10,2,1,4": {"grid_width": 4096, "grid_height": 4096, "block_size_x": 2, "block_size_y": 16, "tile_size_x": 10, "tile_size_y": 1, "temporal_tiling_factor": 8, "max_tfactor": 10, "loop_unroll_factor_t": 2, "sh_power": 1, "blocks_per_sm": 4, "time": 28.28365910053253, "times": [28.331008911132812, 28.284927368164062, 28.282880783081055, 28.283872604370117, 28.284927368164062, 28.281856536865234, 28.277759552001953, 28.282880783081055, 28.280832290649414, 28.278751373291016, 28.280832290649414, 28.283903121948242, 28.284927368164062, 28.280832290649414, 28.283903121948242, 28.284927368164062, 28.280832290649414, 28.282880783081055, 28.28374481201172, 28.280799865722656, 28.279903411865234, 28.282880783081055, 28.282880783081055, 28.279808044433594, 28.285888671875, 28.279808044433594, 28.281728744506836, 28.27961540222168, 28.282880783081055, 28.279808044433594, 28.281856536865234, 28.282751083374023], "compile_time": 784.4982579117641, "verification_time": 0, "benchmark_time": 906.8336619529873, "GFLOP/s": 71.18123976971896, "strategy_time": 0.008606002666056156, "framework_time": 1.3510591816157103, "timestamp": "2025-04-08 00:15:20.963994+00:00", "gridpoints/s": 4745415984.647931}, "4096,4096,224,4,1,1,8,10,2,0,2": {"grid_width": 4096, "grid_height": 4096, "block_size_x": 224, "block_size_y": 4, "tile_size_x": 1, "tile_size_y": 1, "temporal_tiling_factor": 8, 